"Z201851907","https://portal.eks.sk/SpravaZakaziek/Zakazky/Detail/214832","zazmluvnená","§ 110 ZVO","§ 7 ods. 1 písm. a)","Finančné riaditeľstvo Slovenskej republiky","42499500","Slovenská republika","Banská Bystrica","97401","Lazovná 63","28.11.2018 10:02:47","3.12.2018 11:24:00","Zabezpečenie upratovacích a čistiacich služieb v administratívnej budove","Upratovacie služby, čistiace služby","90910000-9 Upratovacie služby","Služba; Tovar","","Zabezpečenie upratovacích a čistiacich služieb a dodávka hygienického spotrebného materiálu v administratívnej budove (suterén, prízemie a 1 poschodie s 2 vstupnými priestormi); Termín realizácie služieb 01.01.2019 - 31.12.2019 (12 mesiacov)","Technické vlastnosti: Určený počet zamestnancov poskytovateľa (v čase od 06:00 - 12:00), Hodnota / charakteristika: 6 zamestnancov poskytovateľa; Technické vlastnosti: Určený počet zamestnancov poskytovateľa (v čase od 14:00 - 20:00), Hodnota / charakteristika: 1 zamestnanec poskytovateľa; Technické vlastnosti: ADMINISTRATÍVNE PRIESTORY - kancelárie, zasadacie a rokovacie priestory, Hodnota / charakteristika: ; Technické vlastnosti: Denné práce:, Hodnota / charakteristika: ; Technické vlastnosti: - vyprázdnenie, mechanické čistenie smetných košov a nádob (podľa potreby výmena sáčkov), Hodnota / charakteristika: ; Technické vlastnosti: - transport odpadov na určené miesto, Hodnota / charakteristika: ; Technické vlastnosti: - vyprázdnenie skartovačiek  (v prípade potreby), Hodnota / charakteristika: ; Technické vlastnosti: - čistenie a umývanie stolov v zasadacích a rokovacích priestoroch (v prípade potreby), Hodnota / charakteristika: ; Technické vlastnosti: Práce 1x týždenne:, Hodnota / charakteristika: ; Technické vlastnosti: - utieranie vnútorných parapetných dosiek vlhkou handrou, Hodnota / charakteristika: ; Technické vlastnosti: - poutieranie prachu z voľných plôch písacích stolov a ostatných vodorovných plôch (podľa potreby na vlhko), Hodnota / charakteristika: ; Technické vlastnosti: - čistenie a umývanie pevných podláh ( v prípade potreby častejšie), Hodnota / charakteristika: ; Technické vlastnosti: - vysávanie kobercov, čalúnených stoličiek a kresiel a pod. (v prípade potreby častejšie), Hodnota / charakteristika: ; Technické vlastnosti: - čistenie dverí a nábytku na miestach častého dotyku, vrátane dezinfekcie (napr. kľučiek, vypínačov, madiel) chlórovými prípravkami, Hodnota / charakteristika: ; Technické vlastnosti: Práce 1x mesačne:, Hodnota / charakteristika: ; Technické vlastnosti: - ometanie pavučín, Hodnota / charakteristika: ; Technické vlastnosti: - vlhké utretie všetkých dostupných vodorovných plôch na skriniach, Hodnota / charakteristika: ; Technické vlastnosti: - vlhké utretie prachu na rámoch obrazov a hasiacich prístrojoch, Hodnota / charakteristika: ; Technické vlastnosti: - utretie prachu s pomocou rebríka na inventári, Hodnota / charakteristika: ; Technické vlastnosti: - vysávanie čalúnených stoličiek, kresiel a pod. v rokovacích a zasadacích priestoroch, Hodnota / charakteristika: ; Technické vlastnosti: - umývanie dverí a zárubní vhodným prípravkom, Hodnota / charakteristika: ; Technické vlastnosti: Práce 2 x ročne:, Hodnota / charakteristika: ; Technické vlastnosti: - očistenie radiátorov, Hodnota / charakteristika: ; Technické vlastnosti: - utieranie prachu zo svietidiel, Hodnota / charakteristika: ; Technické vlastnosti: - umytie a ošetrenie nábytku vhodným prípravkom, Hodnota / charakteristika: ; Technické vlastnosti: - umytie okien, Hodnota / charakteristika: ; Technické vlastnosti: SOCIÁLNE ZARIADENIA– kúpeľne, WC, sprchy, kuchynky, priestory vyžadujúce si osobitnú hygienu, Hodnota / charakteristika: ; Technické vlastnosti: Denné práce:, Hodnota / charakteristika: ; Technické vlastnosti: - vyprázdnenie, mechanické čistenie smetných košov a nádob, resp. dodanie a výmena sáčkov, Hodnota / charakteristika: ; Technické vlastnosti: - transport odpadov na určené miesto, Hodnota / charakteristika: ; Technické vlastnosti: - čistenie kuchynských liniek, drezov, kuchynských batérií a obkladov v dosahu vody, Hodnota / charakteristika: ; Technické vlastnosti: - čistenie a dezinfekcia umývadiel, vodovodných batérií, Hodnota / charakteristika: ; Technické vlastnosti: - čistenie a dezinfekcia WC, pisoárov, vaní, spŕch a výlevok, Hodnota / charakteristika: ; Technické vlastnosti: - odstránenie škvŕn a vlhké utretie dverí a keramických obkladov s použitím dezinfekčných prostriedkov v bezprostrednej blízkosti vody, Hodnota / charakteristika: ; Technické vlastnosti: - leštenie zrkadiel, odstránenie škvŕn z odkladacích poličiek, nerezových doplnkov v sociálnych priestoroch (smetné koše, zásobníky toaletného papiera, sušičov rúk), Hodnota / charakteristika: ; Technické vlastnosti: - dodanie toaletného papiera  420 g.,  bielený recyklovaný, 2 vrstvy, d. 19cm v dostatočnom množstve a jeho plnenie do zásobníkov toaletného papiera, Hodnota / charakteristika: ; Technické vlastnosti: - dodanie gélových vôní, osviežovačov vzduchu  do WC v dostatočnom množstve a ich plnenie, Hodnota / charakteristika: ; Technické vlastnosti: - dodanie hygienických utierok papierových, 1 vrstvé, ZZ, recyklované, biele, 250ks/bal. v dostatočnom množstve a ich plnenie do zásobníkov v kuchynkách a na WC, Hodnota / charakteristika: ; Technické vlastnosti: - dodanie tekutého mydla v dostatočnom množstve a jeho plnenie do zásobníkov tekutého mydla v sociálnych zariadeniach, Hodnota / charakteristika: ; Technické vlastnosti: Práce 1x týždenne:, Hodnota / charakteristika: ; Technické vlastnosti: - utretie prachu na dostupných miestach, Hodnota / charakteristika: ; Technické vlastnosti: - čistenie škvŕn z dverí kľučiek, vypínačov, nábytku a z miest častého dotyku, vrátane dezinfekcie kľučiek, vypínačov, madiel chlórovými prípravkami, Hodnota / charakteristika: ; Technické vlastnosti: -dodanie a dopĺňanie čistiaceho prostriedku na riad v kuchynkách, Hodnota / charakteristika: ; Technické vlastnosti: - dodanie a vymieňanie textilných utierok v kuchynkách, Hodnota / charakteristika: ; Technické vlastnosti: Práce 1x mesačne:, Hodnota / charakteristika: ; Technické vlastnosti: - dôkladné čistenie spodkov umývadiel, sifónov odpadových rúr WC z vonkajšej strany s použitím vhodných čistiacich prostriedkov a dezinfekcie, Hodnota / charakteristika: ; Technické vlastnosti: - dôkladná dezinfekcia kuchynských liniek, drezov a kuchynských batérií, Hodnota / charakteristika: ; Technické vlastnosti: - umytie a dezinfekcia dverí, madiel, zárubní, parapetov, vypínačov, zásuviek, Hodnota / charakteristika: ; Technické vlastnosti: Práce 2x ročne:, Hodnota / charakteristika: ; Technické vlastnosti: - očistenie radiátorov, Hodnota / charakteristika: ; Technické vlastnosti: - utieranie prachu zo svietidiel, Hodnota / charakteristika: ; Technické vlastnosti: - umytie a ošetrenie nábytku vhodných prípravkom, Hodnota / charakteristika: ; Technické vlastnosti: - umytie okien, Hodnota / charakteristika: ; Technické vlastnosti: VSTUPNÉ PRIESTORY, VRÁTNICA, SCHODY, CHODBY, KLIENTSKÁ ZÓNA, PODATEĽŇA, Hodnota / charakteristika: ; Technické vlastnosti: Denné práce:, Hodnota / charakteristika: ; Technické vlastnosti: - vyprázdnenie, mechanické čistenie smetných košov a nádob, resp. dodanie a výmena sáčkov, Hodnota / charakteristika: ; Technické vlastnosti: - transport odpadov na určené miesto, Hodnota / charakteristika: ; Technické vlastnosti: - zabezpečenie čistoty okolo kontajnerov, Hodnota / charakteristika: ; Technické vlastnosti: - zabezpečenie čistoty exteriérových schodísk a priľahlej plochy pred vstupnými priestormi, čistenie vonkajšej čistiacej zóny, Hodnota / charakteristika: ; Technické vlastnosti: - vysávanie kobercov v klientskej zóne a na chodbách, Hodnota / charakteristika: ; Technické vlastnosti: - vyprázdnenie a očistenie stojanových popolníkov, Hodnota / charakteristika: ; Technické vlastnosti: - čistenie a umytie dlažby vo vstupnom priestore, na chodbách a schodiskách, Hodnota / charakteristika: ; Technické vlastnosti: - odstránenie škvŕn z presklených dverí vo vstupnom priestore na chodbách a schodiskách, Hodnota / charakteristika: ; Technické vlastnosti: Práce 1 x týždenne:, Hodnota / charakteristika: ; Technické vlastnosti: - dôkladné umytie a leštenie sklených dverí a sklených tabúľ vo vstupnom priestore a na schodiskách, Hodnota / charakteristika: ; Technické vlastnosti: - čistenie škvŕn z dverí kľučiek, vypínačov, madiel na schodoch, Hodnota / charakteristika: ; Technické vlastnosti: - vysávanie čalúnených kresiel v klientskej zóne, Hodnota / charakteristika: ; Technické vlastnosti: Práce 1 x mesačne:, Hodnota / charakteristika: ; Technické vlastnosti: - ometanie pavučín, Hodnota / charakteristika: ; Technické vlastnosti: - vlhké utretie prachu na rámoch obrazov a hasiacich prístrojoch, Hodnota / charakteristika: ; Technické vlastnosti: - utretie prachu s pomocou rebríka na inventári, Hodnota / charakteristika: ; Technické vlastnosti: - umývanie dverí a zárubní vhodným prípravkom, Hodnota / charakteristika: ; Technické vlastnosti: Práce 2 x ročne:, Hodnota / charakteristika: ; Technické vlastnosti: - očistenie radiátorov, Hodnota / charakteristika: ; Technické vlastnosti: - utieranie prachu zo svietidiel, Hodnota / charakteristika: ; Technické vlastnosti: - umytie a ošetrenie nábytku vhodným prípravkom, Hodnota / charakteristika: ; Technické vlastnosti: - umytie okien, Hodnota / charakteristika: ; Technické vlastnosti: SUTERÉN, REGISTRATÚRNE STREDISKO, SKLADY, SCHODY, CHODBY, Hodnota / charakteristika: ; Technické vlastnosti: Práce 1 x mesačne:, Hodnota / charakteristika: ; Technické vlastnosti: - čistenie a umytie dlažby, umývanie dverí a zárubní vhodným prípravkom, Hodnota / charakteristika: ; Technické vlastnosti: - ometanie pavučín, Hodnota / charakteristika: ; Technické vlastnosti: - vlhké utretie prachu na rámoch obrazov a hasiacich prístrojoch, Hodnota / charakteristika: ; Technické vlastnosti: - utretie prachu s pomocou rebríka na inventári, Hodnota / charakteristika: ; Technické vlastnosti: - umývanie dverí a zárubní vhodným prípravkom, Hodnota / charakteristika: ; Technické vlastnosti: Práce 2 x ročne:, Hodnota / charakteristika: ; Technické vlastnosti: - očistenie radiátorov, Hodnota / charakteristika: ; Technické vlastnosti: - utieranie prachu zo svietidiel, Hodnota / charakteristika: ; Technické vlastnosti: - umytie a ošetrenie nábytku vhodným prípravkom, Hodnota / charakteristika: ","Technické vlastnosti: Upratovaná plocha celkom, Jednotka: m2, Minimum: , Maximum: , Presná hodnota: 7894,17; Technické vlastnosti: vstupné priestory, Jednotka: m2, Minimum: , Maximum: , Presná hodnota: 124,63; Technické vlastnosti: administratívne priestory (kancelárie, zasadačky, rokovacie miestnosti), Jednotka: m2, Minimum: , Maximum: , Presná hodnota: 4184,48; Technické vlastnosti: chodby, Jednotka: m2, Minimum: , Maximum: , Presná hodnota: 1413,52; Technické vlastnosti: schodiská, Jednotka: m2, Minimum: , Maximum: , Presná hodnota: 327,06; Technické vlastnosti: kuchynky, Jednotka: m2, Minimum: , Maximum: , Presná hodnota: 70,87; Technické vlastnosti: sociálne zariadenia ( WC, kúpeľne, sprchy), Jednotka: m2, Minimum: , Maximum: , Presná hodnota: 265,07; Technické vlastnosti: archívne priestory, chodby, sklady v suteréne (postačuje upratať 1x do mesiaca), Jednotka: m2, Minimum: , Maximum: , Presná hodnota: 1508,54","Slovenská republika","Košický","Košice","Košice","Železničná 1","1.1.2019 6:00:00","31.12.2019 20:00:00","","objekt","1,0000","68205,620","Zmluva o poskytovaní služieb","False","Cena s DPH","3.12.2018 10:15:00","297","67920,000","8","35","3.12.2018 10:30:00","20","2","https://portal.eks.sk/Zakazky/StiahniZmluvnuPrilohuZakazky?correlationId=fef8ce24-fe4e-48d8-bfe8-cad3585cf011","https://portal.eks.sk/Zakazky/StiahniZmluvnuPrilohuZakazky?correlationId=f86e5045-bf2c-47e5-88bb-8585a00101cd","https://portal.eks.sk/Zakazky/StiahniZmluvnuPrilohuZakazky?correlationId=8b3c8845-4376-41e6-b820-8ab52072c48c","https://portal.eks.sk/Zakazky/StiahniZmluvnuPrilohuZakazky?correlationId=e7af5829-e159-4fdf-864d-b625d8cededc","https://portal.eks.sk/Zakazky/StiahniZmluvnuPrilohuZakazky?correlationId=b66285a5-8622-4f27-b0ad-e64668e05939","https://portal.eks.sk/Zakazky/StiahniZmluvnuPrilohuZakazky?correlationId=bf0aa10a-47ef-4996-b305-ffeb75d13692","https://portal.eks.sk/Zakazky/StiahniZmluvnuPrilohuZakazky?correlationId=4cf6fd99-ca66-4eec-9c63-834cbf61fee1","https://portal.eks.sk/Zakazky/StiahniZmluvnuPrilohuZakazky?correlationId=189a1692-264d-4bf6-a445-4c843b3865ca",
"Z201851907","https://portal.eks.sk/SpravaZakaziek/Zakazky/Detail/214832","zazmluvnená","§ 110 ZVO","§ 7 ods. 1 písm. a)","Finančné riaditeľstvo Slovenskej republiky","42499500","Slovenská republika","Banská Bystrica","97401","Lazovná 63","28.11.2018 10:02:47","3.12.2018 11:24:00","Zabezpečenie upratovacích a čistiacich služieb v administratívnej budove","","","","","Zabezpečenie dodávky hygienického spotrebného materiálu do administratívnej budovy.","","Technické vlastnosti: Toaletný papier 420 g bielený recyklát dvojvrstvový, priemer 19 cm (minimálny ročný počet), Jednotka: ks, Minimum: 4500, Maximum: , Presná hodnota: ; Technické vlastnosti: Hygienické ZZ  utierky jednovrstvové  skladané biele  25 x 23 cm 250 ks v balení (minimálny ročný počet), Jednotka: balenie, Minimum: 5500, Maximum: , Presná hodnota: ; Technické vlastnosti: Tekuté mydlo s glycerínom antibakteriálne na bežnú hygienickú starostlivosť, ničí baktérie 5l  (minimálny ročný počet), Jednotka: ks, Minimum: 130, Maximum: , Presná hodnota: ; Technické vlastnosti: Koncentrovaný prostriedok na umývanie riadu odstraňujúci mastnotu balenie 1l (minimálny ročný počet), Jednotka: ks, Minimum: 330, Maximum: , Presná hodnota: ; Technické vlastnosti: WC gél so závesnou nádržkou (obsah menej ako 5% neiontové povrchovo aktívne látky, 5% iontové povrchovo aktívne látky, parfum, kyselina citrónová) 500 ml (minimálny ročný počet), Jednotka: ks, Minimum: 330, Maximum: , Presná hodnota: ; Technické vlastnosti: Gélový osviežovač vzduchu na odstránenie zápachu do WC a kúpeľní 150 ml (minimálny ročný počet), Jednotka: ks, Minimum: 200, Maximum: , Presná hodnota: ; Technické vlastnosti: Tablety do pisoárov 3 v 1, dezodorujúce, sanizujúce, zabraňujúce upchatiu odpadov, obsah menej ako 5% toluénsulfonan sodný, 15-20% benzénsulfónová kyselina, alkylderiváty a sodné soli menej ako 5% cocamid, parfém – 1000g - (minimálny ročný počet), Jednotka: ks, Minimum: 33, Maximum: , Presná hodnota: ","Slovenská republika","Košický","Košice","Košice","Železničná 1","1.1.2019 6:00:00","31.12.2019 20:00:00","","objekt","1,0000","68205,620","Zmluva o poskytovaní služieb","False","Cena s DPH","3.12.2018 10:15:00","297","67920,000","8","35","3.12.2018 10:30:00","20","2","https://portal.eks.sk/Zakazky/StiahniZmluvnuPrilohuZakazky?correlationId=fef8ce24-fe4e-48d8-bfe8-cad3585cf011","https://portal.eks.sk/Zakazky/StiahniZmluvnuPrilohuZakazky?correlationId=f86e5045-bf2c-47e5-88bb-8585a00101cd","https://portal.eks.sk/Zakazky/StiahniZmluvnuPrilohuZakazky?correlationId=8b3c8845-4376-41e6-b820-8ab52072c48c","https://portal.eks.sk/Zakazky/StiahniZmluvnuPrilohuZakazky?correlationId=e7af5829-e159-4fdf-864d-b625d8cededc","https://portal.eks.sk/Zakazky/StiahniZmluvnuPrilohuZakazky?correlationId=b66285a5-8622-4f27-b0ad-e64668e05939","https://portal.eks.sk/Zakazky/StiahniZmluvnuPrilohuZakazky?correlationId=bf0aa10a-47ef-4996-b305-ffeb75d13692","https://portal.eks.sk/Zakazky/StiahniZmluvnuPrilohuZakazky?correlationId=4cf6fd99-ca66-4eec-9c63-834cbf61fee1","https://portal.eks.sk/Zakazky/StiahniZmluvnuPrilohuZakazky?correlationId=189a1692-264d-4bf6-a445-4c843b3865ca",
"Z201852817","https://portal.eks.sk/SpravaZakaziek/Zakazky/Detail/215742","zazmluvnená","§ 117 ZVO","§ 7 ods. 1 písm. a)","Kancelária Národnej rady Slovenskej republiky","00151491","Slovenská republika","Bratislava - Staré Mesto","81280","Nám. Alexandra Dubčeka 1","28.11.2018 10:03:30","3.12.2018 11:08:03","Filtre do vzduchotechniky","Filtre do vzduchotechniky","42514310-8 Vzduchové filtre; 60000000-8 Dopravné služby (bez prepravy odpadu)","Tovar; Služba","","","Technické vlastnosti: Filtračná trieda, Hodnota / charakteristika: EU5/F5; Technické vlastnosti: Rozmer, Hodnota / charakteristika: š 785 mm v 490 mm h 600 mm; Technické vlastnosti: Počet vreciek, Hodnota / charakteristika: 6","Technické vlastnosti: Vreckový /kapsový/ filter BFK 80 – 50 F 5, Jednotka: ks, Minimum: , Maximum: , Presná hodnota: 5","Slovenská republika","Bratislavský","Bratislava I","Bratislava - mestská časť Staré Mesto","Námestie Alexandra Dubčeka 1","","","14.12.2018 10:00:00","kus podľa technickej špecifikácie","10,0000","480,000","Kúpna zmluva","False","Cena s DPH","3.12.2018 10:30:00","299","479,980","1","1","3.12.2018 10:45:00","20","2","https://portal.eks.sk/Zakazky/StiahniZmluvnuPrilohuZakazky?correlationId=2bc3166f-2344-4104-a9cd-8a9830242304","https://portal.eks.sk/Zakazky/StiahniZmluvnuPrilohuZakazky?correlationId=9c4ecd95-cfe5-402f-a6c9-7373cf5ce617","https://portal.eks.sk/Zakazky/StiahniZmluvnuPrilohuZakazky?correlationId=50c4d3cd-56da-4091-8e82-ac40895772b0","https://portal.eks.sk/Zakazky/StiahniZmluvnuPrilohuZakazky?correlationId=1cc7b5d1-9eb6-4913-bca5-06ccd30ae241","https://portal.eks.sk/Zakazky/StiahniZmluvnuPrilohuZakazky?correlationId=177d1751-748e-4c2c-bfbf-6fa720b84786","https://portal.eks.sk/Zakazky/StiahniZmluvnuPrilohuZakazky?correlationId=8c8c8085-c1df-4a54-8316-2c9cdfc3aafa","https://portal.eks.sk/Zakazky/StiahniZmluvnuPrilohuZakazky?correlationId=24b7d8e6-eacf-4ddf-b121-e5b6dd11895c","https://portal.eks.sk/Zakazky/StiahniZmluvnuPrilohuZakazky?correlationId=50e13e48-0df0-4e15-abd8-eb4082afffa9",
"Z201852817","https://portal.eks.sk/SpravaZakaziek/Zakazky/Detail/215742","zazmluvnená","§ 117 ZVO","§ 7 ods. 1 písm. a)","Kancelária Národnej rady Slovenskej republiky","00151491","Slovenská republika","Bratislava - Staré Mesto","81280","Nám. Alexandra Dubčeka 1","28.11.2018 10:03:30","3.12.2018 11:08:03","Filtre do vzduchotechniky","","","","","","Technické vlastnosti: Trieda filtrácie, Hodnota / charakteristika: EU3/G; Technické vlastnosti: Rozmery, Hodnota / charakteristika: 443 x 456 mm s rámčekom","Technické vlastnosti: Plochý filter PFR 355-400 G3, Jednotka: ks, Minimum: , Maximum: , Presná hodnota: 5","Slovenská republika","Bratislavský","Bratislava I","Bratislava - mestská časť Staré Mesto","Námestie Alexandra Dubčeka 1","","","14.12.2018 10:00:00","kus podľa technickej špecifikácie","10,0000","480,000","Kúpna zmluva","False","Cena s DPH","3.12.2018 10:30:00","299","479,980","1","1","3.12.2018 10:45:00","20","2","https://portal.eks.sk/Zakazky/StiahniZmluvnuPrilohuZakazky?correlationId=2bc3166f-2344-4104-a9cd-8a9830242304","https://portal.eks.sk/Zakazky/StiahniZmluvnuPrilohuZakazky?correlationId=9c4ecd95-cfe5-402f-a6c9-7373cf5ce617","https://portal.eks.sk/Zakazky/StiahniZmluvnuPrilohuZakazky?correlationId=50c4d3cd-56da-4091-8e82-ac40895772b0","https://portal.eks.sk/Zakazky/StiahniZmluvnuPrilohuZakazky?correlationId=1cc7b5d1-9eb6-4913-bca5-06ccd30ae241","https://portal.eks.sk/Zakazky/StiahniZmluvnuPrilohuZakazky?correlationId=177d1751-748e-4c2c-bfbf-6fa720b84786","https://portal.eks.sk/Zakazky/StiahniZmluvnuPrilohuZakazky?correlationId=8c8c8085-c1df-4a54-8316-2c9cdfc3aafa","https://portal.eks.sk/Zakazky/StiahniZmluvnuPrilohuZakazky?correlationId=24b7d8e6-eacf-4ddf-b121-e5b6dd11895c","https://portal.eks.sk/Zakazky/StiahniZmluvnuPrilohuZakazky?correlationId=50e13e48-0df0-4e15-abd8-eb4082afffa9",
"Z201852407","https://portal.eks.sk/SpravaZakaziek/Zakazky/Detail/215332","zazmluvnená","§ 117 ZVO","§ 7 ods. 1 písm. b) ","Mesto Hlohovec","00312509","Slovenská republika","Hlohovec","92001","M.R.Štefánika 1","28.11.2018 10:05:50","3.12.2018 14:48:00","Stolový počítač, vrátane dopravy na miesto dodania","počítač, IT, hardware, hardvér, PC, informatika,","30200000-1 Počítačové zariadenia a spotrebný materiál; 30210000-4 Stroje na spracovanie údajov (hardvér); 30213000-5 Osobné počítače; 30213300-8 Stolový počítač; 60000000-8 Dopravné služby (bez prepravy odpadu)","Tovar; Služba","","Stolový počítač","Technické vlastnosti: Stav počítača, Hodnota / charakteristika: Nový; Technické vlastnosti: Rozšírená záruka typu HP Care Pack alebo ekvivalent, Hodnota / charakteristika: 3 roky u zákazníka; Technické vlastnosti: Nainštalovaný operačný systém, Hodnota / charakteristika: Windows 10 Pro 64-bit OEM alebo ekvivalent s možnosťou zaradenia do domény v SK lokalizácii, s hologramom výrobcu OS nalepený na kryte PC; Technické vlastnosti: Sieťové rozhranie, Hodnota / charakteristika: Integrovaná sieťová karta, Bezdrôtová WiFi karta 802.11a/b/g/n/ac (1x1) s Bluetooth 4.2; Technické vlastnosti: Vyhotovenie, Hodnota / charakteristika: Mini PC; Technické vlastnosti: Iné komponenty dodané so stolovým počítačom, Hodnota / charakteristika: Klávesnica (SK lokalizácia)+ myš, N246v, 128GB SSD Rýchlosť čítania:až 520 MB / s, Rýchlosť zápisu:až 500 MB / s M.2 slot - neosadený v počítači; Technické vlastnosti: Farba, Hodnota / charakteristika: Čierna; Technické vlastnosti: Zvuk, Hodnota / charakteristika: Integrovaná zvuková karta, interný reproduktor; Technické vlastnosti: Porty a konektory, Hodnota / charakteristika: 4x USB 3.0, 2x USB 2.0, 1x port pre slúchadlá, 1x port pre mikrofón, 1x RJ-45 (LAN), 1x HDMI, 1x VGA, 1x m.2, 1x 2,5"" SATA; Technické vlastnosti: Požiadavky na napájanie, Hodnota / charakteristika: Externý 65 W napájací zdroj s účinnosťou 89%; Technické vlastnosti: Pamäťové sloty, Hodnota / charakteristika: 2x SODIMM DDR4; Technické vlastnosti: Rozmery výrobku (š x h x v), Hodnota / charakteristika: 17,7 x 17,5 x 3,4 cm","Technické vlastnosti: Operačná pamäť, Jednotka: GB, Minimum: , Maximum: , Presná hodnota: 4; Technické vlastnosti: Frekvenzia procesoru, Jednotka: GHz, Minimum: 2,7, Maximum: , Presná hodnota: ; Technické vlastnosti: Počet jadier, Jednotka: ks, Minimum: , Maximum: , Presná hodnota: 2; Technické vlastnosti: Pätica procesoru, Jednotka: typ, Minimum: , Maximum: , Presná hodnota: FCBGA 1356; Technické vlastnosti: Veľkosť pevného disku, Jednotka: GB, Minimum: , Maximum: , Presná hodnota: 500","Slovenská republika","Trnavský","Hlohovec","Hlohovec","M. R. Štefánika 1","","","12.12.2018 13:29:00","kus","6,0000","3600,000","Kúpna zmluva","False","Cena s DPH","3.12.2018 13:29:00","455","3600,000","5","67","3.12.2018 13:44:00","20","2","https://portal.eks.sk/Zakazky/StiahniZmluvnuPrilohuZakazky?correlationId=45b31272-2a7f-4176-b127-8b0b453dc522","https://portal.eks.sk/Zakazky/StiahniZmluvnuPrilohuZakazky?correlationId=f4703880-2db8-4692-b825-5941d5f661d6","https://portal.eks.sk/Zakazky/StiahniZmluvnuPrilohuZakazky?correlationId=6a9356e6-9ca0-4e2c-8166-857cda1a32b7","https://portal.eks.sk/Zakazky/StiahniZmluvnuPrilohuZakazky?correlationId=b176fe0b-a595-4ca7-91c2-928c49a516ad","https://portal.eks.sk/Zakazky/StiahniZmluvnuPrilohuZakazky?correlationId=12470fda-8ad5-458e-93d5-768f4875a0e5","https://portal.eks.sk/Zakazky/StiahniZmluvnuPrilohuZakazky?correlationId=49d5d264-61e0-4601-a06d-276a38eef273","https://portal.eks.sk/Zakazky/StiahniZmluvnuPrilohuZakazky?correlationId=a0d47d43-9957-4ba2-b845-9ee7d6690cb2","https://portal.eks.sk/Zakazky/StiahniZmluvnuPrilohuZakazky?correlationId=41f2784a-198b-4f58-ad11-cfcb06f42b19",
