"Z20206365","https://portal.eks.sk/SpravaZakaziek/Zakazky/Detail/265774","zazmluvnená","§ 117 a § 110 ZVO","§ 7 ods. 1 písm. d)","""FÉNIX""Zariadenie sociálnych služieb Levice","00596825","Slovenská republika","Levice","93401","Komenského č. 29","26.3.2020 12:54:05","1.4.2020 11:28:00","Mrazená zelenina","potraviny","15331170-9 Mrazená zelenina; 15894200-3 Pripravené jedlá; 60000000-8 Dopravné služby (bez prepravy odpadu)","Tovar; Služba","","zabezpečenie potravín v kvalite podľa platných noriem podľa potrieb objednávateľa vrátane dopravy a vyloženia na mieste dodania","Technické vlastnosti:  dodaný tovar nesmie prekročiť prvú tretinu doby spotreby, Hodnota / charakteristika: ; Technické vlastnosti: Množstvá sú určené od súčasného počtu stravníkov a nie sú pre obstarávateľa záväzné, nakoľko sa ich počet počas zmluvného vzťahu môže zvýšiť, resp. znížiť. Na základe toho môže obstarávateľ množstvá upraviť podľa aktuálnych stavov., Hodnota / charakteristika: Zvýšenie alebo zníženie objemu zákazky je prípustné.; Technické vlastnosti: Akosť, Hodnota / charakteristika: 1.trieda","Technické vlastnosti: Mrazená zeleninová zmes čínska, Jednotka: kg, Minimum: , Maximum: , Presná hodnota: 60; Technické vlastnosti: Mrazená zeleninová zmes mochovská, Jednotka: kg, Minimum: , Maximum: , Presná hodnota: 200; Technické vlastnosti: Kukurica mrazená, Jednotka: kg, Minimum: , Maximum: , Presná hodnota: 30; Technické vlastnosti: Krokety mrazené, Jednotka: kg, Minimum: , Maximum: , Presná hodnota: 200; Technické vlastnosti: Brokolica mrazená, Jednotka: kg, Minimum: , Maximum: , Presná hodnota: 180; Technické vlastnosti: Špenát mrazený, Jednotka: kg, Minimum: , Maximum: , Presná hodnota: 150; Technické vlastnosti: Tekvica mrazená, Jednotka: kg, Minimum: , Maximum: , Presná hodnota: 250; Technické vlastnosti: Hrášok mrazený, Jednotka: kg, Minimum: , Maximum: , Presná hodnota: 150; Technické vlastnosti: Knedle slivkové mrazené - tvarohové cesto, polotovar -  pšeničná múka 30% , tvaroh 24% min., zemiaková múčka 14% min., slivkový lekvár 20% min., Jednotka: kg, Minimum: , Maximum: , Presná hodnota: 100; Technické vlastnosti: Fazuľka struková zelená mrazená, Jednotka: kg, Minimum: , Maximum: , Presná hodnota: 50; Technické vlastnosti: Karfiol mrazený, Jednotka: kg, Minimum: , Maximum: , Presná hodnota: 300; Technické vlastnosti: Hranolky mrazené, Jednotka: kg, Minimum: , Maximum: , Presná hodnota: 200","Slovenská republika","Nitriansky","Levice","Levice","Komenského 29","","","","súbor položiek zákazky","1,0000","2800,000","Rámcová dohoda","False","Cena s DPH","1.4.2020 10:00:00","140","2799,600","3","140","1.4.2020 10:15:00","20","2","https://portal.eks.sk/Zakazky/StiahniZmluvnuPrilohuZakazky?correlationId=36370ea8-f0e1-4ac3-bf74-436cdad98978","https://portal.eks.sk/Zakazky/StiahniZmluvnuPrilohuZakazky?correlationId=ab697a0c-3f86-4022-9df9-7ef0fcd153f0","https://portal.eks.sk/Zakazky/StiahniZmluvnuPrilohuZakazky?correlationId=4be314f7-b782-43d9-a998-38a41e3531fe","https://portal.eks.sk/Zakazky/StiahniZmluvnuPrilohuZakazky?correlationId=29136817-b21e-46a3-ba70-7151a539d2fa","https://portal.eks.sk/Zakazky/StiahniZmluvnuPrilohuZakazky?correlationId=3da4adbd-39d4-4ef1-8718-8d8f4dd1c579","https://portal.eks.sk/Zakazky/StiahniZmluvnuPrilohuZakazky?correlationId=63d5a658-1f4a-4964-a903-85d0e3d4fdb0","https://portal.eks.sk/Zakazky/StiahniZmluvnuPrilohuZakazky?correlationId=a01a9725-e443-4a9c-9ee0-c30e67488b03","https://portal.eks.sk/Zakazky/StiahniZmluvnuPrilohuZakazky?correlationId=22af7b03-11f4-4416-8a6b-3a88ca874c23",
"Z20206377","https://portal.eks.sk/SpravaZakaziek/Zakazky/Detail/265786","zazmluvnená","§ 117 a § 110 ZVO","§ 7 ods. 1 písm. d)","Národný ústav srdcových a cievnych chorôb, a.s.","35971126","Slovenská republika","Bratislava","83348","Pod Krásnou hôrkou 1","26.3.2020 13:36:59","1.4.2020 8:58:00","piracetam inj","psychostimulanciá a nootropiká, psychoanaleptiká, centrálna nervová sústava","33661600-7 Psychoanaleptiká","Tovar; Služba","","humánny liek","Technické vlastnosti: ATC skupina :, Hodnota / charakteristika: N06BX03; Technické vlastnosti: Názov účinnej látky :, Hodnota / charakteristika: piracetam; Technické vlastnosti: Množstvo účinnej látky v mernej jednotke :, Hodnota / charakteristika: 1 g účinnej látky v 5ml injekčného roztoku; Technické vlastnosti: Cesta podania :, Hodnota / charakteristika: injekčný roztok","Technické vlastnosti: piracetam sol inj 1g/5ml, Jednotka: ampulka, Minimum: , Maximum: , Presná hodnota: 7000","Slovenská republika","Bratislavský","Bratislava III","Bratislava - mestská časť Nové Mesto","Pod Krásnou hôrkou 1","","","","ampulka","7000,0000","2220,000","Rámcová dohoda","False","Cena bez DPH","1.4.2020 8:20:00","236","2220,000","1","1","1.4.2020 8:35:00","20","2","https://portal.eks.sk/Zakazky/StiahniZmluvnuPrilohuZakazky?correlationId=e6d5c850-93fe-411e-898a-f089f363c59c","https://portal.eks.sk/Zakazky/StiahniZmluvnuPrilohuZakazky?correlationId=4587bc38-7bd1-48ce-90c7-01bee7d03e97","https://portal.eks.sk/Zakazky/StiahniZmluvnuPrilohuZakazky?correlationId=32d74bad-8c69-4d8d-b3be-d12705048290","https://portal.eks.sk/Zakazky/StiahniZmluvnuPrilohuZakazky?correlationId=67e8fdf3-98ae-4d8f-a4c8-8100e8d57cc9","https://portal.eks.sk/Zakazky/StiahniZmluvnuPrilohuZakazky?correlationId=dce00595-9bce-4728-b344-58b9594a6849","https://portal.eks.sk/Zakazky/StiahniZmluvnuPrilohuZakazky?correlationId=2285271b-1eec-4116-ac24-0b9b0aee9325","https://portal.eks.sk/Zakazky/StiahniZmluvnuPrilohuZakazky?correlationId=a92f4f4c-9fd4-4152-8030-5ed024513252","https://portal.eks.sk/Zakazky/StiahniZmluvnuPrilohuZakazky?correlationId=9433f6ac-6189-4065-8624-f6ea01c70204",
"Z20206334","https://portal.eks.sk/SpravaZakaziek/Zakazky/Detail/265743","zazmluvnená","§ 117 a § 110 ZVO","§ 7 ods. 1 písm. d)","Správa a údržba ciest Prešovského samosprávneho kraja","37936859","Slovenská republika","Prešov","08005","Jesenná 14","26.3.2020 13:42:38","2.4.2020 10:22:00","Špeciálne kvapaliny","špeciálne kvapaliny","24960000-1 Rôzne chemické výrobky; 24316000-2 Destilovaná voda; 44830000-7 Tmely, plnivá, tesniace tmely a rozpúšťadlá; 24957000-7 Chemické aditíva","Tovar","","Predmetom zákazky sú špeciálne kvapaliny slúžiace na zabezpečenie prevádzkových potrieb objednávateľa.","Technické vlastnosti: Položka č. 1 - AdBlue je kvapalné aditívum pre dieselové motory na znižovanie emisií oxidov dusíka podľa ISO22241., Hodnota / charakteristika: ; Technické vlastnosti: Položka č. 13 - WD 40 - aktívne odstraňuje vlhkosť, uvoľňuje zadreté a stuhnuté spoje, mechanizmy zámkov a pántov, rýchle preniká na zlé prístupné miesta, ochraňuje kov pred koróziou, odstraňuje staré zvyšky mazív a nečistôt, Hodnota / charakteristika: ; Technické vlastnosti: Položka č. 15 - Sprej kontakt chráni, izoluje a čistí elektrické spoje, sviečky, skrutky atď., Hodnota / charakteristika: ; Technické vlastnosti: Položka č. 16 - Sprej na hrdzu rozpúšťa hrdzu a uvoľňuje ťažko demontovateľné skorodované spojenia., Hodnota / charakteristika: ; Technické vlastnosti: Položka č. 17. - Odstraňovač karbónových usadenín odstraňuje a čistí karbón z EGR ventilov v motoroch, Hodnota / charakteristika: ; Technické vlastnosti: Položka č. 18 - Odmasťovacia kvapalina slúži na odmasťovanie dielov od najhrubšieho znečistenia, u ktorých sa vyžaduje rýchle a rovnomerné odparovanie čistiacej kvapaliny pre ďalšie spracovanie čistených dielov., Hodnota / charakteristika: ","Technické vlastnosti: Kvapalina AD BLUE - 10 L, Jednotka: ks, Minimum: , Maximum: , Presná hodnota: 1113; Technické vlastnosti: Brzdová kvapalina DOT3 - 0,5 L, Jednotka: ks, Minimum: , Maximum: , Presná hodnota: 226; Technické vlastnosti: Brzdová kvapalina DOT4 - 0,5 L, Jednotka: ks, Minimum: , Maximum: , Presná hodnota: 161; Technické vlastnosti: Zimná zmes do ostrekovačov -40°C - 5 L, Jednotka: ks, Minimum: , Maximum: , Presná hodnota: 525; Technické vlastnosti: Arva oplachová - 4 L, Jednotka: ks, Minimum: , Maximum: , Presná hodnota: 79; Technické vlastnosti: Destilovaná voda - 5 L, Jednotka: ks, Minimum: , Maximum: , Presná hodnota: 54; Technické vlastnosti: Kyselina sírová H2SO4 - 1 l, Jednotka: ks, Minimum: , Maximum: , Presná hodnota: 20; Technické vlastnosti: Technický benzín - 9 L, Jednotka: ks, Minimum: , Maximum: , Presná hodnota: 130; Technické vlastnosti: Zimná prísada do nafty - 0,5L, Jednotka: ks, Minimum: , Maximum: , Presná hodnota: 155; Technické vlastnosti: Zimná prísada do benzínu - 0,5L, Jednotka: ks, Minimum: , Maximum: , Presná hodnota: 50; Technické vlastnosti: Lieh proti zamrzaniu vzd.sústavy WABCO - 1L, Jednotka: ks, Minimum: , Maximum: , Presná hodnota: 60; Technické vlastnosti: Lieh obyčajný-1L, Jednotka: ks, Minimum: , Maximum: , Presná hodnota: 20; Technické vlastnosti: Univerzálne mazivo WD 40 -spray 500 ml, Jednotka: ks, Minimum: , Maximum: , Presná hodnota: 215; Technické vlastnosti: Tmel silikonový červený + 350°C - 300 g, Jednotka: ks, Minimum: , Maximum: , Presná hodnota: 117; Technické vlastnosti: Spray kontakt - 200 ml, Jednotka: ks, Minimum: , Maximum: , Presná hodnota: 82; Technické vlastnosti: Spray na hrdzu - 400 ml, Jednotka: ks, Minimum: , Maximum: , Presná hodnota: 160; Technické vlastnosti: Odstraňovač karbonových usadenín-spray 400 ml, Jednotka: ks, Minimum: , Maximum: , Presná hodnota: 38; Technické vlastnosti: Odmasťovacia kvapalina PURGASOL - 50 L, Jednotka: ks, Minimum: , Maximum: , Presná hodnota: 4; Technické vlastnosti: Odmasťovač brzd - spray 500 ml, Jednotka: ks, Minimum: , Maximum: , Presná hodnota: 182; Technické vlastnosti: Utesňovač chladiča STOP LEAK -prášok 18,5g, Jednotka: ks, Minimum: , Maximum: , Presná hodnota: 41; Technické vlastnosti: Aditívum - náhrada olova - 0,25 L, Jednotka: ks, Minimum: , Maximum: , Presná hodnota: 10; Technické vlastnosti: Nemrznúca zmes G 10 - 10L, Jednotka: ks, Minimum: , Maximum: , Presná hodnota: 100; Technické vlastnosti: Nemrznúca zmes G 11 - 10 L, Jednotka: ks, Minimum: , Maximum: , Presná hodnota: 163; Technické vlastnosti: Nemrznúca zmes G 12 - 10 L, Jednotka: ks, Minimum: , Maximum: , Presná hodnota: 56; Technické vlastnosti: Mazací sprej HHS 2000 - 500 ml, Jednotka: ks, Minimum: , Maximum: , Presná hodnota: 152; Technické vlastnosti: Letná zmes do ostrekovačov 5 L, Jednotka: ks, Minimum: , Maximum: , Presná hodnota: 182; Technické vlastnosti: Sprej na hubicu CO 2 Abicor-Binzel - 400 ml, Jednotka: ks, Minimum: , Maximum: , Presná hodnota: 72; Technické vlastnosti: Petrolej 180 lit. Sud, Jednotka: ks, Minimum: , Maximum: , Presná hodnota: 1","Slovenská republika","Prešovský","","","","","","","súbor položiek podľa technickej špecifikácie","1,0000","38563,740","Rámcová dohoda","False","Cena s DPH","2.4.2020 9:00:00","460","38563,740","7","133","2.4.2020 9:15:00","20","2","https://portal.eks.sk/Zakazky/StiahniZmluvnuPrilohuZakazky?correlationId=a3cba817-a24b-4a10-b3f4-296c3b977757","https://portal.eks.sk/Zakazky/StiahniZmluvnuPrilohuZakazky?correlationId=187d3325-074e-4b65-851e-7917b4cc66f5","https://portal.eks.sk/Zakazky/StiahniZmluvnuPrilohuZakazky?correlationId=7a099978-c0ae-49ab-834c-960f6cb5e8e5","https://portal.eks.sk/Zakazky/StiahniZmluvnuPrilohuZakazky?correlationId=92c86783-0273-4745-9bc2-4ad2bc693f56","https://portal.eks.sk/Zakazky/StiahniZmluvnuPrilohuZakazky?correlationId=d3789270-ed83-4276-93b5-47b6182ef3ec","https://portal.eks.sk/Zakazky/StiahniZmluvnuPrilohuZakazky?correlationId=4cc4f74b-4dde-46e3-af3e-97d592447f85","https://portal.eks.sk/Zakazky/StiahniZmluvnuPrilohuZakazky?correlationId=a3a126ab-b998-47de-8ee6-f88be5fcef44","https://portal.eks.sk/Zakazky/StiahniZmluvnuPrilohuZakazky?correlationId=74674c34-5371-4ab2-9136-5377f57aa3b7",
"Z20205329","https://portal.eks.sk/SpravaZakaziek/Zakazky/Detail/264738","zrušená","§ 117 a § 110 ZVO","","","","","","","","26.3.2020 13:47:51","","natrium chloratum 10%","krv a krvotvorné orgány, elektrolyty","33621000-9 Liečivá pre krv a krvotvorné orgány","Tovar; Služba","","humánny liek","Technické vlastnosti: ATC skupina :, Hodnota / charakteristika: B05BB01; Technické vlastnosti: Názov účinnej látky :, Hodnota / charakteristika: natrium chloratum; Technické vlastnosti: Množstvo účinnej látky v mernej jednotke :, Hodnota / charakteristika: 1000 mg účinnej látky v 10ml; Technické vlastnosti: Cesta podania :, Hodnota / charakteristika: injekčný roztok","Technické vlastnosti: natrium chloratum 10% sol inj, Jednotka: 10ml ampulka, Minimum: , Maximum: , Presná hodnota: 15500","Slovenská republika","Bratislavský","Bratislava III","Bratislava - mestská časť Nové Mesto","Pod Krásnou hôrkou 1","","","","10 ml ampulka","15500,0000","6350,000","Rámcová dohoda","False","Cena bez DPH","1.4.2020 8:30:00","239","6350,000","1","1","1.4.2020 8:45:00","20","2","https://portal.eks.sk/Zakazky/StiahniZmluvnuPrilohuZakazky?correlationId=2b91ec42-17a3-4282-8bbf-d9d1f5f22173","","","","https://portal.eks.sk/Zakazky/StiahniZmluvnuPrilohuZakazky?correlationId=11fc8b83-b8db-4569-a02e-565256e1c92e","https://portal.eks.sk/Zakazky/StiahniZmluvnuPrilohuZakazky?correlationId=4ce2a392-4b74-4275-8c40-d1229d37c6ea","https://portal.eks.sk/Zakazky/StiahniZmluvnuPrilohuZakazky?correlationId=5d8bfcb5-bccd-440a-8e8d-b804ff69c50c","https://portal.eks.sk/Zakazky/StiahniZmluvnuPrilohuZakazky?correlationId=9d123215-ca52-4c39-9ffb-5f57442d97d7",
"Z20206382","https://portal.eks.sk/SpravaZakaziek/Zakazky/Detail/265791","zazmluvnená","§ 117 a § 110 ZVO","§ 7 ods. 1 písm. c)","""LIPKA"" Zariadenie sociálnych služieb Lipová","00587052","Slovenská republika","Lipová","94102","Lipová č.474","26.3.2020 13:59:51","1.4.2020 11:38:00","Čerstvý chlieb, pečivo a pekárske výrobky ","Chlieb, rožok, závin, vianočka, bábovka, žemľa, brioška, buchta","15612500-6 Pekárske výrobky; 15811100-7 Chlieb; 15811200-8 Rožky; 15812100-4 Pečivo; 15813000-0 Raňajkové pečivo; 60000000-8 Dopravné služby (bez prepravy odpadu)","Tovar; Služba","","Dodávka čerstvého chleba a pekárskych výrobkov; Dodanie tovaru do zariadenia obstarávateľa v Nitrianskom kraji","Technické vlastnosti: Dodaný tovar musí by čerstvý nie starší ako 6-7 hodín po vypečení pri čerstvom chlebe a rožkoch, a 12 hodín pri ostatnom pečive, Hodnota / charakteristika: Akosť 1. trieda; Technické vlastnosti: Množstvá a sortiment pekárenských výrobkov sú určené od súčasného počtu a zloženia stravníkov a nie sú pre obstarávateľa záväzné, nakoľko sa ich počet a sortiment počas zmluvného vzťahu môže zmeniť, zvýšiť resp. znížiť. Na základe toho môže obstarávateľ množstvá a sortiment pekárenského tovaru upraviť podľa aktuálnych stavov a zloženia stravníkov., Hodnota / charakteristika: Zvýšenie alebo zníženie objemu a zmena sortimentu zákazky je prípustné.; Technické vlastnosti: Predpokladané množstvá pekárenských výrobkov v Technickej špecifikácii predmetu sú uvádzané na dobu 12 mesiacov., Hodnota / charakteristika: ; Technické vlastnosti: Množstvá jednotlivých druhov pekárenských výrobkov slúžia pre potreby súťaže., Hodnota / charakteristika: Dodávka tovaru bude realizovaná počas trvania zmluvného vzťahu na základe objednávok.","Technické vlastnosti: Chlieb čierny 1000 g nekrájaný, Jednotka: ks, Minimum: , Maximum: 4200, Presná hodnota: ; Technické vlastnosti: Vianočka 225 g balená, Jednotka: ks, Minimum: , Maximum: 840, Presná hodnota: ; Technické vlastnosti: Uzol sladký 80 g balený, Jednotka: ks, Minimum: , Maximum: 800, Presná hodnota: ; Technické vlastnosti: Bábovka 400 g balená, Jednotka: ks, Minimum: , Maximum: 600, Presná hodnota: ; Technické vlastnosti: Droždie čerstvé 1 kg, Jednotka: kg, Minimum: , Maximum: 60, Presná hodnota: ; Technické vlastnosti: Buchta lekvárová 80 g balená, Jednotka: ks, Minimum: , Maximum: 1700, Presná hodnota: ; Technické vlastnosti: Lístková trubička 100 g balená, Jednotka: ks, Minimum: , Maximum: 800, Presná hodnota: ; Technické vlastnosti: Buchta tvarohová 80 g balená, Jednotka: ks, Minimum: , Maximum: 1700, Presná hodnota: ; Technické vlastnosti: Pagáč oškvarkový 50 g balený, Jednotka: ks, Minimum: , Maximum: 800, Presná hodnota: ; Technické vlastnosti: Rohlík 40 g, Jednotka: ks, Minimum: , Maximum: 24000, Presná hodnota: ; Technické vlastnosti: Pizza rožok 60 g balený, Jednotka: ks, Minimum: , Maximum: 800, Presná hodnota: ; Technické vlastnosti: Kaiserka 50 g, Jednotka: ks, Minimum: , Maximum: 3500, Presná hodnota: ; Technické vlastnosti: Strúhanka, Jednotka: kg, Minimum: , Maximum: 240, Presná hodnota: ; Technické vlastnosti: Rožok viaczrnný 50 g, Jednotka: ks, Minimum: , Maximum: 3000, Presná hodnota: ; Technické vlastnosti: Žemľa 50 g, Jednotka: ks, Minimum: , Maximum: 3400, Presná hodnota: ; Technické vlastnosti: Osie hniezdo s náplňou škoricovou 70 g, Jednotka: ks, Minimum: , Maximum: 780, Presná hodnota: ; Technické vlastnosti: Croissant s náplňou lieskovo orieškovou 60 g, Jednotka: ks, Minimum: , Maximum: 800, Presná hodnota: ; Technické vlastnosti: Uzol cesnakový 60 g, Jednotka: ks, Minimum: , Maximum: 800, Presná hodnota: ; Technické vlastnosti: Závin kakaový 250 g, Jednotka: ks, Minimum: , Maximum: 1000, Presná hodnota: ; Technické vlastnosti: Závin makovo-jablkový 250 g, Jednotka: ks, Minimum: , Maximum: 1000, Presná hodnota: ; Technické vlastnosti: Croissant s náplňou biela čokoláda 60 g, Jednotka: ks, Minimum: , Maximum: 800, Presná hodnota: ","Slovenská republika","Nitriansky","Nové Zámky","Lipová","94102, Lipová 474","","","","zákazka","1,0000","11558,590","Rámcová dohoda","False","Cena s DPH","1.4.2020 11:00:00","144","11526,770","1","1","1.4.2020 11:15:00","20","2","https://portal.eks.sk/Zakazky/StiahniZmluvnuPrilohuZakazky?correlationId=ede6cd75-74bb-4565-9d9d-6c9bcb3595f5","https://portal.eks.sk/Zakazky/StiahniZmluvnuPrilohuZakazky?correlationId=f9b82c06-9dfe-4efe-85c0-de450df9a9fd","https://portal.eks.sk/Zakazky/StiahniZmluvnuPrilohuZakazky?correlationId=963a51e1-57cb-4703-9046-e8786f054921","https://portal.eks.sk/Zakazky/StiahniZmluvnuPrilohuZakazky?correlationId=9a59e816-1164-4522-9045-96a79e058531","https://portal.eks.sk/Zakazky/StiahniZmluvnuPrilohuZakazky?correlationId=6d7508b0-df51-4cd2-9efd-9a428b3fb276","https://portal.eks.sk/Zakazky/StiahniZmluvnuPrilohuZakazky?correlationId=654000e0-b7fb-4c4d-a620-676a58eceb8b","https://portal.eks.sk/Zakazky/StiahniZmluvnuPrilohuZakazky?correlationId=2bd914ca-3d87-4cc2-9ede-96d711d36b2b","https://portal.eks.sk/Zakazky/StiahniZmluvnuPrilohuZakazky?correlationId=f3aea5e8-9a17-4bec-9834-3324805a592d",
"Z20206381","https://portal.eks.sk/SpravaZakaziek/Zakazky/Detail/265790","zazmluvnená","§ 117 a § 110 ZVO","§ 7 ods. 1 písm. d)","Národný ústav srdcových a cievnych chorôb, a.s.","35971126","Slovenská republika","Bratislava","83348","Pod Krásnou hôrkou 1","26.3.2020 14:16:27","1.4.2020 9:48:00","ertapeném","antiinfektíva na systémové použitie, karbapenémy","33651100-9 Látky ničiace baktérie na systémové použitie","Tovar; Služba","","humánny liek","Technické vlastnosti: ATC skupina :, Hodnota / charakteristika: J01DH03; Technické vlastnosti: Názov účinnej látky :, Hodnota / charakteristika: ertapeném; Technické vlastnosti: Množstvo účinnej látky v mernej jednotke :, Hodnota / charakteristika: 1g účinnej látky v každej injekčnej liekovke; Technické vlastnosti: Cesta podania :, Hodnota / charakteristika: prášok na koncentrát na infúzny roztok","Technické vlastnosti: ertapeném plc ifo 1g, Jednotka: lag, Minimum: , Maximum: , Presná hodnota: 450","Slovenská republika","Bratislavský","Bratislava III","Bratislava - mestská časť Nové Mesto","Pod Krásnou hôrkou 1","","","","lag","450,0000","13100,000","Rámcová dohoda","False","Cena bez DPH","1.4.2020 8:40:00","237","13100,000","2","44","1.4.2020 8:55:00","20","2","https://portal.eks.sk/Zakazky/StiahniZmluvnuPrilohuZakazky?correlationId=4aeedaaf-8c21-4b5d-86ab-730fc392d75d","https://portal.eks.sk/Zakazky/StiahniZmluvnuPrilohuZakazky?correlationId=af754d8c-5634-4f4d-b7cd-fcdc38b6c94b","https://portal.eks.sk/Zakazky/StiahniZmluvnuPrilohuZakazky?correlationId=dde6d146-8fc9-45c5-9768-71923afaf2f6","https://portal.eks.sk/Zakazky/StiahniZmluvnuPrilohuZakazky?correlationId=6a556e44-f538-4b89-beef-8212595f2947","https://portal.eks.sk/Zakazky/StiahniZmluvnuPrilohuZakazky?correlationId=0cb5d7b9-f208-4d4a-a97a-0fe5cf08a78d","https://portal.eks.sk/Zakazky/StiahniZmluvnuPrilohuZakazky?correlationId=18748ee0-ab6a-4644-916e-576913b00377","https://portal.eks.sk/Zakazky/StiahniZmluvnuPrilohuZakazky?correlationId=4296a4ef-6f0f-4ca8-9a45-7dd15226b5c7","https://portal.eks.sk/Zakazky/StiahniZmluvnuPrilohuZakazky?correlationId=b6abe99c-29c2-4f2f-aff6-24ada3d5b0fc",
"Z20206386","https://portal.eks.sk/SpravaZakaziek/Zakazky/Detail/265795","zazmluvnená","§ 117 a § 110 ZVO","§ 7 ods. 1 písm. d)","Slovenská technická univerzita v Bratislave","00397687","Slovenská republika","Bratislava","81243","Vazovova 5","26.3.2020 14:37:33","1.4.2020 15:42:00","projektor","projektor","38652120-7 Videoprojektory; 60000000-8 Dopravné služby (bez prepravy odpadu)","Tovar; Služba","","","Technické vlastnosti: projektor-Epson EB-2247U, Hodnota / charakteristika: ; Technické vlastnosti: Rozlíšenie: 1920×1080 px (Full HD) ,Svietivosť: viac ako 4000 lm (osvetlené priestory) ,Grafické vstupy: HDMI, VGA (D-SUB) ,Ostatné vstupy/výstupy: Wi-Fi, Ethernet ,Funkcie: Zoom, MHL, Miracast ,Hmotnosť: do 3,5 kg (prenosný) ,Min. projekčná vzdialenosť 1,5 m ,, Hodnota / charakteristika: ","Technické vlastnosti: projektor, Jednotka: ks, Minimum: , Maximum: , Presná hodnota: 1","Slovenská republika","Bratislavský","Bratislava IV","Bratislava - mestská časť Karlova Ves","Ilkovičova 3","6.4.2020 9:00:00","14.4.2020 15:00:00","","ks","1,0000","830,000","Kúpna zmluva","False","Cena bez DPH","1.4.2020 15:00:00","259","830,000","8","35","1.4.2020 15:15:00","20","2","https://portal.eks.sk/Zakazky/StiahniZmluvnuPrilohuZakazky?correlationId=84584dca-3346-4867-9e98-51e1acf83bdd","https://portal.eks.sk/Zakazky/StiahniZmluvnuPrilohuZakazky?correlationId=7b2b4888-a57d-465a-8ae2-23da8498a3bb","https://portal.eks.sk/Zakazky/StiahniZmluvnuPrilohuZakazky?correlationId=e4cd674d-04c4-4bf6-ab10-d3b6d7499923","https://portal.eks.sk/Zakazky/StiahniZmluvnuPrilohuZakazky?correlationId=3db5f0f6-b6e1-4bc3-a922-62dcb6205c0a","https://portal.eks.sk/Zakazky/StiahniZmluvnuPrilohuZakazky?correlationId=2176f561-5d50-41ae-a9b4-81301130592c","https://portal.eks.sk/Zakazky/StiahniZmluvnuPrilohuZakazky?correlationId=e3469403-a68d-4e24-942e-5680e442d270","https://portal.eks.sk/Zakazky/StiahniZmluvnuPrilohuZakazky?correlationId=53c4d174-f450-4896-832f-3e7d9cb67fb9","https://portal.eks.sk/Zakazky/StiahniZmluvnuPrilohuZakazky?correlationId=1cb32cc0-9429-4d71-8514-e9a37f043f4d",
