"IdentifikatorZakazky","ZakazkaUrl","StavZakazky","PouzityPostup","ObjednavatelDruh","ObjednavatelObchodneMeno","ObjednavatelICO","ObjednavatelStat","ObjednavatelObec","ObjednavatelPSC","ObjednavatelUlica","DatumVyhlasenia","DatumZazmluvnenia","OpisnyFormularNazov","OpisnyFormularKlucoveSlova","OpisnyFormularCpv","OpisnyFormularDruh","OpisnyFormularKategoriaSluzieb","OpisnyFormularFunkcnaSpecifikacia","OpisnyFormularTechnickaSpecifikaciaTextova","OpisnyFormularTechnickaSpecifikaciaCiselna","MiestoPlneniaStat","MiestoPlneniaKraj","MiestoPlneniaOkres","MiestoPlneniaObec","MiestoPlneniaUlica","LehotaPlneniaOd","LehotaPlneniaDo","LehotaPlneniaPresne","MnozstvoJednotka","MnozstvoHodnota","MaximalnaVyskaZdrojov","ZmluvnyVztah","FinancovanieEU","HodnotiaceKriterium","LehotaNaPredkladaniePonuk","PocetNotifikovanychDodavatelov","VstupnaCena","PocetSutaziacich","PocetPredlozenychPonuk","ZaciatokAukcie","TrvanieAukcie_Minut","PredlzovanieAukcie_Minut","ProtokolOPriebehuZadavaniaZakazky","Priloha_c1_ZmluvnyFormularZakazky","Priloha_c2_VyslednePoradieDodavatelov","Priloha_c3_Zmluva","Priloha_c4A_ZaznamOSystemovychUdalostiachZakazky","Priloha_c4B_ZaznamOSystemovychUdalostiachElektronickejAukcie","AnonymnyZmluvnyFormularZakazky","ObjednavkovyFormularZakazky",
"Z201851359","https://portal.eks.sk/SpravaZakaziek/Zakazky/Detail/214284","zazmluvnená","§ 110 ZVO","§ 7 ods. 1 písm. a)","Okresný súd Nové Mesto nad Váhom","42025524","Slovenská republika","Nové Mesto nad Váhom","91519","Hviezdoslavova 37","21.11.2018 15:12:43","3.12.2018 15:44:00","Zabezpečenie stravovania zamestnancov prostredníctvom stravných lístkov.","Stravné poukážky, dodanie stravných poukážok, zabezpečenie stravovania v zmluvných stravovacích zariadeniach","30199770-8 Stravné poukážky; 55520000-1 Služby hromadného stravovania; 60000000-8 Dopravné služby (bez prepravy odpadu)","Tovar; Služba","","Zabezpečenie stravovania zamestnancov objednávateľa formou stravných poukážok vo vybraných stravovacích zariadeniach zmluvných partnerov dodávateľa, ktorí sú oprávnení tieto služby poskytovať.; Poskytovanie predmetu zákazky musí byť v súlade s ustanovením §152 ods.2 zák. č. 311/2011 Z.z. Zákonníka práce v znení neskorších predpisov.; Počas platnosti zmluvy je dodávateľ povinný mať uzatvorené zmluvy na využitie stravných poukážok s minimálne 10 zariadeniami v sídle verejného obstarávateľa. V prípade, že dodávateľ danú podmienku počas účinnosti zmluvy nebude spĺnať je verejný obstarávateľ oprávnený od zmluvy odstúpiť.  ","Technické vlastnosti: Stravná poukážka obsahuje, Hodnota / charakteristika: názov a logo dodávateľa; Technické vlastnosti: Stravná poukážka obsahuje, Hodnota / charakteristika: ochranné prvky proti falšovaniu používané pre tlač cenných papierov; Technické vlastnosti: Stravná poukážka obsahuje, Hodnota / charakteristika: rok platnosti stravnej poukážky; Technické vlastnosti: Stravná poukážka obsahuje, Hodnota / charakteristika: nominálnu hodnotu stravnej poukážky","Technické vlastnosti: Nominálna hodnota jednej stravnej poukážky, Jednotka: €, Minimum: , Maximum: , Presná hodnota: 4,80; Technické vlastnosti: Predpokladané množstvo odobratých stravných poukážok, Jednotka: ks, Minimum: 40000, Maximum: 41666, Presná hodnota: ","Slovenská republika","Trenčiansky","Nové Mesto nad Váhom","Nové Mesto nad Váhom","Hviezdoslavova 37","1.1.2019 15:04:00","31.12.2021 15:04:00","","ks","41666,0000","199999,000","Zmluva o poskytovaní služieb","False","Cena bez DPH","3.12.2018 15:06:00","545","199999,000","5","8","3.12.2018 15:21:00","20","2","https://portal.eks.sk/Zakazky/StiahniZmluvnuPrilohuZakazky?correlationId=26e3343a-bad5-405b-a492-1c0d3bbba5b1","https://portal.eks.sk/Zakazky/StiahniZmluvnuPrilohuZakazky?correlationId=e8b6daec-b993-4539-8d33-701613d72962","https://portal.eks.sk/Zakazky/StiahniZmluvnuPrilohuZakazky?correlationId=27cc2092-4223-4532-ae03-ad59a978048e","https://portal.eks.sk/Zakazky/StiahniZmluvnuPrilohuZakazky?correlationId=0391480a-65bf-4ab3-9ce7-12c97dbdebab","https://portal.eks.sk/Zakazky/StiahniZmluvnuPrilohuZakazky?correlationId=afd84937-dae0-4a7b-a288-c0c8b4e23262","https://portal.eks.sk/Zakazky/StiahniZmluvnuPrilohuZakazky?correlationId=da8f5cb6-ceaf-4f09-aab6-5d8123b93db1","https://portal.eks.sk/Zakazky/StiahniZmluvnuPrilohuZakazky?correlationId=0f897ab4-6962-4c06-8405-6dc5598cfa95","https://portal.eks.sk/Zakazky/StiahniZmluvnuPrilohuZakazky?correlationId=ef3690e6-f63c-4fb7-924b-dcb2cbd2f375",
"Z201851845","https://portal.eks.sk/SpravaZakaziek/Zakazky/Detail/214770","zazmluvnená","§ 117 ZVO","§ 7 ods. 1 písm. d)","Nemocnica s poliklinikou Myjava","00610721","Slovenská republika","Myjava","90701","Staromyjavská 59","23.11.2018 12:45:03","3.12.2018 9:54:00","Posteľná, hygienická a kuchynská bielizeň","prestieradlo, návlečka, uterák, vankúš, paplón","39512000-4 Posteľná bielizeň; 60000000-8 Dopravné služby (bez prepravy odpadu)","Tovar; Služba","","","","Technické vlastnosti: Prestieradlo biele 150x260 cm, materiál 100 % bavlna, plošná hmotnosť 145 g/m2, väzba plátnová, povolené pranie pri t do 95 st.C, chlórostála úprava, Jednotka: ks, Minimum: , Maximum: 420, Presná hodnota: ; Technické vlastnosti: Návlečka na vankúš biela, rozmer 70 x 90 cm, zapínanie na nitené gombíky, materiál 100% bavlna, plošná hmotnosť 145 g/m2, väzba plátnová, povolené pranie pri t do 95 st.C, chlórostála úprava, Jednotka: ks, Minimum: , Maximum: 400, Presná hodnota: ; Technické vlastnosti: Návlečka na paplón biela, 140 x 200 cm, zapínanie na nitené gombíky, materiál 100 % bavlna, plošná hmotnosť 145 g/m2, väzba plátnová, povolené pranie pri t do 95 st.C, chlórostála úprava, Jednotka: ks, Minimum: , Maximum: 210, Presná hodnota: ; Technické vlastnosti: Uterák froté farebný 50 x 100 cm, min.plošná hmotnosť 400 g/m2, Jednotka: ks, Minimum: , Maximum: 250, Presná hodnota: ; Technické vlastnosti: Vankúš, rozmer 70 x 90 cm, antialergický, nie z materiálu: perie ani guličková výplň, Jednotka: ks, Minimum: , Maximum: 40, Presná hodnota: ; Technické vlastnosti: Paplón, rozmer 145 x 200 cm, antialergický, nie z materiálu: perie ani guličková výplň, Jednotka: ks, Minimum: , Maximum: 30, Presná hodnota: ","Slovenská republika","Trenčiansky","Myjava","Myjava","Staromyjavská 59","","","","celok","1,0000","6664,170","Rámcová dohoda","False","Cena bez DPH","3.12.2018 9:00:00","269","6663,000","5","64","3.12.2018 9:15:00","20","2","https://portal.eks.sk/Zakazky/StiahniZmluvnuPrilohuZakazky?correlationId=03ad35be-41e9-4d0e-9794-ebd4a14df529","https://portal.eks.sk/Zakazky/StiahniZmluvnuPrilohuZakazky?correlationId=9b7a49c9-4965-43b0-8dcc-b587d1ee1391","https://portal.eks.sk/Zakazky/StiahniZmluvnuPrilohuZakazky?correlationId=af2a7b4f-58b5-4557-9e1b-ef39c1fcb3cc","https://portal.eks.sk/Zakazky/StiahniZmluvnuPrilohuZakazky?correlationId=aed3307f-c464-4139-8845-109efc1a67f0","https://portal.eks.sk/Zakazky/StiahniZmluvnuPrilohuZakazky?correlationId=d086936f-7e2f-427e-ab44-59c0949eceb4","https://portal.eks.sk/Zakazky/StiahniZmluvnuPrilohuZakazky?correlationId=272e222f-ef67-4932-8610-20832225d469","https://portal.eks.sk/Zakazky/StiahniZmluvnuPrilohuZakazky?correlationId=ef7fabc2-f5ef-4e9f-9441-37c1ea0a1b32","https://portal.eks.sk/Zakazky/StiahniZmluvnuPrilohuZakazky?correlationId=129470fb-f8d3-49c6-aab7-bfed68cb52b3",
"Z201851856","https://portal.eks.sk/SpravaZakaziek/Zakazky/Detail/214781","zazmluvnená","§ 110 ZVO","§ 7 ods. 1 písm. d)","LIKAVA - centrum sociálnych služieb","00647781","Slovenská republika","Likavka","03495","Likavka 9","23.11.2018 13:00:22","3.12.2018 13:49:59","Dodávka elektrickej energie","elektrická energia, elektrina","09310000-5 Elektrická energia; 65300000-6 Rozvod elektriny a súvisiace služby","Tovar; Služba","","Predmetom zákazky je dodávka elektrickej energie vrátane prevzatia zodpovednosti za odchýlku a zabezpečením distribúcie a distribučných služieb. Dodávka elektrickej energie musí zodpovedať technickým podmienkam a prevádzkovému poriadku prevádzkovateľa distribučnej siete a musí byť v súlade s platnými predpismi SR ( Zákon 251/2012 Z.z., Vyhláška ÚRSO č. 423/2013 Z.z., Nariadenie vlády 211/2010 a 317/2007 Z.z. ); Predmetom zákazky je dodávka elektrickej energie od 01.01.2019, 00:00 hod. do 31.12.2019, 24:00 hod.","Technické vlastnosti: Tarifa/Produkt 1. OM, EIC: 24ZSS9315278000Z, Hodnota / charakteristika: VN /  2 T Normál","Technické vlastnosti: Predpokladaný ročný odber/spotreba elektrickej energie pre 1. Odberné miesto , ČOM:.9315278  EIC: 24ZSS9315278000Z Likava-Centrum sociálnych služieb, Likavka 9, 034 95 Likavka, Jednotka: kWh, Minimum: , Maximum: , Presná hodnota: 268474; Technické vlastnosti: VT, Jednotka: kWh, Minimum: , Maximum: , Presná hodnota: 229529; Technické vlastnosti: NT, Jednotka: kWh, Minimum: , Maximum: , Presná hodnota: 38945; Technické vlastnosti: Rezervovaná kapacita pre 1. OM Typ 12 mesačná, Jednotka: kWh, Minimum: , Maximum: , Presná hodnota: 125; Technické vlastnosti: Záväzok odobratia minimálneho množstva elektriny zo záväzne objednaného množstva elektriny, Jednotka: %, Minimum: 70, Maximum: , Presná hodnota: ; Technické vlastnosti: Záväzok odobratia maximálneho množstva elektriny zo záväzne objednaného množstva elektriny, Jednotka: %, Minimum: , Maximum: , Presná hodnota: 130","Slovenská republika","Žilinský","Ružomberok","Likavka","Likavka 9","1.1.2019 0:00:00","1.1.2020 0:00:00","","kompletná technická špecifikácia predmetu zákazky","1,0000","60557,070","Kúpna zmluva","False","Cena s DPH","3.12.2018 13:00:00","211","55327,360","2","13","3.12.2018 13:15:00","20","2","https://portal.eks.sk/Zakazky/StiahniZmluvnuPrilohuZakazky?correlationId=e2c7c074-4a01-4f5d-afb8-e3247a5ed639","https://portal.eks.sk/Zakazky/StiahniZmluvnuPrilohuZakazky?correlationId=7fda9ac8-f74a-4d0b-93bc-7513b1a29726","https://portal.eks.sk/Zakazky/StiahniZmluvnuPrilohuZakazky?correlationId=6c81530d-2e1a-45b5-ac76-1a5d1138ff9c","https://portal.eks.sk/Zakazky/StiahniZmluvnuPrilohuZakazky?correlationId=cdb8678a-4ca9-4e20-9277-f2fe5a5f9737","https://portal.eks.sk/Zakazky/StiahniZmluvnuPrilohuZakazky?correlationId=bf6ebe9d-2007-4ee0-86e2-b01b55c262cc","https://portal.eks.sk/Zakazky/StiahniZmluvnuPrilohuZakazky?correlationId=00bd5a7f-a2ca-4136-b069-5855e85ddbc2","https://portal.eks.sk/Zakazky/StiahniZmluvnuPrilohuZakazky?correlationId=92822785-63f1-4b92-bab9-57d27b462816","https://portal.eks.sk/Zakazky/StiahniZmluvnuPrilohuZakazky?correlationId=f509f741-91d2-4bfd-aabd-ea3e0b01561d",
"Z201851860","https://portal.eks.sk/SpravaZakaziek/Zakazky/Detail/214785","zrušená","§ 110 ZVO","§ 7 ods. 1 písm. d)","LIKAVA - centrum sociálnych služieb","00647781","Slovenská republika","Likavka","03495","Likavka 9","23.11.2018 13:07:43","","Dodávka zemného plynu","zemný plyn, dodávka zemného plynu, preprava zemného plynu, distribúcia zemného plynu, služby obchodníka","09123000-7 Zemný plyn; 65200000-5 Rozvod plynu a súvisiace služby","Tovar; Služba","","Dodávka zemného plynu, zabezpečenie prepravy a distribúcie plynu, resp. poskytovanie služieb v kvalite garantovanej technickými podmienkami prevádzkovateľa distribučnej siete, vrátane prevzatia zodpovednosti za odchýlku odberateľa v trvaní 12 mesiacov.","Technické vlastnosti: Vyhodnocovací rok - začiatok, Hodnota / charakteristika: 1.1.2019; Technické vlastnosti: Vyhodnocovací rok - koniec, Hodnota / charakteristika: 31.12.2019; Technické vlastnosti: POD : SKSPPDIS010510004917, Hodnota / charakteristika: druh tarify - S9; Technické vlastnosti: Zmluvné obdobie - vyhodnocovací rok, Hodnota / charakteristika: od 1.1.2019 do 31.12.2019; Technické vlastnosti: Dodávateľ na základe splnomocnenia objednávateĺa oznámi spustenie procesu zmeny dodávateľa Viď: Hlavné zásady pri zmene dodávateľa plynu na http://www.urso.gov.sk (ak sa táto skutočnosť vyskytne), Hodnota / charakteristika: ","Technické vlastnosti: Predpokladaná ročná spotreba zemného plynu za OM spolu od 01.01.2019 o 0.00 hod. do 31.12.2019 24:00 hod, Jednotka: kWh, Minimum: , Maximum: , Presná hodnota: 1224000; Technické vlastnosti: Predpokladaná spotreba zemného plynu na 12 mesiacov - zmluvné množstvo (ZM) za OM číslo 4101456934; POD : SKSPPDIS000530021408, Jednotka: kWh, Minimum: , Maximum: , Presná hodnota: 1224000; Technické vlastnosti: Podiel zo ZM za obdobie 12 mesiacov za OM číslo 4101456934  ; POD : SKSPPDIS000530021408 :, Jednotka: %, Minimum: , Maximum: , Presná hodnota: 100; Technické vlastnosti: Podiel zo ZM pre mesiac január, Jednotka: %, Minimum: , Maximum: , Presná hodnota: 15; Technické vlastnosti: Podiel zo ZM pre mesiac február, Jednotka: %, Minimum: , Maximum: , Presná hodnota: 14; Technické vlastnosti: Podiel zo ZM pre mesiac marec, Jednotka: %, Minimum: , Maximum: , Presná hodnota: 11; Technické vlastnosti: Podiel zo ZM pre mesiac apríl, Jednotka: %, Minimum: , Maximum: , Presná hodnota: 8; Technické vlastnosti: Podiel zo ZM pre mesiac máj, Jednotka: %, Minimum: , Maximum: , Presná hodnota: 6; Technické vlastnosti: Podiel zo ZM pre mesiac jún, Jednotka: %, Minimum: , Maximum: , Presná hodnota: 4; Technické vlastnosti: Podiel zo ZM pre mesiac júl, Jednotka: %, Minimum: , Maximum: , Presná hodnota: 3; Technické vlastnosti: Podiel zo ZM pre mesiac august, Jednotka: %, Minimum: , Maximum: , Presná hodnota: 3; Technické vlastnosti: Podiel zo ZM pre mesiac september, Jednotka: %, Minimum: , Maximum: , Presná hodnota: 4; Technické vlastnosti: Podiel zo ZM pre mesiac október, Jednotka: %, Minimum: , Maximum: , Presná hodnota: 9; Technické vlastnosti: Podiel zo ZM pre mesiac november, Jednotka: %, Minimum: , Maximum: , Presná hodnota: 10; Technické vlastnosti: Podiel zo ZM pre mesiac december, Jednotka: %, Minimum: , Maximum: , Presná hodnota: 13; Technické vlastnosti: Denné maximálne množstvo spotreby plynu     za OM číslo 4101456880; POD : SKSPPDIS000530021393, Jednotka: m3, Minimum: , Maximum: 1250, Presná hodnota: ; Technické vlastnosti: Tolerancia odberu plynu vyhodnocovací rok - minimálna hodnota, Jednotka: %, Minimum: 50, Maximum: , Presná hodnota: ; Technické vlastnosti: Tolerancia odberu plynu vyhodnocovací rok - maximálna hodnota, Jednotka: %, Minimum: , Maximum: 150, Presná hodnota: ","Slovenská republika","Žilinský","Ružomberok","Likavka","Likavka 9","1.1.2019 0:00:00","31.12.2019 23:59:00","","kompletná technická špecifikácia predmetu zákazky","1,0000","66823,820","Kúpna zmluva","False","Cena s DPH","3.12.2018 13:15:00","212","66823,800","1","1","3.12.2018 13:30:00","20","2","https://portal.eks.sk/Zakazky/StiahniZmluvnuPrilohuZakazky?correlationId=3eab501c-dea8-470c-a9e5-0ecb55237578","","","","https://portal.eks.sk/Zakazky/StiahniZmluvnuPrilohuZakazky?correlationId=2d98e702-b042-4445-b592-1c84dedf9c51","https://portal.eks.sk/Zakazky/StiahniZmluvnuPrilohuZakazky?correlationId=b0d15da9-1256-4758-908a-ecb866d7df4f","https://portal.eks.sk/Zakazky/StiahniZmluvnuPrilohuZakazky?correlationId=ff6fc98a-fcc7-4d51-a4b6-8b6a1cb7c1ac","https://portal.eks.sk/Zakazky/StiahniZmluvnuPrilohuZakazky?correlationId=af4e1aed-d15d-4a63-b501-dd796dcb5123",
"Z201851798","https://portal.eks.sk/SpravaZakaziek/Zakazky/Detail/214723","zrušená","§ 110 ZVO","§ 7 ods. 1 písm. a)","Ministerstvo vnútra Slovenskej republiky","00151866","Slovenská republika","Bratislava","81272","Pribinova 2","23.11.2018 13:51:32","","Softvér pre expertízne činnosti","softvér, forenzný softvér, virtualizačný softvér, upgrade, predĺženie podpory","48461000-7 Analytický alebo vedecký softvérový balík; 60000000-8 Dopravné služby (bez prepravy odpadu)","Tovar; Služba","","","Technické vlastnosti: Funkcie:, Hodnota / charakteristika: automatická analýza diskov, imigov diskov, operačného systému iOS, Blackberry, Android, dump chipov, Jtag; Technické vlastnosti: Funkcie:, Hodnota / charakteristika: tvorba reportov do programu Evidence reader, tvorba reportov do LACE, filtrovanie obrázkov podľa PhotoDNA, automatická detekcia pornografického obsahu, zobrazení tváre a textu vo fotkách; Technické vlastnosti: Obsahuje moduly:, Hodnota / charakteristika: natívna analýza SQL databáz a office dokumentov, analýza mobilných zariadení, prehliadač súborového systému (File system explorer); Technické vlastnosti: Licencia:, Hodnota / charakteristika: USB dongle kľúč; Technické vlastnosti: Podpora:, Hodnota / charakteristika: 3 roky, priebežné aktualizácie softvéru","Technické vlastnosti: Forenzný softvér na skúmanie pamäťových médií - typ 1, Jednotka: ks, Minimum: , Maximum: , Presná hodnota: 2","Slovenská republika","","","","","","","11.1.2019 15:00:00","súbor položiek zákazky","1,0000","102988,800","Kúpna zmluva","False","Cena s DPH","3.12.2018 10:00:00","422","","0","0","3.12.2018 10:15:00","20","2","https://portal.eks.sk/Zakazky/StiahniZmluvnuPrilohuZakazky?correlationId=377dd624-a4cc-497e-81fd-f5683f59dfed","","","","https://portal.eks.sk/Zakazky/StiahniZmluvnuPrilohuZakazky?correlationId=e7ca79c9-92aa-48ab-bdb0-d98c2b68e9c0","https://portal.eks.sk/Zakazky/StiahniZmluvnuPrilohuZakazky?correlationId=d9a9253b-cbbe-4baf-a84e-97e3f5a202d1","https://portal.eks.sk/Zakazky/StiahniZmluvnuPrilohuZakazky?correlationId=cf71d0c8-e548-4e07-8efd-102e0edf54d7","https://portal.eks.sk/Zakazky/StiahniZmluvnuPrilohuZakazky?correlationId=a9ddbad0-0ccf-44d7-8083-d37e90b27006",
"Z201851798","https://portal.eks.sk/SpravaZakaziek/Zakazky/Detail/214723","zrušená","§ 110 ZVO","§ 7 ods. 1 písm. a)","Ministerstvo vnútra Slovenskej republiky","00151866","Slovenská republika","Bratislava","81272","Pribinova 2","23.11.2018 13:51:32","","Softvér pre expertízne činnosti","","","","","","Technické vlastnosti: Funkcie:, Hodnota / charakteristika: detekcia čiernobielych alebo šedých obrázkov, detekcia farby kože osôb na obrázku, automat. sfarbenie pozadia buniek založené na podmienkach defin. používateľom; Technické vlastnosti: Funkcie:, Hodnota / charakteristika: integrovaný prehliadač súborov, ktorý podporuje +270 súborových typov, možnosť vytvorenia grafických náhľadov z videosúborov v užívateľom definovanom časovom intervale; Technické vlastnosti: Podpora pre súborové systémy:, Hodnota / charakteristika: FAT12, FAT16, FAT32, exFAT, TFAT, NFTS, Ext2, Ext3, Ext4, Next3®, CDFS/ISO9660/Joliet, UDF; Technické vlastnosti: Podpora:, Hodnota / charakteristika: 3 roky, priebežné aktualizácie softvéru","Technické vlastnosti: Forenzný softvér na skúmanie pamäťových médií - typ 2, Jednotka: ks, Minimum: , Maximum: , Presná hodnota: 4","Slovenská republika","","","","","","","11.1.2019 15:00:00","súbor položiek zákazky","1,0000","102988,800","Kúpna zmluva","False","Cena s DPH","3.12.2018 10:00:00","422","","0","0","3.12.2018 10:15:00","20","2","https://portal.eks.sk/Zakazky/StiahniZmluvnuPrilohuZakazky?correlationId=377dd624-a4cc-497e-81fd-f5683f59dfed","","","","https://portal.eks.sk/Zakazky/StiahniZmluvnuPrilohuZakazky?correlationId=e7ca79c9-92aa-48ab-bdb0-d98c2b68e9c0","https://portal.eks.sk/Zakazky/StiahniZmluvnuPrilohuZakazky?correlationId=d9a9253b-cbbe-4baf-a84e-97e3f5a202d1","https://portal.eks.sk/Zakazky/StiahniZmluvnuPrilohuZakazky?correlationId=cf71d0c8-e548-4e07-8efd-102e0edf54d7","https://portal.eks.sk/Zakazky/StiahniZmluvnuPrilohuZakazky?correlationId=a9ddbad0-0ccf-44d7-8083-d37e90b27006",
"Z201851798","https://portal.eks.sk/SpravaZakaziek/Zakazky/Detail/214723","zrušená","§ 110 ZVO","§ 7 ods. 1 písm. a)","Ministerstvo vnútra Slovenskej republiky","00151866","Slovenská republika","Bratislava","81272","Pribinova 2","23.11.2018 13:51:32","","Softvér pre expertízne činnosti","","","","","","Technické vlastnosti: Funkcie:, Hodnota / charakteristika: možnosť skúmania min. 750 typov artefaktov v oper. systémoch Windows, MAC, iOS a Android, možnosť vytvoriť si vlastné definície artefaktov, podpora photoDNA, integrovaný dešifrovací modul; Technické vlastnosti: Funkcie:, Hodnota / charakteristika: modul na automat. rozpoznávanie obsahu chatovej komunikácie, analýza a obnova viac ako 1000 artefaktov, možnosť vytvárania a zdieľania prenosných prípadov, ktoré obsahujú databázu nájdených artefaktov; Technické vlastnosti: Podpora:, Hodnota / charakteristika: 3 roky, priebežné aktualizácie softvéru","Technické vlastnosti: Forenzný softvér na skúmanie pamäťových médií - typ 3, Jednotka: ks, Minimum: , Maximum: , Presná hodnota: 6","Slovenská republika","","","","","","","11.1.2019 15:00:00","súbor položiek zákazky","1,0000","102988,800","Kúpna zmluva","False","Cena s DPH","3.12.2018 10:00:00","422","","0","0","3.12.2018 10:15:00","20","2","https://portal.eks.sk/Zakazky/StiahniZmluvnuPrilohuZakazky?correlationId=377dd624-a4cc-497e-81fd-f5683f59dfed","","","","https://portal.eks.sk/Zakazky/StiahniZmluvnuPrilohuZakazky?correlationId=e7ca79c9-92aa-48ab-bdb0-d98c2b68e9c0","https://portal.eks.sk/Zakazky/StiahniZmluvnuPrilohuZakazky?correlationId=d9a9253b-cbbe-4baf-a84e-97e3f5a202d1","https://portal.eks.sk/Zakazky/StiahniZmluvnuPrilohuZakazky?correlationId=cf71d0c8-e548-4e07-8efd-102e0edf54d7","https://portal.eks.sk/Zakazky/StiahniZmluvnuPrilohuZakazky?correlationId=a9ddbad0-0ccf-44d7-8083-d37e90b27006",
"Z201851798","https://portal.eks.sk/SpravaZakaziek/Zakazky/Detail/214723","zrušená","§ 110 ZVO","§ 7 ods. 1 písm. a)","Ministerstvo vnútra Slovenskej republiky","00151866","Slovenská republika","Bratislava","81272","Pribinova 2","23.11.2018 13:51:32","","Softvér pre expertízne činnosti","","","","","","Technické vlastnosti: Funkcie:, Hodnota / charakteristika: možnosť pripojenia na vSphere, ESXi, možnosť tvorby snapshot, príkazový riadok vmrun a VIX; Technické vlastnosti: Podpora pre operačné systémy:, Hodnota / charakteristika: Windows 10, Kali Linux, Windows Server 2016; Technické vlastnosti: Kompatibilita:, Hodnota / charakteristika: min. 200 operačných systémov, podpora pre 3D grafiku s DX10 and OpenGL 3.3, podpora pre 4K monitory, podpora pre 16 jadrové proceory, do 8 TB disky, 64 GB Ram, 2 GB video Ram; Technické vlastnosti: Podpora:, Hodnota / charakteristika: 3 roky, priebežné aktualizácie softvéru","Technické vlastnosti: Virtualizačný softvér, Jednotka: ks, Minimum: , Maximum: , Presná hodnota: 3","Slovenská republika","","","","","","","11.1.2019 15:00:00","súbor položiek zákazky","1,0000","102988,800","Kúpna zmluva","False","Cena s DPH","3.12.2018 10:00:00","422","","0","0","3.12.2018 10:15:00","20","2","https://portal.eks.sk/Zakazky/StiahniZmluvnuPrilohuZakazky?correlationId=377dd624-a4cc-497e-81fd-f5683f59dfed","","","","https://portal.eks.sk/Zakazky/StiahniZmluvnuPrilohuZakazky?correlationId=e7ca79c9-92aa-48ab-bdb0-d98c2b68e9c0","https://portal.eks.sk/Zakazky/StiahniZmluvnuPrilohuZakazky?correlationId=d9a9253b-cbbe-4baf-a84e-97e3f5a202d1","https://portal.eks.sk/Zakazky/StiahniZmluvnuPrilohuZakazky?correlationId=cf71d0c8-e548-4e07-8efd-102e0edf54d7","https://portal.eks.sk/Zakazky/StiahniZmluvnuPrilohuZakazky?correlationId=a9ddbad0-0ccf-44d7-8083-d37e90b27006",
"Z201851798","https://portal.eks.sk/SpravaZakaziek/Zakazky/Detail/214723","zrušená","§ 110 ZVO","§ 7 ods. 1 písm. a)","Ministerstvo vnútra Slovenskej republiky","00151866","Slovenská republika","Bratislava","81272","Pribinova 2","23.11.2018 13:51:32","","Softvér pre expertízne činnosti","","","","","","Technické vlastnosti: Typ:, Hodnota / charakteristika: fotogrametrický softvér z oblasti digitálnej fotogrametrie, merania z digitálnych snímok a videa; Technické vlastnosti: Funkcie:, Hodnota / charakteristika: kalibrácia digitálnych kamier automaticky na snímkach pomocou automaticky nájdených prirodzených identických bodov, spracovanie meraní z digitálnych snímok a videa; Technické vlastnosti: Funkcie:, Hodnota / charakteristika: vyhodnotenie jendosnímkovej a viacsnímkovej fotogrametrie, kalibrácia v teréne aj v laboratóriu; Technické vlastnosti: Podpora pre operačné systémy:, Hodnota / charakteristika: Windows 10; Technické vlastnosti: Podpora:, Hodnota / charakteristika: 3 roky","Technické vlastnosti: Softvér na vyhodnotenie, analýzu a špeciálne merania vykonávané na digitálnych snímkach, Jednotka: ks, Minimum: , Maximum: , Presná hodnota: 1","Slovenská republika","","","","","","","11.1.2019 15:00:00","súbor položiek zákazky","1,0000","102988,800","Kúpna zmluva","False","Cena s DPH","3.12.2018 10:00:00","422","","0","0","3.12.2018 10:15:00","20","2","https://portal.eks.sk/Zakazky/StiahniZmluvnuPrilohuZakazky?correlationId=377dd624-a4cc-497e-81fd-f5683f59dfed","","","","https://portal.eks.sk/Zakazky/StiahniZmluvnuPrilohuZakazky?correlationId=e7ca79c9-92aa-48ab-bdb0-d98c2b68e9c0","https://portal.eks.sk/Zakazky/StiahniZmluvnuPrilohuZakazky?correlationId=d9a9253b-cbbe-4baf-a84e-97e3f5a202d1","https://portal.eks.sk/Zakazky/StiahniZmluvnuPrilohuZakazky?correlationId=cf71d0c8-e548-4e07-8efd-102e0edf54d7","https://portal.eks.sk/Zakazky/StiahniZmluvnuPrilohuZakazky?correlationId=a9ddbad0-0ccf-44d7-8083-d37e90b27006",
