"Z20206620","https://portal.eks.sk/SpravaZakaziek/Zakazky/Detail/266029","zazmluvnená","§ 117 a § 110 ZVO","§ 9","Dopravný podnik mesta Košice, akciová spoločnosť","31701914","Slovenská republika","Košice","04329","Bardejovská 6","30.3.2020 10:15:35","2.4.2020 14:46:00","Náhradné diely na autobusy Sor NB12,NB18 - Hnacie ústrojenstvo","Náhradné diely, autobus,Sor NB12,NB18,hnacie ústrojenstvo","34913000-0 Rôzne náhradné diely; 60000000-8 Dopravné služby (bez prepravy odpadu)","Tovar","","Nákup náhradných dielov na autobusy Sor NB12,NB18 za účelom výmeny poškodených alebo opotrebovaných dielov za nové","","Technické vlastnosti: Filter oleja motora 57,67 malý WK950/26  992992242, Jednotka: ks, Minimum: , Maximum: , Presná hodnota: 10; Technické vlastnosti: Sada filtrov vymeníka 57,67 2992447  992992447, Jednotka: ks, Minimum: , Maximum: , Presná hodnota: 10; Technické vlastnosti: Tesnenie hlavy valcov 1,25mm 994898850, Jednotka: ks, Minimum: , Maximum: , Presná hodnota: 2; Technické vlastnosti: Tesnenie O-kružok 20,8 994890926, Jednotka: ks, Minimum: , Maximum: , Presná hodnota: 12; Technické vlastnosti: Tesnenie výfuku 992830444, Jednotka: ks, Minimum: , Maximum: , Presná hodnota: 6; Technické vlastnosti: Tesnenie O-kružok 994890929, Jednotka: ks, Minimum: , Maximum: , Presná hodnota: 6; Technické vlastnosti: Tesnenie O-kružok 504085882 99504085882, Jednotka: ks, Minimum: , Maximum: , Presná hodnota: 4; Technické vlastnosti: Potrubie NB12 053 029 výfuk 55797053029, Jednotka: ks, Minimum: , Maximum: , Presná hodnota: 3; Technické vlastnosti: Ložisko valivé 6306  2RS predloha 99797032080008, Jednotka: ks, Minimum: , Maximum: , Presná hodnota: 20; Technické vlastnosti: Filter oleja motora 57,67 malý WK950/26 992992242, Jednotka: ks, Minimum: , Maximum: , Presná hodnota: 10; Technické vlastnosti: Sada filtrov vymeníka 57,67 2992447 992992447, Jednotka: ks, Minimum: , Maximum: , Presná hodnota: 10; Technické vlastnosti: Filter vzduchu 4591057174  994591057174, Jednotka: ks, Minimum: , Maximum: , Presná hodnota: 20; Technické vlastnosti: Silentblok Iveco pre 6 valcový motor 99500394053, Jednotka: ks, Minimum: , Maximum: , Presná hodnota: 7","Slovenská republika","Košický","Košice","Košice","Hornádska 10","","","9.4.2020 8:00:00","ks","120,0000","3500,000","Kúpna zmluva","False","Cena bez DPH","2.4.2020 14:00:00","220","3495,000","2","17","2.4.2020 14:15:00","20","2","https://portal.eks.sk/Zakazky/StiahniZmluvnuPrilohuZakazky?correlationId=ef08699b-33ba-447d-b8b0-a1bb8266a199","https://portal.eks.sk/Zakazky/StiahniZmluvnuPrilohuZakazky?correlationId=11cf7e63-30f3-4a54-a071-1d490a30ade4","https://portal.eks.sk/Zakazky/StiahniZmluvnuPrilohuZakazky?correlationId=f3764305-2433-4807-80db-a258df141e4a","https://portal.eks.sk/Zakazky/StiahniZmluvnuPrilohuZakazky?correlationId=2596103b-8797-423a-9c6b-efd559b8f058","https://portal.eks.sk/Zakazky/StiahniZmluvnuPrilohuZakazky?correlationId=82c31cbc-333c-4629-96c5-6a18c3a053d4","https://portal.eks.sk/Zakazky/StiahniZmluvnuPrilohuZakazky?correlationId=a12d3fce-c1d2-4a13-984f-330db7d0ca7b","https://portal.eks.sk/Zakazky/StiahniZmluvnuPrilohuZakazky?correlationId=c5139c57-88df-4b39-b821-0432cd0539cc","https://portal.eks.sk/Zakazky/StiahniZmluvnuPrilohuZakazky?correlationId=71e6eb0e-2f5a-40d5-8a4a-9a3c6763ff78",
"Z20206622","https://portal.eks.sk/SpravaZakaziek/Zakazky/Detail/266031","zazmluvnená","§ 117 a § 110 ZVO","§ 7 ods. 1 písm. b) ","Mesto Senec","00305065","Slovenská republika","Senec","90301","Mierové námestie 8","30.3.2020 10:20:44","2.4.2020 12:38:00","Hygienické pomôcky a čistiace potreby","čistiace prostriedky na podlahu, WC, riady, tekuté mydlá, hubky na riad, vrecia do koša","39830000-9 Čistiace výrobky; 39831300-9 Čistiace prostriedky na podlahu; 39832100-4 Čistiaci prášok na riad; 39831600-2 Čistiace prostriedky na toalety; 33771000-5 Hygienické výrobky z papiera; 33770000-8 Papierové hygienické výrobky; 39831210-1 Saponáty na umývanie riadu; 39831200-8 Saponáty; 60000000-8 Dopravné služby (bez prepravy odpadu)","Tovar; Služba","","Hygienické potreby a čistiace prostriedky na zabezpečenie hygieny a čistoty","Technické vlastnosti: 4. Rukavice jednorázové NIE vinylové, biele (100 ks v bal. ), Hodnota / charakteristika: Mka 35, Lka 45","Technické vlastnosti: 1. Jar, prostriedok na riad 450 ml, lemon, Jednotka: ks, Minimum: , Maximum: , Presná hodnota: 4; Technické vlastnosti: 2. Osviežovač vzduchu Air Wick sprej 240ml, Jednotka: ks, Minimum: , Maximum: , Presná hodnota: 5; Technické vlastnosti: 3. Dettol antibakteriálne tekuté mydlo na ruky s pumpičkou 250 ml, Jednotka: ks, Minimum: , Maximum: , Presná hodnota: 70; Technické vlastnosti: 4. Rukavice jednorázové NIE vinylové, biele (100 ks v bal. ), Jednotka: bal., Minimum: , Maximum: , Presná hodnota: 80; Technické vlastnosti: 5. Tekuté mydlo na ruky s dávkovačom  0,5l, Jednotka: ks, Minimum: , Maximum: , Presná hodnota: 5; Technické vlastnosti: 6. Drôtenka nerezová na riad (3 ks v bal.), Jednotka: bal.., Minimum: , Maximum: , Presná hodnota: 2; Technické vlastnosti: 7. Savo kúpeľňa 500 ml, s rozprašovačom, Jednotka: ks, Minimum: , Maximum: , Presná hodnota: 9; Technické vlastnosti: 8. Alobal rolka (pevnejší), 10 m, Jednotka: ks, Minimum: , Maximum: , Presná hodnota: 10; Technické vlastnosti: 9. Jar, prostriedok na riad 0,900 ml., Jednotka: ks, Minimum: , Maximum: , Presná hodnota: 27; Technické vlastnosti: 10. Ajax, čistič na podlahy 1l., Jednotka: ks, Minimum: , Maximum: , Presná hodnota: 10; Technické vlastnosti: 11. Sanytol univerzálny dezinfekčný čistič na podlahy 1L, Jednotka: ks, Minimum: , Maximum: , Presná hodnota: 47; Technické vlastnosti: 12. Toaletný papier Katrin Classic, 2 vrst., 200 útržkový, biely (8 ks v bal.), Jednotka: bal., Minimum: , Maximum: , Presná hodnota: 35; Technické vlastnosti: 13. Ambi pur Gel Crystal 150g, Eukalyptus & Lime, Jednotka: ks, Minimum: , Maximum: , Presná hodnota: 14; Technické vlastnosti: 14. Potravinárska fólia 29 cm x 20m, Jednotka: ks, Minimum: , Maximum: , Presná hodnota: 5; Technické vlastnosti: 15. Alpa francovka modrá 60 ml, Jednotka: ks, Minimum: , Maximum: , Presná hodnota: 10; Technické vlastnosti: 16. Persil tekutý gel na biele prádlo 1,5 L, Jednotka: ks, Minimum: , Maximum: , Presná hodnota: 5; Technické vlastnosti: 17. Domestos 24H Plus 750 ml zelený, Jednotka: ks, Minimum: , Maximum: , Presná hodnota: 25; Technické vlastnosti: 18. Špongia na riad stredná (5ks v bal. ), Jednotka: bal., Minimum: , Maximum: , Presná hodnota: 2; Technické vlastnosti: 19. Tekuté mydlo náhradná náplň 5L, Jednotka: ks, Minimum: , Maximum: , Presná hodnota: 9; Technické vlastnosti: 20. Toaletný papier Tento Economy  2vrs, 68 m (24 ks v bal.), Jednotka: bal., Minimum: , Maximum: , Presná hodnota: 1; Technické vlastnosti: 22. Savo Perex 1L, Jednotka: ks, Minimum: , Maximum: , Presná hodnota: 10; Technické vlastnosti: 22. Pewoll Brilliant Color, tekutý prací prostriedok na farebné oblečenie 3L, Jednotka: ks, Minimum: , Maximum: , Presná hodnota: 3; Technické vlastnosti: 23. Sanytol dezinfekcia na bielizeň 1 L, Jednotka: ks, Minimum: , Maximum: , Presná hodnota: 11; Technické vlastnosti: 24. Well done odmasťovač za studena 750 ml, Jednotka: ks, Minimum: , Maximum: , Presná hodnota: 10; Technické vlastnosti: 25. Kuchynské utierky papierové v roliach  (2ks v bal.) trojvrstvové, Jednotka: bal., Minimum: , Maximum: , Presná hodnota: 45; Technické vlastnosti: 26. Náhradná hlavica Mop strapcový  180g , dĺžka 24 cm, Jednotka: ks, Minimum: , Maximum: , Presná hodnota: 6; Technické vlastnosti: 27. Fixinela 500 ml, tekutý čistič s antibak.účinkami, Jednotka: ks, Minimum: , Maximum: , Presná hodnota: 12; Technické vlastnosti: 30. Pronto čistiaci prostriedok na nábytok v spreji 250ml, Jednotka: ks, Minimum: , Maximum: , Presná hodnota: 3; Technické vlastnosti: 29. Utierka švédska univerzálna, mikrovlákno  30x35 cm, Jednotka: ks, Minimum: , Maximum: , Presná hodnota: 10; Technické vlastnosti: 30. Cif tekutý, krémový 700 ml, Jednotka: ks, Minimum: , Maximum: , Presná hodnota: 15; Technické vlastnosti: 31. Krystal na okná 750 ml, Jednotka: ks, Minimum: , Maximum: , Presná hodnota: 6; Technické vlastnosti: 32. Viacúčelové  utierky, farebné  (3ks v bal.), Jednotka: bal., Minimum: , Maximum: , Presná hodnota: 29; Technické vlastnosti: 33. Prášok na pranie, color  6kg, Jednotka: ks, Minimum: , Maximum: , Presná hodnota: 1; Technické vlastnosti: 34. Rukavice gumené M-ka, Jednotka: ks, Minimum: , Maximum: , Presná hodnota: 6; Technické vlastnosti: 35. Antibakteriálny gél na ruky 50 ml, Jednotka: ks, Minimum: , Maximum: , Presná hodnota: 10; Technické vlastnosti: 36. Kozmetické vreckovky - vyťahovacie 2 vrst., (100 ks v bal.), Jednotka: bal., Minimum: , Maximum: , Presná hodnota: 2; Technické vlastnosti: 37. Čistiaci mop + vedro 15 l, Jednotka: ks, Minimum: , Maximum: , Presná hodnota: 1; Technické vlastnosti: 38. Vrecia na odpad 110l, rozmer 70x110 (25ks v bal.) čierne, Jednotka: bal., Minimum: , Maximum: , Presná hodnota: 10; Technické vlastnosti: 39. Papierové servítky biely, 2 vrstvové , rozm. 17x17 cm (100 ks v bal.), Jednotka: bal., Minimum: , Maximum: , Presná hodnota: 11; Technické vlastnosti: 40. Vrecia na odpad 60l, rozmer 60x70 (20ks v bal.) čierne, Jednotka: bal., Minimum: , Maximum: , Presná hodnota: 10; Technické vlastnosti: 41. Náhradný návlek na profi mop (mikrovlákno kapsa 45 x 17 cm), Jednotka: ks, Minimum: , Maximum: , Presná hodnota: 5; Technické vlastnosti: 42. Indulona modrá , krém na ruky 100g, Jednotka: ks, Minimum: , Maximum: , Presná hodnota: 10; Technické vlastnosti: 43. Pulirapid, tekutý čistič s vôňou, 750ml, Jednotka: ks, Minimum: , Maximum: , Presná hodnota: 10; Technické vlastnosti: 44. Skladané sáčky čiré 14x8x32 cm, (1000 ks v bal.), Jednotka: bal., Minimum: , Maximum: , Presná hodnota: 20; Technické vlastnosti: 45. Savo originál 1l, Jednotka: ks, Minimum: , Maximum: , Presná hodnota: 28; Technické vlastnosti: 46. Sanytol univerzálny čistič, s rozprašovačom 500 ml, Jednotka: ks, Minimum: , Maximum: , Presná hodnota: 42; Technické vlastnosti: 47. Palmolive Naturals Moisture Care Tuhé mydlo 90g, Jednotka: ks, Minimum: , Maximum: , Presná hodnota: 10; Technické vlastnosti: 48. Sanytol Dezinfekcia 2v1 Univerzálný Čistič Spray 400 ml, Jednotka: ks, Minimum: , Maximum: , Presná hodnota: 15; Technické vlastnosti: 49. Papier na pečenie, rolka 38cm široká, dĺžka 8m, Jednotka: ks, Minimum: , Maximum: , Presná hodnota: 10","Slovenská republika","Bratislavský","Senec","Senec","Mierové námestie 8","","","15.4.2020 14:00:00","položky","49,0000","2200,000","Kúpna zmluva","False","Cena s DPH","2.4.2020 12:00:00","512","2200,000","2","3","2.4.2020 12:15:00","20","2","https://portal.eks.sk/Zakazky/StiahniZmluvnuPrilohuZakazky?correlationId=1a31c92d-2ed5-4330-97f5-b3cd675ba0ae","https://portal.eks.sk/Zakazky/StiahniZmluvnuPrilohuZakazky?correlationId=6c3aa56b-bba0-4644-be6d-4b4071d6c321","https://portal.eks.sk/Zakazky/StiahniZmluvnuPrilohuZakazky?correlationId=1977b7dc-0ad2-4fef-8698-27494891bd2b","https://portal.eks.sk/Zakazky/StiahniZmluvnuPrilohuZakazky?correlationId=47abce89-1722-4c6d-82f4-672cf4f90e44","https://portal.eks.sk/Zakazky/StiahniZmluvnuPrilohuZakazky?correlationId=05d1ef5d-cc33-46ce-9f85-cfab7f6d42cc","https://portal.eks.sk/Zakazky/StiahniZmluvnuPrilohuZakazky?correlationId=3a69d5ae-080e-402d-8bc8-660442342c42","https://portal.eks.sk/Zakazky/StiahniZmluvnuPrilohuZakazky?correlationId=fd2b6db0-23be-445f-89ef-7eb7b921080f","https://portal.eks.sk/Zakazky/StiahniZmluvnuPrilohuZakazky?correlationId=50c1c319-a93b-46b6-9d3d-adbf0bbcf751",
"Z20206633","https://portal.eks.sk/SpravaZakaziek/Zakazky/Detail/266042","zazmluvnená","§ 110 ZVO","§ 7 ods. 1 písm. d)","Technická univerzita vo Zvolene","00397440","Slovenská republika","Zvolen","96053","T. G. Masaryka 24","30.3.2020 10:50:25","2.4.2020 11:46:01","Ochranné rúško - bavlnené (dvojvrstvové)","rúško, bavlnené","18100000-0 Pracovné odevy, špeciálne pracovné odevy a doplnky; 60000000-8 Dopravné služby (bez prepravy odpadu)","Tovar; Služba","","","Technické vlastnosti: Dvojvrstvové ochranné rúško vyrobené zo 100% bavlny., Hodnota / charakteristika: ; Technické vlastnosti: Určené na viacnásobné použitie. Môže sa prať na min. 60 stupňovCelzia a žehliť pri vysokých teplotách., Hodnota / charakteristika: ; Technické vlastnosti: Zdravotne a hygienicky nezávadné v súlade s STN 80 0055 a OEKO TEX Stanadart 100., Hodnota / charakteristika: ; Technické vlastnosti: Uchytenie na gumu, ktorá sa dá v prípade potreby vymeniť., Hodnota / charakteristika: ; Technické vlastnosti: Rozmer: 24 cm  x 8,5 (tolerancia +/- 0,5 cm), Hodnota / charakteristika: ","","Slovenská republika","Banskobystrický","Zvolen","Zvolen","T. G. Masaryka 24","6.4.2020 7:00:00","8.4.2020 15:00:00","","ks","200,0000","840,000","Kúpna zmluva","False","Cena s DPH","2.4.2020 11:00:00","189","840,000","12","36","2.4.2020 11:15:00","20","2","https://portal.eks.sk/Zakazky/StiahniZmluvnuPrilohuZakazky?correlationId=239a68cf-9ba9-472f-9fe1-3e389ac067bf","https://portal.eks.sk/Zakazky/StiahniZmluvnuPrilohuZakazky?correlationId=9f867bd4-6ed0-4610-82dc-33757d71e02c","https://portal.eks.sk/Zakazky/StiahniZmluvnuPrilohuZakazky?correlationId=7d6eb3a5-853a-4e4c-9505-6c2afb0d229a","https://portal.eks.sk/Zakazky/StiahniZmluvnuPrilohuZakazky?correlationId=76ad400a-ddd8-44fc-9afe-680ac8871aed","https://portal.eks.sk/Zakazky/StiahniZmluvnuPrilohuZakazky?correlationId=dc33ac76-9c1f-440f-b146-dbaade588db8","https://portal.eks.sk/Zakazky/StiahniZmluvnuPrilohuZakazky?correlationId=c62761bc-eadf-49e6-bcb9-bccddba33a14","https://portal.eks.sk/Zakazky/StiahniZmluvnuPrilohuZakazky?correlationId=b343e0d8-02f6-45cf-ab0f-ce5235cb4b9b","https://portal.eks.sk/Zakazky/StiahniZmluvnuPrilohuZakazky?correlationId=bb05f575-9976-4a20-9826-9e408f3c151e",
"Z20206641","https://portal.eks.sk/SpravaZakaziek/Zakazky/Detail/266050","zazmluvnená","§ 117 a § 110 ZVO","§ 7 ods. 1 písm. a)","Ústav na výkon väzby a Ústav na výkon trestu odňatia slobody","00738409","Slovenská republika","Prešov","08113","Kpt. Nálepku 1","30.3.2020 11:33:19","2.4.2020 13:32:00","Spracovaná zelenina a ovocie, džemy a marmeláda","Spracovaná zelenina a ovocie, džemy a marmeláda, kompót, šalát","15332400-8 Konzervované ovocie; 15331460-9 Konzervovaná zelenina; 15332200-6 Džemy a marmelády, ovocné želé; ovocné alebo orechové pyré a pasty/pretlaky; 60000000-8 Dopravné služby (bez prepravy odpadu)","Tovar; Služba","","Spracovaná ( konzervovaná ) zelenina a ovocie, džemy a marmeláda pre kuchyňu","","Technické vlastnosti: Paradajkový pretlak, 3500g/1ks, Jednotka: ks, Minimum: , Maximum: 460, Presná hodnota: ; Technické vlastnosti: Paradajkový pretlak, 700g/1ks, Jednotka: ks, Minimum: , Maximum: 200, Presná hodnota: ; Technické vlastnosti: Uhorky sterilizované 3500g/1ks, Jednotka: ks, Minimum: , Maximum: 350, Presná hodnota: ; Technické vlastnosti: Uhorky sterilizované 700g/1ks, Jednotka: ks, Minimum: , Maximum: 100, Presná hodnota: ; Technické vlastnosti: Šalát sterilizovaný 3500g/1ks, Jednotka: ks, Minimum: , Maximum: 220, Presná hodnota: ; Technické vlastnosti: Šalát sterilizovaný 700g/1ks, Jednotka: ks, Minimum: , Maximum: 100, Presná hodnota: ; Technické vlastnosti: Červená repa 3500g/1ks, Jednotka: ks, Minimum: , Maximum: 250, Presná hodnota: ; Technické vlastnosti: Červená repa 700g/1ks, Jednotka: ks, Minimum: , Maximum: 80, Presná hodnota: ; Technické vlastnosti: Chren sterilizovaný 700g/1ks, Jednotka: ks, Minimum: , Maximum: 45, Presná hodnota: ; Technické vlastnosti: Paprika sterilizovaná - kapia 700g/1ks, Jednotka: ks, Minimum: , Maximum: 60, Presná hodnota: ; Technické vlastnosti: Hrášok sterilizovaný 700g/1ks, Jednotka: ks, Minimum: , Maximum: 130, Presná hodnota: ; Technické vlastnosti: Kukurica sterilizovaná 425g/1ks, Jednotka: ks, Minimum: , Maximum: 80, Presná hodnota: ; Technické vlastnosti: Šampiňóny sterilizované, 425g/1ks, Jednotka: ks, Minimum: , Maximum: 130, Presná hodnota: ; Technické vlastnosti: Marmeláda, (minimálny podiel ovocia 60%) 12kg/1ks, Jednotka: ks, Minimum: , Maximum: 20, Presná hodnota: ; Technické vlastnosti: Slivkový lekvár sladený (minimálny podiel ovocia 60%) 7kg/1ks, Jednotka: ks, Minimum: , Maximum: 46, Presná hodnota: ; Technické vlastnosti: Džemy, rôzne druhy, (minimálny podiel ovocia 60%) 4kg/1ks, Jednotka: ks, Minimum: , Maximum: 55, Presná hodnota: ; Technické vlastnosti: Džemy porciované, rôzne druhy, (minimálny podiel ovocia 60%) 20g/1ks, Jednotka: ks, Minimum: , Maximum: 6500, Presná hodnota: ; Technické vlastnosti: Džemy porciované, rôzne druhy, (minimálny podiel ovocia 60%) Dia 20g/1ks, Jednotka: ks, Minimum: , Maximum: 600, Presná hodnota: ; Technické vlastnosti: Kompót slivkový, 3500g/1ks, Jednotka: ks, Minimum: , Maximum: 75, Presná hodnota: ; Technické vlastnosti: Kompót jablkový, 3500g/1ks, Jednotka: ks, Minimum: , Maximum: 50, Presná hodnota: ; Technické vlastnosti: Kompót hruškový, 3500g/1ks, Jednotka: ks, Minimum: , Maximum: 45, Presná hodnota: ; Technické vlastnosti: Kompót čerešňový, 3500g/1ks, Jednotka: ks, Minimum: , Maximum: 45, Presná hodnota: ; Technické vlastnosti: Kompót višňový, 3500g/1ks, Jednotka: ks, Minimum: , Maximum: 45, Presná hodnota: ; Technické vlastnosti: Kompót broskyňový, 3500g/1ks, Jednotka: ks, Minimum: , Maximum: 40, Presná hodnota: ; Technické vlastnosti: Kompót marhuľový, 3500g/1ks, Jednotka: ks, Minimum: , Maximum: 25, Presná hodnota: ; Technické vlastnosti: Kompót miešaný, 3000g/1ks, Jednotka: ks, Minimum: , Maximum: 20, Presná hodnota: ; Technické vlastnosti: Kompót čerešňový Dia, 700g/1ks, Jednotka: ks, Minimum: , Maximum: 70, Presná hodnota: ; Technické vlastnosti: Kompót slivkový Dia, 700g/1ks, Jednotka: ks, Minimum: , Maximum: 40, Presná hodnota: ; Technické vlastnosti: Detská výživa jablková 100 g ( plastový téglik ), Jednotka: ks, Minimum: , Maximum: 2000, Presná hodnota: ","Slovenská republika","Prešovský","","","","","","","podľa technickej špecifikácie predmetu zákazky","1,0000","11502,000","Rámcová dohoda","False","Cena s DPH","2.4.2020 12:00:00","132","11502,000","3","96","2.4.2020 12:15:00","20","2","https://portal.eks.sk/Zakazky/StiahniZmluvnuPrilohuZakazky?correlationId=714ccb0f-1bbf-4c12-b869-0b80788d7210","https://portal.eks.sk/Zakazky/StiahniZmluvnuPrilohuZakazky?correlationId=db57761a-907c-4a61-a209-341d457c3d98","https://portal.eks.sk/Zakazky/StiahniZmluvnuPrilohuZakazky?correlationId=7c7acd82-1ac7-4a3a-9a34-1f14686db411","https://portal.eks.sk/Zakazky/StiahniZmluvnuPrilohuZakazky?correlationId=d41fe3d6-a572-45fc-b435-8562545f9eda","https://portal.eks.sk/Zakazky/StiahniZmluvnuPrilohuZakazky?correlationId=5eb4dfd7-a33c-4f78-8117-0611cb00c9a4","https://portal.eks.sk/Zakazky/StiahniZmluvnuPrilohuZakazky?correlationId=93b49dbe-a613-4e02-8d12-e4afdef758d6","https://portal.eks.sk/Zakazky/StiahniZmluvnuPrilohuZakazky?correlationId=3439fe38-8f4c-45c0-84ef-a761ca21cb5d","https://portal.eks.sk/Zakazky/StiahniZmluvnuPrilohuZakazky?correlationId=579dffa9-3d46-4a54-b4db-a17499e4ab7a",
"Z20206592","https://portal.eks.sk/SpravaZakaziek/Zakazky/Detail/266001","zazmluvnená","§ 110 ZVO","§ 7 ods. 1 písm. a)","Nemocnica pre obvinených a odsúdených a Ústav na výkon trestu odňatia slobody","00738301","Slovenská republika","Trenčín","91196","Súdna 15","30.3.2020 11:47:24","2.4.2020 12:54:00","Mlieko a mliečne výrobky","mlieko¸ mliečne výrobky¸ jogurt¸ maslo¸ syr¸ tvaroh","15551300-8 Jogurt; 15551310-1 Neochutený jogurt; 15551320-4 Ochutený jogurt; 15511000-3 Mlieko; 15511400-7 Polotučné mlieko; 60000000-8 Dopravné služby (bez prepravy odpadu)","Tovar; Služba","","Tovar bude použitý pri príprave jedál ako potravina pre zariadenia spoločného stravovania, ako aj potravina určená na priamy konzum a kuchynskú úpravu.","","Technické vlastnosti: Mlieko trvanlivé kravské¸ balené tetrapak¸ polotučné ¸ 1 l¸ 1¸5 %, Jednotka: liter, Minimum: , Maximum: 10 400, Presná hodnota: ; Technické vlastnosti: Smotana kyslá 16 % ¸ balené téglik 200 ml, Jednotka: ks, Minimum: , Maximum: 730, Presná hodnota: ; Technické vlastnosti: Smotana kyslá 24 %¸ balené tetrapak 1 liter, Jednotka: ks, Minimum: , Maximum: 90, Presná hodnota: ; Technické vlastnosti: Smotana 31%¸ balené tetrapak 1 liter, Jednotka: ks, Minimum: , Maximum: 90, Presná hodnota: ; Technické vlastnosti: Šľahačka spray, tuk najmenej 17 %, ošetrené UHT, balenie 250 ml, Jednotka: ks, Minimum: , Maximum: 100, Presná hodnota: ; Technické vlastnosti: Maslo čerstvé , balenie 250 g, tuk najmenej 82 %, Jednotka: ks, Minimum: , Maximum: 1000, Presná hodnota: ; Technické vlastnosti: Minimaslo 20 g, Jednotka: ks, Minimum: , Maximum: 5000, Presná hodnota: ; Technické vlastnosti: Smotana trvanlivá , balenie tetrapak 250 ml, minimálne 30 % tuku, Jednotka: ks, Minimum: , Maximum: 750, Presná hodnota: ; Technické vlastnosti: Acidofilné mlieko, balené téglik,  minimálne 200 gr. , 3,5 % tuku, Jednotka: ks, Minimum: , Maximum: 3230, Presná hodnota: ; Technické vlastnosti: Acidofilné mlieko ochutené, balené tetrapak 330 ml, Jednotka: ks, Minimum: , Maximum: 2030, Presná hodnota: ; Technické vlastnosti: Mliečna ryža, balené tetrapak 200 ml, Jednotka: ks, Minimum: , Maximum: 1020, Presná hodnota: ; Technické vlastnosti: Jogurt biely, tuk najmenej 4,5 %, balenie 150 ml, Jednotka: ks, Minimum: , Maximum: 5560, Presná hodnota: ; Technické vlastnosti: Jogurt smotanový ovocný, ovocná zložka 15 %, tuk 10 %, 150 ml balenie, Jednotka: ks, Minimum: , Maximum: 3560, Presná hodnota: ; Technické vlastnosti: Puding so šľahačkou 200 ml, Jednotka: ks, Minimum: , Maximum: 1320, Presná hodnota: ; Technické vlastnosti: Termix z tvarohu 90 g, 48 % tvarohu, Jednotka: ks, Minimum: , Maximum: 1400, Presná hodnota: ; Technické vlastnosti: Tehla EIDAM, sušina najmenej 40 %, Jednotka: kg, Minimum: , Maximum: 1200, Presná hodnota: ; Technické vlastnosti: Tehla EIDAM údený, sušina najmenej 40 %, Jednotka: kg, Minimum: , Maximum: 250, Presná hodnota: ; Technické vlastnosti: Tehla EIDAM plátky, balený minimálne 100 g, Jednotka: ks, Minimum: , Maximum: 2000, Presná hodnota: ; Technické vlastnosti: Bryndza plnotučná, balenie minimálne 125 g, množstvo ovčej zložky min . 50 % hmotnosti zo sušiny výrobku, tuk v sušine min. 48 %, sušina min. 44 %, Jednotka: kg, Minimum: , Maximum: 200, Presná hodnota: ; Technické vlastnosti: Tvaroh hrudkovitý , balenie 250 g, Jednotka: ks, Minimum: , Maximum: 2130, Presná hodnota: ; Technické vlastnosti: Tavený syr ( 8 ks v balení), minimálne 140 g, Jednotka: bal., Minimum: , Maximum: 2700, Presná hodnota: ; Technické vlastnosti: Tavený syr (3 ks v balení), minimálne 141 g, Jednotka: bal., Minimum: , Maximum: 1400, Presná hodnota: ; Technické vlastnosti: Cottage syr biely, 150 g balenie téglik, Jednotka: ks, Minimum: , Maximum: 1000, Presná hodnota: ; Technické vlastnosti: Mozzarella 125 g, Jednotka: ks, Minimum: , Maximum: 2320, Presná hodnota: ; Technické vlastnosti: Syr s bielou plesňou 80 g, Jednotka: ks, Minimum: , Maximum: 100, Presná hodnota: ; Technické vlastnosti: Niva plesnivý syr originál, Jednotka: kg, Minimum: , Maximum: 70, Presná hodnota: ; Technické vlastnosti: Syr balkánsky, balenie 200 g, Jednotka: ks, Minimum: , Maximum: 150, Presná hodnota: ; Technické vlastnosti: Syr balkánsky, balenie 1,25 kg, Jednotka: ks, Minimum: , Maximum: 10, Presná hodnota: ; Technické vlastnosti: Syr tavený črievko 1000 g, Jednotka: kg, Minimum: , Maximum: 20, Presná hodnota: ; Technické vlastnosti: Parmezán 100 g, Jednotka: ks, Minimum: , Maximum: 280, Presná hodnota: ; Technické vlastnosti: Syr s bielou plesňou 120 g, Jednotka: ks, Minimum: , Maximum: 1750, Presná hodnota: ; Technické vlastnosti: Tavený syr črievko, minimálne 140 g, tuk v sušine 50 %, Jednotka: ks, Minimum: , Maximum: 2050, Presná hodnota: ","Slovenská republika","Trenčiansky","Trenčín","Trenčín","Súdna 15/ Omšenie 828","","","","celok","1,0000","35881,000","Rámcová dohoda","False","Cena s DPH","2.4.2020 12:00:00","121","35881,000","4","77","2.4.2020 12:15:00","20","2","https://portal.eks.sk/Zakazky/StiahniZmluvnuPrilohuZakazky?correlationId=9c3e034b-7e1d-4911-9e06-0e4a7bed0b6b","https://portal.eks.sk/Zakazky/StiahniZmluvnuPrilohuZakazky?correlationId=06abea3a-0cc1-499a-ac25-528544587b64","https://portal.eks.sk/Zakazky/StiahniZmluvnuPrilohuZakazky?correlationId=b31dfb4f-9183-4cf4-8a5f-f3ef5fdb6efc","https://portal.eks.sk/Zakazky/StiahniZmluvnuPrilohuZakazky?correlationId=a1fbbeda-25c0-459a-adfb-30e176810e40","https://portal.eks.sk/Zakazky/StiahniZmluvnuPrilohuZakazky?correlationId=7f64651e-0892-41cd-8ba3-cdd03082adf6","https://portal.eks.sk/Zakazky/StiahniZmluvnuPrilohuZakazky?correlationId=ba68251f-223c-4c29-9052-05188cb11cc5","https://portal.eks.sk/Zakazky/StiahniZmluvnuPrilohuZakazky?correlationId=96b81fa7-b0b4-48da-9fe7-bf5e28541388","https://portal.eks.sk/Zakazky/StiahniZmluvnuPrilohuZakazky?correlationId=b31b4edc-9e96-4395-86d4-5f0cb2d0d18d",
