"IdentifikatorZakazky","ZakazkaUrl","StavZakazky","PouzityPostup","ObjednavatelDruh","ObjednavatelObchodneMeno","ObjednavatelICO","ObjednavatelStat","ObjednavatelObec","ObjednavatelPSC","ObjednavatelUlica","DatumVyhlasenia","DatumZazmluvnenia","OpisnyFormularNazov","OpisnyFormularKlucoveSlova","OpisnyFormularCpv","OpisnyFormularDruh","OpisnyFormularKategoriaSluzieb","OpisnyFormularFunkcnaSpecifikacia","OpisnyFormularTechnickaSpecifikaciaTextova","OpisnyFormularTechnickaSpecifikaciaCiselna","MiestoPlneniaStat","MiestoPlneniaKraj","MiestoPlneniaOkres","MiestoPlneniaObec","MiestoPlneniaUlica","LehotaPlneniaOd","LehotaPlneniaDo","LehotaPlneniaPresne","MnozstvoJednotka","MnozstvoHodnota","MaximalnaVyskaZdrojov","ZmluvnyVztah","FinancovanieEU","HodnotiaceKriterium","LehotaNaPredkladaniePonuk","PocetNotifikovanychDodavatelov","VstupnaCena","PocetSutaziacich","PocetPredlozenychPonuk","ZaciatokAukcie","TrvanieAukcie_Minut","PredlzovanieAukcie_Minut","ProtokolOPriebehuZadavaniaZakazky","Priloha_c1_ZmluvnyFormularZakazky","Priloha_c2_VyslednePoradieDodavatelov","Priloha_c3_Zmluva","Priloha_c4A_ZaznamOSystemovychUdalostiachZakazky","Priloha_c4B_ZaznamOSystemovychUdalostiachElektronickejAukcie","AnonymnyZmluvnyFormularZakazky","ObjednavkovyFormularZakazky",
"Z20206195","https://portal.eks.sk/SpravaZakaziek/Zakazky/Detail/265604","zazmluvnená","§ 117 a § 110 ZVO","§ 7 ods. 1 písm. a)","Základná škola, Krosnianska 4, Košice","35546875","Slovenská republika","Košice","04022","Krosnianska 4","24.3.2020 14:25:48","1.4.2020 9:46:00","Mäso a mäsové výrobky","bravčové mäso, hovädzie mäso, hydina, mäsové výrobky","15100000-9 Živočíšne výrobky, mäso a mäsové výrobky; 15113000-3 Bravčové mäso; 15111100-0 Hovädzie mäso; 15111200-1 Teľacie mäso; 15112000-6 Hydina; 15130000-8 Mäsové výrobky; 60000000-8 Dopravné služby (bez prepravy odpadu)","Tovar; Služba","","Dodávka mäsa a mäsových výrobkov na prípravu jedál do školskej kuchyne.","Technické vlastnosti: Mäso a mäsové výrobky, Hodnota / charakteristika: bez cudzieho zápachu a cudzej príchute, bez krvných podliatín a zbavené prebytočného tuku; Technické vlastnosti: Mäsové výrobky, Hodnota / charakteristika: obsah soli pri mäkkých mäsových výrobkoch musí byť nižší ako 2,5 g/ 100 g výrobku a pri trvanlivých mäsových výrobkoch menej ako 4,0 g/ 100 g výrobku; Technické vlastnosti: Mäso, Hodnota / charakteristika: čerstvé, nie mrazené ani rozmrazené mäso, bez prívlastkov krehčené, šťavnaté, solené, mäsový prípravok","Technické vlastnosti: 1. Hovädzie zadné z mladých býčkov, voľné,  chladené bez kosti, svetločervenej farby, čisto biely tuk, kuchynská úprava, Jednotka: kg, Minimum: , Maximum: 516, Presná hodnota: ; Technické vlastnosti: 2. Teľacie stehno, voľné, chladené bez kosti, bez kože, bez mastných častí, biely tuk, svetločervenej farby, kuchynská úprava, Jednotka: kg, Minimum: , Maximum: 250, Presná hodnota: ; Technické vlastnosti: 3. Hovädzí roštenec z mladých býčkov, voľné, chladené bez kosti, chudé do 3 % tuku, svetločervenej farby, kuchynská úprava, Jednotka: kg, Minimum: , Maximum: 365, Presná hodnota: ; Technické vlastnosti: 4. Hovädzie predné krk, voľné, chladené bez kosti, svetločervenej farby, čisto biely tuk, kuchynská úrava, Jednotka: kg, Minimum: , Maximum: 205, Presná hodnota: ; Technické vlastnosti: 5. Bravčové stehno, voľné, chladené bez kosti, bez kože, bez mastných častí, bledoružovej farby, kuchynská úprava, Jednotka: kg, Minimum: , Maximum: 665, Presná hodnota: ; Technické vlastnosti: 6. Bravčové pliecko, voľné, chladené bez kosti, bez kože, bledoružovej farby, kuchynská úprava, Jednotka: kg, Minimum: , Maximum: 519, Presná hodnota: ; Technické vlastnosti: 7. Bravčové karé, voľné, chladené bez kosti, bez mastných šliach, bledoružovej farby, kuchynská úprava, Jednotka: kg, Minimum: , Maximum: 872, Presná hodnota: ; Technické vlastnosti: 8. Bravčová pečeň, voľná, chladená, čerstsvá, Jednotka: kg, Minimum: , Maximum: 40, Presná hodnota: ; Technické vlastnosti: 9. Párková klobása, voľná, chladená, čerstvá, min. 70 % mäso, obsah soli nižší ako 2,5 g/100 g výrobku, Jednotka: kg, Minimum: , Maximum: 150, Presná hodnota: ; Technické vlastnosti: 10. Bravčová klobása, voľná, údená gazdovská, domáca,chladená, obsah soli menej ako 4,0 g /100 g výrobku, Jednotka: kg, Minimum: , Maximum: 100, Presná hodnota: ; Technické vlastnosti: 11. Šunka dusená, voľná, min. 80 % mäso, chladená, čerstvá, obsah soli nižší ako 2,5 g/100 g výrobku, krájaná, Jednotka: kg, Minimum: , Maximum: 14, Presná hodnota: ; Technické vlastnosti: 12. Slanina, voľná, bravčová, údená, bez kože, čerstvá, Jednotka: kg, Minimum: , Maximum: 35, Presná hodnota: ; Technické vlastnosti: 13. Údená krkovička, voľná, čerstvá, obsah soli nižší ako 2,5 g/100 g výrobku, Jednotka: kg, Minimum: , Maximum: 120, Presná hodnota: ; Technické vlastnosti: 14. Údené stehno, voľné, čerstvé, obsah soli nižší ako 2,5 g/100 g výrobku, Jednotka: kg, Minimum: , Maximum: 150, Presná hodnota: ; Technické vlastnosti: 15. Párky bravčové, voľné, min. 70 % mäsom čerstvé, obsah soli nižší ako 2,5 g/100 g výrobku, Jednotka: kg, Minimum: , Maximum: 92, Presná hodnota: ","Slovenská republika","Košický","Košice III","Košice - m. č. Dargovských hrdinov","Krosnianska 4","","","","celok","1,0000","24837,000","Rámcová dohoda","False","Cena s DPH","1.4.2020 9:00:00","131","24824,860","6","26","1.4.2020 9:15:00","20","2","https://portal.eks.sk/Zakazky/StiahniZmluvnuPrilohuZakazky?correlationId=34231bc4-051f-4151-a609-dd3fa7166d36","https://portal.eks.sk/Zakazky/StiahniZmluvnuPrilohuZakazky?correlationId=05e587d1-ecbb-42a0-a62c-b7bb6d160a39","https://portal.eks.sk/Zakazky/StiahniZmluvnuPrilohuZakazky?correlationId=b9fef28d-4364-440e-b816-4ddb0d38599c","https://portal.eks.sk/Zakazky/StiahniZmluvnuPrilohuZakazky?correlationId=88b20e3a-f41d-40f4-a5d6-eb4b7179abec","https://portal.eks.sk/Zakazky/StiahniZmluvnuPrilohuZakazky?correlationId=569fc381-a2d7-4827-a62c-7648e8d5eba3","https://portal.eks.sk/Zakazky/StiahniZmluvnuPrilohuZakazky?correlationId=51d1a4a1-80c4-484a-ab68-80c40695c9e6","https://portal.eks.sk/Zakazky/StiahniZmluvnuPrilohuZakazky?correlationId=c035d70c-6bf4-4be8-8847-22fc11603172","https://portal.eks.sk/Zakazky/StiahniZmluvnuPrilohuZakazky?correlationId=a340e4de-9c46-47fd-8afa-cc292e3c5431",
"Z20206197","https://portal.eks.sk/SpravaZakaziek/Zakazky/Detail/265606","zazmluvnená","§ 117 a § 110 ZVO","§ 7 ods. 1 písm. a)","Základná škola, Krosnianska 4, Košice","35546875","Slovenská republika","Košice","04022","Krosnianska 4","24.3.2020 14:29:15","1.4.2020 10:38:00","Mrazené potraviny","mrazená zelenina, mrazené výrobky","15896000-5 Hlboko zmrazené výrobky; 15331170-9 Mrazená zelenina; 60000000-8 Dopravné služby (bez prepravy odpadu)","Tovar; Služba","","Dodávka mrazených potravín na prípravu jedál do školskej kuchyne.","","Technické vlastnosti: 1. Špenát mrazený, pretlak, 2,5 kg, Jednotka: ks, Minimum: , Maximum: 80, Presná hodnota: ; Technické vlastnosti: 2. Špenátové listy, 2,5 kg, Jednotka: ks, Minimum: , Maximum: 30, Presná hodnota: ; Technické vlastnosti: 3. Tekvica mrazená, rezaná, 2,5 kg, Jednotka: ks, Minimum: , Maximum: 20, Presná hodnota: ; Technické vlastnosti: 4. Kukurica mrazená, sladká, 2,5 kg, Jednotka: ks, Minimum: , Maximum: 35, Presná hodnota: ; Technické vlastnosti: 5. Karfiol mrazený, 30-60 mm kúsky, 2,5 kg, Jednotka: ks, Minimum: , Maximum: 60, Presná hodnota: ; Technické vlastnosti: 6. Hrášok mrazený, 2,5 kg, Jednotka: ks, Minimum: , Maximum: 64, Presná hodnota: ; Technické vlastnosti: 7. Fazuľka zelená mrazená, rezaná, 2,5 kg, Jednotka: ks, Minimum: , Maximum: 20, Presná hodnota: ; Technické vlastnosti: 8. Brokolica mrazená, delená na ružičky, 2,5 kg, Jednotka: ks, Minimum: , Maximum: 40, Presná hodnota: ; Technické vlastnosti: 9. Kel mrazený, rezaný, 2,5 kg, Jednotka: ks, Minimum: , Maximum: 40, Presná hodnota: ; Technické vlastnosti: 10. Mrazená zelenina -  Podsviečková - kocky ( mrkva, zeler, petržlen ) 2,5 kg, Jednotka: ks, Minimum: , Maximum: 40, Presná hodnota: ; Technické vlastnosti: 11. Mrazená zelenina - Podsviečková - prúžky ( mrkva, zeler, petržlen ) 2,5 kg, Jednotka: ks, Minimum: , Maximum: 20, Presná hodnota: ; Technické vlastnosti: 12. Mrazená zelenina - Mrkva, kocky, 2,5 kg, Jednotka: ks, Minimum: , Maximum: 15, Presná hodnota: ; Technické vlastnosti: 13. Mrazená mrkva s hráškom, 2,5 kg, Jednotka: ks, Minimum: , Maximum: 10, Presná hodnota: ; Technické vlastnosti: 13. Mrazená zelenina - Mochovská zmes, kocky  ( mrkva, ružičkový kel. hrášok, pór ) 2,5 kg, Jednotka: ks, Minimum: , Maximum: 30, Presná hodnota: ; Technické vlastnosti: 14. Mrazená zelenina - Kúpeľná zmes, rezy ( karfiol, brokolica, mrkva oranžová, mrkva žltá, fazuľa romano, mini kukuričné rezy ) 2,5 kg, Jednotka: ks, Minimum: , Maximum: 30, Presná hodnota: ; Technické vlastnosti: 15. Hranolky hlboko mrazené, bez glutamánu a alergénov, úprava 90 sek., vhodné do rúry, 2,5 kg, Jednotka: ks, Minimum: , Maximum: 400, Presná hodnota: ","Slovenská republika","Košický","Košice III","Košice - m. č. Dargovských hrdinov","Krosnianska 4","","","","celok","1,0000","4499,000","Rámcová dohoda","False","Cena s DPH","1.4.2020 10:00:00","142","4498,800","2","3","1.4.2020 10:15:00","20","2","https://portal.eks.sk/Zakazky/StiahniZmluvnuPrilohuZakazky?correlationId=7bebac71-68b3-475d-bdc7-ae050e78d4d7","https://portal.eks.sk/Zakazky/StiahniZmluvnuPrilohuZakazky?correlationId=c15a9603-b1a2-4e11-a1d3-45568e5c99de","https://portal.eks.sk/Zakazky/StiahniZmluvnuPrilohuZakazky?correlationId=ca2d6938-18a7-4bf3-a2cf-68020a51e791","https://portal.eks.sk/Zakazky/StiahniZmluvnuPrilohuZakazky?correlationId=13661f41-6d9f-43b1-8f83-86aef42ace99","https://portal.eks.sk/Zakazky/StiahniZmluvnuPrilohuZakazky?correlationId=8192b65c-de48-4982-9452-94920f992e5c","https://portal.eks.sk/Zakazky/StiahniZmluvnuPrilohuZakazky?correlationId=b671616f-363e-4cd1-8bc4-5b6f4a12fad2","https://portal.eks.sk/Zakazky/StiahniZmluvnuPrilohuZakazky?correlationId=f09cb42c-33fc-4ca9-ba58-980fbd03e9d7","https://portal.eks.sk/Zakazky/StiahniZmluvnuPrilohuZakazky?correlationId=78b3f156-991e-4dec-96e7-b99fe759d6a6",
"Z20206198","https://portal.eks.sk/SpravaZakaziek/Zakazky/Detail/265607","zazmluvnená","§ 117 a § 110 ZVO","§ 7 ods. 1 písm. a)","Základná škola, Krosnianska 4, Košice","35546875","Slovenská republika","Košice","04022","Krosnianska 4","24.3.2020 14:33:07","1.4.2020 11:38:00","Hydina chladená","hydina, kuracie mäso, morčacie mäso, kačacie mäso","15100000-9 Živočíšne výrobky, mäso a mäsové výrobky; 15112000-6 Hydina; 60000000-8 Dopravné služby (bez prepravy odpadu)","Tovar; Služba","","Dodávka chladenej hydiny na prípravu jedál do školskej kuchyne.","Technické vlastnosti: Mäso, Hodnota / charakteristika: bez cudzieho zápachu a cudzej príchute, bez krvných podliatín a zbavené prebytočného tuku; Technické vlastnosti: Mäso, Hodnota / charakteristika: čerstvé, nie mrazené ani rozmrazené mäso, bez prívlastkov krehčené, šťavnaté, solené, mäsový prípravok","Technické vlastnosti: 1. Kuracie prsia, voľné, chladené bez kosti a kože, bledoružovej farby, voľné, opracované, Jednotka: kg, Minimum: , Maximum: 768, Presná hodnota: ; Technické vlastnosti: 2. Kuracie stehná, voľné, chladené bez kosti a kože, bez zmeny farby, opracované, Jednotka: kg, Minimum: , Maximum: 288, Presná hodnota: ; Technické vlastnosti: 3. Kuracie stehná, voľné, chladené, s kosťou a kožou, bez zmeny farby, 180 g klalibrované, L.Q.F. kvalita, Jednotka: kg, Minimum: , Maximum: 120, Presná hodnota: ; Technické vlastnosti: 4. Kuracie stehná, voľné, chladené, s kosťou a kožou, bez zmeny farby, 200 g kalibrované, L.Q.F. kvalita, Jednotka: kg, Minimum: , Maximum: 150, Presná hodnota: ; Technické vlastnosti: 5. Kuracie stehná, voľné,  chladené, s kosťou a kožou, bez zmeny farby, 220 g kalibrované, L.Q.F. kvalita, Jednotka: kg, Minimum: , Maximum: 40, Presná hodnota: ; Technické vlastnosti: 6. Kuracia pečeň, voľná, chladená, čerstvá, bez zmeny farby, Jednotka: kg, Minimum: , Maximum: 50, Presná hodnota: ; Technické vlastnosti: 7. Kurča, voľné, celé, bez drobov, chladené, čerstvé, Jednotka: kg, Minimum: , Maximum: 40, Presná hodnota: ; Technické vlastnosti: 8. Morčacie prsia, voľné, chladené bez kosti a kože, bledoružovej farby, opracované, Jednotka: kg, Minimum: , Maximum: 310, Presná hodnota: ; Technické vlastnosti: 9. Kačacie prsia, voľné, chladené bez kosti s kožou, bledoružovej farby, opracované, Jednotka: kg, Minimum: , Maximum: 150, Presná hodnota: ","Slovenská republika","Košický","Košice III","Košice - m. č. Dargovských hrdinov","Krosnianska 4","","","","celok","1,0000","9354,000","Rámcová dohoda","False","Cena s DPH","1.4.2020 11:00:00","130","9350,000","1","1","1.4.2020 11:15:00","20","2","https://portal.eks.sk/Zakazky/StiahniZmluvnuPrilohuZakazky?correlationId=5eaa4420-fc85-4156-9a7e-317c1c180d73","https://portal.eks.sk/Zakazky/StiahniZmluvnuPrilohuZakazky?correlationId=ae5c948d-0d24-43aa-95d4-4c71900dfdf1","https://portal.eks.sk/Zakazky/StiahniZmluvnuPrilohuZakazky?correlationId=34d206f7-183d-4b39-825c-0e38d3a24227","https://portal.eks.sk/Zakazky/StiahniZmluvnuPrilohuZakazky?correlationId=2b78e3dd-9c04-4c9b-b262-feaa0fc200eb","https://portal.eks.sk/Zakazky/StiahniZmluvnuPrilohuZakazky?correlationId=076dc3b0-60e9-4921-bce8-d93dccb3d441","https://portal.eks.sk/Zakazky/StiahniZmluvnuPrilohuZakazky?correlationId=06582081-5c8f-42ad-bf0a-eb0552397ea7","https://portal.eks.sk/Zakazky/StiahniZmluvnuPrilohuZakazky?correlationId=f30e058c-2e65-4257-86a9-dd6f24391972","https://portal.eks.sk/Zakazky/StiahniZmluvnuPrilohuZakazky?correlationId=68a3635a-53d2-44c0-be67-824064d04d4c",
