"OpisnyFormularIdentifikator","OpisnyFormularStav","OpisnyFormularNazov","OpisnyFormularKlucoveSlova","OpisnyFormularCpv","OpisnyFormularDruh","OpisnyFormularKategoriaSluzieb","OpisnyFormularUrl","OpisnyFormularPocetVyhlasenychZakaziek","OpisnyFormularObchodovanaSumaBezDPH",
"OF-140158","Po karanténe","Acrylamide 4K solution (40 %) - Mix 29 : 1 BC","gély elektroforéza","24327000-2 Rôzne organické chemikálie; 60000000-8 Dopravné služby (bez prepravy odpadu)","Tovar; Služba","","https://portal.eks.sk/SpravaKniznice/OpisneFormulareKniznice/VerejnyDetailOpisnehoFormularaKniznice/140158","1","94,000",
"OF-140172","Po karanténe","Vyšetrovacie lampy","Lampa pre malé zákroky,  lampa pre vyšetrovacie účely, lampa pre ambulancie.","33160000-9 Operačná technika","Tovar; Služba","","https://portal.eks.sk/SpravaKniznice/OpisneFormulareKniznice/VerejnyDetailOpisnehoFormularaKniznice/140172","0","0",
"OF-140175","Po karanténe","Vnútorné a vonkajšie klimatizačné zariadenie, dodanie, montáž, servis do priestorov Objednávateľa.","Vnútorná klimatizačná jednotka, vonkajšia klimatizačná jednotka, inštalácia a montáž, doprava, revízia.","42512000-8 Klimatizačné zariadenia; 45331220-4 Inštalovanie klimatizácie; 60000000-8 Dopravné služby (bez prepravy odpadu)","Tovar; Služba","","https://portal.eks.sk/SpravaKniznice/OpisneFormulareKniznice/VerejnyDetailOpisnehoFormularaKniznice/140175","1","0",
"OF-140189","Po karanténe","Kancelárske potreby","kancelárske potreby","30192000-1 Kancelárske potreby; 60000000-8 Dopravné služby (bez prepravy odpadu)","Tovar; Služba","","https://portal.eks.sk/SpravaKniznice/OpisneFormulareKniznice/VerejnyDetailOpisnehoFormularaKniznice/140189","1","2483,330",
"OF-140222","Po karanténe","Nábytok - pracovný stôl, kontajner, kancelárske kreslo, regál","nábytok, pracovný stôl, kontajner, kancelárske kreslo, regál","39130000-2 Kancelársky nábytok; 39121200-8 Stoly; 39113100-8 Kreslá; 39151100-6 Regály","Tovar","","https://portal.eks.sk/SpravaKniznice/OpisneFormulareKniznice/VerejnyDetailOpisnehoFormularaKniznice/140222","1","375,000",
"OF-140225","Po karanténe","Kancelársky nábytok","Kancelársky nábytok, nábytok ","39130000-2 Kancelársky nábytok; 60000000-8 Dopravné služby (bez prepravy odpadu)","Tovar; Služba","","https://portal.eks.sk/SpravaKniznice/OpisneFormulareKniznice/VerejnyDetailOpisnehoFormularaKniznice/140225","0","0",
"OF-140239","Po karanténe","Videoprojektory - lampy do projektorov","Videoprojektory, lampy do projektorov","38652120-7 Videoprojektory; 60000000-8 Dopravné služby (bez prepravy odpadu)","Tovar; Služba","","https://portal.eks.sk/SpravaKniznice/OpisneFormulareKniznice/VerejnyDetailOpisnehoFormularaKniznice/140239","0","0",
"OF-140257","Po karanténe","Zber, odvoz a zneškodnenie biologicky rozložiteľného kuchynského odpadu","kuchynský odpad, zber, odvoz, likvidácia, biologicky rozložiteľný, zmesi tukov a olejov","90510000-5 Likvidácia a spracovanie odpadu; 90512000-9 Služby na prepravu odpadu; 90500000-2 Služby súvisiace s likvidáciou odpadu a odpadom; 90511000-2 Služby na zber odpadu","Služba","","https://portal.eks.sk/SpravaKniznice/OpisneFormulareKniznice/VerejnyDetailOpisnehoFormularaKniznice/140257","1","1158,330",
"OF-140272","Po karanténe","Dodanie a výmena PVC podlahovej krytiny","PVC podlahová krytina, výmena PVC podlahovej krytiny, odvoz a likvidácia starej PVC podlahovej krytiny, manipulačné práce ,","45432111-5 Kladenie pružných dlažbových krytín; 90512000-9 Služby na prepravu odpadu; 60000000-8 Dopravné služby (bez prepravy odpadu); 90513000-6 Služby na spracovanie a likvidáciu nie nebezpečného odpadu","Stavebná práca; Tovar; Služba","","https://portal.eks.sk/SpravaKniznice/OpisneFormulareKniznice/VerejnyDetailOpisnehoFormularaKniznice/140272","0","0",
"OF-140275","Po karanténe","LAPAROSKOPICKÁ VEŽA","VIDEOREŤAZEC, INSUFLÁCIA, SVETELNÝ ZDROJ,OPTIKA, ENDOSKOPIA, LAPAROSKOPIA, PNEUMATICKÉ RAMENO","33168000-5 Endoskopia, endochirurgické prístroje; 60000000-8 Dopravné služby (bez prepravy odpadu)","Tovar; Služba","","https://portal.eks.sk/SpravaKniznice/OpisneFormulareKniznice/VerejnyDetailOpisnehoFormularaKniznice/140275","0","0",
"OF-140276","Po karanténe","Kancelárske potreby, papier, písacie pomôcky, kancelárske doplnky, tonery","Kancelárske potreby a doplnky, sponky,  fixky, perá, papier do tlačiarne, tonery, obálky","30197000-6 Drobné kancelárske vybavenie; 30000000-9 Kancelárske a počítacie stroje, vybavenie a spotrebný materiál s výnimkou nábytku a softvérových balíkov; 30192124-6 Fixky; 60000000-8 Dopravné služby (bez prepravy odpadu); 30197100-7 Sponky, cvočky, pripináčiky; 30194500-0 Písacie pomôcky; 30192121-5 Guľôčkové perá; 30197220-4 Spony na papier; 30192000-1 Kancelárske potreby; 30199000-0 Papiernický tovar a iné položky; 30199230-1 Obálky; 30199200-2 Obálky, neilustrované karty a korešpondenčné lístky; 30192900-0 Korekčné prostriedky; 30197320-5 Zošívačky; 22900000-9 Rôzne tlačoviny; 30199700-7 Tlačené výrobky z papiera okrem formulárov; 30125100-2 Tonerové náplne; 30125110-5 Toner do laserových tlačiarní/faxových prístrojov","Tovar; Služba","","https://portal.eks.sk/SpravaKniznice/OpisneFormulareKniznice/VerejnyDetailOpisnehoFormularaKniznice/140276","1","825,000",
"OF-140290","Po karanténe","Technika pre zberný dvor","traktor, čelný nakladač,  traktorový náves, štiepkovač drevnej hmoty","16700000-2 Traktory/ťahače; 16600000-1 Špeciálne mechanizmy pre poľnohospodárstvo alebo lesníctvo; 34220000-5 Prívesy, návesy a pojazdné kontajnery; 34390000-7 Príslušenstvo ťahačov/traktorov; 43250000-0 Čelné lopatové nakladače; 60000000-8 Dopravné služby (bez prepravy odpadu)","Tovar; Služba","","https://portal.eks.sk/SpravaKniznice/OpisneFormulareKniznice/VerejnyDetailOpisnehoFormularaKniznice/140290","1","50450,000",
"OF-140307","Po karanténe","Chemikálie","chemikálie, základné anorganické a organické chemikálie","24300000-7 Základné anorganické a organické chemikálie; 60000000-8 Dopravné služby (bez prepravy odpadu)","Tovar; Služba","","https://portal.eks.sk/SpravaKniznice/OpisneFormulareKniznice/VerejnyDetailOpisnehoFormularaKniznice/140307","1","850,000",
"OF-140738","Po karanténe","Učebné pomôcky - zdravotnícke vybavenie","fixátor, nosný vzduchovod, trénovací set, neurologická sada, kliešte, zavádzač ","39162200-7 Učebné pomôcky a zariadenia; 33196000-0 Zdravotné pomôcky; 33100000-1 Zdravotnícke vybavenie; 60000000-8 Dopravné služby (bez prepravy odpadu)","Tovar; Služba","","https://portal.eks.sk/SpravaKniznice/OpisneFormulareKniznice/VerejnyDetailOpisnehoFormularaKniznice/140738","1","475,000",
"OF-140745","Po karanténe","Náhradné diely na vozidlo TATRA 815","náhradné diely, TATRA 815","34330000-9 Náhradné diely pre vozidlá na prepravu tovaru, pre dodávky a osobné automobily; 60000000-8 Dopravné služby (bez prepravy odpadu)","Tovar; Služba","","https://portal.eks.sk/SpravaKniznice/OpisneFormulareKniznice/VerejnyDetailOpisnehoFormularaKniznice/140745","2","2640,000",
"OF-140756","Po karanténe","LAPAROSKOPICKÁ VEŽA","VIDEOREŤAZEC, INSUFLÁCIA, SVETELNÝ ZDROJ,OPTIKA, ENDOSKOPIA, LAPAROSKOPIA, PNEUMATICKÉ RAMENO","33168000-5 Endoskopia, endochirurgické prístroje; 60000000-8 Dopravné služby (bez prepravy odpadu)","Tovar; Služba","","https://portal.eks.sk/SpravaKniznice/OpisneFormulareKniznice/VerejnyDetailOpisnehoFormularaKniznice/140756","0","0",
"OF-140763","Po karanténe","Tonerové náplne - originál","toner, tonerová náplň","30125100-2 Tonerové náplne; 60000000-8 Dopravné služby (bez prepravy odpadu)","Tovar; Služba","","https://portal.eks.sk/SpravaKniznice/OpisneFormulareKniznice/VerejnyDetailOpisnehoFormularaKniznice/140763","1","59,200",
"OF-140770","Po karanténe","Čistiace a hygienické potreby","Čistiace a hygienické potreby","33700000-7 Predmety osobnej starostlivosti; 39800000-0 Čistiace a leštiace výrobky; 60000000-8 Dopravné služby (bez prepravy odpadu)","Tovar; Služba","","https://portal.eks.sk/SpravaKniznice/OpisneFormulareKniznice/VerejnyDetailOpisnehoFormularaKniznice/140770","0","0",
"OF-140788","Po karanténe","Kancelársky papier","papier, kancelársky papier, xerox","30197620-8 Písací papier; 30197630-1 Papier na tlač alebo iné grafické účely; 30197642-8 Papier na fotokopírovanie a xerografický papier","Tovar; Služba","","https://portal.eks.sk/SpravaKniznice/OpisneFormulareKniznice/VerejnyDetailOpisnehoFormularaKniznice/140788","0","0",
"OF-140795","Po karanténe","Stojan na bicykle","Stojan na bicykle","34928400-2 Vybavenie miest a obcí; 60000000-8 Dopravné služby (bez prepravy odpadu)","Tovar; Služba","","https://portal.eks.sk/SpravaKniznice/OpisneFormulareKniznice/VerejnyDetailOpisnehoFormularaKniznice/140795","1","998,670",
"OF-140820","Po karanténe","Zdravotnícky spotrebný materiál Respiratory a Medical","močový katéter, Endotr. kanyla s balónikom","33141220-8 Kanyly; 33141200-2 Katétre","Tovar; Služba","","https://portal.eks.sk/SpravaKniznice/OpisneFormulareKniznice/VerejnyDetailOpisnehoFormularaKniznice/140820","1","0",
"OF-140838","Po karanténe","Čerstvé chladené mäso bravčové, hovädzie, mäsové výrobky ","Mäso bravčové, hovädzie,  mäsové výrobky ","15113000-3 Bravčové mäso; 15111100-0 Hovädzie mäso; 15110000-2 Mäso; 15130000-8 Mäsové výrobky; 15131200-7 Sušené, nasolené, údené alebo korenené mäso; 15100000-9 Živočíšne výrobky, mäso a mäsové výrobky; 60000000-8 Dopravné služby (bez prepravy odpadu)","Tovar; Služba","","https://portal.eks.sk/SpravaKniznice/OpisneFormulareKniznice/VerejnyDetailOpisnehoFormularaKniznice/140838","1","43500,000",
"OF-140863","Po karanténe","Traktor","Traktor, poľnohospodárske stroje","16700000-2 Traktory/ťahače; 16000000-5 Poľnohospodárske stroje; 60000000-8 Dopravné služby (bez prepravy odpadu)","Tovar; Služba","","https://portal.eks.sk/SpravaKniznice/OpisneFormulareKniznice/VerejnyDetailOpisnehoFormularaKniznice/140863","0","0",
"OF-140870","Po karanténe","Spiatočná letenka Košice - Moskva","spiatočná letenka","60400000-2 Letecké dopravné služby","Služba","","https://portal.eks.sk/SpravaKniznice/OpisneFormulareKniznice/VerejnyDetailOpisnehoFormularaKniznice/140870","1","332,000",
"OF-140888","Po karanténe","Servisná prehliadka vozidla Mercedes Benz Actros","servisná prehliadka, Mercedes Benz Actros","50100000-6 Opravy, údržba a súvisiace služby pre vozidlá a príbuzné vybavenie","Služba","","https://portal.eks.sk/SpravaKniznice/OpisneFormulareKniznice/VerejnyDetailOpisnehoFormularaKniznice/140888","1","2024,160",
"OF-140906","Po karanténe","Originálne tonerové náplne pre kopírovacie stroje a tlačiarne","toner, tlač, kopírovanie","30125100-2 Tonerové náplne","Tovar; Služba","","https://portal.eks.sk/SpravaKniznice/OpisneFormulareKniznice/VerejnyDetailOpisnehoFormularaKniznice/140906","1","750,000",
"OF-140913","Po karanténe","Plachty, Nemocničná bielizeň","Plachty, Prestieradlo","39512100-5 Plachty; 39518000-6 Nemocničná bielizeň","Tovar; Služba","","https://portal.eks.sk/SpravaKniznice/OpisneFormulareKniznice/VerejnyDetailOpisnehoFormularaKniznice/140913","0","0",
"OF-140945","Po karanténe","Kovové výlevky (nalievacie hrdlá) k 20 l plechovým kanistrom ","kovové výlevky (nalievacie hrdlá)","44618300-8 Zátky, uzávery, vrchnáky kontajnerov a veká; 60000000-8 Dopravné služby (bez prepravy odpadu)","Tovar; Služba","","https://portal.eks.sk/SpravaKniznice/OpisneFormulareKniznice/VerejnyDetailOpisnehoFormularaKniznice/140945","1","40,000",
"OF-140956","Po karanténe","5 kanálový digitálny, stacionárny elektromyografický prístroj","elektromyografický prístroj, evokované potenciály, testovanie vodivosti periférnych nervov","33000000-0 Zdravotnícke vybavenie, farmaceutický materiál a výrobky osobnej starostlivosti; 33121000-4 Systém pre dlhodobé ambulantné zaznamenávanie; 33121300-7 Elektromyografy; 60000000-8 Dopravné služby (bez prepravy odpadu); 60100000-9 Služby cestnej dopravy","Tovar; Služba","","https://portal.eks.sk/SpravaKniznice/OpisneFormulareKniznice/VerejnyDetailOpisnehoFormularaKniznice/140956","0","0",
"OF-140970","Po karanténe","Zakúpenie licencií Oracle Partitioning vrátane technickej podpory","licencie, podpora","48000000-8 Softvérové balíky a informačné systémy; 48800000-6 Informačné systémy a servery; 72261000-2 Softvérové podporné služby","Tovar; Služba","","https://portal.eks.sk/SpravaKniznice/OpisneFormulareKniznice/VerejnyDetailOpisnehoFormularaKniznice/140970","1","51500,000",
"OF-140981","Po karanténe","Bezkontaktný tonometer s pachymetrom ","tonometer, oftalmologické prístroje","33122000-1 Oftalmologické prístroje; 60000000-8 Dopravné služby (bez prepravy odpadu)","Tovar; Služba","","https://portal.eks.sk/SpravaKniznice/OpisneFormulareKniznice/VerejnyDetailOpisnehoFormularaKniznice/140981","0","0",
"OF-140988","Po karanténe","Umývací prostriedok a oplachovací prípravok pre profesionálne umývačky riadu RM GASTRO","umývací prostriedok, oplachovací prípravok, detergent, profesionálne umývačky riadu, tekutý čistiaci prostriedok, čistiaci prostriedok","39832000-3 Čistiace prostriedky na riad; 39831210-1 Saponáty na umývanie riadu; 39831200-8 Saponáty; 39831220-4 Odmasťovacie prostriedky; 60000000-8 Dopravné služby (bez prepravy odpadu); 39220000-0 Kuchynské zariadenie, domáce potreby a potreby pre domáce hospodárstvo a dodávky pre stravovacie zariadenia","Tovar; Služba","","https://portal.eks.sk/SpravaKniznice/OpisneFormulareKniznice/VerejnyDetailOpisnehoFormularaKniznice/140988","2","612,490",
"OF-140201","Po karanténe","Traktor s príslušenstvom","traktor, čelný nakladač, štiepkovač, traktorový príves","16700000-2 Traktory/ťahače; 43250000-0 Čelné lopatové nakladače; 43414000-8 Drviče; 34223370-0 Prívesy s vyklápaním; 60000000-8 Dopravné služby (bez prepravy odpadu)","Tovar; Služba","","https://portal.eks.sk/SpravaKniznice/OpisneFormulareKniznice/VerejnyDetailOpisnehoFormularaKniznice/140201","1","79583,330",
"OF-140203","Po karanténe","Čistiace, hygienické, dezinfekčné prostriedky ","Čistiace prostriedky, dezinfekčné prostriedky","39830000-9 Čistiace výrobky; 24455000-8 Dezinfekčné prostriedky; 39224300-1 Metly a kefy a iné výrobky na upratovanie domácností; 39224330-0 Vedrá; 60000000-8 Dopravné služby (bez prepravy odpadu)","Tovar; Služba","","https://portal.eks.sk/SpravaKniznice/OpisneFormulareKniznice/VerejnyDetailOpisnehoFormularaKniznice/140203","1","360,830",
"OF-140210","Po karanténe","Osobné motorové vozidlo: Citroën Berlingo VP benzín 1,6VTI 120 XTR  alebo ekvivalent","Osobné motorové vozidlo, osobný automobil, auto","34110000-1 Osobné automobily; 34100000-8 Motorové vozidlá; 60000000-8 Dopravné služby (bez prepravy odpadu)","Tovar; Služba","","https://portal.eks.sk/SpravaKniznice/OpisneFormulareKniznice/VerejnyDetailOpisnehoFormularaKniznice/140210","0","0",
"OF-140212","Po karanténe","Pracovné odevy a pracovná obuv ","pracovné odevy, pracovná obuv","18110000-3 Pracovné odevy; 18830000-6 Ochranná obuv","Tovar","","https://portal.eks.sk/SpravaKniznice/OpisneFormulareKniznice/VerejnyDetailOpisnehoFormularaKniznice/140212","0","0",
"OF-140235","Po karanténe","Filtračný papier kvalitatívny","Kruhové výseky neskladané, vyhotovenie nekrepované, nehladené","15994200-4 Filtračný papier; 60000000-8 Dopravné služby (bez prepravy odpadu)","Tovar; Služba","","https://portal.eks.sk/SpravaKniznice/OpisneFormulareKniznice/VerejnyDetailOpisnehoFormularaKniznice/140235","0","0",
"OF-140237","Po karanténe","Dodávka zemného plynu","zemný plyn","09123000-7 Zemný plyn; 60000000-8 Dopravné služby (bez prepravy odpadu)","Tovar; Služba","","https://portal.eks.sk/SpravaKniznice/OpisneFormulareKniznice/VerejnyDetailOpisnehoFormularaKniznice/140237","1","39666,670",
"OF-140244","Po karanténe","Klinix boxy, nádoby na drobné ostré predmety","Klinix boxy, nádoby na ostré predmety, nádoby na biologický odpad, nádoby na zdravotnícky odpad","44613800-8 Kontajnery na odpadový materiál; 33141123-8 Nádoby na ostré predmety; 60000000-8 Dopravné služby (bez prepravy odpadu)","Tovar; Služba","","https://portal.eks.sk/SpravaKniznice/OpisneFormulareKniznice/VerejnyDetailOpisnehoFormularaKniznice/140244","1","124,990",
"OF-140246","Po karanténe","Dodávka  tonerov do laserových a atramentových tlačiarní a multifunkčných zariadení","Tonerry","30125100-2 Tonerové náplne; 30125110-5 Toner do laserových tlačiarní/faxových prístrojov; 30125120-8 Toner do fotokopírovacích strojov; 30192113-6 Atramentové náplne; 30237310-5 Doplnkové náplne do tlačiarní; 30192300-4 Farbiace pásky; 60000000-8 Dopravné služby (bez prepravy odpadu)","Tovar; Služba","","https://portal.eks.sk/SpravaKniznice/OpisneFormulareKniznice/VerejnyDetailOpisnehoFormularaKniznice/140246","0","0",
"OF-140269","Po karanténe","Chemikálie","laboratórne chemikálie, anorganické chemikálie. kyseliny","24327000-2 Rôzne organické chemikálie; 60000000-8 Dopravné služby (bez prepravy odpadu)","Tovar; Služba","","https://portal.eks.sk/SpravaKniznice/OpisneFormulareKniznice/VerejnyDetailOpisnehoFormularaKniznice/140269","1","257,000",
"OF-140271","Po karanténe","Disky na testovanie citlivosti voči antibiotikám zásobník diskov","antibiotické disky, zásobník diskov, ","24000000-4 Chemické výrobky; 60000000-8 Dopravné služby (bez prepravy odpadu)","Tovar; Služba","","https://portal.eks.sk/SpravaKniznice/OpisneFormulareKniznice/VerejnyDetailOpisnehoFormularaKniznice/140271","0","0",
"OF-140278","Po karanténe","mrazená zelenina","ovocie, zelenina","15331170-9 Mrazená zelenina; 60000000-8 Dopravné služby (bez prepravy odpadu)","Tovar; Služba","","https://portal.eks.sk/SpravaKniznice/OpisneFormulareKniznice/VerejnyDetailOpisnehoFormularaKniznice/140278","1","8985,000",
"OF-140280","Po karanténe","Kancelárske stoličky a kreslá","stoličky, kreslá, kancelárske stoličky","39112000-0 Stoličky; 60000000-8 Dopravné služby (bez prepravy odpadu); 39113100-8 Kreslá","Tovar; Služba","","https://portal.eks.sk/SpravaKniznice/OpisneFormulareKniznice/VerejnyDetailOpisnehoFormularaKniznice/140280","1","415,000",
"OF-140303","Po karanténe","Rukavice sterilné","rukavice sterilné, nepudrované","33141420-0 Chirurgické rukavice; 60000000-8 Dopravné služby (bez prepravy odpadu)","Tovar; Služba","","https://portal.eks.sk/SpravaKniznice/OpisneFormulareKniznice/VerejnyDetailOpisnehoFormularaKniznice/140303","0","0",
"OF-140305","Po karanténe","Čistiace, dezinfekčné, umývacie a upratovacie prostriedky","Čistenie, upratovanie, umývanie, čistiace prostriedky, dezinfekčné prostriedky","39800000-0 Čistiace a leštiace výrobky; 39224300-1 Metly a kefy a iné výrobky na upratovanie domácností; 39542000-3 Handry; 39832000-3 Čistiace prostriedky na riad; 39833000-0 Protiprachové prostriedky; 60000000-8 Dopravné služby (bez prepravy odpadu)","Tovar; Služba","","https://portal.eks.sk/SpravaKniznice/OpisneFormulareKniznice/VerejnyDetailOpisnehoFormularaKniznice/140305","1","0",
"OF-140310","Po karanténe","Sanácia 4 miestností v objekte ","Maliarske a natieračské práce, odstránenie a likvidácia starej PVC podlahovej krytiny,  dodanie a zhotovenie  liatej epoxidovej podlahy, výmena dverí, výmena termostatických regulovateľných hlavíc na radiátory, elektroinštalačné práce,   manipulačné práce , odvoz a likvidácia odpadu","45442100-8 Maliarske a natieračské práce; 45432000-4 Kladenie podláh a dlažbových krytín, povrchová úprava stien; 45432111-5 Kladenie pružných dlažbových krytín; 45300000-0 Stavebno-inštalačné práce; 45310000-3 Elektroinštalačné práce; 45311000-0 Inštalácie a montáž elektrických rozvodov a zariadení; 42131110-0 Ventily radiátorov ústredného kúrenia; 44620000-2 Radiátory a ohrievače ústredného kúrenia a ich časti; 45421111-5 Montáž zárubní; 45421131-1 Montáž dverí; 44221200-7 Dvere; 90512000-9 Služby na prepravu odpadu; 90513000-6 Služby na spracovanie a likvidáciu nie nebezpečného odpadu; 60000000-8 Dopravné služby (bez prepravy odpadu)","Stavebná práca; Tovar; Služba","","https://portal.eks.sk/SpravaKniznice/OpisneFormulareKniznice/VerejnyDetailOpisnehoFormularaKniznice/140310","0","0",
"OF-140312","Po karanténe","Originál tonery","Originál tonery","30125110-5 Toner do laserových tlačiarní/faxových prístrojov; 60000000-8 Dopravné služby (bez prepravy odpadu)","Tovar; Služba","","https://portal.eks.sk/SpravaKniznice/OpisneFormulareKniznice/VerejnyDetailOpisnehoFormularaKniznice/140312","1","1116,670",
"OF-140406","Po karanténe","Elektro materiál  / kavomat","ističe, zásuvky, elektromer  / 224/17","31500000-1 Osvetľovacie zariadenia a elektrické žiarovky; 31510000-4 Elektrónky (elektrické katódové lampy); 31520000-7 Lampy/svietidlá a príslušenstvo k nim; 31531000-7 Žiarovky; 60000000-8 Dopravné služby (bez prepravy odpadu)","Tovar; Služba","","https://portal.eks.sk/SpravaKniznice/OpisneFormulareKniznice/VerejnyDetailOpisnehoFormularaKniznice/140406","1","270,000",
"OF-140409","Po karanténe","Skladacie stoly a stoličky","stôl, stolička","39100000-3 Nábytok; 60000000-8 Dopravné služby (bez prepravy odpadu)","Tovar; Služba","","https://portal.eks.sk/SpravaKniznice/OpisneFormulareKniznice/VerejnyDetailOpisnehoFormularaKniznice/140409","1","1668,300",
"OF-140423","Po karanténe","Mlieko, mliečne výrobky, sója, sójové produkty","mlieko, mliečne výrobky, jogurty, syr, maslo, smotana, tvaroh, majonéza, sója, sójové produkty, tofu","15510000-6 Mlieko a smotana; 15550000-8 Mliečne výrobky rôznych druhov; 15551300-8 Jogurt; 15512000-0 Smotana; 15331137-6 Sójové klíčky; 03111100-3 Sójové bôby; 60000000-8 Dopravné služby (bez prepravy odpadu)","Tovar; Služba","","https://portal.eks.sk/SpravaKniznice/OpisneFormulareKniznice/VerejnyDetailOpisnehoFormularaKniznice/140423","1","75400,000",
"OF-140424","Po karanténe","Anorganické kyseliny a zlúčeniny","anorganické zlúčeniny, anorganické chemikálie, anorganické kyseliny	","24310000-0 Základné anorganické chemikálie; 24300000-7 Základné anorganické a organické chemikálie; 24315000-5 Rôzne anorganické chemikálie; 24311410-4 Anorganické kyseliny; 60000000-8 Dopravné služby (bez prepravy odpadu)","Tovar; Služba","","https://portal.eks.sk/SpravaKniznice/OpisneFormulareKniznice/VerejnyDetailOpisnehoFormularaKniznice/140424","1","252,250",
"OF-140441","Po karanténe","Čistiace, dezinfekčné, umývacie a upratovacie prostriedky","Čistenie, upratovanie, umývanie, čistiace prostriedky, dezinfekčné prostriedky","39800000-0 Čistiace a leštiace výrobky; 39224300-1 Metly a kefy a iné výrobky na upratovanie domácností; 39542000-3 Handry; 39832000-3 Čistiace prostriedky na riad; 39833000-0 Protiprachové prostriedky; 60000000-8 Dopravné služby (bez prepravy odpadu)","Tovar; Služba","","https://portal.eks.sk/SpravaKniznice/OpisneFormulareKniznice/VerejnyDetailOpisnehoFormularaKniznice/140441","0","0",
"OF-140442","Po karanténe","Zabezpečenie prania bielizne - pracovisko Martin","pranie bielizne, dezinfekcia, žehlenie, manipulácia s bielizňou, triedenie, balenie, drobné opravy bielizne","98310000-9 Pranie a chemické čistenie; 60000000-8 Dopravné služby (bez prepravy odpadu)","Služba","","https://portal.eks.sk/SpravaKniznice/OpisneFormulareKniznice/VerejnyDetailOpisnehoFormularaKniznice/140442","1","1082,500",
"OF-140456","Po karanténe","Fyzická ochrana objektov, strážna a informátorská služba","Bezpečnostná služba, strážna služba, informátorská služba, ochrana majetku, fyzická ochrana objektov","79713000-5 Strážne služby; 79710000-4 Bezpečnostné služby; 98341120-2 Vrátnik","Služba","","https://portal.eks.sk/SpravaKniznice/OpisneFormulareKniznice/VerejnyDetailOpisnehoFormularaKniznice/140456","1","42270,830",
"OF-140459","Po karanténe","Dodávka zemného plynu","zemný plyn","09123000-7 Zemný plyn; 60000000-8 Dopravné služby (bez prepravy odpadu)","Tovar; Služba","","https://portal.eks.sk/SpravaKniznice/OpisneFormulareKniznice/VerejnyDetailOpisnehoFormularaKniznice/140459","1","8012,500",
"OF-140473","Po karanténe","Zariadenie priestorov","Zariadenie priestorov","39700000-9 Spotrebiče pre domácnosť; 39200000-4 Zariadenie interiéru; 60000000-8 Dopravné služby (bez prepravy odpadu)","Tovar; Služba","","https://portal.eks.sk/SpravaKniznice/OpisneFormulareKniznice/VerejnyDetailOpisnehoFormularaKniznice/140473","1","1498,000",
"OF-140474","Po karanténe","Stavebné drevo a rezivo","drevené hranoly, drevené dosky, krokvy, drevené fošne, tatranský profil","03419000-0 Stavebné drevo/rezivo; 60000000-8 Dopravné služby (bez prepravy odpadu)","Tovar; Služba","","https://portal.eks.sk/SpravaKniznice/OpisneFormulareKniznice/VerejnyDetailOpisnehoFormularaKniznice/140474","1","0",
"OF-140491","Po karanténe","Stavebný materiál","stavebný materiál, výrobky príbuzné stavebným materiálom","44111000-1 Stavebné materiály; 44140000-3 Výrobky príbuzné stavebným materiálom; 60000000-8 Dopravné služby (bez prepravy odpadu)","Tovar; Služba","","https://portal.eks.sk/SpravaKniznice/OpisneFormulareKniznice/VerejnyDetailOpisnehoFormularaKniznice/140491","0","0",
