"OpisnyFormularIdentifikator","OpisnyFormularStav","OpisnyFormularNazov","OpisnyFormularKlucoveSlova","OpisnyFormularCpv","OpisnyFormularDruh","OpisnyFormularKategoriaSluzieb","OpisnyFormularUrl","OpisnyFormularPocetVyhlasenychZakaziek","OpisnyFormularObchodovanaSumaBezDPH",
"OF-223936","Po karanténe","Jednorázové rukavice","zdravotnícky materiál","18424300-0 Jednorazové rukavice; 60000000-8 Dopravné služby (bez prepravy odpadu)","Tovar; Služba","","https://portal.eks.sk/SpravaKniznice/OpisneFormulareKniznice/VerejnyDetailOpisnehoFormularaKniznice/223936","0","0",
"OF-224070","Po karanténe","Šatníkové skrine kovové","šatník, kovové skrine","39143121-0 Šatníky; 39120000-9 Stoly, skrine, písacie stoly a knižnice; 60000000-8 Dopravné služby (bez prepravy odpadu)","Tovar; Služba","","https://portal.eks.sk/SpravaKniznice/OpisneFormulareKniznice/VerejnyDetailOpisnehoFormularaKniznice/224070","1","0",
"OF-224071","Po karanténe","Zemný plyn","zemný plyn, dodávka zemného plynu, preprava a distribúcia zemného plynu","09123000-7 Zemný plyn; 65200000-5 Rozvod plynu a súvisiace služby; 60000000-8 Dopravné služby (bez prepravy odpadu)","Tovar; Služba","","https://portal.eks.sk/SpravaKniznice/OpisneFormulareKniznice/VerejnyDetailOpisnehoFormularaKniznice/224071","1","0",
"OF-224243","Po karanténe","Tonery a spotrebný materiál","Toner, valec, odpadová nádoba","30125000-1 Časti a príslušenstvo fotokopírovacích prístrojov; 30125100-2 Tonerové náplne; 60000000-8 Dopravné služby (bez prepravy odpadu)","Tovar; Služba","","https://portal.eks.sk/SpravaKniznice/OpisneFormulareKniznice/VerejnyDetailOpisnehoFormularaKniznice/224243","1","0",
"OF-224407","Po karanténe","Kancelárske potreby","kancelárske potreby, korektor, zošity, obálky, sponky, tlačivá. obálky","30192000-1 Kancelárske potreby; 30199000-0 Papiernický tovar a iné položky; 60000000-8 Dopravné služby (bez prepravy odpadu)","Tovar; Služba","","https://portal.eks.sk/SpravaKniznice/OpisneFormulareKniznice/VerejnyDetailOpisnehoFormularaKniznice/224407","1","0",
"OF-224987","Po karanténe","Technologické zariadenia stravovacích prevádzok a ND","univerzálny robot, krájač zeleniny","39312000-2 Zariadenia na prípravu jedál; 39220000-0 Kuchynské zariadenie, domáce potreby a potreby pre domáce hospodárstvo a dodávky pre stravovacie zariadenia; 60000000-8 Dopravné služby (bez prepravy odpadu)","Tovar; Služba","","https://portal.eks.sk/SpravaKniznice/OpisneFormulareKniznice/VerejnyDetailOpisnehoFormularaKniznice/224987","0","0",
"OF-224991","Po karanténe","Nákup výpočtovej techniky","notebook, počítač,   dataprojektor, externé disky","30213000-5 Osobné počítače; 30213100-6 Prenosné počítače; 60000000-8 Dopravné služby (bez prepravy odpadu); 38652120-7 Videoprojektory; 30213300-8 Stolový počítač; 30230000-0 Zariadenia súvisiace s počítačmi; 30231300-0 Zobrazovacie jednotky (obrazovky); 32342000-2 Reproduktory; 30237000-9 Časti a príslušenstvo počítačov a spotrebný materiál k nim","Tovar; Služba","","https://portal.eks.sk/SpravaKniznice/OpisneFormulareKniznice/VerejnyDetailOpisnehoFormularaKniznice/224991","1","0",
"OF-225046","Po karanténe","IKT technika - s príslušenstvom","ethernetový LAN tester, USB HUB, externá zvuková karta, RJ45","30237000-9 Časti a príslušenstvo počítačov a spotrebný materiál k nim; 30237136-1 Zvukové karty; 30237132-3 Rozhranie univerzálnej sériovej zbernice (USB); 60000000-8 Dopravné služby (bez prepravy odpadu)","Tovar; Služba","","https://portal.eks.sk/SpravaKniznice/OpisneFormulareKniznice/VerejnyDetailOpisnehoFormularaKniznice/225046","1","0",
"OF-225065","Po karanténe","Kancelárske potreby","Kancelárske potreby","30192000-1 Kancelárske potreby; 60000000-8 Dopravné služby (bez prepravy odpadu)","Tovar; Služba","","https://portal.eks.sk/SpravaKniznice/OpisneFormulareKniznice/VerejnyDetailOpisnehoFormularaKniznice/225065","1","0",
"OF-225077","Po karanténe","Lekárske odevy - ústenky","Lekárske odevy - ústenky","35113400-3 Ochranné a bezpečnostné odevy; 60000000-8 Dopravné služby (bez prepravy odpadu); 33199000-1 Lekárske odevy","Tovar; Služba","","https://portal.eks.sk/SpravaKniznice/OpisneFormulareKniznice/VerejnyDetailOpisnehoFormularaKniznice/225077","1","0",
"OF-225102","Po karanténe","Nákup  lavíc ","lavica, sedadlá, nábytok, vybavenie chodieb, vybavenie čakární","39113200-9 Lavice s operadlom; 60000000-8 Dopravné služby (bez prepravy odpadu)","Tovar; Služba","","https://portal.eks.sk/SpravaKniznice/OpisneFormulareKniznice/VerejnyDetailOpisnehoFormularaKniznice/225102","0","0",
"OF-225109","Po karanténe","Komponenty k PC","Procesor, Základná doska, Grafická karta, Operačná pamäť, Pevný disk, Zdroj, Operačný systém, Grafický tablet, Monitor, Notebook,","30200000-1 Počítačové zariadenia a spotrebný materiál; 30234000-8 Pamäťové médiá; 60000000-8 Dopravné služby (bez prepravy odpadu)","Tovar; Služba","","https://portal.eks.sk/SpravaKniznice/OpisneFormulareKniznice/VerejnyDetailOpisnehoFormularaKniznice/225109","1","0",
"OF-225182","Po karanténe","Lieky a liečivé prípravky","liek, liečivo, liečivé prípravky, farmaceutické výrobky","33690000-3 Rôzne liečivá; 33600000-6 Farmaceutické výrobky; 60000000-8 Dopravné služby (bez prepravy odpadu)","Tovar; Služba","","https://portal.eks.sk/SpravaKniznice/OpisneFormulareKniznice/VerejnyDetailOpisnehoFormularaKniznice/225182","1","0",
"OF-225205","Po karanténe","Zariadenie na chladenie a mrazenie","chladnička, mraznička","39710000-2 Elektrické prístroje pre domácnosť; 60000000-8 Dopravné služby (bez prepravy odpadu)","Tovar; Služba","","https://portal.eks.sk/SpravaKniznice/OpisneFormulareKniznice/VerejnyDetailOpisnehoFormularaKniznice/225205","1","0",
"OF-225253","Po karanténe","Generálna oprava 5 ks nosičov náradia MT8, 4 ks žacích líšt typu SP2-211 a rotačnej kosy na vysoký porast AM 4-003","MT8, motorová kosačka, žacia lišta, rotačná kosa","50000000-5 Opravárske a údržbárske služby; 50116000-1 Oprava a údržba konkrétnych častí vozidiel; 50433000-9 Kalibrovanie","Služba","","https://portal.eks.sk/SpravaKniznice/OpisneFormulareKniznice/VerejnyDetailOpisnehoFormularaKniznice/225253","0","0",
"OF-225279","Po karanténe","Vzduchové filtre časť č. 1- Filter dýchací","zdravotnícky materiál","42514310-8 Vzduchové filtre; 60000000-8 Dopravné služby (bez prepravy odpadu)","Tovar; Služba","","https://portal.eks.sk/SpravaKniznice/OpisneFormulareKniznice/VerejnyDetailOpisnehoFormularaKniznice/225279","0","0",
"OF-225299","Po karanténe","Vzduchové filtre časť č. 2- Filter sací","zdravotnícky materiál","42514310-8 Vzduchové filtre; 60000000-8 Dopravné služby (bez prepravy odpadu)","Tovar; Služba","","https://portal.eks.sk/SpravaKniznice/OpisneFormulareKniznice/VerejnyDetailOpisnehoFormularaKniznice/225299","0","0",
"OF-225315","Po karanténe","Kancelárske potreby","obal, papier, popisovače, fólie","30190000-7 Rôzne kancelárske zariadenia a kancelárske potreby; 30192000-1 Kancelárske potreby; 30192153-8 Textové pečiatky; 44174000-0 Fólia","Tovar; Služba","","https://portal.eks.sk/SpravaKniznice/OpisneFormulareKniznice/VerejnyDetailOpisnehoFormularaKniznice/225315","0","0",
"OF-225316","Po karanténe","Tablety","tablety, púzdro, perá","30213200-7 Tabletový počítač; 30237200-1 Príslušenstvo počítačov; 60000000-8 Dopravné služby (bez prepravy odpadu)","Tovar; Služba","","https://portal.eks.sk/SpravaKniznice/OpisneFormulareKniznice/VerejnyDetailOpisnehoFormularaKniznice/225316","1","0",
"OF-225329","Po karanténe","Laboratórna sušiareň s núteným prúdením vzduchu v komore","laboratórna sušiareň, nútené prúdenie vzduchu v komore","38000000-5 Laboratórne, optické a presné prístroje a vybavenie (s výnimkou skiel); 60000000-8 Dopravné služby (bez prepravy odpadu)","Tovar; Služba","","https://portal.eks.sk/SpravaKniznice/OpisneFormulareKniznice/VerejnyDetailOpisnehoFormularaKniznice/225329","1","0",
"OF-225353","Po karanténe","Projektor","datavideoprojektor, dataprojektor, videoprojektor","38652120-7 Videoprojektory; 60000000-8 Dopravné služby (bez prepravy odpadu)","Tovar; Služba","","https://portal.eks.sk/SpravaKniznice/OpisneFormulareKniznice/VerejnyDetailOpisnehoFormularaKniznice/225353","0","0",
"OF-225366","Po karanténe","Obstaranie osobného motorového vozidla","osobný automobil, Osobné motorové vozidlo, Motorové vozidlo na prepravu osôb","34100000-8 Motorové vozidlá; 60000000-8 Dopravné služby (bez prepravy odpadu)","Tovar; Služba","","https://portal.eks.sk/SpravaKniznice/OpisneFormulareKniznice/VerejnyDetailOpisnehoFormularaKniznice/225366","1","0",
"OF-225370","Po karanténe","Nové osobné motorove vozidlo - minibus alebo ekvivalent, farba - Biela alebo ekvivalen, motor - diesel, prevodovka - automatická","Motorové vozidlo, preprava osôb, preprava batožiny,","34100000-8 Motorové vozidlá; 34110000-1 Osobné automobily; 60000000-8 Dopravné služby (bez prepravy odpadu)","Tovar; Služba","","https://portal.eks.sk/SpravaKniznice/OpisneFormulareKniznice/VerejnyDetailOpisnehoFormularaKniznice/225370","1","0",
"OF-225372","Po karanténe","Uhelon 130 T ","polyamidové sito","39525200-0 Filtračné prvky z textílie; 60000000-8 Dopravné služby (bez prepravy odpadu)","Tovar; Služba","","https://portal.eks.sk/SpravaKniznice/OpisneFormulareKniznice/VerejnyDetailOpisnehoFormularaKniznice/225372","1","0",
"OF-225373","Po karanténe","Tlačiarenské služby","tlač, tlačiarenské služby","79810000-5 Tlačiarenské služby; 60000000-8 Dopravné služby (bez prepravy odpadu)","Služba; Tovar","","https://portal.eks.sk/SpravaKniznice/OpisneFormulareKniznice/VerejnyDetailOpisnehoFormularaKniznice/225373","1","0",
"OF-225374","Po karanténe","Vozidlo na zber a zvoz odpadu","zberové vozidlo","34144511-3 Vozidlá na odvoz smetí; 34144000-8 Motorové vozidlá na špeciálne účely","Tovar","","https://portal.eks.sk/SpravaKniznice/OpisneFormulareKniznice/VerejnyDetailOpisnehoFormularaKniznice/225374","0","0",
"OF-225375","Po karanténe","Dáždnik","Dáždnik","18000000-9 Odevy, obuv, brašnárske výrobky a príslušenstvo; 60000000-8 Dopravné služby (bez prepravy odpadu)","Tovar; Služba","","https://portal.eks.sk/SpravaKniznice/OpisneFormulareKniznice/VerejnyDetailOpisnehoFormularaKniznice/225375","0","0",
"OF-225376","Po karanténe","Zabezpečenie stravovania formou stravných lístkov","stravné lístky, stravovanie, gastro lístky, nominálna hodnota","30199770-8 Stravné poukážky; 60000000-8 Dopravné služby (bez prepravy odpadu)","Tovar; Služba","","https://portal.eks.sk/SpravaKniznice/OpisneFormulareKniznice/VerejnyDetailOpisnehoFormularaKniznice/225376","0","0",
"OF-225381","Po karanténe","Operatívny lízing osobných automobilov strednej triedy","operatívny lízing, lízing osobných automobilov","34100000-8 Motorové vozidlá; 34110000-1 Osobné automobily; 60000000-8 Dopravné služby (bez prepravy odpadu); 60100000-9 Služby cestnej dopravy","Tovar; Služba","","https://portal.eks.sk/SpravaKniznice/OpisneFormulareKniznice/VerejnyDetailOpisnehoFormularaKniznice/225381","0","0",
"OF-225382","Po karanténe","Dodávka: rozšírenie diskových políc a rozšírenie diskovej kapacity diskových polí","diskové police, diskové polia","30233141-1 Nadbytočné pole nezávislých diskov (RAID); 60000000-8 Dopravné služby (bez prepravy odpadu)","Tovar; Služba","","https://portal.eks.sk/SpravaKniznice/OpisneFormulareKniznice/VerejnyDetailOpisnehoFormularaKniznice/225382","0","0",
"OF-225383","Po karanténe","Kontrola hasiacich prístrojov","pojazdné HP, prenosné HP","71356100-9 Technická kontrola; 60000000-8 Dopravné služby (bez prepravy odpadu)","Služba","","https://portal.eks.sk/SpravaKniznice/OpisneFormulareKniznice/VerejnyDetailOpisnehoFormularaKniznice/225383","1","0",
"OF-225384","Po karanténe","Jednorazový protichemický oblek s návlekmi","Covid_19, ochranný oblek,","35113410-6 Odevy na biologickú alebo chemickú ochranu; 35113400-3 Ochranné a bezpečnostné odevy; 60000000-8 Dopravné služby (bez prepravy odpadu)","Tovar; Služba","","https://portal.eks.sk/SpravaKniznice/OpisneFormulareKniznice/VerejnyDetailOpisnehoFormularaKniznice/225384","1","0",
"OF-225385","Po karanténe","Laboratórny spotrebný materiál a pomôcky","viečka hliníkové, petriho miska","33790000-4 Laboratórny, zdravotnícky alebo farmaceutický sklenený tovar; 60000000-8 Dopravné služby (bez prepravy odpadu)","Tovar; Služba","","https://portal.eks.sk/SpravaKniznice/OpisneFormulareKniznice/VerejnyDetailOpisnehoFormularaKniznice/225385","1","0",
"OF-225387","Po karanténe","stolový počítač (HP ProDesk 400 G6 (7EL75EA)","stolový počítač","30213300-8 Stolový počítač; 60000000-8 Dopravné služby (bez prepravy odpadu)","Tovar; Služba","","https://portal.eks.sk/SpravaKniznice/OpisneFormulareKniznice/VerejnyDetailOpisnehoFormularaKniznice/225387","0","0",
"OF-225388","Po karanténe","Oprava a tlaková skúška prenosných a poajzdných  hasiacich prístrojov","prenosný hasiaci prístroj, oprava a tlaková skúška hasiacich prístrojov, pojazdné hasiace prístroje","50514000-1 Opravy a údržba kovových nádob; 60000000-8 Dopravné služby (bez prepravy odpadu)","Služba","","https://portal.eks.sk/SpravaKniznice/OpisneFormulareKniznice/VerejnyDetailOpisnehoFormularaKniznice/225388","1","0",
"OF-225390","Po karanténe","Laboratórny a zdravotnícky materiál","ihla, rukavice tácka, nožnice, katéter, tácka na inštrumenty","33790000-4 Laboratórny, zdravotnícky alebo farmaceutický sklenený tovar; 60000000-8 Dopravné služby (bez prepravy odpadu)","Tovar; Služba","","https://portal.eks.sk/SpravaKniznice/OpisneFormulareKniznice/VerejnyDetailOpisnehoFormularaKniznice/225390","1","0",
"OF-225391","Po karanténe","Notebook/tablet 2 v 1","notebook, tablet, 2v1","30213100-6 Prenosné počítače; 60000000-8 Dopravné služby (bez prepravy odpadu)","Tovar; Služba","","https://portal.eks.sk/SpravaKniznice/OpisneFormulareKniznice/VerejnyDetailOpisnehoFormularaKniznice/225391","1","0",
"OF-225392","Po karanténe","OOPP -  respirátory","respirátory OOPP","33140000-3 Zdravotnícky spotrebný materiál; 60000000-8 Dopravné služby (bez prepravy odpadu); 18143000-3 Ochranný výstroj","Tovar","","https://portal.eks.sk/SpravaKniznice/OpisneFormulareKniznice/VerejnyDetailOpisnehoFormularaKniznice/225392","1","0",
"OF-225393","Po karanténe","Náhradné diely a príslušenstvo do traktorov a malotraktorov ","mulčovač","16800000-3 Časti poľnohospodárskych a lesníckych mechanizmov; 60000000-8 Dopravné služby (bez prepravy odpadu)","Tovar; Služba","","https://portal.eks.sk/SpravaKniznice/OpisneFormulareKniznice/VerejnyDetailOpisnehoFormularaKniznice/225393","0","0",
"OF-225394","Po karanténe","stolový počítač (HP ProDesk 400 G6, 9UT21EA)","stolový počítač","30213300-8 Stolový počítač; 60000000-8 Dopravné služby (bez prepravy odpadu)","Tovar; Služba","","https://portal.eks.sk/SpravaKniznice/OpisneFormulareKniznice/VerejnyDetailOpisnehoFormularaKniznice/225394","1","0",
"OF-225395","Po karanténe","Polopodzemné kontajnery na zber komunálneho odpadu","Polopodzemný kontajner, nádoby na odpad","34928480-6 Kontajnery a nádoby na odpad a odpadky; 60000000-8 Dopravné služby (bez prepravy odpadu)","Tovar; Služba","","https://portal.eks.sk/SpravaKniznice/OpisneFormulareKniznice/VerejnyDetailOpisnehoFormularaKniznice/225395","0","0",
"OF-225396","Po karanténe","Tonery do tlačiarní","toner, tlač, páska,","30125100-2 Tonerové náplne","Tovar; Služba","","https://portal.eks.sk/SpravaKniznice/OpisneFormulareKniznice/VerejnyDetailOpisnehoFormularaKniznice/225396","0","0",
"OF-225397","Po karanténe","Trúbky, potrubia, hadice a armatúry ","hadice","44165100-5 Hadice; 60000000-8 Dopravné služby (bez prepravy odpadu)","Tovar; Služba","","https://portal.eks.sk/SpravaKniznice/OpisneFormulareKniznice/VerejnyDetailOpisnehoFormularaKniznice/225397","1","0",
"OF-225400","Po karanténe","notebook (HP Spectre x360 13-aw0109nc, 187L7EA)","notebook","30213100-6 Prenosné počítače; 60000000-8 Dopravné služby (bez prepravy odpadu)","Tovar; Služba","","https://portal.eks.sk/SpravaKniznice/OpisneFormulareKniznice/VerejnyDetailOpisnehoFormularaKniznice/225400","0","0",
"OF-225402","Po karanténe","Notebook","počítač","30213100-6 Prenosné počítače; 60000000-8 Dopravné služby (bez prepravy odpadu)","Tovar; Služba","","https://portal.eks.sk/SpravaKniznice/OpisneFormulareKniznice/VerejnyDetailOpisnehoFormularaKniznice/225402","1","0",
"OF-225403","Po karanténe","Nákup gastrozariadení pre kuchyňu ŠJ","elektrická smažiaca panvica, hromadné stravovanie, inštalácia","39312000-2 Zariadenia na prípravu jedál; 39220000-0 Kuchynské zariadenie, domáce potreby a potreby pre domáce hospodárstvo a dodávky pre stravovacie zariadenia; 60000000-8 Dopravné služby (bez prepravy odpadu)","Tovar; Služba","","https://portal.eks.sk/SpravaKniznice/OpisneFormulareKniznice/VerejnyDetailOpisnehoFormularaKniznice/225403","0","0",
"OF-225405","Po karanténe","Stolové počítače typu  pre školy ","počítačová technika, stolový počítač, pc, all-in-one, notebook","30213300-8 Stolový počítač; 30213000-5 Osobné počítače; 60000000-8 Dopravné služby (bez prepravy odpadu)","Tovar; Služba","","https://portal.eks.sk/SpravaKniznice/OpisneFormulareKniznice/VerejnyDetailOpisnehoFormularaKniznice/225405","1","0",
"OF-225406","Po karanténe","Tlačiarenské služby","tlač, tlačiarenské služby","79810000-5 Tlačiarenské služby; 60000000-8 Dopravné služby (bez prepravy odpadu)","Služba; Tovar","","https://portal.eks.sk/SpravaKniznice/OpisneFormulareKniznice/VerejnyDetailOpisnehoFormularaKniznice/225406","1","0",
"OF-225407","Po karanténe","Prenosný hĺbkomer","hĺbka","38300000-8 Meracie prístroje; 60000000-8 Dopravné služby (bez prepravy odpadu)","Tovar","","https://portal.eks.sk/SpravaKniznice/OpisneFormulareKniznice/VerejnyDetailOpisnehoFormularaKniznice/225407","1","0",
"OF-225409","Po karanténe","Tlačiarenské služby","tlač, tlačiarenské služby","79810000-5 Tlačiarenské služby; 60000000-8 Dopravné služby (bez prepravy odpadu)","Služba; Tovar","","https://portal.eks.sk/SpravaKniznice/OpisneFormulareKniznice/VerejnyDetailOpisnehoFormularaKniznice/225409","1","0",
"OF-225410","Po karanténe","PC zostava 2020 pre sledovanie Covid-19","PC, osobný počítač s príslušenstvom","30213000-5 Osobné počítače; 60000000-8 Dopravné služby (bez prepravy odpadu)","Tovar; Služba","","https://portal.eks.sk/SpravaKniznice/OpisneFormulareKniznice/VerejnyDetailOpisnehoFormularaKniznice/225410","1","0",
"OF-225413","Po karanténe","Informačná tabuľa na dvere","Informačná tabuľa na dvere","44423450-0 Menovky; 60000000-8 Dopravné služby (bez prepravy odpadu)","Tovar; Služba","","https://portal.eks.sk/SpravaKniznice/OpisneFormulareKniznice/VerejnyDetailOpisnehoFormularaKniznice/225413","1","0",
"OF-225414","Po karanténe","Rádioprijímač s CD","Rádioprijímač s CD","32331300-5 Prístroje na reprodukciu zvuku; 60000000-8 Dopravné služby (bez prepravy odpadu)","Tovar; Služba","","https://portal.eks.sk/SpravaKniznice/OpisneFormulareKniznice/VerejnyDetailOpisnehoFormularaKniznice/225414","1","0",
"OF-225417","Po karanténe","Žiarovo pozinkované rúry  ZN 2"" (Ø 60 mm)","rúry, stĺpy, stožiare","44144000-1 Stĺpy; 44212200-1 Piliere, stožiare, veže, pylóny a stĺpy; 60000000-8 Dopravné služby (bez prepravy odpadu)","Tovar; Služba","","https://portal.eks.sk/SpravaKniznice/OpisneFormulareKniznice/VerejnyDetailOpisnehoFormularaKniznice/225417","1","0",
"OF-225418","Po karanténe","IKT technika - s príslušenstvom","grafický tablet, diaľkový ovládač, prezentér","30213100-6 Prenosné počítače; 30237000-9 Časti a príslušenstvo počítačov a spotrebný materiál k nim; 30213200-7 Tabletový počítač; 60000000-8 Dopravné služby (bez prepravy odpadu)","Tovar; Služba","","https://portal.eks.sk/SpravaKniznice/OpisneFormulareKniznice/VerejnyDetailOpisnehoFormularaKniznice/225418","1","0",
"OF-225419","Po karanténe","Tlačiarenské služby","tlač, tlačiarenské služby","79810000-5 Tlačiarenské služby; 60000000-8 Dopravné služby (bez prepravy odpadu)","Služba; Tovar","","https://portal.eks.sk/SpravaKniznice/OpisneFormulareKniznice/VerejnyDetailOpisnehoFormularaKniznice/225419","1","0",
"OF-225420","Po karanténe","Nákup stolových kalendárov a diárov 2021","stolový kalendár a diár","30199792-8 Kalendáre; 22817000-0 Diáre alebo osobné organizéry; 60000000-8 Dopravné služby (bez prepravy odpadu)","Tovar; Služba","","https://portal.eks.sk/SpravaKniznice/OpisneFormulareKniznice/VerejnyDetailOpisnehoFormularaKniznice/225420","1","0",
"OF-225421","Po karanténe","IKT a príslušenstvo - webkamera, mikrofón","webkamera, mikrofón","30237000-9 Časti a príslušenstvo počítačov a spotrebný materiál k nim; 30237240-3 Webová kamera; 32341000-5 Mikrofóny; 60000000-8 Dopravné služby (bez prepravy odpadu)","Tovar; Služba","","https://portal.eks.sk/SpravaKniznice/OpisneFormulareKniznice/VerejnyDetailOpisnehoFormularaKniznice/225421","1","0",
"OF-225422","Po karanténe","Fotopasca Bushnell-24MP TROPHY CAM AGGRESOR HD CAMO LOW GLOW","fotopasca Bushnell","38651000-3 Fotografické prístroje; 38650000-6 Fotografické zariadenia; 60000000-8 Dopravné služby (bez prepravy odpadu)","Tovar; Služba","","https://portal.eks.sk/SpravaKniznice/OpisneFormulareKniznice/VerejnyDetailOpisnehoFormularaKniznice/225422","0","0",
"OF-225423","Po karanténe","Nárezový stroj ","kuchynské stroje","39314000-6 Priemyselné vybavenie kuchýň; 39711211-1 Mixéry potravín; 60000000-8 Dopravné služby (bez prepravy odpadu)","Tovar; Služba","","https://portal.eks.sk/SpravaKniznice/OpisneFormulareKniznice/VerejnyDetailOpisnehoFormularaKniznice/225423","1","0",
"OF-225424","Po karanténe","Asfaltový betón :  AC8 obrusný II,  AC11 obrusný II - ( LV/2_2020 )","asfaltový betón, obrusná vrstva","44113300-8 Obalené kamenivo","Tovar","","https://portal.eks.sk/SpravaKniznice/OpisneFormulareKniznice/VerejnyDetailOpisnehoFormularaKniznice/225424","1","0",
"OF-225425","Po karanténe","Filamenty pre FDM 3D tlačiareň ","Filament, 3D tlačiareň, PET-G, Devil Designe","30125000-1 Časti a príslušenstvo fotokopírovacích prístrojov; 60000000-8 Dopravné služby (bez prepravy odpadu)","Tovar; Služba","","https://portal.eks.sk/SpravaKniznice/OpisneFormulareKniznice/VerejnyDetailOpisnehoFormularaKniznice/225425","1","0",
"OF-225426","Po karanténe","Kancelárske potreby","kalendár, tlačivo, zvýrazňovač, pero, náplň do pera, pentelka, tuha, lepiaca páska, diár, lepiaca tyčinka, lepidlo, sáčky, obálky, euroobal, spony, lišta násuvná,  papier, fólia, zošit, box, blok, výkres, štetec, tuš, paleta, záložky, servítky, farba","30192000-1 Kancelárske potreby; 30197642-8 Papier na fotokopírovanie a xerografický papier; 30199792-8 Kalendáre; 30192121-5 Guľôčkové perá; 22852000-7 Zakladače; 39292500-0 Pravítka; 39224210-3 Maliarske štetce; 44812000-5 Farby na umeleckú maľbu; 60000000-8 Dopravné služby (bez prepravy odpadu)","Tovar; Služba","","https://portal.eks.sk/SpravaKniznice/OpisneFormulareKniznice/VerejnyDetailOpisnehoFormularaKniznice/225426","1","0",
"OF-225429","Po karanténe","Zdravotnícke - učebné pomôcky pre PA","Zdravotnícke pomôcky, figuríny, elektrický masérsky stôl, tréner pre dojčenie, model dieťaťa pe dojčenie, trenažér, simulátor, fyzioterapia, pôrodníctvo","33196000-0 Zdravotné pomôcky; 33100000-1 Zdravotnícke vybavenie; 33140000-3 Zdravotnícky spotrebný materiál; 60000000-8 Dopravné služby (bez prepravy odpadu)","Tovar; Služba","","https://portal.eks.sk/SpravaKniznice/OpisneFormulareKniznice/VerejnyDetailOpisnehoFormularaKniznice/225429","1","0",
"OF-225431","Po karanténe","IKT - mikrofóny","mikrofón stolný","30237000-9 Časti a príslušenstvo počítačov a spotrebný materiál k nim; 32341000-5 Mikrofóny; 60000000-8 Dopravné služby (bez prepravy odpadu)","Tovar; Služba","","https://portal.eks.sk/SpravaKniznice/OpisneFormulareKniznice/VerejnyDetailOpisnehoFormularaKniznice/225431","1","0",
"OF-225433","Po karanténe","Jedálenský stôl","stôl do jedálne","39143210-1 Jedálenské stoly; 60000000-8 Dopravné služby (bez prepravy odpadu)","Tovar; Služba","","https://portal.eks.sk/SpravaKniznice/OpisneFormulareKniznice/VerejnyDetailOpisnehoFormularaKniznice/225433","0","0",
"OF-225436","Po karanténe","Korytový žehliaci lis (parný)","žehlenie, manglovanie","42932000-8 Mangle; 42718100-3 Žehliace stroje; 60000000-8 Dopravné služby (bez prepravy odpadu)","Tovar; Služba","","https://portal.eks.sk/SpravaKniznice/OpisneFormulareKniznice/VerejnyDetailOpisnehoFormularaKniznice/225436","0","0",
"OF-225437","Po karanténe","ND na opravu krovinorezu","ND na opravu krovinorezu, hlava do krovinorezu","16311100-9 Kosačky trávnikov, parkov alebo športovísk; 44311000-3 Lanká; 44514200-8 Časti náradia; 60000000-8 Dopravné služby (bez prepravy odpadu)","Tovar; Služba","","https://portal.eks.sk/SpravaKniznice/OpisneFormulareKniznice/VerejnyDetailOpisnehoFormularaKniznice/225437","1","0",
"OF-225438","Po karanténe","Maliarsky materiál","farba, maliarsky valček, páska maliarska","44800000-8 Náterové farby, laky a tmely; 24200000-6 Farby a pigmenty; 60000000-8 Dopravné služby (bez prepravy odpadu)","Tovar; Služba","","https://portal.eks.sk/SpravaKniznice/OpisneFormulareKniznice/VerejnyDetailOpisnehoFormularaKniznice/225438","1","0",
