"OpisnyFormularIdentifikator","OpisnyFormularStav","OpisnyFormularNazov","OpisnyFormularKlucoveSlova","OpisnyFormularCpv","OpisnyFormularDruh","OpisnyFormularKategoriaSluzieb","OpisnyFormularUrl","OpisnyFormularPocetVyhlasenychZakaziek","OpisnyFormularObchodovanaSumaBezDPH",
"OF-209139","Po karanténe","vybavenie biologicko - chemických učební a fyzikálnej učebne","váhy, laboratórne sklo, varič, teplomer, bezpečnostná skriňa, laboratórne stoly, učebné pomôcky, prenosné počítače","39711440-5 Variče; 33793000-5 Sklenené výrobky pre laboratóriá; 38311000-8 Elektronické váhy a ich príslušenstvo; 38412000-6 Teplomery; 44421722-4 Bezpečnostné skrine; 39181000-4 Laboratórne stoly; 39162200-7 Učebné pomôcky a zariadenia; 30213100-6 Prenosné počítače","Tovar; Služba","","https://portal.eks.sk/SpravaKniznice/OpisneFormulareKniznice/VerejnyDetailOpisnehoFormularaKniznice/209139","1","0",
"OF-209141","Po karanténe","Tlač foldrov so striebornou razbou","tlač, tlačiarenské služby, folder","79820000-8 Služby súvisiace s tlačou; 22000000-0 Tlačené výrobky a príbuzné produkty","Služba","","https://portal.eks.sk/SpravaKniznice/OpisneFormulareKniznice/VerejnyDetailOpisnehoFormularaKniznice/209141","1","979,160",
"OF-209143","Po karanténe","Kancelárske potreby","Kancelársky papier, euroobaly, obálky......","30192000-1 Kancelárske potreby; 60000000-8 Dopravné služby (bez prepravy odpadu)","Tovar; Služba","","https://portal.eks.sk/SpravaKniznice/OpisneFormulareKniznice/VerejnyDetailOpisnehoFormularaKniznice/209143","1","2915,830",
"OF-209144","Po karanténe","Tlač  časopisu ","tlač, tlačiarenská služba, výroba tlače, tlač a distribúcia materiálov,","79800000-2 Tlačiarenské a príbuzné služby; 79810000-5 Tlačiarenské služby; 79820000-8 Služby súvisiace s tlačou; 79824000-6 Tlačiarenské a distribučné služby; 60000000-8 Dopravné služby (bez prepravy odpadu)","Služba","","https://portal.eks.sk/SpravaKniznice/OpisneFormulareKniznice/VerejnyDetailOpisnehoFormularaKniznice/209144","1","1007,270",
"OF-209146","Po karanténe","Ochranné pracovné pomôcky ","ochranné okuliare","33735100-2 Ochranné okuliare; 60000000-8 Dopravné služby (bez prepravy odpadu)","Tovar; Služba","","https://portal.eks.sk/SpravaKniznice/OpisneFormulareKniznice/VerejnyDetailOpisnehoFormularaKniznice/209146","1","299,000",
"OF-209147","Po karanténe","Propagačné materiály s potlačou do súťaží","pero, USB, antistresová lopta, kozmetická taška, pršiplášť v púzdre","22462000-6 Propagačný materiál; 39294100-0 Informačné a propagačné výrobky; 79342200-5 Propagačné služby; 60000000-8 Dopravné služby (bez prepravy odpadu)","Tovar; Služba","","https://portal.eks.sk/SpravaKniznice/OpisneFormulareKniznice/VerejnyDetailOpisnehoFormularaKniznice/209147","0","0",
"OF-209148","Po karanténe","Liečivá","liečivo, infúzia, roztok, liek","33600000-6 Farmaceutické výrobky; 33690000-3 Rôzne liečivá; 60000000-8 Dopravné služby (bez prepravy odpadu)","Tovar; Služba","","https://portal.eks.sk/SpravaKniznice/OpisneFormulareKniznice/VerejnyDetailOpisnehoFormularaKniznice/209148","1","0",
"OF-209149","Po karanténe","Zdravotnícky spotrebný materiál","ihla, kanyla, šitie, náplasť","33140000-3 Zdravotnícky spotrebný materiál; 60000000-8 Dopravné služby (bez prepravy odpadu)","Tovar; Služba","","https://portal.eks.sk/SpravaKniznice/OpisneFormulareKniznice/VerejnyDetailOpisnehoFormularaKniznice/209149","1","0",
"OF-209150","Po karanténe","Elektrické olejové radiátory a automatické prečerpávacie stanice","Elektrické olejové radiátory a automatické prečerpávacie stanice","44621000-9 Radiátory a ohrievače; 42122220-8 Čerpadlá odpadových vôd; 60000000-8 Dopravné služby (bez prepravy odpadu)","Tovar; Služba","","https://portal.eks.sk/SpravaKniznice/OpisneFormulareKniznice/VerejnyDetailOpisnehoFormularaKniznice/209150","1","2200,000",
"OF-209152","Po karanténe","Originálne tonery do multifunkčných zariadení","toner","30125110-5 Toner do laserových tlačiarní/faxových prístrojov","Tovar; Služba","","https://portal.eks.sk/SpravaKniznice/OpisneFormulareKniznice/VerejnyDetailOpisnehoFormularaKniznice/209152","1","152990,000",
"OF-209153","Po karanténe","Dymové clony","dymostroj","39515110-9 Dymové clony","Tovar; Služba","","https://portal.eks.sk/SpravaKniznice/OpisneFormulareKniznice/VerejnyDetailOpisnehoFormularaKniznice/209153","1","4500,000",
"OF-209155","Po karanténe","Kancelársky nábytok","stôl, stolička, kreslo, stolík, vešiak, kancelária, vybavenie","39130000-2 Kancelársky nábytok; 39100000-3 Nábytok; 39121200-8 Stoly; 39121100-7 Písacie stoly; 39112000-0 Stoličky; 39113000-7 Rôzne sedadlá a stoličky; 30195800-0 Závesné vešiaky alebo držiaky; 60000000-8 Dopravné služby (bez prepravy odpadu)","Tovar; Služba","","https://portal.eks.sk/SpravaKniznice/OpisneFormulareKniznice/VerejnyDetailOpisnehoFormularaKniznice/209155","0","0",
"OF-209156","Po karanténe","Technologické vybavenie zberného dvora - stroje","nakladač, drvič stavebného odpadu, nosič s rukou","16000000-5 Poľnohospodárske stroje; 34223300-9 Prívesy; 34223370-0 Prívesy s vyklápaním; 16810000-6 Časti poľnohospodárskych mechanizmov; 43414000-8 Drviče; 60000000-8 Dopravné služby (bez prepravy odpadu)","Tovar; Služba","","https://portal.eks.sk/SpravaKniznice/OpisneFormulareKniznice/VerejnyDetailOpisnehoFormularaKniznice/209156","0","0",
"OF-209157","Po karanténe","Technologické vybavenie zberného dvora - nádoby a kontajnery","zberné nádoby, kontajner","44613800-8 Kontajnery na odpadový materiál; 60000000-8 Dopravné služby (bez prepravy odpadu)","Tovar; Služba","","https://portal.eks.sk/SpravaKniznice/OpisneFormulareKniznice/VerejnyDetailOpisnehoFormularaKniznice/209157","0","0",
"OF-209158","Po karanténe","IT - príslušenstvo","príslušenstvo","30000000-9 Kancelárske a počítacie stroje, vybavenie a spotrebný materiál s výnimkou nábytku a softvérových balíkov; 30237100-0 Časti počítačov; 30237460-1 Počítačové klávesnice; 30237000-9 Časti a príslušenstvo počítačov a spotrebný materiál k nim; 30234500-3 Pamäťové archivačné médiá; 30213100-6 Prenosné počítače; 38652120-7 Videoprojektory; 60000000-8 Dopravné služby (bez prepravy odpadu)","Tovar; Služba","","https://portal.eks.sk/SpravaKniznice/OpisneFormulareKniznice/VerejnyDetailOpisnehoFormularaKniznice/209158","2","8800,790",
"OF-209159","Po karanténe","Kancelárske potreby","kancelárske potreby","30192000-1 Kancelárske potreby; 30199230-1 Obálky; 60000000-8 Dopravné služby (bez prepravy odpadu)","Tovar; Služba","","https://portal.eks.sk/SpravaKniznice/OpisneFormulareKniznice/VerejnyDetailOpisnehoFormularaKniznice/209159","1","289,990",
"OF-209160","Po karanténe","Tonery originál","toner, tlačiareň, náplň","30125100-2 Tonerové náplne; 60000000-8 Dopravné služby (bez prepravy odpadu)","Tovar; Služba","","https://portal.eks.sk/SpravaKniznice/OpisneFormulareKniznice/VerejnyDetailOpisnehoFormularaKniznice/209160","1","564,000",
"OF-209161","Po karanténe","Technické vybavenie zberného dvora - stroje","Traktor, náves, drvič BRO","16700000-2 Traktory/ťahače; 43414000-8 Drviče; 34223100-7 Návesy; 60000000-8 Dopravné služby (bez prepravy odpadu)","Tovar; Služba","","https://portal.eks.sk/SpravaKniznice/OpisneFormulareKniznice/VerejnyDetailOpisnehoFormularaKniznice/209161","0","0",
"OF-209162","Po karanténe","Technické vybavenie zberného dvora - nakladač samochodný","Nakladač samochodný","34144710-8 Nakladače na kolesách; 16000000-5 Poľnohospodárske stroje; 60000000-8 Dopravné služby (bez prepravy odpadu)","Tovar; Služba","","https://portal.eks.sk/SpravaKniznice/OpisneFormulareKniznice/VerejnyDetailOpisnehoFormularaKniznice/209162","0","0",
"OF-209163","Po karanténe","Technické vybavenie zberného dvora - nádoby a kontajnery","Kontajner na textil, zberné nádoby, kontajner","44613800-8 Kontajnery na odpadový materiál; 60000000-8 Dopravné služby (bez prepravy odpadu)","Tovar; Služba","","https://portal.eks.sk/SpravaKniznice/OpisneFormulareKniznice/VerejnyDetailOpisnehoFormularaKniznice/209163","0","0",
"OF-209164","Po karanténe","Výrub stromov","výrub stromov","77211500-7 Údržba stromov; 60000000-8 Dopravné služby (bez prepravy odpadu)","Služba","","https://portal.eks.sk/SpravaKniznice/OpisneFormulareKniznice/VerejnyDetailOpisnehoFormularaKniznice/209164","1","4550,000",
"OF-209170","Po karanténe","Chémia pre úpravu a dezinfekciu bazénovej vody","chémia, voda, bazén, úprava, dezinfekcia, chlór, PH","24962000-5 Chemikálie na úpravu vody; 24311900-6 Chlór","Tovar","","https://portal.eks.sk/SpravaKniznice/OpisneFormulareKniznice/VerejnyDetailOpisnehoFormularaKniznice/209170","1","158,330",
"OF-209172","Po karanténe","Čistiace a hygienické potreby alebo ekvivalent alebo ekvivalent","Čistiace a hygienické potreby","39831300-9 Čistiace prostriedky na podlahu; 39832000-3 Čistiace prostriedky na riad; 39832100-4 Čistiaci prášok na riad; 33761000-2 Toaletný papier; 39224300-1 Metly a kefy a iné výrobky na upratovanie domácností; 39542000-3 Handry; 39514200-0 Kychynské utierky; 33760000-5 Toaletný papier, vreckovky, uteráky na ruky a servítky; 33711900-6 Mydlo; 60000000-8 Dopravné služby (bez prepravy odpadu)","Tovar; Služba","","https://portal.eks.sk/SpravaKniznice/OpisneFormulareKniznice/VerejnyDetailOpisnehoFormularaKniznice/209172","1","421,670",
"OF-209173","Po karanténe","Ambulantné monitory krvného tlaku","monitorovanie krvného tlaku","33121000-4 Systém pre dlhodobé ambulantné zaznamenávanie; 51410000-9 Inštalácia lekárskych zariadení; 60000000-8 Dopravné služby (bez prepravy odpadu)","Tovar; Služba","","https://portal.eks.sk/SpravaKniznice/OpisneFormulareKniznice/VerejnyDetailOpisnehoFormularaKniznice/209173","1","0",
"OF-209175","Po karanténe","Výrub a rez drevín","výrub stromov","77211500-7 Údržba stromov; 60000000-8 Dopravné služby (bez prepravy odpadu)","Služba","","https://portal.eks.sk/SpravaKniznice/OpisneFormulareKniznice/VerejnyDetailOpisnehoFormularaKniznice/209175","1","3980,000",
"OF-209176","Po karanténe","Čistiace a hygienické potreby","Čistiace a hygienické potreby","39831300-9 Čistiace prostriedky na podlahu; 39224300-1 Metly a kefy a iné výrobky na upratovanie domácností; 39542000-3 Handry; 33760000-5 Toaletný papier, vreckovky, uteráky na ruky a servítky; 60000000-8 Dopravné služby (bez prepravy odpadu)","Tovar; Služba","","https://portal.eks.sk/SpravaKniznice/OpisneFormulareKniznice/VerejnyDetailOpisnehoFormularaKniznice/209176","1","516,670",
"OF-209178","Po karanténe","Dodávka zemného plynu r. 2020 - 2021","Zemný plyn","09123000-7 Zemný plyn","Tovar; Služba","","https://portal.eks.sk/SpravaKniznice/OpisneFormulareKniznice/VerejnyDetailOpisnehoFormularaKniznice/209178","1","73200,000",
"OF-209179","Po karanténe","Zabezpečenie stravovania zamestnancov prostredníctvom stravných poukážok","Stravovanie, stravné poukážky, zabezpečenie stravovania, hromadné stravovanie, stravovacie služby, služby stravovania.","55520000-1 Služby hromadného stravovania; 60000000-8 Dopravné služby (bez prepravy odpadu)","Služba","","https://portal.eks.sk/SpravaKniznice/OpisneFormulareKniznice/VerejnyDetailOpisnehoFormularaKniznice/209179","1","5469,400",
"OF-209180","Po karanténe","Kuchynské potreby","sada nožov, panvica, džbán, plech na pečenie, poháre","39221120-4 Šálky a poháre; 39221180-2 Kuchárske potreby; 39241000-3 Nože a nožnice; 39221100-8 Kuchynské potreby; 60000000-8 Dopravné služby (bez prepravy odpadu)","Tovar; Služba","","https://portal.eks.sk/SpravaKniznice/OpisneFormulareKniznice/VerejnyDetailOpisnehoFormularaKniznice/209180","0","0",
"OF-209181","Po karanténe","Záhradnícke potreby","Nožnice na živý plot, akumulátorový záhradný vysávač, záhradný vozík, plastová nádrž na dažďovú vodu","16160000-4 Rôzne záhradnícke potreby; 60000000-8 Dopravné služby (bez prepravy odpadu)","Tovar; Služba","","https://portal.eks.sk/SpravaKniznice/OpisneFormulareKniznice/VerejnyDetailOpisnehoFormularaKniznice/209181","0","0",
"OF-209183","Po karanténe","Spisové dosky so šnúrkami A4 a Rýchloviazače formátu A4","spisové dosky, rýchloviazače","22852100-8 Spisové dosky; 60000000-8 Dopravné služby (bez prepravy odpadu); 22851000-0 Rýchloviazače","Tovar; Služba","","https://portal.eks.sk/SpravaKniznice/OpisneFormulareKniznice/VerejnyDetailOpisnehoFormularaKniznice/209183","1","450,000",
"OF-209184","Po karanténe","Kadernícke a kozmetické prípravky","emulzný peroxid, dvojfázový odličovač, kozmetická čelenka, depilačný vosk, čepeľ","33711600-3 Vlasové prípravky a výrobky; 33711540-4 Nefarmaceutické krémy alebo telové mlieka; 60000000-8 Dopravné služby (bez prepravy odpadu)","Tovar; Služba","","https://portal.eks.sk/SpravaKniznice/OpisneFormulareKniznice/VerejnyDetailOpisnehoFormularaKniznice/209184","1","150,000",
"OF-209185","Po karanténe","Tlač dvojmesačníka","letáky","22140000-3 Letáky; 60000000-8 Dopravné služby (bez prepravy odpadu)","Tovar; Služba","","https://portal.eks.sk/SpravaKniznice/OpisneFormulareKniznice/VerejnyDetailOpisnehoFormularaKniznice/209185","0","0",
"OF-209186","Po karanténe","Rozšírenie integračnej platformy a externých integrácií","Integrácie","72260000-5 Služby súvisiace so softvérom; 72262000-9 Vývoj softvéru; 72263000-6 Implementácia softvéru; 72227000-2 Poradenstvo pri integrácii softvéru; 72316000-3 Analýza údajov","Služba","","https://portal.eks.sk/SpravaKniznice/OpisneFormulareKniznice/VerejnyDetailOpisnehoFormularaKniznice/209186","1","0",
"OF-209188","Po karanténe","Autonabíjačka CTEK","Nabíjačka batérií","31158100-9 Nabíjače batérií; 60000000-8 Dopravné služby (bez prepravy odpadu)","Tovar; Služba","","https://portal.eks.sk/SpravaKniznice/OpisneFormulareKniznice/VerejnyDetailOpisnehoFormularaKniznice/209188","1","113,080",
"OF-209189","Po karanténe","Projektor","Projektor","38652120-7 Videoprojektory; 60000000-8 Dopravné služby (bez prepravy odpadu)","Tovar; Služba","","https://portal.eks.sk/SpravaKniznice/OpisneFormulareKniznice/VerejnyDetailOpisnehoFormularaKniznice/209189","1","0",
"OF-209190","Po karanténe","Prístroj na záznam zvuku - mikrofón + držiak /pavúk/ + rameno na uchytenie držiaka /pavúka/ s mikrofónom","Prístroj na záznam zvuku, mikrofón, držiak /pavúk, rameno na uchytenie držiaka /pavúka/ s mikrofónom","32300000-6 Televízne a rozhlasové prijímače a prístroje na záznam alebo reprodukciu zvuku alebo obrazu; 32341000-5 Mikrofóny; 60000000-8 Dopravné služby (bez prepravy odpadu)","Tovar; Služba","","https://portal.eks.sk/SpravaKniznice/OpisneFormulareKniznice/VerejnyDetailOpisnehoFormularaKniznice/209190","1","289,900",
"OF-209191","Po karanténe","Externé disky","Externé disky WD My Book 14TB alebo ekvivalent","30230000-0 Zariadenia súvisiace s počítačmi; 30200000-1 Počítačové zariadenia a spotrebný materiál; 30233100-2 Počítačové pamäťové jednotky","Tovar","","https://portal.eks.sk/SpravaKniznice/OpisneFormulareKniznice/VerejnyDetailOpisnehoFormularaKniznice/209191","1","487,500",
"OF-209192","Po karanténe","Mikrovlnná rúra","Mikrovlnná rúra","39700000-9 Spotrebiče pre domácnosť; 60000000-8 Dopravné služby (bez prepravy odpadu)","Tovar; Služba","","https://portal.eks.sk/SpravaKniznice/OpisneFormulareKniznice/VerejnyDetailOpisnehoFormularaKniznice/209192","1","64,110",
"OF-209193","Po karanténe","Čistiace a hygienické potreby","Čistiace a hygienické potreby","39831300-9 Čistiace prostriedky na podlahu; 39224300-1 Metly a kefy a iné výrobky na upratovanie domácností; 39542000-3 Handry; 33760000-5 Toaletný papier, vreckovky, uteráky na ruky a servítky; 60000000-8 Dopravné služby (bez prepravy odpadu)","Tovar; Služba","","https://portal.eks.sk/SpravaKniznice/OpisneFormulareKniznice/VerejnyDetailOpisnehoFormularaKniznice/209193","0","0",
"OF-209194","Po karanténe","Disky pre dátové centrá  NAS - SEAGETE IRONWOLF alebo ekvivalent","Disky","30200000-1 Počítačové zariadenia a spotrebný materiál; 30230000-0 Zariadenia súvisiace s počítačmi; 48823000-3 Súborové servery; 32584000-0 Dátové médiá","Tovar","","https://portal.eks.sk/SpravaKniznice/OpisneFormulareKniznice/VerejnyDetailOpisnehoFormularaKniznice/209194","1","805,830",
"OF-209195","Po karanténe","Dacia LODGY Arctica 7 miest TCe  75 kW/102 k SandS","Dacia LODGY","34110000-1 Osobné automobily; 34136000-9 Dodávkové automobily; 34136100-0 Ľahké dodávkové automobily","Tovar; Služba","","https://portal.eks.sk/SpravaKniznice/OpisneFormulareKniznice/VerejnyDetailOpisnehoFormularaKniznice/209195","1","10499,000",
"OF-209196","Po karanténe","Zber, odvoz a zneškodnenie biologicky rozložiteľného kuchynského odpadu","kuchynský odpad, zber, odvoz, likvidácia, biologicky rozložiteľný, zmesi tukov a olejov","90510000-5 Likvidácia a spracovanie odpadu; 90512000-9 Služby na prepravu odpadu; 90500000-2 Služby súvisiace s likvidáciou odpadu a odpadom; 90511000-2 Služby na zber odpadu","Služba","","https://portal.eks.sk/SpravaKniznice/OpisneFormulareKniznice/VerejnyDetailOpisnehoFormularaKniznice/209196","1","441,670",
"OF-209197","Po karanténe","Notebooky","Notebook","30213100-6 Prenosné počítače; 60000000-8 Dopravné služby (bez prepravy odpadu)","Tovar; Služba","","https://portal.eks.sk/SpravaKniznice/OpisneFormulareKniznice/VerejnyDetailOpisnehoFormularaKniznice/209197","1","0",
"OF-209198","Po karanténe","Komunálne vozidlo na umývanie plôch a komunikácií","Komunálne vozidlo na umývanie plôch a komunikácií","34144400-2 Vozidlá na údržbu ciest; 60000000-8 Dopravné služby (bez prepravy odpadu)","Tovar; Služba","","https://portal.eks.sk/SpravaKniznice/OpisneFormulareKniznice/VerejnyDetailOpisnehoFormularaKniznice/209198","0","0",
"OF-209199","Po karanténe","Nákup elektro-materiálu ","elektro-materiál","31531000-7 Žiarovky; 31681410-0 Elektromateriály; 31520000-7 Lampy/svietidlá a príslušenstvo k nim; 60000000-8 Dopravné služby (bez prepravy odpadu)","Tovar; Služba","","https://portal.eks.sk/SpravaKniznice/OpisneFormulareKniznice/VerejnyDetailOpisnehoFormularaKniznice/209199","1","1391,670",
"OF-209201","Po karanténe","Dodávka pevného paliva - koks","pevné palivo, koks","09113000-4 Koks; 09110000-3 Pevné palivá; 60000000-8 Dopravné služby (bez prepravy odpadu)","Tovar; Služba","","https://portal.eks.sk/SpravaKniznice/OpisneFormulareKniznice/VerejnyDetailOpisnehoFormularaKniznice/209201","1","16760,000",
"OF-209202","Po karanténe","Chemikálie","chemikálie, dimetylsulfoxid,  formaldehyd","24320000-3 Základné organické chemikálie; 60000000-8 Dopravné služby (bez prepravy odpadu)","Tovar; Služba","","https://portal.eks.sk/SpravaKniznice/OpisneFormulareKniznice/VerejnyDetailOpisnehoFormularaKniznice/209202","1","131,000",
"OF-209203","Po karanténe","Kefy na valcový zametací stroj HAKO Citymaster 600","kefa, zametací stroj","34900000-6 Rôzne dopravné zariadenia a náhradné diely; 60000000-8 Dopravné služby (bez prepravy odpadu)","Tovar; Služba","","https://portal.eks.sk/SpravaKniznice/OpisneFormulareKniznice/VerejnyDetailOpisnehoFormularaKniznice/209203","0","0",
"OF-209204","Po karanténe","Laminárny box","laminárny box","38000000-5 Laboratórne, optické a presné prístroje a vybavenie (s výnimkou skiel); 51410000-9 Inštalácia lekárskych zariadení; 60000000-8 Dopravné služby (bez prepravy odpadu)","Tovar; Služba","","https://portal.eks.sk/SpravaKniznice/OpisneFormulareKniznice/VerejnyDetailOpisnehoFormularaKniznice/209204","1","0",
"OF-209205","Po karanténe","Smerovač siete ethernet ","smerovač","32413100-2 Sieťové smerovače; 60000000-8 Dopravné služby (bez prepravy odpadu)","Tovar; Služba","","https://portal.eks.sk/SpravaKniznice/OpisneFormulareKniznice/VerejnyDetailOpisnehoFormularaKniznice/209205","0","0",
"OF-209206","Po karanténe","bezpečnostná kamera","bezpečnostná kamera","35125300-2 Bezpečnostné kamery","Tovar","","https://portal.eks.sk/SpravaKniznice/OpisneFormulareKniznice/VerejnyDetailOpisnehoFormularaKniznice/209206","0","0",
"OF-209207","Po karanténe","Počítač","počítač","30213000-5 Osobné počítače; 30213300-8 Stolový počítač; 60000000-8 Dopravné služby (bez prepravy odpadu)","Tovar; Služba","","https://portal.eks.sk/SpravaKniznice/OpisneFormulareKniznice/VerejnyDetailOpisnehoFormularaKniznice/209207","1","934,170",
"OF-209209","Po karanténe","Kartotečná skrinka kovová- 4 zásuvková","Registračná skrinka, listkovnica kovová","39132200-8 Kartotékové skrine; 60000000-8 Dopravné služby (bez prepravy odpadu)","Tovar; Služba","","https://portal.eks.sk/SpravaKniznice/OpisneFormulareKniznice/VerejnyDetailOpisnehoFormularaKniznice/209209","0","0",
"OF-209210","Po karanténe","1 spiatočná letenka z Viedne do Bruselu od 26.2.-1.3.2020","letenka, poistenie storna leteniek","60410000-5 Pravidelné letecké dopravné služby","Služba","","https://portal.eks.sk/SpravaKniznice/OpisneFormulareKniznice/VerejnyDetailOpisnehoFormularaKniznice/209210","1","219,200",
"OF-209213","Po karanténe","Čistiace a dezinfekčné prostriedky ","Čistiace prostriedky, dezinfekčné prostriedky, umývacie prostriedky, odmasťovacie prostriedky, prostriedky na odstraňovanie vodného kameňa, leštiace prostriedky,  handry .","39800000-0 Čistiace a leštiace výrobky; 39831300-9 Čistiace prostriedky na podlahu; 39831600-2 Čistiace prostriedky na toalety; 39832000-3 Čistiace prostriedky na riad; 39830000-9 Čistiace výrobky; 39832100-4 Čistiaci prášok na riad; 39831220-4 Odmasťovacie prostriedky; 39831000-6 Pracie prostriedky; 39831200-8 Saponáty; 39831210-1 Saponáty na umývanie riadu; 24455000-8 Dezinfekčné prostriedky; 39224320-7 Špongie; 39224310-4 WC kefy; 39542000-3 Handry","Tovar; Služba","","https://portal.eks.sk/SpravaKniznice/OpisneFormulareKniznice/VerejnyDetailOpisnehoFormularaKniznice/209213","1","2300,000",
"OF-209214","Po karanténe","Zdravotné vybavenie","paravan, vozík, stravovanie, servírovací vozík,","33192300-5 Zdravotnícke vybavenie okrem lôžok a stolov; 60000000-8 Dopravné služby (bez prepravy odpadu)","Tovar; Služba","","https://portal.eks.sk/SpravaKniznice/OpisneFormulareKniznice/VerejnyDetailOpisnehoFormularaKniznice/209214","0","0",
"OF-209215","Po karanténe","Kancelárske kreslo s podrúčkami","kreslo, otočné, podrúčky","39113100-8 Kreslá; 60000000-8 Dopravné služby (bez prepravy odpadu)","Tovar; Služba","","https://portal.eks.sk/SpravaKniznice/OpisneFormulareKniznice/VerejnyDetailOpisnehoFormularaKniznice/209215","1","680,000",
"OF-209217","Po karanténe","Sprchovacia stolička","sprchovanie, hygiena, umývanie","33196000-0 Zdravotné pomôcky","Tovar; Služba","","https://portal.eks.sk/SpravaKniznice/OpisneFormulareKniznice/VerejnyDetailOpisnehoFormularaKniznice/209217","1","232,500",
"OF-209218","Po karanténe","Tablet","Tablet","30213200-7 Tabletový počítač; 60000000-8 Dopravné služby (bez prepravy odpadu)","Tovar; Služba","","https://portal.eks.sk/SpravaKniznice/OpisneFormulareKniznice/VerejnyDetailOpisnehoFormularaKniznice/209218","1","769,900",
"OF-209219","Po karanténe","Kancelárske potreby a kancelársky papier na obdobie 12 mesiacov","farbičky,  obálka, blok, box,  ceruzka, pečiatka,  diár, dierovač, dosky, tlačivo, etiketa, euroobal, fixa, pero, guma, papier, lepiaca  páska, laminovací stroj, skartátor,  laminovacia fólia, lepiaca tyčinka, magnetická tabuľa,  nožnice, obal, odkladacia mapa, odspinkovač, kalendár, plastový hrebeň,  popisovač, tabuľa, pripinačky, rýchloviazač, blok, spony, spinky, strúhadlo, zakladač, zásuvka, zošit, zvýrazňovač,","30192000-1 Kancelárske potreby; 60000000-8 Dopravné služby (bez prepravy odpadu); 30197642-8 Papier na fotokopírovanie a xerografický papier","Tovar; Služba","","https://portal.eks.sk/SpravaKniznice/OpisneFormulareKniznice/VerejnyDetailOpisnehoFormularaKniznice/209219","1","0",
"OF-209223","Po karanténe","Zabezpečenie stravovania elektronickou stravnou kartou  ","Elektronické stravné karty, zabezpečenie hromadného stravovania  zamestnancov","55520000-1 Služby hromadného stravovania; 30160000-8 Magnetické karty; 30237131-6 Elektronické karty","Služba; Tovar","","https://portal.eks.sk/SpravaKniznice/OpisneFormulareKniznice/VerejnyDetailOpisnehoFormularaKniznice/209223","1","189565,850",
"OF-209224","Po karanténe","Rýchlovarná kanvica","rýchlovarná kanvica","39710000-2 Elektrické prístroje pre domácnosť","Tovar","","https://portal.eks.sk/SpravaKniznice/OpisneFormulareKniznice/VerejnyDetailOpisnehoFormularaKniznice/209224","1","37,410",
"OF-209228","Po karanténe","Dodávka výpočtovej techniky","notebook vrátane príslušenstva","30213000-5 Osobné počítače; 60000000-8 Dopravné služby (bez prepravy odpadu)","Tovar; Služba","","https://portal.eks.sk/SpravaKniznice/OpisneFormulareKniznice/VerejnyDetailOpisnehoFormularaKniznice/209228","1","2218,330",
"OF-209229","Po karanténe","Laboratórne chemikálie","chemikália, laboratórium, výskum, pokus","24000000-4 Chemické výrobky; 24300000-7 Základné anorganické a organické chemikálie; 60000000-8 Dopravné služby (bez prepravy odpadu)","Tovar; Služba","","https://portal.eks.sk/SpravaKniznice/OpisneFormulareKniznice/VerejnyDetailOpisnehoFormularaKniznice/209229","1","205,000",
