"OpisnyFormularIdentifikator","OpisnyFormularStav","OpisnyFormularNazov","OpisnyFormularKlucoveSlova","OpisnyFormularCpv","OpisnyFormularDruh","OpisnyFormularKategoriaSluzieb","OpisnyFormularUrl","OpisnyFormularPocetVyhlasenychZakaziek","OpisnyFormularObchodovanaSumaBezDPH",
"OF-254182","Po karanténe","Systém na hrudnú drenáž","hrudná drenáž dvojkomorová, suchá drenáž, špeciálny zdravotnícky materiál","33100000-1 Zdravotnícke vybavenie; 33140000-3 Zdravotnícky spotrebný materiál; 33141600-6 Zberače a zberné vaky, drenáže a súpravy; 60000000-8 Dopravné služby (bez prepravy odpadu)","Tovar; Služba","","https://portal.eks.sk/SpravaKniznice/OpisneFormulareKniznice/VerejnyDetailOpisnehoFormularaKniznice/254182","0","0",
"OF-254193","Po karanténe","Očkovacie látky - FSME-IMMUN","očkovacie látky","33651600-4 Očkovacie látky; 60000000-8 Dopravné služby (bez prepravy odpadu)","Tovar; Služba","","https://portal.eks.sk/SpravaKniznice/OpisneFormulareKniznice/VerejnyDetailOpisnehoFormularaKniznice/254193","0","0",
"OF-254203","Po karanténe","Slama","Slama","03114100-4 Slama; 03114000-3 Slama a krmoviny; 03114200-5 Krmoviny; 15700000-5 Krmivo pre zvieratá; 60000000-8 Dopravné služby (bez prepravy odpadu)","Tovar; Služba","","https://portal.eks.sk/SpravaKniznice/OpisneFormulareKniznice/VerejnyDetailOpisnehoFormularaKniznice/254203","0","0",
"OF-254213","Po karanténe","Tlač časopisu","tlač, tlačiarenská služba, výroba tlače, časopis","79810000-5 Tlačiarenské služby; 79800000-2 Tlačiarenské a príbuzné služby; 79823000-9 Tlačiarenské a doručovateľské služby; 79824000-6 Tlačiarenské a distribučné služby; 79820000-8 Služby súvisiace s tlačou; 79821000-5 Konečná úprava tlače; 60000000-8 Dopravné služby (bez prepravy odpadu)","Služba","","https://portal.eks.sk/SpravaKniznice/OpisneFormulareKniznice/VerejnyDetailOpisnehoFormularaKniznice/254213","0","0",
"OF-254222","Po karanténe","Knižná publikácia ","Knižná publikácia , Knihy, Tlačené knihy","22110000-4 Tlačené knihy; 60000000-8 Dopravné služby (bez prepravy odpadu)","Tovar; Služba","","https://portal.eks.sk/SpravaKniznice/OpisneFormulareKniznice/VerejnyDetailOpisnehoFormularaKniznice/254222","0","0",
"OF-254231","Po karanténe","Zabezpečenie pitného režimu v rámci mobilných výjazdov","minerálna voda, pitný režim, nápoje","15981000-8 Minerálne vody; 60000000-8 Dopravné služby (bez prepravy odpadu)","Tovar; Služba","","https://portal.eks.sk/SpravaKniznice/OpisneFormulareKniznice/VerejnyDetailOpisnehoFormularaKniznice/254231","0","0",
"OF-254241","Po karanténe","Zariadenia na klimatizáciu, chladenie vzduchu a príslušenstvo																													","Stojanový ventilátor","39714100-1 Ventilátory; 60000000-8 Dopravné služby (bez prepravy odpadu); 31720000-9 Elektromechanické zariadenia","Tovar; Služba","","https://portal.eks.sk/SpravaKniznice/OpisneFormulareKniznice/VerejnyDetailOpisnehoFormularaKniznice/254241","0","0",
"OF-254254","Po karanténe","Zariadenia na chladenie, mrazenie a príslušenstvo","Chladnička, mraznička","39711123-7 Stojaté chladničky; 60000000-8 Dopravné služby (bez prepravy odpadu)","Tovar; Služba","","https://portal.eks.sk/SpravaKniznice/OpisneFormulareKniznice/VerejnyDetailOpisnehoFormularaKniznice/254254","0","0",
"OF-254266","Po karanténe","Zariadenia súvisiace s PC        ","Taška na notebook, Switch, puzdro, webkamera, myš, držiak na monitor, sieťový kábel, nabíjačka","30237000-9 Časti a príslušenstvo počítačov a spotrebný materiál k nim; 60000000-8 Dopravné služby (bez prepravy odpadu)","Tovar; Služba","","https://portal.eks.sk/SpravaKniznice/OpisneFormulareKniznice/VerejnyDetailOpisnehoFormularaKniznice/254266","0","0",
"OF-254276","Po karanténe","Mäso a mäsové výrobky","Mäso a mäsové výrobky","15100000-9 Živočíšne výrobky, mäso a mäsové výrobky; 15130000-8 Mäsové výrobky; 60000000-8 Dopravné služby (bez prepravy odpadu)","Tovar; Služba","","https://portal.eks.sk/SpravaKniznice/OpisneFormulareKniznice/VerejnyDetailOpisnehoFormularaKniznice/254276","0","0",
"OF-254287","Po karanténe","Dodávka zemného plynu","zemný plyn, distribúcia zemného plynu, preprava plynu","09123000-7 Zemný plyn; 65200000-5 Rozvod plynu a súvisiace služby; 60000000-8 Dopravné služby (bez prepravy odpadu)","Tovar; Služba","","https://portal.eks.sk/SpravaKniznice/OpisneFormulareKniznice/VerejnyDetailOpisnehoFormularaKniznice/254287","0","0",
"OF-254299","Po karanténe","oprava kosačiek ručných a ručne vedených","oprava krovinorezu, oprava kosačky, servis krovinorezu, servis kosačky, opravy a údržby strojov","50530000-9 Opravy a údržba strojov; 60000000-8 Dopravné služby (bez prepravy odpadu); 16800000-3 Časti poľnohospodárskych a lesníckych mechanizmov; 16310000-1 Kosačky; 16311100-9 Kosačky trávnikov, parkov alebo športovísk; 50531000-6 Opravy a údržba neelektrických strojov","Služba; Tovar","","https://portal.eks.sk/SpravaKniznice/OpisneFormulareKniznice/VerejnyDetailOpisnehoFormularaKniznice/254299","0","0",
"OF-254310","Po karanténe","Ručné nástroje a príslušenstvo","Montážna páka, sada kľúčov, kliešte, brzdové piesty, magnetické misky, pinzeta, sťahovaky pružín","44511000-5 Ručné nástroje; 44512000-2 Rôzne ručné nástroje; 43830000-0 Mechanické náradie; 44512940-3 Sada náradia; 43800000-1 Dielenské zariadenia; 44510000-8 Nástroje; 60000000-8 Dopravné služby (bez prepravy odpadu)","Tovar; Služba","","https://portal.eks.sk/SpravaKniznice/OpisneFormulareKniznice/VerejnyDetailOpisnehoFormularaKniznice/254310","1","0",
"OF-254318","Po karanténe","Káble, konektory a nabíjačky","VGA pripojovacie, predlžovacie káble","44321000-6 Káble; 31224810-3 Predlžovacie káble; 60000000-8 Dopravné služby (bez prepravy odpadu); 45314300-4 Inštalovanie kabeláže; 44322100-4 Elektroinštalačné káble; 44318000-2 Vodiče; 30237100-0 Časti počítačov","Tovar; Služba","","https://portal.eks.sk/SpravaKniznice/OpisneFormulareKniznice/VerejnyDetailOpisnehoFormularaKniznice/254318","0","0",
"OF-254327","Po karanténe","Stavebný materiál ","omietka, vápno, hmota, malta, cement, beton, emulzia, asfaltová hmota, tekutá fólia, sádra, cement, špárovacia hmota, tvármica, dvere, zárubňa","44111000-1 Stavebné materiály; 44921210-7 Vápno v prášku; 44800000-8 Náterové farby, laky a tmely; 37820000-2 Potreby pre maliarov; 44112000-8 Rôzne stavebné konštrukcie; 44210000-5 Konštrukcie a časti konštrukcií; 44221211-7 Rámy dverí; 60000000-8 Dopravné služby (bez prepravy odpadu)","Tovar; Služba","","https://portal.eks.sk/SpravaKniznice/OpisneFormulareKniznice/VerejnyDetailOpisnehoFormularaKniznice/254327","0","0",
"OF-254337","Po karanténe","Hygienické potreby","Toaletný papier JUMBO a papierové utierky","33761000-2 Toaletný papier; 33763000-6 Papierové uteráky na ruky; 60000000-8 Dopravné služby (bez prepravy odpadu)","Tovar; Služba","","https://portal.eks.sk/SpravaKniznice/OpisneFormulareKniznice/VerejnyDetailOpisnehoFormularaKniznice/254337","0","0",
"OF-254149","Po karanténe","Osobný automobil SUV 4 x 4","Osobné motorové vozidlo","34100000-8 Motorové vozidlá; 60000000-8 Dopravné služby (bez prepravy odpadu); 34110000-1 Osobné automobily","Tovar; Služba","","https://portal.eks.sk/SpravaKniznice/OpisneFormulareKniznice/VerejnyDetailOpisnehoFormularaKniznice/254149","0","0",
"OF-254158","Po karanténe","Kancelárske potreby","kancelárske potreby, obaly, kancelársky papier","30192000-1 Kancelárske potreby","Tovar; Služba","","https://portal.eks.sk/SpravaKniznice/OpisneFormulareKniznice/VerejnyDetailOpisnehoFormularaKniznice/254158","1","0",
"OF-254166","Po karanténe","Protokolárny a propagačný materiál","propagačné materiály, hrnčeky, perá","39294100-0 Informačné a propagačné výrobky; 60000000-8 Dopravné služby (bez prepravy odpadu); 79810000-5 Tlačiarenské služby; 39221120-4 Šálky a poháre; 30192121-5 Guľôčkové perá","Tovar; Služba","","https://portal.eks.sk/SpravaKniznice/OpisneFormulareKniznice/VerejnyDetailOpisnehoFormularaKniznice/254166","0","0",
"OF-254178","Po karanténe","poľnohospodárske stroje a zariadenia","kosačky, krovinorezi, príslušenstvo - silon do krovinorezu","16310000-1 Kosačky; 60000000-8 Dopravné služby (bez prepravy odpadu)","Tovar; Služba","","https://portal.eks.sk/SpravaKniznice/OpisneFormulareKniznice/VerejnyDetailOpisnehoFormularaKniznice/254178","0","0",
"OF-254190","Po karanténe","Spotrebný materiál využiteľný v laboratóriách","laboratórny materiál","33790000-4 Laboratórny, zdravotnícky alebo farmaceutický sklenený tovar; 38000000-5 Laboratórne, optické a presné prístroje a vybavenie (s výnimkou skiel)","Tovar","","https://portal.eks.sk/SpravaKniznice/OpisneFormulareKniznice/VerejnyDetailOpisnehoFormularaKniznice/254190","0","0",
"OF-254200","Po karanténe","Elektroinštalačný materiál 0522","istič,elektromer, kábel, žiarovka","31210000-1 Elektrické prístroje na spínanie alebo ochranu elektrických obvodov; 31500000-1 Osvetľovacie zariadenia a elektrické žiarovky; 31531000-7 Žiarovky; 60000000-8 Dopravné služby (bez prepravy odpadu)","Tovar; Služba","","https://portal.eks.sk/SpravaKniznice/OpisneFormulareKniznice/VerejnyDetailOpisnehoFormularaKniznice/254200","0","0",
"OF-254209","Po karanténe","Geofyzikálne a navigačné prístroje","GPS, navigácia","38110000-9 Navigačné prístroje; 60000000-8 Dopravné služby (bez prepravy odpadu)","Tovar; Služba","","https://portal.eks.sk/SpravaKniznice/OpisneFormulareKniznice/VerejnyDetailOpisnehoFormularaKniznice/254209","1","0",
"OF-254218","Po karanténe","Obstaranie licencií Microsoft licencií Exchange Online Plan 1 a licencií Microsoft Office 365 E1","Licencia Exchange Online Plan 1 a licencia Office 365 E1","72268000-1 Dodávky softvéru","Služba","","https://portal.eks.sk/SpravaKniznice/OpisneFormulareKniznice/VerejnyDetailOpisnehoFormularaKniznice/254218","0","0",
"OF-243750","Po karanténe","Špeciálny a spotrebný zdravotnícky materiál","ihly, striekačky, skúmavky, gázy","33140000-3 Zdravotnícky spotrebný materiál; 33192500-7 Skúmavky; 33141320-9 Lekárske ihly; 60000000-8 Dopravné služby (bez prepravy odpadu)","Tovar; Služba","","https://portal.eks.sk/SpravaKniznice/OpisneFormulareKniznice/VerejnyDetailOpisnehoFormularaKniznice/243750","0","0",
"OF-254228","Po karanténe","ND do polaris","polaris, štvorkolky,","34411000-1 Časti a príslušenstvo motocyklov; 50115000-4 Oprava a údržba motocyklov; 34411200-3 Pneumatiky pre motocykle; 60000000-8 Dopravné služby (bez prepravy odpadu)","Tovar; Služba","","https://portal.eks.sk/SpravaKniznice/OpisneFormulareKniznice/VerejnyDetailOpisnehoFormularaKniznice/254228","0","0",
"OF-254238","Po karanténe","Združená dodávka elektrickej energie vrátane prevzatia zodpovednosti za odchýlku ","elektrická energia","09310000-5 Elektrická energia; 65300000-6 Rozvod elektriny a súvisiace služby","Tovar; Služba","","https://portal.eks.sk/SpravaKniznice/OpisneFormulareKniznice/VerejnyDetailOpisnehoFormularaKniznice/254238","1","0",
"OF-254248","Po karanténe","Zemiaky skoré","zemiaky skoré","03212100-1 Zemiaky; 15310000-4 Zemiaky a zemiakové výrobky; 03210000-6 Obilniny a zemiaky; 03212000-0 Zemiaky a sušená zelenina; 60000000-8 Dopravné služby (bez prepravy odpadu)","Tovar; Služba","","https://portal.eks.sk/SpravaKniznice/OpisneFormulareKniznice/VerejnyDetailOpisnehoFormularaKniznice/254248","0","0",
"OF-254261","Po karanténe","Prenájom vibračného valca (bez obsluhy).","Prenájom","60182000-7 Prenájom priemyselných vozidiel s vodičom; 60000000-8 Dopravné služby (bez prepravy odpadu)","Služba","","https://portal.eks.sk/SpravaKniznice/OpisneFormulareKniznice/VerejnyDetailOpisnehoFormularaKniznice/254261","0","0",
"OF-254271","Po karanténe","Lieky ATC J05 Antivirotiká na systémové použitie","antivirotiká na systémové použitie","33600000-6 Farmaceutické výrobky; 33651400-2 Antivírusové prostriedky na systémové použitie","Tovar","","https://portal.eks.sk/SpravaKniznice/OpisneFormulareKniznice/VerejnyDetailOpisnehoFormularaKniznice/254271","0","0",
"OF-254283","Po karanténe","Elektrická energia","Elektrická energia, Elektrina","09310000-5 Elektrická energia; 65300000-6 Rozvod elektriny a súvisiace služby","Tovar; Služba","","https://portal.eks.sk/SpravaKniznice/OpisneFormulareKniznice/VerejnyDetailOpisnehoFormularaKniznice/254283","0","0",
"OF-254294","Po karanténe","Špecialny zdravotnícky materiál - centrálny venózny vstup určený na použitie pri dlhodobej chemoterapeutickej liečbe","centrálne venózne katétre,  PICC s rozšírenym príslušenstvom,","33141200-2 Katétre; 33141240-4 Príslušenstvo ku katétrom; 60000000-8 Dopravné služby (bez prepravy odpadu)","Tovar; Služba","","https://portal.eks.sk/SpravaKniznice/OpisneFormulareKniznice/VerejnyDetailOpisnehoFormularaKniznice/254294","0","0",
"OF-254306","Po karanténe","Originálne tonery","originál toner - Xerox","30125000-1 Časti a príslušenstvo fotokopírovacích prístrojov; 30125120-8 Toner do fotokopírovacích strojov; 30125100-2 Tonerové náplne; 60000000-8 Dopravné služby (bez prepravy odpadu)","Tovar; Služba","","https://portal.eks.sk/SpravaKniznice/OpisneFormulareKniznice/VerejnyDetailOpisnehoFormularaKniznice/254306","0","0",
"OF-254315","Po karanténe","Laserový prístroj","zdravotnícky prístroj","33100000-1 Zdravotnícke vybavenie; 60000000-8 Dopravné služby (bez prepravy odpadu); 33150000-6 Prístroje na rádioterapiu, mechanoterapiu, elektroterapiu a fyzioterapiu","Tovar; Služba","","https://portal.eks.sk/SpravaKniznice/OpisneFormulareKniznice/VerejnyDetailOpisnehoFormularaKniznice/254315","0","0",
"OF-254324","Po karanténe","Mlieko a mliečne výrobky","Mlieko, mliečne výrobky,  jogurt, syr, maslo, tvaroh, smotana","15500000-3 Mliečne výrobky; 15511000-3 Mlieko; 15512000-0 Smotana; 15542200-1 Mäkký syr; 15544000-3 Tvrdý syr; 15545000-0 Syrové nátierky; 15550000-8 Mliečne výrobky rôznych druhov; 15551000-5 Jogurt a ostatné fermentované mliečne výrobky; 15551300-8 Jogurt; 15551500-0 Cmar; 60000000-8 Dopravné služby (bez prepravy odpadu)","Tovar; Služba","","https://portal.eks.sk/SpravaKniznice/OpisneFormulareKniznice/VerejnyDetailOpisnehoFormularaKniznice/254324","0","0",
"OF-254334","Po karanténe","Notebook, monitor a príslušenstvo         ","Notebook, monitor, SDD Disk, Diskt WD, Taška na notebook","30213100-6 Prenosné počítače; 30231000-7 Počítačové monitory a konzoly; 30237000-9 Časti a príslušenstvo počítačov a spotrebný materiál k nim; 60000000-8 Dopravné služby (bez prepravy odpadu)","Tovar; Služba","","https://portal.eks.sk/SpravaKniznice/OpisneFormulareKniznice/VerejnyDetailOpisnehoFormularaKniznice/254334","0","0",
"OF-254122","Po karanténe","Podpora systému pre zaistenie oblasti informačnej bezpečnosti a monitoringu","informačná bezpečnosť, webová a mailová brána, bezpečnostné technológie, bezpečnostné zariadenia","32420000-3 Sieťové zariadenia; 32422000-7 Sieťové komponenty; 48000000-8 Softvérové balíky a informačné systémy; 71356300-1 Technická podpora","Tovar; Služba","","https://portal.eks.sk/SpravaKniznice/OpisneFormulareKniznice/VerejnyDetailOpisnehoFormularaKniznice/254122","0","0",
"OF-254132","Po karanténe","Respirátor FFP3 bez výdychového ventilu","respirátor, FFP3, výdychový, ventil, s gumičkami, OOPP","33140000-3 Zdravotnícky spotrebný materiál; 60000000-8 Dopravné služby (bez prepravy odpadu)","Tovar; Služba","","https://portal.eks.sk/SpravaKniznice/OpisneFormulareKniznice/VerejnyDetailOpisnehoFormularaKniznice/254132","0","0",
"OF-254146","Po karanténe","Laboratórne sklo  ","sklo, laboratórne sklo, banky, fľaše","33790000-4 Laboratórny, zdravotnícky alebo farmaceutický sklenený tovar; 60000000-8 Dopravné služby (bez prepravy odpadu)","Tovar; Služba","","https://portal.eks.sk/SpravaKniznice/OpisneFormulareKniznice/VerejnyDetailOpisnehoFormularaKniznice/254146","0","0",
"OF-254155","Po karanténe","Nákup OMR softvéru pre digitalizáciu údajov","OMR softvér, digitalizácia údajov","48920000-3 Softvérový balík na automatizáciu kancelárskych prác","Tovar","","https://portal.eks.sk/SpravaKniznice/OpisneFormulareKniznice/VerejnyDetailOpisnehoFormularaKniznice/254155","0","0",
"OF-254163","Po karanténe","Nádoby, obaly a obalový materiál","plachta, vrece, vrecko. fólia, papier","39522110-1 Nepremokavé plachty; 37823100-4 Nepremastiteľný papier; 44174000-0 Fólia; 60000000-8 Dopravné služby (bez prepravy odpadu)","Tovar; Služba","","https://portal.eks.sk/SpravaKniznice/OpisneFormulareKniznice/VerejnyDetailOpisnehoFormularaKniznice/254163","0","0",
"OF-254173","Po karanténe","Čerstvé vajcia","Vajcia","03142500-3 Vajcia; 60000000-8 Dopravné služby (bez prepravy odpadu)","Tovar; Služba","","https://portal.eks.sk/SpravaKniznice/OpisneFormulareKniznice/VerejnyDetailOpisnehoFormularaKniznice/254173","0","0",
"OF-254186","Po karanténe","Žiarovo pozinkované rúry  ZN 2"" (Ø 60 mm)","rúry, stĺpy, stožiare","44144000-1 Stĺpy; 44212200-1 Piliere, stožiare, veže, pylóny a stĺpy; 60000000-8 Dopravné služby (bez prepravy odpadu)","Tovar; Služba","","https://portal.eks.sk/SpravaKniznice/OpisneFormulareKniznice/VerejnyDetailOpisnehoFormularaKniznice/254186","0","0",
"OF-254196","Po karanténe","4. Kamenivo pre vysprávky tryskovou metódou","drvený kameň, drvený kameň frakcie: 2-4, 2-5, kamenivo do bitúmenových zmesí","14212430-3 Kamenná drvina; 60000000-8 Dopravné služby (bez prepravy odpadu)","Tovar; Služba","","https://portal.eks.sk/SpravaKniznice/OpisneFormulareKniznice/VerejnyDetailOpisnehoFormularaKniznice/254196","0","0",
"OF-254205","Po karanténe","8. Kamenivo pre vysprávky tryskovou metódou","drvený kameň, drvený kameň frakcie: 2-4, 2-5, kamenivo do bitúmenových zmesí","14212430-3 Kamenná drvina; 60000000-8 Dopravné služby (bez prepravy odpadu)","Tovar; Služba","","https://portal.eks.sk/SpravaKniznice/OpisneFormulareKniznice/VerejnyDetailOpisnehoFormularaKniznice/254205","0","0",
"OF-254215","Po karanténe","Postrek herbicídny","herbicíd, buriny, glyfosát","24450000-3 Agrochemikálie; 60000000-8 Dopravné služby (bez prepravy odpadu)","Tovar; Služba","","https://portal.eks.sk/SpravaKniznice/OpisneFormulareKniznice/VerejnyDetailOpisnehoFormularaKniznice/254215","1","0",
"OF-254224","Po karanténe","Odbery a rozbory odpadových vôd","Odbery a rozbory odpadových vôd","90733000-4 Služby súvisiace so znečistením vody","Služba","","https://portal.eks.sk/SpravaKniznice/OpisneFormulareKniznice/VerejnyDetailOpisnehoFormularaKniznice/254224","0","0",
"OF-254235","Po karanténe","Drôtená slučka","slučka, chirurgia, nástroj","33140000-3 Zdravotnícky spotrebný materiál; 60000000-8 Dopravné služby (bez prepravy odpadu)","Tovar; Služba","","https://portal.eks.sk/SpravaKniznice/OpisneFormulareKniznice/VerejnyDetailOpisnehoFormularaKniznice/254235","0","0",
"OF-254243","Po karanténe","Zariadenie na chladenie a mrazenie","Chladnička s mrazničkou, truhlicová mraznička","39711100-0 Chladničky a mrazničky; 39711110-3 Chladničky s mrazničkou; 39711121-3 Truhlicové mrazničky; 60000000-8 Dopravné služby (bez prepravy odpadu)","Tovar; Služba","","https://portal.eks.sk/SpravaKniznice/OpisneFormulareKniznice/VerejnyDetailOpisnehoFormularaKniznice/254243","0","0",
"OF-254257","Po karanténe","Imunoglobulíny","Imunoglobulíny","33651520-9 Imunoglobulíny","Tovar; Služba","","https://portal.eks.sk/SpravaKniznice/OpisneFormulareKniznice/VerejnyDetailOpisnehoFormularaKniznice/254257","0","0",
"OF-254268","Po karanténe","Mlieko a mliečné výrobky alebo ekvivalent","Mlieko, syry, jogurt, tvaroh, bryndza","15550000-8 Mliečne výrobky rôznych druhov; 15530000-2 Maslo; 15511000-3 Mlieko","Tovar; Služba","","https://portal.eks.sk/SpravaKniznice/OpisneFormulareKniznice/VerejnyDetailOpisnehoFormularaKniznice/254268","0","0",
"OF-254279","Po karanténe","Minicentrifúga na mikroskúmavky","centrifúga","38430000-8 Prístroje na detekciu a rozbory; 60000000-8 Dopravné služby (bez prepravy odpadu)","Tovar; Služba","","https://portal.eks.sk/SpravaKniznice/OpisneFormulareKniznice/VerejnyDetailOpisnehoFormularaKniznice/254279","0","0",
"OF-254289","Po karanténe","Kovoobrábacie stroje a príslušenstvo","mikrovlnná rúra, elektrická stolná dvojplatnička, elektrický varič, elektrický kávovar, rýchlovarná kanvica, celoelektrický sporák","42651000-4 Pneumatické ručné nástroje; 42600000-2 Obrábacie stroje; 60000000-8 Dopravné služby (bez prepravy odpadu)","Tovar; Služba","","https://portal.eks.sk/SpravaKniznice/OpisneFormulareKniznice/VerejnyDetailOpisnehoFormularaKniznice/254289","0","0",
"OF-254301","Po karanténe","Optický valec","optický valec HP","30125000-1 Časti a príslušenstvo fotokopírovacích prístrojov; 60000000-8 Dopravné služby (bez prepravy odpadu)","Tovar; Služba","","https://portal.eks.sk/SpravaKniznice/OpisneFormulareKniznice/VerejnyDetailOpisnehoFormularaKniznice/254301","0","0",
"OF-254312","Po karanténe","Vrecia na triedený odpad","triedený zber odpadu,  vrecia LDPE","19640000-4 Polyetylénový odpad a odpadkové vrecká a vaky; 60000000-8 Dopravné služby (bez prepravy odpadu)","Tovar; Služba","","https://portal.eks.sk/SpravaKniznice/OpisneFormulareKniznice/VerejnyDetailOpisnehoFormularaKniznice/254312","0","0",
"OF-254154","Po karanténe","Kia Ceed  SW 1,6 CRDi MHEV A7 /alebo alternatíva/  nové alebo predvádzacie osobné vozidlo","osobný automobil  na prepravu osôb","34110000-1 Osobné automobily; 60000000-8 Dopravné služby (bez prepravy odpadu)","Tovar; Služba","","https://portal.eks.sk/SpravaKniznice/OpisneFormulareKniznice/VerejnyDetailOpisnehoFormularaKniznice/254154","0","0",
"OF-254162","Po karanténe","Chemikálie ","chemikálie, kyseliny,","24310000-0 Základné anorganické chemikálie; 24320000-3 Základné organické chemikálie; 24950000-8 Špecializované chemické výrobky; 60000000-8 Dopravné služby (bez prepravy odpadu)","Tovar; Služba","","https://portal.eks.sk/SpravaKniznice/OpisneFormulareKniznice/VerejnyDetailOpisnehoFormularaKniznice/254162","0","0",
"OF-254172","Po karanténe","Nádoby, obaly a obalový materiál","vrecia, 60 l","19640000-4 Polyetylénový odpad a odpadkové vrecká a vaky; 18930000-7 Vrecia a vaky; 60000000-8 Dopravné služby (bez prepravy odpadu)","Tovar; Služba","","https://portal.eks.sk/SpravaKniznice/OpisneFormulareKniznice/VerejnyDetailOpisnehoFormularaKniznice/254172","0","0",
"OF-254184","Po karanténe","datavideoprojektory - EKS","videoprojektory, datavideoprojektory","38652120-7 Videoprojektory","Tovar","","https://portal.eks.sk/SpravaKniznice/OpisneFormulareKniznice/VerejnyDetailOpisnehoFormularaKniznice/254184","0","0",
"OF-254195","Po karanténe","3. Kamenivo pre vysprávky tryskovou metódou","drvený kameň, drvený kameň frakcie: 2-4, 2-5, kamenivo do bitúmenových zmesí","14212430-3 Kamenná drvina; 60000000-8 Dopravné služby (bez prepravy odpadu)","Tovar; Služba","","https://portal.eks.sk/SpravaKniznice/OpisneFormulareKniznice/VerejnyDetailOpisnehoFormularaKniznice/254195","0","0",
"OF-254204","Po karanténe","7. Kamenivo pre vysprávky tryskovou metódou","drvený kameň, drvený kameň frakcie: 2-4, 2-5, kamenivo do bitúmenových zmesí","14212430-3 Kamenná drvina; 60000000-8 Dopravné služby (bez prepravy odpadu)","Tovar; Služba","","https://portal.eks.sk/SpravaKniznice/OpisneFormulareKniznice/VerejnyDetailOpisnehoFormularaKniznice/254204","0","0",
"OF-254214","Po karanténe","Lieky ostatné - ATC skupiny D - časť 2","Betametazón a antibiotiká, Hydrokortizón a antibiotiká, Hydrokortizónbutyrát, Mupirocín,","33631000-2 Liečivá pre dermatológiu; 60000000-8 Dopravné služby (bez prepravy odpadu)","Tovar; Služba","","https://portal.eks.sk/SpravaKniznice/OpisneFormulareKniznice/VerejnyDetailOpisnehoFormularaKniznice/254214","0","0",
"OF-254223","Po karanténe","Mrazená zelenina, ovocie, mrazené polotovary","Dodávka mrazenej zeleniny, ovocia","15331100-8 Čerstvá alebo mrazená zelenina; 15331170-9 Mrazená zelenina; 60000000-8 Dopravné služby (bez prepravy odpadu); 15896000-5 Hlboko zmrazené výrobky","Tovar; Služba","","https://portal.eks.sk/SpravaKniznice/OpisneFormulareKniznice/VerejnyDetailOpisnehoFormularaKniznice/254223","0","0",
"OF-254234","Po karanténe","Lieky ostatné - ATC skupiny H","Betametazón, Dexametazón, Fludrokortizón, Glukagón, Hydrokortizón, Levotyroxín, sodná soľ,  Metylprednizolón, Oktreotid, Parikalcitol, Prednizón, Terlipresín, Vazopresín,","33642200-4 Kortikosteroidy na systémové použitie; 33642000-2 Systémové hormonálne prípravky okrem pohlavných hormónov; 60000000-8 Dopravné služby (bez prepravy odpadu)","Tovar; Služba","","https://portal.eks.sk/SpravaKniznice/OpisneFormulareKniznice/VerejnyDetailOpisnehoFormularaKniznice/254234","0","0",
"OF-254242","Po karanténe","Mäso a mäsové výrobky","bravčové mäso, hovädzie mäso, hydina, mäsové výrobky","15100000-9 Živočíšne výrobky, mäso a mäsové výrobky; 15113000-3 Bravčové mäso; 15111100-0 Hovädzie mäso; 15112000-6 Hydina; 15130000-8 Mäsové výrobky; 60000000-8 Dopravné služby (bez prepravy odpadu)","Tovar; Služba","","https://portal.eks.sk/SpravaKniznice/OpisneFormulareKniznice/VerejnyDetailOpisnehoFormularaKniznice/254242","0","0",
