"OpisnyFormularIdentifikator","OpisnyFormularStav","OpisnyFormularNazov","OpisnyFormularKlucoveSlova","OpisnyFormularCpv","OpisnyFormularDruh","OpisnyFormularKategoriaSluzieb","OpisnyFormularUrl","OpisnyFormularPocetVyhlasenychZakaziek","OpisnyFormularObchodovanaSumaBezDPH",
"OF-222393","Po karanténe","Projektor, notebook, SSD disk                                                 ","notebook, laptop, prenosný počítač, SSD disk, projektor","30191200-6 Spätné projektory; 30213100-6 Prenosné počítače; 30230000-0 Zariadenia súvisiace s počítačmi; 60000000-8 Dopravné služby (bez prepravy odpadu)","Tovar; Služba","","https://portal.eks.sk/SpravaKniznice/OpisneFormulareKniznice/VerejnyDetailOpisnehoFormularaKniznice/222393","0","0",
"OF-222394","Po karanténe","Nákup vstupov do fitness centra","vstup, fitness centrum","92000000-1 Rekreačné, kultúrne a športové služby; 92600000-7 Športové služby","Služba","","https://portal.eks.sk/SpravaKniznice/OpisneFormulareKniznice/VerejnyDetailOpisnehoFormularaKniznice/222394","0","0",
"OF-222396","Po karanténe","Špeciálne pracovné odevy a doplnky","odevy, bunda, nohavice, topánky","18100000-0 Pracovné odevy, špeciálne pracovné odevy a doplnky; 60000000-8 Dopravné služby (bez prepravy odpadu)","Tovar; Služba","","https://portal.eks.sk/SpravaKniznice/OpisneFormulareKniznice/VerejnyDetailOpisnehoFormularaKniznice/222396","0","0",
"OF-222398","Po karanténe","Laserová tlačiareň čiernobiela","Tlačiareň","30232110-8 Laserové tlačiarne","Tovar","","https://portal.eks.sk/SpravaKniznice/OpisneFormulareKniznice/VerejnyDetailOpisnehoFormularaKniznice/222398","0","0",
"OF-222399","Po karanténe","Dodávka polyetylénových vriec, sáčkov, tašiek a vreciek","Vrecia, sáčky, tašky, vrecká","19640000-4 Polyetylénový odpad a odpadkové vrecká a vaky; 18930000-7 Vrecia a vaky; 60000000-8 Dopravné služby (bez prepravy odpadu)","Tovar; Služba","","https://portal.eks.sk/SpravaKniznice/OpisneFormulareKniznice/VerejnyDetailOpisnehoFormularaKniznice/222399","0","0",
"OF-222401","Po karanténe","Originálne tonery","originál toner","30125000-1 Časti a príslušenstvo fotokopírovacích prístrojov; 30125120-8 Toner do fotokopírovacích strojov; 30125100-2 Tonerové náplne; 60000000-8 Dopravné služby (bez prepravy odpadu)","Tovar; Služba","","https://portal.eks.sk/SpravaKniznice/OpisneFormulareKniznice/VerejnyDetailOpisnehoFormularaKniznice/222401","1","0",
"OF-222402","Po karanténe","Laboratórny spotrebný materiál pre plynový chromatograf GC-MS s hmotnostnou spektrometriou ","kolóna, vialky, uzávery","33790000-4 Laboratórny, zdravotnícky alebo farmaceutický sklenený tovar; 60000000-8 Dopravné služby (bez prepravy odpadu)","Tovar; Služba","","https://portal.eks.sk/SpravaKniznice/OpisneFormulareKniznice/VerejnyDetailOpisnehoFormularaKniznice/222402","0","0",
"OF-222403","Po karanténe","Záložné zdroje UPS s príslušenstvom","Záložné zdroje UPS s príslušenstvom","31400000-0 Akumulátory, galvanické články a batérie; 60000000-8 Dopravné služby (bez prepravy odpadu)","Tovar; Služba","","https://portal.eks.sk/SpravaKniznice/OpisneFormulareKniznice/VerejnyDetailOpisnehoFormularaKniznice/222403","0","0",
"OF-222404","Po karanténe","Údržba software ESID System GIS CC","ESID","72261000-2 Softvérové podporné služby","Služba","","https://portal.eks.sk/SpravaKniznice/OpisneFormulareKniznice/VerejnyDetailOpisnehoFormularaKniznice/222404","1","0",
"OF-222405","Po karanténe","Malotraktor Vari MTVO GCVx200 s prívesom ANV-400, bubnovou kosačkou BDR 650V a príslušenstvom","malotraktor","16710000-5 Poľnohospodárske traktory/ťahače ovládané chodcami; 60000000-8 Dopravné služby (bez prepravy odpadu)","Tovar; Služba","","https://portal.eks.sk/SpravaKniznice/OpisneFormulareKniznice/VerejnyDetailOpisnehoFormularaKniznice/222405","1","0",
"OF-222406","Po karanténe","Drevoobrábacie stroje, zariadenia a príslušenstvo","elektronická chvostová píla","42642100-9 Obrábacie stroje na drevo; 43810000-4 Zariadenia na opracovanie dreva; 60000000-8 Dopravné služby (bez prepravy odpadu)","Tovar; Služba","","https://portal.eks.sk/SpravaKniznice/OpisneFormulareKniznice/VerejnyDetailOpisnehoFormularaKniznice/222406","0","0",
"OF-222411","Po karanténe","Ozimné osivá","ozimné osivá, jačmeň, pšenica","03111000-2 Osivo; 60000000-8 Dopravné služby (bez prepravy odpadu)","Tovar; Služba","","https://portal.eks.sk/SpravaKniznice/OpisneFormulareKniznice/VerejnyDetailOpisnehoFormularaKniznice/222411","0","0",
"OF-222413","Po karanténe","Barová stolička s podrúčkami","stolička","39000000-2 Nábytok (vrátane kancelárskeho nábytku), zariadenie interiéru, domáce spotrebiče (s výnimkou osvetlenia) a čistiace prostriedky; 60000000-8 Dopravné služby (bez prepravy odpadu)","Tovar; Služba","","https://portal.eks.sk/SpravaKniznice/OpisneFormulareKniznice/VerejnyDetailOpisnehoFormularaKniznice/222413","1","0",
"OF-222417","Po karanténe","Kávovar","kávovar","39700000-9 Spotrebiče pre domácnosť; 60000000-8 Dopravné služby (bez prepravy odpadu)","Tovar; Služba","","https://portal.eks.sk/SpravaKniznice/OpisneFormulareKniznice/VerejnyDetailOpisnehoFormularaKniznice/222417","0","0",
"OF-222421","Po karanténe","Asfaltový betón :  AC11 obrusný II   ( NZ/3_2020 )","asfaltový betón, obrusná vrstva","44113300-8 Obalené kamenivo","Tovar","","https://portal.eks.sk/SpravaKniznice/OpisneFormulareKniznice/VerejnyDetailOpisnehoFormularaKniznice/222421","0","0",
"OF-222422","Po karanténe","PC All in One HP 24-df0003nc (25J31EA#BCM)","PC All in One","30213000-5 Osobné počítače; 60000000-8 Dopravné služby (bez prepravy odpadu)","Tovar; Služba","","https://portal.eks.sk/SpravaKniznice/OpisneFormulareKniznice/VerejnyDetailOpisnehoFormularaKniznice/222422","0","0",
"OF-222423","Po karanténe","Náhradné diely na Záložné zdroje LPIS","Náhradné diely, filter oleja, filter paliva","34913000-0 Rôzne náhradné diely; 60000000-8 Dopravné služby (bez prepravy odpadu); 42913300-2 Olejové filtre; 42913400-3 Benzínové filtre","Tovar; Služba","","https://portal.eks.sk/SpravaKniznice/OpisneFormulareKniznice/VerejnyDetailOpisnehoFormularaKniznice/222423","0","0",
"OF-222424","Po karanténe","Tonerové náplne ","Tonerové náplne","30125100-2 Tonerové náplne; 60000000-8 Dopravné služby (bez prepravy odpadu)","Tovar; Služba","","https://portal.eks.sk/SpravaKniznice/OpisneFormulareKniznice/VerejnyDetailOpisnehoFormularaKniznice/222424","0","0",
"OF-222425","Po karanténe","Zdravotnícky spotrebný materiál ","zdravotnícky spotrebný materiál, dopravné služby","33140000-3 Zdravotnícky spotrebný materiál; 60000000-8 Dopravné služby (bez prepravy odpadu)","Tovar; Služba","","https://portal.eks.sk/SpravaKniznice/OpisneFormulareKniznice/VerejnyDetailOpisnehoFormularaKniznice/222425","1","0",
"OF-222426","Po karanténe","Počítače a monitory","počítač, monitor, desktop, výpočtová technik","30213300-8 Stolový počítač; 30213100-6 Prenosné počítače; 30231000-7 Počítačové monitory a konzoly; 60000000-8 Dopravné služby (bez prepravy odpadu)","Tovar; Služba","","https://portal.eks.sk/SpravaKniznice/OpisneFormulareKniznice/VerejnyDetailOpisnehoFormularaKniznice/222426","0","0",
"OF-222427","Po karanténe","Softvér na úpravu videa  - strihový softvér 24/2020","softvér","60000000-8 Dopravné služby (bez prepravy odpadu); 48000000-8 Softvérové balíky a informačné systémy","Služba; Tovar","","https://portal.eks.sk/SpravaKniznice/OpisneFormulareKniznice/VerejnyDetailOpisnehoFormularaKniznice/222427","1","0",
"OF-222428","Po karanténe","Trvanlivé potraviny a koreniny","trvanlivé potraviny, koreniny, chuťové prísady","15870000-7 Koreniny a chuťové prísady; 15891500-5 Bujóny; 15891410-7 Polievkové zmesi; 60000000-8 Dopravné služby (bez prepravy odpadu); 15612000-1 Obilná alebo rastlinná múka a príbuzné výrobky; 15411100-3 Rastlinné oleje; 15831000-2 Cukor; 03211300-6 Ryža; 15332200-6 Džemy a marmelády, ovocné želé; ovocné alebo orechové pyré a pasty/pretlaky","Tovar; Služba","","https://portal.eks.sk/SpravaKniznice/OpisneFormulareKniznice/VerejnyDetailOpisnehoFormularaKniznice/222428","0","0",
"OF-222430","Po karanténe","Digestory","odsávanie, digestor, ventilátor","38430000-8 Prístroje na detekciu a rozbory; 60000000-8 Dopravné služby (bez prepravy odpadu)","Tovar; Služba","","https://portal.eks.sk/SpravaKniznice/OpisneFormulareKniznice/VerejnyDetailOpisnehoFormularaKniznice/222430","0","0",
"OF-222432","Po karanténe","Mlieko a mliečne výrobky","mlieko, mliečne výrobky, smotana, tvaroh, syr, maslo, jogurt","15511000-3 Mlieko; 15500000-3 Mliečne výrobky; 15512000-0 Smotana; 15530000-2 Maslo; 15542200-1 Mäkký syr; 15544000-3 Tvrdý syr; 60000000-8 Dopravné služby (bez prepravy odpadu)","Tovar; Služba","","https://portal.eks.sk/SpravaKniznice/OpisneFormulareKniznice/VerejnyDetailOpisnehoFormularaKniznice/222432","0","0",
"OF-222433","Po karanténe","Fotoaparát s príslušenstvom 25/2020","fotoaparát, ochranné sklo, akumulátor, nabíjačka","38651000-3 Fotografické prístroje; 14820000-5 Sklo; 31400000-0 Akumulátory, galvanické články a batérie; 31681500-8 Nabíjačky; 60000000-8 Dopravné služby (bez prepravy odpadu)","Tovar; Služba","","https://portal.eks.sk/SpravaKniznice/OpisneFormulareKniznice/VerejnyDetailOpisnehoFormularaKniznice/222433","1","0",
"OF-222434","Po karanténe","Licencia na softvér","licencia, softvér","48000000-8 Softvérové balíky a informačné systémy","Tovar","","https://portal.eks.sk/SpravaKniznice/OpisneFormulareKniznice/VerejnyDetailOpisnehoFormularaKniznice/222434","0","0",
"OF-222435","Po karanténe","Mrazená hydina, ryby, zelenina ","mrazená hydina, mrazené ryby, mrazená zelenina","15112000-6 Hydina; 15221000-3 Mrazené ryby; 15331170-9 Mrazená zelenina; 60000000-8 Dopravné služby (bez prepravy odpadu)","Tovar; Služba","","https://portal.eks.sk/SpravaKniznice/OpisneFormulareKniznice/VerejnyDetailOpisnehoFormularaKniznice/222435","0","0",
"OF-222438","Po karanténe","Stroj na úpravu ľadovej plochy","rolba, úprava ľadu","37481000-3 Stroje na úpravu ľadovej plochy; 60000000-8 Dopravné služby (bez prepravy odpadu)","Tovar; Služba","","https://portal.eks.sk/SpravaKniznice/OpisneFormulareKniznice/VerejnyDetailOpisnehoFormularaKniznice/222438","0","0",
"OF-222439","Po karanténe","Mäso a mäsové výrobky","mäso, bravčové, hovädzie, chladené, mäsové výrobky","15110000-2 Mäso; 15111100-0 Hovädzie mäso; 15113000-3 Bravčové mäso; 15130000-8 Mäsové výrobky; 60000000-8 Dopravné služby (bez prepravy odpadu)","Tovar; Služba","","https://portal.eks.sk/SpravaKniznice/OpisneFormulareKniznice/VerejnyDetailOpisnehoFormularaKniznice/222439","0","0",
"OF-222442","Po karanténe","Zvislé dopravné značenie, dopravné zariadenie a príslušenstvo","dopravné značenie, dopravné zariadenie","34992200-9 Dopravné značky; 34920000-2 Cestné príslušenstvo; 60000000-8 Dopravné služby (bez prepravy odpadu)","Tovar; Služba","","https://portal.eks.sk/SpravaKniznice/OpisneFormulareKniznice/VerejnyDetailOpisnehoFormularaKniznice/222442","0","0",
"OF-222443","Po karanténe","Stravné poukážky v nominálnej hodnote 5,00 €","stravné poukážky, stravovanie zamestnancov","30199770-8 Stravné poukážky; 60000000-8 Dopravné služby (bez prepravy odpadu)","Tovar; Služba","","https://portal.eks.sk/SpravaKniznice/OpisneFormulareKniznice/VerejnyDetailOpisnehoFormularaKniznice/222443","0","0",
"OF-222445","Po karanténe","Notebook Lenovo","notebook, lenovo, thinkpad, 14""","30213100-6 Prenosné počítače; 60000000-8 Dopravné služby (bez prepravy odpadu)","Tovar; Služba","","https://portal.eks.sk/SpravaKniznice/OpisneFormulareKniznice/VerejnyDetailOpisnehoFormularaKniznice/222445","1","0",
"OF-222447","Po karanténe","Lenovo ThinkStation P330 Tiny 30CF001HXS alebo ekvivalent","informatika, hardware, hardvér, notebook, doprava, PC","30200000-1 Počítačové zariadenia a spotrebný materiál; 30210000-4 Stroje na spracovanie údajov (hardvér); 30213000-5 Osobné počítače; 30213300-8 Stolový počítač; 60000000-8 Dopravné služby (bez prepravy odpadu)","Tovar; Služba","","https://portal.eks.sk/SpravaKniznice/OpisneFormulareKniznice/VerejnyDetailOpisnehoFormularaKniznice/222447","0","0",
"OF-222449","Po karanténe","prenosný počítač, notebook alebo ekvivalent","počítač, notebook, laptop","30213100-6 Prenosné počítače; 60000000-8 Dopravné služby (bez prepravy odpadu)","Tovar; Služba","","https://portal.eks.sk/SpravaKniznice/OpisneFormulareKniznice/VerejnyDetailOpisnehoFormularaKniznice/222449","1","0",
"OF-222450","Po karanténe","Liek ATC skupiny č. J06BB16","Palivizumab","33651520-9 Imunoglobulíny; 60000000-8 Dopravné služby (bez prepravy odpadu)","Tovar; Služba","","https://portal.eks.sk/SpravaKniznice/OpisneFormulareKniznice/VerejnyDetailOpisnehoFormularaKniznice/222450","0","0",
"OF-222455","Po karanténe","Prostriedky IKT","Notebook, tlačiareň, myš, vizualizér","30213100-6 Prenosné počítače; 30232100-5 Tlačiarne a zapisovače; 30237410-6 Počítačová myš; 30236000-2 Rôzne počítačové vybavenie; 60000000-8 Dopravné služby (bez prepravy odpadu)","Tovar; Služba","","https://portal.eks.sk/SpravaKniznice/OpisneFormulareKniznice/VerejnyDetailOpisnehoFormularaKniznice/222455","0","0",
"OF-222457","Po karanténe","Jednorazové rukavice","nitrilové rukavice","33000000-0 Zdravotnícke vybavenie, farmaceutický materiál a výrobky osobnej starostlivosti; 60000000-8 Dopravné služby (bez prepravy odpadu)","Tovar; Služba","","https://portal.eks.sk/SpravaKniznice/OpisneFormulareKniznice/VerejnyDetailOpisnehoFormularaKniznice/222457","1","0",
"OF-222458","Po karanténe","Voľne stojaci bezdotykový stojanový dávkovač dezinfekčného prostriedku s 3 litrami tekutého dezinfekčného prostriedku na ruky","Voľne stojaci bezdotykový stojanový dávkovač dezinfekčného prostriedku s 3 litrami tekutého dezinfekčného prostriedku na ruky","39831700-3 Automatické dávkovače mydla; 39831600-2 Čistiace prostriedky na toalety; 33711900-6 Mydlo; 60000000-8 Dopravné služby (bez prepravy odpadu)","Tovar; Služba","","https://portal.eks.sk/SpravaKniznice/OpisneFormulareKniznice/VerejnyDetailOpisnehoFormularaKniznice/222458","0","0",
"OF-222459","Po karanténe","Nákup tonerov a náhradných dielov do tlačiarní","toner do laserových tlačiarní, tonerové náplne, originálne tonerové kazety, príslušenstvo pre skenery, valce pre kancelárske stroje, zapekacie jednotky","30125100-2 Tonerové náplne; 30125110-5 Toner do laserových tlačiarní/faxových prístrojov; 30125120-8 Toner do fotokopírovacích strojov; 30124500-9 Príslušenstvo pre skenery; 30124300-7 Valce pre kancelárske stroje; 30124100-5 Zapekacie jednotky; 60000000-8 Dopravné služby (bez prepravy odpadu)","Tovar; Služba","","https://portal.eks.sk/SpravaKniznice/OpisneFormulareKniznice/VerejnyDetailOpisnehoFormularaKniznice/222459","0","0",
"OF-222461","Po karanténe","Nákup softvéru 1","softvér","48920000-3 Softvérový balík na automatizáciu kancelárskych prác; 60000000-8 Dopravné služby (bez prepravy odpadu)","Tovar; Služba","","https://portal.eks.sk/SpravaKniznice/OpisneFormulareKniznice/VerejnyDetailOpisnehoFormularaKniznice/222461","0","0",
"OF-222462","Po karanténe","Stolový počítač s LCD monitorom- nové nie repasované","informatika","30213000-5 Osobné počítače; 60000000-8 Dopravné služby (bez prepravy odpadu)","Tovar; Služba","","https://portal.eks.sk/SpravaKniznice/OpisneFormulareKniznice/VerejnyDetailOpisnehoFormularaKniznice/222462","0","0",
"OF-222464","Po karanténe","Kancelárske potreby","kancelárske potreby, korektor, zošity, obálky, sponky, tlačivá. obálky","30192000-1 Kancelárske potreby; 30199000-0 Papiernický tovar a iné položky; 60000000-8 Dopravné služby (bez prepravy odpadu)","Tovar; Služba","","https://portal.eks.sk/SpravaKniznice/OpisneFormulareKniznice/VerejnyDetailOpisnehoFormularaKniznice/222464","0","0",
"OF-222466","Po karanténe","Výpočtová technika","Výpočtová technika, switch, router, LAN","30200000-1 Počítačové zariadenia a spotrebný materiál; 32400000-7 Siete; 32500000-8 Telekomunikačné zariadenia a spotrebný materiál; 60000000-8 Dopravné služby (bez prepravy odpadu)","Tovar; Služba","","https://portal.eks.sk/SpravaKniznice/OpisneFormulareKniznice/VerejnyDetailOpisnehoFormularaKniznice/222466","0","0",
"OF-222468","Po karanténe","Prívesný vozík BE7323U s príslušenstvom  alebo ekvivalent","prívesný vozík","34100000-8 Motorové vozidlá; 60000000-8 Dopravné služby (bez prepravy odpadu)","Tovar; Služba","","https://portal.eks.sk/SpravaKniznice/OpisneFormulareKniznice/VerejnyDetailOpisnehoFormularaKniznice/222468","0","0",
"OF-222470","Po karanténe","Kancelárske potreby","rôzne kancelárske potreby","30192000-1 Kancelárske potreby; 60000000-8 Dopravné služby (bez prepravy odpadu)","Tovar; Služba","","https://portal.eks.sk/SpravaKniznice/OpisneFormulareKniznice/VerejnyDetailOpisnehoFormularaKniznice/222470","0","0",
"OF-222471","Po karanténe","Svietidlá, osvetľovacie zariadenia a svetelné zdroje ","svetlá, svetelné zdroje, led, lampy","31532000-4 Časti lámp a svietidiel a príslušenstvo k nim; 31520000-7 Lampy/svietidlá a príslušenstvo k nim; 31524120-2 Stropné svetlá; 31521100-5 Stolové lampy; 60000000-8 Dopravné služby (bez prepravy odpadu)","Tovar; Služba","","https://portal.eks.sk/SpravaKniznice/OpisneFormulareKniznice/VerejnyDetailOpisnehoFormularaKniznice/222471","0","0",
"OF-222472","Po karanténe","Reagenčné diagnostické súpravy pre novorodenecký skríning","diagnsotické súpravy, kity, novorodenecký skríning, diagnostika, TSH, OHP, IRT","33141625-7 Diagnostické súpravy; 33124110-9 Diagnostické systémy; 60000000-8 Dopravné služby (bez prepravy odpadu)","Tovar; Služba","","https://portal.eks.sk/SpravaKniznice/OpisneFormulareKniznice/VerejnyDetailOpisnehoFormularaKniznice/222472","0","0",
"OF-222473","Po karanténe","Prostriedky IKT","Notebook, tlačiareň, myš, vizualizér","30213100-6 Prenosné počítače; 30232100-5 Tlačiarne a zapisovače; 30237410-6 Počítačová myš; 30236000-2 Rôzne počítačové vybavenie; 60000000-8 Dopravné služby (bez prepravy odpadu)","Tovar; Služba","","https://portal.eks.sk/SpravaKniznice/OpisneFormulareKniznice/VerejnyDetailOpisnehoFormularaKniznice/222473","0","0",
"OF-222475","Po karanténe","IKT predmety","Monitor, počítač, IKT","30200000-1 Počítačové zariadenia a spotrebný materiál; 30230000-0 Zariadenia súvisiace s počítačmi; 60000000-8 Dopravné služby (bez prepravy odpadu)","Tovar; Služba","","https://portal.eks.sk/SpravaKniznice/OpisneFormulareKniznice/VerejnyDetailOpisnehoFormularaKniznice/222475","0","0",
"OF-222476","Po karanténe","Kancelárska skriňa","Kancelársky nábytok, kartotéková skriňa, kartotéková skriňa","39130000-2 Kancelársky nábytok; 39120000-9 Stoly, skrine, písacie stoly a knižnice; 60000000-8 Dopravné služby (bez prepravy odpadu)","Tovar; Služba","","https://portal.eks.sk/SpravaKniznice/OpisneFormulareKniznice/VerejnyDetailOpisnehoFormularaKniznice/222476","0","0",
"OF-222477","Po karanténe","Diagnostický spotrebný materiál pre novorodenecký skríninig","diagnostický spotrebný materiál, koncentrát, zosilňovací roztok, pipetovacie špičky, test","33124130-5 Diagnostický spotrebný materiál; 60000000-8 Dopravné služby (bez prepravy odpadu)","Tovar; Služba","","https://portal.eks.sk/SpravaKniznice/OpisneFormulareKniznice/VerejnyDetailOpisnehoFormularaKniznice/222477","0","0",
"OF-222479","Po karanténe","Notebook Dell Vostro 15 5590 (28M9H)","Notebook Dell - prenosný počítač","30213100-6 Prenosné počítače; 60000000-8 Dopravné služby (bez prepravy odpadu)","Tovar; Služba","","https://portal.eks.sk/SpravaKniznice/OpisneFormulareKniznice/VerejnyDetailOpisnehoFormularaKniznice/222479","0","0",
"OF-222480","Po karanténe","IKT predmety","Monitor, počítač, IKT","30200000-1 Počítačové zariadenia a spotrebný materiál; 30230000-0 Zariadenia súvisiace s počítačmi; 60000000-8 Dopravné služby (bez prepravy odpadu)","Tovar; Služba","","https://portal.eks.sk/SpravaKniznice/OpisneFormulareKniznice/VerejnyDetailOpisnehoFormularaKniznice/222480","0","0",
