"OpisnyFormularIdentifikator","OpisnyFormularStav","OpisnyFormularNazov","OpisnyFormularKlucoveSlova","OpisnyFormularCpv","OpisnyFormularDruh","OpisnyFormularKategoriaSluzieb","OpisnyFormularUrl","OpisnyFormularPocetVyhlasenychZakaziek","OpisnyFormularObchodovanaSumaBezDPH",
"OF-206729","Po karanténe","Zabezpečenie dodávok kancelárskeho papiera","papier na tlač, papier fotokopírovanie","30197642-8 Papier na fotokopírovanie a xerografický papier; 30197643-5 Papier na fotokopírovanie; 60000000-8 Dopravné služby (bez prepravy odpadu)","Tovar; Služba","","https://portal.eks.sk/SpravaKniznice/OpisneFormulareKniznice/VerejnyDetailOpisnehoFormularaKniznice/206729","1","0",
"OF-206737","Po karanténe","Chemikálie - Primery","primer HPCL P1, primer HPCL P2, primer HPCL P3, primer HPCL P4, primer GSF  GP60 F1, primer GSF  GP60 F2, primer GSF  GP60 R1, primer GSF GP60 R2","24000000-4 Chemické výrobky; 24900000-3 Čisté a rôzne chemické výrobky; 33694000-1 Diagnostické činidlá","Tovar; Služba","","https://portal.eks.sk/SpravaKniznice/OpisneFormulareKniznice/VerejnyDetailOpisnehoFormularaKniznice/206737","1","329,280",
"OF-206746","Po karanténe","Preprava osôb autobusom ","preprava, autobus","60100000-9 Služby cestnej dopravy; 60112000-6 Služby verejnej cestnej dopravy","Služba","","https://portal.eks.sk/SpravaKniznice/OpisneFormulareKniznice/VerejnyDetailOpisnehoFormularaKniznice/206746","1","1410,000",
"OF-206747","Po karanténe","Zabezpečenie stravovania elektronickou stravnou kartou ","Stravovanie","30160000-8 Magnetické karty; 30237131-6 Elektronické karty; 60000000-8 Dopravné služby (bez prepravy odpadu)","Tovar; Služba","","https://portal.eks.sk/SpravaKniznice/OpisneFormulareKniznice/VerejnyDetailOpisnehoFormularaKniznice/206747","1","25948,560",
"OF-206754","Po karanténe","Originálne tonery ","Fotokopírovanie, kopírovanie, skenovanie, tlač","30125100-2 Tonerové náplne; 30125110-5 Toner do laserových tlačiarní/faxových prístrojov; 30125120-8 Toner do fotokopírovacích strojov; 60000000-8 Dopravné služby (bez prepravy odpadu)","Tovar; Služba","","https://portal.eks.sk/SpravaKniznice/OpisneFormulareKniznice/VerejnyDetailOpisnehoFormularaKniznice/206754","1","0",
"OF-206763","Po karanténe","Čítačka elektronických kníh (projekt)","čítačka elektronických kníh","30233000-1 Archivačné a čítacie zariadenia; 30200000-1 Počítačové zariadenia a spotrebný materiál; 60000000-8 Dopravné služby (bez prepravy odpadu)","Tovar; Služba","","https://portal.eks.sk/SpravaKniznice/OpisneFormulareKniznice/VerejnyDetailOpisnehoFormularaKniznice/206763","1","0",
"OF-206783","Po karanténe","Interiérové vybavenie do kancelárii","vitrína, jedálenský stôl, kôš na odpad, vešiak, korková nástenka, pohovka, konferenčný stolík, konferenčné kreslo","39100000-3 Nábytok; 39000000-2 Nábytok (vrátane kancelárskeho nábytku), zariadenie interiéru, domáce spotrebiče (s výnimkou osvetlenia) a čistiace prostriedky; 60000000-8 Dopravné služby (bez prepravy odpadu)","Tovar; Služba","","https://portal.eks.sk/SpravaKniznice/OpisneFormulareKniznice/VerejnyDetailOpisnehoFormularaKniznice/206783","1","0",
"OF-206799","Po karanténe","Kancelársky nábytok","stoličky, stôl","39100000-3 Nábytok; 60000000-8 Dopravné služby (bez prepravy odpadu)","Tovar; Služba","","https://portal.eks.sk/SpravaKniznice/OpisneFormulareKniznice/VerejnyDetailOpisnehoFormularaKniznice/206799","1","0",
"OF-206804","Po karanténe","Vybavenie elektrónového mikroskopu a laboratória pre meranie optických signálov","Skenovací elektrónový mikroskop, optický vláknový coupler, materiál na pokovenie, substráty pre litografiu","33790000-4 Laboratórny, zdravotnícky alebo farmaceutický sklenený tovar; 38519000-6 Rôzne súčasti mikroskopov; 14523200-5 Zlato; 60000000-8 Dopravné služby (bez prepravy odpadu)","Tovar; Služba","","https://portal.eks.sk/SpravaKniznice/OpisneFormulareKniznice/VerejnyDetailOpisnehoFormularaKniznice/206804","1","6502,000",
"OF-206823","Po karanténe","SPRACOVANÉ OVOCIE A SPRACOVANÁ ZELENINA","spracované ovocie a zelenina, zeleninové a ovocné šťavy","15330000-0 Spracované ovocie a zelenina; 15331130-7 Fazuľa, hrach, paprika, paradajky a iná zelenina; 15331000-7 Spracovaná zelenina; 15332100-5 Spracované ovocie; 15331131-4 Spracovaná fazuľa; 15331133-8 Lúpaný a polený hrach; 15331135-2 Spracované huby; 15331142-4 Spracovaná kapusta; 15331150-3 Spracované strukoviny; 15331170-9 Mrazená zelenina; 15331400-1 Nakladaná a/alebo konzervovaná zelenina; 15331425-2 Paradajkový pretlak; 15331430-0 Konzervované huby; 15331470-2 Kukurica cukrová; 15332200-6 Džemy a marmelády, ovocné želé; ovocné alebo orechové pyré a pasty/pretlaky; 15332290-3 Džemy; 15331460-9 Konzervovaná zelenina; 15332412-5 Spracované hrozienka; 15871230-5 Paradajkový kečup; 15332230-5 Marmelády; 15884000-8 Dojčenská výživa; 15320000-7 Ovocné a zeleninové šťavy","Tovar","","https://portal.eks.sk/SpravaKniznice/OpisneFormulareKniznice/VerejnyDetailOpisnehoFormularaKniznice/206823","0","0",
"OF-206827","Po karanténe","Sanitné vozidlo RLP","sanitné vozidlá","34114121-3 Sanitky; 60000000-8 Dopravné služby (bez prepravy odpadu)","Tovar; Služba","","https://portal.eks.sk/SpravaKniznice/OpisneFormulareKniznice/VerejnyDetailOpisnehoFormularaKniznice/206827","1","115495,000",
"OF-206829","Po karanténe","Posteľná, hygienická a kuchynská bielizeň","prestieradlo, návlečka, uterák, vankúš, paplón","39512000-4 Posteľná bielizeň; 60000000-8 Dopravné služby (bez prepravy odpadu); 39514100-9 Uteráky","Tovar; Služba","","https://portal.eks.sk/SpravaKniznice/OpisneFormulareKniznice/VerejnyDetailOpisnehoFormularaKniznice/206829","1","5250,000",
"OF-206830","Po karanténe","ovocie a zelenina","ovocie, zelenina","03212100-1 Zemiaky; 03221100-7 Koreňová a hľuzová zelenina; 03221230-7 Papriky; 03221240-0 Paradajka; 03221270-9 Uhorka; 03221410-3 Kapusta; 03222111-4 Banány; 03222210-8 Citróny; 03222220-1 Pomaranče; 03222321-9 Jablká; 60000000-8 Dopravné služby (bez prepravy odpadu); 15331461-6 Konzervovaná kyslá kapusta","Tovar; Služba","","https://portal.eks.sk/SpravaKniznice/OpisneFormulareKniznice/VerejnyDetailOpisnehoFormularaKniznice/206830","1","13998,330",
"OF-206840","Po karanténe","Firewall + support a služby na 1 rok","firewall, switch, sieť, smerovač","32422000-7 Sieťové komponenty; 32430000-6 Sieť WAN; 48732000-8 Softvérový balík na zaistenie bezpečnosti dát; 60000000-8 Dopravné služby (bez prepravy odpadu)","Tovar; Služba","","https://portal.eks.sk/SpravaKniznice/OpisneFormulareKniznice/VerejnyDetailOpisnehoFormularaKniznice/206840","1","7875,000",
"OF-206843","Po karanténe","Zametacia metla ","Zametacia metla","34300000-0 Časti a príslušenstvo vozidiel a ich motorov; 60000000-8 Dopravné služby (bez prepravy odpadu)","Tovar; Služba","","https://portal.eks.sk/SpravaKniznice/OpisneFormulareKniznice/VerejnyDetailOpisnehoFormularaKniznice/206843","0","0",
"OF-206855","Po karanténe","Antidekubitné matrace 12 ks","matrac antidekubitný","39143112-4 Matrace; 60000000-8 Dopravné služby (bez prepravy odpadu)","Tovar; Služba","","https://portal.eks.sk/SpravaKniznice/OpisneFormulareKniznice/VerejnyDetailOpisnehoFormularaKniznice/206855","1","2068,000",
"OF-206870","Po karanténe","Reagencie pre analýzu koncentrácie siričitanov, dusičnanov, fosfátov, chloridov, tvrdosti vody a sonda pre meranie pH","reagencie, reagenčné sety, pH sonda","24320000-3 Základné organické chemikálie; 39230000-3 Špeciálne výrobky; 60000000-8 Dopravné služby (bez prepravy odpadu)","Tovar; Služba","","https://portal.eks.sk/SpravaKniznice/OpisneFormulareKniznice/VerejnyDetailOpisnehoFormularaKniznice/206870","1","0",
"OF-206872","Po karanténe","Zabezpečenie stravovania elektronickou stravnou kartou","elektronické stravné karty, stravné poukážky, zabezpečenie hromadného stravovania zamestnancov","30160000-8 Magnetické karty; 30237131-6 Elektronické karty; 30199770-8 Stravné poukážky; 60000000-8 Dopravné služby (bez prepravy odpadu)","Tovar; Služba","","https://portal.eks.sk/SpravaKniznice/OpisneFormulareKniznice/VerejnyDetailOpisnehoFormularaKniznice/206872","1","0",
"OF-206874","Po karanténe","Výpočtová technika (f2)","tablet, elektronické pero, tlačiareň, púzdro na prenosný počítač, externý disk, notebook, adaptér","30213200-7 Tabletový počítač; 60000000-8 Dopravné služby (bez prepravy odpadu); 48313100-6 Optické čítacie systémy; 30232110-8 Laserové tlačiarne; 30237270-2 Puzdrá na prenosné počítače; 37453300-1 Disky; 30213100-6 Prenosné počítače; 31111000-7 Adaptéry","Tovar; Služba","","https://portal.eks.sk/SpravaKniznice/OpisneFormulareKniznice/VerejnyDetailOpisnehoFormularaKniznice/206874","1","1540,000",
"OF-206877","Po karanténe","DeLonghi Vodný filter DLS C002","DeLonghi Vodný filter DLS C002","39800000-0 Čistiace a leštiace výrobky; 42900000-5 Rôzne strojové zariadenia na všeobecné a osobitné účely; 60000000-8 Dopravné služby (bez prepravy odpadu)","Tovar; Služba","","https://portal.eks.sk/SpravaKniznice/OpisneFormulareKniznice/VerejnyDetailOpisnehoFormularaKniznice/206877","1","143,330",
"OF-206878","Po karanténe","Hliníkove konštrukčné diely MILOS pre pódiovú a javiskovú techniku","Hliník, Truss, MILOS, Javisko, Pódium","31000000-6 Elektrické stroje, prístroje, zariadenia a spotrebný tovar; osvetlenie; 32000000-3 Rozhlas, televízia, komunikácie, telekomunikácie a príbuzné zariadenia; 44000000-0 Stavebné konštrukcie a materiály; pomocné výrobky pre konštrukcie (s výnimkou elektrických prístrojov); 60000000-8 Dopravné služby (bez prepravy odpadu)","Tovar; Služba","","https://portal.eks.sk/SpravaKniznice/OpisneFormulareKniznice/VerejnyDetailOpisnehoFormularaKniznice/206878","1","0",
"OF-206879","Po karanténe","Združená dodávka plynu.","Zemný plyn, distribúcia plynu, preprava plynu.","09123000-7 Zemný plyn; 65200000-5 Rozvod plynu a súvisiace služby","Tovar; Služba","","https://portal.eks.sk/SpravaKniznice/OpisneFormulareKniznice/VerejnyDetailOpisnehoFormularaKniznice/206879","1","23583,330",
"OF-206880","Po karanténe","Upgrade kit k 3D tlačiarni Original Prusa i3 MK3S alebo ekvivalent","Upgrade kit 3D printer","30232100-5 Tlačiarne a zapisovače; 60000000-8 Dopravné služby (bez prepravy odpadu)","Tovar; Služba","","https://portal.eks.sk/SpravaKniznice/OpisneFormulareKniznice/VerejnyDetailOpisnehoFormularaKniznice/206880","1","499,990",
"OF-206882","Po karanténe","Kancelárske potreby","Kancelársky papier, výkresy","30192000-1 Kancelárske potreby; 30197620-8 Písací papier; 30197630-1 Papier na tlač alebo iné grafické účely; 60000000-8 Dopravné služby (bez prepravy odpadu)","Tovar; Služba","","https://portal.eks.sk/SpravaKniznice/OpisneFormulareKniznice/VerejnyDetailOpisnehoFormularaKniznice/206882","0","0",
"OF-206883","Po karanténe","Potreby pre spoločné stravovanie","tanier, pohár, lyžica","19520000-7 Plastové výrobky; 39220000-0 Kuchynské zariadenie, domáce potreby a potreby pre domáce hospodárstvo a dodávky pre stravovacie zariadenia; 39221210-2 Taniere; 39221120-4 Šálky a poháre; 39223100-2 Lyžice; 18424300-0 Jednorazové rukavice; 60000000-8 Dopravné služby (bez prepravy odpadu)","Tovar; Služba","","https://portal.eks.sk/SpravaKniznice/OpisneFormulareKniznice/VerejnyDetailOpisnehoFormularaKniznice/206883","1","1058,330",
"OF-206884","Po karanténe","Stravné poukážky","Papierové stravné poukážky, dodanie papierových stravných poukážok, Zabezpečenie stravovania","30199770-8 Stravné poukážky; 60000000-8 Dopravné služby (bez prepravy odpadu)","Tovar; Služba","","https://portal.eks.sk/SpravaKniznice/OpisneFormulareKniznice/VerejnyDetailOpisnehoFormularaKniznice/206884","0","0",
"OF-206885","Po karanténe","Farby","farba, riedidlo","24200000-6 Farby a pigmenty; 44810000-1 Náterové farby; 44832200-3 Riedidlá; 60000000-8 Dopravné služby (bez prepravy odpadu)","Tovar; Služba","","https://portal.eks.sk/SpravaKniznice/OpisneFormulareKniznice/VerejnyDetailOpisnehoFormularaKniznice/206885","2","583,330",
"OF-206886","Po karanténe","Hlbokomraziaci box","Hlbokomraziaci box","39711120-6 Mrazničky; 42513000-5 Chladiace a mraziace zariadenia; 60000000-8 Dopravné služby (bez prepravy odpadu)","Tovar; Služba","","https://portal.eks.sk/SpravaKniznice/OpisneFormulareKniznice/VerejnyDetailOpisnehoFormularaKniznice/206886","1","10166,500",
"OF-206887","Po karanténe","Mini PC zostavy a monitory","počítač, monitor, All in one stojan, klávesnica, myš","30213000-5 Osobné počítače; 30213300-8 Stolový počítač; 30237200-1 Príslušenstvo počítačov; 60000000-8 Dopravné služby (bez prepravy odpadu); 30231310-3 Ploché displeje; 30231000-7 Počítačové monitory a konzoly","Tovar; Služba","","https://portal.eks.sk/SpravaKniznice/OpisneFormulareKniznice/VerejnyDetailOpisnehoFormularaKniznice/206887","0","0",
"OF-206888","Po karanténe","Źeleziarske výrobky a brusivá ","Drobný spotrebný materiál na techniku","14522300-9 Šmirgeľ; 44315310-7 Materiály na spájkovanie; 43830000-0 Mechanické náradie; 60000000-8 Dopravné služby (bez prepravy odpadu)","Tovar","","https://portal.eks.sk/SpravaKniznice/OpisneFormulareKniznice/VerejnyDetailOpisnehoFormularaKniznice/206888","0","0",
"OF-206889","Po karanténe","Mrazena zelenina, mrazene zemiaky a zemiakové výrobky a mrazené polotovary","zemiaky, mrkva, hrášok","15331100-8 Čerstvá alebo mrazená zelenina; 60000000-8 Dopravné služby (bez prepravy odpadu)","Tovar; Služba","","https://portal.eks.sk/SpravaKniznice/OpisneFormulareKniznice/VerejnyDetailOpisnehoFormularaKniznice/206889","1","13166,670",
"OF-206890","Po karanténe","hojdačky","skúter, hojdačka, umelý kaučukový povrch, maxi miešačka","37400000-2 Športový tovar a výbava; 37500000-3 Hry a hračky; lunaparky; 60000000-8 Dopravné služby (bez prepravy odpadu); 37000000-8 Hudobné nástroje, športový tovar, hry, hračky, materiály pre remeselné a umelecké práce a príslušenstvo","Tovar; Služba","","https://portal.eks.sk/SpravaKniznice/OpisneFormulareKniznice/VerejnyDetailOpisnehoFormularaKniznice/206890","1","826,730",
"OF-206892","Po karanténe","Ručné elektrické náradie","vibračná brúska,  priamočiara píla","42652000-1 Ručné elektromechanické nástroje; 44511500-0 Ručné píly; 42642100-9 Obrábacie stroje na drevo; 33136000-2 Rotačné a brúsne nástroje; 60000000-8 Dopravné služby (bez prepravy odpadu)","Tovar; Služba","","https://portal.eks.sk/SpravaKniznice/OpisneFormulareKniznice/VerejnyDetailOpisnehoFormularaKniznice/206892","1","273,330",
"OF-206893","Po karanténe","Kaučuková dlažba do materskej školy II.","kaučuková dlažba","37400000-2 Športový tovar a výbava; 37500000-3 Hry a hračky; lunaparky; 60000000-8 Dopravné služby (bez prepravy odpadu)","Tovar; Služba","","https://portal.eks.sk/SpravaKniznice/OpisneFormulareKniznice/VerejnyDetailOpisnehoFormularaKniznice/206893","1","1502,710",
"OF-206894","Po karanténe","Napájací zdroj 24 V / 30 A","zdroj napätia","30237280-5 Napájacie príslušenstvo; 60000000-8 Dopravné služby (bez prepravy odpadu)","Tovar; Služba","","https://portal.eks.sk/SpravaKniznice/OpisneFormulareKniznice/VerejnyDetailOpisnehoFormularaKniznice/206894","1","454,000",
"OF-206897","Po karanténe","Zostava desktop PC","počítač, pracovná stanica, monitor","30211400-5 Počítačové konfigurácie; 60000000-8 Dopravné služby (bez prepravy odpadu)","Tovar; Služba","","https://portal.eks.sk/SpravaKniznice/OpisneFormulareKniznice/VerejnyDetailOpisnehoFormularaKniznice/206897","1","4357,410",
"OF-206898","Po karanténe","kancelárske stoličky otočné","kancelárska stolička","39130000-2 Kancelársky nábytok; 60000000-8 Dopravné služby (bez prepravy odpadu)","Tovar; Služba","","https://portal.eks.sk/SpravaKniznice/OpisneFormulareKniznice/VerejnyDetailOpisnehoFormularaKniznice/206898","1","895,000",
"OF-206899","Po karanténe","Licencie Microsoft ","Microsoft, SQL, server, Core, center, datacenter, exchange, licencia","48000000-8 Softvérové balíky a informačné systémy; 60000000-8 Dopravné služby (bez prepravy odpadu)","Tovar; Služba","","https://portal.eks.sk/SpravaKniznice/OpisneFormulareKniznice/VerejnyDetailOpisnehoFormularaKniznice/206899","1","10000,000",
"OF-206900","Po karanténe","Laboratórny nábytok do Rovinky a Vígľaša","laboratórny nábytok","39180000-7 Laboratórny nábytok; 60000000-8 Dopravné služby (bez prepravy odpadu)","Tovar; Služba","","https://portal.eks.sk/SpravaKniznice/OpisneFormulareKniznice/VerejnyDetailOpisnehoFormularaKniznice/206900","1","56500,280",
"OF-206901","Po karanténe","Toaletné a hygienické prostriedky","mydlo toaletné, mydlo tekuté, krém na ruky, šampón na vlasy, zubná pasta, zubná kefka, jednorazový holiaci strojček, krém na  holenie, toaletný papier jednovrstvový, latexové rukavice, papierové utierky, štetka na holenie, krém na holenie","18424000-7 Rukavice; 18424300-0 Jednorazové rukavice; 33711610-6 Šampóny; 33711710-7 Zubné kefky; 33711720-0 Zubná pasta; 33711800-5 Holiace prípravky; 33711810-8 Holiace krémy; 33711900-6 Mydlo; 33761000-2 Toaletný papier; 33770000-8 Papierové hygienické výrobky; 33741200-8 Krémy na ruky alebo telové mlieka; 18141000-9 Pracovné rukavice; 60000000-8 Dopravné služby (bez prepravy odpadu)","Tovar; Služba","","https://portal.eks.sk/SpravaKniznice/OpisneFormulareKniznice/VerejnyDetailOpisnehoFormularaKniznice/206901","1","2500,000",
"OF-206904","Po karanténe","Originálne tonery","tonery","30125100-2 Tonerové náplne; 60000000-8 Dopravné služby (bez prepravy odpadu)","Tovar; Služba","","https://portal.eks.sk/SpravaKniznice/OpisneFormulareKniznice/VerejnyDetailOpisnehoFormularaKniznice/206904","1","0",
"OF-206905","Po karanténe","Obnovenie podpory produktov RED HAT (2)","produkty RED HAT","48620000-0 Operačné systémy; 48625000-5 Operačné systémy pre otvorené systémy","Tovar","","https://portal.eks.sk/SpravaKniznice/OpisneFormulareKniznice/VerejnyDetailOpisnehoFormularaKniznice/206905","0","0",
"OF-206906","Po karanténe","Tonery - originál od výrobcu zariadení daných značiek (HP Laser Jet P2055dn , HP LaserJet 2300, Epson EPL-N2550, LaserJet Pro M426fdn, HP Officejet Pro X476dw, HP LaserJet 1300)","Tonery originál","30125110-5 Toner do laserových tlačiarní/faxových prístrojov; 30125120-8 Toner do fotokopírovacích strojov; 60000000-8 Dopravné služby (bez prepravy odpadu)","Tovar; Služba","","https://portal.eks.sk/SpravaKniznice/OpisneFormulareKniznice/VerejnyDetailOpisnehoFormularaKniznice/206906","1","0",
"OF-206907","Po karanténe","Čistiace a dezinfekčné prostriedky","Čistiace prostriedky, dezinfekčné prostriedky, umývacie prostriedky, leštiace prostriedky, odmasťovacie prostriedky, prostriedky na odstraňovanie vodného kameňa, vedrá, zmetáky","39800000-0 Čistiace a leštiace výrobky; 39831300-9 Čistiace prostriedky na podlahu; 39831600-2 Čistiace prostriedky na toalety; 39832000-3 Čistiace prostriedky na riad; 39830000-9 Čistiace výrobky; 39832100-4 Čistiaci prášok na riad; 39831220-4 Odmasťovacie prostriedky; 39831210-1 Saponáty na umývanie riadu; 39831200-8 Saponáty; 24455000-8 Dezinfekčné prostriedky; 39224000-8 Metly a kefy a iné predmety rôznych typov; 39224300-1 Metly a kefy a iné výrobky na upratovanie domácností; 39224100-9 Metly; 39224310-4 WC kefy; 60000000-8 Dopravné služby (bez prepravy odpadu)","Tovar; Služba","","https://portal.eks.sk/SpravaKniznice/OpisneFormulareKniznice/VerejnyDetailOpisnehoFormularaKniznice/206907","1","1499,170",
"OF-206908","Po karanténe","Meracímodul pre senzorové aplikácie s príslušenstvom","Systém zberu dát, analógovo-číslicový prevodník, rozhranie, senzorový systém","38540000-2 Testovacie a meracie stroje a prístroje; 60000000-8 Dopravné služby (bez prepravy odpadu)","Tovar; Služba","","https://portal.eks.sk/SpravaKniznice/OpisneFormulareKniznice/VerejnyDetailOpisnehoFormularaKniznice/206908","1","0",
"OF-206910","Po karanténe","Nákup výpočtovej techniky a príslušenstva","Počítačové zariadenia a príslušenstvo, Prenosné počítače, Osobné počítače, Videoprojektory, Monitor, Slúchadlá s mikrofónom, Adaptéry","30200000-1 Počítačové zariadenia a spotrebný materiál; 30213100-6 Prenosné počítače; 30213000-5 Osobné počítače; 38652120-7 Videoprojektory; 60000000-8 Dopravné služby (bez prepravy odpadu); 30231000-7 Počítačové monitory a konzoly; 32342100-3 Slúchadlá; 31111000-7 Adaptéry","Tovar; Služba","","https://portal.eks.sk/SpravaKniznice/OpisneFormulareKniznice/VerejnyDetailOpisnehoFormularaKniznice/206910","1","0",
"OF-206911","Po karanténe","Zdravotnícky spotrebný materiál","skalpelová čepeľ, nožnice, kanyla, ihla, striekačka, obväz, tampón, rukavice, plášť, vata, transfúzny vak, fonendoskop, teplomer","33140000-3 Zdravotnícky spotrebný materiál; 60000000-8 Dopravné služby (bez prepravy odpadu)","Tovar; Služba","","https://portal.eks.sk/SpravaKniznice/OpisneFormulareKniznice/VerejnyDetailOpisnehoFormularaKniznice/206911","0","0",
"OF-206913","Po karanténe","Vodoinštalačný materiál","ventil, sifón, koleno, batéria, rúry","42130000-9 Výpusty, kohúty, ventily a podobné príslušenstvo; 44164310-3 Rúry a príslušenstvo (spojky); 42131260-6 Guľové/plavákové ventily; 44167400-2 Kolená; 42131240-0 Priame (guľové) ventily; 44167300-1 Ohyby, nátrubky a príslušenstvo na rúrky; 60000000-8 Dopravné služby (bez prepravy odpadu)","Tovar; Služba","","https://portal.eks.sk/SpravaKniznice/OpisneFormulareKniznice/VerejnyDetailOpisnehoFormularaKniznice/206913","1","0",
"OF-206915","Po karanténe","prenosné počítače, notebooky","prenosný počítač, externé ovládacie zariadenie - myš,","30213100-6 Prenosné počítače; 60000000-8 Dopravné služby (bez prepravy odpadu)","Tovar; Služba","","https://portal.eks.sk/SpravaKniznice/OpisneFormulareKniznice/VerejnyDetailOpisnehoFormularaKniznice/206915","0","0",
"OF-206916","Po karanténe","Kancelárske potreby, predmety osobnej starostlivosti a xerografický papier","kancelárske potreby, toaletný papier, papierové utierky, xerografický papier","30192000-1 Kancelárske potreby; 33700000-7 Predmety osobnej starostlivosti; 30197644-2 Xerografický papier","Tovar","","https://portal.eks.sk/SpravaKniznice/OpisneFormulareKniznice/VerejnyDetailOpisnehoFormularaKniznice/206916","0","0",
"OF-206917","Po karanténe","Predmety osobnej starostlivosti a xerografický papier","toaletný papier, papierové utierky, xerografický papier","33700000-7 Predmety osobnej starostlivosti; 30197644-2 Xerografický papier","Tovar","","https://portal.eks.sk/SpravaKniznice/OpisneFormulareKniznice/VerejnyDetailOpisnehoFormularaKniznice/206917","0","0",
"OF-206918","Po karanténe","Grafická karta a SSD disk","grafická karta, ssd","30237000-9 Časti a príslušenstvo počítačov a spotrebný materiál k nim; 60000000-8 Dopravné služby (bez prepravy odpadu)","Tovar; Služba","","https://portal.eks.sk/SpravaKniznice/OpisneFormulareKniznice/VerejnyDetailOpisnehoFormularaKniznice/206918","1","1230,000",
"OF-206920","Po karanténe","Bezpečnostná skriňa pre horľavé kvapaliny","bezpečnostná skriňa","44421722-4 Bezpečnostné skrine; 60000000-8 Dopravné služby (bez prepravy odpadu)","Tovar; Služba","","https://portal.eks.sk/SpravaKniznice/OpisneFormulareKniznice/VerejnyDetailOpisnehoFormularaKniznice/206920","1","1407,000",
"OF-206922","Po karanténe","Výpočtová technika -  PC, monitory","Výpočtová technika,  PC, monitory","30200000-1 Počítačové zariadenia a spotrebný materiál; 30231000-7 Počítačové monitory a konzoly; 60000000-8 Dopravné služby (bez prepravy odpadu)","Tovar; Služba","","https://portal.eks.sk/SpravaKniznice/OpisneFormulareKniznice/VerejnyDetailOpisnehoFormularaKniznice/206922","1","2679,990",
"OF-206924","Po karanténe","Krimpovacie uzávery									","Laboratórne vybavenie, Krimpovacie uzávery","38000000-5 Laboratórne, optické a presné prístroje a vybavenie (s výnimkou skiel); 60000000-8 Dopravné služby (bez prepravy odpadu)","Tovar; Služba","","https://portal.eks.sk/SpravaKniznice/OpisneFormulareKniznice/VerejnyDetailOpisnehoFormularaKniznice/206924","1","290,000",
"OF-206925","Po karanténe","Výroba a dodávka tlačív (2)","tlačivá, obálky","22458000-5 Tlačoviny na objednávku; 30199710-0 Tlačené obálky; 22820000-4 Formuláre; 79810000-5 Tlačiarenské služby; 60000000-8 Dopravné služby (bez prepravy odpadu)","Tovar; Služba","","https://portal.eks.sk/SpravaKniznice/OpisneFormulareKniznice/VerejnyDetailOpisnehoFormularaKniznice/206925","0","0",
"OF-206926","Po karanténe","Zabezpečenie poskytovania stravovacích služieb formou stravných poukážok","Stravné poukážky","30199770-8 Stravné poukážky; 60000000-8 Dopravné služby (bez prepravy odpadu)","Tovar; Služba","","https://portal.eks.sk/SpravaKniznice/OpisneFormulareKniznice/VerejnyDetailOpisnehoFormularaKniznice/206926","1","0",
"OF-206927","Po karanténe","  Filtre","Filtre,filtračná náplň do prístroja Millipore Direct Q3","42910000-8 Destilačné, filtračné alebo rektifikačné prístroje; 42912000-2 Stroje a prístroje na filtráciu alebo čistenie kvapalín; 42955000-5 Časti filtračných zariadení; 60000000-8 Dopravné služby (bez prepravy odpadu)","Tovar; Služba","","https://portal.eks.sk/SpravaKniznice/OpisneFormulareKniznice/VerejnyDetailOpisnehoFormularaKniznice/206927","0","0",
