"OpisnyFormularIdentifikator","OpisnyFormularStav","OpisnyFormularNazov","OpisnyFormularKlucoveSlova","OpisnyFormularCpv","OpisnyFormularDruh","OpisnyFormularKategoriaSluzieb","OpisnyFormularUrl","OpisnyFormularPocetVyhlasenychZakaziek","OpisnyFormularObchodovanaSumaBezDPH",
"OF-295675","Po karanténe","Zariadenia pre domovú inštaláciu, vykurovanie a hygienu, sanitárna technika","Sanitárna technika","44411000-4 Sanitárne výrobky; 42131000-6 Výpusty, kohúty a ventily; 39370000-6 Vodoinštalácie; 60000000-8 Dopravné služby (bez prepravy odpadu)","Tovar; Služba","","https://portal.eks.sk/SpravaKniznice/OpisneFormulareKniznice/VerejnyDetailOpisnehoFormularaKniznice/295675","1","1250.000",
"OF-296032","Po karanténe","Náhradné diely na autobusy Sor NB12, NB18 ","Náhradné diely, autobus ,Sor","34121100-2 Autobusy verejnej dopravy; 34121200-3 Kĺbové autobusy; 60000000-8 Dopravné služby (bez prepravy odpadu)","Tovar; Služba","","https://portal.eks.sk/SpravaKniznice/OpisneFormulareKniznice/VerejnyDetailOpisnehoFormularaKniznice/296032","1","2020.000",
"OF-296046","Po karanténe","Náhradné diely na autobusy Sor NB12,NB18 - podvozok","Náhradné diely, autobus,Sor NB12,NB18,podvozok","34121100-2 Autobusy verejnej dopravy; 34139200-2 Samotný podvozok; 60000000-8 Dopravné služby (bez prepravy odpadu)","Tovar","","https://portal.eks.sk/SpravaKniznice/OpisneFormulareKniznice/VerejnyDetailOpisnehoFormularaKniznice/296046","1","1530.000",
"OF-296057","Po karanténe","Svietidlá, svetelné zdroje a príslušenstvo","Žiarovky, žiarivky","31531000-7 Žiarovky; 31532910-6 Žiarivkové trubice; 60000000-8 Dopravné služby (bez prepravy odpadu)","Tovar; Služba","","https://portal.eks.sk/SpravaKniznice/OpisneFormulareKniznice/VerejnyDetailOpisnehoFormularaKniznice/296057","1","678.000",
"OF-296064","Po karanténe","Svietidlá,osvetľovacie zariadenie,svetelné zdroje a príslušenstvo","LED trubice,žiarivky, žiarovky,","31532920-9 Žiarovky a žiarivkové lampy; 31532100-5 Trubicové svietidlá; 60000000-8 Dopravné služby (bez prepravy odpadu)","Tovar; Služba","","https://portal.eks.sk/SpravaKniznice/OpisneFormulareKniznice/VerejnyDetailOpisnehoFormularaKniznice/296064","2","1614.960",
"OF-296089","Po karanténe","Čistiace prostriedky ","čistiace prostriedky, prostriedok na čistenie podláh, toaletný papier, handry","39830000-9 Čistiace výrobky; 60000000-8 Dopravné služby (bez prepravy odpadu)","Tovar; Služba","","https://portal.eks.sk/SpravaKniznice/OpisneFormulareKniznice/VerejnyDetailOpisnehoFormularaKniznice/296089","1","940.830",
"OF-296096","Po karanténe","Kancelársky nábytok","stolička, lavica, stôl, doska, regál, skrinka, kontajner, kolieska","39130000-2 Kancelársky nábytok; 39100000-3 Nábytok; 39121200-8 Stoly; 39121100-7 Písacie stoly; 39112000-0 Stoličky; 39113000-7 Rôzne sedadlá a stoličky; 39141300-5 Skrine; 39122000-3 Skrine a knižnice; 39132100-7 Archivačné skrine; 60000000-8 Dopravné služby (bez prepravy odpadu)","Tovar; Služba","","https://portal.eks.sk/SpravaKniznice/OpisneFormulareKniznice/VerejnyDetailOpisnehoFormularaKniznice/296096","1","3040.830",
"OF-296107","Po karanténe","Chemikálie pre histologickú a molekulovú analýzu ","protilátka, DNA, kit","24320000-3 Základné organické chemikálie; 60000000-8 Dopravné služby (bez prepravy odpadu)","Tovar; Služba","","https://portal.eks.sk/SpravaKniznice/OpisneFormulareKniznice/VerejnyDetailOpisnehoFormularaKniznice/296107","1","0",
"OF-296114","Po karanténe","Chemikálie pre in vitro a in vivo analýzu ","protilátka, DNA, kit","24320000-3 Základné organické chemikálie; 60000000-8 Dopravné služby (bez prepravy odpadu)","Tovar; Služba","","https://portal.eks.sk/SpravaKniznice/OpisneFormulareKniznice/VerejnyDetailOpisnehoFormularaKniznice/296114","1","0",
"OF-296121","Po karanténe","Špeciálne oleje a mazivá centrálne nezabezpečované","olej, mazivo","09211400-5 Prevodové oleje; 09211000-1 Mazacie oleje a mazivá; 60000000-8 Dopravné služby (bez prepravy odpadu)","Tovar; Služba","","https://portal.eks.sk/SpravaKniznice/OpisneFormulareKniznice/VerejnyDetailOpisnehoFormularaKniznice/296121","1","1884.240",
"OF-296132","Po karanténe","Športové a rekreačné vybavenie","lyže, viazanie, mačky, pásy, lyžiarky","37411160-1 Lyžiarsky výstroj; 37411110-6 Lyžiarske topánky; 37411120-9 Lyže; 60000000-8 Dopravné služby (bez prepravy odpadu)","Tovar","","https://portal.eks.sk/SpravaKniznice/OpisneFormulareKniznice/VerejnyDetailOpisnehoFormularaKniznice/296132","2","34787.500",
"OF-296139","Po karanténe","Technické plyny a zásobníky","plyn, propán,","09122110-4 Skvapalnený propán; 60000000-8 Dopravné služby (bez prepravy odpadu)","Tovar; Služba","","https://portal.eks.sk/SpravaKniznice/OpisneFormulareKniznice/VerejnyDetailOpisnehoFormularaKniznice/296139","1","3266.670",
"OF-296157","Po karanténe","Výpočtová technika s príslušenstvom - tlačiareň a počítač","Tlačiareň, stolový počítač","30232110-8 Laserové tlačiarne; 30213300-8 Stolový počítač; 30125110-5 Toner do laserových tlačiarní/faxových prístrojov; 60000000-8 Dopravné služby (bez prepravy odpadu)","Tovar; Služba","","https://portal.eks.sk/SpravaKniznice/OpisneFormulareKniznice/VerejnyDetailOpisnehoFormularaKniznice/296157","1","604.170",
"OF-296164","Po karanténe","Dodávka elektrickej energie","Elektrická energia","09310000-5 Elektrická energia; 65300000-6 Rozvod elektriny a súvisiace služby","Tovar; Služba","","https://portal.eks.sk/SpravaKniznice/OpisneFormulareKniznice/VerejnyDetailOpisnehoFormularaKniznice/296164","0","0",
"OF-296171","Po karanténe","Čistiace a dezinfekčné prostriedky","čistiace prostriedky, čistiace prostriedky na riad, čistiace prostriedky na podlahu, mazľavé mydlo, pasta na umývanie rúk, osviežovač vzduchu","39800000-0 Čistiace a leštiace výrobky; 39830000-9 Čistiace výrobky; 39832000-3 Čistiace prostriedky na riad; 33741100-7 Čistiace prostriedky na ruky; 60000000-8 Dopravné služby (bez prepravy odpadu)","Tovar; Služba","","https://portal.eks.sk/SpravaKniznice/OpisneFormulareKniznice/VerejnyDetailOpisnehoFormularaKniznice/296171","1","24283.250",
"OF-296182","Po karanténe","Mini PC, myš a klávesnica, webová kamera s videokonferenčným systémom","webová kamera, videokonferencia, Mini PC Apple, myš, klávesnica","30213100-6 Prenosné počítače; 60000000-8 Dopravné služby (bez prepravy odpadu)","Tovar; Služba","","https://portal.eks.sk/SpravaKniznice/OpisneFormulareKniznice/VerejnyDetailOpisnehoFormularaKniznice/296182","1","2085.000",
"OF-296189","Po karanténe","Elektrospotrebiče","rýchlovarné kanvice,mikrovlnná rúra, varná doska, konvektor, mikrosystém, chladničky","39710000-2 Elektrické prístroje pre domácnosť; 60000000-8 Dopravné služby (bez prepravy odpadu)","Tovar; Služba","","https://portal.eks.sk/SpravaKniznice/OpisneFormulareKniznice/VerejnyDetailOpisnehoFormularaKniznice/296189","1","2688.320",
"OF-296207","Po karanténe","Špecifické krmivo pre zvieratá do nemocnice ","krmivo, diéta","15700000-5 Krmivo pre zvieratá; 60000000-8 Dopravné služby (bez prepravy odpadu)","Tovar; Služba","","https://portal.eks.sk/SpravaKniznice/OpisneFormulareKniznice/VerejnyDetailOpisnehoFormularaKniznice/296207","1","17893.000",
"OF-296214","Po karanténe","Motorové vozidlo 8-miestne na prepravu osôb ","vozidlo, motorové vozidlo","34110000-1 Osobné automobily; 34100000-8 Motorové vozidlá; 34115200-8 Motorové vozidlá na prepravu menej než 10 osôb","Tovar; Služba","","https://portal.eks.sk/SpravaKniznice/OpisneFormulareKniznice/VerejnyDetailOpisnehoFormularaKniznice/296214","0","0",
"OF-296466","Po karanténe","Objemové stavebné materiály","štrk, antuka","14212120-7 Štrk; 44111000-1 Stavebné materiály; 60000000-8 Dopravné služby (bez prepravy odpadu)","Tovar; Služba","","https://portal.eks.sk/SpravaKniznice/OpisneFormulareKniznice/VerejnyDetailOpisnehoFormularaKniznice/296466","1","6116.540",
"OF-296480","Po karanténe","Prefabrikované konštrukcie, prístrešky a kryty","Zatávňovacie tvárnice","44175000-7 Panely; 60000000-8 Dopravné služby (bez prepravy odpadu)","Tovar; Služba","","https://portal.eks.sk/SpravaKniznice/OpisneFormulareKniznice/VerejnyDetailOpisnehoFormularaKniznice/296480","1","40416.670",
"OF-296491","Po karanténe","Nábytok","kancelárske stoličky, pohovka, kancelársky stôl, jedálenský set, kuchynská linka","39100000-3 Nábytok","Tovar; Služba","","https://portal.eks.sk/SpravaKniznice/OpisneFormulareKniznice/VerejnyDetailOpisnehoFormularaKniznice/296491","1","0",
"OF-296498","Po karanténe","Špeciálne oleje a mazivá centrálne nezabezpečované","motorový olej, ad blue","09211100-2 Motorové oleje; 09211000-1 Mazacie oleje a mazivá; 60000000-8 Dopravné služby (bez prepravy odpadu)","Tovar; Služba","","https://portal.eks.sk/SpravaKniznice/OpisneFormulareKniznice/VerejnyDetailOpisnehoFormularaKniznice/296498","1","28333.330",
"OF-296505","Po karanténe","Objemové stavebné materiály","posypové materiály ,vápno, potery, kamenivo","14212120-7 Štrk; 44111000-1 Stavebné materiály; 60000000-8 Dopravné služby (bez prepravy odpadu)","Tovar; Služba","","https://portal.eks.sk/SpravaKniznice/OpisneFormulareKniznice/VerejnyDetailOpisnehoFormularaKniznice/296505","1","0",
"OF-296516","Po karanténe","Tonery","toner, Canon, HP","30125000-1 Časti a príslušenstvo fotokopírovacích prístrojov; 30125120-8 Toner do fotokopírovacích strojov; 30125100-2 Tonerové náplne; 60000000-8 Dopravné služby (bez prepravy odpadu)","Tovar; Služba","","https://portal.eks.sk/SpravaKniznice/OpisneFormulareKniznice/VerejnyDetailOpisnehoFormularaKniznice/296516","1","537.480",
"OF-296530","Po karanténe","Autopríslušenstvo - nákup prenosných staníc pre nabíjanie služobného motorového vozidla na elektrický pohon","nabíjacia stanica, elektromobil","31158100-9 Nabíjače batérií; 60000000-8 Dopravné služby (bez prepravy odpadu)","Tovar; Služba","","https://portal.eks.sk/SpravaKniznice/OpisneFormulareKniznice/VerejnyDetailOpisnehoFormularaKniznice/296530","2","603.920",
"OF-296541","Po karanténe","Osobný počítač ","osobný počítač","30213000-5 Osobné počítače; 60000000-8 Dopravné služby (bez prepravy odpadu)","Tovar; Služba","","https://portal.eks.sk/SpravaKniznice/OpisneFormulareKniznice/VerejnyDetailOpisnehoFormularaKniznice/296541","1","2345.000",
"OF-296548","Po karanténe","Prenosný počítač vrátane príslušenstva","Notebook","30213100-6 Prenosné počítače; 30230000-0 Zariadenia súvisiace s počítačmi; 60000000-8 Dopravné služby (bez prepravy odpadu)","Tovar; Služba","","https://portal.eks.sk/SpravaKniznice/OpisneFormulareKniznice/VerejnyDetailOpisnehoFormularaKniznice/296548","1","714.000",
"OF-296555","Po karanténe","Kovové skrine na zámok","kovová skriňa","44421722-4 Bezpečnostné skrine; 60000000-8 Dopravné služby (bez prepravy odpadu)","Tovar; Služba","","https://portal.eks.sk/SpravaKniznice/OpisneFormulareKniznice/VerejnyDetailOpisnehoFormularaKniznice/296555","1","2700.000",
"OF-296566","Po karanténe","Krmivo - ľaničník siaty","zviera, krmivo, ľaničník","15700000-5 Krmivo pre zvieratá; 60000000-8 Dopravné služby (bez prepravy odpadu)","Tovar; Služba","","https://portal.eks.sk/SpravaKniznice/OpisneFormulareKniznice/VerejnyDetailOpisnehoFormularaKniznice/296566","0","0",
"OF-296573","Po karanténe","Krmivo - ľan","zviera, krmivo, ľan","15700000-5 Krmivo pre zvieratá; 60000000-8 Dopravné služby (bez prepravy odpadu)","Tovar; Služba","","https://portal.eks.sk/SpravaKniznice/OpisneFormulareKniznice/VerejnyDetailOpisnehoFormularaKniznice/296573","0","0",
"OF-296580","Po karanténe","Trezory mobilné certifikované","trezor, mobilný trezor","44421000-7 Pancierové alebo spevnené trezory, pancierové skrinky a dvere; 44421300-0 Trezory; 60000000-8 Dopravné služby (bez prepravy odpadu)","Tovar","","https://portal.eks.sk/SpravaKniznice/OpisneFormulareKniznice/VerejnyDetailOpisnehoFormularaKniznice/296580","1","2000.000",
"OF-296591","Po karanténe","Hnedé uhlie (Svetec)Bilina- kocka","Hnedé uhlie","09111100-1 Uhlie; 60000000-8 Dopravné služby (bez prepravy odpadu)","Tovar; Služba","","https://portal.eks.sk/SpravaKniznice/OpisneFormulareKniznice/VerejnyDetailOpisnehoFormularaKniznice/296591","1","4962.480",
"OF-296598","Po karanténe","Utierky","utierky","33141118-0 Utierky; 60000000-8 Dopravné služby (bez prepravy odpadu)","Tovar; Služba","","https://portal.eks.sk/SpravaKniznice/OpisneFormulareKniznice/VerejnyDetailOpisnehoFormularaKniznice/296598","0","0",
"OF-296605","Po karanténe","Chémia pre prácu v biologickom laboratóriu","chemikálie","24000000-4 Chemické výrobky; 24960000-1 Rôzne chemické výrobky","Tovar","","https://portal.eks.sk/SpravaKniznice/OpisneFormulareKniznice/VerejnyDetailOpisnehoFormularaKniznice/296605","1","671.660",
"OF-296616","Po karanténe","Nové 7 miestne špeciálne motorové vozidlo s hydraulickou plošinou a kotviacim systémom pre invalidný vozík","motorové vozidlo, hydraulická plošina, kotviaci systém pre invalidný vozík","34110000-1 Osobné automobily; 34115200-8 Motorové vozidlá na prepravu menej než 10 osôb","Tovar; Služba","","https://portal.eks.sk/SpravaKniznice/OpisneFormulareKniznice/VerejnyDetailOpisnehoFormularaKniznice/296616","0","0",
"OF-296623","Po karanténe","Tonery","toner, tlačiareň","30125100-2 Tonerové náplne; 30125110-5 Toner do laserových tlačiarní/faxových prístrojov; 60000000-8 Dopravné služby (bez prepravy odpadu)","Tovar; Služba","","https://portal.eks.sk/SpravaKniznice/OpisneFormulareKniznice/VerejnyDetailOpisnehoFormularaKniznice/296623","1","0",
"OF-296630","Po karanténe","Náhradné diely na autobusy Solaris  U12","Náhradné diely, autobus ,Solaris U12","34121100-2 Autobusy verejnej dopravy; 60000000-8 Dopravné služby (bez prepravy odpadu)","Tovar; Služba","","https://portal.eks.sk/SpravaKniznice/OpisneFormulareKniznice/VerejnyDetailOpisnehoFormularaKniznice/296630","1","669.000",
"OF-296641","Po karanténe","Tlačiareň multifunkčné zariadenie","tlačiareň, multifunkčné zariadenie","42962000-7 Tlačiarske/kopírovacie a grafické zariadenia; 60000000-8 Dopravné služby (bez prepravy odpadu)","Tovar","","https://portal.eks.sk/SpravaKniznice/OpisneFormulareKniznice/VerejnyDetailOpisnehoFormularaKniznice/296641","1","0",
"OF-296648","Po karanténe","Opravy a ošetrovanie energoblokov","profylaktická prehliadka, energoblok, elektrocentrála, motorgenerátor","50530000-9 Opravy a údržba strojov","Služba","","https://portal.eks.sk/SpravaKniznice/OpisneFormulareKniznice/VerejnyDetailOpisnehoFormularaKniznice/296648","1","0",
"OF-296174","Po karanténe","Ostatné interiérové vybavenie																																									","Fotorám,  matrac","39151000-5 Rozličný nábytok; 60000000-8 Dopravné služby (bez prepravy odpadu)","Tovar; Služba","","https://portal.eks.sk/SpravaKniznice/OpisneFormulareKniznice/VerejnyDetailOpisnehoFormularaKniznice/296174","1","1116.660",
"OF-296197","Po karanténe","Výpočtová technika","Notebook,   atramentová tlačiareň","30213000-5 Osobné počítače; 30213100-6 Prenosné počítače; 30232150-0 Atramentové tlačiarne; 60000000-8 Dopravné služby (bez prepravy odpadu)","Tovar; Služba","","https://portal.eks.sk/SpravaKniznice/OpisneFormulareKniznice/VerejnyDetailOpisnehoFormularaKniznice/296197","1","936.670",
"OF-296199","Po karanténe","Pranie bielizne pre MŠ /2025","Pranie postelnej bielizne","98310000-9 Pranie a chemické čistenie; 60000000-8 Dopravné služby (bez prepravy odpadu)","Služba","","https://portal.eks.sk/SpravaKniznice/OpisneFormulareKniznice/VerejnyDetailOpisnehoFormularaKniznice/296199","1","40832.500",
"OF-296204","Po karanténe","Chemikálie priemyselné","Chemikalie na úpravu vody, Anorganické chemikálie, Odmasťovacie prostriedky","24962000-5 Chemikálie na úpravu vody; 24310000-0 Základné anorganické chemikálie; 39831220-4 Odmasťovacie prostriedky; 60000000-8 Dopravné služby (bez prepravy odpadu)","Tovar","","https://portal.eks.sk/SpravaKniznice/OpisneFormulareKniznice/VerejnyDetailOpisnehoFormularaKniznice/296204","1","2500.000",
"OF-296206","Po karanténe","Pamätné plakety","gravírovanie, pamätná minca, pasparta","98300000-6 Rôzne služby; 60000000-8 Dopravné služby (bez prepravy odpadu)","Služba","","https://portal.eks.sk/SpravaKniznice/OpisneFormulareKniznice/VerejnyDetailOpisnehoFormularaKniznice/296206","1","10000.000",
"OF-296231","Po karanténe","Objemové stavebné materiály","Kameninová drť- makadam","44111000-1 Stavebné materiály; 44190000-8 Rôzne stavebné materiály; 60000000-8 Dopravné služby (bez prepravy odpadu)","Tovar; Služba","","https://portal.eks.sk/SpravaKniznice/OpisneFormulareKniznice/VerejnyDetailOpisnehoFormularaKniznice/296231","1","2665.830",
"OF-296238","Po karanténe","Izolačné kity a komponenty pre PCR","kit, PCR","24327000-2 Rôzne organické chemikálie; 60000000-8 Dopravné služby (bez prepravy odpadu)","Tovar; Služba","","https://portal.eks.sk/SpravaKniznice/OpisneFormulareKniznice/VerejnyDetailOpisnehoFormularaKniznice/296238","1","5275.450",
"OF-296240","Po karanténe","Osobné ochranné pracovné prostriedky","pracovné odevy, pracovná obuv, pracovné okuliare, pracovné rukavice","18110000-3 Pracovné odevy; 18830000-6 Ochranná obuv; 33735100-2 Ochranné okuliare; 18141000-9 Pracovné rukavice; 60000000-8 Dopravné služby (bez prepravy odpadu)","Tovar; Služba","","https://portal.eks.sk/SpravaKniznice/OpisneFormulareKniznice/VerejnyDetailOpisnehoFormularaKniznice/296240","1","0",
"OF-296263","Po karanténe","Licencie Veeam Backup","Veeam, licencia","48000000-8 Softvérové balíky a informačné systémy; 60000000-8 Dopravné služby (bez prepravy odpadu)","Tovar; Služba","","https://portal.eks.sk/SpravaKniznice/OpisneFormulareKniznice/VerejnyDetailOpisnehoFormularaKniznice/296263","0","0",
"OF-296265","Po karanténe","Chemikálie","chemikálie","24000000-4 Chemické výrobky; 24960000-1 Rôzne chemické výrobky","Tovar","","https://portal.eks.sk/SpravaKniznice/OpisneFormulareKniznice/VerejnyDetailOpisnehoFormularaKniznice/296265","1","101.900",
"OF-296272","Po karanténe","Chladničky, kávovar, vyhrievaný autopoťah a iné elektrospotrebiče","chladenie, kávovar, ventilátor, varič","39710000-2 Elektrické prístroje pre domácnosť; 60000000-8 Dopravné služby (bez prepravy odpadu)","Tovar; Služba","","https://portal.eks.sk/SpravaKniznice/OpisneFormulareKniznice/VerejnyDetailOpisnehoFormularaKniznice/296272","1","1238.000",
"OF-296297","Po karanténe","Monočlánky a batérie","batérie, monočlánky","31440000-2 Batérie; 31434000-7 Lítiové akumulátory; 31411000-0 Alkalické batérie; 60000000-8 Dopravné služby (bez prepravy odpadu)","Tovar","","https://portal.eks.sk/SpravaKniznice/OpisneFormulareKniznice/VerejnyDetailOpisnehoFormularaKniznice/296297","0","0",
"OF-296299","Po karanténe","Špeciálne chemikálie a spotrebný materiál ","materiál, chemikália, laboratórium, výskum, pokus","24000000-4 Chemické výrobky; 24300000-7 Základné anorganické a organické chemikálie; 38000000-5 Laboratórne, optické a presné prístroje a vybavenie (s výnimkou skiel); 38437000-7 Laboratórne pipety a príslušenstvo; 60000000-8 Dopravné služby (bez prepravy odpadu)","Tovar; Služba","","https://portal.eks.sk/SpravaKniznice/OpisneFormulareKniznice/VerejnyDetailOpisnehoFormularaKniznice/296299","1","0",
"OF-296304","Po karanténe","holografické nálepky","hologram, nálepka","22459100-3 Reklamné nálepky a pásy; 30192800-9 Samolepiace etikety; 60000000-8 Dopravné služby (bez prepravy odpadu)","Tovar; Služba","","https://portal.eks.sk/SpravaKniznice/OpisneFormulareKniznice/VerejnyDetailOpisnehoFormularaKniznice/296304","0","0",
"OF-296306","Po karanténe","holografické nálepky","hologram, nálepka","22459100-3 Reklamné nálepky a pásy; 30192800-9 Samolepiace etikety; 60000000-8 Dopravné služby (bez prepravy odpadu)","Tovar; Služba","","https://portal.eks.sk/SpravaKniznice/OpisneFormulareKniznice/VerejnyDetailOpisnehoFormularaKniznice/296306","1","372.720",
"OF-296329","Po karanténe","PC ","osobný počítač","30213000-5 Osobné počítače; 60000000-8 Dopravné služby (bez prepravy odpadu)","Tovar; Služba","","https://portal.eks.sk/SpravaKniznice/OpisneFormulareKniznice/VerejnyDetailOpisnehoFormularaKniznice/296329","1","1409.980",
"OF-296338","Po karanténe","Darčekové poukážky pre zamestnancov","Darčeková poukážka, kupón","30199750-2 Poukážky; 98390000-3 Iné služby","Tovar; Služba","","https://portal.eks.sk/SpravaKniznice/OpisneFormulareKniznice/VerejnyDetailOpisnehoFormularaKniznice/296338","1","3347.320",
"OF-296340","Po karanténe","EKS - pH/DO meter ","pH/DO meter, O2 lumitródy,","38416000-4 pH metre; 60000000-8 Dopravné služby (bez prepravy odpadu)","Tovar; Služba","","https://portal.eks.sk/SpravaKniznice/OpisneFormulareKniznice/VerejnyDetailOpisnehoFormularaKniznice/296340","1","0",
"OF-296363","Po karanténe","Stravné poukážky","stravné poukážky, stravovanie zamestnancov","30199770-8 Stravné poukážky; 60000000-8 Dopravné služby (bez prepravy odpadu)","Tovar; Služba","","https://portal.eks.sk/SpravaKniznice/OpisneFormulareKniznice/VerejnyDetailOpisnehoFormularaKniznice/296363","1","3508.250",
"OF-296365","Po karanténe","Cukrovinky","cukrovinky","15842300-5 Cukrovinky; 60000000-8 Dopravné služby (bez prepravy odpadu)","Tovar; Služba","","https://portal.eks.sk/SpravaKniznice/OpisneFormulareKniznice/VerejnyDetailOpisnehoFormularaKniznice/296365","1","4870.830",
"OF-296372","Po karanténe","Dodávka zemného plynu","zemný plyn, distribúcia zemného plynu, preprava plynu","09123000-7 Zemný plyn; 65200000-5 Rozvod plynu a súvisiace služby; 60000000-8 Dopravné služby (bez prepravy odpadu)","Tovar; Služba","","https://portal.eks.sk/SpravaKniznice/OpisneFormulareKniznice/VerejnyDetailOpisnehoFormularaKniznice/296372","1","24962.680",
"OF-296374","Po karanténe","Združená dodávka elektrickej energie","Elektrická energia, distribúcia a dodávka a elektrickej energie","09310000-5 Elektrická energia; 65300000-6 Rozvod elektriny a súvisiace služby","Tovar; Služba","","https://portal.eks.sk/SpravaKniznice/OpisneFormulareKniznice/VerejnyDetailOpisnehoFormularaKniznice/296374","1","23631.710",
"OF-296221","Po karanténe","Klimatizácie","Klimatizácia","42512000-8 Klimatizačné zariadenia; 45331220-4 Inštalovanie klimatizácie; 60000000-8 Dopravné služby (bez prepravy odpadu)","Tovar; Služba","","https://portal.eks.sk/SpravaKniznice/OpisneFormulareKniznice/VerejnyDetailOpisnehoFormularaKniznice/296221","1","19000.000",
"OF-296232","Po karanténe","Šijacie, žehliace stroje a príslušenstvo","šijací stroj","42715000-1 Šijacie stroje; 60000000-8 Dopravné služby (bez prepravy odpadu)","Tovar; Služba","","https://portal.eks.sk/SpravaKniznice/OpisneFormulareKniznice/VerejnyDetailOpisnehoFormularaKniznice/296232","1","696.220",
"OF-296239","Po karanténe","Čistiace a hygienické potreby","Čistiace a hygienické potreby","39831300-9 Čistiace prostriedky na podlahu; 39224300-1 Metly a kefy a iné výrobky na upratovanie domácností; 39542000-3 Handry; 33760000-5 Toaletný papier, vreckovky, uteráky na ruky a servítky; 60000000-8 Dopravné služby (bez prepravy odpadu)","Tovar; Služba","","https://portal.eks.sk/SpravaKniznice/OpisneFormulareKniznice/VerejnyDetailOpisnehoFormularaKniznice/296239","1","1375.000",
"OF-296246","Po karanténe","Hygienické potreby","Kefka zubná, pasta zubná, šampón na vlasy, krém/mydlo na holenie, štetka na holenie, jednorazový holiaci strojček, hrebeň","33700000-7 Predmety osobnej starostlivosti; 33711610-6 Šampóny; 33711710-7 Zubné kefky; 33711720-0 Zubná pasta; 33711800-5 Holiace prípravky; 33721200-2 Holiace strojčeky; 60000000-8 Dopravné služby (bez prepravy odpadu); 33711620-9 Hrebene","Tovar; Služba","","https://portal.eks.sk/SpravaKniznice/OpisneFormulareKniznice/VerejnyDetailOpisnehoFormularaKniznice/296246","1","2625.000",
"OF-296257","Po karanténe","Zváračka fólií, konvektor","Zváračka fólií, fólia, spotrebný materiál","19500000-1 Gumené a plastové materiály; 44174000-0 Fólia; 31600000-2 Elektrické zariadenia a prístroje; 60000000-8 Dopravné služby (bez prepravy odpadu)","Tovar; Služba","","https://portal.eks.sk/SpravaKniznice/OpisneFormulareKniznice/VerejnyDetailOpisnehoFormularaKniznice/296257","0","0",
"OF-296271","Po karanténe","Hnojivá, pesticídy a semená","postrek na mravce a burinu","24453000-4 Herbicídy; 60000000-8 Dopravné služby (bez prepravy odpadu)","Tovar; Služba","","https://portal.eks.sk/SpravaKniznice/OpisneFormulareKniznice/VerejnyDetailOpisnehoFormularaKniznice/296271","1","0",
"OF-296282","Po karanténe","Tonery - originál","Tonery, náplne do tlačiarní","30125120-8 Toner do fotokopírovacích strojov; 60000000-8 Dopravné služby (bez prepravy odpadu)","Tovar; Služba","","https://portal.eks.sk/SpravaKniznice/OpisneFormulareKniznice/VerejnyDetailOpisnehoFormularaKniznice/296282","1","1630.000",
"OF-296289","Po karanténe","PÁSOVÁ PÍLA","píla, kov, obrábací stroj","42630000-1 Kovoobrábacie stroje; 60000000-8 Dopravné služby (bez prepravy odpadu)","Tovar; Služba","","https://portal.eks.sk/SpravaKniznice/OpisneFormulareKniznice/VerejnyDetailOpisnehoFormularaKniznice/296289","1","3208.330",
