"OpisnyFormularIdentifikator","OpisnyFormularStav","OpisnyFormularNazov","OpisnyFormularKlucoveSlova","OpisnyFormularCpv","OpisnyFormularDruh","OpisnyFormularKategoriaSluzieb","OpisnyFormularUrl","OpisnyFormularPocetVyhlasenychZakaziek","OpisnyFormularObchodovanaSumaBezDPH",
"OF-129290","Po karanténe","Nákup nového vozidla Fabia Combi Ambition alebo ekvivalent","osobné motorové vozidlo,  služby pozemnej dopravy, služobné vozidlo","34110000-1 Osobné automobily; 60000000-8 Dopravné služby (bez prepravy odpadu); 34100000-8 Motorové vozidlá","Tovar; Služba","","https://portal.eks.sk/SpravaKniznice/OpisneFormulareKniznice/VerejnyDetailOpisnehoFormularaKniznice/129290","0","0",
"OF-129297","Po karanténe","Podložky a plienky","Podložka pod chorých rozmer 60x60 cm, Podložka pod chorých rozmer 60x90 cm, Jednorázové plienky pre dospelých","33140000-3 Zdravotnícky spotrebný materiál; 60000000-8 Dopravné služby (bez prepravy odpadu)","Tovar; Služba","","https://portal.eks.sk/SpravaKniznice/OpisneFormulareKniznice/VerejnyDetailOpisnehoFormularaKniznice/129297","0","0",
"OF-129308","Po karanténe","Reklamné predmety","liekovka, pero, potlač, taška","39294100-0 Informačné a propagačné výrobky; 60000000-8 Dopravné služby (bez prepravy odpadu)","Tovar; Služba","","https://portal.eks.sk/SpravaKniznice/OpisneFormulareKniznice/VerejnyDetailOpisnehoFormularaKniznice/129308","1","2583,330",
"OF-129315","Po karanténe","Hygienická zdvíhacia stolička s hydraulickým zdvihom - vozík pre invalidov - CALYPSO alebo ekvivalent, Sprchové lehátko/vozík pre imobilných s hydraulickým zdvihom Concerto alebo ekvivalent so zvýšenými postrannicami, Pásový schodolez SA-3 alebo ekvivalent","Pojazdná stolička pre zdvíhanie, transport, sprchovanie a kúpanie, vozík pre invalidov, hygienická stolička, hydraulický zdvih, sprchové lehátko, pásový schodolez","33100000-1 Zdravotnícke vybavenie; 60000000-8 Dopravné služby (bez prepravy odpadu)","Tovar; Služba","","https://portal.eks.sk/SpravaKniznice/OpisneFormulareKniznice/VerejnyDetailOpisnehoFormularaKniznice/129315","0","0",
"OF-129322","Po karanténe","METAMIZOL inj 1000 mg","Analgetiká ","33600000-6 Farmaceutické výrobky; 60000000-8 Dopravné služby (bez prepravy odpadu)","Tovar; Služba","","https://portal.eks.sk/SpravaKniznice/OpisneFormulareKniznice/VerejnyDetailOpisnehoFormularaKniznice/129322","1","6980,000",
"OF-129333","Po karanténe","Rehabilitačné pobyty","kúpeľná starostlivosť, liečenie, kúpele","98332000-9 Kúpeľné služby; 85312500-4 Rehabilitačné služby","Služba","","https://portal.eks.sk/SpravaKniznice/OpisneFormulareKniznice/VerejnyDetailOpisnehoFormularaKniznice/129333","0","0",
"OF-129358","Po karanténe","Hrnček s uchom ","plastový tovar, hrnček plastový","19520000-7 Plastové výrobky; 39221120-4 Šálky a poháre; 60000000-8 Dopravné služby (bez prepravy odpadu)","Tovar; Služba","","https://portal.eks.sk/SpravaKniznice/OpisneFormulareKniznice/VerejnyDetailOpisnehoFormularaKniznice/129358","1","226,670",
"OF-129365","Po karanténe","Pozáručné opravy a údržba osobných motorových vozidiel ","Oprava, údržba, vozidlo Škoda, vozidlo Volkswagen","50112000-3 Oprava a údržba osobných motorových vozidiel","Služba; Tovar","","https://portal.eks.sk/SpravaKniznice/OpisneFormulareKniznice/VerejnyDetailOpisnehoFormularaKniznice/129365","1","0",
"OF-129390","Po karanténe","Plastové výrobky","plast, indikátor, pipeta, serológia","19520000-7 Plastové výrobky; 33100000-1 Zdravotnícke vybavenie; 38437000-7 Laboratórne pipety a príslušenstvo; 60000000-8 Dopravné služby (bez prepravy odpadu)","Tovar; Služba","","https://portal.eks.sk/SpravaKniznice/OpisneFormulareKniznice/VerejnyDetailOpisnehoFormularaKniznice/129390","1","200,000",
"OF-129397","Po karanténe","Elektrospotrebiče","rýchlovarná kanvica, varič","39711440-5 Variče; 60000000-8 Dopravné služby (bez prepravy odpadu); 31600000-2 Elektrické zariadenia a prístroje","Tovar; Služba","","https://portal.eks.sk/SpravaKniznice/OpisneFormulareKniznice/VerejnyDetailOpisnehoFormularaKniznice/129397","1","291,670",
"OF-129408","Po karanténe","Kompostéry a Elektrický kompostér na spracovanie organického odpadu","kompostéry, doprava, elektrický kompostér","39234000-1 Škatule na kompost; 60000000-8 Dopravné služby (bez prepravy odpadu); 77120000-7 Kompostovanie","Tovar; Služba","","https://portal.eks.sk/SpravaKniznice/OpisneFormulareKniznice/VerejnyDetailOpisnehoFormularaKniznice/129408","1","0",
"OF-129433","Po karanténe","Kancelárske potreby","pero, ceruzka, guma, lepidlo, papier, zošívačka, dierovač, fixky, nástenka, spinky, nožnice, etikety, otvárač listov, podložka, nožnice, tlačivá","30192000-1 Kancelárske potreby; 30197000-6 Drobné kancelárske vybavenie; 30199000-0 Papiernický tovar a iné položky; 30140000-2 Počítacie a účtovacie stroje; 30191100-5 Archivačné/registračné zariadenia; 30194500-0 Písacie pomôcky; 30195600-8 Vývesné tabule alebo príslušenstvo; 22800000-8 Papierové alebo lepenkové registre, účtovné knihy, rýchloviazače, formuláre a iné druhy tlačeného papierenského tovaru; 22817000-0 Diáre alebo osobné organizéry; 22850000-3 Rýchloviazače a súvisiace príslušenstvo; 22810000-1 Papierové alebo lepenkové registre; 30193000-8 Organizéry a príslušenstvo; 30194300-8 Rysovacie súpravy, sady a papiere; 30195100-3 Plánovacie tabule alebo príslušenstvo; 30197200-8 Krúžkové viazače a spony na papier; 30197300-9 Otvárače listov, zošívačky a dierovače; 30197100-7 Sponky, cvočky, pripináčiky; 30199200-2 Obálky, neilustrované karty a korešpondenčné lístky; 30199731-3 Vizitkáre; 30199792-8 Kalendáre; 30199230-1 Obálky; 30199600-6 Priehradky na kancelárske potreby; 30199500-5 Škatuľové zaraďovače, listové priehradky, skladovacie škatule a podobné výrobky; 30199700-7 Tlačené výrobky z papiera okrem formulárov","Tovar; Služba","","https://portal.eks.sk/SpravaKniznice/OpisneFormulareKniznice/VerejnyDetailOpisnehoFormularaKniznice/129433","1","12916,670",
"OF-129447","Po karanténe","Operačný stôl","operačný stôl, mobilný operačný stôl","33162100-4 Prístroje operačnej sály; 60000000-8 Dopravné služby (bez prepravy odpadu)","Tovar; Služba","","https://portal.eks.sk/SpravaKniznice/OpisneFormulareKniznice/VerejnyDetailOpisnehoFormularaKniznice/129447","0","0",
"OF-129458","Po karanténe","Originál tonery do tlačiarní a multifunkčných zariadení","originál tonery do tlačiarní, originál tonery na fotokopírovanie, originál tonery na skenovanie, originál tonery na tlač, originál tonery atramentové, originál tonery laserové","30125110-5 Toner do laserových tlačiarní/faxových prístrojov; 30125120-8 Toner do fotokopírovacích strojov; 30125100-2 Tonerové náplne; 30192112-9 Zdroje atramentu pre tlačiarske stroje; 30192113-6 Atramentové náplne; 60000000-8 Dopravné služby (bez prepravy odpadu)","Tovar; Služba","","https://portal.eks.sk/SpravaKniznice/OpisneFormulareKniznice/VerejnyDetailOpisnehoFormularaKniznice/129458","1","819,170",
"OF-129465","Po karanténe","1. Stolný PC ACER TC-780 2. Monitor Philips 243V5QHABA 3. Flash pamäť Kingston Data Traveler SE9 G2 4. USB klávesnica Canyon CNE-CKEY01 5. USB myš Canyon CNE-CMS2","1. Stolný PC 2. Monitor Philips 3. Flash pamäť 4. USB klávesnica 5. USB myš ","30213000-5 Osobné počítače; 30237200-1 Príslušenstvo počítačov; 30231000-7 Počítačové monitory a konzoly; 30237460-1 Počítačové klávesnice; 30237410-6 Počítačová myš; 30234600-4 Flash pamäť; 60000000-8 Dopravné služby (bez prepravy odpadu)","Tovar; Služba","","https://portal.eks.sk/SpravaKniznice/OpisneFormulareKniznice/VerejnyDetailOpisnehoFormularaKniznice/129465","1","1925,000",
"OF-129472","Po karanténe","Plastový kontajner na zber komunálneho odpadu s objemom 120 L","Plastový kontajner 120 L","34928480-6 Kontajnery a nádoby na odpad a odpadky; 60000000-8 Dopravné služby (bez prepravy odpadu)","Tovar; Služba","","https://portal.eks.sk/SpravaKniznice/OpisneFormulareKniznice/VerejnyDetailOpisnehoFormularaKniznice/129472","0","0",
"OF-129483","Po karanténe","Plastový kontajner na separovaný zber odpadu s objemom 240 L","Plastový kontajner 240 L","34928480-6 Kontajnery a nádoby na odpad a odpadky; 60000000-8 Dopravné služby (bez prepravy odpadu)","Tovar; Služba","","https://portal.eks.sk/SpravaKniznice/OpisneFormulareKniznice/VerejnyDetailOpisnehoFormularaKniznice/129483","0","0",
"OF-129490","Po karanténe","Dezinfekčné, hygienické, čistiace prostriedky a potreby na upratovanie","Dezinfekčné prostriedky, čistiace prostriedky, hygienické prostriedky, a potreby na upratovanie, toaletný papier, lopatky na smeti, metly, handry na čistenie, osviežovače vzduchu.","39831300-9 Čistiace prostriedky na podlahu; 60000000-8 Dopravné služby (bez prepravy odpadu); 39831600-2 Čistiace prostriedky na toalety; 39224310-4 WC kefy; 39525800-6 Handry na čistenie; 39811100-1 Osviežovač vzduchu; 39224100-9 Metly; 33761000-2 Toaletný papier; 39224350-6 Lopatky na smeti; 24455000-8 Dezinfekčné prostriedky; 33711900-6 Mydlo","Tovar; Služba","","https://portal.eks.sk/SpravaKniznice/OpisneFormulareKniznice/VerejnyDetailOpisnehoFormularaKniznice/129490","1","1239,170",
"OF-129508","Po karanténe","Zabezpečenie leteckých prepravných služieb","letecké dopravné služby, letecké prepravné služby, letenky","60400000-2 Letecké dopravné služby; 63512000-1 Služby na predaj cestovných lístkov a turistických zájazdov","Služba","","https://portal.eks.sk/SpravaKniznice/OpisneFormulareKniznice/VerejnyDetailOpisnehoFormularaKniznice/129508","1","47369,000",
"OF-129515","Po karanténe","Osobné ochranné pracovné prostriedky ","kabát, špeciálny oblek, plášť, spodné prádlo, rukavice, čiapka, čižmy, obuv, respirátor, chránič sluchu,  prací prášok, uterák, repelentný sprey, krém, zástera, tričko, nohavice - osobné ochranné pracovné prostriedky  ","35113400-3 Ochranné a bezpečnostné odevy; 18830000-6 Ochranná obuv; 35113450-8 Ochranné kabáty alebo plášte; 33735100-2 Ochranné okuliare; 18444000-3 Ochranné pokrývky hlavy; 18143000-3 Ochranný výstroj; 35113490-0 Ochranný plášť; 33711510-5 Výrobky na ochranu pred slnkom; 18110000-3 Pracovné odevy; 18141000-9 Pracovné rukavice; 18221100-5 Nepremokavé pláštenky; 18318400-5 Tielka; 18331000-8 Tričká s krátkym rukávom; 18811000-7 Nepremokavá obuv; 18812000-4 Obuv s časťami z gumy alebo plastov; 18812200-6 Gumové čižmy; 18813000-1 Obuv s koženým zvrškom; 39514100-9 Uteráky; 33700000-7 Predmety osobnej starostlivosti; 18100000-0 Pracovné odevy, špeciálne pracovné odevy a doplnky; 60000000-8 Dopravné služby (bez prepravy odpadu)","Tovar; Služba","","https://portal.eks.sk/SpravaKniznice/OpisneFormulareKniznice/VerejnyDetailOpisnehoFormularaKniznice/129515","1","1739,000",
"OF-129540","Po karanténe","Sempercare Vinyl nepuder","rukavice , nepuder, polyvinylclorid, vysetrovacie, nesterilne","33141420-0 Chirurgické rukavice","Tovar; Služba","","https://portal.eks.sk/SpravaKniznice/OpisneFormulareKniznice/VerejnyDetailOpisnehoFormularaKniznice/129540","0","0",
"OF-129547","Po karanténe","Mobilné telefóny","Mobilné telefóny","32250000-0 Mobilné telefóny; 60000000-8 Dopravné služby (bez prepravy odpadu)","Tovar; Služba","","https://portal.eks.sk/SpravaKniznice/OpisneFormulareKniznice/VerejnyDetailOpisnehoFormularaKniznice/129547","1","825,000",
"OF-129558","Po karanténe","Ihly lekárske spinálne-pomôcky pre anestéziu","spinálna ihla, regionálna anestézia, Quincke, lumbálna punkcia, epidurálny set, periférne blokády","33000000-0 Zdravotnícke vybavenie, farmaceutický materiál a výrobky osobnej starostlivosti; 33140000-3 Zdravotnícky spotrebný materiál; 33170000-2 Anestézia a resuscitácia; 33141321-6 Ihly na anestéziu; 60000000-8 Dopravné služby (bez prepravy odpadu)","Tovar; Služba","","https://portal.eks.sk/SpravaKniznice/OpisneFormulareKniznice/VerejnyDetailOpisnehoFormularaKniznice/129558","1","10485,000",
"OF-129375","Po karanténe","Náhradné diely, oleje a mazacie tuky na motorové píly, krovinorezy a vyvetvovače konárov","krovinorezy, motorové píly, vyvetvovače konárov, náhradné diely, oleje a mazivá","42675100-9 Časti reťazových píl; 34913000-0 Rôzne náhradné diely; 09211000-1 Mazacie oleje a mazivá; 60000000-8 Dopravné služby (bez prepravy odpadu)","Tovar; Služba","","https://portal.eks.sk/SpravaKniznice/OpisneFormulareKniznice/VerejnyDetailOpisnehoFormularaKniznice/129375","1","2916,670",
"OF-129380","Po karanténe","Drobný inventár - vybavenie prevádzok kuchýň","tanier, doska, pohár, pokrievka, strúhadlo, hrniec, podnos","39221100-8 Kuchynské potreby; 39221200-9 Jedálenské potreby; 39221210-2 Taniere; 60000000-8 Dopravné služby (bez prepravy odpadu)","Tovar; Služba","","https://portal.eks.sk/SpravaKniznice/OpisneFormulareKniznice/VerejnyDetailOpisnehoFormularaKniznice/129380","0","0",
"OF-129382","Po karanténe","Spiatočná letenka Viedeň-Brusel-Viedeň","spiatočné letenky, letenky, letecká doprava","60410000-5 Pravidelné letecké dopravné služby","Služba","","https://portal.eks.sk/SpravaKniznice/OpisneFormulareKniznice/VerejnyDetailOpisnehoFormularaKniznice/129382","0","0",
"OF-129414","Po karanténe","Ortopedicko-traumatologický systém","Batériový motorový systém","33183000-6 Ortopedické podporné prístroje; 60000000-8 Dopravné služby (bez prepravy odpadu)","Tovar","","https://portal.eks.sk/SpravaKniznice/OpisneFormulareKniznice/VerejnyDetailOpisnehoFormularaKniznice/129414","0","0",
"OF-129416","Po karanténe","Obchodno-reklamný materiál","reklama, potlač, tričko","22460000-2 Obchodno-reklamný materiál, komerčné katalógy a príručky; 60000000-8 Dopravné služby (bez prepravy odpadu)","Tovar; Služba","","https://portal.eks.sk/SpravaKniznice/OpisneFormulareKniznice/VerejnyDetailOpisnehoFormularaKniznice/129416","1","0",
"OF-129441","Po karanténe","Predĺženie záruky na hardware","záruka, carepack, server, diskové pole","72611000-6 Technické počítačové podporné služby; 60000000-8 Dopravné služby (bez prepravy odpadu)","Služba","","https://portal.eks.sk/SpravaKniznice/OpisneFormulareKniznice/VerejnyDetailOpisnehoFormularaKniznice/129441","0","0",
"OF-129448","Po karanténe","Drôt plombovací"," Plombovací drôt oceľový s priemerom 1,1 mm","44333000-3 Drôty; 60000000-8 Dopravné služby (bez prepravy odpadu)","Tovar; Služba","","https://portal.eks.sk/SpravaKniznice/OpisneFormulareKniznice/VerejnyDetailOpisnehoFormularaKniznice/129448","1","0",
"OF-129450","Po karanténe","Pranie a chemické čistenie nemocničnej bielizne","pranie, chemické čistenie, bielizeň, prádlo","98310000-9 Pranie a chemické čistenie; 60000000-8 Dopravné služby (bez prepravy odpadu)","Služba","","https://portal.eks.sk/SpravaKniznice/OpisneFormulareKniznice/VerejnyDetailOpisnehoFormularaKniznice/129450","0","0",
"OF-129473","Po karanténe","Televízory","televízne prijímače","32324000-0 Televízory; 60000000-8 Dopravné služby (bez prepravy odpadu)","Tovar; Služba","","https://portal.eks.sk/SpravaKniznice/OpisneFormulareKniznice/VerejnyDetailOpisnehoFormularaKniznice/129473","2","616,670",
"OF-129475","Po karanténe","Plastový kontajner na separovaný zber odpadu s objemom 120 L","Plastový kontajner 120 L","34928480-6 Kontajnery a nádoby na odpad a odpadky; 60000000-8 Dopravné služby (bez prepravy odpadu)","Tovar; Služba","","https://portal.eks.sk/SpravaKniznice/OpisneFormulareKniznice/VerejnyDetailOpisnehoFormularaKniznice/129475","0","0",
"OF-129480","Po karanténe","Grafická úprava (zalamovanie), tlač a distribúcia mesačníka Nitrianskeho samosprávneho kraja ","grafická úprava, tlačiarenské služby, doručovacie služby, tlač, mesačník, noviny, doručovanie","79810000-5 Tlačiarenské služby; 79920000-9 Balenie a súvisiace služby; 60000000-8 Dopravné služby (bez prepravy odpadu)","Služba","","https://portal.eks.sk/SpravaKniznice/OpisneFormulareKniznice/VerejnyDetailOpisnehoFormularaKniznice/129480","1","70833,330",
"OF-129484","Po karanténe","Tonery do laserových tlačiarni, atramentové náplne","Toner do laserových tlačiarní , atramentová náplň","30125110-5 Toner do laserových tlačiarní/faxových prístrojov; 90510000-5 Likvidácia a spracovanie odpadu; 60000000-8 Dopravné služby (bez prepravy odpadu); 30192113-6 Atramentové náplne","Tovar; Služba","","https://portal.eks.sk/SpravaKniznice/OpisneFormulareKniznice/VerejnyDetailOpisnehoFormularaKniznice/129484","0","0",
"OF-129505","Po karanténe","Dotlač propagačnej brožúrky k projektu","tlač, tlačiarenská služba, výroba tlače, publikácia","79800000-2 Tlačiarenské a príbuzné služby; 79810000-5 Tlačiarenské služby; 60000000-8 Dopravné služby (bez prepravy odpadu)","Služba; Tovar","","https://portal.eks.sk/SpravaKniznice/OpisneFormulareKniznice/VerejnyDetailOpisnehoFormularaKniznice/129505","1","340,000",
"OF-129507","Po karanténe","Záznamový monitor srdcovej činnosti","monitor srdcovej činnosti","33123210-3 Prístroje na monitorovanie srdca; 60000000-8 Dopravné služby (bez prepravy odpadu)","Tovar; Služba","","https://portal.eks.sk/SpravaKniznice/OpisneFormulareKniznice/VerejnyDetailOpisnehoFormularaKniznice/129507","1","17927,270",
"OF-129509","Po karanténe","Handry","handry, hubky","39542000-3 Handry; 39525800-6 Handry na čistenie; 39525810-9 Handry na leštenie; 60000000-8 Dopravné služby (bez prepravy odpadu)","Tovar; Služba","","https://portal.eks.sk/SpravaKniznice/OpisneFormulareKniznice/VerejnyDetailOpisnehoFormularaKniznice/129509","1","387,490",
"OF-129514","Po karanténe","Letné pneumatiky na SUV vozidlo - nové ","letné pneumatiky na SUV vozidlo","34351100-3 Pneumatiky pre motorové vozidlá; 60000000-8 Dopravné služby (bez prepravy odpadu)","Tovar; Služba","","https://portal.eks.sk/SpravaKniznice/OpisneFormulareKniznice/VerejnyDetailOpisnehoFormularaKniznice/129514","1","215,000",
"OF-129516","Po karanténe","Upratovacie služby","upratovacie služby","90900000-6 Čistiace a sanitárne služby; 90910000-9 Upratovacie služby; 90911300-9 Umývanie okien","Služba","","https://portal.eks.sk/SpravaKniznice/OpisneFormulareKniznice/VerejnyDetailOpisnehoFormularaKniznice/129516","0","0",
"OF-129541","Po karanténe","Počítačová  technika","osobný počítač, monitor, výpočtová technika","30213000-5 Osobné počítače; 30231000-7 Počítačové monitory a konzoly; 60000000-8 Dopravné služby (bez prepravy odpadu)","Tovar; Služba","","https://portal.eks.sk/SpravaKniznice/OpisneFormulareKniznice/VerejnyDetailOpisnehoFormularaKniznice/129541","1","3729,170",
"OF-128641","Po karanténe","opravy traktora","opravy traktora","50110000-9 Opravy a údržbárske služby pre motorové vozidlá a súvisiace vybavenie","Služba","","https://portal.eks.sk/SpravaKniznice/OpisneFormulareKniznice/VerejnyDetailOpisnehoFormularaKniznice/128641","0","0",
"OF-128659","Po karanténe","Čistiace a dezinfekčné prostriedky","čistiace prostriedky a pomôcky, dezinfekčné prostriedky a pomôcky, pracie prostriedky, upratovacie prostriedky a pomôcky","33741100-7 Čistiace prostriedky na ruky; 39830000-9 Čistiace výrobky; 39831600-2 Čistiace prostriedky na toalety; 39832000-3 Čistiace prostriedky na riad; 24455000-8 Dezinfekčné prostriedky; 33741300-9 Dezinfekčné prostriedky na ruky; 39831000-6 Pracie prostriedky; 39831200-8 Saponáty; 33741000-6 Výrobky na starostlivosť o ruky; 33711610-6 Šampóny; 33711800-5 Holiace prípravky; 33711900-6 Mydlo; 39224000-8 Metly a kefy a iné predmety rôznych typov; 39224330-0 Vedrá; 39525800-6 Handry na čistenie; 60000000-8 Dopravné služby (bez prepravy odpadu)","Tovar; Služba","","https://portal.eks.sk/SpravaKniznice/OpisneFormulareKniznice/VerejnyDetailOpisnehoFormularaKniznice/128659","1","29290,000",
"OF-128660","Po karanténe","Syntéza primerov","chemikália","24300000-7 Základné anorganické a organické chemikálie; 60000000-8 Dopravné služby (bez prepravy odpadu)","Tovar; Služba","","https://portal.eks.sk/SpravaKniznice/OpisneFormulareKniznice/VerejnyDetailOpisnehoFormularaKniznice/128660","1","0",
"OF-128674","Po karanténe","pozáručný servis vnútorných a vonkajších klimatizačných jednotiek ","servis klimatizácií","50730000-1 Opravy a údržba chladiacich zostáv; 60000000-8 Dopravné služby (bez prepravy odpadu)","Služba","","https://portal.eks.sk/SpravaKniznice/OpisneFormulareKniznice/VerejnyDetailOpisnehoFormularaKniznice/128674","1","1065,830",
"OF-128677","Po karanténe","Rozšírenie a modernizácia monitorovacieho kamerového systému 1/2017","Kamery, kamerový systém, dodávka a montáž bezpečnostného kamerového systému , bezpečnosť, diskové pole, monitor, PC","35125300-2 Bezpečnostné kamery; 35125000-6 Systémy ostrahy/dohľadu; 45315100-9 Elektrotechnické inštalačné práce; 31230000-7 Časti rozvodu elektriny alebo regulačných prístrojov; 60000000-8 Dopravné služby (bez prepravy odpadu); 72250000-2 Služby týkajúce sa podpory systému; 30213300-8 Stolový počítač; 51611000-8 Inštalácia počítačov; 30237000-9 Časti a príslušenstvo počítačov a spotrebný materiál k nim; 30231000-7 Počítačové monitory a konzoly; 72265000-0 Konfigurovanie softvéru; 72268000-1 Dodávky softvéru","Tovar; Služba; Stavebná práca","","https://portal.eks.sk/SpravaKniznice/OpisneFormulareKniznice/VerejnyDetailOpisnehoFormularaKniznice/128677","1","0",
"OF-128691","Po karanténe","Kamenná soľ","kamenná soľ, zver, ","14410000-8 Kamenná soľ; 60000000-8 Dopravné služby (bez prepravy odpadu)","Tovar; Služba","","https://portal.eks.sk/SpravaKniznice/OpisneFormulareKniznice/VerejnyDetailOpisnehoFormularaKniznice/128691","1","510,000",
"OF-128692","Po karanténe","Hydraulický olej - Texaco Rando HD 10","olej","09211600-7 Oleje na použitie v hydraulických systémoch a na iné účely; 60000000-8 Dopravné služby (bez prepravy odpadu)","Tovar; Služba","","https://portal.eks.sk/SpravaKniznice/OpisneFormulareKniznice/VerejnyDetailOpisnehoFormularaKniznice/128692","1","266,670",
"OF-128709","Po karanténe","Antigrafity náter, odstraňovač grafitových náterov","Antigrafity náter, odstraňovač grafitových náterov","44800000-8 Náterové farby, laky a tmely; 44810000-1 Náterové farby; 60000000-8 Dopravné služby (bez prepravy odpadu); 24200000-6 Farby a pigmenty","Tovar; Služba","","https://portal.eks.sk/SpravaKniznice/OpisneFormulareKniznice/VerejnyDetailOpisnehoFormularaKniznice/128709","1","690,000",
"OF-97375","Po karanténe","sanitka RLP","sanitka, RLP","34114121-3 Sanitky; 60000000-8 Dopravné služby (bez prepravy odpadu)","Tovar; Služba","","https://portal.eks.sk/SpravaKniznice/OpisneFormulareKniznice/VerejnyDetailOpisnehoFormularaKniznice/97375","1","0",
"OF-128724","Po karanténe","Letenka spiatočná","letenka","60400000-2 Letecké dopravné služby","Služba","","https://portal.eks.sk/SpravaKniznice/OpisneFormulareKniznice/VerejnyDetailOpisnehoFormularaKniznice/128724","1","0",
"OF-128727","Po karanténe","Laboratórny materiál z plastov a gumy - špičky","špičky","33140000-3 Zdravotnícky spotrebný materiál; 19520000-7 Plastové výrobky; 60000000-8 Dopravné služby (bez prepravy odpadu)","Tovar; Služba","","https://portal.eks.sk/SpravaKniznice/OpisneFormulareKniznice/VerejnyDetailOpisnehoFormularaKniznice/128727","1","135,000",
"OF-128741","Po karanténe","Neutrálne elektródy","jednorazové, neutrálne elektródy, s káblom, uzemnenie pacienta","33161000-6 Elektrochirurgické jednotky; 60000000-8 Dopravné služby (bez prepravy odpadu)","Tovar; Služba","","https://portal.eks.sk/SpravaKniznice/OpisneFormulareKniznice/VerejnyDetailOpisnehoFormularaKniznice/128741","1","4793,950",
"OF-128742","Po karanténe","Nádoby a kontajnery na komunálny a separovaný zber","plastový kontajner, plastová nádoba na odpad, separovaný zber","34928480-6 Kontajnery a nádoby na odpad a odpadky; 60000000-8 Dopravné služby (bez prepravy odpadu)","Tovar; Služba","","https://portal.eks.sk/SpravaKniznice/OpisneFormulareKniznice/VerejnyDetailOpisnehoFormularaKniznice/128742","1","110900,000",
"OF-128760","Po karanténe","Notebook Dell Inspiron 15 (7000)","Osobné počítače, notebook, počítač bez monitora, komponenty integrované v počítači","30213000-5 Osobné počítače; 30213100-6 Prenosné počítače; 60000000-8 Dopravné služby (bez prepravy odpadu)","Tovar; Služba","","https://portal.eks.sk/SpravaKniznice/OpisneFormulareKniznice/VerejnyDetailOpisnehoFormularaKniznice/128760","1","1055,760",
"OF-128774","Po karanténe","Letenky:Košice-Frankfurt nad Mohánom a späť","spiatočné letenky","60400000-2 Letecké dopravné služby","Služba","","https://portal.eks.sk/SpravaKniznice/OpisneFormulareKniznice/VerejnyDetailOpisnehoFormularaKniznice/128774","1","365,000",
"OF-128791","Po karanténe","stravné lístky","stravné lístky","55520000-1 Služby hromadného stravovania; 60000000-8 Dopravné služby (bez prepravy odpadu)","Služba","","https://portal.eks.sk/SpravaKniznice/OpisneFormulareKniznice/VerejnyDetailOpisnehoFormularaKniznice/128791","0","0",
"OF-128809","Po karanténe","Univerzálny kuchynský robot pre zariadenie hromadného stravovania","kuchynský robot, šľahací stroj, hnetací stroj, strúhač, krájač","39312000-2 Zariadenia na prípravu jedál; 60000000-8 Dopravné služby (bez prepravy odpadu)","Tovar; Služba","","https://portal.eks.sk/SpravaKniznice/OpisneFormulareKniznice/VerejnyDetailOpisnehoFormularaKniznice/128809","1","5158,330",
