"OpisnyFormularIdentifikator","OpisnyFormularStav","OpisnyFormularNazov","OpisnyFormularKlucoveSlova","OpisnyFormularCpv","OpisnyFormularDruh","OpisnyFormularKategoriaSluzieb","OpisnyFormularUrl","OpisnyFormularPocetVyhlasenychZakaziek","OpisnyFormularObchodovanaSumaBezDPH",
"OF-263476","Po karanténe","Rozhlasové a televízne prijímače a príslušenstvo","televízor, držiak","32324100-1 Farebné televízory; 32224000-9 Prístroj na televízne vysielanie; 32000000-3 Rozhlas, televízia, komunikácie, telekomunikácie a príbuzné zariadenia; 32344280-2 Prenosné rozhlasové prijímače; 32310000-9 Rozhlasové prijímače; 60000000-8 Dopravné služby (bez prepravy odpadu)","Tovar; Služba","","https://portal.eks.sk/SpravaKniznice/OpisneFormulareKniznice/VerejnyDetailOpisnehoFormularaKniznice/263476","1","2166,670",
"OF-263851","Po karanténe","Originálne tonery/zobrazovací valec","originál toner, valec, HP","30125000-1 Časti a príslušenstvo fotokopírovacích prístrojov; 30125120-8 Toner do fotokopírovacích strojov; 30125100-2 Tonerové náplne; 60000000-8 Dopravné služby (bez prepravy odpadu)","Tovar; Služba","","https://portal.eks.sk/SpravaKniznice/OpisneFormulareKniznice/VerejnyDetailOpisnehoFormularaKniznice/263851","1","0",
"OF-262529","Po karanténe","Enterálna a parenterálna výživa","Potravina na špeciálne lekárske účely, enterálna výživa, parenterálna výživa","33692300-0 Enterálna výživa; 33692200-9 Produkty parenterálnej výživy; 60000000-8 Dopravné služby (bez prepravy odpadu)","Tovar; Služba","","https://portal.eks.sk/SpravaKniznice/OpisneFormulareKniznice/VerejnyDetailOpisnehoFormularaKniznice/262529","1","0",
"OF-263422","Po karanténe","Náhradné diely do PC","káble, disky, PC,","30237100-0 Časti počítačov; 30237000-9 Časti a príslušenstvo počítačov a spotrebný materiál k nim; 60000000-8 Dopravné služby (bez prepravy odpadu)","Tovar; Služba","","https://portal.eks.sk/SpravaKniznice/OpisneFormulareKniznice/VerejnyDetailOpisnehoFormularaKniznice/263422","1","1324,170",
"OF-263651","Po karanténe","Kalibrácia meradiel technických a tepelných veličín","Kalibrácie, meradlá, tepelné veličiny, technické veličiny","50433000-9 Kalibrovanie","Služba","","https://portal.eks.sk/SpravaKniznice/OpisneFormulareKniznice/VerejnyDetailOpisnehoFormularaKniznice/263651","1","0",
"OF-262572","Po karanténe","Insígnie - rukávový znak Veliteľstvo vojenského zdravotníctva","insígnia, rukávový znak","39561133-3 Insígnie; 60000000-8 Dopravné služby (bez prepravy odpadu); 98393000-4 Krajčírske služby; 39561000-2 Tyl, krajka, stuhy, lemovky a výšivky","Tovar; Služba","","https://portal.eks.sk/SpravaKniznice/OpisneFormulareKniznice/VerejnyDetailOpisnehoFormularaKniznice/262572","1","1333,320",
"OF-262947","Po karanténe","Samolepiace obálky bez potlače","Samolepiace listové obálky","30199230-1 Obálky; 60000000-8 Dopravné služby (bez prepravy odpadu)","Tovar; Služba","","https://portal.eks.sk/SpravaKniznice/OpisneFormulareKniznice/VerejnyDetailOpisnehoFormularaKniznice/262947","1","329,170",
"OF-262904","Po karanténe","Kovové tyče, plechy, fólie a profily","Kovové tyče, plechy, fólie a profily","44330000-2 Tyče, prúty, drôty a profily používané v stavebníctve; 44331000-9 Tyče; 44333000-3 Drôty; 44112120-5 Profilové diely; 44170000-2 Dosky, plechy, pásy a fólie súvisiace so stavebnými materiálmi; 44172000-6 Plechy (stavebné); 60000000-8 Dopravné služby (bez prepravy odpadu)","Tovar; Služba","","https://portal.eks.sk/SpravaKniznice/OpisneFormulareKniznice/VerejnyDetailOpisnehoFormularaKniznice/262904","1","7657,500",
"OF-263090","Po karanténe","Umývanie osobných motorových vozidiel","Umývanie osobných motorových vozidiel","50112300-6 Umývanie osobných motorových vozidiel a podobné služby; 60000000-8 Dopravné služby (bez prepravy odpadu)","Služba","","https://portal.eks.sk/SpravaKniznice/OpisneFormulareKniznice/VerejnyDetailOpisnehoFormularaKniznice/263090","1","833,250",
"OF-264018","Po karanténe","Okná, dvere a príslušenstvo","Žalúzie","39515430-8 Vodorovné žalúzie; 39515440-1 Zvislé žalúzie; 45421145-2 Montáž žalúzií; 44221000-5 Okná, dvere a súvisiace prvky; 60000000-8 Dopravné služby (bez prepravy odpadu)","Tovar; Služba","","https://portal.eks.sk/SpravaKniznice/OpisneFormulareKniznice/VerejnyDetailOpisnehoFormularaKniznice/264018","1","0",
"OF-263314","Po karanténe","Stavebný materiál","flexibilné lepidlo, sádrová stierka","44190000-8 Rôzne stavebné materiály; 44111000-1 Stavebné materiály; 60000000-8 Dopravné služby (bez prepravy odpadu)","Tovar; Služba","","https://portal.eks.sk/SpravaKniznice/OpisneFormulareKniznice/VerejnyDetailOpisnehoFormularaKniznice/263314","1","9916,670",
"OF-262773","Po karanténe","Nákup videoprojektorov","dataprojektor, videoprojektor","32323000-3 Videomonitory; 32323400-7 Prehrávacie videoprístroje; 32321200-1 Audiovizuálne zariadenia; 60000000-8 Dopravné služby (bez prepravy odpadu)","Tovar; Služba","","https://portal.eks.sk/SpravaKniznice/OpisneFormulareKniznice/VerejnyDetailOpisnehoFormularaKniznice/262773","1","3120,970",
"OF-263248","Po karanténe","Tabuľka reflexná na vozidlo","reflexná tabuľka","44423400-5 Značky a súvisiace prvky; 60000000-8 Dopravné služby (bez prepravy odpadu)","Tovar; Služba","","https://portal.eks.sk/SpravaKniznice/OpisneFormulareKniznice/VerejnyDetailOpisnehoFormularaKniznice/263248","1","0",
"OF-262916","Po karanténe","Poukážky určené na zabezpečenie regenerácie pracovnej sily zamestnancov","poukážka, regenerácia pracovnej sily","30199750-2 Poukážky; 60100000-9 Služby cestnej dopravy","Tovar; Služba","","https://portal.eks.sk/SpravaKniznice/OpisneFormulareKniznice/VerejnyDetailOpisnehoFormularaKniznice/262916","1","28615,690",
"OF-262873","Po karanténe","Zariadenia na chladenie, mrazenie a príslušenstvo ","Chladiaca skriňa 610 l., Chladnička kombinovaná, Chladiaca skriňa 1300 l","39700000-9 Spotrebiče pre domácnosť; 39711130-9 Chladničky; 60000000-8 Dopravné služby (bez prepravy odpadu)","Tovar; Služba","","https://portal.eks.sk/SpravaKniznice/OpisneFormulareKniznice/VerejnyDetailOpisnehoFormularaKniznice/262873","1","3265,000",
"OF-262478","Po karanténe","Tonery","Náplne, tonery.","30125100-2 Tonerové náplne; 60000000-8 Dopravné služby (bez prepravy odpadu)","Tovar; Služba","","https://portal.eks.sk/SpravaKniznice/OpisneFormulareKniznice/VerejnyDetailOpisnehoFormularaKniznice/262478","1","825,010",
"OF-263643","Po karanténe","Prenosný počítač","Prenosný počítač-Notebook","30213100-6 Prenosné počítače; 60000000-8 Dopravné služby (bez prepravy odpadu)","Tovar; Služba","","https://portal.eks.sk/SpravaKniznice/OpisneFormulareKniznice/VerejnyDetailOpisnehoFormularaKniznice/263643","1","660,830",
"OF-262169","Po karanténe","Síran sodný bezvodý","chemikálie, síran sodný bezvodý","24300000-7 Základné anorganické a organické chemikálie; 60000000-8 Dopravné služby (bez prepravy odpadu)","Tovar; Služba","","https://portal.eks.sk/SpravaKniznice/OpisneFormulareKniznice/VerejnyDetailOpisnehoFormularaKniznice/262169","1","642,000",
"OF-263105","Po karanténe","Spútavacie retiazky, model 9930 alebo ekvivalent","spútavacie retiazky, putá kovové s poistkou, spútavacie prostriedky,","35230000-5 Putá; 35200000-6 Policajný výstroj; 60000000-8 Dopravné služby (bez prepravy odpadu)","Tovar; Služba","","https://portal.eks.sk/SpravaKniznice/OpisneFormulareKniznice/VerejnyDetailOpisnehoFormularaKniznice/263105","1","11999,000",
"OF-262982","Po karanténe","Značky a súvisiace prvky","piktogramy","44423400-5 Značky a súvisiace prvky; 34928470-3 Značenie; 60000000-8 Dopravné služby (bez prepravy odpadu)","Tovar","","https://portal.eks.sk/SpravaKniznice/OpisneFormulareKniznice/VerejnyDetailOpisnehoFormularaKniznice/262982","1","200,000",
"OF-264041","Po karanténe","Vybavenie stravovacích zariadení","vybavenie stravovacích zariadení, termoizolačná nádoba s výpustom","39222000-4 Potreby pre verejné stravovanie; 60000000-8 Dopravné služby (bez prepravy odpadu)","Tovar; Služba","","https://portal.eks.sk/SpravaKniznice/OpisneFormulareKniznice/VerejnyDetailOpisnehoFormularaKniznice/264041","1","0",
"OF-262939","Po karanténe","Kompatibilný optický valec Xerox","valec, spotrebný materiál","30125120-8 Toner do fotokopírovacích strojov; 60000000-8 Dopravné služby (bez prepravy odpadu)","Tovar; Služba","","https://portal.eks.sk/SpravaKniznice/OpisneFormulareKniznice/VerejnyDetailOpisnehoFormularaKniznice/262939","1","48,000",
"OF-263809","Po karanténe","Pohovka","pohovka, nábytok","39150000-8 Rôzny nábytok a vybavenie; 60000000-8 Dopravné služby (bez prepravy odpadu)","Tovar; Služba","","https://portal.eks.sk/SpravaKniznice/OpisneFormulareKniznice/VerejnyDetailOpisnehoFormularaKniznice/263809","1","0",
"OF-263918","Po karanténe","Pevný 3,5"" disk  pre NAS - WD Red PRO Int. Disk 14 TB 3,5""","Pevný 3,5"" disk  pre NAS - WD Red PRO Int. Disk 14 TB 3,5""","30234000-8 Pamäťové médiá; 60000000-8 Dopravné služby (bez prepravy odpadu)","Tovar; Služba","","https://portal.eks.sk/SpravaKniznice/OpisneFormulareKniznice/VerejnyDetailOpisnehoFormularaKniznice/263918","1","1325,000",
"OF-264184","Po karanténe","LiDAR s príslušenstvom, počítačové vybavenie","LiDAR, príslušenstvo k LiDARu, počítačové vybavenie","38300000-8 Meracie prístroje; 30236000-2 Rôzne počítačové vybavenie; 60000000-8 Dopravné služby (bez prepravy odpadu)","Tovar; Služba","","https://portal.eks.sk/SpravaKniznice/OpisneFormulareKniznice/VerejnyDetailOpisnehoFormularaKniznice/264184","1","0",
"OF-263709","Po karanténe","Prietokový cytometer CytoFLEX alebo ekvivalent","prietokový cytometer, bunka, svetlo, laboratórium","38430000-8 Prístroje na detekciu a rozbory; 60000000-8 Dopravné služby (bez prepravy odpadu)","Tovar; Služba","","https://portal.eks.sk/SpravaKniznice/OpisneFormulareKniznice/VerejnyDetailOpisnehoFormularaKniznice/263709","1","0",
"OF-262312","Po karanténe","Železiarske výrobky a brusivá","brúsny kotúč, rezný kotúč, oceľová kefa, viazací drôt","14811300-2 Brúsne kotúče; 39224200-0 Kefy; 44310000-6 Drôtené výrobky; 44333000-3 Drôty; 60000000-8 Dopravné služby (bez prepravy odpadu)","Tovar; Služba","","https://portal.eks.sk/SpravaKniznice/OpisneFormulareKniznice/VerejnyDetailOpisnehoFormularaKniznice/262312","1","309,000",
"OF-262816","Po karanténe","Pamätná plaketa","Plaketa, pamätná plaketa","22462000-6 Propagačný materiál; 39294100-0 Informačné a propagačné výrobky; 60000000-8 Dopravné služby (bez prepravy odpadu)","Tovar; Služba","","https://portal.eks.sk/SpravaKniznice/OpisneFormulareKniznice/VerejnyDetailOpisnehoFormularaKniznice/262816","1","460,000",
"OF-262378","Po karanténe","15 ks elektricky polohovateľná posteľ s hrazdou, hrazdičkou a antidekubitným matracom","Posteľ, polohovateľná, hrazda, hrazdička, matrac, antidekubitný","33192130-2 Motorizované lôžka; 39143112-4 Matrace; 60000000-8 Dopravné služby (bez prepravy odpadu)","Tovar; Služba","","https://portal.eks.sk/SpravaKniznice/OpisneFormulareKniznice/VerejnyDetailOpisnehoFormularaKniznice/262378","1","10185,000",
"OF-262809","Po karanténe","Objemové stavebné materiály ","piesok kremičitý na pieskovanie","44111000-1 Stavebné materiály; 60000000-8 Dopravné služby (bez prepravy odpadu)","Tovar; Služba","","https://portal.eks.sk/SpravaKniznice/OpisneFormulareKniznice/VerejnyDetailOpisnehoFormularaKniznice/262809","1","0",
"OF-263828","Po karanténe","kancelársky LCD monitor 27"" HP X27 FHD ","kancelársky LCD monitor 27"" HP X27 FHD","30231000-7 Počítačové monitory a konzoly; 60000000-8 Dopravné služby (bez prepravy odpadu)","Tovar; Služba","","https://portal.eks.sk/SpravaKniznice/OpisneFormulareKniznice/VerejnyDetailOpisnehoFormularaKniznice/263828","1","660,000",
"OF-262792","Po karanténe","Kovové tyče, plechy, fólie a profily","plech, odkvap, zvody, rúra, profil, joklovina","44172000-6 Plechy (stavebné); 44334000-0 Profily; 60000000-8 Dopravné služby (bez prepravy odpadu); 44112400-2 Strecha; 44330000-2 Tyče, prúty, drôty a profily používané v stavebníctve","Tovar; Služba","","https://portal.eks.sk/SpravaKniznice/OpisneFormulareKniznice/VerejnyDetailOpisnehoFormularaKniznice/262792","1","1661,000",
"OF-263645","Po karanténe","Filtre","olejový, palivový, vzduchový","32352100-6 Časti rádiového a radarového zariadenia; 42514310-8 Vzduchové filtre; 42913300-2 Olejové filtre; 60000000-8 Dopravné služby (bez prepravy odpadu); 31161000-2 Časti elektromotorov a generátorov","Tovar; Služba","","https://portal.eks.sk/SpravaKniznice/OpisneFormulareKniznice/VerejnyDetailOpisnehoFormularaKniznice/263645","1","0",
"OF-263227","Po karanténe","Potreby pre stravovanie na jedno použitie ","miska, viečko, menu box, vanička","39222000-4 Potreby pre verejné stravovanie; 39222100-5 Potreby pre verejné stravovanie na jedno použitie; 60000000-8 Dopravné služby (bez prepravy odpadu)","Tovar; Služba","","https://portal.eks.sk/SpravaKniznice/OpisneFormulareKniznice/VerejnyDetailOpisnehoFormularaKniznice/263227","1","0",
"OF-262892","Po karanténe","Rôzne počítačové vybavenie","simulátor, procesor, monitor, okuliare VR, slúchadlá, deskopt PC, externý disk","30236200-4 Zariadenia na spracovanie údajov; 60000000-8 Dopravné služby (bez prepravy odpadu)","Tovar; Služba","","https://portal.eks.sk/SpravaKniznice/OpisneFormulareKniznice/VerejnyDetailOpisnehoFormularaKniznice/262892","1","0",
"OF-262474","Po karanténe","Technická a licenčná aktualizácia komunikačného systému so službami na podporu prevádzky ","komunikačný systém, licenčná aktualizácia, elektronická pošta","48223000-7 Softvérový balík pre elektronickú poštu; 48510000-6 Softvérový balík na komunikáciu; 72261000-2 Softvérové podporné služby; 60000000-8 Dopravné služby (bez prepravy odpadu)","Tovar; Služba","","https://portal.eks.sk/SpravaKniznice/OpisneFormulareKniznice/VerejnyDetailOpisnehoFormularaKniznice/262474","1","0",
"OF-263931","Po karanténe","Chemické svetlá","chemické svetlo, svetlo, zdroj svetla, chemická svietiaca tyčinka, svietiaca tyčinka","31518000-0 Signalizačné svetlá; 31000000-6 Elektrické stroje, prístroje, zariadenia a spotrebný tovar; osvetlenie; 60000000-8 Dopravné služby (bez prepravy odpadu)","Tovar; Služba","","https://portal.eks.sk/SpravaKniznice/OpisneFormulareKniznice/VerejnyDetailOpisnehoFormularaKniznice/263931","1","1479,980",
"OF-262709","Po karanténe","Telefónne aparáty","Telekomunikácia","32552110-1 Bezdrôtové telefóny; 32552100-8 Telefónne prístroje; 60000000-8 Dopravné služby (bez prepravy odpadu)","Tovar; Služba","","https://portal.eks.sk/SpravaKniznice/OpisneFormulareKniznice/VerejnyDetailOpisnehoFormularaKniznice/262709","1","2849,900",
"OF-264163","Po karanténe","Maliarske náradie a pomôcky","štetec, páska maliarska","39224210-3 Maliarske štetce; 37820000-2 Potreby pre maliarov; 60000000-8 Dopravné služby (bez prepravy odpadu)","Tovar; Služba","","https://portal.eks.sk/SpravaKniznice/OpisneFormulareKniznice/VerejnyDetailOpisnehoFormularaKniznice/264163","1","0",
"OF-263396","Po karanténe","Počítač, Notebook","osobný počítač, notebook","30213000-5 Osobné počítače; 30213100-6 Prenosné počítače; 60000000-8 Dopravné služby (bez prepravy odpadu)","Tovar; Služba","","https://portal.eks.sk/SpravaKniznice/OpisneFormulareKniznice/VerejnyDetailOpisnehoFormularaKniznice/263396","1","0",
"OF-263914","Po karanténe","Anorganické, organické chemikálie a biologický spotrebný materiál","Chemikálie","24300000-7 Základné anorganické a organické chemikálie; 60000000-8 Dopravné služby (bez prepravy odpadu)","Tovar; Služba","","https://portal.eks.sk/SpravaKniznice/OpisneFormulareKniznice/VerejnyDetailOpisnehoFormularaKniznice/263914","1","3694,650",
"OF-262895","Po karanténe","Špeciálne a bežné náterové hmoty, farby a riedidlá","farby, spreje, riedidlá","44810000-1 Náterové farby; 44832200-3 Riedidlá; 44800000-8 Náterové farby, laky a tmely; 60000000-8 Dopravné služby (bez prepravy odpadu)","Tovar; Služba","","https://portal.eks.sk/SpravaKniznice/OpisneFormulareKniznice/VerejnyDetailOpisnehoFormularaKniznice/262895","1","1058,330",
"OF-262377","Po karanténe","Počítače a monitory","Počítač, monitor, all in one, mini tower","30213300-8 Stolový počítač; 30231000-7 Počítačové monitory a konzoly; 60000000-8 Dopravné služby (bez prepravy odpadu)","Tovar; Služba","","https://portal.eks.sk/SpravaKniznice/OpisneFormulareKniznice/VerejnyDetailOpisnehoFormularaKniznice/262377","1","3989,960",
"OF-263528","Po karanténe","Kuchynský nábytok","kuchyňa, nábytok, kuchynský nábytok","39141000-2 Kuchynský nábytok a vybavenie; 39100000-3 Nábytok","Tovar; Služba","","https://portal.eks.sk/SpravaKniznice/OpisneFormulareKniznice/VerejnyDetailOpisnehoFormularaKniznice/263528","1","0",
"OF-262592","Po karanténe","Brity na snehové radlice","brit, guma, oceľ","34390000-7 Príslušenstvo ťahačov/traktorov; 43313100-1 Snehové pluhy; 60000000-8 Dopravné služby (bez prepravy odpadu)","Tovar; Služba","","https://portal.eks.sk/SpravaKniznice/OpisneFormulareKniznice/VerejnyDetailOpisnehoFormularaKniznice/262592","1","4202,080",
"OF-262360","Po karanténe","Deratizácia, dezinsekcia a zadymovanie objektov a celého areálu","deratizácia, dezinsekcia, zadymovanie, deratizačné služby, dezinsekčné a hubiace služby","90921000-9 Dezinfekčné a hubiace služby; 90922000-6 Hubenie škodcov; 90923000-3 Deratizačné služby; 60000000-8 Dopravné služby (bez prepravy odpadu)","Služba","","https://portal.eks.sk/SpravaKniznice/OpisneFormulareKniznice/VerejnyDetailOpisnehoFormularaKniznice/262360","1","10500,000",
"OF-263127","Po karanténe","Trubky, potrubia, hadice a armatúry","Ventil, rohový, radiátorov, priamy,","44162300-6 Odtokové/odpadové potrubia; 45331000-6 Inštalovanie kúrenia, ventilácie a klimatizácie; 42131110-0 Ventily radiátorov ústredného kúrenia; 60000000-8 Dopravné služby (bez prepravy odpadu)","Tovar; Služba","","https://portal.eks.sk/SpravaKniznice/OpisneFormulareKniznice/VerejnyDetailOpisnehoFormularaKniznice/263127","1","830,420",
"OF-263110","Po karanténe","Tlačiarne kariet, čítačky kariet, licencie, pásky do tlačiarní a čipové karty žlté","Tlačiarne kariet, čítačky kariet, licencie, pásky do tlačiarní a čipové karty žlté","30232100-5 Tlačiarne a zapisovače; 30192300-4 Farbiace pásky; 30160000-8 Magnetické karty; 60000000-8 Dopravné služby (bez prepravy odpadu)","Tovar; Služba","","https://portal.eks.sk/SpravaKniznice/OpisneFormulareKniznice/VerejnyDetailOpisnehoFormularaKniznice/263110","1","10832,500",
"OF-263162","Po karanténe","Kovové tyče, plechy, fólie a profily","Kovové profily, kovové pásy, kovová rúra, trapézový plech, krytina","44330000-2 Tyče, prúty, drôty a profily používané v stavebníctve; 44334000-0 Profily; 44112120-5 Profilové diely; 44170000-2 Dosky, plechy, pásy a fólie súvisiace so stavebnými materiálmi; 44172000-6 Plechy (stavebné); 60000000-8 Dopravné služby (bez prepravy odpadu)","Tovar","","https://portal.eks.sk/SpravaKniznice/OpisneFormulareKniznice/VerejnyDetailOpisnehoFormularaKniznice/263162","1","8333,330",
"OF-263411","Po karanténe","Zariadenia na klimatizáciu, chladenie vzduchu a príslušenstvo","mobilná klimatizácia, prenosná klimatizácia, klimatizácia, stĺpový ventilátor","39717200-3 Klimatizačné spotrebiče; 39717000-1 Ventilátory a klimatizačné spotrebiče; 39714100-1 Ventilátory; 60000000-8 Dopravné služby (bez prepravy odpadu)","Tovar; Služba","","https://portal.eks.sk/SpravaKniznice/OpisneFormulareKniznice/VerejnyDetailOpisnehoFormularaKniznice/263411","1","2271,670",
"OF-262976","Po karanténe","Náhradné diely na autobusy Sor NB12,NB18 - podvozok","Náhradné diely, autobus,Sor NB12,NB18,podvozok","34121100-2 Autobusy verejnej dopravy; 34139200-2 Samotný podvozok; 60000000-8 Dopravné služby (bez prepravy odpadu)","Tovar","","https://portal.eks.sk/SpravaKniznice/OpisneFormulareKniznice/VerejnyDetailOpisnehoFormularaKniznice/262976","1","2770,000",
"OF-262544","Po karanténe","Výpočtová technika a príslušenstvo","Notebook, PC komponenty, Procesor, Základná doska","30213100-6 Prenosné počítače; 30231000-7 Počítačové monitory a konzoly; 30237000-9 Časti a príslušenstvo počítačov a spotrebný materiál k nim; 30237200-1 Príslušenstvo počítačov; 60000000-8 Dopravné služby (bez prepravy odpadu)","Tovar; Služba","","https://portal.eks.sk/SpravaKniznice/OpisneFormulareKniznice/VerejnyDetailOpisnehoFormularaKniznice/262544","1","6578,330",
"OF-263712","Po karanténe","Opravy a revízie individuálnych dýchacích prístrojov","Dräger, opravy a revízie individuálnych dýchacích prístrojov pre hasičov, IDP pre hasičov","50413200-5 Opravy a údržba protipožiarnych zariadení; 60000000-8 Dopravné služby (bez prepravy odpadu)","Služba","","https://portal.eks.sk/SpravaKniznice/OpisneFormulareKniznice/VerejnyDetailOpisnehoFormularaKniznice/263712","1","3332,920",
"OF-263480","Po karanténe","Vertikálny nosič sudov pre VZV","nosič","42418500-4 Mechanické manipulačné zariadenia; 60000000-8 Dopravné služby (bez prepravy odpadu)","Tovar; Služba","","https://portal.eks.sk/SpravaKniznice/OpisneFormulareKniznice/VerejnyDetailOpisnehoFormularaKniznice/263480","2","1030,000",
"OF-263729","Po karanténe","Poly dG-dC","chemikália,  Poly dG-dC","24326000-5 Aldehydy, ketóny, organické peroxidy a étery; 60000000-8 Dopravné služby (bez prepravy odpadu)","Tovar; Služba","","https://portal.eks.sk/SpravaKniznice/OpisneFormulareKniznice/VerejnyDetailOpisnehoFormularaKniznice/263729","1","0",
"OF-262962","Po karanténe","Počítačové vybavenie a príslušenstvo","notebook, projektor","30213000-5 Osobné počítače; 38652120-7 Videoprojektory; 60000000-8 Dopravné služby (bez prepravy odpadu)","Tovar; Služba","","https://portal.eks.sk/SpravaKniznice/OpisneFormulareKniznice/VerejnyDetailOpisnehoFormularaKniznice/262962","1","0",
"OF-262561","Po karanténe","Kancelárske stoličky","stoličky, kancelárske stoličky,","39110000-6 Sedadlá, stoličky a podobné výrobky a súvisiace časti; 39112000-0 Stoličky; 60000000-8 Dopravné služby (bez prepravy odpadu)","Tovar; Služba","","https://portal.eks.sk/SpravaKniznice/OpisneFormulareKniznice/VerejnyDetailOpisnehoFormularaKniznice/262561","1","0",
"OF-264247","Po karanténe","Toner - alternatíva","toner, alternatíva","30125000-1 Časti a príslušenstvo fotokopírovacích prístrojov; 30125120-8 Toner do fotokopírovacích strojov; 30125100-2 Tonerové náplne; 60000000-8 Dopravné služby (bez prepravy odpadu)","Tovar; Služba","","https://portal.eks.sk/SpravaKniznice/OpisneFormulareKniznice/VerejnyDetailOpisnehoFormularaKniznice/264247","1","0",
"OF-264330","Po karanténe","Dodávka elektrickej energie","Elektrická energia","09310000-5 Elektrická energia; 65300000-6 Rozvod elektriny a súvisiace služby","Tovar; Služba","","https://portal.eks.sk/SpravaKniznice/OpisneFormulareKniznice/VerejnyDetailOpisnehoFormularaKniznice/264330","1","0",
"OF-263311","Po karanténe","Arteriálne katétre, monitorovacie súpravy","Arteriálne katétre, monitorovacie súpravy","33141322-3 Arteriálne ihly; 60000000-8 Dopravné služby (bez prepravy odpadu)","Tovar; Služba","","https://portal.eks.sk/SpravaKniznice/OpisneFormulareKniznice/VerejnyDetailOpisnehoFormularaKniznice/263311","1","0",
"OF-262275","Po karanténe","Špeciálne a bežné náterové hmoty, farby a riedidlá","Špeciálne a bežné náterové hmoty, farby a riedidlá","44810000-1 Náterové farby; 60000000-8 Dopravné služby (bez prepravy odpadu)","Tovar; Služba","","https://portal.eks.sk/SpravaKniznice/OpisneFormulareKniznice/VerejnyDetailOpisnehoFormularaKniznice/262275","1","115,000",
"OF-263812","Po karanténe","Mlieko a mliečne výrobky","mlieko, mliečne výrobky, smotana, tvaroh, syr, maslo, jogurt","15511000-3 Mlieko; 15500000-3 Mliečne výrobky; 15551300-8 Jogurt; 15512000-0 Smotana; 15530000-2 Maslo; 15542200-1 Mäkký syr; 15544000-3 Tvrdý syr; 60000000-8 Dopravné služby (bez prepravy odpadu)","Tovar; Služba","","https://portal.eks.sk/SpravaKniznice/OpisneFormulareKniznice/VerejnyDetailOpisnehoFormularaKniznice/263812","1","0",
"OF-262876","Po karanténe","Výzva na predloženie cenovej ponuky na IT služby a správu HW /SW.“ ","IT služby a správa HW /SW.“","72000000-5 Služby informačných technológií: konzultácie, vývoj softvéru, internet a podpora","Služba","","https://portal.eks.sk/SpravaKniznice/OpisneFormulareKniznice/VerejnyDetailOpisnehoFormularaKniznice/262876","1","10000,000",
"OF-263998","Po karanténe","Dodávka kancelárskych stoličiek pohoviek","Dodávka kancelárskych stoličiek pohoviek","39100000-3 Nábytok; 39112000-0 Stoličky; 60000000-8 Dopravné služby (bez prepravy odpadu)","Tovar; Služba","","https://portal.eks.sk/SpravaKniznice/OpisneFormulareKniznice/VerejnyDetailOpisnehoFormularaKniznice/263998","1","0",
"OF-263211","Po karanténe","Mlieko a mliečne výrobky","mlieko, mliečne výrobky, smotana, tvaroh, syr, maslo, jogurt","15511000-3 Mlieko; 15500000-3 Mliečne výrobky; 15551300-8 Jogurt; 15512000-0 Smotana; 15530000-2 Maslo; 15542200-1 Mäkký syr; 15544000-3 Tvrdý syr; 60000000-8 Dopravné služby (bez prepravy odpadu)","Tovar; Služba","","https://portal.eks.sk/SpravaKniznice/OpisneFormulareKniznice/VerejnyDetailOpisnehoFormularaKniznice/263211","1","0",
