"OpisnyFormularIdentifikator","OpisnyFormularStav","OpisnyFormularNazov","OpisnyFormularKlucoveSlova","OpisnyFormularCpv","OpisnyFormularDruh","OpisnyFormularKategoriaSluzieb","OpisnyFormularUrl","OpisnyFormularPocetVyhlasenychZakaziek","OpisnyFormularObchodovanaSumaBezDPH",
"OF-289361","Po karanténe","Mobilné, ochranné oplotenie a zábrany","žiletkový drôt, končertino","44312300-3 Ostnatý drôt; 60000000-8 Dopravné služby (bez prepravy odpadu)","Tovar; Služba","","https://portal.eks.sk/SpravaKniznice/OpisneFormulareKniznice/VerejnyDetailOpisnehoFormularaKniznice/289361","1","0",
"OF-289362","Po karanténe","Železiarske výrobky a brusivá","skrutka, matica, podložka, samorezná skrutka, vrut, červík, hadicová spona, klinec, hmoždina, zdrhovačka, brúsny kotúč, brúsny papier, regálová konzola","44531100-2 Skrutky do dreva; 44531300-4 Závitorezné skrutky; 44531600-7 Matice; 44530000-4 Upínadlá/spony; 44192200-4 Klince; 39516120-9 Podložky; 14811300-2 Brúsne kotúče; 60000000-8 Dopravné služby (bez prepravy odpadu)","Tovar; Služba","","https://portal.eks.sk/SpravaKniznice/OpisneFormulareKniznice/VerejnyDetailOpisnehoFormularaKniznice/289362","1","0",
"OF-289364","Po karanténe","All-in-one počítače","All-in-one, počítač, PC","30213300-8 Stolový počítač; 60000000-8 Dopravné služby (bez prepravy odpadu)","Tovar; Služba","","https://portal.eks.sk/SpravaKniznice/OpisneFormulareKniznice/VerejnyDetailOpisnehoFormularaKniznice/289364","1","0",
"OF-289366","Po karanténe","Mobilné, ochranné oplotenie a zábrany","Brána, Cestný panel","34928220-6 Súčasti oplotenia; 44175000-7 Panely; 44114220-0 Betónové rúry a ich príslušenstvo (spojky); 60000000-8 Dopravné služby (bez prepravy odpadu)","Tovar","","https://portal.eks.sk/SpravaKniznice/OpisneFormulareKniznice/VerejnyDetailOpisnehoFormularaKniznice/289366","0","0",
"OF-289368","Po karanténe","Notebook","notebook","30213100-6 Prenosné počítače; 60000000-8 Dopravné služby (bez prepravy odpadu)","Tovar; Služba","","https://portal.eks.sk/SpravaKniznice/OpisneFormulareKniznice/VerejnyDetailOpisnehoFormularaKniznice/289368","1","0",
"OF-289369","Po karanténe","Ekologické skrine","Ekologická skriňa na skladovanie vodu ohrozujúcich kvapalín","44421722-4 Bezpečnostné skrine; 60000000-8 Dopravné služby (bez prepravy odpadu)","Tovar; Služba","","https://portal.eks.sk/SpravaKniznice/OpisneFormulareKniznice/VerejnyDetailOpisnehoFormularaKniznice/289369","1","0",
"OF-289370","Po karanténe","Mlieko a mliečne výrobky","mlieko, mliečne výrobky, smotana, tvaroh, syr, maslo, jogurt","15511000-3 Mlieko; 15500000-3 Mliečne výrobky; 15551300-8 Jogurt; 15512000-0 Smotana; 15530000-2 Maslo; 15542200-1 Mäkký syr; 15544000-3 Tvrdý syr; 60000000-8 Dopravné služby (bez prepravy odpadu)","Tovar; Služba","","https://portal.eks.sk/SpravaKniznice/OpisneFormulareKniznice/VerejnyDetailOpisnehoFormularaKniznice/289370","1","0",
"OF-289371","Po karanténe","Tonery  ","toner, xerox","30125000-1 Časti a príslušenstvo fotokopírovacích prístrojov; 30125120-8 Toner do fotokopírovacích strojov; 30125100-2 Tonerové náplne; 60000000-8 Dopravné služby (bez prepravy odpadu)","Tovar; Služba","","https://portal.eks.sk/SpravaKniznice/OpisneFormulareKniznice/VerejnyDetailOpisnehoFormularaKniznice/289371","1","0",
"OF-289373","Po karanténe","Umývanie osobných motorových vozidiel","Umývanie osobných motorových vozidiel","50112300-6 Umývanie osobných motorových vozidiel a podobné služby; 60000000-8 Dopravné služby (bez prepravy odpadu)","Služba","","https://portal.eks.sk/SpravaKniznice/OpisneFormulareKniznice/VerejnyDetailOpisnehoFormularaKniznice/289373","0","0",
"OF-289374","Po karanténe","Učebné pomôcky - zdravotnícky sektor","učebné a tréningové pomôcky: intraoseálna vŕtačka, intraoseálna ihla, trénovacie kosti (proximálny humerus s kožou-dospelý, proximálna tibia s kožou-dospelý, proximálna tibia s kožou-dieťa, a pod.), taška s kapsami pre intraoseálnu vŕtačku, fixátor intraoseálnej ihly","33196000-0 Zdravotné pomôcky; 33100000-1 Zdravotnícke vybavenie; 60000000-8 Dopravné služby (bez prepravy odpadu); 33190000-8 Rôzne lekárske zariadenia a výrobky","Tovar; Služba","","https://portal.eks.sk/SpravaKniznice/OpisneFormulareKniznice/VerejnyDetailOpisnehoFormularaKniznice/289374","1","0",
"OF-289376","Po karanténe","Odvoz a likvidácia nemocničného odpadu","odpad zdravotnícky, nebezpečný odpad , odvoz odpadu","90520000-8 Služby súvisiace s rádioaktívnym, toxickým, zdravotníckym a nebezpečným odpadom; 90524400-0 Zber, doprava a likvidácia nemocničného odpadu","Služba","","https://portal.eks.sk/SpravaKniznice/OpisneFormulareKniznice/VerejnyDetailOpisnehoFormularaKniznice/289376","1","0",
"OF-289377","Po karanténe","Náterové hmoty, farby a riedidlá","farba, syntetika, riedidlo. kov, striekanie, maľovanie,","44810000-1 Náterové farby; 44832200-3 Riedidlá; 44800000-8 Náterové farby, laky a tmely; 60000000-8 Dopravné služby (bez prepravy odpadu)","Tovar; Služba","","https://portal.eks.sk/SpravaKniznice/OpisneFormulareKniznice/VerejnyDetailOpisnehoFormularaKniznice/289377","1","0",
"OF-289379","Po karanténe","Umývanie osobných motorových vozidiel","Umývanie osobných motorových vozidiel","50112300-6 Umývanie osobných motorových vozidiel a podobné služby; 60000000-8 Dopravné služby (bez prepravy odpadu)","Služba","","https://portal.eks.sk/SpravaKniznice/OpisneFormulareKniznice/VerejnyDetailOpisnehoFormularaKniznice/289379","0","0",
"OF-289380","Po karanténe","Zdravotnícke prístroje ","zdravotnícky prístroj, systém, mechanizované stláčanie hrudníka, držiak defibrilátora, prístroj, defibrilátor s monitorom","33196000-0 Zdravotné pomôcky; 33100000-1 Zdravotnícke vybavenie; 33190000-8 Rôzne lekárske zariadenia a výrobky; 60000000-8 Dopravné služby (bez prepravy odpadu)","Tovar; Služba","","https://portal.eks.sk/SpravaKniznice/OpisneFormulareKniznice/VerejnyDetailOpisnehoFormularaKniznice/289380","1","0",
"OF-289385","Po karanténe","Žiarovky do semafórov","žiarovky","31500000-1 Osvetľovacie zariadenia a elektrické žiarovky; 60000000-8 Dopravné služby (bez prepravy odpadu)","Tovar; Služba","","https://portal.eks.sk/SpravaKniznice/OpisneFormulareKniznice/VerejnyDetailOpisnehoFormularaKniznice/289385","0","0",
"OF-289388","Po karanténe","Integrovaný cestný smerový stĺpik","integrovaný cestný smerový stĺpik so snehovou tyčou","34920000-2 Cestné príslušenstvo; 60000000-8 Dopravné služby (bez prepravy odpadu)","Tovar; Služba","","https://portal.eks.sk/SpravaKniznice/OpisneFormulareKniznice/VerejnyDetailOpisnehoFormularaKniznice/289388","0","0",
"OF-289392","Po karanténe","Chemikálie prevádzkové 2","kyselina mravčia, kyselina citrónová, Hydrát vápenný","24300000-7 Základné anorganické a organické chemikálie; 60000000-8 Dopravné služby (bez prepravy odpadu)","Tovar; Služba","","https://portal.eks.sk/SpravaKniznice/OpisneFormulareKniznice/VerejnyDetailOpisnehoFormularaKniznice/289392","1","0",
"OF-289395","Po karanténe","Tonery","toner, HP","30125000-1 Časti a príslušenstvo fotokopírovacích prístrojov; 30125120-8 Toner do fotokopírovacích strojov; 30125100-2 Tonerové náplne; 60000000-8 Dopravné služby (bez prepravy odpadu)","Tovar; Služba","","https://portal.eks.sk/SpravaKniznice/OpisneFormulareKniznice/VerejnyDetailOpisnehoFormularaKniznice/289395","1","0",
"OF-289396","Po karanténe","Stolové multifunkčné tlačiarne","tlačiarne, multifunkčné zariadenia","30232110-8 Laserové tlačiarne; 30232100-5 Tlačiarne a zapisovače; 30121200-5 Zariadenia na fotokopírovanie; 38520000-6 Skenery","Tovar","","https://portal.eks.sk/SpravaKniznice/OpisneFormulareKniznice/VerejnyDetailOpisnehoFormularaKniznice/289396","0","0",
"OF-289397","Po karanténe","Skúšky dlhodobej stability","Skúšky dlhodobej stability","90721600-3 Služby na ochranu pred žiarením; 60000000-8 Dopravné služby (bez prepravy odpadu)","Služba","","https://portal.eks.sk/SpravaKniznice/OpisneFormulareKniznice/VerejnyDetailOpisnehoFormularaKniznice/289397","1","0",
"OF-289398","Po karanténe","HSM zariadenie","HSM zariadenie, bezpečnostné zariadenie","35113300-2 Bezpečnostné zariadenia","Tovar","","https://portal.eks.sk/SpravaKniznice/OpisneFormulareKniznice/VerejnyDetailOpisnehoFormularaKniznice/289398","0","0",
"OF-289399","Po karanténe","Vysokorýchlostný motorový systém – set na ošetrenie hlavy a chrbtice","operačné výkony hlavy a chrbtice, motorový systém","33162100-4 Prístroje operačnej sály; 51410000-9 Inštalácia lekárskych zariadení; 80511000-9 Školenie pracovníkov; 60000000-8 Dopravné služby (bez prepravy odpadu)","Tovar; Služba","","https://portal.eks.sk/SpravaKniznice/OpisneFormulareKniznice/VerejnyDetailOpisnehoFormularaKniznice/289399","0","0",
"OF-289401","Po karanténe","Rokovacie stoličky","Rokovacie stoličky","39141300-5 Skrine; 60000000-8 Dopravné služby (bez prepravy odpadu)","Tovar; Služba","","https://portal.eks.sk/SpravaKniznice/OpisneFormulareKniznice/VerejnyDetailOpisnehoFormularaKniznice/289401","0","0",
"OF-289402","Po karanténe","Opravy, ošetrovanie a revízie lokomotív","servis, odborné prehliadky, skúšky a revízie lokomotív","50221000-0 Opravy a údržba lokomotív; 60000000-8 Dopravné služby (bez prepravy odpadu)","Služba","","https://portal.eks.sk/SpravaKniznice/OpisneFormulareKniznice/VerejnyDetailOpisnehoFormularaKniznice/289402","1","0",
"OF-289404","Po karanténe","Elektroinštalačný materiál","vypínač, zásuvka, svorkovnica","31224100-3 Zástrčky a zásuvky; 31211310-4 Vypínacie poistky/vypínače; 60000000-8 Dopravné služby (bez prepravy odpadu)","Tovar; Služba","","https://portal.eks.sk/SpravaKniznice/OpisneFormulareKniznice/VerejnyDetailOpisnehoFormularaKniznice/289404","1","0",
"OF-289407","Po karanténe","Dodávka originálnych   a kompatibilných tonerov do tlačiarní","Dodávka originálnych a kompatibilných  tonerov do tlačiarní","30125100-2 Tonerové náplne; 60000000-8 Dopravné služby (bez prepravy odpadu)","Tovar; Služba","","https://portal.eks.sk/SpravaKniznice/OpisneFormulareKniznice/VerejnyDetailOpisnehoFormularaKniznice/289407","1","0",
"OF-289408","Po karanténe","Tmely, konzervačné materiály a lepidlá","lepidlo, disperzné spojivo","44190000-8 Rôzne stavebné materiály; 60000000-8 Dopravné služby (bez prepravy odpadu)","Tovar; Služba","","https://portal.eks.sk/SpravaKniznice/OpisneFormulareKniznice/VerejnyDetailOpisnehoFormularaKniznice/289408","0","0",
"OF-289409","Po karanténe","Nákup ručných pneumatických a motorových prístrojov","pneumatické alebo motorové ručné nástroje","42650000-7 Pneumatické alebo motorové ručné nástroje; 16310000-1 Kosačky; 16311100-9 Kosačky trávnikov, parkov alebo športovísk; 60000000-8 Dopravné služby (bez prepravy odpadu)","Tovar; Služba","","https://portal.eks.sk/SpravaKniznice/OpisneFormulareKniznice/VerejnyDetailOpisnehoFormularaKniznice/289409","0","0",
"OF-289411","Po karanténe","Železiarske výrobky a brusivá","Visiace zámky","44521000-8 Rôzne visiace zámky a zámky; 44520000-1 Zámky, kľúče a pánty; 44521210-3 Visiace zámky; 60000000-8 Dopravné služby (bez prepravy odpadu)","Tovar","","https://portal.eks.sk/SpravaKniznice/OpisneFormulareKniznice/VerejnyDetailOpisnehoFormularaKniznice/289411","0","0",
"OF-289412","Po karanténe","Servisná prehliadka a servisná skúška zdvíhacích zariadení","zdvíhacie zariadenia, brány, servisná prehliadka, servisná skúška","71600000-4 Služby v oblasti technického skúšania, technickej analýzy a technického poradenstva; 71621000-7 Služby v oblasti technickej analýzy alebo technického poradenstva; 44000000-0 Stavebné konštrukcie a materiály; pomocné výrobky pre konštrukcie (s výnimkou elektrických prístrojov); 45000000-7 Stavebné práce; 71631300-3 Technická inšpekcia budov; 71632000-7 Technické skúšky; 71300000-1 Inžinierske služby; 60000000-8 Dopravné služby (bez prepravy odpadu)","Služba; Tovar","","https://portal.eks.sk/SpravaKniznice/OpisneFormulareKniznice/VerejnyDetailOpisnehoFormularaKniznice/289412","1","0",
"OF-289415","Po karanténe","Sanitárna technika a príslušenstvo","vodovodná batéria, ventil, rukoväť, doska, umývadlo,","39370000-6 Vodoinštalácie; 42131400-0 Sanitárne výpusty, kohúty; 44411000-4 Sanitárne výrobky; 60000000-8 Dopravné služby (bez prepravy odpadu)","Tovar; Služba","","https://portal.eks.sk/SpravaKniznice/OpisneFormulareKniznice/VerejnyDetailOpisnehoFormularaKniznice/289415","0","0",
"OF-289416","Po karanténe","Tlač - Verba Theologica","tlačiarenské služby","79810000-5 Tlačiarenské služby; 60000000-8 Dopravné služby (bez prepravy odpadu); 79820000-8 Služby súvisiace s tlačou","Služba","","https://portal.eks.sk/SpravaKniznice/OpisneFormulareKniznice/VerejnyDetailOpisnehoFormularaKniznice/289416","1","0",
"OF-289417","Po karanténe","Kalibrácia lekárskych tlakomerov","Kalibrácia lekárskych tlakomerov","50433000-9 Kalibrovanie; 50430000-8 Opravy a údržba presných zariadení; 60000000-8 Dopravné služby (bez prepravy odpadu)","Služba","","https://portal.eks.sk/SpravaKniznice/OpisneFormulareKniznice/VerejnyDetailOpisnehoFormularaKniznice/289417","1","0",
"OF-289418","Po karanténe","Výstroj - Vaky na výstroj pre vojakov","Vaky na výstroj pre vojakov","18900000-8 Brašnárske výrobky, sedlárske výrobky, vrecká a tašky; 60000000-8 Dopravné služby (bez prepravy odpadu)","Tovar; Služba","","https://portal.eks.sk/SpravaKniznice/OpisneFormulareKniznice/VerejnyDetailOpisnehoFormularaKniznice/289418","0","0",
"OF-289419","Po karanténe","Pracovná obuv","pracovná obuv","18830000-6 Ochranná obuv; 18800000-7 Obuv","Tovar","","https://portal.eks.sk/SpravaKniznice/OpisneFormulareKniznice/VerejnyDetailOpisnehoFormularaKniznice/289419","1","0",
"OF-289420","Po karanténe","Zabezpečenie prepravy osôb autobusom  DEU","preprava, autobus","60100000-9 Služby cestnej dopravy; 60140000-1 Nepravidelná osobná doprava; 60000000-8 Dopravné služby (bez prepravy odpadu)","Služba","","https://portal.eks.sk/SpravaKniznice/OpisneFormulareKniznice/VerejnyDetailOpisnehoFormularaKniznice/289420","1","0",
"OF-289421","Po karanténe","Odvoz a likvidácia kuchynského odpadu","Odlučovač tukov, lapač tukov, odvoz, likvidácia, kuchynský odpad","90500000-2 Služby súvisiace s likvidáciou odpadu a odpadom; 90512000-9 Služby na prepravu odpadu; 90510000-5 Likvidácia a spracovanie odpadu","Služba","","https://portal.eks.sk/SpravaKniznice/OpisneFormulareKniznice/VerejnyDetailOpisnehoFormularaKniznice/289421","0","0",
"OF-289423","Po karanténe","Klaprámy A3","plagátový klap rám","30192000-1 Kancelárske potreby; 60000000-8 Dopravné služby (bez prepravy odpadu)","Tovar; Služba","","https://portal.eks.sk/SpravaKniznice/OpisneFormulareKniznice/VerejnyDetailOpisnehoFormularaKniznice/289423","0","0",
"OF-289424","Po karanténe","Odborná literatúra a časopisy","urgentná medicína, 100 Deadly Skills, Survival Edition, 5P Prvá pomoc pre pokročilých poskytovateľov, CyberSecurity","22100000-1 Tlačené knihy, brožúry a letáky; 22110000-4 Tlačené knihy; 22120000-7 Publikácie; 60000000-8 Dopravné služby (bez prepravy odpadu)","Tovar; Služba","","https://portal.eks.sk/SpravaKniznice/OpisneFormulareKniznice/VerejnyDetailOpisnehoFormularaKniznice/289424","0","0",
"OF-289425","Po karanténe","Notebooky pre výpočty","Notebook s príslušenstvom","30213100-6 Prenosné počítače; 60000000-8 Dopravné služby (bez prepravy odpadu)","Tovar; Služba","","https://portal.eks.sk/SpravaKniznice/OpisneFormulareKniznice/VerejnyDetailOpisnehoFormularaKniznice/289425","1","0",
"OF-289426","Po karanténe","Originál tonery, alternatívne tonery","toner, Originál tonery, alternatívne tonery","30125110-5 Toner do laserových tlačiarní/faxových prístrojov; 30125100-2 Tonerové náplne; 60000000-8 Dopravné služby (bez prepravy odpadu)","Tovar; Služba","","https://portal.eks.sk/SpravaKniznice/OpisneFormulareKniznice/VerejnyDetailOpisnehoFormularaKniznice/289426","1","0",
"OF-289427","Po karanténe","Kvapalinový chromatograf s kvartérnou analytickou pumpou s DAD,  FLD a refraktometrickým  detektorom","kvapalinový chromatograf, DAD,  FLD a refraktometrický  detektor","38000000-5 Laboratórne, optické a presné prístroje a vybavenie (s výnimkou skiel); 38432200-4 Chromatografy; 51430000-5 Inštalácia laboratórnych zariadení; 60000000-8 Dopravné služby (bez prepravy odpadu)","Tovar; Služba","","https://portal.eks.sk/SpravaKniznice/OpisneFormulareKniznice/VerejnyDetailOpisnehoFormularaKniznice/289427","0","0",
"OF-289428","Po karanténe","Zneškodnenie nebezpečných odpadov - PHM","Zneškodnenie nebezpečných odpadov, likvidácia, odber, odvoz","90510000-5 Likvidácia a spracovanie odpadu; 90500000-2 Služby súvisiace s likvidáciou odpadu a odpadom; 90512000-9 Služby na prepravu odpadu","Služba","","https://portal.eks.sk/SpravaKniznice/OpisneFormulareKniznice/VerejnyDetailOpisnehoFormularaKniznice/289428","0","0",
"OF-289429","Po karanténe","Technické plyny a zásobníky","dusík, fľaša tlaková","24110000-8 Technické plyny; 24111700-2 Dusík; 60000000-8 Dopravné služby (bez prepravy odpadu)","Tovar","","https://portal.eks.sk/SpravaKniznice/OpisneFormulareKniznice/VerejnyDetailOpisnehoFormularaKniznice/289429","0","0",
"OF-289432","Po karanténe","Náhradné diely do sprejovej sušiarne Buchi Mini Spay dryer B-290","Náhradné diely, sprejová sušiareň","38000000-5 Laboratórne, optické a presné prístroje a vybavenie (s výnimkou skiel); 60000000-8 Dopravné služby (bez prepravy odpadu)","Tovar; Služba","","https://portal.eks.sk/SpravaKniznice/OpisneFormulareKniznice/VerejnyDetailOpisnehoFormularaKniznice/289432","1","0",
"OF-289434","Po karanténe","Priemyselne vyrábané nekovové materiály","manžeta, páska sťahovacia, zúbkové pásky, zmrštovacie chráničky, bužírky, gumenné chráničky","44167200-0 Opravné svorky a manžety (límce); 60000000-8 Dopravné služby (bez prepravy odpadu); 34312500-2 Tesnenia; 22850000-3 Rýchloviazače a súvisiace príslušenstvo; 22851000-0 Rýchloviazače; 44425200-7 Gumené tesnenia; 44532200-0 Podložky/tesnenia; 39812500-2 Tesniace materiály; 44425000-5 Krúžky, tesnenia, pásky, latky a nádoby na cementovú maltu; 39532000-0 Rohože","Tovar; Služba","","https://portal.eks.sk/SpravaKniznice/OpisneFormulareKniznice/VerejnyDetailOpisnehoFormularaKniznice/289434","1","0",
"OF-289435","Po karanténe","Opravy a údržba kopírovacích strojov a príslušenstva","Oprava, Fotokopírovacie zariadenie","50313100-3 Opravy fotokopírovacích strojov; 50313200-4 Údržba fotokopírovacích strojov; 60000000-8 Dopravné služby (bez prepravy odpadu)","Služba","","https://portal.eks.sk/SpravaKniznice/OpisneFormulareKniznice/VerejnyDetailOpisnehoFormularaKniznice/289435","1","0",
"OF-289436","Po karanténe","Nákup 1 ks Samozberného zametača s odsávaním - nadstavba na vozidlo MAN","samozberný zametač, zametač","34921100-0 Zametače ciest; 60000000-8 Dopravné služby (bez prepravy odpadu)","Tovar; Služba","","https://portal.eks.sk/SpravaKniznice/OpisneFormulareKniznice/VerejnyDetailOpisnehoFormularaKniznice/289436","1","0",
"OF-289437","Po karanténe","Pomôcky a materiál na polygrafickú výrobu","cartridge","42991500-4 Časti tlačiarenských alebo kníhviazačských strojov; 42962000-7 Tlačiarske/kopírovacie a grafické zariadenia; 30125100-2 Tonerové náplne; 60000000-8 Dopravné služby (bez prepravy odpadu)","Tovar; Služba","","https://portal.eks.sk/SpravaKniznice/OpisneFormulareKniznice/VerejnyDetailOpisnehoFormularaKniznice/289437","1","0",
"OF-289438","Po karanténe","Náterové hmoty, farby a riedidlá","farby, riedidlá","44810000-1 Náterové farby; 44832200-3 Riedidlá; 44800000-8 Náterové farby, laky a tmely; 60000000-8 Dopravné služby (bez prepravy odpadu)","Tovar; Služba","","https://portal.eks.sk/SpravaKniznice/OpisneFormulareKniznice/VerejnyDetailOpisnehoFormularaKniznice/289438","0","0",
"OF-289439","Po karanténe","Záchranárske vybavenie","zachytávač, zachytávač pádu","35110000-8 Hasičské, záchranárske a bezpečnostné vybavenie; 35112000-2 Záchranárske a pohotovostné vybavenie; 60000000-8 Dopravné služby (bez prepravy odpadu)","Tovar; Služba","","https://portal.eks.sk/SpravaKniznice/OpisneFormulareKniznice/VerejnyDetailOpisnehoFormularaKniznice/289439","0","0",
"OF-289440","Po karanténe","Záchranárske vybavenie","osma, zlaňovacia osma","35110000-8 Hasičské, záchranárske a bezpečnostné vybavenie; 35112000-2 Záchranárske a pohotovostné vybavenie; 60000000-8 Dopravné služby (bez prepravy odpadu)","Tovar; Služba","","https://portal.eks.sk/SpravaKniznice/OpisneFormulareKniznice/VerejnyDetailOpisnehoFormularaKniznice/289440","0","0",
"OF-289441","Po karanténe","Predĺženie podpory licencií UFED 4PC Ultimate na 12 mesiacov","UFED 4PC Ultimate podpora na 12 mesiacov,","72200000-7 Programovanie softvéru a poradenstvo; 71356300-1 Technická podpora; 72000000-5 Služby informačných technológií: konzultácie, vývoj softvéru, internet a podpora; 60000000-8 Dopravné služby (bez prepravy odpadu)","Služba","","https://portal.eks.sk/SpravaKniznice/OpisneFormulareKniznice/VerejnyDetailOpisnehoFormularaKniznice/289441","0","0",
"OF-289442","Po karanténe","Nádoby, obaly a obalový materiál","plachta, nepremokavá plachta, krycia plachta","39522100-8 Nepremokavé plachty, ochranné a tieniace plachty; 39522000-7 Nepremokavé plachty, lodné plachty pre člny, plachetnice alebo pozemné vozidlá, ochranné a tieniace plachty, stany a kempingové výrobky; 39522110-1 Nepremokavé plachty; 60000000-8 Dopravné služby (bez prepravy odpadu)","Tovar; Služba","","https://portal.eks.sk/SpravaKniznice/OpisneFormulareKniznice/VerejnyDetailOpisnehoFormularaKniznice/289442","0","0",
"OF-289446","Po karanténe","Výpočtová technika","monitor, IKT, príslušenstvo, dáta","30213000-5 Osobné počítače; 30213100-6 Prenosné počítače; 30236000-2 Rôzne počítačové vybavenie; 60000000-8 Dopravné služby (bez prepravy odpadu)","Tovar; Služba","","https://portal.eks.sk/SpravaKniznice/OpisneFormulareKniznice/VerejnyDetailOpisnehoFormularaKniznice/289446","0","0",
"OF-289447","Po karanténe"," Originál tonery","tonery do laserových tlačiarní, tonery do multifunkčných zariadení","30125110-5 Toner do laserových tlačiarní/faxových prístrojov; 30125120-8 Toner do fotokopírovacích strojov; 30125100-2 Tonerové náplne; 60000000-8 Dopravné služby (bez prepravy odpadu)","Tovar; Služba","","https://portal.eks.sk/SpravaKniznice/OpisneFormulareKniznice/VerejnyDetailOpisnehoFormularaKniznice/289447","1","0",
"OF-289449","Po karanténe","Revízie, opravy a renovácia stanov","Oprava stanov","50800000-3 Rôzne opravárske a údržbárske služby; 50830000-2 Oprava odevov a textilu; 60000000-8 Dopravné služby (bez prepravy odpadu)","Služba; Tovar","","https://portal.eks.sk/SpravaKniznice/OpisneFormulareKniznice/VerejnyDetailOpisnehoFormularaKniznice/289449","0","0",
"OF-289450","Po karanténe","Nerezový pracovný stôl a regálová zostava","pracovný stôl, nerez, regálová zostava","39310000-8 Zariadenia hromadného stravovania; 60000000-8 Dopravné služby (bez prepravy odpadu)","Tovar; Služba","","https://portal.eks.sk/SpravaKniznice/OpisneFormulareKniznice/VerejnyDetailOpisnehoFormularaKniznice/289450","0","0",
"OF-289451","Po karanténe","osobný počítač","osobný počítač","30213300-8 Stolový počítač; 60000000-8 Dopravné služby (bez prepravy odpadu)","Tovar; Služba","","https://portal.eks.sk/SpravaKniznice/OpisneFormulareKniznice/VerejnyDetailOpisnehoFormularaKniznice/289451","0","0",
"OF-289453","Po karanténe","Svetelné zdroje a príslušenstvo","svetelné zdroje","31519000-7 Žiarivky a neónové lampy; 31500000-1 Osvetľovacie zariadenia a elektrické žiarovky; 31512100-9 Halogénové žiarovky, lineárne; 31514000-2 Výbojky; 60000000-8 Dopravné služby (bez prepravy odpadu)","Tovar; Služba","","https://portal.eks.sk/SpravaKniznice/OpisneFormulareKniznice/VerejnyDetailOpisnehoFormularaKniznice/289453","0","0",
"OF-289455","Po karanténe","Enoxaparín sodný","B01AB05, enoxaparín, antitrombotiká, antitrombotické činidlá","33621100-0 Antitrombotické činidlá; 60000000-8 Dopravné služby (bez prepravy odpadu)","Tovar; Služba","","https://portal.eks.sk/SpravaKniznice/OpisneFormulareKniznice/VerejnyDetailOpisnehoFormularaKniznice/289455","0","0",
"OF-289456","Po karanténe","Pultová mraznička ","Pultová mraznička","39711120-6 Mrazničky; 39711121-3 Truhlicové mrazničky; 60000000-8 Dopravné služby (bez prepravy odpadu)","Tovar; Služba","","https://portal.eks.sk/SpravaKniznice/OpisneFormulareKniznice/VerejnyDetailOpisnehoFormularaKniznice/289456","0","0",
"OF-289457","Po karanténe","Predĺženie podpory pre licencie IDA/Hexray na 12 mesiacov","Predĺženie podpory pre licencie IDA/Hexray na 12 mesiacov","72200000-7 Programovanie softvéru a poradenstvo; 71356300-1 Technická podpora; 72000000-5 Služby informačných technológií: konzultácie, vývoj softvéru, internet a podpora; 60000000-8 Dopravné služby (bez prepravy odpadu)","Služba","","https://portal.eks.sk/SpravaKniznice/OpisneFormulareKniznice/VerejnyDetailOpisnehoFormularaKniznice/289457","0","0",
