"OpisnyFormularIdentifikator","OpisnyFormularStav","OpisnyFormularNazov","OpisnyFormularKlucoveSlova","OpisnyFormularCpv","OpisnyFormularDruh","OpisnyFormularKategoriaSluzieb","OpisnyFormularUrl","OpisnyFormularPocetVyhlasenychZakaziek","OpisnyFormularObchodovanaSumaBezDPH",
"OF-289285","Po karanténe","Príslušenstvo k vysávačom","hadica, potrubie, vysávač","39713431-3 Príslušenstvo k vysávačom prachu; 60000000-8 Dopravné služby (bez prepravy odpadu)","Tovar; Služba","","https://portal.eks.sk/SpravaKniznice/OpisneFormulareKniznice/VerejnyDetailOpisnehoFormularaKniznice/289285","1","0",
"OF-289286","Po karanténe","Železiarske výrobky a brusivá","petllica, zámok stavebný, rezný kotúč, kovanie guľa/kľučka, brúsny papier","14810000-2 Brúsne produkty; 14811300-2 Brúsne kotúče; 14522300-9 Šmirgeľ; 44520000-1 Zámky, kľúče a pánty; 44523000-2 Pánty, kovanie a drobné príslušenstvo; 44521000-8 Rôzne visiace zámky a zámky; 60000000-8 Dopravné služby (bez prepravy odpadu)","Tovar; Služba","","https://portal.eks.sk/SpravaKniznice/OpisneFormulareKniznice/VerejnyDetailOpisnehoFormularaKniznice/289286","1","0",
"OF-289287","Po karanténe","Tréningovo vzdelávací systém pre lokalizáciu objektov v priestore","software, dáta, lokalizácia, dátový , transfer, počítač, vybavenie, logistika, priestor, hardvér, kufor, konzultácia","30236200-4 Zariadenia na spracovanie údajov; 80511000-9 Školenie pracovníkov; 60000000-8 Dopravné služby (bez prepravy odpadu)","Tovar; Služba","","https://portal.eks.sk/SpravaKniznice/OpisneFormulareKniznice/VerejnyDetailOpisnehoFormularaKniznice/289287","1","0",
"OF-289289","Po karanténe","Tmely a konzervačné materiály a lepidlá","Tmely, lepidlá, čističe, silikóny","44831100-5 Tmely; 60000000-8 Dopravné služby (bez prepravy odpadu); 24911200-5 Spojivá; 44800000-8 Náterové farby, laky a tmely; 44831300-7 Tesniace tmely; 44831000-4 Tmely, plnivá, tesniace tmely; 44830000-7 Tmely, plnivá, tesniace tmely a rozpúšťadlá; 44832200-3 Riedidlá; 31224000-2 Spájacie a kontaktné prvky; 24951120-2 Silikónové mazivo; 39831500-1 Čistiace prostriedky na autá; 39800000-0 Čistiace a leštiace výrobky","Tovar; Služba","","https://portal.eks.sk/SpravaKniznice/OpisneFormulareKniznice/VerejnyDetailOpisnehoFormularaKniznice/289289","1","808.330",
"OF-289290","Po karanténe","Opravy a údržba kopírovacích strojov a príslušenstva ","Servis, údržba a opravy strojov","50313100-3 Opravy fotokopírovacích strojov; 50313200-4 Údržba fotokopírovacích strojov; 30121100-4 Fotokopírovacie stroje; 30121200-5 Zariadenia na fotokopírovanie; 60000000-8 Dopravné služby (bez prepravy odpadu)","Služba; Tovar","","https://portal.eks.sk/SpravaKniznice/OpisneFormulareKniznice/VerejnyDetailOpisnehoFormularaKniznice/289290","1","0",
"OF-289292","Po karanténe","Priemyselne vyrábané nekovové materiály","gufero, O-krúžok, záplaty, háčiky, napínacia guma, opravný hríbik, teflónová páska","44173000-3 Pás; 44425200-7 Gumené tesnenia; 19520000-7 Plastové výrobky; 19512000-8 Výrobky z nevulkanizovaného kaučuku; 44425300-8 Gumené pásy; 60000000-8 Dopravné služby (bez prepravy odpadu)","Tovar; Služba","","https://portal.eks.sk/SpravaKniznice/OpisneFormulareKniznice/VerejnyDetailOpisnehoFormularaKniznice/289292","1","0",
"OF-289293","Po karanténe","Originálny toner HP 149 X","tonery, tonerové náplne","30125100-2 Tonerové náplne; 60000000-8 Dopravné služby (bez prepravy odpadu)","Tovar; Služba","","https://portal.eks.sk/SpravaKniznice/OpisneFormulareKniznice/VerejnyDetailOpisnehoFormularaKniznice/289293","1","0",
"OF-289294","Po karanténe","Kovové tyče, plechy, fólie a profily","oceľové profily, plechy, tyče, L profily, tyč plochá,","44331000-9 Tyče; 60000000-8 Dopravné služby (bez prepravy odpadu); 44172000-6 Plechy (stavebné); 44170000-2 Dosky, plechy, pásy a fólie súvisiace so stavebnými materiálmi; 34928200-0 Ploty; 34928220-6 Súčasti oplotenia; 44212220-7 Pylóny, stĺpy, koly; 44334000-0 Profily; 44330000-2 Tyče, prúty, drôty a profily používané v stavebníctve; 14711000-8 Železo; 14711100-9 Surové železo","Tovar; Služba","","https://portal.eks.sk/SpravaKniznice/OpisneFormulareKniznice/VerejnyDetailOpisnehoFormularaKniznice/289294","1","1708.330",
"OF-289295","Po karanténe","Skriňa kovová","skriňa","39120000-9 Stoly, skrine, písacie stoly a knižnice; 60000000-8 Dopravné služby (bez prepravy odpadu)","Tovar; Služba","","https://portal.eks.sk/SpravaKniznice/OpisneFormulareKniznice/VerejnyDetailOpisnehoFormularaKniznice/289295","1","0",
"OF-289296","Po karanténe","Podpora prostredia pre virtualizáciu LAN siete pri zachovaní pôvodnej funkcionality","LAN siete, virtualizácia","72261000-2 Softvérové podporné služby","Služba","","https://portal.eks.sk/SpravaKniznice/OpisneFormulareKniznice/VerejnyDetailOpisnehoFormularaKniznice/289296","1","0",
"OF-289298","Po karanténe","Kancelársky papier (ekologický výrobok)","kancelársky papier","30197642-8 Papier na fotokopírovanie a xerografický papier; 60000000-8 Dopravné služby (bez prepravy odpadu)","Tovar; Služba","","https://portal.eks.sk/SpravaKniznice/OpisneFormulareKniznice/VerejnyDetailOpisnehoFormularaKniznice/289298","1","0",
"OF-289299","Po karanténe","Servis a opravy posypových nadstavieb","Posypové nadstavby, servisné prehliadky, diagnostika, opravy","50110000-9 Opravy a údržbárske služby pre motorové vozidlá a súvisiace vybavenie; 72254100-1 Testovanie systémov; 50530000-9 Opravy a údržba strojov; 34143000-1 Vozidlá na zimnú údržbu ciest","Služba","","https://portal.eks.sk/SpravaKniznice/OpisneFormulareKniznice/VerejnyDetailOpisnehoFormularaKniznice/289299","1","0",
"OF-289300","Po karanténe","Tlačiarenské služby 3","tlač, tlačiarenská služba, výroba tlače","79800000-2 Tlačiarenské a príbuzné služby; 79810000-5 Tlačiarenské služby; 79820000-8 Služby súvisiace s tlačou; 79821000-5 Konečná úprava tlače; 60000000-8 Dopravné služby (bez prepravy odpadu)","Služba","","https://portal.eks.sk/SpravaKniznice/OpisneFormulareKniznice/VerejnyDetailOpisnehoFormularaKniznice/289300","1","120.000",
"OF-289301","Po karanténe","Kuchynské vybavenie pre domácnosť a kanceláriu","Automatický kávovar, mikrovlnná rúra","39711310-5 Elektrické kávovary; 39700000-9 Spotrebiče pre domácnosť; 39710000-2 Elektrické prístroje pre domácnosť; 39711000-9 Elektrické prístroje používané v domácnosti na potraviny; 39711300-2 Elektrotepelné prístroje; 60000000-8 Dopravné služby (bez prepravy odpadu); 42940000-7 Stroje na tepelné spracovanie materiálov; 39711362-4 Mikrovlné rúry","Tovar; Služba","","https://portal.eks.sk/SpravaKniznice/OpisneFormulareKniznice/VerejnyDetailOpisnehoFormularaKniznice/289301","1","0",
"OF-289302","Po karanténe","Skladacie, posuvné stoly","stôl","39130000-2 Kancelársky nábytok; 60000000-8 Dopravné služby (bez prepravy odpadu)","Tovar; Služba","","https://portal.eks.sk/SpravaKniznice/OpisneFormulareKniznice/VerejnyDetailOpisnehoFormularaKniznice/289302","1","0",
"OF-289303","Po karanténe","Plnoautomatický skladací stroj ","plnoautomatický skladací stroj","30123400-1 Skladacie stroje; 51500000-7 Inštalácia strojov a zariadení; 60000000-8 Dopravné služby (bez prepravy odpadu)","Tovar; Služba","","https://portal.eks.sk/SpravaKniznice/OpisneFormulareKniznice/VerejnyDetailOpisnehoFormularaKniznice/289303","1","0",
"OF-289306","Po karanténe","Zariadenie na klimatizáciu, cirkuláciu vzduchu a príslušenstvo","klimatizácia, mobilná klimatizácia, zariadenie na rozvod vzduchu,","39717200-3 Klimatizačné spotrebiče; 60000000-8 Dopravné služby (bez prepravy odpadu); 39717000-1 Ventilátory a klimatizačné spotrebiče; 42500000-1 Chladiace a ventilačné zariadenia; 39714100-1 Ventilátory","Tovar; Služba","","https://portal.eks.sk/SpravaKniznice/OpisneFormulareKniznice/VerejnyDetailOpisnehoFormularaKniznice/289306","1","349.170",
"OF-289307","Po karanténe","Nádoby, obaly a obalový materiál","sorbent na olej, kôš na triedený odpad","34928480-6 Kontajnery a nádoby na odpad a odpadky; 44613800-8 Kontajnery na odpadový materiál; 44613600-6 Kontajnery na kolesách; 44618000-5 Ľahké kontajnery, zátky, vrchnáky kontajnerov, kade a veká; 44618100-6 Ľahké kontajnery; 60000000-8 Dopravné služby (bez prepravy odpadu)","Tovar","","https://portal.eks.sk/SpravaKniznice/OpisneFormulareKniznice/VerejnyDetailOpisnehoFormularaKniznice/289307","1","0",
"OF-289308","Po karanténe","Tlač a doručenie dvojmesačníka","tlačiarenské služby, doručovateľské služby, tlač, mesačník, noviny, doručovanie","79810000-5 Tlačiarenské služby; 60000000-8 Dopravné služby (bez prepravy odpadu)","Služba; Tovar","","https://portal.eks.sk/SpravaKniznice/OpisneFormulareKniznice/VerejnyDetailOpisnehoFormularaKniznice/289308","0","0",
"OF-289309","Po karanténe","Propofol","centrálna nervová sústava, celkové anestetiká","33661100-2 Anestetiká","Tovar","","https://portal.eks.sk/SpravaKniznice/OpisneFormulareKniznice/VerejnyDetailOpisnehoFormularaKniznice/289309","0","0",
"OF-289310","Po karanténe","Originálne tonerové náplne","originálne tonerové náplne","30125100-2 Tonerové náplne; 60000000-8 Dopravné služby (bez prepravy odpadu)","Tovar; Služba","","https://portal.eks.sk/SpravaKniznice/OpisneFormulareKniznice/VerejnyDetailOpisnehoFormularaKniznice/289310","1","0",
"OF-289311","Po karanténe","Vrecia PE","vrecia na odpad","19640000-4 Polyetylénový odpad a odpadkové vrecká a vaky; 60000000-8 Dopravné služby (bez prepravy odpadu)","Tovar; Služba","","https://portal.eks.sk/SpravaKniznice/OpisneFormulareKniznice/VerejnyDetailOpisnehoFormularaKniznice/289311","1","0",
"OF-289312","Po karanténe","Tmely, konzervačné materiály a lepidlá","tmely, lepidlá, silikóny","44831100-5 Tmely; 24590000-6 Silikóny v primárnych formách; 44830000-7 Tmely, plnivá, tesniace tmely a rozpúšťadlá; 60000000-8 Dopravné služby (bez prepravy odpadu)","Tovar","","https://portal.eks.sk/SpravaKniznice/OpisneFormulareKniznice/VerejnyDetailOpisnehoFormularaKniznice/289312","1","0",
"OF-289315","Po karanténe","Tmely, konzervačné materiály a lepidlá","Mazivo","09211000-1 Mazacie oleje a mazivá; 60000000-8 Dopravné služby (bez prepravy odpadu)","Tovar; Služba","","https://portal.eks.sk/SpravaKniznice/OpisneFormulareKniznice/VerejnyDetailOpisnehoFormularaKniznice/289315","1","0",
"OF-289316","Po karanténe","Obstaranie SSD diskov a pamätí RAM","pamäť, pamäťová jednotka, SSD disk, RAM, pamäť s náhodným prístupom, počítač","30236110-6 Pamäť s náhodným prístupom (RAM); 30233100-2 Počítačové pamäťové jednotky; 60000000-8 Dopravné služby (bez prepravy odpadu)","Tovar","","https://portal.eks.sk/SpravaKniznice/OpisneFormulareKniznice/VerejnyDetailOpisnehoFormularaKniznice/289316","1","0",
"OF-289317","Po karanténe","Železiarske výrobky a brusivá","kotúč, brúsny koúč, rezný kotúč","14811300-2 Brúsne kotúče; 60000000-8 Dopravné služby (bez prepravy odpadu)","Tovar; Služba","","https://portal.eks.sk/SpravaKniznice/OpisneFormulareKniznice/VerejnyDetailOpisnehoFormularaKniznice/289317","0","0",
"OF-289318","Po karanténe","Potrubia, príruby a tvarovky pozinkované","vsuvky, prechodky reduk., ventily, spojky, príruby, zátky","39370000-6 Vodoinštalácie; 60000000-8 Dopravné služby (bez prepravy odpadu)","Tovar; Služba","","https://portal.eks.sk/SpravaKniznice/OpisneFormulareKniznice/VerejnyDetailOpisnehoFormularaKniznice/289318","1","0",
"OF-289319","Po karanténe","Sanitárna technika a príslušenstvo","Sanitárna technika","44411000-4 Sanitárne výrobky; 42131400-0 Sanitárne výpusty, kohúty; 60000000-8 Dopravné služby (bez prepravy odpadu)","Tovar; Služba","","https://portal.eks.sk/SpravaKniznice/OpisneFormulareKniznice/VerejnyDetailOpisnehoFormularaKniznice/289319","1","0",
"OF-289320","Po karanténe","Sieťový server NAS a vybavenie","NAS, dátové úložisko na sieti, pamäťové médiá","30210000-4 Stroje na spracovanie údajov (hardvér); 30200000-1 Počítačové zariadenia a spotrebný materiál; 30230000-0 Zariadenia súvisiace s počítačmi; 48820000-2 Servery; 51610000-1 Inštalácia počítačov a zariadení na spracovanie informácií; 60000000-8 Dopravné služby (bez prepravy odpadu)","Tovar; Služba","","https://portal.eks.sk/SpravaKniznice/OpisneFormulareKniznice/VerejnyDetailOpisnehoFormularaKniznice/289320","1","0",
"OF-289321","Po karanténe","Opravy a ošetrenie autobusov","Oprava, autobus, diagnostika","50113000-0 Opravy a údržba autobusov; 50113200-2 Údržba autobusov; 50113100-1 Oprava autobusov","Služba","","https://portal.eks.sk/SpravaKniznice/OpisneFormulareKniznice/VerejnyDetailOpisnehoFormularaKniznice/289321","1","0",
"OF-289322","Po karanténe","Umývanie osobných motorových vozidiel","Umývanie osobných motorových vozidiel","50112300-6 Umývanie osobných motorových vozidiel a podobné služby","Služba","","https://portal.eks.sk/SpravaKniznice/OpisneFormulareKniznice/VerejnyDetailOpisnehoFormularaKniznice/289322","1","0",
"OF-289324","Po karanténe","3. Náterové hmoty, farby a riedidlá ","akrylová farba S 2822, riedidlo S- 6000","44810000-1 Náterové farby; 44800000-8 Náterové farby, laky a tmely; 60000000-8 Dopravné služby (bez prepravy odpadu)","Tovar; Služba","","https://portal.eks.sk/SpravaKniznice/OpisneFormulareKniznice/VerejnyDetailOpisnehoFormularaKniznice/289324","0","0",
"OF-289325","Po karanténe","2. Nádoby, obaly a obalový materiál","sorbent na olej, kôš na triedený odpad","34928480-6 Kontajnery a nádoby na odpad a odpadky; 44613800-8 Kontajnery na odpadový materiál; 44618000-5 Ľahké kontajnery, zátky, vrchnáky kontajnerov, kade a veká; 60000000-8 Dopravné služby (bez prepravy odpadu)","Tovar","","https://portal.eks.sk/SpravaKniznice/OpisneFormulareKniznice/VerejnyDetailOpisnehoFormularaKniznice/289325","0","0",
"OF-289326","Po karanténe","Koncentrát mydlovej peny ","Koncentrát mydlovej peny","33741100-7 Čistiace prostriedky na ruky; 60000000-8 Dopravné služby (bez prepravy odpadu)","Tovar; Služba","","https://portal.eks.sk/SpravaKniznice/OpisneFormulareKniznice/VerejnyDetailOpisnehoFormularaKniznice/289326","1","0",
"OF-289327","Po karanténe","Krovinorez benzínový","krovinorez","16310000-1 Kosačky; 16311000-8 Kosačky trávnikov; 16311100-9 Kosačky trávnikov, parkov alebo športovísk; 60000000-8 Dopravné služby (bez prepravy odpadu)","Tovar; Služba","","https://portal.eks.sk/SpravaKniznice/OpisneFormulareKniznice/VerejnyDetailOpisnehoFormularaKniznice/289327","1","0",
"OF-289328","Po karanténe","Poľnohospodárske stroje a príslušenstvo","kosačky, kosačky trávnikov, strunová kosačka, krovinorez, bubnová kosačka","16310000-1 Kosačky; 16311000-8 Kosačky trávnikov; 60000000-8 Dopravné služby (bez prepravy odpadu)","Tovar; Služba","","https://portal.eks.sk/SpravaKniznice/OpisneFormulareKniznice/VerejnyDetailOpisnehoFormularaKniznice/289328","0","0",
"OF-289330","Po karanténe","Elektroinštalačný materiál","chránička, WAGO svorka, ističe, krabica elektroinštalačná, zásuvka, vidlica, vypínač, páska, objímka, štartér","31219000-4 Ochranné kryty; 30197110-0 Svorky; 31211310-4 Vypínacie poistky/vypínače; 31681410-0 Elektromateriály; 31224100-3 Zástrčky a zásuvky; 31681400-7 Elektrické súčiastky; 31681000-3 Elektropríslušenstvo; 31214100-0 Spínače; 31000000-6 Elektrické stroje, prístroje, zariadenia a spotrebný tovar; osvetlenie; 60000000-8 Dopravné služby (bez prepravy odpadu); 31651000-4 Elektroizolačná páska","Tovar; Služba","","https://portal.eks.sk/SpravaKniznice/OpisneFormulareKniznice/VerejnyDetailOpisnehoFormularaKniznice/289330","1","0",
"OF-289331","Po karanténe","Diagnostické kity","diagnostické kity, laboratórne potreby, laboratórny materiál","24000000-4 Chemické výrobky; 33694000-1 Diagnostické činidlá; 60000000-8 Dopravné služby (bez prepravy odpadu)","Tovar; Služba","","https://portal.eks.sk/SpravaKniznice/OpisneFormulareKniznice/VerejnyDetailOpisnehoFormularaKniznice/289331","0","0",
"OF-289332","Po karanténe","Laboratórny spotrebný materiál","laboratórium, materiál","38000000-5 Laboratórne, optické a presné prístroje a vybavenie (s výnimkou skiel); 33140000-3 Zdravotnícky spotrebný materiál; 60000000-8 Dopravné služby (bez prepravy odpadu)","Tovar; Služba","","https://portal.eks.sk/SpravaKniznice/OpisneFormulareKniznice/VerejnyDetailOpisnehoFormularaKniznice/289332","0","0",
"OF-289333","Po karanténe","Hasiace prístroje","Hasiaci prístroj, prenosné HP, pojazdné HP, ochrana pred požiarmi, hasiace zariadenia","35111320-4 Prenosné hasiace prístroje; 35111300-8 Hasiace zariadenia; 60000000-8 Dopravné služby (bez prepravy odpadu)","Tovar; Služba","","https://portal.eks.sk/SpravaKniznice/OpisneFormulareKniznice/VerejnyDetailOpisnehoFormularaKniznice/289333","1","0",
"OF-289334","Po karanténe","Cukrovinky","Cukrovinky","15842300-5 Cukrovinky; 60000000-8 Dopravné služby (bez prepravy odpadu)","Tovar; Služba","","https://portal.eks.sk/SpravaKniznice/OpisneFormulareKniznice/VerejnyDetailOpisnehoFormularaKniznice/289334","1","0",
"OF-289336","Po karanténe","Mobilné, ochranné oplotenie a zábrany","Brána, Cestný panel","34928220-6 Súčasti oplotenia; 44175000-7 Panely; 44114220-0 Betónové rúry a ich príslušenstvo (spojky); 60000000-8 Dopravné služby (bez prepravy odpadu)","Tovar","","https://portal.eks.sk/SpravaKniznice/OpisneFormulareKniznice/VerejnyDetailOpisnehoFormularaKniznice/289336","0","0",
"OF-289337","Po karanténe","Mobilné, ochranné oplotenie a zábrany","Cestný panel","44175000-7 Panely; 34928220-6 Súčasti oplotenia; 60000000-8 Dopravné služby (bez prepravy odpadu)","Tovar","","https://portal.eks.sk/SpravaKniznice/OpisneFormulareKniznice/VerejnyDetailOpisnehoFormularaKniznice/289337","0","0",
"OF-289339","Po karanténe","Tonery - PF,","tonery","30125100-2 Tonerové náplne; 60000000-8 Dopravné služby (bez prepravy odpadu)","Tovar; Služba","","https://portal.eks.sk/SpravaKniznice/OpisneFormulareKniznice/VerejnyDetailOpisnehoFormularaKniznice/289339","1","0",
"OF-289340","Po karanténe","Náhradné diely na autobusy Sor NB12,NB18 - podvozok","Náhradné diely, autobus,Sor NB12,NB18,podvozok","34121100-2 Autobusy verejnej dopravy; 34139200-2 Samotný podvozok; 60000000-8 Dopravné služby (bez prepravy odpadu)","Tovar","","https://portal.eks.sk/SpravaKniznice/OpisneFormulareKniznice/VerejnyDetailOpisnehoFormularaKniznice/289340","1","0",
"OF-289341","Po karanténe","Náhradné diely na autobusy SOR - hnacie ústrojenstvo","Náhradné diely, autobus, Sor NB12, Sor NB18,hnacie ústrojenstvo","34121100-2 Autobusy verejnej dopravy; 42111000-0 Motory a hnacie zariadenia; 60000000-8 Dopravné služby (bez prepravy odpadu)","Tovar","","https://portal.eks.sk/SpravaKniznice/OpisneFormulareKniznice/VerejnyDetailOpisnehoFormularaKniznice/289341","1","0",
"OF-289342","Po karanténe","Propagačný banner ","roll-up, banner, stojan, prenosný, taška, teleskopická tyč","35261000-1 Informačné panely","Tovar; Služba","","https://portal.eks.sk/SpravaKniznice/OpisneFormulareKniznice/VerejnyDetailOpisnehoFormularaKniznice/289342","0","0",
"OF-289343","Po karanténe","Náhradné diely na autobusy Solaris U12 - hnacie ústrojenstvo","Náhradné diely, autobus,Solaris U12,hnacie ústrojenstvo","34121100-2 Autobusy verejnej dopravy; 42111000-0 Motory a hnacie zariadenia; 60000000-8 Dopravné služby (bez prepravy odpadu)","Tovar","","https://portal.eks.sk/SpravaKniznice/OpisneFormulareKniznice/VerejnyDetailOpisnehoFormularaKniznice/289343","1","0",
"OF-289344","Po karanténe","Maliarsky materiál","Farby","24200000-6 Farby a pigmenty; 24960000-1 Rôzne chemické výrobky; 24300000-7 Základné anorganické a organické chemikálie; 60000000-8 Dopravné služby (bez prepravy odpadu)","Tovar; Služba","","https://portal.eks.sk/SpravaKniznice/OpisneFormulareKniznice/VerejnyDetailOpisnehoFormularaKniznice/289344","1","0",
"OF-289345","Po karanténe","Náhradné diely na autobusy Sor NB12, NB18 ","Náhradné diely, autobus ,Sor","34121100-2 Autobusy verejnej dopravy; 34121200-3 Kĺbové autobusy; 60000000-8 Dopravné služby (bez prepravy odpadu)","Tovar; Služba","","https://portal.eks.sk/SpravaKniznice/OpisneFormulareKniznice/VerejnyDetailOpisnehoFormularaKniznice/289345","1","0",
"OF-289346","Po karanténe","Náhradné diely na autobusy Sor NB12,NB18 - podvozok","Náhradné diely, autobus,Sor NB12,NB18,podvozok","34121100-2 Autobusy verejnej dopravy; 34139200-2 Samotný podvozok; 60000000-8 Dopravné služby (bez prepravy odpadu)","Tovar","","https://portal.eks.sk/SpravaKniznice/OpisneFormulareKniznice/VerejnyDetailOpisnehoFormularaKniznice/289346","1","0",
"OF-289347","Po karanténe","Umývanie osobných motorových vozidiel","Umývanie osobných motorových vozidiel","50112300-6 Umývanie osobných motorových vozidiel a podobné služby","Služba","","https://portal.eks.sk/SpravaKniznice/OpisneFormulareKniznice/VerejnyDetailOpisnehoFormularaKniznice/289347","0","0",
"OF-289348","Po karanténe","Náhradné diely na autobusy Citelis - podvozok","Náhradné diely, autobus, Citelis, podvozok","34121100-2 Autobusy verejnej dopravy; 34121200-3 Kĺbové autobusy; 34139300-3 Kompletný podvozok; 60000000-8 Dopravné služby (bez prepravy odpadu)","Tovar","","https://portal.eks.sk/SpravaKniznice/OpisneFormulareKniznice/VerejnyDetailOpisnehoFormularaKniznice/289348","1","0",
"OF-289350","Po karanténe","Náhradné diely na autobusy Sor NB12,NB18 - podvozok","Náhradné diely, autobus,Sor NB12,NB18,podvozok","34121100-2 Autobusy verejnej dopravy; 34139200-2 Samotný podvozok; 60000000-8 Dopravné služby (bez prepravy odpadu)","Tovar","","https://portal.eks.sk/SpravaKniznice/OpisneFormulareKniznice/VerejnyDetailOpisnehoFormularaKniznice/289350","1","0",
"OF-289351","Po karanténe","Náhradné diely na autobusy Sor NB12,NB18 - podvozok","Náhradné diely, autobus,Sor NB12,NB18,podvozok","34121100-2 Autobusy verejnej dopravy; 34139200-2 Samotný podvozok; 60000000-8 Dopravné služby (bez prepravy odpadu)","Tovar","","https://portal.eks.sk/SpravaKniznice/OpisneFormulareKniznice/VerejnyDetailOpisnehoFormularaKniznice/289351","1","0",
"OF-289353","Po karanténe","Toner do multifunkčného zariadenia Canon imageRunner  C1533iF ","Toner, náplne, kopírka, tlačiareň","30125110-5 Toner do laserových tlačiarní/faxových prístrojov; 60000000-8 Dopravné služby (bez prepravy odpadu); 30125120-8 Toner do fotokopírovacích strojov; 30125100-2 Tonerové náplne","Tovar; Služba","","https://portal.eks.sk/SpravaKniznice/OpisneFormulareKniznice/VerejnyDetailOpisnehoFormularaKniznice/289353","0","0",
"OF-289354","Po karanténe","Výpočtová technika (ff)","notebook, PC myš, pamäťová karta, adaptér, nabíjačka batérií","30213100-6 Prenosné počítače; 30237410-6 Počítačová myš; 30237230-0 Pamäte; 31111000-7 Adaptéry; 31158100-9 Nabíjače batérií; 60000000-8 Dopravné služby (bez prepravy odpadu)","Tovar; Služba","","https://portal.eks.sk/SpravaKniznice/OpisneFormulareKniznice/VerejnyDetailOpisnehoFormularaKniznice/289354","1","0",
"OF-289355","Po karanténe","Toner do tlačiarne CANON imageRunner C1533iF  - color","Toner, náplne, kopírka, tlačiareň","30125110-5 Toner do laserových tlačiarní/faxových prístrojov; 60000000-8 Dopravné služby (bez prepravy odpadu); 30125120-8 Toner do fotokopírovacích strojov; 30125100-2 Tonerové náplne","Tovar; Služba","","https://portal.eks.sk/SpravaKniznice/OpisneFormulareKniznice/VerejnyDetailOpisnehoFormularaKniznice/289355","0","0",
"OF-289356","Po karanténe","Red Hat Enterprise Linux Server - Standard Support - RH00004F3 alebo ekvivalent","softvérové licencie","72250000-2 Služby týkajúce sa podpory systému","Služba","","https://portal.eks.sk/SpravaKniznice/OpisneFormulareKniznice/VerejnyDetailOpisnehoFormularaKniznice/289356","1","0",
"OF-289357","Po karanténe","Náhradné diely na autobusy SOR - hnacie ústrojenstvo","Náhradné diely, autobus, Sor NB12, Sor NB18,hnacie ústrojenstvo","34121100-2 Autobusy verejnej dopravy; 42111000-0 Motory a hnacie zariadenia; 60000000-8 Dopravné služby (bez prepravy odpadu)","Tovar","","https://portal.eks.sk/SpravaKniznice/OpisneFormulareKniznice/VerejnyDetailOpisnehoFormularaKniznice/289357","1","0",
"OF-289358","Po karanténe","Náhradné diely na autobusy Sor NB12, NB18 ","Náhradné diely, autobus ,Sor","34121100-2 Autobusy verejnej dopravy; 34121200-3 Kĺbové autobusy; 60000000-8 Dopravné služby (bez prepravy odpadu)","Tovar; Služba","","https://portal.eks.sk/SpravaKniznice/OpisneFormulareKniznice/VerejnyDetailOpisnehoFormularaKniznice/289358","1","0",
"OF-289359","Po karanténe","Kovoobrábacie stroje a príslušenstvo","Elektródy, vrtáky, pilový list","31711140-6 Elektródy; 44511510-3 Listy (čepele) do ručných píl; 42670000-3 Časti a príslušenstvo obrábacích strojov; 42674000-1 Časti a príslušenstvo kovoobrábacích strojov; 44512900-1 Vrtná korunka, špice skrutkovačov a ostatné príslušenstvo; 60000000-8 Dopravné služby (bez prepravy odpadu)","Tovar; Služba","","https://portal.eks.sk/SpravaKniznice/OpisneFormulareKniznice/VerejnyDetailOpisnehoFormularaKniznice/289359","1","0",
"OF-289360","Po karanténe","Tlačiarenské služby","tlač, tlačiarenské služby","79810000-5 Tlačiarenské služby; 60000000-8 Dopravné služby (bez prepravy odpadu)","Služba; Tovar","","https://portal.eks.sk/SpravaKniznice/OpisneFormulareKniznice/VerejnyDetailOpisnehoFormularaKniznice/289360","1","0",
