"OpisnyFormularIdentifikator","OpisnyFormularStav","OpisnyFormularNazov","OpisnyFormularKlucoveSlova","OpisnyFormularCpv","OpisnyFormularDruh","OpisnyFormularKategoriaSluzieb","OpisnyFormularUrl","OpisnyFormularPocetVyhlasenychZakaziek","OpisnyFormularObchodovanaSumaBezDPH",
"OF-296484","Po karanténe","Dexametazón","Dexametazón","33642200-4 Kortikosteroidy na systémové použitie","Tovar","","https://portal.eks.sk/SpravaKniznice/OpisneFormulareKniznice/VerejnyDetailOpisnehoFormularaKniznice/296484","1","135.000",
"OF-296487","Po karanténe","Náhradné diely do lakovanej techniky","náhradné diely, lakovaná technika, osobné automobily","34330000-9 Náhradné diely pre vozidlá na prepravu tovaru, pre dodávky a osobné automobily; 34110000-1 Osobné automobily; 60000000-8 Dopravné služby (bez prepravy odpadu)","Tovar; Služba","","https://portal.eks.sk/SpravaKniznice/OpisneFormulareKniznice/VerejnyDetailOpisnehoFormularaKniznice/296487","1","157.920",
"OF-296501","Po karanténe","Mimozáručná oprava, profylaxia, kalibrácia a údržba kopírovacích strojov a príslušenstva  ","Oprava, profylaxia, kalibrácia a údržba kopírovacích strojov","50313100-3 Opravy fotokopírovacích strojov; 50313200-4 Údržba fotokopírovacích strojov; 50310000-1 Údržba a opravy kancelárskych strojov; 60000000-8 Dopravné služby (bez prepravy odpadu)","Služba; Tovar","","https://portal.eks.sk/SpravaKniznice/OpisneFormulareKniznice/VerejnyDetailOpisnehoFormularaKniznice/296501","1","0",
"OF-296502","Po karanténe","Ostatné interiérové vybavenie","Ostatné interiérové vybavenie","39290000-1 Rôzne vybavenie a zariadenie interiérov; 60000000-8 Dopravné služby (bez prepravy odpadu)","Tovar; Služba","","https://portal.eks.sk/SpravaKniznice/OpisneFormulareKniznice/VerejnyDetailOpisnehoFormularaKniznice/296502","1","0",
"OF-296519","Po karanténe","Nábytok do kreatívneho centra.","stôl, vešiaky, stojan na oblečenie","39100000-3 Nábytok","Tovar; Služba","","https://portal.eks.sk/SpravaKniznice/OpisneFormulareKniznice/VerejnyDetailOpisnehoFormularaKniznice/296519","1","791.660",
"OF-296534","Po karanténe","Učebné pomôcky - zdravotnícky sektor: Súprava na výcvik chirurgického šitia, tréningový model kože","Učebné pomôcky, Súprava, chirurgické šitie, model kože, podložka na šitie","33196000-0 Zdravotné pomôcky; 33100000-1 Zdravotnícke vybavenie; 39162200-7 Učebné pomôcky a zariadenia; 33190000-8 Rôzne lekárske zariadenia a výrobky; 60000000-8 Dopravné služby (bez prepravy odpadu)","Tovar; Služba","","https://portal.eks.sk/SpravaKniznice/OpisneFormulareKniznice/VerejnyDetailOpisnehoFormularaKniznice/296534","1","0",
"OF-296537","Po karanténe","Náhradné diely na autobusy SOR - hnacie ústrojenstvo","Náhradné diely, autobus, Sor NB12, Sor NB18,hnacie ústrojenstvo","34121100-2 Autobusy verejnej dopravy; 42111000-0 Motory a hnacie zariadenia; 60000000-8 Dopravné služby (bez prepravy odpadu)","Tovar","","https://portal.eks.sk/SpravaKniznice/OpisneFormulareKniznice/VerejnyDetailOpisnehoFormularaKniznice/296537","1","2280.000",
"OF-296551","Po karanténe","Zariadenie na 3D tlač s príslušenstvom","3D, tlač, podložka, tryska, hotend","42960000-3 Ovládací a riadiaci systém, tlačiarenské a grafické vybavenie, vybavenie na automatizáciu kancelárskych prác a spracovanie informácií; 60000000-8 Dopravné služby (bez prepravy odpadu)","Tovar; Služba","","https://portal.eks.sk/SpravaKniznice/OpisneFormulareKniznice/VerejnyDetailOpisnehoFormularaKniznice/296551","1","3850.000",
"OF-296718","Po karanténe","Výpočtová technika 5","projektor, laserová tlačiareň, multifunkčná tlačiareň, klávesnica, stropný držiak, elektrické plátko","30237100-0 Časti počítačov; 30232110-8 Laserové tlačiarne; 30237460-1 Počítačové klávesnice; 38652120-7 Videoprojektory; 60000000-8 Dopravné služby (bez prepravy odpadu)","Tovar; Služba","","https://portal.eks.sk/SpravaKniznice/OpisneFormulareKniznice/VerejnyDetailOpisnehoFormularaKniznice/296718","1","0",
"OF-295893","Po karanténe","Monočlánky a batérie","batérie, monočlánky","31440000-2 Batérie; 31434000-7 Lítiové akumulátory; 31411000-0 Alkalické batérie; 60000000-8 Dopravné služby (bez prepravy odpadu)","Tovar","","https://portal.eks.sk/SpravaKniznice/OpisneFormulareKniznice/VerejnyDetailOpisnehoFormularaKniznice/295893","1","587.500",
"OF-295908","Po karanténe","Stavebný materiál","Suchý betón","44000000-0 Stavebné konštrukcie a materiály; pomocné výrobky pre konštrukcie (s výnimkou elektrických prístrojov); 44111000-1 Stavebné materiály; 44111200-3 Cement; 60000000-8 Dopravné služby (bez prepravy odpadu)","Tovar; Služba","","https://portal.eks.sk/SpravaKniznice/OpisneFormulareKniznice/VerejnyDetailOpisnehoFormularaKniznice/295908","1","574.170",
"OF-295910","Po karanténe","Tlačiarenské služby","tlač, tlačiarenské služby","79810000-5 Tlačiarenské služby; 60000000-8 Dopravné služby (bez prepravy odpadu)","Služba; Tovar","","https://portal.eks.sk/SpravaKniznice/OpisneFormulareKniznice/VerejnyDetailOpisnehoFormularaKniznice/295910","1","799.090",
"OF-295927","Po karanténe","Chladnička","chladnička","39700000-9 Spotrebiče pre domácnosť; 60000000-8 Dopravné služby (bez prepravy odpadu)","Tovar; Služba","","https://portal.eks.sk/SpravaKniznice/OpisneFormulareKniznice/VerejnyDetailOpisnehoFormularaKniznice/295927","1","160.000",
"OF-295942","Po karanténe","ELISA súprava","diagnostika, detekcia","33694000-1 Diagnostické činidlá; 60000000-8 Dopravné služby (bez prepravy odpadu)","Tovar; Služba","","https://portal.eks.sk/SpravaKniznice/OpisneFormulareKniznice/VerejnyDetailOpisnehoFormularaKniznice/295942","1","525.000",
"OF-295944","Po karanténe","Žiarovky a žiarivky","Trubica žiarivková, Žiarovka","31532910-6 Žiarivkové trubice; 31531000-7 Žiarovky; 60000000-8 Dopravné služby (bez prepravy odpadu)","Tovar; Služba","","https://portal.eks.sk/SpravaKniznice/OpisneFormulareKniznice/VerejnyDetailOpisnehoFormularaKniznice/295944","1","502.000",
"OF-295957","Po karanténe","Fotopasca TETRAO Spromise S328 30Mpx 940nm MMS/4G","fotopasca","38650000-6 Fotografické zariadenia; 60000000-8 Dopravné služby (bez prepravy odpadu)","Tovar; Služba","","https://portal.eks.sk/SpravaKniznice/OpisneFormulareKniznice/VerejnyDetailOpisnehoFormularaKniznice/295957","0","0",
"OF-295959","Po karanténe","Nákup náhradných dielov do osobných automobilov ","Filter olejový, kabinový, vzduchový, Obloženie brzdové predné, Obloženie brzdové zadné, Kotúč brzdový predný","34330000-9 Náhradné diely pre vozidlá na prepravu tovaru, pre dodávky a osobné automobily; 34913000-0 Rôzne náhradné diely; 34110000-1 Osobné automobily; 60000000-8 Dopravné služby (bez prepravy odpadu)","Tovar; Služba","","https://portal.eks.sk/SpravaKniznice/OpisneFormulareKniznice/VerejnyDetailOpisnehoFormularaKniznice/295959","0","0",
"OF-295961","Po karanténe","Dodanie softvérových licencií.","Nákup licencií, predĺženie licencií.","48000000-8 Softvérové balíky a informačné systémy; 72510000-3 Služby súvisiace so správou počítačov; 72610000-9 Počítačové podporné služby; 48700000-5 Obslužné programy softvérových balíkov; 72250000-2 Služby týkajúce sa podpory systému","Tovar; Služba","","https://portal.eks.sk/SpravaKniznice/OpisneFormulareKniznice/VerejnyDetailOpisnehoFormularaKniznice/295961","1","20833.000",
"OF-295974","Po karanténe","Tonery - príslušenstvo","toner, optický valec, xerox","30125000-1 Časti a príslušenstvo fotokopírovacích prístrojov; 30125120-8 Toner do fotokopírovacích strojov; 30125100-2 Tonerové náplne; 60000000-8 Dopravné služby (bez prepravy odpadu)","Tovar; Služba","","https://portal.eks.sk/SpravaKniznice/OpisneFormulareKniznice/VerejnyDetailOpisnehoFormularaKniznice/295974","1","67.980",
"OF-295991","Po karanténe","Tlačiarenské služby","tlač, tlačiarenské služby","79810000-5 Tlačiarenské služby; 60000000-8 Dopravné služby (bez prepravy odpadu)","Služba; Tovar","","https://portal.eks.sk/SpravaKniznice/OpisneFormulareKniznice/VerejnyDetailOpisnehoFormularaKniznice/295991","0","0",
"OF-296008","Po karanténe","Jednorázová podložka pod chorých 60cm x 90cm","podložka pod chorých, inkontinentná podložka, zdravotnícka pomôcka","33198000-4 Výrobky z papiera na nemocničné účely; 33772000-2 Jednorazové papierové výrobky; 33000000-0 Zdravotnícke vybavenie, farmaceutický materiál a výrobky osobnej starostlivosti; 60000000-8 Dopravné služby (bez prepravy odpadu)","Tovar; Služba","","https://portal.eks.sk/SpravaKniznice/OpisneFormulareKniznice/VerejnyDetailOpisnehoFormularaKniznice/296008","0","0",
"OF-296010","Po karanténe","Sterilizačný materiál","sterilizačné sáčky, rolky, hárky","33198200-6 Papierové sterilizačné vrecká alebo odevy z papieroviny; 60000000-8 Dopravné služby (bez prepravy odpadu)","Tovar; Služba","","https://portal.eks.sk/SpravaKniznice/OpisneFormulareKniznice/VerejnyDetailOpisnehoFormularaKniznice/296010","0","0",
"OF-296027","Po karanténe","Náterové hmoty, farby a riedidlá","vnútorný náter, penetrácia, stierka","44810000-1 Náterové farby; 60000000-8 Dopravné služby (bez prepravy odpadu)","Tovar; Služba","","https://portal.eks.sk/SpravaKniznice/OpisneFormulareKniznice/VerejnyDetailOpisnehoFormularaKniznice/296027","1","380.000",
"OF-296042","Po karanténe","Dodávka elektrickej energie","Elektrická energia","09310000-5 Elektrická energia; 65300000-6 Rozvod elektriny a súvisiace služby","Tovar; Služba","","https://portal.eks.sk/SpravaKniznice/OpisneFormulareKniznice/VerejnyDetailOpisnehoFormularaKniznice/296042","1","12394.960",
"OF-296044","Po karanténe","Náhradné diely na autobusy Sor NB12, NB18 ","Náhradné diely, autobus ,Sor","34121100-2 Autobusy verejnej dopravy; 34121200-3 Kĺbové autobusy; 60000000-8 Dopravné služby (bez prepravy odpadu)","Tovar; Služba","","https://portal.eks.sk/SpravaKniznice/OpisneFormulareKniznice/VerejnyDetailOpisnehoFormularaKniznice/296044","1","2510.000",
"OF-296059","Po karanténe","Káble, lišty","káble, lišty","44321000-6 Káble; 44320000-9 Káble a súvisiace výrobky; 44322000-3 Príslušenstvo ku káblom; 60000000-8 Dopravné služby (bez prepravy odpadu)","Tovar; Služba","","https://portal.eks.sk/SpravaKniznice/OpisneFormulareKniznice/VerejnyDetailOpisnehoFormularaKniznice/296059","1","591.500",
"OF-296061","Po karanténe","Zobrazovací  valec pre tlačiareň - originál","tlač, valec","30125120-8 Toner do fotokopírovacích strojov; 60000000-8 Dopravné služby (bez prepravy odpadu)","Tovar; Služba","","https://portal.eks.sk/SpravaKniznice/OpisneFormulareKniznice/VerejnyDetailOpisnehoFormularaKniznice/296061","1","87.700",
"OF-296091","Po karanténe"," Letenka obojsmerná","Letenka, letecká preprava","60410000-5 Pravidelné letecké dopravné služby","Služba","","https://portal.eks.sk/SpravaKniznice/OpisneFormulareKniznice/VerejnyDetailOpisnehoFormularaKniznice/296091","1","867.000",
"OF-296110","Po karanténe","Diagnostická súprava","diagnostické súpravy, HBV","33141625-7 Diagnostické súpravy; 60000000-8 Dopravné služby (bez prepravy odpadu)","Tovar; Služba","","https://portal.eks.sk/SpravaKniznice/OpisneFormulareKniznice/VerejnyDetailOpisnehoFormularaKniznice/296110","1","515.000",
"OF-296125","Po karanténe","Propylénglykol","propylénglykol","24520000-5 Polyméry propylénu v primárnych formách; 60000000-8 Dopravné služby (bez prepravy odpadu)","Tovar; Služba","","https://portal.eks.sk/SpravaKniznice/OpisneFormulareKniznice/VerejnyDetailOpisnehoFormularaKniznice/296125","1","54.350",
"OF-296127","Po karanténe","Nákup rôznych potravinových výrobkov","rôzne potravinové výrobky","15800000-6 Rôzne potravinárske výrobky","Tovar; Služba","","https://portal.eks.sk/SpravaKniznice/OpisneFormulareKniznice/VerejnyDetailOpisnehoFormularaKniznice/296127","0","0",
"OF-296142","Po karanténe","Opravy a údržba laboratórnych prístrojov, zariadení a príslušenstva","servis plynového chromatografu s hmotnostným detektorom","50430000-8 Opravy a údržba presných zariadení; 60000000-8 Dopravné služby (bez prepravy odpadu)","Služba; Tovar","","https://portal.eks.sk/SpravaKniznice/OpisneFormulareKniznice/VerejnyDetailOpisnehoFormularaKniznice/296142","1","6893.500",
"OF-296144","Po karanténe","Zabezpečenie stravovania zamestnancov prostredníctvom elektronických stravovacích kariet na rok 2025","stravovacie karty, elektronické stravovacie poukážky, stravné karty","30199770-8 Stravné poukážky; 30237131-6 Elektronické karty; 55520000-1 Služby hromadného stravovania; 60000000-8 Dopravné služby (bez prepravy odpadu)","Tovar; Služba","","https://portal.eks.sk/SpravaKniznice/OpisneFormulareKniznice/VerejnyDetailOpisnehoFormularaKniznice/296144","1","64064.040",
"OF-296159","Po karanténe","Poľnohospodárske stroje a príslušenstvo","Náhon disku, hridel ,kryt, hlava, spojka","34913000-0 Rôzne náhradné diely; 16300000-8 Žacie mechanizmy; 44514200-8 Časti náradia; 60000000-8 Dopravné služby (bez prepravy odpadu)","Tovar; Služba","","https://portal.eks.sk/SpravaKniznice/OpisneFormulareKniznice/VerejnyDetailOpisnehoFormularaKniznice/296159","1","832.500",
"OF-296178","Po karanténe","Mrazená zelenina, mäso, ryby ","Mrazená zelenina, mäso, ryby","15331170-9 Mrazená zelenina; 60000000-8 Dopravné služby (bez prepravy odpadu); 15220000-6 Mrazené ryby, rybie filé a ostatné rybie mäso; 15896000-5 Hlboko zmrazené výrobky","Tovar; Služba","","https://portal.eks.sk/SpravaKniznice/OpisneFormulareKniznice/VerejnyDetailOpisnehoFormularaKniznice/296178","2","6141.670",
"OF-296191","Po karanténe","Tlač mestských novín - dvojtýždenník","tlač, mestské noviny","79824000-6 Tlačiarenské a distribučné služby; 60000000-8 Dopravné služby (bez prepravy odpadu)","Služba","","https://portal.eks.sk/SpravaKniznice/OpisneFormulareKniznice/VerejnyDetailOpisnehoFormularaKniznice/296191","1","31896.000",
"OF-296195","Po karanténe","Elektrická trojpec s nútenou cirkuláciou vzduchu napr. ALBA TPE 30 ARS alebo ekvivalent","pec na prípravu jedál, teplovzdušná pec","42214100-0 Varné pece","Tovar; Služba","","https://portal.eks.sk/SpravaKniznice/OpisneFormulareKniznice/VerejnyDetailOpisnehoFormularaKniznice/296195","0","0",
"OF-296208","Po karanténe","Prepínač počítačovej siete RG-SF2920-8GT2MG2XS","Switch, prepínač počítačovej siete","32420000-3 Sieťové zariadenia; 60000000-8 Dopravné služby (bez prepravy odpadu)","Tovar; Služba","","https://portal.eks.sk/SpravaKniznice/OpisneFormulareKniznice/VerejnyDetailOpisnehoFormularaKniznice/296208","1","4832.500",
"OF-296210","Po karanténe","Osobný počítač s monitorom a záložným zdrojom","osobný počítač, monitor, UPS","30213000-5 Osobné počítače; 30231000-7 Počítačové monitory a konzoly; 60000000-8 Dopravné služby (bez prepravy odpadu); 31154000-0 Zdroje nepretržitého/stáleho napájania","Tovar; Služba","","https://portal.eks.sk/SpravaKniznice/OpisneFormulareKniznice/VerejnyDetailOpisnehoFormularaKniznice/296210","1","1415.000",
"OF-296225","Po karanténe","Tlač publikácií ","tlač, tlačiarenské služby, publikácia","79820000-8 Služby súvisiace s tlačou; 22000000-0 Tlačené výrobky a príbuzné produkty; 22120000-7 Publikácie","Služba","","https://portal.eks.sk/SpravaKniznice/OpisneFormulareKniznice/VerejnyDetailOpisnehoFormularaKniznice/296225","1","2718.180",
"OF-296227","Po karanténe","Nákup príslušenstva pre malotraktor Solis GT 26 6+2 s kabínou","Príves, kefa, bubnová kosačka, rozmetadlo piesku a soli, vysávač","16700000-2 Traktory/ťahače; 16000000-5 Poľnohospodárske stroje; 60000000-8 Dopravné služby (bez prepravy odpadu)","Tovar; Služba","","https://portal.eks.sk/SpravaKniznice/OpisneFormulareKniznice/VerejnyDetailOpisnehoFormularaKniznice/296227","2","17983.340",
"OF-296244","Po karanténe","Farby OL","farba, štetec, lak","24200000-6 Farby a pigmenty; 39224210-3 Maliarske štetce; 60000000-8 Dopravné služby (bez prepravy odpadu)","Tovar; Služba","","https://portal.eks.sk/SpravaKniznice/OpisneFormulareKniznice/VerejnyDetailOpisnehoFormularaKniznice/296244","1","1566.660",
"OF-296261","Po karanténe","Zváračka fólií, konvektor","Zváračka fólií, fólia, spotrebný materiál","19500000-1 Gumené a plastové materiály; 44174000-0 Fólia; 31600000-2 Elektrické zariadenia a prístroje; 60000000-8 Dopravné služby (bez prepravy odpadu)","Tovar; Služba","","https://portal.eks.sk/SpravaKniznice/OpisneFormulareKniznice/VerejnyDetailOpisnehoFormularaKniznice/296261","0","0",
"OF-296276","Po karanténe","Programová a technická podpora informačnej, komunikačnej a technickej infraštruktúry","technická podpora, informačná, komunikačná a technická infraštruktúra","72000000-5 Služby informačných technológií: konzultácie, vývoj softvéru, internet a podpora; 72260000-5 Služby súvisiace so softvérom; 72266000-7 Softvérové poradenstvo; 72267000-4 Služby na údržbu a opravu softvéru; 72267100-0 Údržba programového vybavenia (softvér) informačných technológií; 72267200-1 Opravy programového vybavenia (softvér) informačných technológií","Služba","","https://portal.eks.sk/SpravaKniznice/OpisneFormulareKniznice/VerejnyDetailOpisnehoFormularaKniznice/296276","1","136515.000",
"OF-296278","Po karanténe","Chladničky (s mrazničkou)","chladnička, chladenie, mrazenie","39711130-9 Chladničky; 39711123-7 Stojaté chladničky; 39711110-3 Chladničky s mrazničkou; 60000000-8 Dopravné služby (bez prepravy odpadu)","Tovar; Služba","","https://portal.eks.sk/SpravaKniznice/OpisneFormulareKniznice/VerejnyDetailOpisnehoFormularaKniznice/296278","1","570.830",
"OF-296293","Po karanténe","Pneumatika 315/70 R22,5, 215/65 R16C, 205/55 R16","Pneumatiky.","34352100-0 Pneumatiky pre nákladné vozidlá; 34351100-3 Pneumatiky pre motorové vozidlá; 60000000-8 Dopravné služby (bez prepravy odpadu)","Tovar; Služba","","https://portal.eks.sk/SpravaKniznice/OpisneFormulareKniznice/VerejnyDetailOpisnehoFormularaKniznice/296293","1","2760.000",
"OF-296295","Po karanténe","Súprava kancelárskych počítačov, ","Kancelársky počítač,","30213000-5 Osobné počítače; 30213300-8 Stolový počítač; 60000000-8 Dopravné služby (bez prepravy odpadu); 30234000-8 Pamäťové médiá","Tovar; Služba","","https://portal.eks.sk/SpravaKniznice/OpisneFormulareKniznice/VerejnyDetailOpisnehoFormularaKniznice/296295","1","5916.670",
"OF-296308","Po karanténe","Športové a rekreačné vybavenie","Dres, športové tričko, s potlačou","37400000-2 Športový tovar a výbava; 60000000-8 Dopravné služby (bez prepravy odpadu)","Tovar; Služba","","https://portal.eks.sk/SpravaKniznice/OpisneFormulareKniznice/VerejnyDetailOpisnehoFormularaKniznice/296308","1","415.830",
"OF-296310","Po karanténe","Minibáger","Minibáger, minirýpadlo","43000000-3 Strojové zariadenie na hlbinnú a povrchovú ťažbu, stavebné zariadenia; 60000000-8 Dopravné služby (bez prepravy odpadu)","Tovar; Služba","","https://portal.eks.sk/SpravaKniznice/OpisneFormulareKniznice/VerejnyDetailOpisnehoFormularaKniznice/296310","2","42000.000",
"OF-296312","Po karanténe","Hygienické pomôcky a čistiace potreby","čistiace prostriedky na podlahu, WC, riady, tekuté mydlá, hubky na riad, vrecia do koša","39830000-9 Čistiace výrobky; 39831300-9 Čistiace prostriedky na podlahu; 39832100-4 Čistiaci prášok na riad; 39831600-2 Čistiace prostriedky na toalety; 33771000-5 Hygienické výrobky z papiera; 33770000-8 Papierové hygienické výrobky; 39831210-1 Saponáty na umývanie riadu; 39831200-8 Saponáty; 60000000-8 Dopravné služby (bez prepravy odpadu)","Tovar; Služba","","https://portal.eks.sk/SpravaKniznice/OpisneFormulareKniznice/VerejnyDetailOpisnehoFormularaKniznice/296312","1","624.170",
"OF-296638","Po karanténe","Ručné náradie s pohonom a príslušenstvo","brúska uhlová","42652000-1 Ručné elektromechanické nástroje; 60000000-8 Dopravné služby (bez prepravy odpadu)","Tovar; Služba","","https://portal.eks.sk/SpravaKniznice/OpisneFormulareKniznice/VerejnyDetailOpisnehoFormularaKniznice/296638","1","0",
"OF-296640","Po karanténe","Toner pre tlačiareň HP","tonerové náplne","30125100-2 Tonerové náplne; 60000000-8 Dopravné služby (bez prepravy odpadu)","Tovar; Služba","","https://portal.eks.sk/SpravaKniznice/OpisneFormulareKniznice/VerejnyDetailOpisnehoFormularaKniznice/296640","1","0",
"OF-296642","Po karanténe","Agrochemikálie","Agrochemikálie, Pesticídy","24450000-3 Agrochemikálie; 24451000-0 Pesticídy; 60000000-8 Dopravné služby (bez prepravy odpadu)","Tovar; Služba","","https://portal.eks.sk/SpravaKniznice/OpisneFormulareKniznice/VerejnyDetailOpisnehoFormularaKniznice/296642","1","13736.000",
"OF-296663","Po karanténe","Elektrická pec, plynový kotol","Plynový varný kotol, Hromadné stravovanie, Pec na prípravu jedál, Teplovzdušná pec, Elektrická pec","39312000-2 Zariadenia na prípravu jedál; 60000000-8 Dopravné služby (bez prepravy odpadu); 42214100-0 Varné pece","Tovar; Služba","","https://portal.eks.sk/SpravaKniznice/OpisneFormulareKniznice/VerejnyDetailOpisnehoFormularaKniznice/296663","1","0",
"OF-296665","Po karanténe","Náhradné diely do techniky","náhradné diely, lakovaná technika, osobné automobily","34330000-9 Náhradné diely pre vozidlá na prepravu tovaru, pre dodávky a osobné automobily; 34110000-1 Osobné automobily; 60000000-8 Dopravné služby (bez prepravy odpadu)","Tovar; Služba","","https://portal.eks.sk/SpravaKniznice/OpisneFormulareKniznice/VerejnyDetailOpisnehoFormularaKniznice/296665","1","53.320",
"OF-296667","Po karanténe","Náhradné diely na autobusy Sor NB12, NB18 ","Náhradné diely, autobus ,Sor","34121100-2 Autobusy verejnej dopravy; 34121200-3 Kĺbové autobusy; 60000000-8 Dopravné služby (bez prepravy odpadu)","Tovar; Služba","","https://portal.eks.sk/SpravaKniznice/OpisneFormulareKniznice/VerejnyDetailOpisnehoFormularaKniznice/296667","1","0",
"OF-296672","Po karanténe","Povinné zmluvné poistenie","poistenie","66516100-1 Poistenie zodpovednosti za škodu spôsobenú prevádzkou motorového vozidla; 60000000-8 Dopravné služby (bez prepravy odpadu)","Služba","","https://portal.eks.sk/SpravaKniznice/OpisneFormulareKniznice/VerejnyDetailOpisnehoFormularaKniznice/296672","1","0",
"OF-296674","Po karanténe","havarijné poistenie motorových vozidiel","poistenie","66514110-0 Poistenie motorových vozidiel","Služba","","https://portal.eks.sk/SpravaKniznice/OpisneFormulareKniznice/VerejnyDetailOpisnehoFormularaKniznice/296674","1","0",
"OF-296697","Po karanténe","Nákup 10 kusov mobilných telefónov Android","mobilný telefón,","32250000-0 Mobilné telefóny; 60000000-8 Dopravné služby (bez prepravy odpadu)","Tovar; Služba","","https://portal.eks.sk/SpravaKniznice/OpisneFormulareKniznice/VerejnyDetailOpisnehoFormularaKniznice/296697","1","0",
"OF-296699","Po karanténe","Špeciálne a bežné náterové hmoty, farby a riedidlá","Špeciálne a bežné náterové hmoty, farby a riedidlá","44810000-1 Náterové farby; 44812100-6 Emaily a glazúry; 44812310-1 Farby v súpravách; 44811000-8 Farba na vozovku; 44820000-4 Laky; 44800000-8 Náterové farby, laky a tmely; 44832200-3 Riedidlá; 60000000-8 Dopravné služby (bez prepravy odpadu)","Tovar; Služba","","https://portal.eks.sk/SpravaKniznice/OpisneFormulareKniznice/VerejnyDetailOpisnehoFormularaKniznice/296699","1","0",
"OF-296708","Po karanténe","Stavebné rezivo","Stavebné rezivo na stavbu altánku","03419000-0 Stavebné drevo/rezivo; 03419100-1 Výrobky zo stavebného dreva/reziva; 39142000-9 Záhradný nábytok; 60000000-8 Dopravné služby (bez prepravy odpadu)","Tovar; Služba","","https://portal.eks.sk/SpravaKniznice/OpisneFormulareKniznice/VerejnyDetailOpisnehoFormularaKniznice/296708","1","0",
"OF-295690","Po karanténe","Mobilný bubnový štiepkovač  ","drvič - štiepkovač   konárov s listami a ihličím,  drvič  - štiepkovač dreva,  drvič biologicky-rozložiteľného komunálneho odpadu,","43414000-8 Drviče; 34144700-5 Úžitkové vozidlá; 60000000-8 Dopravné služby (bez prepravy odpadu)","Tovar; Služba","","https://portal.eks.sk/SpravaKniznice/OpisneFormulareKniznice/VerejnyDetailOpisnehoFormularaKniznice/295690","0","0",
"OF-295692","Po karanténe","Ostatné interiérové vybavenie","Držiak na telefón , sušiak na ruky, dávkovač na mydlo","39712300-9 Prístroje na vysušovanie rúk; 39831700-3 Automatické dávkovače mydla; 30195800-0 Závesné vešiaky alebo držiaky; 39224340-3 Koše; 60000000-8 Dopravné služby (bez prepravy odpadu)","Tovar; Služba","","https://portal.eks.sk/SpravaKniznice/OpisneFormulareKniznice/VerejnyDetailOpisnehoFormularaKniznice/295692","1","1645.000",
"OF-295707","Po karanténe","Kancelársky papier A4, A5","Papier do fotokopírovacieho zariadenia, papier do tlačiarní","30197642-8 Papier na fotokopírovanie a xerografický papier; 60000000-8 Dopravné služby (bez prepravy odpadu)","Tovar; Služba","","https://portal.eks.sk/SpravaKniznice/OpisneFormulareKniznice/VerejnyDetailOpisnehoFormularaKniznice/295707","1","6082.500",
"OF-295709","Po karanténe","Multifunkčná 3D tlačiareň na báze FDM s dvoma extrudérmi","3D tlačiareň","42960000-3 Ovládací a riadiaci systém, tlačiarenské a grafické vybavenie, vybavenie na automatizáciu kancelárskych prác a spracovanie informácií; 60000000-8 Dopravné služby (bez prepravy odpadu)","Tovar; Služba","","https://portal.eks.sk/SpravaKniznice/OpisneFormulareKniznice/VerejnyDetailOpisnehoFormularaKniznice/295709","1","2166.000",
