"OpisnyFormularIdentifikator","OpisnyFormularStav","OpisnyFormularNazov","OpisnyFormularKlucoveSlova","OpisnyFormularCpv","OpisnyFormularDruh","OpisnyFormularKategoriaSluzieb","OpisnyFormularUrl","OpisnyFormularPocetVyhlasenychZakaziek","OpisnyFormularObchodovanaSumaBezDPH",
"OF-203879","Po karanténe","Diagnostiká","diagnostiká","33141625-7 Diagnostické súpravy; 33694000-1 Diagnostické činidlá; 60000000-8 Dopravné služby (bez prepravy odpadu)","Tovar; Služba","","https://portal.eks.sk/SpravaKniznice/OpisneFormulareKniznice/VerejnyDetailOpisnehoFormularaKniznice/203879","0","0",
"OF-204002","Po karanténe","Kancelárske vybavenie","rezačka, laminátor, laminovanie, fólia, strúhadlo na ceruzky","30191000-4 Kancelárske zariadenia s výnimkou nábytku; 60000000-8 Dopravné služby (bez prepravy odpadu); 31720000-9 Elektromechanické zariadenia","Tovar; Služba","","https://portal.eks.sk/SpravaKniznice/OpisneFormulareKniznice/VerejnyDetailOpisnehoFormularaKniznice/204002","1","390,830",
"OF-204150","Po karanténe","ľudský protrombínový komplex","B02BD01, ľudský protrombínový komplex, koagulačné faktory IX, II, VII a X, antihemoragiká","33621200-1 Antihemoragiká; 60000000-8 Dopravné služby (bez prepravy odpadu)","Tovar; Služba","","https://portal.eks.sk/SpravaKniznice/OpisneFormulareKniznice/VerejnyDetailOpisnehoFormularaKniznice/204150","1","0",
"OF-206446","Po karanténe","Kryoablačná sonda","sonda, kryoablačná sonda, chirurgická kryoablačná sonda, špeciálny zdravotnícky materiál","33100000-1 Zdravotnícke vybavenie; 33140000-3 Zdravotnícky spotrebný materiál; 33182300-2 Prístroje pre srdcovú chirurgiu; 60000000-8 Dopravné služby (bez prepravy odpadu)","Tovar; Služba","","https://portal.eks.sk/SpravaKniznice/OpisneFormulareKniznice/VerejnyDetailOpisnehoFormularaKniznice/206446","1","0",
"OF-207021","Po karanténe","Fakoemulzifikačný prístroj","fako a vitroretinálna chirurgia, očná mikrochirurgia, predný a zadný segment","33122000-1 Oftalmologické prístroje; 33162100-4 Prístroje operačnej sály; 60000000-8 Dopravné služby (bez prepravy odpadu)","Tovar; Služba","","https://portal.eks.sk/SpravaKniznice/OpisneFormulareKniznice/VerejnyDetailOpisnehoFormularaKniznice/207021","0","0",
"OF-207156","Po karanténe","Dodávanie tematického monitoringu médií","Monitoring médií, monitoring správ, on-line monitoring, mediálne výstupy, spracovanie dát, prepisy reportáží, monitorovanie verejných informačných zdrojov","79811000-2 Služby v oblasti digitálnej tlače; 92400000-5 Služby spravodajských agentúr; 72320000-4 Databázové služby; 72319000-4 Poskytovanie údajov; 72300000-8 Dátové služby","Služba","","https://portal.eks.sk/SpravaKniznice/OpisneFormulareKniznice/VerejnyDetailOpisnehoFormularaKniznice/207156","1","16080,000",
"OF-207258","Po karanténe","Laboratórne prístroje","prístroj, meranie, teplota, mikroskop, kamera, platnička, konzola, grafén,","38000000-5 Laboratórne, optické a presné prístroje a vybavenie (s výnimkou skiel); 38300000-8 Meracie prístroje; 38341000-7 Prístroje na meranie žiarenia; 60000000-8 Dopravné služby (bez prepravy odpadu)","Tovar; Služba","","https://portal.eks.sk/SpravaKniznice/OpisneFormulareKniznice/VerejnyDetailOpisnehoFormularaKniznice/207258","1","0",
"OF-207641","Po karanténe","Chlieb a pečivo","Chlieb, rožky, sendvič, vianočka, strúhanka, makovka, pečivo","15810000-9 Pekársky tovar, čerstvé pečivo a cukrárske výrobky; 15811100-7 Chlieb; 15811200-8 Rožky; 15811510-4 Sendviče; 15812100-4 Pečivo; 60000000-8 Dopravné služby (bez prepravy odpadu)","Tovar; Služba","","https://portal.eks.sk/SpravaKniznice/OpisneFormulareKniznice/VerejnyDetailOpisnehoFormularaKniznice/207641","0","0",
"OF-207671","Po karanténe","Ovocie a zelenina","ovocie, zelenina, banány, citrusové plody, jablká, hrušky, hrozno, slivky, brokolica, cibuľa, kaleráb, kapusta, paradajky, paprika, mrkva, šalát, zeler, zemiaky","03220000-9 Zelenina, ovocie a orechy; 03222200-5 Citrusové plody; 03222320-2 Jablká, hrušky a dule; 03222111-4 Banány; 03222340-8 Hrozno; 03222334-3 Slivky; 03221430-9 Brokolica; 03221113-1 Cibuľa; 03221410-3 Kapusta; 03221240-0 Paradajka; 15872100-2 Paprika; 60000000-8 Dopravné služby (bez prepravy odpadu)","Tovar; Služba","","https://portal.eks.sk/SpravaKniznice/OpisneFormulareKniznice/VerejnyDetailOpisnehoFormularaKniznice/207671","1","5032,000",
"OF-207723","Po karanténe","Základné potraviny","trvanlivé potraviny, lekvár, kompót, oleje, cestoviny, ryža, cukor, čaj,  chuťové prísady","15890000-3 Rôzne potravinové výrobky a sušený tovar; 15330000-0 Spracované ovocie a zelenina; 15332200-6 Džemy a marmelády, ovocné želé; ovocné alebo orechové pyré a pasty/pretlaky; 15612000-1 Obilná alebo rastlinná múka a príbuzné výrobky; 15411100-3 Rastlinné oleje; 15831000-2 Cukor; 03211300-6 Ryža; 15870000-7 Koreniny a chuťové prísady; 60000000-8 Dopravné služby (bez prepravy odpadu)","Tovar; Služba","","https://portal.eks.sk/SpravaKniznice/OpisneFormulareKniznice/VerejnyDetailOpisnehoFormularaKniznice/207723","1","0",
"OF-207762","Po karanténe","Mrazené potraviny a hydina","mrazená zelenina, mrazené výrobky, hydina","15896000-5 Hlboko zmrazené výrobky; 15331170-9 Mrazená zelenina; 15221000-3 Mrazené ryby; 15112000-6 Hydina; 60000000-8 Dopravné služby (bez prepravy odpadu)","Tovar; Služba","","https://portal.eks.sk/SpravaKniznice/OpisneFormulareKniznice/VerejnyDetailOpisnehoFormularaKniznice/207762","1","1137,500",
"OF-207788","Po karanténe","Mäso a mäsové výrobky","bravčové mäso, hovädzie mäso, hydinové mäso, mäsové výrobky","15100000-9 Živočíšne výrobky, mäso a mäsové výrobky; 15130000-8 Mäsové výrobky; 15113000-3 Bravčové mäso; 15111100-0 Hovädzie mäso; 15111200-1 Teľacie mäso; 60000000-8 Dopravné služby (bez prepravy odpadu); 15112000-6 Hydina","Tovar; Služba","","https://portal.eks.sk/SpravaKniznice/OpisneFormulareKniznice/VerejnyDetailOpisnehoFormularaKniznice/207788","1","0",
"OF-207789","Po karanténe","Základné potraviny a vajcia","trvanlivé potraviny, lekvár, kompót, oleje, cestoviny, ryža, cukor, čaj, vajcia, chuťové prísady","15890000-3 Rôzne potravinové výrobky a sušený tovar; 15330000-0 Spracované ovocie a zelenina; 15332200-6 Džemy a marmelády, ovocné želé; ovocné alebo orechové pyré a pasty/pretlaky; 15612000-1 Obilná alebo rastlinná múka a príbuzné výrobky; 15411100-3 Rastlinné oleje; 15831000-2 Cukor; 03211300-6 Ryža; 15870000-7 Koreniny a chuťové prísady; 60000000-8 Dopravné služby (bez prepravy odpadu)","Tovar; Služba","","https://portal.eks.sk/SpravaKniznice/OpisneFormulareKniznice/VerejnyDetailOpisnehoFormularaKniznice/207789","1","0",
"OF-207793","Po karanténe","Mlieko, mliečne výrobky a vajcia","mlieko, mliečne výrobky, smotana, tvaroh, syr, maslo, jogurt,vajcia","15511000-3 Mlieko; 15500000-3 Mliečne výrobky; 15551300-8 Jogurt; 15512000-0 Smotana; 15530000-2 Maslo; 15542200-1 Mäkký syr; 15544000-3 Tvrdý syr; 03142500-3 Vajcia; 60000000-8 Dopravné služby (bez prepravy odpadu)","Tovar; Služba","","https://portal.eks.sk/SpravaKniznice/OpisneFormulareKniznice/VerejnyDetailOpisnehoFormularaKniznice/207793","1","0",
"OF-207845","Po karanténe","Ovocie a zelenina","ovocie, zelenina, banány, citrusové plody, jablká, hrušky, hrozno, slivky, brokolica, cibuľa, kaleráb, kapusta, paradajky, paprika, mrkva, šalát, zeler, zemiaky","03220000-9 Zelenina, ovocie a orechy; 03222200-5 Citrusové plody; 03222320-2 Jablká, hrušky a dule; 03222111-4 Banány; 03222340-8 Hrozno; 03222334-3 Slivky; 03221430-9 Brokolica; 03221113-1 Cibuľa; 03221410-3 Kapusta; 03221240-0 Paradajka; 15872100-2 Paprika; 60000000-8 Dopravné služby (bez prepravy odpadu)","Tovar; Služba","","https://portal.eks.sk/SpravaKniznice/OpisneFormulareKniznice/VerejnyDetailOpisnehoFormularaKniznice/207845","1","0",
"OF-207853","Po karanténe","Mrazené potraviny, zelenina a ryby","mrazená zelenina, mrazené ryby, mrazená hydina","15896000-5 Hlboko zmrazené výrobky; 15331170-9 Mrazená zelenina; 15221000-3 Mrazené ryby; 60000000-8 Dopravné služby (bez prepravy odpadu)","Tovar; Služba","","https://portal.eks.sk/SpravaKniznice/OpisneFormulareKniznice/VerejnyDetailOpisnehoFormularaKniznice/207853","1","21041,670",
"OF-207860","Po karanténe","Mlieko a mliečne výrobky","mlieko, mliečne výrobky, smotana, tvaroh, syr, maslo, jogurt","15511000-3 Mlieko; 15500000-3 Mliečne výrobky; 15551300-8 Jogurt; 15512000-0 Smotana; 15530000-2 Maslo; 15542200-1 Mäkký syr; 15544000-3 Tvrdý syr; 60000000-8 Dopravné služby (bez prepravy odpadu)","Tovar; Služba","","https://portal.eks.sk/SpravaKniznice/OpisneFormulareKniznice/VerejnyDetailOpisnehoFormularaKniznice/207860","1","0",
"OF-207870","Po karanténe","Mäso a mäsové výrobky","bravčové mäso, hovädzie mäso, hydina, mäsové výrobky","15100000-9 Živočíšne výrobky, mäso a mäsové výrobky; 15113000-3 Bravčové mäso; 15111100-0 Hovädzie mäso; 15112000-6 Hydina; 15130000-8 Mäsové výrobky; 60000000-8 Dopravné služby (bez prepravy odpadu)","Tovar; Služba","","https://portal.eks.sk/SpravaKniznice/OpisneFormulareKniznice/VerejnyDetailOpisnehoFormularaKniznice/207870","1","0",
"OF-208023","Po karanténe","Podpora pre informačné technológie","podpora, údržba","72250000-2 Služby týkajúce sa podpory systému; 60000000-8 Dopravné služby (bez prepravy odpadu)","Služba","","https://portal.eks.sk/SpravaKniznice/OpisneFormulareKniznice/VerejnyDetailOpisnehoFormularaKniznice/208023","0","0",
"OF-208028","Po karanténe","Podpora pre úložiskovú infraštruktúru a monitorovací softvér","podpora, údržba","72253200-5 Systémové podporné služby; 60000000-8 Dopravné služby (bez prepravy odpadu)","Služba","","https://portal.eks.sk/SpravaKniznice/OpisneFormulareKniznice/VerejnyDetailOpisnehoFormularaKniznice/208028","0","0",
"OF-208030","Po karanténe","Podpora pre publikačný prezentačný systém a sieťové produkty","podpora, údržba","60000000-8 Dopravné služby (bez prepravy odpadu); 72261000-2 Softvérové podporné služby","Služba","","https://portal.eks.sk/SpravaKniznice/OpisneFormulareKniznice/VerejnyDetailOpisnehoFormularaKniznice/208030","0","0",
"OF-208034","Po karanténe","Podpora pre serverové produkty a vizualizačný nástroj","podpora, údržba","60000000-8 Dopravné služby (bez prepravy odpadu); 72267000-4 Služby na údržbu a opravu softvéru","Služba","","https://portal.eks.sk/SpravaKniznice/OpisneFormulareKniznice/VerejnyDetailOpisnehoFormularaKniznice/208034","0","0",
"OF-208037","Po karanténe","Podpora pre archivačnú infraštruktúru, výpočtovú infraštruktúru  a nástroja pre zber a spracovanie","podpora, údržba","50324100-3 Údržba systémov; 60000000-8 Dopravné služby (bez prepravy odpadu)","Služba","","https://portal.eks.sk/SpravaKniznice/OpisneFormulareKniznice/VerejnyDetailOpisnehoFormularaKniznice/208037","0","0",
"OF-208139","Po karanténe","Zdravotnícka obuv","zdravotná obuv, operačná obuv","18830000-6 Ochranná obuv; 60000000-8 Dopravné služby (bez prepravy odpadu)","Tovar; Služba","","https://portal.eks.sk/SpravaKniznice/OpisneFormulareKniznice/VerejnyDetailOpisnehoFormularaKniznice/208139","0","0",
"OF-208254","Po karanténe","NGS sekvenačná chémia a kity na stanovenie HLA","NGS, HLA typizácia, sekvenovanie","33141625-7 Diagnostické súpravy; 60000000-8 Dopravné služby (bez prepravy odpadu); 33696500-0 Laboratórne činidlá","Tovar; Služba","","https://portal.eks.sk/SpravaKniznice/OpisneFormulareKniznice/VerejnyDetailOpisnehoFormularaKniznice/208254","0","0",
"OF-208468","Po karanténe","Elektronika - časť 1.","televízor, TV anténa, držiak na TV, chladnička, umývačka riadu, mikrovlná rúra, rýchlovarná kanvica, osobná váha","32324100-1 Farebné televízory; 32324400-4 Televízne antény; 39711130-9 Chladničky; 39713100-4 Umývačky riadu; 39711362-4 Mikrovlné rúry; 60000000-8 Dopravné služby (bez prepravy odpadu)","Tovar; Služba","","https://portal.eks.sk/SpravaKniznice/OpisneFormulareKniznice/VerejnyDetailOpisnehoFormularaKniznice/208468","0","0",
"OF-208478","Po karanténe","Elektronika - časť 2.","chladnička","39711130-9 Chladničky; 60000000-8 Dopravné služby (bez prepravy odpadu)","Tovar; Služba","","https://portal.eks.sk/SpravaKniznice/OpisneFormulareKniznice/VerejnyDetailOpisnehoFormularaKniznice/208478","0","0",
"OF-208485","Po karanténe","Elektronika - časť 3.","chladnička","39711130-9 Chladničky; 60000000-8 Dopravné služby (bez prepravy odpadu)","Tovar; Služba","","https://portal.eks.sk/SpravaKniznice/OpisneFormulareKniznice/VerejnyDetailOpisnehoFormularaKniznice/208485","0","0",
"OF-208510","Po karanténe","Plastové kontajnery  (HDPE) na separovaný zber - 1100 litrov  na zber plastov, Plastové kontajnery  (HDPE) na separovaný zber - 1100 litrov  na zber papiera, plastový kontajner  - 1100 l na zber komunálneho odpadu, smetné nádoby (štvorcové) 120 l čierne  ","kontajnery plastové, separovaný zber, papier, modrá, žltá,","34928480-6 Kontajnery a nádoby na odpad a odpadky; 60000000-8 Dopravné služby (bez prepravy odpadu)","Tovar; Služba","","https://portal.eks.sk/SpravaKniznice/OpisneFormulareKniznice/VerejnyDetailOpisnehoFormularaKniznice/208510","1","35760,000",
"OF-208523","Po karanténe","Kancelárske potreby pre mestský úrad, zariadenie starostlivosti o deti do troch rokov veku dieťaťa a denné centrum seniorov","kancelárske potreby, detské šarkany, bambusové fakle","30192000-1 Kancelárske potreby; 60000000-8 Dopravné služby (bez prepravy odpadu)","Tovar; Služba","","https://portal.eks.sk/SpravaKniznice/OpisneFormulareKniznice/VerejnyDetailOpisnehoFormularaKniznice/208523","1","3199,450",
"OF-208595","Po karanténe","Sieťové firewally, podpora a licencie pre bezpečnostné funkcie sieťových firewallov - 1.","podpora funkcionality firewallov zabezpečujúcich ochranu lokálnej sieťovej infraštruktúry","72250000-2 Služby týkajúce sa podpory systému; 72710000-0 Služby pre lokálne siete LAN; 60000000-8 Dopravné služby (bez prepravy odpadu)","Služba","","https://portal.eks.sk/SpravaKniznice/OpisneFormulareKniznice/VerejnyDetailOpisnehoFormularaKniznice/208595","1","0",
"OF-208646","Po karanténe","Uzavretý odberový systém krvi","Vákuový-aspiračný systém, skrutkový uzáver, európske farebné značenie","33192500-7 Skúmavky; 33140000-3 Zdravotnícky spotrebný materiál; 60000000-8 Dopravné služby (bez prepravy odpadu)","Tovar; Služba","","https://portal.eks.sk/SpravaKniznice/OpisneFormulareKniznice/VerejnyDetailOpisnehoFormularaKniznice/208646","0","0",
"OF-208678","Po karanténe","Stravné poukážky","zabezpečenie stravovania v zmluvných stravovacích zariadeniach , stravné poukážky, dodanie stravných poukážok,","55520000-1 Služby hromadného stravovania; 30199770-8 Stravné poukážky; 60000000-8 Dopravné služby (bez prepravy odpadu)","Služba; Tovar","","https://portal.eks.sk/SpravaKniznice/OpisneFormulareKniznice/VerejnyDetailOpisnehoFormularaKniznice/208678","0","0",
"OF-208707","Po karanténe","Mlieko, mliečne výrobky ","mlieko, mliečne výrobky, smotana, tvaroh, syr, maslo, jogurt","15511000-3 Mlieko; 15500000-3 Mliečne výrobky; 15551300-8 Jogurt; 15512000-0 Smotana; 15530000-2 Maslo; 15542200-1 Mäkký syr; 15544000-3 Tvrdý syr; 60000000-8 Dopravné služby (bez prepravy odpadu)","Tovar; Služba","","https://portal.eks.sk/SpravaKniznice/OpisneFormulareKniznice/VerejnyDetailOpisnehoFormularaKniznice/208707","1","0",
"OF-208721","Po karanténe","Mrazené ryby ","mrazené ryby","15896000-5 Hlboko zmrazené výrobky; 15221000-3 Mrazené ryby; 60000000-8 Dopravné služby (bez prepravy odpadu)","Tovar; Služba","","https://portal.eks.sk/SpravaKniznice/OpisneFormulareKniznice/VerejnyDetailOpisnehoFormularaKniznice/208721","1","0",
"OF-208724","Po karanténe","Mrazené potraviny a hydina","mrazené potraviny a hydina","15896000-5 Hlboko zmrazené výrobky; 15331170-9 Mrazená zelenina; 15112000-6 Hydina; 60000000-8 Dopravné služby (bez prepravy odpadu)","Tovar; Služba","","https://portal.eks.sk/SpravaKniznice/OpisneFormulareKniznice/VerejnyDetailOpisnehoFormularaKniznice/208724","1","0",
"OF-208728","Po karanténe","Základné potraviny a vajcia","trvanlivé potraviny, lekvár, kompót, oleje, cestoviny, ryža, cukor, čaj, vajcia, chuťové prísady","15890000-3 Rôzne potravinové výrobky a sušený tovar; 15330000-0 Spracované ovocie a zelenina; 15332200-6 Džemy a marmelády, ovocné želé; ovocné alebo orechové pyré a pasty/pretlaky; 15612000-1 Obilná alebo rastlinná múka a príbuzné výrobky; 15411100-3 Rastlinné oleje; 15831000-2 Cukor; 03211300-6 Ryža; 15870000-7 Koreniny a chuťové prísady; 03142500-3 Vajcia; 60000000-8 Dopravné služby (bez prepravy odpadu)","Tovar; Služba","","https://portal.eks.sk/SpravaKniznice/OpisneFormulareKniznice/VerejnyDetailOpisnehoFormularaKniznice/208728","1","0",
"OF-208733","Po karanténe","Mrazené ryby","mrazené ryby","15896000-5 Hlboko zmrazené výrobky; 15221000-3 Mrazené ryby; 60000000-8 Dopravné služby (bez prepravy odpadu)","Tovar; Služba","","https://portal.eks.sk/SpravaKniznice/OpisneFormulareKniznice/VerejnyDetailOpisnehoFormularaKniznice/208733","1","2000,000",
"OF-208783","Po karanténe","makadam, železiarsky materiál","makadam, železiarsky materiál","44113000-5 Cestný stavebný materiál; 44316000-8 Železiarsky tovar; 60000000-8 Dopravné služby (bez prepravy odpadu)","Tovar; Služba","","https://portal.eks.sk/SpravaKniznice/OpisneFormulareKniznice/VerejnyDetailOpisnehoFormularaKniznice/208783","1","648,000",
"OF-208793","Po karanténe","Drobné kancelárske potreby, ","Euroobaly, spinky, šanóny, rýchloviazače, perá, obálky","30190000-7 Rôzne kancelárske zariadenia a kancelárske potreby; 30197000-6 Drobné kancelárske vybavenie; 60000000-8 Dopravné služby (bez prepravy odpadu); 30192121-5 Guľôčkové perá; 39241200-5 Nožnice; 30192800-9 Samolepiace etikety; 30199230-1 Obálky","Tovar; Služba","","https://portal.eks.sk/SpravaKniznice/OpisneFormulareKniznice/VerejnyDetailOpisnehoFormularaKniznice/208793","1","1498,330",
"OF-208808","Po karanténe","Počítače All In One, Microsoft Office 2019","Počítače All In One, Microsoft Office 2019","30213000-5 Osobné počítače; 30213300-8 Stolový počítač; 60000000-8 Dopravné služby (bez prepravy odpadu); 48300000-1 Softvérový balík na vytváranie dokumentov, kreslenie, vytváranie obrázkov, harmonogramov a zlepšovanie produktivity","Tovar; Služba","","https://portal.eks.sk/SpravaKniznice/OpisneFormulareKniznice/VerejnyDetailOpisnehoFormularaKniznice/208808","1","10374,170",
"OF-208853","Po karanténe","Kontrola a čistenie komínov a dymovodov - západ","kontrola komínov, čistenie komínov","98112000-1 Služby poskytované profesijnými organizáciami","Služba","","https://portal.eks.sk/SpravaKniznice/OpisneFormulareKniznice/VerejnyDetailOpisnehoFormularaKniznice/208853","0","0",
"OF-208859","Po karanténe","Ovocie a zelenina","ovocie, zelenina, banány, citrusové plody, jablká, hrušky, hrozno, slivky, brokolica, cibuľa, kaleráb, kapusta, paradajky, paprika, mrkva, šalát, zeler, zemiaky","03220000-9 Zelenina, ovocie a orechy; 03222200-5 Citrusové plody; 03222320-2 Jablká, hrušky a dule; 03222111-4 Banány; 03222340-8 Hrozno; 03222334-3 Slivky; 03221430-9 Brokolica; 03221113-1 Cibuľa; 03221410-3 Kapusta; 03221240-0 Paradajka; 15872100-2 Paprika; 60000000-8 Dopravné služby (bez prepravy odpadu)","Tovar; Služba","","https://portal.eks.sk/SpravaKniznice/OpisneFormulareKniznice/VerejnyDetailOpisnehoFormularaKniznice/208859","1","0",
"OF-208886","Po karanténe","Základné potraviny a vajcia","trvanlivé potraviny, lekvár, kompót, oleje, cestoviny, ryža, cukor, čaj, vajcia, orechy, huby, chuťové prísady","15890000-3 Rôzne potravinové výrobky a sušený tovar; 15330000-0 Spracované ovocie a zelenina; 15332200-6 Džemy a marmelády, ovocné želé; ovocné alebo orechové pyré a pasty/pretlaky; 15612000-1 Obilná alebo rastlinná múka a príbuzné výrobky; 15411100-3 Rastlinné oleje; 15831000-2 Cukor; 03211300-6 Ryža; 15870000-7 Koreniny a chuťové prísady; 03142500-3 Vajcia; 03221260-6 Huby; 60000000-8 Dopravné služby (bez prepravy odpadu)","Tovar; Služba","","https://portal.eks.sk/SpravaKniznice/OpisneFormulareKniznice/VerejnyDetailOpisnehoFormularaKniznice/208886","1","0",
"OF-208896","Po karanténe","Dodávka čistiacich prostriedkov","Čistiace prostriedky","39800000-0 Čistiace a leštiace výrobky; 39830000-9 Čistiace výrobky; 60000000-8 Dopravné služby (bez prepravy odpadu)","Tovar; Služba","","https://portal.eks.sk/SpravaKniznice/OpisneFormulareKniznice/VerejnyDetailOpisnehoFormularaKniznice/208896","0","0",
"OF-208909","Po karanténe","Výpočtová technika a jej komponenty","výpočtová technika, stolový počítač, notebook, monitor, desktop","30200000-1 Počítačové zariadenia a spotrebný materiál; 60000000-8 Dopravné služby (bez prepravy odpadu)","Tovar; Služba","","https://portal.eks.sk/SpravaKniznice/OpisneFormulareKniznice/VerejnyDetailOpisnehoFormularaKniznice/208909","1","155900,000",
"OF-208923","Po karanténe","Nábytkové a spojovacie kovanie, výsuvy, zámky  ","nábytkové závesy, zásuvkové výsuvy,dverové kovanie, dverové zámky, spojovacie kovanie","44523000-2 Pánty, kovanie a drobné príslušenstvo; 44521110-2 Dverové zámky; 44531100-2 Skrutky do dreva; 60000000-8 Dopravné služby (bez prepravy odpadu)","Tovar; Služba","","https://portal.eks.sk/SpravaKniznice/OpisneFormulareKniznice/VerejnyDetailOpisnehoFormularaKniznice/208923","1","4416,670",
"OF-208930","Po karanténe","Poskytovanie technickej podpory pre monitorovací systém pre bezpečnosť počítačových sietí založený na dátových tokoch a analýze chovania siete Flowmon","technická podpora, podpora, dáta, toky, siete, počítačová sieť, bezpečnosť, Flowmon, sieť, dátové toky, systém, monitorovací systém","72261000-2 Softvérové podporné služby; 72267100-0 Údržba programového vybavenia (softvér) informačných technológií; 72267000-4 Služby na údržbu a opravu softvéru; 48000000-8 Softvérové balíky a informačné systémy","Služba","","https://portal.eks.sk/SpravaKniznice/OpisneFormulareKniznice/VerejnyDetailOpisnehoFormularaKniznice/208930","0","0",
"OF-208932","Po karanténe","Ovocie a zelenina ","ovocie, zelenina, banány, citrusové plody, jablká, hrušky, hrozno, slivky, brokolica, cibuľa, kaleráb, kapusta, paradajky, paprika, mrkva, šalát, zeler, zemiaky","03220000-9 Zelenina, ovocie a orechy; 03222200-5 Citrusové plody; 03222320-2 Jablká, hrušky a dule; 03222111-4 Banány; 03222340-8 Hrozno; 03222334-3 Slivky; 03221430-9 Brokolica; 03221113-1 Cibuľa; 03221410-3 Kapusta; 03221240-0 Paradajka; 15872100-2 Paprika; 60000000-8 Dopravné služby (bez prepravy odpadu)","Tovar; Služba","","https://portal.eks.sk/SpravaKniznice/OpisneFormulareKniznice/VerejnyDetailOpisnehoFormularaKniznice/208932","1","0",
"OF-208947","Po karanténe","Kancelárske potreby","kancelárske,potreby","22816000-3 Bloky; 22830000-7 Zošity; 22851000-0 Rýchloviazače; 30124510-2 Popisovače; 30192000-1 Kancelárske potreby; 30197300-9 Otvárače listov, zošívačky a dierovače; 30199760-5 Etikety; 30199230-1 Obálky; 60000000-8 Dopravné služby (bez prepravy odpadu)","Tovar","","https://portal.eks.sk/SpravaKniznice/OpisneFormulareKniznice/VerejnyDetailOpisnehoFormularaKniznice/208947","1","9599,000",
"OF-208951","Po karanténe","Mäso a mäsové výrobky","bravčové mäso, hovädzie mäso, hydina, mäsové výrobky","15100000-9 Živočíšne výrobky, mäso a mäsové výrobky; 15113000-3 Bravčové mäso; 15111100-0 Hovädzie mäso; 15112000-6 Hydina; 15130000-8 Mäsové výrobky; 60000000-8 Dopravné služby (bez prepravy odpadu)","Tovar; Služba","","https://portal.eks.sk/SpravaKniznice/OpisneFormulareKniznice/VerejnyDetailOpisnehoFormularaKniznice/208951","1","0",
"OF-208956","Po karanténe","Mrazené potraviny, ryby a hydina","mrazené potraviny, ryby, hydina","15896000-5 Hlboko zmrazené výrobky; 15331170-9 Mrazená zelenina; 15221000-3 Mrazené ryby; 15112000-6 Hydina; 60000000-8 Dopravné služby (bez prepravy odpadu)","Tovar; Služba","","https://portal.eks.sk/SpravaKniznice/OpisneFormulareKniznice/VerejnyDetailOpisnehoFormularaKniznice/208956","1","0",
"OF-208959","Po karanténe","Mlieko a mliečne výrobky","mlieko, mliečne výrobky, smotana, tvaroh, syr, maslo, jogurt","15511000-3 Mlieko; 15500000-3 Mliečne výrobky; 15551300-8 Jogurt; 15512000-0 Smotana; 15530000-2 Maslo; 15542200-1 Mäkký syr; 15544000-3 Tvrdý syr; 60000000-8 Dopravné služby (bez prepravy odpadu)","Tovar; Služba","","https://portal.eks.sk/SpravaKniznice/OpisneFormulareKniznice/VerejnyDetailOpisnehoFormularaKniznice/208959","1","0",
"OF-208962","Po karanténe","Ročná podpora zariadení HP ","HP","60000000-8 Dopravné služby (bez prepravy odpadu); 72700000-7 Služby pre počítačové siete; 72710000-0 Služby pre lokálne siete LAN","Služba","","https://portal.eks.sk/SpravaKniznice/OpisneFormulareKniznice/VerejnyDetailOpisnehoFormularaKniznice/208962","0","0",
"OF-208974","Po karanténe","Osobné motorové vozidlo","osobné motorové vozidlo, zážihový motor s priamym vstrekovaním paliva , karoséria SUV,  COMBI","34100000-8 Motorové vozidlá; 34110000-1 Osobné automobily","Tovar; Služba","","https://portal.eks.sk/SpravaKniznice/OpisneFormulareKniznice/VerejnyDetailOpisnehoFormularaKniznice/208974","1","51000,000",
