"OpisnyFormularIdentifikator","OpisnyFormularStav","OpisnyFormularNazov","OpisnyFormularKlucoveSlova","OpisnyFormularCpv","OpisnyFormularDruh","OpisnyFormularKategoriaSluzieb","OpisnyFormularUrl","OpisnyFormularPocetVyhlasenychZakaziek","OpisnyFormularObchodovanaSumaBezDPH",
"OF-199168","Po karanténe","Dodávka a montáž laboratórneho nábytku_4","laboratórny stôl, laboratórna stolička, bezpečnostná skriňa, mobilné laboratórne pracovisko","39180000-7 Laboratórny nábytok; 60000000-8 Dopravné služby (bez prepravy odpadu)","Tovar; Služba","","https://portal.eks.sk/SpravaKniznice/OpisneFormulareKniznice/VerejnyDetailOpisnehoFormularaKniznice/199168","1","0",
"OF-208079","Po karanténe","Združená dodávka plynu","dodávka zemného plynu, preprava a distribúcia","09123000-7 Zemný plyn; 65200000-5 Rozvod plynu a súvisiace služby","Tovar; Služba","","https://portal.eks.sk/SpravaKniznice/OpisneFormulareKniznice/VerejnyDetailOpisnehoFormularaKniznice/208079","1","31416,670",
"OF-208082","Po karanténe","Združená dodávka elektrickej energie","dodávka elektrickej energie, distribúcia","09310000-5 Elektrická energia; 65300000-6 Rozvod elektriny a súvisiace služby","Tovar; Služba","","https://portal.eks.sk/SpravaKniznice/OpisneFormulareKniznice/VerejnyDetailOpisnehoFormularaKniznice/208082","0","0",
"OF-208128","Po karanténe","Odberová stolička, laboratórna stolička, zdravotnícka stolička, lekárska stolička, kreslo na kolieskach, zdravotnícke kreslo, stolička k mikroskopu, kreslo na 24-hodinové sedenie","Kreslo s opierkami rúk, špecializovaná stolička","33192000-2 Zdravotnícky nábytok; 39111100-4 Otočné sedadlá; 39112000-0 Stoličky; 39113100-8 Kreslá","Tovar; Služba","","https://portal.eks.sk/SpravaKniznice/OpisneFormulareKniznice/VerejnyDetailOpisnehoFormularaKniznice/208128","1","0",
"OF-208878","Po karanténe","Odberové vaky - štvorvaky na krv, vrátane prenájmu odberových váh","vaky na krv, štvorvaky na krv,","33141613-0 Vaky na krv; 33194210-1 Prístroje na transfúziu krvi; 60000000-8 Dopravné služby (bez prepravy odpadu)","Tovar","","https://portal.eks.sk/SpravaKniznice/OpisneFormulareKniznice/VerejnyDetailOpisnehoFormularaKniznice/208878","1","211290,000",
"OF-209694","Po karanténe","Odvoz a likvidácia nemocničného odpadu zo zdravotnej starostlivosti","Nemocničný odpad, nebezpečný odpad, odvoz odpadu, likvidácia odpadu, služby","90524400-0 Zber, doprava a likvidácia nemocničného odpadu; 90520000-8 Služby súvisiace s rádioaktívnym, toxickým, zdravotníckym a nebezpečným odpadom","Služba","","https://portal.eks.sk/SpravaKniznice/OpisneFormulareKniznice/VerejnyDetailOpisnehoFormularaKniznice/209694","0","0",
"OF-209717","Po karanténe","Dodávka a montáž nábytku v jazykovej učebni a v knižnici_5","katedra učiteľa, kancelárska pracovná stolička, žiacky stôl, stolička/taburet pre žiaka","39000000-2 Nábytok (vrátane kancelárskeho nábytku), zariadenie interiéru, domáce spotrebiče (s výnimkou osvetlenia) a čistiace prostriedky; 60000000-8 Dopravné služby (bez prepravy odpadu)","Tovar; Služba","","https://portal.eks.sk/SpravaKniznice/OpisneFormulareKniznice/VerejnyDetailOpisnehoFormularaKniznice/209717","1","0",
"OF-209719","Po karanténe","Dodávka a montáž nábytku do jazykovej učebne_1","katedra učiteľa, kancelárska pracovná stolička, žiacky stôl, stolička/taburet pre žiaka","39000000-2 Nábytok (vrátane kancelárskeho nábytku), zariadenie interiéru, domáce spotrebiče (s výnimkou osvetlenia) a čistiace prostriedky; 60000000-8 Dopravné služby (bez prepravy odpadu)","Tovar; Služba","","https://portal.eks.sk/SpravaKniznice/OpisneFormulareKniznice/VerejnyDetailOpisnehoFormularaKniznice/209719","1","0",
"OF-210398","Po karanténe","Chladnička, mikrosystém audio a iné elektrospotrebiče","espresso kávovar, chladnička, ventilátor","39710000-2 Elektrické prístroje pre domácnosť; 60000000-8 Dopravné služby (bez prepravy odpadu)","Tovar; Služba","","https://portal.eks.sk/SpravaKniznice/OpisneFormulareKniznice/VerejnyDetailOpisnehoFormularaKniznice/210398","1","0",
"OF-210802","Po karanténe","Kancelárske potreby","kancelárske potreby","30192000-1 Kancelárske potreby; 60000000-8 Dopravné služby (bez prepravy odpadu)","Tovar; Služba","","https://portal.eks.sk/SpravaKniznice/OpisneFormulareKniznice/VerejnyDetailOpisnehoFormularaKniznice/210802","1","839,000",
"OF-210808","Po karanténe","Notebooky","prenosný osobný počítač","30213100-6 Prenosné počítače; 60000000-8 Dopravné služby (bez prepravy odpadu)","Tovar; Služba","","https://portal.eks.sk/SpravaKniznice/OpisneFormulareKniznice/VerejnyDetailOpisnehoFormularaKniznice/210808","1","2319,000",
"OF-210850","Po karanténe","Nákup kancelárskeho papiera","papier na fotokopírovanie","30197643-5 Papier na fotokopírovanie; 30197630-1 Papier na tlač alebo iné grafické účely; 60000000-8 Dopravné služby (bez prepravy odpadu)","Tovar; Služba","","https://portal.eks.sk/SpravaKniznice/OpisneFormulareKniznice/VerejnyDetailOpisnehoFormularaKniznice/210850","1","0",
"OF-210955","Po karanténe","Pozáručný servis, opravy, kontroly, odborné prehliadky a skúšky systémov elektrickej požiarnej signalizácie","servis, oprava, kontrola, odborná prehliadka, odborná skúška, EPS, elektrická požiarna signalizácia","50413200-5 Opravy a údržba protipožiarnych zariadení; 31625100-4 Systémy na detekciu požiarov; 60000000-8 Dopravné služby (bez prepravy odpadu)","Služba","","https://portal.eks.sk/SpravaKniznice/OpisneFormulareKniznice/VerejnyDetailOpisnehoFormularaKniznice/210955","1","31500,000",
"OF-211017","Po karanténe","Chirurgicko-laparoskopická operačná zostava","Operačná veža, operačná vizualizácia, Videoendoskopická zostava, laparoskopická kamera, laparoskopická kamerová hlavica, optika, svet. kábel, laparoskopický svetelný zdroj","33162100-4 Prístroje operačnej sály; 33168100-6 Endoskopy; 60000000-8 Dopravné služby (bez prepravy odpadu)","Tovar; Služba","","https://portal.eks.sk/SpravaKniznice/OpisneFormulareKniznice/VerejnyDetailOpisnehoFormularaKniznice/211017","0","0",
"OF-211093","Po karanténe","Agrochemikálie k projektu","agrochemikálie","24450000-3 Agrochemikálie; 60000000-8 Dopravné služby (bez prepravy odpadu)","Tovar; Služba","","https://portal.eks.sk/SpravaKniznice/OpisneFormulareKniznice/VerejnyDetailOpisnehoFormularaKniznice/211093","1","2304,000",
"OF-211096","Po karanténe","Hnojivá k projektu","Hnojivá, dusíkaté hnojivo, kombinované hnojivo","24440000-0 Rôzne hnojivá; 60000000-8 Dopravné služby (bez prepravy odpadu)","Tovar; Služba","","https://portal.eks.sk/SpravaKniznice/OpisneFormulareKniznice/VerejnyDetailOpisnehoFormularaKniznice/211096","0","0",
"OF-211130","Po karanténe","Dodávka a montáž nábytku do jazykovej učebne_6","katedra učiteľa, kancelárska pracovná stolička, žiacky stôl, stolička/taburet pre žiaka","39000000-2 Nábytok (vrátane kancelárskeho nábytku), zariadenie interiéru, domáce spotrebiče (s výnimkou osvetlenia) a čistiace prostriedky; 60000000-8 Dopravné služby (bez prepravy odpadu)","Tovar; Služba","","https://portal.eks.sk/SpravaKniznice/OpisneFormulareKniznice/VerejnyDetailOpisnehoFormularaKniznice/211130","1","0",
"OF-211139","Po karanténe","Laboratórny nábytok a vybavenie - 1. časť","Laboratórne vybavenie","38000000-5 Laboratórne, optické a presné prístroje a vybavenie (s výnimkou skiel); 60000000-8 Dopravné služby (bez prepravy odpadu)","Tovar; Služba","","https://portal.eks.sk/SpravaKniznice/OpisneFormulareKniznice/VerejnyDetailOpisnehoFormularaKniznice/211139","0","0",
"OF-211218","Po karanténe","Základné potraviny","trvanlivé potraviny, lekvár, kompót, oleje, cestoviny, ryža, cukor, čaj, vajcia, chuťové prísady","15890000-3 Rôzne potravinové výrobky a sušený tovar; 15330000-0 Spracované ovocie a zelenina; 15332200-6 Džemy a marmelády, ovocné želé; ovocné alebo orechové pyré a pasty/pretlaky; 15612000-1 Obilná alebo rastlinná múka a príbuzné výrobky; 15411100-3 Rastlinné oleje; 15831000-2 Cukor; 03211300-6 Ryža; 15870000-7 Koreniny a chuťové prísady; 60000000-8 Dopravné služby (bez prepravy odpadu)","Tovar; Služba","","https://portal.eks.sk/SpravaKniznice/OpisneFormulareKniznice/VerejnyDetailOpisnehoFormularaKniznice/211218","1","0",
"OF-211233","Po karanténe","Mrazené potraviny","mrazená zelenina, mrazené ryby, mrazená hydina","15896000-5 Hlboko zmrazené výrobky; 15331170-9 Mrazená zelenina; 15221000-3 Mrazené ryby; 60000000-8 Dopravné služby (bez prepravy odpadu)","Tovar; Služba","","https://portal.eks.sk/SpravaKniznice/OpisneFormulareKniznice/VerejnyDetailOpisnehoFormularaKniznice/211233","1","13566,670",
"OF-211284","Po karanténe"," Laserové tlačiarne, ","informatika","30232110-8 Laserové tlačiarne; 30237460-1 Počítačové klávesnice; 60000000-8 Dopravné služby (bez prepravy odpadu)","Tovar; Služba","","https://portal.eks.sk/SpravaKniznice/OpisneFormulareKniznice/VerejnyDetailOpisnehoFormularaKniznice/211284","1","390,830",
"OF-211300","Po karanténe","Kancelársky počítač","Počítač, desktop","30213300-8 Stolový počítač; 60000000-8 Dopravné služby (bez prepravy odpadu)","Tovar; Služba","","https://portal.eks.sk/SpravaKniznice/OpisneFormulareKniznice/VerejnyDetailOpisnehoFormularaKniznice/211300","1","0",
"OF-211438","Po karanténe","Pneumatiky letné","Pneumatiky letné","34350000-5 Pneumatiky na ľahkú záťaž a pneumatiky na vysokú záťaž; 34351100-3 Pneumatiky pre motorové vozidlá; 34351000-2 Pneumatiky na ľahkú záťaž; 34352000-9 Pneumatiky na vysokú záťaž; 60000000-8 Dopravné služby (bez prepravy odpadu)","Tovar; Služba","","https://portal.eks.sk/SpravaKniznice/OpisneFormulareKniznice/VerejnyDetailOpisnehoFormularaKniznice/211438","1","1080,000",
"OF-211466","Po karanténe","Nákup a dodávka kancelárskych potrieb","kancelárske potreby","30192000-1 Kancelárske potreby; 60000000-8 Dopravné služby (bez prepravy odpadu)","Tovar; Služba","","https://portal.eks.sk/SpravaKniznice/OpisneFormulareKniznice/VerejnyDetailOpisnehoFormularaKniznice/211466","0","0",
"OF-211481","Po karanténe","Právny informačný systém","informačný systém,  právny IS","79140000-7 Právne poradenstvo a informačné služby; 64216200-5 Elektronické informácie; 72600000-6 Počítačové podporné služby a poradenstvo","Služba","","https://portal.eks.sk/SpravaKniznice/OpisneFormulareKniznice/VerejnyDetailOpisnehoFormularaKniznice/211481","1","0",
"OF-211501","Po karanténe","Diagnostiká","diagnostiká","33141625-7 Diagnostické súpravy; 33694000-1 Diagnostické činidlá; 60000000-8 Dopravné služby (bez prepravy odpadu)","Tovar; Služba","","https://portal.eks.sk/SpravaKniznice/OpisneFormulareKniznice/VerejnyDetailOpisnehoFormularaKniznice/211501","1","1325,000",
"OF-211517","Po karanténe","Ochrana budovy","strážna služba, ochrana budovy, revízia, servis a opravy technického zariadenia","79713000-5 Strážne služby; 60000000-8 Dopravné služby (bez prepravy odpadu)","Služba","","https://portal.eks.sk/SpravaKniznice/OpisneFormulareKniznice/VerejnyDetailOpisnehoFormularaKniznice/211517","0","0",
"OF-211522","Po karanténe","Upgrade telekomunikačných systémov","Upgrade, telekomunikácie, systém","32524000-2 Telekomunikačný systém; 32552100-8 Telefónne prístroje; 32520000-4 Telekomunikačné káble a zariadenia; 72263000-6 Implementácia softvéru; 72265000-0 Konfigurovanie softvéru; 50312600-1 Údržba a opravy zariadení informačných technológií","Tovar; Služba","","https://portal.eks.sk/SpravaKniznice/OpisneFormulareKniznice/VerejnyDetailOpisnehoFormularaKniznice/211522","1","205900,000",
"OF-211580","Po karanténe","Zabezpečenie služieb SW podpory zariadení dátovej sály ","podpora, SW podpora, softvérová podpora, softvér","72611000-6 Technické počítačové podporné služby","Služba","","https://portal.eks.sk/SpravaKniznice/OpisneFormulareKniznice/VerejnyDetailOpisnehoFormularaKniznice/211580","0","0",
"OF-211598","Po karanténe","Zabezpečenie služieb HW podpory zariadení dátovej sály ","Hardvérové komponenty, výmena, pozáručný servis","71356300-1 Technická podpora","Služba","","https://portal.eks.sk/SpravaKniznice/OpisneFormulareKniznice/VerejnyDetailOpisnehoFormularaKniznice/211598","0","0",
"OF-211605","Po karanténe","Tonery, spotrebný materiál","Tonerové náplne, atramentové náplne, spotrebný materiál","30125100-2 Tonerové náplne; 30125110-5 Toner do laserových tlačiarní/faxových prístrojov; 30192113-6 Atramentové náplne; 90510000-5 Likvidácia a spracovanie odpadu; 60000000-8 Dopravné služby (bez prepravy odpadu); 30125120-8 Toner do fotokopírovacích strojov; 30192400-5 Reprografický spotrebný materiál","Tovar; Služba","","https://portal.eks.sk/SpravaKniznice/OpisneFormulareKniznice/VerejnyDetailOpisnehoFormularaKniznice/211605","0","0",
"OF-211610","Po karanténe","Pranie a chemické čistenie - Liptovský Mikuláš","pranie a chemické čistenie","98310000-9 Pranie a chemické čistenie; 60000000-8 Dopravné služby (bez prepravy odpadu)","Služba","","https://portal.eks.sk/SpravaKniznice/OpisneFormulareKniznice/VerejnyDetailOpisnehoFormularaKniznice/211610","1","807,500",
"OF-211647","Po karanténe","Kancelársky papier (xerografický) A5, A4, A3 biely","Papier na fotokopírovanie a xerografický papier A5, A4, A3","30197642-8 Papier na fotokopírovanie a xerografický papier; 60000000-8 Dopravné služby (bez prepravy odpadu)","Tovar; Služba","","https://portal.eks.sk/SpravaKniznice/OpisneFormulareKniznice/VerejnyDetailOpisnehoFormularaKniznice/211647","1","11948,000",
"OF-211658","Po karanténe","Toaletný papier, papierové uteráky","papier toaletný, papierové uteráky na ruky","33761000-2 Toaletný papier; 33763000-6 Papierové uteráky na ruky; 60000000-8 Dopravné služby (bez prepravy odpadu)","Tovar; Služba","","https://portal.eks.sk/SpravaKniznice/OpisneFormulareKniznice/VerejnyDetailOpisnehoFormularaKniznice/211658","1","691,650",
"OF-211686","Po karanténe","Chlieb a pekárenské výrobky ","čerstvý chlieb, rožok, vianočka, makovka, strúhanka,droždie","15810000-9 Pekársky tovar, čerstvé pečivo a cukrárske výrobky; 15811100-7 Chlieb; 15812100-4 Pečivo; 60000000-8 Dopravné služby (bez prepravy odpadu)","Tovar; Služba","","https://portal.eks.sk/SpravaKniznice/OpisneFormulareKniznice/VerejnyDetailOpisnehoFormularaKniznice/211686","1","64718,890",
"OF-211687","Po karanténe","Zber, odvoz a likvidácia tuhého komunálneho odpadu","odpad, zber odpadu, odpadové hospodárstvo, odvoz odpadu, likvidácia tuhého odpadu, komunálny odpad","90511100-3 Zber tuhého komunálneho odpadu; 90513200-8 Likvidácia tuhého komunálneho odpadu; 90500000-2 Služby súvisiace s likvidáciou odpadu a odpadom; 60000000-8 Dopravné služby (bez prepravy odpadu)","Služba","","https://portal.eks.sk/SpravaKniznice/OpisneFormulareKniznice/VerejnyDetailOpisnehoFormularaKniznice/211687","0","0",
"OF-211708","Po karanténe","Ovocie a zelenina.","Ovocie a zelenina.","15300000-1 Ovocie, zelenina a súvisiace výrobky; 60000000-8 Dopravné služby (bez prepravy odpadu)","Tovar; Služba","","https://portal.eks.sk/SpravaKniznice/OpisneFormulareKniznice/VerejnyDetailOpisnehoFormularaKniznice/211708","1","0",
"OF-211712","Po karanténe","Kancelárske potreby","kancelárske potreby, krabica, blok, ceruzka, dierovač, fix, guma, kalkulačka, klip,  lepidlo, nožnice, magnetka, nožnice, obal, obálka, papier, pero, pentelka, páska, podložka, pravítko, rozšívačka, skartátor, spinky, sáčky, stojan, stúhadko, špagát, špendlíky, zakladač, záložka, zošit,  zošívačka","30192000-1 Kancelárske potreby; 60000000-8 Dopravné služby (bez prepravy odpadu)","Tovar; Služba","","https://portal.eks.sk/SpravaKniznice/OpisneFormulareKniznice/VerejnyDetailOpisnehoFormularaKniznice/211712","1","0",
"OF-211758","Po karanténe","Sety na hrudnú podvodnú drenáž jednorázové dvojkomorové s možnosťou podtlaku","drenážna jednotky, komora monitoringu drénovej tekutiny","33141640-8 Drény; 60000000-8 Dopravné služby (bez prepravy odpadu)","Tovar; Služba","","https://portal.eks.sk/SpravaKniznice/OpisneFormulareKniznice/VerejnyDetailOpisnehoFormularaKniznice/211758","0","0",
"OF-211768","Po karanténe","Profesionálne čistiace prostriedky  dezinfekcie a doplnkový sortiment","čistiace prostriedky","39830000-9 Čistiace výrobky; 33700000-7 Predmety osobnej starostlivosti; 33741300-9 Dezinfekčné prostriedky na ruky; 24455000-8 Dezinfekčné prostriedky; 33760000-5 Toaletný papier, vreckovky, uteráky na ruky a servítky; 39224300-1 Metly a kefy a iné výrobky na upratovanie domácností; 39224320-7 Špongie; 60000000-8 Dopravné služby (bez prepravy odpadu)","Tovar; Služba","","https://portal.eks.sk/SpravaKniznice/OpisneFormulareKniznice/VerejnyDetailOpisnehoFormularaKniznice/211768","0","0",
"OF-211775","Po karanténe","Zabezpečenie stravovania zamestnancov prostredníctvom stravných lístkov","stravné lístky, stravovanie, poukážka","30199770-8 Stravné poukážky; 55520000-1 Služby hromadného stravovania; 60000000-8 Dopravné služby (bez prepravy odpadu)","Tovar; Služba","","https://portal.eks.sk/SpravaKniznice/OpisneFormulareKniznice/VerejnyDetailOpisnehoFormularaKniznice/211775","0","0",
"OF-211777","Po karanténe","Rozšírenie existujúcich licencií programu ESET Endpoint Security o ESET Dynamic Threat Defense","licencie, upgrade licencií,  šifrovanie údajov","48900000-7 Rôzne softvérové balíky a počítačové systémy; 60000000-8 Dopravné služby (bez prepravy odpadu)","Tovar; Služba","","https://portal.eks.sk/SpravaKniznice/OpisneFormulareKniznice/VerejnyDetailOpisnehoFormularaKniznice/211777","1","1413,560",
"OF-211782","Po karanténe","Čistenie a dezinfekcia zberných nádob s objemom 1100 l na komunálny odpad","čistenie, dezinfekcia, zberná nádoba, odpad","90918000-5 Čistenie odpadových nádob; 60000000-8 Dopravné služby (bez prepravy odpadu)","Služba","","https://portal.eks.sk/SpravaKniznice/OpisneFormulareKniznice/VerejnyDetailOpisnehoFormularaKniznice/211782","1","0",
"OF-211786","Po karanténe","Zdravotnícky materiál - monitoring","snímač k prístroju Somanetic pediatrický a aj pre dospelých, kyslíkové okuliare, alkoholové dezinfekčné tampóny, odsávacie katétre, močové katétre, anestetický okruh, sonda, krytie.","33195000-3 Systém monitorovania pacientov; 33000000-0 Zdravotnícke vybavenie, farmaceutický materiál a výrobky osobnej starostlivosti; 60000000-8 Dopravné služby (bez prepravy odpadu)","Tovar; Služba","","https://portal.eks.sk/SpravaKniznice/OpisneFormulareKniznice/VerejnyDetailOpisnehoFormularaKniznice/211786","1","0",
"OF-211789","Po karanténe","Dodanie výpočtovej techniky pre organizáciu 2020","počítač, notebook, monitor, tablet, tlačiareň, softvér","30213100-6 Prenosné počítače; 30231000-7 Počítačové monitory a konzoly; 30230000-0 Zariadenia súvisiace s počítačmi; 30231300-0 Zobrazovacie jednotky (obrazovky); 30237200-1 Príslušenstvo počítačov; 30237410-6 Počítačová myš; 30237450-8 Grafické tablety; 30237460-1 Počítačové klávesnice; 32342300-5 Mikrofónové a reproduktorové sústavy; 48000000-8 Softvérové balíky a informačné systémy; 48214000-1 Softvérový balík pre sieťové operačné systémy; 48624000-8 Softvérový balík pre operačný systém osobného počítača (PC); 48900000-7 Rôzne softvérové balíky a počítačové systémy; 60000000-8 Dopravné služby (bez prepravy odpadu)","Tovar; Služba","","https://portal.eks.sk/SpravaKniznice/OpisneFormulareKniznice/VerejnyDetailOpisnehoFormularaKniznice/211789","0","0",
"OF-211795","Po karanténe","Samochodné plne elektrické zametacie vozidlo na čistenie chodníkov a priestranstiev","Samochodné, zametanie, vozidlo, čistiace, chodníky a verejné priestranstvo, elektroautá","34920000-2 Cestné príslušenstvo; 34921000-9 Zariadenia na údržbu ciest; 34921100-0 Zametače ciest; 60000000-8 Dopravné služby (bez prepravy odpadu)","Tovar; Služba","","https://portal.eks.sk/SpravaKniznice/OpisneFormulareKniznice/VerejnyDetailOpisnehoFormularaKniznice/211795","0","0",
"OF-211798","Po karanténe","Vrecia PVC - LDPE, polyetylén","vrecia, vrecká, sáčky, polyetylénový odpad","19640000-4 Polyetylénový odpad a odpadkové vrecká a vaky; 60000000-8 Dopravné služby (bez prepravy odpadu)","Tovar; Služba","","https://portal.eks.sk/SpravaKniznice/OpisneFormulareKniznice/VerejnyDetailOpisnehoFormularaKniznice/211798","1","5423,980",
"OF-211806","Po karanténe","Modernizácia serverovej infraštruktúry","Hardvér, technická podpora, inštalácia","30210000-4 Stroje na spracovanie údajov (hardvér); 48710000-8 Softvérový balík na zálohovanie a obnovu; 48000000-8 Softvérové balíky a informačné systémy; 48800000-6 Informačné systémy a servery; 48820000-2 Servery; 32422000-7 Sieťové komponenty; 72000000-5 Služby informačných technológií: konzultácie, vývoj softvéru, internet a podpora","Tovar; Služba","","https://portal.eks.sk/SpravaKniznice/OpisneFormulareKniznice/VerejnyDetailOpisnehoFormularaKniznice/211806","1","125400,000",
"OF-211808","Po karanténe","Tigecyklín","Tigecyklín, Látky ničiace baktérie na systémové použitie","33651100-9 Látky ničiace baktérie na systémové použitie; 60000000-8 Dopravné služby (bez prepravy odpadu)","Tovar; Služba","","https://portal.eks.sk/SpravaKniznice/OpisneFormulareKniznice/VerejnyDetailOpisnehoFormularaKniznice/211808","0","0",
"OF-211812","Po karanténe","Etamsylát","Etamsylát, Antihemoragiká","33621200-1 Antihemoragiká; 60000000-8 Dopravné služby (bez prepravy odpadu)","Tovar; Služba","","https://portal.eks.sk/SpravaKniznice/OpisneFormulareKniznice/VerejnyDetailOpisnehoFormularaKniznice/211812","0","0",
"OF-211814","Po karanténe","Amikacín","Amikacín, Látky  ničiace baktérie na systémové použitie","33651100-9 Látky ničiace baktérie na systémové použitie; 60000000-8 Dopravné služby (bez prepravy odpadu)","Tovar; Služba","","https://portal.eks.sk/SpravaKniznice/OpisneFormulareKniznice/VerejnyDetailOpisnehoFormularaKniznice/211814","0","0",
"OF-211816","Po karanténe","Remifentanil","Remifentanil, Anestetiká","33661100-2 Anestetiká; 60000000-8 Dopravné služby (bez prepravy odpadu)","Tovar; Služba","","https://portal.eks.sk/SpravaKniznice/OpisneFormulareKniznice/VerejnyDetailOpisnehoFormularaKniznice/211816","0","0",
"OF-211817","Po karanténe"," Cefotaxím","Cefotaxím, Látky ničiace baktérie na systémové použitie","33651100-9 Látky ničiace baktérie na systémové použitie; 60000000-8 Dopravné služby (bez prepravy odpadu)","Tovar; Služba","","https://portal.eks.sk/SpravaKniznice/OpisneFormulareKniznice/VerejnyDetailOpisnehoFormularaKniznice/211817","1","0",
"OF-211818","Po karanténe","Variče elektrické, ohrievače, filtre a sáčky do vysávačov","varič, vysávač filter","39710000-2 Elektrické prístroje pre domácnosť; 60000000-8 Dopravné služby (bez prepravy odpadu); 39713431-3 Príslušenstvo k vysávačom prachu","Tovar; Služba","","https://portal.eks.sk/SpravaKniznice/OpisneFormulareKniznice/VerejnyDetailOpisnehoFormularaKniznice/211818","1","0",
"OF-211819","Po karanténe","Dexmedetomidín","Dexmedetomidín, psycholeptiká","33661500-6 Psycholeptiká; 60000000-8 Dopravné služby (bez prepravy odpadu)","Tovar; Služba","","https://portal.eks.sk/SpravaKniznice/OpisneFormulareKniznice/VerejnyDetailOpisnehoFormularaKniznice/211819","1","10054,600",
"OF-211822","Po karanténe","Paracetamol ","Paracetamol , Analgetiká","33661200-3 Analgetiká; 60000000-8 Dopravné služby (bez prepravy odpadu)","Tovar; Služba","","https://portal.eks.sk/SpravaKniznice/OpisneFormulareKniznice/VerejnyDetailOpisnehoFormularaKniznice/211822","1","0",
"OF-211825","Po karanténe","Chemikálie: DDM, Síran draselný, TAPS","DDM (n-Dodecyl-ß-D-Maltoside), Síran draselný, TAPS, (N-[Tris(hydroxymetyl)metyl]-3-aminopropánsulfonová kyselina), EPPS,  (4-(2-Hydroxyetyl)-1-piperazínpropánsulfonová kyselina), Hexachloroiridát draselný (IV) - K2IrCl6, Technický tlmivý roztok pH 7, Technický tlmivý roztok pH 4, Technický tlmivý roztok pH 10, Skladovací roztok pre pH elektródu, Dihydrogén fosforečnan sodný, bezvodý, monobázický, Coomassie Brilliant Blue R 250, Octan sodný, bezvodý, Inzulín – ľudský, rekombinantný, HaloTag PEG-Biotín - Ligand Biotín, TriDye 100 bp DNA marker, GelPilot DNA 5x – nanášacie farbivo","24000000-4 Chemické výrobky; 60000000-8 Dopravné služby (bez prepravy odpadu)","Tovar; Služba","","https://portal.eks.sk/SpravaKniznice/OpisneFormulareKniznice/VerejnyDetailOpisnehoFormularaKniznice/211825","1","2886,900",
"OF-211827","Po karanténe","Melfalán","Melfalán, Antineoplastické činidlá","33652100-6 Antineoplastické činidlá; 60000000-8 Dopravné služby (bez prepravy odpadu)","Tovar; Služba","","https://portal.eks.sk/SpravaKniznice/OpisneFormulareKniznice/VerejnyDetailOpisnehoFormularaKniznice/211827","1","0",
"OF-211829","Po karanténe","Síran horečnatý","Síran horečnatý, Minerálne doplnky","33617000-8 Minerálne doplnky; 60000000-8 Dopravné služby (bez prepravy odpadu)","Tovar; Služba","","https://portal.eks.sk/SpravaKniznice/OpisneFormulareKniznice/VerejnyDetailOpisnehoFormularaKniznice/211829","0","0",
