"OpisnyFormularIdentifikator","OpisnyFormularStav","OpisnyFormularNazov","OpisnyFormularKlucoveSlova","OpisnyFormularCpv","OpisnyFormularDruh","OpisnyFormularKategoriaSluzieb","OpisnyFormularUrl","OpisnyFormularPocetVyhlasenychZakaziek","OpisnyFormularObchodovanaSumaBezDPH",
"OF-283848","Po karanténe","Nádoba na medicínsky odpad 60l ","nádoba na medicínsky odpad, klinik box, kontajnery","34928480-6 Kontajnery a nádoby na odpad a odpadky; 60000000-8 Dopravné služby (bez prepravy odpadu)","Tovar; Služba","","https://portal.eks.sk/SpravaKniznice/OpisneFormulareKniznice/VerejnyDetailOpisnehoFormularaKniznice/283848","0","0",
"OF-283849","Po karanténe","Špeciálny zdravotnícky materiál určený k epikardiálnemu uzáveru uška ľavej predsiene","intrakardiálny oklúzor, uzáver uška ľavej predsiene","33123000-8 Kardiovaskulárne prístroje; 33141122-1 Chirurgické spony; 33162100-4 Prístroje operačnej sály","Tovar","","https://portal.eks.sk/SpravaKniznice/OpisneFormulareKniznice/VerejnyDetailOpisnehoFormularaKniznice/283849","0","0",
"OF-283929","Po karanténe","Licencie Atlassian","licencie","48000000-8 Softvérové balíky a informačné systémy; 48620000-0 Operačné systémy","Tovar","","https://portal.eks.sk/SpravaKniznice/OpisneFormulareKniznice/VerejnyDetailOpisnehoFormularaKniznice/283929","1","0",
"OF-284010","Po karanténe","Notebook vrátane SW","Notebook, Antivírový softvér, MS Office Professional","30213100-6 Prenosné počítače; 60000000-8 Dopravné služby (bez prepravy odpadu)","Tovar; Služba","","https://portal.eks.sk/SpravaKniznice/OpisneFormulareKniznice/VerejnyDetailOpisnehoFormularaKniznice/284010","1","0",
"OF-284066","Po karanténe","Zabezpečenie upratovacích a čistiacich služieb a dodania hygienického materiálu ","upratovacie služby, čistiace služby, upratovanie, čistiace pomôcky, hygienické potreby","90910000-9 Upratovacie služby","Služba; Tovar","","https://portal.eks.sk/SpravaKniznice/OpisneFormulareKniznice/VerejnyDetailOpisnehoFormularaKniznice/284066","1","0",
"OF-284067","Po karanténe","Upratovacie a čistiace služby a dodávka hygienického spotrebného materiálu","upratovacie služby, čistiace služby, upratovanie, čistiace pomôcky, hygienické potreby","90910000-9 Upratovacie služby","Služba; Tovar","","https://portal.eks.sk/SpravaKniznice/OpisneFormulareKniznice/VerejnyDetailOpisnehoFormularaKniznice/284067","0","0",
"OF-284070","Po karanténe","Nákup osobného automobilu - Škoda Superb Sportiline (2.0 TDI, 147 kW, 200 k) 4x4 - alebo ekvivalent ","osobné automobily","34110000-1 Osobné automobily; 60000000-8 Dopravné služby (bez prepravy odpadu)","Tovar","","https://portal.eks.sk/SpravaKniznice/OpisneFormulareKniznice/VerejnyDetailOpisnehoFormularaKniznice/284070","1","0",
"OF-284071","Po karanténe","SLA pre Správu registratúry na MZ SR pre rok 2024","SLA, správa registratúry","72000000-5 Služby informačných technológií: konzultácie, vývoj softvéru, internet a podpora","Služba","","https://portal.eks.sk/SpravaKniznice/OpisneFormulareKniznice/VerejnyDetailOpisnehoFormularaKniznice/284071","0","0",
"OF-284073","Po karanténe","Náhradné diely na autobusy Sor NB12,NB18 - podvozok","Náhradné diely, autobus,Sor NB12,NB18,podvozok","34121100-2 Autobusy verejnej dopravy; 34139200-2 Samotný podvozok; 60000000-8 Dopravné služby (bez prepravy odpadu)","Tovar","","https://portal.eks.sk/SpravaKniznice/OpisneFormulareKniznice/VerejnyDetailOpisnehoFormularaKniznice/284073","1","0",
"OF-284074","Po karanténe","Náhradné diely na autobusy Sor NB12, NB18 ","Náhradné diely, autobus ,Sor","34121100-2 Autobusy verejnej dopravy; 34121200-3 Kĺbové autobusy; 60000000-8 Dopravné služby (bez prepravy odpadu)","Tovar; Služba","","https://portal.eks.sk/SpravaKniznice/OpisneFormulareKniznice/VerejnyDetailOpisnehoFormularaKniznice/284074","1","0",
"OF-284075","Po karanténe","Náhradné diely na autobusy Sor NB12, NB18 ","Náhradné diely, autobus ,Sor","34121100-2 Autobusy verejnej dopravy; 34121200-3 Kĺbové autobusy; 60000000-8 Dopravné služby (bez prepravy odpadu)","Tovar; Služba","","https://portal.eks.sk/SpravaKniznice/OpisneFormulareKniznice/VerejnyDetailOpisnehoFormularaKniznice/284075","1","0",
"OF-284076","Po karanténe","Náhradné diely na autobusy Sor NB12,NB18 - podvozok","Náhradné diely, autobus,Sor NB12,NB18,podvozok","34121100-2 Autobusy verejnej dopravy; 34139200-2 Samotný podvozok; 60000000-8 Dopravné služby (bez prepravy odpadu)","Tovar","","https://portal.eks.sk/SpravaKniznice/OpisneFormulareKniznice/VerejnyDetailOpisnehoFormularaKniznice/284076","1","0",
"OF-284077","Po karanténe","Náhradné diely na autobusy Sor NB12, NB18 ","Náhradné diely, autobus ,Sor","34121100-2 Autobusy verejnej dopravy; 34121200-3 Kĺbové autobusy; 60000000-8 Dopravné služby (bez prepravy odpadu)","Tovar; Služba","","https://portal.eks.sk/SpravaKniznice/OpisneFormulareKniznice/VerejnyDetailOpisnehoFormularaKniznice/284077","1","0",
"OF-284081","Po karanténe","Zabezpečenie upratovacích a čistiacich služieb a dodávka hygienického spotrebného materiálu vo vybraných objektoch.","Upratovacie služby, čistiace služby, upratovanie, hygienický materiál, hygienické potreby, čistiace pomôcky","90910000-9 Upratovacie služby","Služba; Tovar","","https://portal.eks.sk/SpravaKniznice/OpisneFormulareKniznice/VerejnyDetailOpisnehoFormularaKniznice/284081","0","0",
"OF-284082","Po karanténe","Zemiaky","Zemiaky, potraviny","03212100-1 Zemiaky; 60000000-8 Dopravné služby (bez prepravy odpadu)","Tovar; Služba","","https://portal.eks.sk/SpravaKniznice/OpisneFormulareKniznice/VerejnyDetailOpisnehoFormularaKniznice/284082","1","0",
"OF-284084","Po karanténe","Motorová nafta","pohonné hmoty, palivá, nafta","09134100-8 Motorová nafta; 60000000-8 Dopravné služby (bez prepravy odpadu)","Tovar; Služba","","https://portal.eks.sk/SpravaKniznice/OpisneFormulareKniznice/VerejnyDetailOpisnehoFormularaKniznice/284084","0","0",
"OF-284085","Po karanténe","Dodávka zemného plynu","Zemný plyn, rozvod plynu a súvisiace služby","09123000-7 Zemný plyn; 65200000-5 Rozvod plynu a súvisiace služby; 60000000-8 Dopravné služby (bez prepravy odpadu)","Tovar; Služba","","https://portal.eks.sk/SpravaKniznice/OpisneFormulareKniznice/VerejnyDetailOpisnehoFormularaKniznice/284085","0","0",
"OF-284086","Po karanténe","Albumíny ","Albumín","33141540-7 Albumíny; 60000000-8 Dopravné služby (bez prepravy odpadu)","Tovar; Služba","","https://portal.eks.sk/SpravaKniznice/OpisneFormulareKniznice/VerejnyDetailOpisnehoFormularaKniznice/284086","1","0",
"OF-284087","Po karanténe","Lieky skupiny ATC B05 - Infundibilia","Infundibilia","33692100-8 Infúzne roztoky; 60000000-8 Dopravné služby (bez prepravy odpadu)","Tovar; Služba","","https://portal.eks.sk/SpravaKniznice/OpisneFormulareKniznice/VerejnyDetailOpisnehoFormularaKniznice/284087","1","0",
"OF-284090","Po karanténe","Softvérové licencie Microsoft","Microsoft, 365, Exchange","48920000-3 Softvérový balík na automatizáciu kancelárskych prác","Tovar","","https://portal.eks.sk/SpravaKniznice/OpisneFormulareKniznice/VerejnyDetailOpisnehoFormularaKniznice/284090","0","0",
"OF-284093","Po karanténe","Dodávka zemného plynu","zemný plyn","09123000-7 Zemný plyn; 60000000-8 Dopravné služby (bez prepravy odpadu)","Tovar; Služba","","https://portal.eks.sk/SpravaKniznice/OpisneFormulareKniznice/VerejnyDetailOpisnehoFormularaKniznice/284093","1","0",
"OF-284097","Po karanténe","Skríningové antigénové testy na diagnostiku ochorenia COVID-19","skríning, test, diagnostika, antigénový test, ochorenie, COVID-19","33124130-5 Diagnostický spotrebný materiál; 33141625-7 Diagnostické súpravy; 60000000-8 Dopravné služby (bez prepravy odpadu)","Tovar; Služba","","https://portal.eks.sk/SpravaKniznice/OpisneFormulareKniznice/VerejnyDetailOpisnehoFormularaKniznice/284097","0","0",
"OF-284098","Po karanténe","Maliarsky materiál","farba","44800000-8 Náterové farby, laky a tmely; 24200000-6 Farby a pigmenty; 60000000-8 Dopravné služby (bez prepravy odpadu)","Tovar; Služba","","https://portal.eks.sk/SpravaKniznice/OpisneFormulareKniznice/VerejnyDetailOpisnehoFormularaKniznice/284098","1","0",
"OF-284099","Po karanténe","Automatický prepínač zdrojov napájania","Redundantné napájanie pro zariadenie s jedným napájacím zdrojom","31154000-0 Zdroje nepretržitého/stáleho napájania; 60000000-8 Dopravné služby (bez prepravy odpadu)","Tovar; Služba","","https://portal.eks.sk/SpravaKniznice/OpisneFormulareKniznice/VerejnyDetailOpisnehoFormularaKniznice/284099","0","0",
"OF-284100","Po karanténe","Stravné poukážky","stravné lístky, stravné poukážky,","30199770-8 Stravné poukážky; 60000000-8 Dopravné služby (bez prepravy odpadu)","Tovar; Služba","","https://portal.eks.sk/SpravaKniznice/OpisneFormulareKniznice/VerejnyDetailOpisnehoFormularaKniznice/284100","0","0",
"OF-284102","Po karanténe","Dodávka zemného plynu 2024/2025","Zemný plyn","09123000-7 Zemný plyn","Tovar","","https://portal.eks.sk/SpravaKniznice/OpisneFormulareKniznice/VerejnyDetailOpisnehoFormularaKniznice/284102","0","0",
"OF-284103","Po karanténe","Softvérové licencie ESET","ESET, antivírus","48761000-0 Antivírusový softvérový balík","Tovar","","https://portal.eks.sk/SpravaKniznice/OpisneFormulareKniznice/VerejnyDetailOpisnehoFormularaKniznice/284103","0","0",
"OF-284104","Po karanténe","Nafta motorová II","nafta, nafta motorová","09134100-8 Motorová nafta","Tovar; Služba","","https://portal.eks.sk/SpravaKniznice/OpisneFormulareKniznice/VerejnyDetailOpisnehoFormularaKniznice/284104","0","0",
