"OpisnyFormularIdentifikator","OpisnyFormularStav","OpisnyFormularNazov","OpisnyFormularKlucoveSlova","OpisnyFormularCpv","OpisnyFormularDruh","OpisnyFormularKategoriaSluzieb","OpisnyFormularUrl","OpisnyFormularPocetVyhlasenychZakaziek","OpisnyFormularObchodovanaSumaBezDPH",
"OF-207108","Po karanténe","Vykonanie pravidelných revízií inštalovaných prvkov fyzickej a objektovej bezpečnosti v  7 objektoch v Nitrianskom kraji (2)","Odborná prehliadka, odborná skúška, revízie, technická kontrola, technické skúšanie","50610000-4 Služby na opravu a údržbu bezpečnostných zariadení; 71630000-3 Technická inšpekcia a skúšanie; 60000000-8 Dopravné služby (bez prepravy odpadu); 90513000-6 Služby na spracovanie a likvidáciu nie nebezpečného odpadu; 90512000-9 Služby na prepravu odpadu","Služba; Tovar","","https://portal.eks.sk/SpravaKniznice/OpisneFormulareKniznice/VerejnyDetailOpisnehoFormularaKniznice/207108","0","0",
"OF-207110","Po karanténe","Tonery a náplne do digitálnej tlačiarne ","toner, tlačiareň, kartridže (kazety)","30125120-8 Toner do fotokopírovacích strojov; 60000000-8 Dopravné služby (bez prepravy odpadu)","Tovar; Služba","","https://portal.eks.sk/SpravaKniznice/OpisneFormulareKniznice/VerejnyDetailOpisnehoFormularaKniznice/207110","1","0",
"OF-207112","Po karanténe","Vykonanie pravidelných revízií inštalovaných prvkov fyzickej a objektovej bezpečnosti v  7 objektoch v Žilinskom kraji (2)","Odborná prehliadka, odborná skúška, revízie, technická kontrola, technické skúšanie","50610000-4 Služby na opravu a údržbu bezpečnostných zariadení; 71630000-3 Technická inšpekcia a skúšanie; 60000000-8 Dopravné služby (bez prepravy odpadu); 90513000-6 Služby na spracovanie a likvidáciu nie nebezpečného odpadu; 90512000-9 Služby na prepravu odpadu","Služba; Tovar","","https://portal.eks.sk/SpravaKniznice/OpisneFormulareKniznice/VerejnyDetailOpisnehoFormularaKniznice/207112","0","0",
"OF-207113","Po karanténe","Čerstvá zelenina a ovocie","jablká, hrozno, pomaranče, broskyne, banány, grepy, kiwi, hrušky, citróny, kel, cesnak, cibuľa, mrkva, petržlen, kaleráb, cvikla, šampiňóny, šalát, pór, hliva ustricová, paradajky, cuketa, tekvica, brokolica, kôpor, paprika, zeler, špargľa, špenát, rukola, zemiaky,","03212000-0 Zemiaky a sušená zelenina; 03220000-9 Zelenina, ovocie a orechy; 60000000-8 Dopravné služby (bez prepravy odpadu)","Tovar; Služba","","https://portal.eks.sk/SpravaKniznice/OpisneFormulareKniznice/VerejnyDetailOpisnehoFormularaKniznice/207113","0","0",
"OF-207114","Po karanténe","Vykonanie pravidelných revízií inštalovaných prvkov fyzickej a objektovej bezpečnosti v  6 objektoch v Prešovskom kraji (2)","Odborná prehliadka, odborná skúška, revízie, technická kontrola, technické skúšanie","50610000-4 Služby na opravu a údržbu bezpečnostných zariadení; 71630000-3 Technická inšpekcia a skúšanie; 60000000-8 Dopravné služby (bez prepravy odpadu); 90513000-6 Služby na spracovanie a likvidáciu nie nebezpečného odpadu; 90512000-9 Služby na prepravu odpadu","Služba; Tovar","","https://portal.eks.sk/SpravaKniznice/OpisneFormulareKniznice/VerejnyDetailOpisnehoFormularaKniznice/207114","0","0",
"OF-207115","Po karanténe","Vykonanie pravidelných revízií inštalovaných prvkov fyzickej a objektovej bezpečnosti v  5 objektoch v Košickom kraji (2)","Odborná prehliadka, odborná skúška, revízie, technická kontrola, technické skúšanie","50610000-4 Služby na opravu a údržbu bezpečnostných zariadení; 71630000-3 Technická inšpekcia a skúšanie; 60000000-8 Dopravné služby (bez prepravy odpadu); 90513000-6 Služby na spracovanie a likvidáciu nie nebezpečného odpadu; 90512000-9 Služby na prepravu odpadu","Služba; Tovar","","https://portal.eks.sk/SpravaKniznice/OpisneFormulareKniznice/VerejnyDetailOpisnehoFormularaKniznice/207115","0","0",
"OF-207119","Po karanténe","Dodávka zemného plynu","zemný plyn, preprava zemného plynu, distribúcia zemného plynu, služby obchodníka","09123000-7 Zemný plyn; 60000000-8 Dopravné služby (bez prepravy odpadu)","Tovar; Služba","","https://portal.eks.sk/SpravaKniznice/OpisneFormulareKniznice/VerejnyDetailOpisnehoFormularaKniznice/207119","1","0",
"OF-207120","Po karanténe","Plachty, posteľné plachty","Plachty, posteľné plachty","39512100-5 Plachty; 60000000-8 Dopravné služby (bez prepravy odpadu)","Tovar; Služba","","https://portal.eks.sk/SpravaKniznice/OpisneFormulareKniznice/VerejnyDetailOpisnehoFormularaKniznice/207120","1","0",
"OF-207121","Po karanténe","Mäso a mäsové výrobky","bravčové mäso, hovädzie mäso, mäsové výrobky","15110000-2 Mäso; 60000000-8 Dopravné služby (bez prepravy odpadu)","Tovar; Služba","","https://portal.eks.sk/SpravaKniznice/OpisneFormulareKniznice/VerejnyDetailOpisnehoFormularaKniznice/207121","0","0",
"OF-207123","Po karanténe","Datalogger s príslušenstvom","meranie, datalogger","38300000-8 Meracie prístroje; 60000000-8 Dopravné služby (bez prepravy odpadu)","Tovar; Služba","","https://portal.eks.sk/SpravaKniznice/OpisneFormulareKniznice/VerejnyDetailOpisnehoFormularaKniznice/207123","1","0",
"OF-207124","Po karanténe","Tonerové náplne - originál","Tonerové náplne, originál","30125100-2 Tonerové náplne; 60000000-8 Dopravné služby (bez prepravy odpadu)","Tovar; Služba","","https://portal.eks.sk/SpravaKniznice/OpisneFormulareKniznice/VerejnyDetailOpisnehoFormularaKniznice/207124","0","0",
"OF-207125","Po karanténe","Zvýšenie bezpečnosti pripojenia do siete internet a vucnet","pripojenie, bezpečnosť, sieť, internet","48730000-4 Softvérový balík na zaistenie bezpečnosti; 48731000-1 Softvérový balík na zaistenie bezpečnosti súborov; 48732000-8 Softvérový balík na zaistenie bezpečnosti dát; 35113300-2 Bezpečnostné zariadenia; 35113000-9 Bezpečnostné inštalácie; 35121300-1 Bezpečnostné príslušenstvo; 60000000-8 Dopravné služby (bez prepravy odpadu)","Tovar; Služba","","https://portal.eks.sk/SpravaKniznice/OpisneFormulareKniznice/VerejnyDetailOpisnehoFormularaKniznice/207125","0","0",
"OF-207126","Po karanténe","Diagnostiká","diagnostiká","33141625-7 Diagnostické súpravy; 33694000-1 Diagnostické činidlá; 60000000-8 Dopravné služby (bez prepravy odpadu)","Tovar; Služba","","https://portal.eks.sk/SpravaKniznice/OpisneFormulareKniznice/VerejnyDetailOpisnehoFormularaKniznice/207126","1","0",
"OF-207127","Po karanténe","Tonery a optický valec","toner, náplň do tlačiarne, spotrebný materiál do tlačiarne, optický valec","30125120-8 Toner do fotokopírovacích strojov; 30125110-5 Toner do laserových tlačiarní/faxových prístrojov; 30125100-2 Tonerové náplne; 60000000-8 Dopravné služby (bez prepravy odpadu)","Tovar; Služba","","https://portal.eks.sk/SpravaKniznice/OpisneFormulareKniznice/VerejnyDetailOpisnehoFormularaKniznice/207127","1","0",
"OF-207128","Po karanténe","Zber, odvoz a zneškodnenie komunálneho odpadu ","Odpad, zber odpadu, odpadové hospodárstvo, odvoz odpadu, likvidácia tuhého komunálneho odpadu, komunálny odpad","90511100-3 Zber tuhého komunálneho odpadu; 90500000-2 Služby súvisiace s likvidáciou odpadu a odpadom; 90511000-2 Služby na zber odpadu; 90512000-9 Služby na prepravu odpadu","Služba","","https://portal.eks.sk/SpravaKniznice/OpisneFormulareKniznice/VerejnyDetailOpisnehoFormularaKniznice/207128","1","0",
"OF-207129","Po karanténe"," Kancelárske potreby a výtvarný materiál",", kancelárske potreby atď.","30192000-1 Kancelárske potreby; 60000000-8 Dopravné služby (bez prepravy odpadu); 30192121-5 Guľôčkové perá; 22852000-7 Zakladače; 30197100-7 Sponky, cvočky, pripináčiky; 30192125-3 Zvýrazňovače; 30192160-0 Korektory; 22816100-4 Poznámkové bloky","Tovar; Služba","","https://portal.eks.sk/SpravaKniznice/OpisneFormulareKniznice/VerejnyDetailOpisnehoFormularaKniznice/207129","0","0",
"OF-207130","Po karanténe","Príslušenstvo k notebookom a počítačom ","pamäťová karta, powerbanka","30237000-9 Časti a príslušenstvo počítačov a spotrebný materiál k nim; 60000000-8 Dopravné služby (bez prepravy odpadu)","Tovar; Služba","","https://portal.eks.sk/SpravaKniznice/OpisneFormulareKniznice/VerejnyDetailOpisnehoFormularaKniznice/207130","1","0",
"OF-207131","Po karanténe","Vykonanie pravidelných odborných prehliadok, odborných skúšok vyhradených technických zariadení plynových a tlakových v 3 objektoch objednávateľa na území Bratislavy (2).","Kontrolná činnosť,   vykonávanie odborných prehliadok a skúšok, revízia, vyhradené technické zariadenia plynové a tlakové","71630000-3 Technická inšpekcia a skúšanie; 50531200-8 Služby na údržbu plynových zariadení; 71631430-3 Skúšky tesnosti; 65210000-8 Rozvod plynu; 50413100-4 Opravy a údržba zariadení na detekciu plynu; 60000000-8 Dopravné služby (bez prepravy odpadu)","Služba","","https://portal.eks.sk/SpravaKniznice/OpisneFormulareKniznice/VerejnyDetailOpisnehoFormularaKniznice/207131","1","0",
"OF-207132","Po karanténe","Vykonanie pravidelných odborných prehliadok, odborných skúšok vyhradených technických zariadení plynových a tlakových v 2 objektoch objednávateľa na území Trnavy (2).","Kontrolná činnosť,   vykonávanie odborných prehliadok a skúšok, revízia, vyhradené technické zariadenia plynové a tlakové","71630000-3 Technická inšpekcia a skúšanie; 50531200-8 Služby na údržbu plynových zariadení; 71631430-3 Skúšky tesnosti; 65210000-8 Rozvod plynu; 50413100-4 Opravy a údržba zariadení na detekciu plynu; 60000000-8 Dopravné služby (bez prepravy odpadu)","Služba","","https://portal.eks.sk/SpravaKniznice/OpisneFormulareKniznice/VerejnyDetailOpisnehoFormularaKniznice/207132","1","0",
"OF-207134","Po karanténe","Vykonanie pravidelných odborných prehliadok, odborných skúšok vyhradených technických zariadení plynových a tlakových v 4 objektoch objednávateľa na území Trenčianskeho samosprávneho kraja (2).","Kontrolná činnosť,   vykonávanie odborných prehliadok a skúšok, revízia, vyhradené technické zariadenia plynové a tlakové","71630000-3 Technická inšpekcia a skúšanie; 50531200-8 Služby na údržbu plynových zariadení; 71631430-3 Skúšky tesnosti; 65210000-8 Rozvod plynu; 50413100-4 Opravy a údržba zariadení na detekciu plynu; 60000000-8 Dopravné služby (bez prepravy odpadu)","Služba","","https://portal.eks.sk/SpravaKniznice/OpisneFormulareKniznice/VerejnyDetailOpisnehoFormularaKniznice/207134","1","0",
"OF-207135","Po karanténe","Vykonanie pravidelných odborných prehliadok, odborných skúšok vyhradených technických zariadení plynových a tlakových v 3 objektoch objednávateľa na území  Nitrianskeho samosprávneho kraja (2) .","Kontrolná činnosť,   vykonávanie odborných prehliadok a skúšok, revízia, vyhradené technické zariadenia plynové a tlakové","71630000-3 Technická inšpekcia a skúšanie; 50531200-8 Služby na údržbu plynových zariadení; 71631430-3 Skúšky tesnosti; 65210000-8 Rozvod plynu; 50413100-4 Opravy a údržba zariadení na detekciu plynu; 60000000-8 Dopravné služby (bez prepravy odpadu)","Služba","","https://portal.eks.sk/SpravaKniznice/OpisneFormulareKniznice/VerejnyDetailOpisnehoFormularaKniznice/207135","1","0",
"OF-207136","Po karanténe","Vysávač v kvalite MIELE Classic C1 Power Line","vysávač","39713430-6 Vysávače prachu; 42999100-6 Vysávače prachu nie pre domácnosť; 60000000-8 Dopravné služby (bez prepravy odpadu)","Tovar; Služba","","https://portal.eks.sk/SpravaKniznice/OpisneFormulareKniznice/VerejnyDetailOpisnehoFormularaKniznice/207136","1","0",
"OF-207137","Po karanténe","Vykonanie pravidelných odborných prehliadok, odborných skúšok vyhradených technických zariadení plynových a tlakových v 4 objektoch objednávateľa na území  Banskobystrického samosprávneho kraja (2) .","Kontrolná činnosť,   vykonávanie odborných prehliadok a skúšok, revízia, vyhradené technické zariadenia plynové a tlakové","71630000-3 Technická inšpekcia a skúšanie; 50531200-8 Služby na údržbu plynových zariadení; 71631430-3 Skúšky tesnosti; 65210000-8 Rozvod plynu; 50413100-4 Opravy a údržba zariadení na detekciu plynu; 60000000-8 Dopravné služby (bez prepravy odpadu)","Služba","","https://portal.eks.sk/SpravaKniznice/OpisneFormulareKniznice/VerejnyDetailOpisnehoFormularaKniznice/207137","1","0",
"OF-207138","Po karanténe","Nákup notebookov pre školiace miestnosti","notebook, klávesnica, myš","30213100-6 Prenosné počítače; 30237200-1 Príslušenstvo počítačov; 30237220-7 Podložky pod myš; 30237280-5 Napájacie príslušenstvo; 30237000-9 Časti a príslušenstvo počítačov a spotrebný materiál k nim; 60000000-8 Dopravné služby (bez prepravy odpadu)","Tovar; Služba","","https://portal.eks.sk/SpravaKniznice/OpisneFormulareKniznice/VerejnyDetailOpisnehoFormularaKniznice/207138","1","0",
"OF-207139","Po karanténe","Vykonanie pravidelných odborných prehliadok, odborných skúšok vyhradených technických zariadení plynových a tlakových v 6 objektoch objednávateľa na území  Žilinského samosprávneho kraja (2).","Kontrolná činnosť,   vykonávanie odborných prehliadok a skúšok, revízia, vyhradené technické zariadenia plynové a tlakové","71630000-3 Technická inšpekcia a skúšanie; 50531200-8 Služby na údržbu plynových zariadení; 71631430-3 Skúšky tesnosti; 65210000-8 Rozvod plynu; 50413100-4 Opravy a údržba zariadení na detekciu plynu; 60000000-8 Dopravné služby (bez prepravy odpadu)","Služba","","https://portal.eks.sk/SpravaKniznice/OpisneFormulareKniznice/VerejnyDetailOpisnehoFormularaKniznice/207139","1","0",
"OF-207140","Po karanténe","Vykonanie pravidelných odborných prehliadok, odborných skúšok vyhradených technických zariadení plynových a tlakových v 6 objektoch objednávateľa na území  Prešovského samosprávneho kraja (2).","Kontrolná činnosť,   vykonávanie odborných prehliadok a skúšok, revízia, vyhradené technické zariadenia plynové a tlakové","71630000-3 Technická inšpekcia a skúšanie; 50531200-8 Služby na údržbu plynových zariadení; 71631430-3 Skúšky tesnosti; 65210000-8 Rozvod plynu; 50413100-4 Opravy a údržba zariadení na detekciu plynu; 60000000-8 Dopravné služby (bez prepravy odpadu)","Služba","","https://portal.eks.sk/SpravaKniznice/OpisneFormulareKniznice/VerejnyDetailOpisnehoFormularaKniznice/207140","1","0",
"OF-207142","Po karanténe","Vykonanie pravidelných odborných prehliadok, odborných skúšok vyhradených technických zariadení plynových a tlakových v 3 objektoch objednávateľa na území  Košického samosprávneho kraja (2) .","Kontrolná činnosť,   vykonávanie odborných prehliadok a skúšok, revízia, vyhradené technické zariadenia plynové a tlakové","71630000-3 Technická inšpekcia a skúšanie; 50531200-8 Služby na údržbu plynových zariadení; 71631430-3 Skúšky tesnosti; 65210000-8 Rozvod plynu; 50413100-4 Opravy a údržba zariadení na detekciu plynu; 60000000-8 Dopravné služby (bez prepravy odpadu)","Služba","","https://portal.eks.sk/SpravaKniznice/OpisneFormulareKniznice/VerejnyDetailOpisnehoFormularaKniznice/207142","1","0",
"OF-207143","Po karanténe","Zemiaky konzumné, rôzne","zemiaky konzumné,","03212100-1 Zemiaky; 03200000-3 Obilniny, zemiaky, zelenina, ovocie a orechy; 03210000-6 Obilniny a zemiaky; 15310000-4 Zemiaky a zemiakové výrobky; 60000000-8 Dopravné služby (bez prepravy odpadu)","Tovar; Služba","","https://portal.eks.sk/SpravaKniznice/OpisneFormulareKniznice/VerejnyDetailOpisnehoFormularaKniznice/207143","0","0",
"OF-207144","Po karanténe","Telekomunikačné služby","služba, mobil, dáta, internet","64200000-8 Telekomunikačné služby; 64212000-5 Mobilné telefónne služby; 64216110-7 Služby elektronickej výmeny údajov; 32250000-0 Mobilné telefóny; 72400000-4 Internetové služby","Služba; Tovar","","https://portal.eks.sk/SpravaKniznice/OpisneFormulareKniznice/VerejnyDetailOpisnehoFormularaKniznice/207144","0","0",
"OF-207145","Po karanténe","IKT predmety","notebook, pc, mobilný telefón","30200000-1 Počítačové zariadenia a spotrebný materiál; 30230000-0 Zariadenia súvisiace s počítačmi; 60000000-8 Dopravné služby (bez prepravy odpadu)","Tovar; Služba","","https://portal.eks.sk/SpravaKniznice/OpisneFormulareKniznice/VerejnyDetailOpisnehoFormularaKniznice/207145","0","0",
"OF-207148","Po karanténe","Softvérová podpora produktov ","Softvérová podpora","72267000-4 Služby na údržbu a opravu softvéru","Služba","","https://portal.eks.sk/SpravaKniznice/OpisneFormulareKniznice/VerejnyDetailOpisnehoFormularaKniznice/207148","0","0",
"OF-207149","Po karanténe","Tlač publikácií","tlač, brožúra, nálepky","22100000-1 Tlačené knihy, brožúry a letáky; 22458000-5 Tlačoviny na objednávku; 60000000-8 Dopravné služby (bez prepravy odpadu); 79810000-5 Tlačiarenské služby","Tovar; Služba","","https://portal.eks.sk/SpravaKniznice/OpisneFormulareKniznice/VerejnyDetailOpisnehoFormularaKniznice/207149","0","0",
"OF-207150","Po karanténe","Propagačné predmety s potlačou","šnúrka na kľúče, vak, reflexná páska, lopta, pero, zápisník, USB kľúč","39294100-0 Informačné a propagačné výrobky; 60000000-8 Dopravné služby (bez prepravy odpadu)","Tovar; Služba","","https://portal.eks.sk/SpravaKniznice/OpisneFormulareKniznice/VerejnyDetailOpisnehoFormularaKniznice/207150","0","0",
"OF-207151","Po karanténe","Kovová šatníková skriňa","Kovová šatníková skriňa","39160000-1 Školský nábytok; 39100000-3 Nábytok; 39143121-0 Šatníky; 60000000-8 Dopravné služby (bez prepravy odpadu)","Tovar; Služba","","https://portal.eks.sk/SpravaKniznice/OpisneFormulareKniznice/VerejnyDetailOpisnehoFormularaKniznice/207151","1","0",
"OF-207152","Po karanténe","Projektory a vizualizéry (projekt)","projektor, vizualizér","38652120-7 Videoprojektory; 30216100-7 Optické snímače; 32321200-1 Audiovizuálne zariadenia; 60000000-8 Dopravné služby (bez prepravy odpadu)","Tovar; Služba","","https://portal.eks.sk/SpravaKniznice/OpisneFormulareKniznice/VerejnyDetailOpisnehoFormularaKniznice/207152","0","0",
"OF-207153","Po karanténe","Stravné poukážky","stravné lístky, stravné poukážky,","30199770-8 Stravné poukážky; 60000000-8 Dopravné služby (bez prepravy odpadu)","Tovar; Služba","","https://portal.eks.sk/SpravaKniznice/OpisneFormulareKniznice/VerejnyDetailOpisnehoFormularaKniznice/207153","0","0",
"OF-207155","Po karanténe","Multifunkčné ČB laserové zariadenia A3","Multifunkkčné, laserové, kopírka, skener, tlačiareň","42962000-7 Tlačiarske/kopírovacie a grafické zariadenia; 60000000-8 Dopravné služby (bez prepravy odpadu)","Tovar; Služba","","https://portal.eks.sk/SpravaKniznice/OpisneFormulareKniznice/VerejnyDetailOpisnehoFormularaKniznice/207155","0","0",
"OF-207157","Po karanténe","IT spotrebný materiál","disk, kábel, grafická karta, procesor, video kábel","30237000-9 Časti a príslušenstvo počítačov a spotrebný materiál k nim; 60000000-8 Dopravné služby (bez prepravy odpadu)","Tovar; Služba","","https://portal.eks.sk/SpravaKniznice/OpisneFormulareKniznice/VerejnyDetailOpisnehoFormularaKniznice/207157","0","0",
"OF-207161","Po karanténe","Notebooky pre Projekt","notebook, prenosný počítač","30213100-6 Prenosné počítače; 60000000-8 Dopravné služby (bez prepravy odpadu)","Tovar; Služba","","https://portal.eks.sk/SpravaKniznice/OpisneFormulareKniznice/VerejnyDetailOpisnehoFormularaKniznice/207161","0","0",
"OF-207162","Po karanténe","Notebooky (pre Projekt)","notebook, prenosný počítač","30213100-6 Prenosné počítače; 60000000-8 Dopravné služby (bez prepravy odpadu)","Tovar; Služba","","https://portal.eks.sk/SpravaKniznice/OpisneFormulareKniznice/VerejnyDetailOpisnehoFormularaKniznice/207162","0","0",
"OF-207163","Po karanténe","Elektrospotrebiče","vysávač, práčka, mikrovlnná rúra, televízor, žehlička","32324100-1 Farebné televízory; 42716120-5 Práčky; 39713430-6 Vysávače prachu; 60000000-8 Dopravné služby (bez prepravy odpadu)","Tovar; Služba","","https://portal.eks.sk/SpravaKniznice/OpisneFormulareKniznice/VerejnyDetailOpisnehoFormularaKniznice/207163","1","0",
"OF-207164","Po karanténe","Pouličné LED svietidlo","svietidlo, LED,","31520000-7 Lampy/svietidlá a príslušenstvo k nim; 60000000-8 Dopravné služby (bez prepravy odpadu)","Tovar; Služba","","https://portal.eks.sk/SpravaKniznice/OpisneFormulareKniznice/VerejnyDetailOpisnehoFormularaKniznice/207164","1","0",
"OF-207165","Po karanténe","Traktorová kosačka","kosačka","16310000-1 Kosačky; 60000000-8 Dopravné služby (bez prepravy odpadu)","Tovar; Služba","","https://portal.eks.sk/SpravaKniznice/OpisneFormulareKniznice/VerejnyDetailOpisnehoFormularaKniznice/207165","1","0",
"OF-207166","Po karanténe","""Znovu spolu"" - florbalový mantinel","florbalový mantinel","37450000-7 Vybavenie na vonkajšie a halové športy; 60000000-8 Dopravné služby (bez prepravy odpadu)","Tovar; Služba","","https://portal.eks.sk/SpravaKniznice/OpisneFormulareKniznice/VerejnyDetailOpisnehoFormularaKniznice/207166","1","0",
"OF-207167","Po karanténe","Náhradné diely na autobusy Citelis - podvozok","Náhradné diely, autobus, Citelis, podvozok","34200000-9 Karosérie vozidiel, prívesy alebo návesy; 60000000-8 Dopravné služby (bez prepravy odpadu); 34900000-6 Rôzne dopravné zariadenia a náhradné diely","Tovar","","https://portal.eks.sk/SpravaKniznice/OpisneFormulareKniznice/VerejnyDetailOpisnehoFormularaKniznice/207167","1","0",
"OF-207169","Po karanténe","Služobné motorové vozidlo","automobil, nový automobil, motorové vozidlo","34100000-8 Motorové vozidlá; 60000000-8 Dopravné služby (bez prepravy odpadu)","Tovar; Služba","","https://portal.eks.sk/SpravaKniznice/OpisneFormulareKniznice/VerejnyDetailOpisnehoFormularaKniznice/207169","1","0",
"OF-207170","Po karanténe","Stravné poukážky","stravné poukážky, dodanie stravných poukážok, zabezpečenie stravovania v zmluvných stravovacích zariadeniach","30199770-8 Stravné poukážky; 55520000-1 Služby hromadného stravovania; 60000000-8 Dopravné služby (bez prepravy odpadu)","Tovar; Služba","","https://portal.eks.sk/SpravaKniznice/OpisneFormulareKniznice/VerejnyDetailOpisnehoFormularaKniznice/207170","0","0",
"OF-207172","Po karanténe","Hydraulický olej OHHM 46 ","hydraulický olej, olej","09000000-3 Ropné výrobky, palivo, elektrina a ostatné zdroje energie; 60000000-8 Dopravné služby (bez prepravy odpadu)","Tovar; Služba","","https://portal.eks.sk/SpravaKniznice/OpisneFormulareKniznice/VerejnyDetailOpisnehoFormularaKniznice/207172","0","0",
"OF-207173","Po karanténe","Stravné poukážky pre zamestnancov","stravné poukážky, zabezpečenie služieb hromadného stravovania","30199770-8 Stravné poukážky; 55520000-1 Služby hromadného stravovania","Tovar; Služba","","https://portal.eks.sk/SpravaKniznice/OpisneFormulareKniznice/VerejnyDetailOpisnehoFormularaKniznice/207173","0","0",
"OF-207174","Po karanténe","Nesený drvič BRO","Nesený drvič biologického rozložiteľného odpadu","43414000-8 Drviče; 60000000-8 Dopravné služby (bez prepravy odpadu)","Tovar; Služba","","https://portal.eks.sk/SpravaKniznice/OpisneFormulareKniznice/VerejnyDetailOpisnehoFormularaKniznice/207174","0","0",
"OF-207176","Po karanténe","Stravné poukážky","Papierové stravné poukážky, dodanie papierových stravných poukážok, Zabezpečenie stravovania","30199770-8 Stravné poukážky; 60000000-8 Dopravné služby (bez prepravy odpadu)","Tovar; Služba","","https://portal.eks.sk/SpravaKniznice/OpisneFormulareKniznice/VerejnyDetailOpisnehoFormularaKniznice/207176","1","0",
"OF-207177","Po karanténe","Drevené protisnehové zábrany - poskytnutie, montáž, údržba a demontáž","drevené snehové zábrany, snehové zábrany","98300000-6 Rôzne služby; 34928340-3 Protisnehové zábrany; 60000000-8 Dopravné služby (bez prepravy odpadu)","Služba","","https://portal.eks.sk/SpravaKniznice/OpisneFormulareKniznice/VerejnyDetailOpisnehoFormularaKniznice/207177","0","0",
"OF-207178","Po karanténe","Zdravotnícky spotrebný materiál","skalpelová čepeľ, nožnice, kanyla, ihla, striekačka, obväz, tampón, rukavice, plášť, vata, transfúzny vak, fonendoskop, teplomer","33100000-1 Zdravotnícke vybavenie; 33140000-3 Zdravotnícky spotrebný materiál; 60000000-8 Dopravné služby (bez prepravy odpadu)","Tovar; Služba","","https://portal.eks.sk/SpravaKniznice/OpisneFormulareKniznice/VerejnyDetailOpisnehoFormularaKniznice/207178","1","0",
"OF-207182","Po karanténe","Mäsové výrobky","mäsové výrobky, klobása, párky, jaternice, slanina, saláma, šunka, tlačenka, údené","15131130-5 Klobásy/párky/saláma/jaternice; 15131220-3 Slanina; 15130000-8 Mäsové výrobky; 15131230-6 Saláma; 15131120-2 Klobásové výrobky; 15131210-0 Údená šunka/slanina; 15131410-2 Šunka; 15131200-7 Sušené, nasolené, údené alebo korenené mäso; 60000000-8 Dopravné služby (bez prepravy odpadu)","Tovar; Služba","","https://portal.eks.sk/SpravaKniznice/OpisneFormulareKniznice/VerejnyDetailOpisnehoFormularaKniznice/207182","0","0",
