"OpisnyFormularIdentifikator","OpisnyFormularStav","OpisnyFormularNazov","OpisnyFormularKlucoveSlova","OpisnyFormularCpv","OpisnyFormularDruh","OpisnyFormularKategoriaSluzieb","OpisnyFormularUrl","OpisnyFormularPocetVyhlasenychZakaziek","OpisnyFormularObchodovanaSumaBezDPH",
"OF-238217","Po karanténe","sypké stavebné materiály ","sypké stavebné materiály - Prírodný piesok","14211100-4 Prírodný piesok; 44192000-2 Iné rôzne stavebné materiály; 60000000-8 Dopravné služby (bez prepravy odpadu)","Tovar; Služba","","https://portal.eks.sk/SpravaKniznice/OpisneFormulareKniznice/VerejnyDetailOpisnehoFormularaKniznice/238217","0","0",
"OF-238218","Po karanténe","Podlahové krytiny","Podlahové krytiny","44112230-9 Linoleum; 45432110-8 Kladenie podláh; 98300000-6 Rôzne služby; 60000000-8 Dopravné služby (bez prepravy odpadu)","Tovar; Služba","","https://portal.eks.sk/SpravaKniznice/OpisneFormulareKniznice/VerejnyDetailOpisnehoFormularaKniznice/238218","1","0",
"OF-238219","Po karanténe","Záhradný stôl a lavice","Záhradný nábytok, záhradný stôl a lavice, záhradná zostava, piknikový set","39142000-9 Záhradný nábytok","Tovar","","https://portal.eks.sk/SpravaKniznice/OpisneFormulareKniznice/VerejnyDetailOpisnehoFormularaKniznice/238219","0","0",
"OF-238221","Po karanténe","Vozidlo na zvoz odpadu","Vozidlo na zvoz odpadu a lisovanie","34144511-3 Vozidlá na odvoz smetí; 60000000-8 Dopravné služby (bez prepravy odpadu)","Tovar; Služba","","https://portal.eks.sk/SpravaKniznice/OpisneFormulareKniznice/VerejnyDetailOpisnehoFormularaKniznice/238221","1","0",
"OF-238222","Po karanténe","Osobné počítače s monitormi pre prácu s grafickými programami","osobné počítače a monitory, klávesnice, myši","30213000-5 Osobné počítače; 30213300-8 Stolový počítač; 30231000-7 Počítačové monitory a konzoly; 30231300-0 Zobrazovacie jednotky (obrazovky); 30231310-3 Ploché displeje; 60000000-8 Dopravné služby (bez prepravy odpadu)","Tovar; Služba","","https://portal.eks.sk/SpravaKniznice/OpisneFormulareKniznice/VerejnyDetailOpisnehoFormularaKniznice/238222","1","0",
"OF-238224","Po karanténe","Výpočtová technika ","Výpočtová technika, tlačiarne","30230000-0 Zariadenia súvisiace s počítačmi; 60000000-8 Dopravné služby (bez prepravy odpadu)","Tovar; Služba","","https://portal.eks.sk/SpravaKniznice/OpisneFormulareKniznice/VerejnyDetailOpisnehoFormularaKniznice/238224","1","0",
"OF-238225","Po karanténe","Stolové počítače","počítač","30213300-8 Stolový počítač; 60000000-8 Dopravné služby (bez prepravy odpadu)","Tovar; Služba","","https://portal.eks.sk/SpravaKniznice/OpisneFormulareKniznice/VerejnyDetailOpisnehoFormularaKniznice/238225","0","0",
"OF-238226","Po karanténe","Mobilný digitálny RTG prístroj s C-ramenom","RTG systém, C-rameno","33111000-1 Röntgenové prístroje; 33111800-9 Diagnostický röntgenový systém; 60000000-8 Dopravné služby (bez prepravy odpadu)","Tovar; Služba","","https://portal.eks.sk/SpravaKniznice/OpisneFormulareKniznice/VerejnyDetailOpisnehoFormularaKniznice/238226","0","0",
"OF-238229","Po karanténe","Germicídny žiarič","žiariče, sterilizačné prístroje, dezinfekčné prístroje, hygienické prístroje","33191000-5 Sterilizačné, dezinfekčné a hygienické prístroje; 60000000-8 Dopravné služby (bez prepravy odpadu)","Tovar; Služba","","https://portal.eks.sk/SpravaKniznice/OpisneFormulareKniznice/VerejnyDetailOpisnehoFormularaKniznice/238229","1","0",
"OF-238230","Po karanténe","Senzory na meranie rSO2","Senzory na meranie rSO2","33140000-3 Zdravotnícky spotrebný materiál; 60000000-8 Dopravné služby (bez prepravy odpadu)","Tovar; Služba","","https://portal.eks.sk/SpravaKniznice/OpisneFormulareKniznice/VerejnyDetailOpisnehoFormularaKniznice/238230","0","0",
"OF-238233","Po karanténe","Pulzný oxymeter","oxymeter, pulz","38430000-8 Prístroje na detekciu a rozbory; 33140000-3 Zdravotnícky spotrebný materiál; 60000000-8 Dopravné služby (bez prepravy odpadu)","Tovar; Služba","","https://portal.eks.sk/SpravaKniznice/OpisneFormulareKniznice/VerejnyDetailOpisnehoFormularaKniznice/238233","1","0",
"OF-238235","Po karanténe","IKT predmety a kancelárske potreby","IKT, webcam, batérie. euroobal, kancelársky papier","30200000-1 Počítačové zariadenia a spotrebný materiál; 30230000-0 Zariadenia súvisiace s počítačmi; 60000000-8 Dopravné služby (bez prepravy odpadu)","Tovar; Služba","","https://portal.eks.sk/SpravaKniznice/OpisneFormulareKniznice/VerejnyDetailOpisnehoFormularaKniznice/238235","0","0",
"OF-238236","Po karanténe","Počítač a monitor","PC, počítač, monitor","60000000-8 Dopravné služby (bez prepravy odpadu)","Služba","","https://portal.eks.sk/SpravaKniznice/OpisneFormulareKniznice/VerejnyDetailOpisnehoFormularaKniznice/238236","1","0",
"OF-238237","Po karanténe","Výpočtová technika","počítač, tlačiareň, projektor","30213100-6 Prenosné počítače; 30213000-5 Osobné počítače; 30232110-8 Laserové tlačiarne; 30191200-6 Spätné projektory; 60000000-8 Dopravné služby (bez prepravy odpadu)","Tovar; Služba","","https://portal.eks.sk/SpravaKniznice/OpisneFormulareKniznice/VerejnyDetailOpisnehoFormularaKniznice/238237","1","0",
"OF-238238","Po karanténe","Hygienické potreby","toaletný papier, papierové utierky,","33770000-8 Papierové hygienické výrobky; 60000000-8 Dopravné služby (bez prepravy odpadu); 33761000-2 Toaletný papier; 33772000-2 Jednorazové papierové výrobky; 33771000-5 Hygienické výrobky z papiera","Tovar; Služba","","https://portal.eks.sk/SpravaKniznice/OpisneFormulareKniznice/VerejnyDetailOpisnehoFormularaKniznice/238238","1","0",
"OF-238239","Po karanténe","Kancelárske zariadenia - skartovačky, laminovačky, rezačky, magnetické tabule","dierovačka, veľkokapacitná, kalkulačka, laminovací stroj, magnetická tabuľa, nástenná tabuľa, rezačka, kotúčová, páková, rotačná, skartovací stroj, viazač na hrebeňovú väzbu, zošívačka","30000000-9 Kancelárske a počítacie stroje, vybavenie a spotrebný materiál s výnimkou nábytku a softvérových balíkov; 30123000-7 Kancelárske a obchodné stroje; 30197000-6 Drobné kancelárske vybavenie; 30100000-0 Kancelárske stroje, vybavenie a spotrebný materiál s výnimkou počítačov, tlačiarní a nábytku; 60000000-8 Dopravné služby (bez prepravy odpadu)","Tovar; Služba","","https://portal.eks.sk/SpravaKniznice/OpisneFormulareKniznice/VerejnyDetailOpisnehoFormularaKniznice/238239","1","0",
"OF-238240","Po karanténe","Albumíny","ľudský albumín","33141540-7 Albumíny; 60000000-8 Dopravné služby (bez prepravy odpadu)","Tovar; Služba","","https://portal.eks.sk/SpravaKniznice/OpisneFormulareKniznice/VerejnyDetailOpisnehoFormularaKniznice/238240","1","0",
"OF-238241","Po karanténe","Servopohon – riadiaca jednotka a motor","pohon so safety funkciami, riadiaca jednotka","31710000-6 Elektronické zariadenia; 60000000-8 Dopravné služby (bez prepravy odpadu)","Tovar; Služba","","https://portal.eks.sk/SpravaKniznice/OpisneFormulareKniznice/VerejnyDetailOpisnehoFormularaKniznice/238241","1","0",
"OF-238242","Po karanténe","Dodávka a montáž nástennej klimatizácie Sinclair Terrel séria alebo ekvivalent","klimatiázacia, chladenie","42512000-8 Klimatizačné zariadenia; 42512200-0 Nástenné klimatizačné mechanizmy; 60000000-8 Dopravné služby (bez prepravy odpadu)","Tovar; Služba","","https://portal.eks.sk/SpravaKniznice/OpisneFormulareKniznice/VerejnyDetailOpisnehoFormularaKniznice/238242","1","0",
"OF-238243","Po karanténe","Nákup a dodávka pevných palív","uhlie, drevné palivá, pelety, palivové drevo","09111100-1 Uhlie; 09111400-4 Drevné palivá; 60000000-8 Dopravné služby (bez prepravy odpadu)","Tovar; Služba","","https://portal.eks.sk/SpravaKniznice/OpisneFormulareKniznice/VerejnyDetailOpisnehoFormularaKniznice/238243","1","0",
"OF-238246","Po karanténe","Profesionálny vysávač na mokré a suché vysávanie","vysávač","39700000-9 Spotrebiče pre domácnosť; 60000000-8 Dopravné služby (bez prepravy odpadu)","Tovar; Služba","","https://portal.eks.sk/SpravaKniznice/OpisneFormulareKniznice/VerejnyDetailOpisnehoFormularaKniznice/238246","1","0",
"OF-238247","Po karanténe","Učebné pomôcky pre katedru chémie","učebné pomôcky, destilačný set, destilačná sústava, elektrochemická súprava, rukavice, elektrochémia, model atómu","39162200-7 Učebné pomôcky a zariadenia; 60000000-8 Dopravné služby (bez prepravy odpadu)","Tovar; Služba","","https://portal.eks.sk/SpravaKniznice/OpisneFormulareKniznice/VerejnyDetailOpisnehoFormularaKniznice/238247","0","0",
"OF-238248","Po karanténe","Počítačové vybavenie a počítač","klávesnica, pamäť RAM, pevný disk SSD, prenosný počítač, Wi-Fi sieťový smerovač","30236000-2 Rôzne počítačové vybavenie; 30233132-5 Mechaniky pevného disku; 30237460-1 Počítačové klávesnice; 30213100-6 Prenosné počítače; 32413100-2 Sieťové smerovače; 60000000-8 Dopravné služby (bez prepravy odpadu)","Tovar; Služba","","https://portal.eks.sk/SpravaKniznice/OpisneFormulareKniznice/VerejnyDetailOpisnehoFormularaKniznice/238248","1","0",
"OF-238249","Po karanténe","Elektrospotrebiče","varné kanvice , variče, chladničky, rádioprijímače, ventilátory","39711440-5 Variče; 39711130-9 Chladničky; 60000000-8 Dopravné služby (bez prepravy odpadu)","Tovar; Služba","","https://portal.eks.sk/SpravaKniznice/OpisneFormulareKniznice/VerejnyDetailOpisnehoFormularaKniznice/238249","1","0",
"OF-238250","Po karanténe","Kahan s kartušou+ náhradný cartridge, Fuego SCS basic","Kahan, cartridge pre Bunsenov horák","38000000-5 Laboratórne, optické a presné prístroje a vybavenie (s výnimkou skiel); 60000000-8 Dopravné služby (bez prepravy odpadu)","Tovar; Služba","","https://portal.eks.sk/SpravaKniznice/OpisneFormulareKniznice/VerejnyDetailOpisnehoFormularaKniznice/238250","1","0",
"OF-238251","Po karanténe","OOPP - odev, obuv","ochranné oblečenie, obuv","18100000-0 Pracovné odevy, špeciálne pracovné odevy a doplnky; 18830000-6 Ochranná obuv","Tovar; Služba","","https://portal.eks.sk/SpravaKniznice/OpisneFormulareKniznice/VerejnyDetailOpisnehoFormularaKniznice/238251","0","0",
"OF-238252","Po karanténe","Sonografický prístroj najvyššej triedy pre kardiológiu","USG prístroj, ultrasonografický prístroj","33124120-2 Diagnostické ultrazvukové prístroje; 60000000-8 Dopravné služby (bez prepravy odpadu)","Tovar; Služba","","https://portal.eks.sk/SpravaKniznice/OpisneFormulareKniznice/VerejnyDetailOpisnehoFormularaKniznice/238252","0","0",
"OF-238257","Po karanténe","Kancelárske kreslá","kreslo","39113100-8 Kreslá; 60000000-8 Dopravné služby (bez prepravy odpadu)","Tovar; Služba","","https://portal.eks.sk/SpravaKniznice/OpisneFormulareKniznice/VerejnyDetailOpisnehoFormularaKniznice/238257","0","0",
"OF-238258","Po karanténe","Holmiový laser pre urológiu","laser, holmium, urológia, urolitiáza","33169100-3 Chirurgický laser; 51410000-9 Inštalácia lekárskych zariadení; 80511000-9 Školenie pracovníkov; 60000000-8 Dopravné služby (bez prepravy odpadu)","Tovar; Služba","","https://portal.eks.sk/SpravaKniznice/OpisneFormulareKniznice/VerejnyDetailOpisnehoFormularaKniznice/238258","0","0",
"OF-238261","Po karanténe","Disekčno-koagulačný systém na mäkké biologické tkanivové štruktúry","Elektro-generátor, Monopolárne a bipolárne rezanie, Monopolárne a bipolárne koagulačné režimy, Štandardný rez, Laparoskopický rez, Suchý rez, Precízny rez, Štandardný bipolárny rez, Argónový rez, Ľahká koagulácia, Forsírovaná koagulácia, Iskrivá koagulácia, Bezkontaktná - sprejová koagulácia, Laparoskopická koagulácia, Dvojkoagulácia, Vysokovýkonná koagulácia, Bipolárna štandardná koagulácia, Bipolárna forsírovaná koagulácia, Bipolárna simultánna koagulácia","33161000-6 Elektrochirurgické jednotky; 51410000-9 Inštalácia lekárskych zariadení; 80561000-4 Zdravotnícke školenia","Tovar; Služba","","https://portal.eks.sk/SpravaKniznice/OpisneFormulareKniznice/VerejnyDetailOpisnehoFormularaKniznice/238261","0","0",
"OF-238265","Po karanténe","Náhradné diely na autobusy Sor NB12,NB18 - Hnacie ústrojenstvo","Náhradné diely, autobus,Sor NB12,NB18,hnacie ústrojenstvo","34300000-0 Časti a príslušenstvo vozidiel a ich motorov; 60000000-8 Dopravné služby (bez prepravy odpadu)","Tovar","","https://portal.eks.sk/SpravaKniznice/OpisneFormulareKniznice/VerejnyDetailOpisnehoFormularaKniznice/238265","1","0",
"OF-238267","Po karanténe","Náhradné diely na Sor NB12,NB18 - elektro","Náhradné diely, autobus,Sor,elektro","34300000-0 Časti a príslušenstvo vozidiel a ich motorov; 60000000-8 Dopravné služby (bez prepravy odpadu)","Tovar","","https://portal.eks.sk/SpravaKniznice/OpisneFormulareKniznice/VerejnyDetailOpisnehoFormularaKniznice/238267","1","0",
"OF-238269","Po karanténe","Náhradné diely na autobusy Sor NB12,NB18 - podvozok","Náhradné diely, autobus,Sor NB12,NB18,podvozok","34300000-0 Časti a príslušenstvo vozidiel a ich motorov; 60000000-8 Dopravné služby (bez prepravy odpadu)","Tovar","","https://portal.eks.sk/SpravaKniznice/OpisneFormulareKniznice/VerejnyDetailOpisnehoFormularaKniznice/238269","1","0",
"OF-238270","Po karanténe","Náhradné diely na Sor NB12,NB18 - elektro","Náhradné diely, autobus,Sor,elektro","34300000-0 Časti a príslušenstvo vozidiel a ich motorov; 60000000-8 Dopravné služby (bez prepravy odpadu)","Tovar","","https://portal.eks.sk/SpravaKniznice/OpisneFormulareKniznice/VerejnyDetailOpisnehoFormularaKniznice/238270","1","0",
"OF-238271","Po karanténe","Náhradné diely na autobusy Sor NB12,NB18 - zasklenie","Náhradné diely, autobus,Sor NB12,NB18,zasklenie","34913000-0 Rôzne náhradné diely; 60000000-8 Dopravné služby (bez prepravy odpadu)","Tovar","","https://portal.eks.sk/SpravaKniznice/OpisneFormulareKniznice/VerejnyDetailOpisnehoFormularaKniznice/238271","1","0",
"OF-238272","Po karanténe","Xerografický papier","Papier, papier na kopírovanie a xerografický papier","30197642-8 Papier na fotokopírovanie a xerografický papier; 60000000-8 Dopravné služby (bez prepravy odpadu)","Tovar; Služba","","https://portal.eks.sk/SpravaKniznice/OpisneFormulareKniznice/VerejnyDetailOpisnehoFormularaKniznice/238272","1","0",
"OF-238273","Po karanténe","Náhradné diely na autobusy Sor NB12,NB18 - Hnacie ústrojenstvo","Náhradné diely, autobus,Sor NB12,NB18,hnacie ústrojenstvo","34300000-0 Časti a príslušenstvo vozidiel a ich motorov; 60000000-8 Dopravné služby (bez prepravy odpadu)","Tovar","","https://portal.eks.sk/SpravaKniznice/OpisneFormulareKniznice/VerejnyDetailOpisnehoFormularaKniznice/238273","1","0",
"OF-238274","Po karanténe","Náhradné diely na autobusy Sor NB12,NB18 - podvozok","Náhradné diely, autobus,Sor NB12,NB18,podvozok","34300000-0 Časti a príslušenstvo vozidiel a ich motorov; 60000000-8 Dopravné služby (bez prepravy odpadu)","Tovar","","https://portal.eks.sk/SpravaKniznice/OpisneFormulareKniznice/VerejnyDetailOpisnehoFormularaKniznice/238274","1","0",
"OF-238275","Po karanténe","Náhradné diely na autobusy Sor NB12,NB18 - podvozok","Náhradné diely, autobus,Sor NB12,NB18,podvozok","34300000-0 Časti a príslušenstvo vozidiel a ich motorov; 60000000-8 Dopravné služby (bez prepravy odpadu)","Tovar","","https://portal.eks.sk/SpravaKniznice/OpisneFormulareKniznice/VerejnyDetailOpisnehoFormularaKniznice/238275","1","0",
"OF-238278","Po karanténe","Náhradné diely na Sor NB12,NB18 - elektro","Náhradné diely, autobus,Sor,elektro","34300000-0 Časti a príslušenstvo vozidiel a ich motorov; 60000000-8 Dopravné služby (bez prepravy odpadu)","Tovar","","https://portal.eks.sk/SpravaKniznice/OpisneFormulareKniznice/VerejnyDetailOpisnehoFormularaKniznice/238278","1","0",
"OF-238279","Po karanténe","Náhradné diely na Sor NB12,NB18 - elektro","Náhradné diely, autobus,Sor,elektro","34300000-0 Časti a príslušenstvo vozidiel a ich motorov; 60000000-8 Dopravné služby (bez prepravy odpadu)","Tovar","","https://portal.eks.sk/SpravaKniznice/OpisneFormulareKniznice/VerejnyDetailOpisnehoFormularaKniznice/238279","1","0",
"OF-238280","Po karanténe","Petriho misky, nitrilové rukavice","zdravotnícky materiál, laboratórny materiál, Petriho miska, nitrilové rukavice","33140000-3 Zdravotnícky spotrebný materiál; 19520000-7 Plastové výrobky; 60000000-8 Dopravné služby (bez prepravy odpadu)","Tovar; Služba","","https://portal.eks.sk/SpravaKniznice/OpisneFormulareKniznice/VerejnyDetailOpisnehoFormularaKniznice/238280","1","0",
"OF-238281","Po karanténe","Odber, preprava a zhodnotenie/zneškodnenie odpadov","Odber, preprava a zhodnotenie/zneškodnenie odpadov","90512000-9 Služby na prepravu odpadu; 90510000-5 Likvidácia a spracovanie odpadu; 90500000-2 Služby súvisiace s likvidáciou odpadu a odpadom","Služba","","https://portal.eks.sk/SpravaKniznice/OpisneFormulareKniznice/VerejnyDetailOpisnehoFormularaKniznice/238281","0","0",
"OF-238283","Po karanténe","Laboratórna sušička","laboratórna sušička, laboratórne vybavenie, sušiareň","38000000-5 Laboratórne, optické a presné prístroje a vybavenie (s výnimkou skiel); 60000000-8 Dopravné služby (bez prepravy odpadu)","Tovar; Služba","","https://portal.eks.sk/SpravaKniznice/OpisneFormulareKniznice/VerejnyDetailOpisnehoFormularaKniznice/238283","1","0",
"OF-238284","Po karanténe","Náhradné diely na autobusy Sor NB12,NB18 - podvozok","Náhradné diely, autobus,Sor NB12,NB18,podvozok","34300000-0 Časti a príslušenstvo vozidiel a ich motorov; 60000000-8 Dopravné služby (bez prepravy odpadu)","Tovar","","https://portal.eks.sk/SpravaKniznice/OpisneFormulareKniznice/VerejnyDetailOpisnehoFormularaKniznice/238284","1","0",
"OF-238285","Po karanténe","Náhradné dielce do generátorov a elektrocentrál","Filter palivový","31161000-2 Časti elektromotorov a generátorov; 34913000-0 Rôzne náhradné diely; 60000000-8 Dopravné služby (bez prepravy odpadu)","Tovar","","https://portal.eks.sk/SpravaKniznice/OpisneFormulareKniznice/VerejnyDetailOpisnehoFormularaKniznice/238285","1","0",
"OF-238286","Po karanténe","Náhradné diely na autobusy Solaris U15 - podvozok","Náhradné diely, autobus,Solaris U15,podvozok","34300000-0 Časti a príslušenstvo vozidiel a ich motorov; 60000000-8 Dopravné služby (bez prepravy odpadu)","Tovar","","https://portal.eks.sk/SpravaKniznice/OpisneFormulareKniznice/VerejnyDetailOpisnehoFormularaKniznice/238286","1","0",
"OF-238289","Po karanténe","Bagety","Bagety","15811511-1 Pripravené sendviče; 15800000-6 Rôzne potravinárske výrobky; 60000000-8 Dopravné služby (bez prepravy odpadu)","Tovar; Služba","","https://portal.eks.sk/SpravaKniznice/OpisneFormulareKniznice/VerejnyDetailOpisnehoFormularaKniznice/238289","0","0",
"OF-238290","Po karanténe","Dodávka a montáž klimatizácie ","Klimatizácia, vonkajšia, vnútorná klimatizačná jednotka, montáž, inštalácia","42512000-8 Klimatizačné zariadenia; 45331220-4 Inštalovanie klimatizácie; 60000000-8 Dopravné služby (bez prepravy odpadu)","Tovar; Služba","","https://portal.eks.sk/SpravaKniznice/OpisneFormulareKniznice/VerejnyDetailOpisnehoFormularaKniznice/238290","1","0",
"OF-238291","Po karanténe","Osobný počítač","Počítač, Pamäť, WIFI, BT","30213300-8 Stolový počítač; 30230000-0 Zariadenia súvisiace s počítačmi; 60000000-8 Dopravné služby (bez prepravy odpadu)","Tovar; Služba","","https://portal.eks.sk/SpravaKniznice/OpisneFormulareKniznice/VerejnyDetailOpisnehoFormularaKniznice/238291","0","0",
"OF-238292","Po karanténe","Ručné nástroje s pohonom","Vŕtačka,  flexi brúska, uhlová brúska","43132300-0 Vŕtačky; 33136000-2 Rotačné a brúsne nástroje; 60000000-8 Dopravné služby (bez prepravy odpadu); 14810000-2 Brúsne produkty; 43830000-0 Mechanické náradie; 43800000-1 Dielenské zariadenia","Tovar; Služba","","https://portal.eks.sk/SpravaKniznice/OpisneFormulareKniznice/VerejnyDetailOpisnehoFormularaKniznice/238292","1","0",
"OF-238295","Po karanténe","Materiál na vytvorenie náučného chodníka ","neviditeľný plastový obrubník, plastové kotvy, agrotextília","44190000-8 Rôzne stavebné materiály; 19500000-1 Gumené a plastové materiály; 19520000-7 Plastové výrobky; 44912400-0 Obrubníky; 34913800-8 Kotvy; 60000000-8 Dopravné služby (bez prepravy odpadu); 44111000-1 Stavebné materiály","Tovar; Služba","","https://portal.eks.sk/SpravaKniznice/OpisneFormulareKniznice/VerejnyDetailOpisnehoFormularaKniznice/238295","0","0",
"OF-238296","Po karanténe","Invertovaný mikroskop s kamerou","mikroskop, kamera","38510000-3 Mikroskopy; 60000000-8 Dopravné služby (bez prepravy odpadu)","Tovar; Služba","","https://portal.eks.sk/SpravaKniznice/OpisneFormulareKniznice/VerejnyDetailOpisnehoFormularaKniznice/238296","1","0",
"OF-238297","Po karanténe","Nábytok - EKS","Nábytok, školská lavica, Školská stolička","39000000-2 Nábytok (vrátane kancelárskeho nábytku), zariadenie interiéru, domáce spotrebiče (s výnimkou osvetlenia) a čistiace prostriedky","Tovar","","https://portal.eks.sk/SpravaKniznice/OpisneFormulareKniznice/VerejnyDetailOpisnehoFormularaKniznice/238297","1","0",
"OF-238298","Po karanténe","Tlačiarenské služby","tlač, tlačiarenské služby","79810000-5 Tlačiarenské služby; 60000000-8 Dopravné služby (bez prepravy odpadu)","Služba; Tovar","","https://portal.eks.sk/SpravaKniznice/OpisneFormulareKniznice/VerejnyDetailOpisnehoFormularaKniznice/238298","0","0",
"OF-238300","Po karanténe","Pracovná pánska zimná bunda","Pracovná pánska zimná bunda","18221200-6 Bundy; 18110000-3 Pracovné odevy; 18140000-2 Doplnky pracovných odevov; 35113400-3 Ochranné a bezpečnostné odevy; 18221000-4 Nepremokavé odevy; 18300000-2 Odevy; 60000000-8 Dopravné služby (bez prepravy odpadu)","Tovar; Služba","","https://portal.eks.sk/SpravaKniznice/OpisneFormulareKniznice/VerejnyDetailOpisnehoFormularaKniznice/238300","0","0",
"OF-238303","Po karanténe","Ručné náradie s pohonom","vŕtacie kladivo, Aku vŕtací skrutkovač","42652000-1 Ručné elektromechanické nástroje; 60000000-8 Dopravné služby (bez prepravy odpadu)","Tovar; Služba","","https://portal.eks.sk/SpravaKniznice/OpisneFormulareKniznice/VerejnyDetailOpisnehoFormularaKniznice/238303","0","0",
"OF-238304","Po karanténe","ŠZM - krvné vaky","vaky na krv, prístroje na odber a spracovanie krvi","33141613-0 Vaky na krv; 60000000-8 Dopravné služby (bez prepravy odpadu)","Tovar","","https://portal.eks.sk/SpravaKniznice/OpisneFormulareKniznice/VerejnyDetailOpisnehoFormularaKniznice/238304","1","0",
"OF-238305","Po karanténe","Dielenské vybavenie","Dvojstĺpový zdvihák 4T poloautomatický, bezolejový kompresor, pneumatický mazací lis, lis mazací pákový","34326200-0 Zdviháky vozidiel; 42123000-7 Kompresory; 60000000-8 Dopravné služby (bez prepravy odpadu)","Tovar; Služba","","https://portal.eks.sk/SpravaKniznice/OpisneFormulareKniznice/VerejnyDetailOpisnehoFormularaKniznice/238305","0","0",
"OF-238307","Po karanténe","Prenosná audio-vizuálna technika ","prenosná réžia, monitor, rekordér, diaľkový ovládač HDBaseT PTZ kamier, audio pult a enkodér, HDBaseT kamera, HDMI > USB 3.0 UVC prevodník, CAT5E sieťový kábel navinutý na bubon, prevodník, streaming bridge","32321200-1 Audiovizuálne zariadenia; 60000000-8 Dopravné služby (bez prepravy odpadu)","Tovar; Služba","","https://portal.eks.sk/SpravaKniznice/OpisneFormulareKniznice/VerejnyDetailOpisnehoFormularaKniznice/238307","0","0",
"OF-238308","Po karanténe","Nepudrované jednorazové rukavice z nitrilu","Nepudrované jednorazové rukavice z nitrilu","18424300-0 Jednorazové rukavice; 33140000-3 Zdravotnícky spotrebný materiál; 60000000-8 Dopravné služby (bez prepravy odpadu)","Tovar; Služba","","https://portal.eks.sk/SpravaKniznice/OpisneFormulareKniznice/VerejnyDetailOpisnehoFormularaKniznice/238308","0","0",
"OF-238309","Po karanténe","E-Platničky do RTCA prístroja","platničky","19500000-1 Gumené a plastové materiály; 60000000-8 Dopravné služby (bez prepravy odpadu)","Tovar; Služba","","https://portal.eks.sk/SpravaKniznice/OpisneFormulareKniznice/VerejnyDetailOpisnehoFormularaKniznice/238309","0","0",
"OF-238310","Po karanténe","E-Platničky do RTCA prístroja","platničky","19500000-1 Gumené a plastové materiály; 60000000-8 Dopravné služby (bez prepravy odpadu)","Tovar; Služba","","https://portal.eks.sk/SpravaKniznice/OpisneFormulareKniznice/VerejnyDetailOpisnehoFormularaKniznice/238310","1","0",
"OF-238317","Po karanténe","Nákup motorového vozidla kombi","motorové vozidlo -na prepravu osôb , tovaru , batožiny","34100000-8 Motorové vozidlá; 34110000-1 Osobné automobily; 34111100-9 Polododávky (automobil kombi)","Tovar","","https://portal.eks.sk/SpravaKniznice/OpisneFormulareKniznice/VerejnyDetailOpisnehoFormularaKniznice/238317","0","0",
"OF-238320","Po karanténe","Nákup motorového vozidla kombi","Motorové vozidlo – na prepravu osôb , tovaru , batožiny","34100000-8 Motorové vozidlá; 34110000-1 Osobné automobily; 34111100-9 Polododávky (automobil kombi)","Tovar","","https://portal.eks.sk/SpravaKniznice/OpisneFormulareKniznice/VerejnyDetailOpisnehoFormularaKniznice/238320","0","0",
