"OpisnyFormularIdentifikator","OpisnyFormularStav","OpisnyFormularNazov","OpisnyFormularKlucoveSlova","OpisnyFormularCpv","OpisnyFormularDruh","OpisnyFormularKategoriaSluzieb","OpisnyFormularUrl","OpisnyFormularPocetVyhlasenychZakaziek","OpisnyFormularObchodovanaSumaBezDPH",
"OF-206929","Po karanténe","Dodávka potravín ","Potraviny","15000000-8 Potraviny, nápoje, tabak a príbuzné produkty; 15550000-8 Mliečne výrobky rôznych druhov; 15131310-1 Paštéta; 15131230-6 Saláma","Tovar; Služba","","https://portal.eks.sk/SpravaKniznice/OpisneFormulareKniznice/VerejnyDetailOpisnehoFormularaKniznice/206929","0","0",
"OF-206930","Po karanténe","Kombinovaná chladnička -Chladnička s mrazničkou","Chladnička, mraznička","39710000-2 Elektrické prístroje pre domácnosť; 39711110-3 Chladničky s mrazničkou; 39711100-0 Chladničky a mrazničky; 60000000-8 Dopravné služby (bez prepravy odpadu)","Tovar; Služba","","https://portal.eks.sk/SpravaKniznice/OpisneFormulareKniznice/VerejnyDetailOpisnehoFormularaKniznice/206930","1","0",
"OF-206931","Po karanténe","Tonery - originál","toner, počítač","30125100-2 Tonerové náplne; 30125110-5 Toner do laserových tlačiarní/faxových prístrojov; 60000000-8 Dopravné služby (bez prepravy odpadu)","Tovar; Služba","","https://portal.eks.sk/SpravaKniznice/OpisneFormulareKniznice/VerejnyDetailOpisnehoFormularaKniznice/206931","1","0",
"OF-206932","Po karanténe","Notebook ASUS X509UA","notebook","30213100-6 Prenosné počítače; 60000000-8 Dopravné služby (bez prepravy odpadu)","Tovar; Služba","","https://portal.eks.sk/SpravaKniznice/OpisneFormulareKniznice/VerejnyDetailOpisnehoFormularaKniznice/206932","0","0",
"OF-206933","Po karanténe","Telekomunikačné služby","telekomunikačné služby, mobil, dáta, internet","64200000-8 Telekomunikačné služby; 64212000-5 Mobilné telefónne služby; 64216110-7 Služby elektronickej výmeny údajov; 72400000-4 Internetové služby; 60000000-8 Dopravné služby (bez prepravy odpadu); 32250000-0 Mobilné telefóny","Služba; Tovar","","https://portal.eks.sk/SpravaKniznice/OpisneFormulareKniznice/VerejnyDetailOpisnehoFormularaKniznice/206933","0","0",
"OF-206934","Po karanténe","Čerstvé mäso","bravčové mäso, hovädzie mäso, stehno, karé, plece, hovädzia roštenka, kliška, špikové kosti,","15110000-2 Mäso; 60000000-8 Dopravné služby (bez prepravy odpadu)","Tovar; Služba","","https://portal.eks.sk/SpravaKniznice/OpisneFormulareKniznice/VerejnyDetailOpisnehoFormularaKniznice/206934","0","0",
"OF-206936","Po karanténe","Pneumatiky  Mitas 7,50-16 NB37 SATIM 10PR ","Pneumatiky Mitas 7,50-16 NB37 SATIM 10PR  zimné","34351100-3 Pneumatiky pre motorové vozidlá; 60000000-8 Dopravné služby (bez prepravy odpadu)","Tovar; Služba","","https://portal.eks.sk/SpravaKniznice/OpisneFormulareKniznice/VerejnyDetailOpisnehoFormularaKniznice/206936","1","175,000",
"OF-206939","Po karanténe","Čerstvé slepačie vajcia","vajcia, slepačie vajcia, čerstvé vajcia","03142500-3 Vajcia","Tovar","","https://portal.eks.sk/SpravaKniznice/OpisneFormulareKniznice/VerejnyDetailOpisnehoFormularaKniznice/206939","1","0",
"OF-206940","Po karanténe","Originálne tonery ","Fotokopírovanie, kopírovanie, skenovanie, tlač","30125100-2 Tonerové náplne; 30125110-5 Toner do laserových tlačiarní/faxových prístrojov; 30125120-8 Toner do fotokopírovacích strojov; 60000000-8 Dopravné služby (bez prepravy odpadu)","Tovar; Služba","","https://portal.eks.sk/SpravaKniznice/OpisneFormulareKniznice/VerejnyDetailOpisnehoFormularaKniznice/206940","1","0",
"OF-206942","Po karanténe","Bazénová chémia","bazén, chémia","33631600-8 Antiseptiká a dezinfekčné prostriedky; 38910000-7 Vybavenie na monitorovanie a testovanie hygieny; 60000000-8 Dopravné služby (bez prepravy odpadu)","Tovar; Služba","","https://portal.eks.sk/SpravaKniznice/OpisneFormulareKniznice/VerejnyDetailOpisnehoFormularaKniznice/206942","0","0",
"OF-206943","Po karanténe","Výpočtová technika – komponenty a príslušenstvo","RAM, procesor, disk, zdroj, doska, tablet, čítačka kníh","30237000-9 Časti a príslušenstvo počítačov a spotrebný materiál k nim; 30233000-1 Archivačné a čítacie zariadenia; 30213100-6 Prenosné počítače; 60000000-8 Dopravné služby (bez prepravy odpadu)","Tovar; Služba","","https://portal.eks.sk/SpravaKniznice/OpisneFormulareKniznice/VerejnyDetailOpisnehoFormularaKniznice/206943","0","0",
"OF-206945","Po karanténe","Pranie, žehlenie, dezinfekcia a chemické čistenie hotelovej bielizne a kuchynského textilu. Odvoz, dovoz a balenie prádla. ","pranie, čistenie, dezinfekcia, bielenie, žehlenie, skladanie, balenie/triedenie, dovoz čistej hygienickej bielizne a odvoz použitej bielizne","98310000-9 Pranie a chemické čistenie; 98311000-6 Zber bielizne; 98315000-4 Žehlenie; 60000000-8 Dopravné služby (bez prepravy odpadu)","Služba","","https://portal.eks.sk/SpravaKniznice/OpisneFormulareKniznice/VerejnyDetailOpisnehoFormularaKniznice/206945","1","0",
"OF-206946","Po karanténe","Tester elektrických inštalácií a Ovládač hrotový","prístroj, príslušenstvo, brašna","38300000-8 Meracie prístroje; 60000000-8 Dopravné služby (bez prepravy odpadu)","Tovar; Služba","","https://portal.eks.sk/SpravaKniznice/OpisneFormulareKniznice/VerejnyDetailOpisnehoFormularaKniznice/206946","0","0",
"OF-206947","Po karanténe","Chemikálie","etylalkohol, xylén","24320000-3 Základné organické chemikálie; 24960000-1 Rôzne chemické výrobky; 60000000-8 Dopravné služby (bez prepravy odpadu)","Tovar; Služba","","https://portal.eks.sk/SpravaKniznice/OpisneFormulareKniznice/VerejnyDetailOpisnehoFormularaKniznice/206947","1","0",
"OF-206948","Po karanténe","Hygienické a čistiace potreby","hygienické potreby, čistiace potreby","39800000-0 Čistiace a leštiace výrobky; 33700000-7 Predmety osobnej starostlivosti; 60000000-8 Dopravné služby (bez prepravy odpadu)","Tovar; Služba","","https://portal.eks.sk/SpravaKniznice/OpisneFormulareKniznice/VerejnyDetailOpisnehoFormularaKniznice/206948","1","0",
"OF-206949","Po karanténe","Grafický tablet ","tablet","30237000-9 Časti a príslušenstvo počítačov a spotrebný materiál k nim; 30237450-8 Grafické tablety; 60000000-8 Dopravné služby (bez prepravy odpadu)","Tovar; Služba","","https://portal.eks.sk/SpravaKniznice/OpisneFormulareKniznice/VerejnyDetailOpisnehoFormularaKniznice/206949","1","0",
"OF-206950","Po karanténe","Dodávka elektrickej energie","dodávka a distribúcia elektrickej energie","09310000-5 Elektrická energia; 60000000-8 Dopravné služby (bez prepravy odpadu)","Tovar; Služba","","https://portal.eks.sk/SpravaKniznice/OpisneFormulareKniznice/VerejnyDetailOpisnehoFormularaKniznice/206950","0","0",
"OF-206952","Po karanténe","Váľanda","váľanda, posteľ","39143110-0 Postele a lôžkoviny a špeciálne mäkké vybavenie; 60000000-8 Dopravné služby (bez prepravy odpadu)","Tovar; Služba","","https://portal.eks.sk/SpravaKniznice/OpisneFormulareKniznice/VerejnyDetailOpisnehoFormularaKniznice/206952","1","0",
"OF-206953","Po karanténe","Elektroinštalačný materiál","žiarovka, trubica, svorka","31532920-9 Žiarovky a žiarivkové lampy; 31519000-7 Žiarivky a neónové lampy; 60000000-8 Dopravné služby (bez prepravy odpadu)","Tovar; Služba","","https://portal.eks.sk/SpravaKniznice/OpisneFormulareKniznice/VerejnyDetailOpisnehoFormularaKniznice/206953","1","0",
"OF-206955","Po karanténe","Osobné ochranné pracovné prostriedky","slúchadlá, rukavice, okuliare, štít, opasok","18141000-9 Pracovné rukavice; 33735100-2 Ochranné okuliare; 60000000-8 Dopravné služby (bez prepravy odpadu)","Tovar; Služba","","https://portal.eks.sk/SpravaKniznice/OpisneFormulareKniznice/VerejnyDetailOpisnehoFormularaKniznice/206955","1","0",
"OF-206956","Po karanténe","Tlakový čistič","tlakový čistič","31600000-2 Elektrické zariadenia a prístroje; 60000000-8 Dopravné služby (bez prepravy odpadu)","Tovar; Služba","","https://portal.eks.sk/SpravaKniznice/OpisneFormulareKniznice/VerejnyDetailOpisnehoFormularaKniznice/206956","1","0",
"OF-206957","Po karanténe","Stavebný materiál","betón, lepiaca malta, flexibilné lepidlo, sieťka","44114000-2 Betón; 60000000-8 Dopravné služby (bez prepravy odpadu)","Tovar; Služba","","https://portal.eks.sk/SpravaKniznice/OpisneFormulareKniznice/VerejnyDetailOpisnehoFormularaKniznice/206957","1","0",
"OF-206958","Po karanténe","Ručné náradie a dielenský materiál","pilník, vrták, rašpľa, brúsny kotúč, kliešte","43830000-0 Mechanické náradie; 14811300-2 Brúsne kotúče; 44512700-9 Pilníky a rašple; 60000000-8 Dopravné služby (bez prepravy odpadu)","Tovar; Služba","","https://portal.eks.sk/SpravaKniznice/OpisneFormulareKniznice/VerejnyDetailOpisnehoFormularaKniznice/206958","1","0",
"OF-206959","Po karanténe","Nákup schladzovača potravín (šokéra)","Technológie, šokový schladzovač","39312000-2 Zariadenia na prípravu jedál; 39221000-7 Kuchynské vybavenie; 39310000-8 Zariadenia hromadného stravovania; 60000000-8 Dopravné služby (bez prepravy odpadu)","Tovar; Služba","","https://portal.eks.sk/SpravaKniznice/OpisneFormulareKniznice/VerejnyDetailOpisnehoFormularaKniznice/206959","1","0",
"OF-206960","Po karanténe","Združená dodávka elektrickej energie","Elektrická energia, kWh, distribúcia elektrickej energie, dodávka elektriny","09310000-5 Elektrická energia","Tovar; Služba","","https://portal.eks.sk/SpravaKniznice/OpisneFormulareKniznice/VerejnyDetailOpisnehoFormularaKniznice/206960","0","0",
"OF-206966","Po karanténe","Náhradné diely na autobusy Sor NB12,NB18 - podvozok","Náhradné diely, autobus,Sor NB12,NB18,podvozok","34200000-9 Karosérie vozidiel, prívesy alebo návesy; 60000000-8 Dopravné služby (bez prepravy odpadu); 34900000-6 Rôzne dopravné zariadenia a náhradné diely","Tovar","","https://portal.eks.sk/SpravaKniznice/OpisneFormulareKniznice/VerejnyDetailOpisnehoFormularaKniznice/206966","1","0",
"OF-206967","Po karanténe","Zabezpečenie stravovania zamestnancov prostredníctvom stravných poukážok pre rok 2020","Stravné lístky, stravné poukážky, dodanie stravných lístkov, zabezpečenie stravovania","30199770-8 Stravné poukážky; 60000000-8 Dopravné služby (bez prepravy odpadu)","Tovar; Služba","","https://portal.eks.sk/SpravaKniznice/OpisneFormulareKniznice/VerejnyDetailOpisnehoFormularaKniznice/206967","1","0",
"OF-206968","Po karanténe","Stravné poukážky na rok 2020","stravné lístky, stravné poukážky, dodanie papierových stravných poukážok, zabezpečenie stravovania","30199770-8 Stravné poukážky; 60000000-8 Dopravné služby (bez prepravy odpadu)","Tovar; Služba","","https://portal.eks.sk/SpravaKniznice/OpisneFormulareKniznice/VerejnyDetailOpisnehoFormularaKniznice/206968","1","0",
"OF-206970","Po karanténe","Inštrumentačný stolík hydraulický 2 ks","vozík na inštrumenty na operačnej sále","33100000-1 Zdravotnícke vybavenie; 60000000-8 Dopravné služby (bez prepravy odpadu)","Tovar; Služba","","https://portal.eks.sk/SpravaKniznice/OpisneFormulareKniznice/VerejnyDetailOpisnehoFormularaKniznice/206970","1","0",
"OF-206971","Po karanténe","Kancelársky papier  A4, kancelársky papier A3","papier do laserových a atramentových tlačiarní, do multifunkčných zariadení, papier na kopírovanie, papier na písanie","30197642-8 Papier na fotokopírovanie a xerografický papier; 30197643-5 Papier na fotokopírovanie; 60000000-8 Dopravné služby (bez prepravy odpadu)","Tovar; Služba","","https://portal.eks.sk/SpravaKniznice/OpisneFormulareKniznice/VerejnyDetailOpisnehoFormularaKniznice/206971","1","0",
"OF-206972","Po karanténe","priemyselná posypová soľ","posypová soľ","34927100-2 Soľ na posyp ciest; 60000000-8 Dopravné služby (bez prepravy odpadu)","Tovar; Služba","","https://portal.eks.sk/SpravaKniznice/OpisneFormulareKniznice/VerejnyDetailOpisnehoFormularaKniznice/206972","1","0",
"OF-206974","Po karanténe","Tlaková fľaša na CO2,  plyn CO2","tlaková fľaša, nádoba, plyn","44615000-4 Tlakové nádoby; 44612100-4 Tlakové fľaše na plyn; 60000000-8 Dopravné služby (bez prepravy odpadu)","Tovar; Služba","","https://portal.eks.sk/SpravaKniznice/OpisneFormulareKniznice/VerejnyDetailOpisnehoFormularaKniznice/206974","1","0",
"OF-206975","Po karanténe","Preprava mŕtvych tiel z miesta úmrtia na pitvu na príslušné pracovisko objednávateľa (ďalej len „pracovisko“) a späť z pracoviska na miesto úmrtia zomrelého, resp. jeho pohrebu – okres Komárno.","preprava, pracovisko, pohreb, mŕtve telo","98370000-7 Pohrebné a súvisiace služby","Služba","","https://portal.eks.sk/SpravaKniznice/OpisneFormulareKniznice/VerejnyDetailOpisnehoFormularaKniznice/206975","1","0",
"OF-206977","Po karanténe","Zabezpečenie stravovania zamestnancov prostredníctvom stravných poukážok","Stravné poukážky, dodanie stravných poukážok, zabezpečenie stravovania v zmluvných stravovacích zariadeniach","30199770-8 Stravné poukážky; 55520000-1 Služby hromadného stravovania; 60000000-8 Dopravné služby (bez prepravy odpadu)","Tovar; Služba","","https://portal.eks.sk/SpravaKniznice/OpisneFormulareKniznice/VerejnyDetailOpisnehoFormularaKniznice/206977","1","0",
"OF-206978","Po karanténe","Dodávka zemného plynu","dodávka zemného plynu, preprava a distribúcia zemného plynu","09123000-7 Zemný plyn; 65200000-5 Rozvod plynu a súvisiace služby","Tovar; Služba","","https://portal.eks.sk/SpravaKniznice/OpisneFormulareKniznice/VerejnyDetailOpisnehoFormularaKniznice/206978","1","0",
"OF-206979","Po karanténe","Dodávka originálnych tonerov do tlačiarní","Dodávka originálnych tonerov do tlačiarní","30125100-2 Tonerové náplne; 60000000-8 Dopravné služby (bez prepravy odpadu)","Tovar; Služba","","https://portal.eks.sk/SpravaKniznice/OpisneFormulareKniznice/VerejnyDetailOpisnehoFormularaKniznice/206979","1","0",
"OF-206980","Po karanténe","Kompletizácia a doplnenie existujúcej infúznej techniky","lineárny dávkovač, infúzna pumpa, infúzna technika, dokovacia stanica, enetrálna pumpa, transfúzna pumpa","33194100-7 Prístroje a nástroje na infúziu; 33170000-2 Anestézia a resuscitácia; 33194000-6 Prístroje a nástroje na transfúziu a infúziu; 33194110-0 Infúzne čerpadlá; 33194200-8 Prístroje a nástroje na transfúziu; 60000000-8 Dopravné služby (bez prepravy odpadu)","Tovar; Služba","","https://portal.eks.sk/SpravaKniznice/OpisneFormulareKniznice/VerejnyDetailOpisnehoFormularaKniznice/206980","0","0",
"OF-206983","Po karanténe","Nákup osobného motorového vozidla na služobné účely","osobné automobily","34110000-1 Osobné automobily; 60000000-8 Dopravné služby (bez prepravy odpadu); 34300000-0 Časti a príslušenstvo vozidiel a ich motorov; 34351100-3 Pneumatiky pre motorové vozidlá","Tovar; Služba","","https://portal.eks.sk/SpravaKniznice/OpisneFormulareKniznice/VerejnyDetailOpisnehoFormularaKniznice/206983","1","0",
"OF-206985","Po karanténe","Interiérové vybavenie učební ZŠ - nábytok","učebné pomôcky, laboratórne pracovisko, polytechnika, fyzika, katedra učiteľa, stôl, stolička, skriňa","39160000-1 Školský nábytok; 39180000-7 Laboratórny nábytok; 60000000-8 Dopravné služby (bez prepravy odpadu)","Tovar; Služba","","https://portal.eks.sk/SpravaKniznice/OpisneFormulareKniznice/VerejnyDetailOpisnehoFormularaKniznice/206985","0","0",
"OF-206986","Po karanténe","Drenážny set s fľašou","drenážny set, fľaše na drenáž, redonové fľaše","33141600-6 Zberače a zberné vaky, drenáže a súpravy; 60000000-8 Dopravné služby (bez prepravy odpadu)","Tovar; Služba","","https://portal.eks.sk/SpravaKniznice/OpisneFormulareKniznice/VerejnyDetailOpisnehoFormularaKniznice/206986","1","0",
"OF-206987","Po karanténe","Dodávka výpočtovej techniky","počítače s príslušenstvom, notebooky, tablet a tlačiarne","30213000-5 Osobné počítače; 60000000-8 Dopravné služby (bez prepravy odpadu)","Tovar; Služba","","https://portal.eks.sk/SpravaKniznice/OpisneFormulareKniznice/VerejnyDetailOpisnehoFormularaKniznice/206987","1","0",
"OF-206989","Po karanténe","kancelárske potreby","rýchloviazač, popisovač, listové spony, kalendáre, organizér","22851000-0 Rýchloviazače; 30124510-2 Popisovače; 30199792-8 Kalendáre; 30197000-6 Drobné kancelárske vybavenie; 60000000-8 Dopravné služby (bez prepravy odpadu)","Tovar; Služba","","https://portal.eks.sk/SpravaKniznice/OpisneFormulareKniznice/VerejnyDetailOpisnehoFormularaKniznice/206989","1","0",
"OF-206990","Po karanténe","Hygienické potreby","Toaletný papier","33760000-5 Toaletný papier, vreckovky, uteráky na ruky a servítky; 60000000-8 Dopravné služby (bez prepravy odpadu); 39224340-3 Koše","Tovar; Služba","","https://portal.eks.sk/SpravaKniznice/OpisneFormulareKniznice/VerejnyDetailOpisnehoFormularaKniznice/206990","1","0",
"OF-206991","Po karanténe","Čistiace prostriedky ","čistiace prostriedky, prostriedok na čistenie podláh, toaletný papier, handry","39830000-9 Čistiace výrobky; 60000000-8 Dopravné služby (bez prepravy odpadu)","Tovar; Služba","","https://portal.eks.sk/SpravaKniznice/OpisneFormulareKniznice/VerejnyDetailOpisnehoFormularaKniznice/206991","0","0",
"OF-206992","Po karanténe","Kojenecký tovar","plienky, zavinovačka","39525000-8 Rôzne hotové textilné výrobky; 60000000-8 Dopravné služby (bez prepravy odpadu)","Tovar; Služba","","https://portal.eks.sk/SpravaKniznice/OpisneFormulareKniznice/VerejnyDetailOpisnehoFormularaKniznice/206992","1","0",
"OF-206993","Po karanténe","Náhradné diely na električky -KT8 , T6 ","Náhradné diely na električky -KT8 , T6","34620000-9 Železničný a električkový vozňový park; 34622100-4 Električkové osobné vozne; 60000000-8 Dopravné služby (bez prepravy odpadu)","Tovar; Služba","","https://portal.eks.sk/SpravaKniznice/OpisneFormulareKniznice/VerejnyDetailOpisnehoFormularaKniznice/206993","1","0",
"OF-206995","Po karanténe","Posteľ - pružinová váľanda","váľanda, posteľ","39143100-7 Nábytok do spálne; 60000000-8 Dopravné služby (bez prepravy odpadu)","Tovar; Služba","","https://portal.eks.sk/SpravaKniznice/OpisneFormulareKniznice/VerejnyDetailOpisnehoFormularaKniznice/206995","0","0",
"OF-206997","Po karanténe","Združená dodávka elektrickej energie","Elektrická energia, elektrina","09310000-5 Elektrická energia","Tovar; Služba","","https://portal.eks.sk/SpravaKniznice/OpisneFormulareKniznice/VerejnyDetailOpisnehoFormularaKniznice/206997","1","0",
"OF-206999","Po karanténe","Odvoz a likvidácia biologicky rozložiteľného odpadu v kontajneroch","odvoz a likvidácia bioodpadu","90512000-9 Služby na prepravu odpadu; 34144511-3 Vozidlá na odvoz smetí; 60000000-8 Dopravné služby (bez prepravy odpadu)","Služba","","https://portal.eks.sk/SpravaKniznice/OpisneFormulareKniznice/VerejnyDetailOpisnehoFormularaKniznice/206999","1","0",
"OF-207000","Po karanténe","Odvoz komunálneho odpadu v kontajneroch s objemom  10 m3","odvoz a likvidácia veľkorozmerného, drobného stavebného odpadu a zmiešaného komunálneho odpadu","90512000-9 Služby na prepravu odpadu; 34144511-3 Vozidlá na odvoz smetí; 60000000-8 Dopravné služby (bez prepravy odpadu)","Služba","","https://portal.eks.sk/SpravaKniznice/OpisneFormulareKniznice/VerejnyDetailOpisnehoFormularaKniznice/207000","1","0",
"OF-207002","Po karanténe","Konvektomat","konvektomat","39220000-0 Kuchynské zariadenie, domáce potreby a potreby pre domáce hospodárstvo a dodávky pre stravovacie zariadenia; 60000000-8 Dopravné služby (bez prepravy odpadu)","Tovar; Služba","","https://portal.eks.sk/SpravaKniznice/OpisneFormulareKniznice/VerejnyDetailOpisnehoFormularaKniznice/207002","1","0",
"OF-207003","Po karanténe","Propagačné a športové predmety ","reklamné predmety, propagácia OP, potlač, tlačové služby","39294100-0 Informačné a propagačné výrobky; 22462000-6 Propagačný materiál; 37400000-2 Športový tovar a výbava; 30192000-1 Kancelárske potreby; 79800000-2 Tlačiarenské a príbuzné služby; 60000000-8 Dopravné služby (bez prepravy odpadu)","Tovar; Služba","","https://portal.eks.sk/SpravaKniznice/OpisneFormulareKniznice/VerejnyDetailOpisnehoFormularaKniznice/207003","0","0",
"OF-207006","Po karanténe","Software Adobe  – predĺženie podpory 2","software, adobe, connect","48421000-5 Softvérový balík na správu zariadení; 60000000-8 Dopravné služby (bez prepravy odpadu)","Tovar; Služba","","https://portal.eks.sk/SpravaKniznice/OpisneFormulareKniznice/VerejnyDetailOpisnehoFormularaKniznice/207006","1","0",
"OF-207008","Po karanténe","Propagačné predmety s potlačou","meteorologická stanica, taška, zápisník, termopohár, náprsná fľaša, krajčírske meracie pásmo, diár, dáždnik, igelitová taška","39294100-0 Informačné a propagačné výrobky; 60000000-8 Dopravné služby (bez prepravy odpadu)","Tovar; Služba","","https://portal.eks.sk/SpravaKniznice/OpisneFormulareKniznice/VerejnyDetailOpisnehoFormularaKniznice/207008","1","0",
"OF-207009","Po karanténe","Software pre zálohovanie a replikáciu virtuálnych serverov, upgrade a predĺženie podpory na 3 roky","software, backup, replication, vmware, záloha, replikácia","48710000-8 Softvérový balík na zálohovanie a obnovu; 60000000-8 Dopravné služby (bez prepravy odpadu)","Tovar; Služba","","https://portal.eks.sk/SpravaKniznice/OpisneFormulareKniznice/VerejnyDetailOpisnehoFormularaKniznice/207009","1","0",
"OF-207010","Po karanténe","Tonery a optické válce","Toner","30000000-9 Kancelárske a počítacie stroje, vybavenie a spotrebný materiál s výnimkou nábytku a softvérových balíkov; 30237310-5 Doplnkové náplne do tlačiarní; 60000000-8 Dopravné služby (bez prepravy odpadu); 30125100-2 Tonerové náplne","Tovar; Služba","","https://portal.eks.sk/SpravaKniznice/OpisneFormulareKniznice/VerejnyDetailOpisnehoFormularaKniznice/207010","0","0",
"OF-207011","Po karanténe","Software SUSE Linux Entrerprise – predĺženie podpory 3","software, suse, sles, linux","48214000-1 Softvérový balík pre sieťové operačné systémy; 60000000-8 Dopravné služby (bez prepravy odpadu)","Tovar; Služba","","https://portal.eks.sk/SpravaKniznice/OpisneFormulareKniznice/VerejnyDetailOpisnehoFormularaKniznice/207011","1","0",
"OF-207014","Po karanténe","čistiace prostriedky","Saponát,dezinfekčné prostriedky, handry, čistiace prostriedky, leštiace prostriedky..","39800000-0 Čistiace a leštiace výrobky; 39830000-9 Čistiace výrobky","Tovar; Služba","","https://portal.eks.sk/SpravaKniznice/OpisneFormulareKniznice/VerejnyDetailOpisnehoFormularaKniznice/207014","1","0",
"OF-207015","Po karanténe","Software Micro Focus – Zenworks  – predĺženie podpory 2","software, micro focus, zenworks, servicedesk","48421000-5 Softvérový balík na správu zariadení; 60000000-8 Dopravné služby (bez prepravy odpadu)","Tovar; Služba","","https://portal.eks.sk/SpravaKniznice/OpisneFormulareKniznice/VerejnyDetailOpisnehoFormularaKniznice/207015","1","0",
"OF-207016","Po karanténe","Software Vmware  – predĺženie podpory 2","software, vmware, vsphere, vcenter","48421000-5 Softvérový balík na správu zariadení; 60000000-8 Dopravné služby (bez prepravy odpadu)","Tovar; Služba","","https://portal.eks.sk/SpravaKniznice/OpisneFormulareKniznice/VerejnyDetailOpisnehoFormularaKniznice/207016","1","0",
"OF-207017","Po karanténe","Kancelársky papier","kancelársky papier biely, kancelársky papier farebný, vizitkový papier","30197642-8 Papier na fotokopírovanie a xerografický papier; 60000000-8 Dopravné služby (bez prepravy odpadu)","Tovar; Služba","","https://portal.eks.sk/SpravaKniznice/OpisneFormulareKniznice/VerejnyDetailOpisnehoFormularaKniznice/207017","0","0",
"OF-207018","Po karanténe","Elektrické prístroje","laboratórny zdroj, merací prístroj","38300000-8 Meracie prístroje; 31600000-2 Elektrické zariadenia a prístroje; 38552000-9 Elektronické merače; 38550000-5 Merače; 60000000-8 Dopravné služby (bez prepravy odpadu)","Tovar; Služba","","https://portal.eks.sk/SpravaKniznice/OpisneFormulareKniznice/VerejnyDetailOpisnehoFormularaKniznice/207018","1","0",
"OF-207019","Po karanténe","Mäso a mäsové výrobky","mäso, hovädzie mäso, bravčové mäso, mäsové výrobky","15100000-9 Živočíšne výrobky, mäso a mäsové výrobky; 15111100-0 Hovädzie mäso; 15113000-3 Bravčové mäso; 15130000-8 Mäsové výrobky","Tovar; Služba","","https://portal.eks.sk/SpravaKniznice/OpisneFormulareKniznice/VerejnyDetailOpisnehoFormularaKniznice/207019","1","0",
"OF-207020","Po karanténe","Kancelársky (xerografický) papier","papier do laserovej tlačiarne; papier do fotokopírovacieho stroja","30197642-8 Papier na fotokopírovanie a xerografický papier; 30197643-5 Papier na fotokopírovanie; 30197644-2 Xerografický papier; 60000000-8 Dopravné služby (bez prepravy odpadu)","Tovar; Služba","","https://portal.eks.sk/SpravaKniznice/OpisneFormulareKniznice/VerejnyDetailOpisnehoFormularaKniznice/207020","1","0",
"OF-207022","Po karanténe","Náhradné diely na autobusy Citelis - hnacie ústrojenstvo","Náhradné diely, autobus, Citelis, hnacie ústrojenstvo","34200000-9 Karosérie vozidiel, prívesy alebo návesy; 60000000-8 Dopravné služby (bez prepravy odpadu); 34900000-6 Rôzne dopravné zariadenia a náhradné diely","Tovar","","https://portal.eks.sk/SpravaKniznice/OpisneFormulareKniznice/VerejnyDetailOpisnehoFormularaKniznice/207022","1","0",
