"OpisnyFormularIdentifikator","OpisnyFormularStav","OpisnyFormularNazov","OpisnyFormularKlucoveSlova","OpisnyFormularCpv","OpisnyFormularDruh","OpisnyFormularKategoriaSluzieb","OpisnyFormularUrl","OpisnyFormularPocetVyhlasenychZakaziek","OpisnyFormularObchodovanaSumaBezDPH",
"OF-289458","Po karanténe","Softvérové podporné služby HCL NOTES DOMINO na 1 rok","Softvérová podpora","72261000-2 Softvérové podporné služby","Služba","","https://portal.eks.sk/SpravaKniznice/OpisneFormulareKniznice/VerejnyDetailOpisnehoFormularaKniznice/289458","1","0",
"OF-289459","Po karanténe","Kurzy pre zváračov","zváranie, STN, ZK 111 - 8, ZK 311-1, ZK 135-1, ZK 141-21, ZK 141-8, ZE 1, ZG 1, ZM 1 CO2, TIG Z-T7,Z-E3, Z-M3, ZP 83.","80500000-9 Školiace (výcvikové) služby","Služba","","https://portal.eks.sk/SpravaKniznice/OpisneFormulareKniznice/VerejnyDetailOpisnehoFormularaKniznice/289459","1","0",
"OF-289462","Po karanténe","Nákup maliarskych potrieb","štetec, valček, zárohák, mriežka, páska teflónová","39224210-3 Maliarske štetce; 60000000-8 Dopravné služby (bez prepravy odpadu)","Tovar; Služba","","https://portal.eks.sk/SpravaKniznice/OpisneFormulareKniznice/VerejnyDetailOpisnehoFormularaKniznice/289462","0","0",
"OF-289464","Po karanténe","Výpočtová technika a tlačiarne","osobný počítač, monitor, multifunkčné zariadenie, záložný zdroj, klávesnica, myš","30000000-9 Kancelárske a počítacie stroje, vybavenie a spotrebný materiál s výnimkou nábytku a softvérových balíkov; 30213000-5 Osobné počítače; 30213300-8 Stolový počítač; 30231000-7 Počítačové monitory a konzoly; 30236000-2 Rôzne počítačové vybavenie; 30237300-2 Spotrebný materiál k počítačom; 30237460-1 Počítačové klávesnice; 60000000-8 Dopravné služby (bez prepravy odpadu)","Tovar; Služba","","https://portal.eks.sk/SpravaKniznice/OpisneFormulareKniznice/VerejnyDetailOpisnehoFormularaKniznice/289464","0","0",
"OF-289466","Po karanténe","Nádoby, obaly a obalový materiál","vodeodolné boxy na kolieskach","44617000-8 Škatule/boxy; 44617300-1 Prefabrikované škatule/boxy; 60000000-8 Dopravné služby (bez prepravy odpadu)","Tovar; Služba","","https://portal.eks.sk/SpravaKniznice/OpisneFormulareKniznice/VerejnyDetailOpisnehoFormularaKniznice/289466","0","0",
"OF-289467","Po karanténe","Analytické váhy na presné naváženie látok pri príprave vzoriek","Analytické váhy, hmotnosť, laboratórne váhy","38311100-9 Elektronické analytické váhy; 60000000-8 Dopravné služby (bez prepravy odpadu)","Tovar; Služba","","https://portal.eks.sk/SpravaKniznice/OpisneFormulareKniznice/VerejnyDetailOpisnehoFormularaKniznice/289467","0","0",
"OF-289468","Po karanténe","Chladiaca skriňa 1 300l","Chladiaca skriňa","39711130-9 Chladničky; 39711123-7 Stojaté chladničky; 60000000-8 Dopravné služby (bez prepravy odpadu)","Tovar; Služba","","https://portal.eks.sk/SpravaKniznice/OpisneFormulareKniznice/VerejnyDetailOpisnehoFormularaKniznice/289468","0","0",
"OF-289469","Po karanténe","Kontroly prenosných hasiacich prístrojov","hasiace prístroje, kontroly","71356100-9 Technická kontrola; 60000000-8 Dopravné služby (bez prepravy odpadu)","Služba","","https://portal.eks.sk/SpravaKniznice/OpisneFormulareKniznice/VerejnyDetailOpisnehoFormularaKniznice/289469","1","0",
"OF-289472","Po karanténe","Policajný materiál","Púzdro opaskové","35820000-8 Pomocný výstroj; 60000000-8 Dopravné služby (bez prepravy odpadu)","Tovar; Služba","","https://portal.eks.sk/SpravaKniznice/OpisneFormulareKniznice/VerejnyDetailOpisnehoFormularaKniznice/289472","0","0",
"OF-289473","Po karanténe","Mobilné prenosné klimatizácie a príslušenstvo","klimatizácia, mobilná klimatizácia, prenosná klimatizácia, klíma, chladenie","39717200-3 Klimatizačné spotrebiče; 60000000-8 Dopravné služby (bez prepravy odpadu)","Tovar; Služba","","https://portal.eks.sk/SpravaKniznice/OpisneFormulareKniznice/VerejnyDetailOpisnehoFormularaKniznice/289473","0","0",
"OF-289475","Po karanténe","Tmely, konzervačné materiály a lepidlá ","Tmel, lepidlo sekundové, čistič bŕzd, ochrana podvozkov, ochrana dutín, montážna pasta, kontakt sprej, silikón, lepidlo","44831300-7 Tesniace tmely; 24911200-5 Spojivá; 44831100-5 Tmely; 24951400-9 Chemicky upravené tuky a oleje; 24963000-2 Antikorozívne výrobky; 60000000-8 Dopravné služby (bez prepravy odpadu)","Tovar; Služba","","https://portal.eks.sk/SpravaKniznice/OpisneFormulareKniznice/VerejnyDetailOpisnehoFormularaKniznice/289475","0","0",
"OF-289476","Po karanténe","Neplánované opravy a ošetrenia kolesových traktorov","Servis vozidiel, opravy vozidiel, údržba vozidiel","50100000-6 Opravy, údržba a súvisiace služby pre vozidlá a príbuzné vybavenie; 16700000-2 Traktory/ťahače; 60000000-8 Dopravné služby (bez prepravy odpadu)","Služba","","https://portal.eks.sk/SpravaKniznice/OpisneFormulareKniznice/VerejnyDetailOpisnehoFormularaKniznice/289476","0","0",
"OF-289478","Po karanténe","Železiarske výrobky a brusivá","Kruhový pilník na železo, Podložka kruhová, Kĺbová skrutka, Mechanický samozamykací zámok, Bezpečnostná rukoväť , Bezpečnostná cylindrická vložka","44520000-1 Zámky, kľúče a pánty; 44522400-9 Časti zámkov; 44521130-8 Zosilnená bezpečnostná zámka; 44316000-8 Železiarsky tovar; 44512700-9 Pilníky a rašple; 60000000-8 Dopravné služby (bez prepravy odpadu)","Tovar; Služba","","https://portal.eks.sk/SpravaKniznice/OpisneFormulareKniznice/VerejnyDetailOpisnehoFormularaKniznice/289478","1","0",
"OF-289481","Po karanténe","Nákup ručných fréz na asfalt a betón a priemyselných vysávačov","fréza, priemyselný vysávač","42999100-6 Vysávače prachu nie pre domácnosť; 43312100-4 Zrovnávacie frézovačky; 60000000-8 Dopravné služby (bez prepravy odpadu)","Tovar","","https://portal.eks.sk/SpravaKniznice/OpisneFormulareKniznice/VerejnyDetailOpisnehoFormularaKniznice/289481","0","0",
"OF-289483","Po karanténe","Náterové hmoty, farby a riedidlá","syntetická farba vrchná, farba základná, sprej","44810000-1 Náterové farby; 44832200-3 Riedidlá; 60000000-8 Dopravné služby (bez prepravy odpadu)","Tovar; Služba","","https://portal.eks.sk/SpravaKniznice/OpisneFormulareKniznice/VerejnyDetailOpisnehoFormularaKniznice/289483","1","0",
"OF-289484","Po karanténe","Odber, preprava a zneškodnenie obyčajného odpadu ","služby v oblasti nakladania s odpadmi - odber, preprava a nakladanie, zhodnotenie, resp. zneškodnenie odpadov, ktorý vzniká zo zdravotnej starostlivosti a celkovej prevádzky verejného obstarávateľa","90513000-6 Služby na spracovanie a likvidáciu nie nebezpečného odpadu; 90524400-0 Zber, doprava a likvidácia nemocničného odpadu","Služba","","https://portal.eks.sk/SpravaKniznice/OpisneFormulareKniznice/VerejnyDetailOpisnehoFormularaKniznice/289484","0","0",
"OF-289486","Po karanténe","Kurz na rozšírenie vodičského oprávnenia zo skupiny ""B"" na ""C"" ,  z ""C"" na ""CE"" a z ""C"" na ""D""","Kurz na rozšírenie vodičského oprávnenia","80411000-8 Autoškoly","Služba","","https://portal.eks.sk/SpravaKniznice/OpisneFormulareKniznice/VerejnyDetailOpisnehoFormularaKniznice/289486","0","0",
"OF-289487","Po karanténe","Školenie vodičov ADR","základné školenie vodičov ADR, školenie vodičov ADR rozšírené o triedu 1, školenie vodičov ADR rozšírené o cisterny, obnovovacie školenie, bezpečnostný poradca ADR","79632000-3 Školenia a výcvik personálu; 80510000-2 Služby týkajúce sa odborných školení; 80500000-9 Školiace (výcvikové) služby","Služba","","https://portal.eks.sk/SpravaKniznice/OpisneFormulareKniznice/VerejnyDetailOpisnehoFormularaKniznice/289487","0","0",
"OF-289489","Po karanténe","Nové 7-miestne motorové vozidlo","osobné motorové vozidlo, nové, 7 miest","34110000-1 Osobné automobily","Tovar; Služba","","https://portal.eks.sk/SpravaKniznice/OpisneFormulareKniznice/VerejnyDetailOpisnehoFormularaKniznice/289489","0","0",
