"OpisnyFormularIdentifikator","OpisnyFormularStav","OpisnyFormularNazov","OpisnyFormularKlucoveSlova","OpisnyFormularCpv","OpisnyFormularDruh","OpisnyFormularKategoriaSluzieb","OpisnyFormularUrl","OpisnyFormularPocetVyhlasenychZakaziek","OpisnyFormularObchodovanaSumaBezDPH",
"OF-258706","Po karanténe","Opravy a údržba veľkokuchynských zariadení","servis, pozáručné opravy veľkokuchynských strojov a zariadení, gastro zariadenie","50883000-8 Opravy a údržba zariadenia pre verejné stravovanie; 60000000-8 Dopravné služby (bez prepravy odpadu)","Služba","","https://portal.eks.sk/SpravaKniznice/OpisneFormulareKniznice/VerejnyDetailOpisnehoFormularaKniznice/258706","1","0",
"OF-258708","Po karanténe","Špeciálny spotrebný materiál a inštalácia","špeciálny spotrbný materiál, výrobky","39230000-3 Špeciálne výrobky; 38434560-9 Chemické analyzátory; 38432000-2 Prístroje na rozbory; 31711000-3 Elektronický spotrebný materiál; 31600000-2 Elektrické zariadenia a prístroje; 31731000-9 Elektrotechnický spotrebný materiál; 51540000-9 Inštalácia špeciálnych strojov a zariadení; 60000000-8 Dopravné služby (bez prepravy odpadu)","Tovar; Služba","","https://portal.eks.sk/SpravaKniznice/OpisneFormulareKniznice/VerejnyDetailOpisnehoFormularaKniznice/258708","0","0",
"OF-258709","Po karanténe","Opravy, revízie potápačskej výstroje a výzbroje","revízie, odborné skúšky, odborné prehliadky, potápačská výstroj","71600000-4 Služby v oblasti technického skúšania, technickej analýzy a technického poradenstva; 71631430-3 Skúšky tesnosti; 71632100-8 Skúšky ventilov; 71632000-7 Technické skúšky; 71700000-5 Monitorovacie a kontrolné skúšky","Služba","","https://portal.eks.sk/SpravaKniznice/OpisneFormulareKniznice/VerejnyDetailOpisnehoFormularaKniznice/258709","0","0",
"OF-258710","Po karanténe","Notebook","počítač, notebook, prenosný","30213100-6 Prenosné počítače; 60000000-8 Dopravné služby (bez prepravy odpadu)","Tovar; Služba","","https://portal.eks.sk/SpravaKniznice/OpisneFormulareKniznice/VerejnyDetailOpisnehoFormularaKniznice/258710","0","0",
"OF-258712","Po karanténe","Elektroinštalačný materiál","vidlica,400 V 32 A, 16A, spoja sieťova, zásuvka, prúdový chránič","31224100-3 Zástrčky a zásuvky; 31681400-7 Elektrické súčiastky; 60000000-8 Dopravné služby (bez prepravy odpadu)","Tovar; Služba","","https://portal.eks.sk/SpravaKniznice/OpisneFormulareKniznice/VerejnyDetailOpisnehoFormularaKniznice/258712","1","0",
"OF-258716","Po karanténe","Čistiace prostriedky","Čistiace prípravky na povrchy, čistiace prostriedky podlahy, čistiace prostriedky na WC, čistiace prostriedky na okná, čistiace prostriedky na nábytok, prostriedky na riad, metly, kefy, mopy, handry","39831300-9 Čistiace prostriedky na podlahu; 39831600-2 Čistiace prostriedky na toalety; 39832000-3 Čistiace prostriedky na riad; 39800000-0 Čistiace a leštiace výrobky; 39224300-1 Metly a kefy a iné výrobky na upratovanie domácností; 39542000-3 Handry; 60000000-8 Dopravné služby (bez prepravy odpadu)","Tovar; Služba","","https://portal.eks.sk/SpravaKniznice/OpisneFormulareKniznice/VerejnyDetailOpisnehoFormularaKniznice/258716","0","0",
"OF-258719","Po karanténe","Kovové tyče, plechy, fólie a profily","Plech, Protišmykový plech, Jakel","44172000-6 Plechy (stavebné); 14622000-7 Oceľ; 44450000-9 Mäkká oceľ; 44170000-2 Dosky, plechy, pásy a fólie súvisiace so stavebnými materiálmi; 44331000-9 Tyče; 44330000-2 Tyče, prúty, drôty a profily používané v stavebníctve; 44334000-0 Profily; 60000000-8 Dopravné služby (bez prepravy odpadu)","Tovar; Služba","","https://portal.eks.sk/SpravaKniznice/OpisneFormulareKniznice/VerejnyDetailOpisnehoFormularaKniznice/258719","0","0",
"OF-258720","Po karanténe","Mäso a mäsové výrobky","mäso, mäsové výrobky","15100000-9 Živočíšne výrobky, mäso a mäsové výrobky; 60000000-8 Dopravné služby (bez prepravy odpadu)","Tovar; Služba","","https://portal.eks.sk/SpravaKniznice/OpisneFormulareKniznice/VerejnyDetailOpisnehoFormularaKniznice/258720","0","0",
"OF-258722","Po karanténe","Kurz na rozšírenie vodičského oprávnenia","kurz na rozšírenie vodičského oprávnenia zo skupiny B na skupinu C","80411000-8 Autoškoly; 80411100-9 Vodičské skúšky; 80510000-2 Služby týkajúce sa odborných školení; 79632000-3 Školenia a výcvik personálu","Služba","","https://portal.eks.sk/SpravaKniznice/OpisneFormulareKniznice/VerejnyDetailOpisnehoFormularaKniznice/258722","0","0",
"OF-258723","Po karanténe","Kurz na rozšírenie vodičského oprávnenia","kurz na rozšírenie vodičského oprávnenia zo skupiny B na skupinu C","80411000-8 Autoškoly; 80411100-9 Vodičské skúšky; 80510000-2 Služby týkajúce sa odborných školení; 79632000-3 Školenia a výcvik personálu","Služba","","https://portal.eks.sk/SpravaKniznice/OpisneFormulareKniznice/VerejnyDetailOpisnehoFormularaKniznice/258723","0","0",
"OF-258724","Po karanténe","Kurz na rozšírenie vodičského oprávnenia","kurz na rozšírenie vodičského oprávnenia zo skupiny B na skupinu C","80411000-8 Autoškoly; 80411100-9 Vodičské skúšky; 80510000-2 Služby týkajúce sa odborných školení; 79632000-3 Školenia a výcvik personálu","Služba","","https://portal.eks.sk/SpravaKniznice/OpisneFormulareKniznice/VerejnyDetailOpisnehoFormularaKniznice/258724","0","0",
"OF-258725","Po karanténe","Školenie vodičov ADR","školenie vodičov ADR, školenie vodičov ADR rozšírené o triedu 1, školenie vodičov ADR o cisterny","79632000-3 Školenia a výcvik personálu; 80510000-2 Služby týkajúce sa odborných školení; 80500000-9 Školiace (výcvikové) služby","Služba","","https://portal.eks.sk/SpravaKniznice/OpisneFormulareKniznice/VerejnyDetailOpisnehoFormularaKniznice/258725","0","0",
"OF-258726","Po karanténe","Dodávka zemného plynu","zemný plyn, distribúcia zemného plynu, preprava plynu","09123000-7 Zemný plyn; 65200000-5 Rozvod plynu a súvisiace služby; 60000000-8 Dopravné služby (bez prepravy odpadu)","Tovar; Služba","","https://portal.eks.sk/SpravaKniznice/OpisneFormulareKniznice/VerejnyDetailOpisnehoFormularaKniznice/258726","0","0",
"OF-258729","Po karanténe","Spracované ovocie a zelenina, mrazené a sterilizované potraviny, polotovary, rôzne potraviny","mrazené ovocie, mrazená zelenina, kompóty, džemy, sirupy, pripravené jedlá, polotovary, mrazené polotovary, mrazené ryby, mrazené mäso, oleje, tuky, mlynské výrobky, mliečne výrobky, koreniny, ochucovadlá","15330000-0 Spracované ovocie a zelenina; 15894200-3 Pripravené jedlá; 15896000-5 Hlboko zmrazené výrobky; 15400000-2 Živočíšne alebo rastlinné oleje a tuky; 15870000-7 Koreniny a chuťové prísady; 15871200-6 Omáčky, miešané korenisté zmesi a zmesi chuťových prísad; 15812000-3 Pečivo a cukrovinky; 15833000-6 Výrobky z cukru; 15851000-8 Múčne výrobky; 15620000-0 Škroby a škrobové výrobky; 03212220-8 Strukoviny; 15550000-8 Mliečne výrobky rôznych druhov; 15540000-5 Syrárske výrobky; 15100000-9 Živočíšne výrobky, mäso a mäsové výrobky; 15221000-3 Mrazené ryby; 60000000-8 Dopravné služby (bez prepravy odpadu)","Tovar; Služba","","https://portal.eks.sk/SpravaKniznice/OpisneFormulareKniznice/VerejnyDetailOpisnehoFormularaKniznice/258729","0","0",
"OF-258731","Po karanténe","Unimobunka","Unimobunka, kontajner, obytný kontajner","44211200-4 Obytné bunky; 60000000-8 Dopravné služby (bez prepravy odpadu)","Tovar; Služba","","https://portal.eks.sk/SpravaKniznice/OpisneFormulareKniznice/VerejnyDetailOpisnehoFormularaKniznice/258731","0","0",
"OF-258732","Po karanténe","Školský nábytok","školské stoličky, lavice","39160000-1 Školský nábytok; 60000000-8 Dopravné služby (bez prepravy odpadu)","Tovar; Služba","","https://portal.eks.sk/SpravaKniznice/OpisneFormulareKniznice/VerejnyDetailOpisnehoFormularaKniznice/258732","1","0",
"OF-258734","Po karanténe","Náhradné diely a upgrade prístroja Artis zee ceiling","RTG, Artis zee ceiling, náhradný diel, PC vybavenie","33111000-1 Röntgenové prístroje; 51410000-9 Inštalácia lekárskych zariadení; 60000000-8 Dopravné služby (bez prepravy odpadu)","Tovar","","https://portal.eks.sk/SpravaKniznice/OpisneFormulareKniznice/VerejnyDetailOpisnehoFormularaKniznice/258734","0","0",
"OF-258735","Po karanténe","Športové a rekreačné vybavenie","Švihadlo, činky, karimatka, futbalová lopta, sieťka na pingpongový stôl, loptičky na stolný tenis, brankárske rukavice, medicimbal","37441500-6 Švihadlá; 37442100-8 Jednoručné činky; 37461500-2 Stoly na stolný tenis; 37414100-4 Spacie podložky; 37451700-1 Futbalové lopty; 37441700-8 Cvičné lopty; 37461510-5 Stolnotenisové loptičky; 37451730-0 Futbalové tréningové pomôcky; 37420000-8 Výbava do telocvične; 37411200-4 Korčuliarsky výstroj a výstroj na ľadový hokej","Tovar; Služba","","https://portal.eks.sk/SpravaKniznice/OpisneFormulareKniznice/VerejnyDetailOpisnehoFormularaKniznice/258735","0","0",
"OF-258736","Po karanténe","Kurz na rozšírenie vodičského oprávnenia zo skupiny „B“ na „C“","Kurz na rozšírenie vodičského oprávnenia zo skupiny „B“ na „C“","80411000-8 Autoškoly","Služba","","https://portal.eks.sk/SpravaKniznice/OpisneFormulareKniznice/VerejnyDetailOpisnehoFormularaKniznice/258736","0","0",
"OF-258737","Po karanténe","Kurz na rozšírenie vodičského oprávnenia zo skupiny „C“ na „C+E“","Kurz na rozšírenie vodičského oprávnenia zo skupiny „C“ na „C+E“","80411000-8 Autoškoly","Služba","","https://portal.eks.sk/SpravaKniznice/OpisneFormulareKniznice/VerejnyDetailOpisnehoFormularaKniznice/258737","0","0",
"OF-258739","Po karanténe","Kovové kartotékové skrine ","kartotéka, registračná skriňa, kartotéka 4-zásuvková, kartotéka 5-zásuvková","39132200-8 Kartotékové skrine; 33192000-2 Zdravotnícky nábytok; 60000000-8 Dopravné služby (bez prepravy odpadu)","Tovar; Služba","","https://portal.eks.sk/SpravaKniznice/OpisneFormulareKniznice/VerejnyDetailOpisnehoFormularaKniznice/258739","1","0",
"OF-258740","Po karanténe","Grafická úprava (novinové zalamovanie), tlač a distribúcia dvojmesačníka NSK ""ŽUPNÉ OZVENY""","grafická úprava, tlačiarenské služby, doručovacie služby, tlač, dvojmesačník, noviny, doručovanie","79810000-5 Tlačiarenské služby; 79920000-9 Balenie a súvisiace služby; 60000000-8 Dopravné služby (bez prepravy odpadu)","Služba","","https://portal.eks.sk/SpravaKniznice/OpisneFormulareKniznice/VerejnyDetailOpisnehoFormularaKniznice/258740","0","0",
"OF-258741","Po karanténe","Dvojstupňová vákuová olejová výveva ","vákuová výveva, olejová pumpa","42122450-9 Vákuové čerpadlá; 60000000-8 Dopravné služby (bez prepravy odpadu)","Tovar; Služba","","https://portal.eks.sk/SpravaKniznice/OpisneFormulareKniznice/VerejnyDetailOpisnehoFormularaKniznice/258741","0","0",
"OF-258742","Po karanténe","Odvoz a zneškodnenie triedených a zmiešaných objemových odpadov okrem komunálneho odpadu ","Odvoz a zneškodnenie triedených a zmiešaných objemových odpadov okrem komunálneho odpadu , Služby súvisiace s likvidáciou odpadu a odpadom","90500000-2 Služby súvisiace s likvidáciou odpadu a odpadom; 60000000-8 Dopravné služby (bez prepravy odpadu)","Služba","","https://portal.eks.sk/SpravaKniznice/OpisneFormulareKniznice/VerejnyDetailOpisnehoFormularaKniznice/258742","0","0",
"OF-258743","Po karanténe","Kyselina sírová – elektrolyt do olovených AKB    ","kyselina sírová, elektrolyt, AKB","24311411-1 Kyselina sírová; 31431000-6 Olovené akumulátory; 60000000-8 Dopravné služby (bez prepravy odpadu)","Tovar; Služba","","https://portal.eks.sk/SpravaKniznice/OpisneFormulareKniznice/VerejnyDetailOpisnehoFormularaKniznice/258743","1","0",
"OF-258744","Po karanténe","Dodávka zemného plynu","Zemný plyn","09123000-7 Zemný plyn; 60000000-8 Dopravné služby (bez prepravy odpadu)","Tovar; Služba","","https://portal.eks.sk/SpravaKniznice/OpisneFormulareKniznice/VerejnyDetailOpisnehoFormularaKniznice/258744","0","0",
"OF-258745","Po karanténe","Zariadenie na chladenie,mrazenie a príslušenstvo ","Jednodverová stojaca chladnička","39711130-9 Chladničky; 60000000-8 Dopravné služby (bez prepravy odpadu)","Tovar; Služba","","https://portal.eks.sk/SpravaKniznice/OpisneFormulareKniznice/VerejnyDetailOpisnehoFormularaKniznice/258745","1","0",
"OF-258746","Po karanténe","Originálne Tonery","Originálne tonery a náplne v originálnych baleniach, náplne do tlačiarní a multifunkčných zariadení","30125120-8 Toner do fotokopírovacích strojov; 30125110-5 Toner do laserových tlačiarní/faxových prístrojov; 30125100-2 Tonerové náplne; 60000000-8 Dopravné služby (bez prepravy odpadu)","Tovar; Služba","","https://portal.eks.sk/SpravaKniznice/OpisneFormulareKniznice/VerejnyDetailOpisnehoFormularaKniznice/258746","1","0",
"OF-258748","Po karanténe","Zariadenia na chladenie, mrazenie a príslušenstvo","Chladnička, mraznička","39711123-7 Stojaté chladničky; 60000000-8 Dopravné služby (bez prepravy odpadu); 39711100-0 Chladničky a mrazničky","Tovar; Služba","","https://portal.eks.sk/SpravaKniznice/OpisneFormulareKniznice/VerejnyDetailOpisnehoFormularaKniznice/258748","0","0",
"OF-258749","Po karanténe","Kit pre genovú expresiu","kit, gén","24960000-1 Rôzne chemické výrobky; 60000000-8 Dopravné služby (bez prepravy odpadu)","Tovar; Služba","","https://portal.eks.sk/SpravaKniznice/OpisneFormulareKniznice/VerejnyDetailOpisnehoFormularaKniznice/258749","1","0",
"OF-258750","Po karanténe","Monitor 27""","Monitor","30200000-1 Počítačové zariadenia a spotrebný materiál; 60000000-8 Dopravné služby (bez prepravy odpadu)","Tovar; Služba","","https://portal.eks.sk/SpravaKniznice/OpisneFormulareKniznice/VerejnyDetailOpisnehoFormularaKniznice/258750","0","0",
"OF-258751","Po karanténe","Trofeje, plakety, športové poháre, medaile ","materiál na prezentáciu","39298700-4 Trofeje; 39221120-4 Šálky a poháre; 60000000-8 Dopravné služby (bez prepravy odpadu)","Tovar; Služba","","https://portal.eks.sk/SpravaKniznice/OpisneFormulareKniznice/VerejnyDetailOpisnehoFormularaKniznice/258751","0","0",
"OF-258752","Po karanténe","Nafta motorová dovozom cisternami","nafta motorová","09134100-8 Motorová nafta; 60000000-8 Dopravné služby (bez prepravy odpadu)","Tovar; Služba","","https://portal.eks.sk/SpravaKniznice/OpisneFormulareKniznice/VerejnyDetailOpisnehoFormularaKniznice/258752","0","0",
"OF-258753","Po karanténe","Bavlnená tkanina na košele - košeľovina.","Bavlnená tkanina.","19212000-5 Bavlnené tkaniny","Tovar; Služba","","https://portal.eks.sk/SpravaKniznice/OpisneFormulareKniznice/VerejnyDetailOpisnehoFormularaKniznice/258753","0","0",
"OF-258754","Po karanténe","Náhradné diely na Sor NB12,NB18 - elektro","Náhradné diely, autobus,Sor,elektro","34121100-2 Autobusy verejnej dopravy; 31610000-5 Elektrické zariadenia pre motory a vozidlá; 60000000-8 Dopravné služby (bez prepravy odpadu)","Tovar","","https://portal.eks.sk/SpravaKniznice/OpisneFormulareKniznice/VerejnyDetailOpisnehoFormularaKniznice/258754","1","0",
"OF-258755","Po karanténe","Respirátor typ FFP2 bez výdychového ventilu","Respirátor typ FFP2 bez výdychového ventilu","33140000-3 Zdravotnícky spotrebný materiál; 60000000-8 Dopravné služby (bez prepravy odpadu)","Tovar; Služba","","https://portal.eks.sk/SpravaKniznice/OpisneFormulareKniznice/VerejnyDetailOpisnehoFormularaKniznice/258755","1","0",
"OF-258756","Po karanténe"," policajný materiál","policajný materiál, vytyčovacia páska, megafon, detektor kovov, inšpekčné zrkadlo","44424300-1 Reflexné pásky; 34928450-7 Dopravné majáky (svetelné); 35820000-8 Pomocný výstroj; 35200000-6 Policajný výstroj; 34996000-5 Regulačné, bezpečnostné alebo signalizačné zariadenia pre cestnú dopravu; 60000000-8 Dopravné služby (bez prepravy odpadu)","Tovar; Služba","","https://portal.eks.sk/SpravaKniznice/OpisneFormulareKniznice/VerejnyDetailOpisnehoFormularaKniznice/258756","1","0",
"OF-258757","Po karanténe","Reklamné predmety s potlačou","pero, prívesok, USB klúč, nabíjací kábel","39294100-0 Informačné a propagačné výrobky; 60000000-8 Dopravné služby (bez prepravy odpadu)","Tovar; Služba","","https://portal.eks.sk/SpravaKniznice/OpisneFormulareKniznice/VerejnyDetailOpisnehoFormularaKniznice/258757","0","0",
"OF-258758","Po karanténe","Náhradné diely na autobusy Sor NB12,NB18 - kúrenie + klimatizácia Webasto","Náhradné diely, autobus,Sor NB12,NB18,kúrenie Webasto, klimatizácia","34121100-2 Autobusy verejnej dopravy; 39715200-9 Kúrenie; 60000000-8 Dopravné služby (bez prepravy odpadu); 42512400-2 Klimatizácia vozidiel","Tovar","","https://portal.eks.sk/SpravaKniznice/OpisneFormulareKniznice/VerejnyDetailOpisnehoFormularaKniznice/258758","1","0",
"OF-258759","Po karanténe","Náhradné diely na autobusy Sor NB12,NB18 - karoséria","Náhradné diely, autobus,Sor NB12,NB18 - karoséria","34211100-9 Karosérie autobusov; 60000000-8 Dopravné služby (bez prepravy odpadu); 34121100-2 Autobusy verejnej dopravy","Tovar","","https://portal.eks.sk/SpravaKniznice/OpisneFormulareKniznice/VerejnyDetailOpisnehoFormularaKniznice/258759","1","0",
"OF-258760","Po karanténe","Náhradné diely na autobusy Sor NB12,NB18 - klimatizácia Webasto","Náhradné diely, autobus,Sor NB12,NB18,klimatizácia Webasto","34121100-2 Autobusy verejnej dopravy; 42512400-2 Klimatizácia vozidiel; 60000000-8 Dopravné služby (bez prepravy odpadu)","Tovar","","https://portal.eks.sk/SpravaKniznice/OpisneFormulareKniznice/VerejnyDetailOpisnehoFormularaKniznice/258760","1","0",
"OF-258761","Po karanténe","Kuchynské vybavenie pre domácnosť a kanceláriu","Espresso DeLonghi Magnifica ECAM22.110B , Rýchlovarná kanvica Esperanza Tugela","39711310-5 Elektrické kávovary; 39711300-2 Elektrotepelné prístroje; 39711320-8 Elektrické čajovary; 39710000-2 Elektrické prístroje pre domácnosť; 39711440-5 Variče; 60000000-8 Dopravné služby (bez prepravy odpadu)","Tovar; Služba","","https://portal.eks.sk/SpravaKniznice/OpisneFormulareKniznice/VerejnyDetailOpisnehoFormularaKniznice/258761","1","0",
"OF-258762","Po karanténe","Zariadenia na ohrev vody","bojlery, prietokové ohrievače","42161000-5 Ohrievače teplej vody; 60000000-8 Dopravné služby (bez prepravy odpadu)","Tovar; Služba","","https://portal.eks.sk/SpravaKniznice/OpisneFormulareKniznice/VerejnyDetailOpisnehoFormularaKniznice/258762","0","0",
"OF-258763","Po karanténe","Kurz na rozšírenie vodičského oprávnenia zo skupiny „B“ na skupinu „C“,  zo skupiny „C“ na skupinu „CE“, ","Kurz na rozšírenie vodičského oprávnenia zo skupiny „B“ na skupinu „C“,  zo skupiny „C“ na skupinu „CE“,","80411000-8 Autoškoly; 60000000-8 Dopravné služby (bez prepravy odpadu)","Služba","","https://portal.eks.sk/SpravaKniznice/OpisneFormulareKniznice/VerejnyDetailOpisnehoFormularaKniznice/258763","0","0",
"OF-258765","Po karanténe","Notebook			","notebook, výpočtová technika","30200000-1 Počítačové zariadenia a spotrebný materiál; 30213100-6 Prenosné počítače; 60000000-8 Dopravné služby (bez prepravy odpadu)","Tovar; Služba","","https://portal.eks.sk/SpravaKniznice/OpisneFormulareKniznice/VerejnyDetailOpisnehoFormularaKniznice/258765","0","0",
"OF-258766","Po karanténe","Kancelárske potreby a kancelárske zariadenia II.","Euroobal, ceruzky, guličkové pero, zvýrazňovač, pravítko, pilot, tlačivá, značkovacie lístky, doska s klipom, lepiaca tyčinka, korekčný roller, pákový zakladač, lepidlo, spony listové, kancelársky papier, pripínačka, popisovač, centropen, lakový popisovač EDDING, stojan na perá, obálka, podpisová kniha, kazeta s páskou, farbiaca páska do tlačiarne, písacieho stroja, vitrína","22800000-8 Papierové alebo lepenkové registre, účtovné knihy, rýchloviazače, formuláre a iné druhy tlačeného papierenského tovaru; 30192000-1 Kancelárske potreby; 30194000-5 Rysovacie potreby; 30124510-2 Popisovače; 30125100-2 Tonerové náplne; 30152000-9 Časti a príslušenstvo písacích strojov; 30192100-2 Vymazávacie potreby (guma, zmizík); 30192121-5 Guľôčkové perá; 30192122-2 Plniace perá; 30192130-1 Ceruzky; 30192930-9 Korekčné perá; 30192940-2 Náplne do korekčných pier; 30195600-8 Vývesné tabule alebo príslušenstvo; 30199200-2 Obálky, neilustrované karty a korešpondenčné lístky; 30141200-1 Stolové kalkulačky; 19513200-7 Lepiaca páska z pogumovaných textílií; 30197220-4 Spony na papier; 30199230-1 Obálky; 60000000-8 Dopravné služby (bez prepravy odpadu)","Tovar; Služba","","https://portal.eks.sk/SpravaKniznice/OpisneFormulareKniznice/VerejnyDetailOpisnehoFormularaKniznice/258766","0","0",
"OF-258767","Po karanténe","Nádoby,obaly a obalový materál","Vrece jutové, na piesok, zákopové","18930000-7 Vrecia a vaky; 60000000-8 Dopravné služby (bez prepravy odpadu)","Tovar; Služba","","https://portal.eks.sk/SpravaKniznice/OpisneFormulareKniznice/VerejnyDetailOpisnehoFormularaKniznice/258767","0","0",
"OF-258769","Po karanténe","Technické plyny a zásobníky","oxid uhličitý","24110000-8 Technické plyny","Tovar","","https://portal.eks.sk/SpravaKniznice/OpisneFormulareKniznice/VerejnyDetailOpisnehoFormularaKniznice/258769","0","0",
"OF-258773","Po karanténe","Kancelárske stroje, vybavenie a spotrebný materiál s výnimkou počítačov, tlačiarní a nábytku EKS","kancelárske stroje, spotrebný materiál","30192000-1 Kancelárske potreby","Tovar","","https://portal.eks.sk/SpravaKniznice/OpisneFormulareKniznice/VerejnyDetailOpisnehoFormularaKniznice/258773","0","0",
"OF-258774","Po karanténe","tonery, a optické valce","tlačenie písomnosti","30125110-5 Toner do laserových tlačiarní/faxových prístrojov","Tovar; Služba","","https://portal.eks.sk/SpravaKniznice/OpisneFormulareKniznice/VerejnyDetailOpisnehoFormularaKniznice/258774","0","0",
"OF-258777","Po karanténe","Ochladzovač vzduchu","ventilátor, ochladzovač, zvlhčovač","42500000-1 Chladiace a ventilačné zariadenia; 39714100-1 Ventilátory; 39717000-1 Ventilátory a klimatizačné spotrebiče; 60000000-8 Dopravné služby (bez prepravy odpadu)","Tovar; Služba","","https://portal.eks.sk/SpravaKniznice/OpisneFormulareKniznice/VerejnyDetailOpisnehoFormularaKniznice/258777","1","0",
"OF-258779","Po karanténe","Exteriérové zvislé žalúzie na diaľkové ovládanie s elektropríslušenstvom a montážou.","vonkajšie žalúzie, exteriérové žalúzie, zvislé žalúzie","39515440-1 Zvislé žalúzie; 45421145-2 Montáž žalúzií; 60000000-8 Dopravné služby (bez prepravy odpadu)","Tovar; Služba","","https://portal.eks.sk/SpravaKniznice/OpisneFormulareKniznice/VerejnyDetailOpisnehoFormularaKniznice/258779","0","0",
"OF-258780","Po karanténe","Obväzy elastické a obväzy hydrofilné","obväzy, zdravotnícky, pomôcky, materiál","33141110-4 Chirurgické obväzy; 60000000-8 Dopravné služby (bez prepravy odpadu)","Tovar; Služba","","https://portal.eks.sk/SpravaKniznice/OpisneFormulareKniznice/VerejnyDetailOpisnehoFormularaKniznice/258780","1","0",
"OF-258781","Po karanténe","Dodávka originálnych tonerov do fotokopírovacích strojov ","Dodávka originálnych tonerov do fotokopírovacích strojov","30125120-8 Toner do fotokopírovacích strojov; 60000000-8 Dopravné služby (bez prepravy odpadu)","Tovar; Služba","","https://portal.eks.sk/SpravaKniznice/OpisneFormulareKniznice/VerejnyDetailOpisnehoFormularaKniznice/258781","0","0",
"OF-258782","Po karanténe","Obväz hadicový - pruban","obväz, ošetrenie, zdravotnícka pomôcka","33141116-6 Balíky obväzov; 60000000-8 Dopravné služby (bez prepravy odpadu)","Tovar; Služba","","https://portal.eks.sk/SpravaKniznice/OpisneFormulareKniznice/VerejnyDetailOpisnehoFormularaKniznice/258782","1","0",
"OF-258783","Po karanténe","Obväz sádrový","obväz, ošetrenie, zdravotnícka pomôcka","33141110-4 Chirurgické obväzy; 60000000-8 Dopravné služby (bez prepravy odpadu)","Tovar; Služba","","https://portal.eks.sk/SpravaKniznice/OpisneFormulareKniznice/VerejnyDetailOpisnehoFormularaKniznice/258783","1","0",
"OF-258784","Po karanténe","Služby rozšírenej servisnej podpory a údržby pre zariadenia informačno-komunikačných technológií dátových centier a pobočiek","opravy, servis a údržba v oblasti informačných technológií","72100000-6 Hardvérové konzultačné služby (poradenstvo); 72250000-2 Služby týkajúce sa podpory systému; 72251000-9 Odstraňovanie porúch; 72267000-4 Služby na údržbu a opravu softvéru","Služba","","https://portal.eks.sk/SpravaKniznice/OpisneFormulareKniznice/VerejnyDetailOpisnehoFormularaKniznice/258784","1","0",
"OF-258785","Po karanténe","Ručne vedený  umývací stroj na podlahu  ","Ručne vedený  umývací stroj na podlahu","42999200-7 Leštičky podláh nie pre domácnosť; 42924740-8 Prístroje na čistenie pod vysokým tlakom; 60000000-8 Dopravné služby (bez prepravy odpadu)","Tovar; Služba","","https://portal.eks.sk/SpravaKniznice/OpisneFormulareKniznice/VerejnyDetailOpisnehoFormularaKniznice/258785","0","0",
"OF-258787","Po karanténe","Prenosné počítače","Notebook","30213100-6 Prenosné počítače; 60000000-8 Dopravné služby (bez prepravy odpadu)","Tovar; Služba","","https://portal.eks.sk/SpravaKniznice/OpisneFormulareKniznice/VerejnyDetailOpisnehoFormularaKniznice/258787","0","0",
