"OpisnyFormularIdentifikator","OpisnyFormularStav","OpisnyFormularNazov","OpisnyFormularKlucoveSlova","OpisnyFormularCpv","OpisnyFormularDruh","OpisnyFormularKategoriaSluzieb","OpisnyFormularUrl","OpisnyFormularPocetVyhlasenychZakaziek","OpisnyFormularObchodovanaSumaBezDPH",
"OF-218832","Po karanténe"," Nákup multifunkčných CB zariadení - tlačiarní","tlačiarne, kopírky, skenery, faxy, multifunkčné zariadenia","30232100-5 Tlačiarne a zapisovače; 60000000-8 Dopravné služby (bez prepravy odpadu)","Tovar; Služba","","https://portal.eks.sk/SpravaKniznice/OpisneFormulareKniznice/VerejnyDetailOpisnehoFormularaKniznice/218832","1","0",
"OF-218833","Po karanténe","Zvukové, obrazové prostriedky a príslušenstvo","projektor, lampa do projektora","38652120-7 Videoprojektory; 30191200-6 Spätné projektory; 60000000-8 Dopravné služby (bez prepravy odpadu)","Tovar; Služba","","https://portal.eks.sk/SpravaKniznice/OpisneFormulareKniznice/VerejnyDetailOpisnehoFormularaKniznice/218833","1","0",
"OF-218834","Po karanténe","Združená dodávka elektrickej energie","elektrická energia, energia","09310000-5 Elektrická energia; 60000000-8 Dopravné služby (bez prepravy odpadu)","Tovar; Služba","","https://portal.eks.sk/SpravaKniznice/OpisneFormulareKniznice/VerejnyDetailOpisnehoFormularaKniznice/218834","0","0",
"OF-218835","Po karanténe","Tonery ","tonery","30125100-2 Tonerové náplne","Tovar; Služba","","https://portal.eks.sk/SpravaKniznice/OpisneFormulareKniznice/VerejnyDetailOpisnehoFormularaKniznice/218835","1","0",
"OF-218837","Po karanténe","Školenie vodičov podľa ADR","základné školenie vodičov ADR, základné školenie vodičov ADR rozšírené o triedu 1, základné školenie vodičov ADR rozšírené o cisterny, rozširovacie (špecializované) školenie vodičov ADR na triedu 1","79632000-3 Školenia a výcvik personálu; 80510000-2 Služby týkajúce sa odborných školení; 80500000-9 Školiace (výcvikové) služby","Služba","","https://portal.eks.sk/SpravaKniznice/OpisneFormulareKniznice/VerejnyDetailOpisnehoFormularaKniznice/218837","0","0",
"OF-218839","Po karanténe","zariadenie pre chladenie  a mrazenie","chladiace zariadenie, mraziace zariadenie","42513000-5 Chladiace a mraziace zariadenia; 42513100-6 Mraziace zariadenia; 42513200-7 Chladiace zariadenia; 60000000-8 Dopravné služby (bez prepravy odpadu)","Tovar; Služba","","https://portal.eks.sk/SpravaKniznice/OpisneFormulareKniznice/VerejnyDetailOpisnehoFormularaKniznice/218839","0","0",
