"OpisnyFormularIdentifikator","OpisnyFormularStav","OpisnyFormularNazov","OpisnyFormularKlucoveSlova","OpisnyFormularCpv","OpisnyFormularDruh","OpisnyFormularKategoriaSluzieb","OpisnyFormularUrl","OpisnyFormularPocetVyhlasenychZakaziek","OpisnyFormularObchodovanaSumaBezDPH",
"OF-218804","Po karanténe","Teplovzdušný konvektor","Teplovzdušný konvektor","39721310-8 Ohrievače vzduchu; 60000000-8 Dopravné služby (bez prepravy odpadu)","Tovar; Služba","","https://portal.eks.sk/SpravaKniznice/OpisneFormulareKniznice/VerejnyDetailOpisnehoFormularaKniznice/218804","0","0",
"OF-218805","Po karanténe","Anestéziologická pracovná stanica","anestézia","33172100-7 Prístroje na anestéziu; 60000000-8 Dopravné služby (bez prepravy odpadu)","Tovar; Služba","","https://portal.eks.sk/SpravaKniznice/OpisneFormulareKniznice/VerejnyDetailOpisnehoFormularaKniznice/218805","0","0",
"OF-218806","Po karanténe","Prenosný počítač","Notebook, Laptop, HP, Probook","30213100-6 Prenosné počítače; 60000000-8 Dopravné služby (bez prepravy odpadu)","Tovar; Služba","","https://portal.eks.sk/SpravaKniznice/OpisneFormulareKniznice/VerejnyDetailOpisnehoFormularaKniznice/218806","0","0",
"OF-218807","Po karanténe","autokozmetika pre automatickú umývaciu linku ISTOBAL M22","autokozmetika, umývacia linka","60000000-8 Dopravné služby (bez prepravy odpadu); 39800000-0 Čistiace a leštiace výrobky; 39812300-0 Leštiace vosky; 39831500-1 Čistiace prostriedky na autá; 24951000-5 Mazivá a mazacie oleje","Služba; Tovar","","https://portal.eks.sk/SpravaKniznice/OpisneFormulareKniznice/VerejnyDetailOpisnehoFormularaKniznice/218807","1","0",
"OF-218811","Po karanténe","Mrazené potraviny","Mrazené potraviny","15220000-6 Mrazené ryby, rybie filé a ostatné rybie mäso; 15311000-1 Mrazené zemiaky; 60000000-8 Dopravné služby (bez prepravy odpadu); 15896000-5 Hlboko zmrazené výrobky; 15221000-3 Mrazené ryby; 15311100-2 Hranolčeky; 15851220-6 Plnené cestoviny","Tovar; Služba","","https://portal.eks.sk/SpravaKniznice/OpisneFormulareKniznice/VerejnyDetailOpisnehoFormularaKniznice/218811","1","0",
"OF-218813","Po karanténe","Vybavenie oddelenia","odpadkový kôš, kúpeľňový záves, kuchynské vybavenie","39221000-7 Kuchynské vybavenie; 39224340-3 Koše; 39831000-6 Pracie prostriedky; 60000000-8 Dopravné služby (bez prepravy odpadu)","Tovar; Služba","","https://portal.eks.sk/SpravaKniznice/OpisneFormulareKniznice/VerejnyDetailOpisnehoFormularaKniznice/218813","1","0",
"OF-218816","Po karanténe","Ručné nástroje a príslušenstvo","Skrutkovač akumulátorový, ručné náradie, sada náradia","42652000-1 Ručné elektromechanické nástroje; 44512800-0 Skrutkovače; 60000000-8 Dopravné služby (bez prepravy odpadu); 44512940-3 Sada náradia","Tovar; Služba","","https://portal.eks.sk/SpravaKniznice/OpisneFormulareKniznice/VerejnyDetailOpisnehoFormularaKniznice/218816","1","0",
"OF-218817","Po karanténe","Servis a oprava zariadení knihárskej dielne aj s náhradnými dielmi - znášačka, lepička, rezačka","zariadenia knihárskej dielne, oprava","50530000-9 Opravy a údržba strojov; 60000000-8 Dopravné služby (bez prepravy odpadu)","Služba","","https://portal.eks.sk/SpravaKniznice/OpisneFormulareKniznice/VerejnyDetailOpisnehoFormularaKniznice/218817","1","0",
"OF-218820","Po karanténe","Nemocničné lôžka","Nemocničné lôžko","33192120-9 Nemocničné lôžka; 60000000-8 Dopravné služby (bez prepravy odpadu)","Tovar; Služba","","https://portal.eks.sk/SpravaKniznice/OpisneFormulareKniznice/VerejnyDetailOpisnehoFormularaKniznice/218820","0","0",
"OF-218822","Po karanténe","Fritéza, nárezový stroj, umývačka riadu","Fritéza, nárezový stroj, umývačka riadu","39312000-2 Zariadenia na prípravu jedál; 39310000-8 Zariadenia hromadného stravovania; 60000000-8 Dopravné služby (bez prepravy odpadu)","Tovar; Služba","","https://portal.eks.sk/SpravaKniznice/OpisneFormulareKniznice/VerejnyDetailOpisnehoFormularaKniznice/218822","1","0",
"OF-218823","Po karanténe","Stolik - vozík viacúčelový 2 policový  , 1 zásuvka ","stolík- vozík","39290000-1 Rôzne vybavenie a zariadenie interiérov; 60000000-8 Dopravné služby (bez prepravy odpadu)","Tovar; Služba","","https://portal.eks.sk/SpravaKniznice/OpisneFormulareKniznice/VerejnyDetailOpisnehoFormularaKniznice/218823","0","0",
"OF-218824","Po karanténe","Výpočtová technika - dodanie I.","kamera, dron","30232000-4 Periférne vybavenie; 60000000-8 Dopravné služby (bez prepravy odpadu)","Tovar; Služba","","https://portal.eks.sk/SpravaKniznice/OpisneFormulareKniznice/VerejnyDetailOpisnehoFormularaKniznice/218824","1","0",
"OF-218825","Po karanténe","Základné a dlhodobo skladovateľné potraviny","Dodávka potravín pre stravovacie zariadenie, cestoviny, koreniny, nápoje, pochutiny, sterilizované potraviny, kompóty, šaláty","15000000-8 Potraviny, nápoje, tabak a príbuzné produkty; 15600000-4 Mlynské výrobky, škrob a škrobové výrobky; 15820000-2 Sucháre a piškóty; trvanlivé pečivo a cukrovinky; 15830000-5 Cukor a jemu príbuzné výrobky; 15840000-8 Kakao; čokoláda a cukrovinky; 15850000-1 Cestoviny; 15860000-4 Káva, čaj a príbuzné produkty; 15870000-7 Koreniny a chuťové prísady; 15897200-4 Výrobky v konzerve; 15240000-2 Ryby v konzerve a inak pripravené alebo konzervované ryby; 15331400-1 Nakladaná a/alebo konzervovaná zelenina; 15332200-6 Džemy a marmelády, ovocné želé; ovocné alebo orechové pyré a pasty/pretlaky; 15400000-2 Živočíšne alebo rastlinné oleje a tuky; 60000000-8 Dopravné služby (bez prepravy odpadu)","Tovar; Služba","","https://portal.eks.sk/SpravaKniznice/OpisneFormulareKniznice/VerejnyDetailOpisnehoFormularaKniznice/218825","1","0",
"OF-218827","Po karanténe","Plynový varný kotol","Plynový varný kotol, Gastro zariadenie, Kuchynské zariadenie","39220000-0 Kuchynské zariadenie, domáce potreby a potreby pre domáce hospodárstvo a dodávky pre stravovacie zariadenia; 39221000-7 Kuchynské vybavenie; 39310000-8 Zariadenia hromadného stravovania; 39314000-6 Priemyselné vybavenie kuchýň; 39312000-2 Zariadenia na prípravu jedál; 60000000-8 Dopravné služby (bez prepravy odpadu)","Tovar; Služba","","https://portal.eks.sk/SpravaKniznice/OpisneFormulareKniznice/VerejnyDetailOpisnehoFormularaKniznice/218827","1","0",
"OF-218829","Po karanténe","Odber, odvoz, zneškodňovanie a likvidácia odpadov ","Odber, odvoz, zneškodňovanie a likvidácia odpadov","90510000-5 Likvidácia a spracovanie odpadu; 90500000-2 Služby súvisiace s likvidáciou odpadu a odpadom; 90512000-9 Služby na prepravu odpadu","Služba","","https://portal.eks.sk/SpravaKniznice/OpisneFormulareKniznice/VerejnyDetailOpisnehoFormularaKniznice/218829","1","0",
"OF-218830","Po karanténe","Kancelársky softvér","kancelársky softvér","48219300-9 Softvérový balík pre administratívu; 60000000-8 Dopravné služby (bez prepravy odpadu)","Tovar; Služba","","https://portal.eks.sk/SpravaKniznice/OpisneFormulareKniznice/VerejnyDetailOpisnehoFormularaKniznice/218830","0","0",
"OF-218831","Po karanténe","Odber, odvoz, zneškodňovanie a likvidácia odpadov.  ","Odber, odvoz, zneškodňovanie a likvidácia odpadov","90510000-5 Likvidácia a spracovanie odpadu; 90512000-9 Služby na prepravu odpadu","Služba","","https://portal.eks.sk/SpravaKniznice/OpisneFormulareKniznice/VerejnyDetailOpisnehoFormularaKniznice/218831","0","0",
"OF-218832","Po karanténe"," Nákup multifunkčných CB zariadení - tlačiarní","tlačiarne, kopírky, skenery, faxy, multifunkčné zariadenia","30232100-5 Tlačiarne a zapisovače; 60000000-8 Dopravné služby (bez prepravy odpadu)","Tovar; Služba","","https://portal.eks.sk/SpravaKniznice/OpisneFormulareKniznice/VerejnyDetailOpisnehoFormularaKniznice/218832","1","0",
"OF-218833","Po karanténe","Zvukové, obrazové prostriedky a príslušenstvo","projektor, lampa do projektora","38652120-7 Videoprojektory; 30191200-6 Spätné projektory; 60000000-8 Dopravné služby (bez prepravy odpadu)","Tovar; Služba","","https://portal.eks.sk/SpravaKniznice/OpisneFormulareKniznice/VerejnyDetailOpisnehoFormularaKniznice/218833","1","0",
"OF-218834","Po karanténe","Združená dodávka elektrickej energie","elektrická energia, energia","09310000-5 Elektrická energia; 60000000-8 Dopravné služby (bez prepravy odpadu)","Tovar; Služba","","https://portal.eks.sk/SpravaKniznice/OpisneFormulareKniznice/VerejnyDetailOpisnehoFormularaKniznice/218834","1","0",
"OF-218835","Po karanténe","Tonery ","tonery","30125100-2 Tonerové náplne","Tovar; Služba","","https://portal.eks.sk/SpravaKniznice/OpisneFormulareKniznice/VerejnyDetailOpisnehoFormularaKniznice/218835","1","0",
"OF-218836","Po karanténe","Monitory, Tlačiarne, Skener, Multifunkčné zariadenia","Monitory, Tlačiarne, Skener, Multifunkčné zariadenia","30232110-8 Laserové tlačiarne; 51600000-8 Inštalácia počítačov a kancelárskeho vybavenia; 38520000-6 Skenery; 30231300-0 Zobrazovacie jednotky (obrazovky); 30232100-5 Tlačiarne a zapisovače; 30121200-5 Zariadenia na fotokopírovanie; 30216110-0 Skenery na používanie s počítačom; 60000000-8 Dopravné služby (bez prepravy odpadu)","Tovar; Služba","","https://portal.eks.sk/SpravaKniznice/OpisneFormulareKniznice/VerejnyDetailOpisnehoFormularaKniznice/218836","0","0",
"OF-218837","Po karanténe","Školenie vodičov podľa ADR","základné školenie vodičov ADR, základné školenie vodičov ADR rozšírené o triedu 1, základné školenie vodičov ADR rozšírené o cisterny, rozširovacie (špecializované) školenie vodičov ADR na triedu 1","79632000-3 Školenia a výcvik personálu; 80510000-2 Služby týkajúce sa odborných školení; 80500000-9 Školiace (výcvikové) služby","Služba","","https://portal.eks.sk/SpravaKniznice/OpisneFormulareKniznice/VerejnyDetailOpisnehoFormularaKniznice/218837","0","0",
"OF-218839","Po karanténe","zariadenie pre chladenie  a mrazenie","chladiace zariadenie, mraziace zariadenie","42513000-5 Chladiace a mraziace zariadenia; 42513100-6 Mraziace zariadenia; 42513200-7 Chladiace zariadenia; 60000000-8 Dopravné služby (bez prepravy odpadu)","Tovar; Služba","","https://portal.eks.sk/SpravaKniznice/OpisneFormulareKniznice/VerejnyDetailOpisnehoFormularaKniznice/218839","1","0",
"OF-218840","Po karanténe","Digitálny RTG prístroj","digitálny rtg prístroj, snímkovací stôl, diagnostická stanica","33111000-1 Röntgenové prístroje; 60000000-8 Dopravné služby (bez prepravy odpadu)","Tovar; Služba","","https://portal.eks.sk/SpravaKniznice/OpisneFormulareKniznice/VerejnyDetailOpisnehoFormularaKniznice/218840","1","0",
"OF-218842","Po karanténe","Tablet 10,1"" - 10,5""","Tablet 10,1"" - 10,5"" vrátane držiaku na tablet","30213200-7 Tabletový počítač; 30237270-2 Puzdrá na prenosné počítače; 60000000-8 Dopravné služby (bez prepravy odpadu)","Tovar; Služba","","https://portal.eks.sk/SpravaKniznice/OpisneFormulareKniznice/VerejnyDetailOpisnehoFormularaKniznice/218842","0","0",
"OF-218846","Po karanténe","Zváracie zariadenia a potreby ","zváracie elektródy, zvárací drôt","31711140-6 Elektródy; 60000000-8 Dopravné služby (bez prepravy odpadu)","Tovar; Služba","","https://portal.eks.sk/SpravaKniznice/OpisneFormulareKniznice/VerejnyDetailOpisnehoFormularaKniznice/218846","1","0",
"OF-218847","Po karanténe","Uterákovina","Uterákovina","19212000-5 Bavlnené tkaniny; 60000000-8 Dopravné služby (bez prepravy odpadu)","Tovar; Služba","","https://portal.eks.sk/SpravaKniznice/OpisneFormulareKniznice/VerejnyDetailOpisnehoFormularaKniznice/218847","0","0",
"OF-218848","Po karanténe","Stavebný materiál ","cement, omietka, dvere, flexibilné lepidlo, vedro, tmel","44111200-3 Cement; 44190000-8 Rôzne stavebné materiály; 44221200-7 Dvere; 60000000-8 Dopravné služby (bez prepravy odpadu)","Tovar; Služba","","https://portal.eks.sk/SpravaKniznice/OpisneFormulareKniznice/VerejnyDetailOpisnehoFormularaKniznice/218848","1","0",
"OF-218850","Po karanténe","Reagencie a laboratórny spotrebný materiál","Reagencie a laboratórny spotrebný materiál","24950000-8 Špecializované chemické výrobky; 60000000-8 Dopravné služby (bez prepravy odpadu)","Tovar; Služba","","https://portal.eks.sk/SpravaKniznice/OpisneFormulareKniznice/VerejnyDetailOpisnehoFormularaKniznice/218850","0","0",
"OF-218851","Po karanténe","Opravy a tlakové skúšky hasiacich prístrojov","hasiaci prístroj, oprava, tlaková skúška","50514000-1 Opravy a údržba kovových nádob; 60000000-8 Dopravné služby (bez prepravy odpadu)","Služba","","https://portal.eks.sk/SpravaKniznice/OpisneFormulareKniznice/VerejnyDetailOpisnehoFormularaKniznice/218851","0","0",
"OF-218856","Po karanténe","Katiónaktívna asfaltová emulzia C65B4","asfaltová emulzia, katiónaktívna emulzia, vysprávky živičných krytov, údržba vozovky","44113700-2 Materiály na opravu ciest; 44113900-4 Materiály na údržbu ciest; 44113600-1 Bitúmen a asfalt","Tovar","","https://portal.eks.sk/SpravaKniznice/OpisneFormulareKniznice/VerejnyDetailOpisnehoFormularaKniznice/218856","1","0",
"OF-218859","Po karanténe","Kationaktívna asfaltová emulzia C65 B4","asfaltová emulzia, katiónaktívna emulzia, vysprávky živičných krytov, údržba vozovky","44113700-2 Materiály na opravu ciest; 44113900-4 Materiály na údržbu ciest; 44113600-1 Bitúmen a asfalt; 60000000-8 Dopravné služby (bez prepravy odpadu)","Tovar; Služba","","https://portal.eks.sk/SpravaKniznice/OpisneFormulareKniznice/VerejnyDetailOpisnehoFormularaKniznice/218859","1","0",
"OF-218860","Po karanténe","Nábytok do poľných podmienok","nábytok, stôl, poľný stôl,  cateringový stôl,","39121200-8 Stoly; 39110000-6 Sedadlá, stoličky a podobné výrobky a súvisiace časti; 60000000-8 Dopravné služby (bez prepravy odpadu)","Tovar; Služba","","https://portal.eks.sk/SpravaKniznice/OpisneFormulareKniznice/VerejnyDetailOpisnehoFormularaKniznice/218860","0","0",
"OF-218864","Po karanténe","Odber, odvoz, zneškodňovanie a likvidácia nebezpečných odpadov.  ","Odber, odvoz, zneškodňovanie a likvidácia odpadov","90500000-2 Služby súvisiace s likvidáciou odpadu a odpadom; 90510000-5 Likvidácia a spracovanie odpadu; 90512000-9 Služby na prepravu odpadu","Služba","","https://portal.eks.sk/SpravaKniznice/OpisneFormulareKniznice/VerejnyDetailOpisnehoFormularaKniznice/218864","1","0",
"OF-218865","Po karanténe","Odpadový kôš s popolníkom","odpad, smeti","34928480-6 Kontajnery a nádoby na odpad a odpadky; 60000000-8 Dopravné služby (bez prepravy odpadu)","Tovar; Služba","","https://portal.eks.sk/SpravaKniznice/OpisneFormulareKniznice/VerejnyDetailOpisnehoFormularaKniznice/218865","0","0",
"OF-218867","Po karanténe","Ručné nástroje a príslušenstvo","Ručné nástroje a príslušenstvo, schodiky do skladu, trojdielný rebrík, sada náradia","44511000-5 Ručné nástroje; 44512000-2 Rôzne ručné nástroje; 43830000-0 Mechanické náradie; 44512940-3 Sada náradia; 44423200-3 Rebríky; 44423230-2 Ľahké schodíky/nášľapné plošinky; 60000000-8 Dopravné služby (bez prepravy odpadu)","Tovar; Služba","","https://portal.eks.sk/SpravaKniznice/OpisneFormulareKniznice/VerejnyDetailOpisnehoFormularaKniznice/218867","0","0",
"OF-218868","Po karanténe","Odber, odvoz, zneškodňovanie a likvidácia nebezpečných odpadov.  ","Odber, odvoz, zneškodňovanie a likvidácia odpadov","90500000-2 Služby súvisiace s likvidáciou odpadu a odpadom; 90510000-5 Likvidácia a spracovanie odpadu; 90512000-9 Služby na prepravu odpadu","Služba","","https://portal.eks.sk/SpravaKniznice/OpisneFormulareKniznice/VerejnyDetailOpisnehoFormularaKniznice/218868","1","0",
"OF-218869","Po karanténe","Anestéziologický prístroj s monitorom vitálnych funkcií  ","anestézia","33172100-7 Prístroje na anestéziu; 60000000-8 Dopravné služby (bez prepravy odpadu)","Tovar; Služba","","https://portal.eks.sk/SpravaKniznice/OpisneFormulareKniznice/VerejnyDetailOpisnehoFormularaKniznice/218869","0","0",
"OF-218871","Po karanténe","Laptopy pre učiteľov nové, alebo repasované","laptop, prenosný počítač, notebook","30213100-6 Prenosné počítače; 60000000-8 Dopravné služby (bez prepravy odpadu)","Tovar; Služba","","https://portal.eks.sk/SpravaKniznice/OpisneFormulareKniznice/VerejnyDetailOpisnehoFormularaKniznice/218871","0","0",
"OF-218873","Po karanténe","Údržba nezastavaných pozemkov","Údržba, kosenie, nezastavaných pozemkov","77314000-4 Údržba pozemkov; 77314100-5 Údržba trávnikov; 60000000-8 Dopravné služby (bez prepravy odpadu)","Služba","","https://portal.eks.sk/SpravaKniznice/OpisneFormulareKniznice/VerejnyDetailOpisnehoFormularaKniznice/218873","0","0",
"OF-218874","Po karanténe","Zváracie zariadenia a príslušenstvo","zvárací drôt","44315200-3 Zváracie materiály; 60000000-8 Dopravné služby (bez prepravy odpadu)","Tovar; Služba","","https://portal.eks.sk/SpravaKniznice/OpisneFormulareKniznice/VerejnyDetailOpisnehoFormularaKniznice/218874","1","0",
"OF-218876","Po karanténe","Dodatie Tatami","Tatami, športová podlaha","37400000-2 Športový tovar a výbava; 37421000-5 Žinenky do telocviční; 60000000-8 Dopravné služby (bez prepravy odpadu)","Tovar; Služba","","https://portal.eks.sk/SpravaKniznice/OpisneFormulareKniznice/VerejnyDetailOpisnehoFormularaKniznice/218876","0","0",
"OF-218877","Po karanténe","Automatická vyvažovačka kolies, s laserovým ukazovateľom umiestnenia závažia 230V","Vyvažovačka, zariadenia na vyvažovanie kolies","34324100-5 Zariadenie na vyvažovanie kolies; 60000000-8 Dopravné služby (bez prepravy odpadu); 42123610-6 Pneumatické súpravy","Tovar; Služba","","https://portal.eks.sk/SpravaKniznice/OpisneFormulareKniznice/VerejnyDetailOpisnehoFormularaKniznice/218877","0","0",
"OF-218878","Po karanténe","Plnoautomatický kávovar","kávovar, plnoautomatický kávovar","39711310-5 Elektrické kávovary; 60000000-8 Dopravné služby (bez prepravy odpadu)","Tovar; Služba","","https://portal.eks.sk/SpravaKniznice/OpisneFormulareKniznice/VerejnyDetailOpisnehoFormularaKniznice/218878","1","0",
"OF-218880","Po karanténe","Radlica snehová zadná ","radlica, snehová, zadná, komunálna, technika","34921000-9 Zariadenia na údržbu ciest; 60000000-8 Dopravné služby (bez prepravy odpadu); 43313100-1 Snehové pluhy","Tovar; Služba","","https://portal.eks.sk/SpravaKniznice/OpisneFormulareKniznice/VerejnyDetailOpisnehoFormularaKniznice/218880","0","0",
"OF-218881","Po karanténe","Špecializované chemické výrobky ","Amplex™ UltraRed Reagent, Primery","24950000-8 Špecializované chemické výrobky; 60000000-8 Dopravné služby (bez prepravy odpadu)","Tovar","","https://portal.eks.sk/SpravaKniznice/OpisneFormulareKniznice/VerejnyDetailOpisnehoFormularaKniznice/218881","1","0",
"OF-218884","Po karanténe","Alkoholtestery a náustky","alkoholtester, náustok","38431000-5 Detekčné prístroje; 37322300-4 Náustky; 38430000-8 Prístroje na detekciu a rozbory; 60000000-8 Dopravné služby (bez prepravy odpadu)","Tovar; Služba","","https://portal.eks.sk/SpravaKniznice/OpisneFormulareKniznice/VerejnyDetailOpisnehoFormularaKniznice/218884","0","0",
"OF-218886","Po karanténe","Bielizeň osobná, operačná","nohavice, blúza, košeľa, rúška, plachta, obliečka","18110000-3 Pracovné odevy; 39512000-4 Posteľná bielizeň; 60000000-8 Dopravné služby (bez prepravy odpadu)","Tovar; Služba","","https://portal.eks.sk/SpravaKniznice/OpisneFormulareKniznice/VerejnyDetailOpisnehoFormularaKniznice/218886","0","0",
"OF-218888","Po karanténe","Čistiace,  dezinfekčné a ochranné prostriedky","čistiace a dezinfekčné prostriedky; mydlo, jednorazové utierky, odpadové vrecia, metly, mopy, prací prášok, rukavice, rúška","39800000-0 Čistiace a leštiace výrobky; 39830000-9 Čistiace výrobky; 18424300-0 Jednorazové rukavice; 19640000-4 Polyetylénový odpad a odpadkové vrecká a vaky; 39224300-1 Metly a kefy a iné výrobky na upratovanie domácností; 39831000-6 Pracie prostriedky; 33711430-0 Jednorazové utierky; 33761000-2 Toaletný papier; 60000000-8 Dopravné služby (bez prepravy odpadu)","Tovar; Služba","","https://portal.eks.sk/SpravaKniznice/OpisneFormulareKniznice/VerejnyDetailOpisnehoFormularaKniznice/218888","1","0",
"OF-218892","Po karanténe","Inšpekčná kamera ","inšpekčná kamera,","32333200-8 Videokamery; 32330000-5 Prístroje na záznam a reprodukciu zvuku a obrazu; 60000000-8 Dopravné služby (bez prepravy odpadu)","Tovar; Služba","","https://portal.eks.sk/SpravaKniznice/OpisneFormulareKniznice/VerejnyDetailOpisnehoFormularaKniznice/218892","1","0",
"OF-218893","Po karanténe","Bielizeň osobná, operačná","nohavice, blúza, košeľa, rúška, plachta, obliečka","18110000-3 Pracovné odevy; 39512000-4 Posteľná bielizeň; 60000000-8 Dopravné služby (bez prepravy odpadu)","Tovar; Služba","","https://portal.eks.sk/SpravaKniznice/OpisneFormulareKniznice/VerejnyDetailOpisnehoFormularaKniznice/218893","1","0",
"OF-218894","Po karanténe","Dataprojektor","Dataprojektor","30191200-6 Spätné projektory; 30230000-0 Zariadenia súvisiace s počítačmi; 60000000-8 Dopravné služby (bez prepravy odpadu)","Tovar; Služba","","https://portal.eks.sk/SpravaKniznice/OpisneFormulareKniznice/VerejnyDetailOpisnehoFormularaKniznice/218894","0","0",
"OF-218897","Po karanténe","Varič vody elektrický celonerezový","varič vody elektrický, príprava nápojov","39310000-8 Zariadenia hromadného stravovania; 39715100-8 Elektrické prietokové alebo zásobníkové ohrievače vody a ponorné ohrievače; 42200000-8 Zariadenia na spracovanie potravín, nápojov a tabaku a ich súvisiace časti; 60000000-8 Dopravné služby (bez prepravy odpadu)","Tovar; Služba","","https://portal.eks.sk/SpravaKniznice/OpisneFormulareKniznice/VerejnyDetailOpisnehoFormularaKniznice/218897","0","0",
"OF-218899","Po karanténe","Zariadenia na dávkovanie a doplňovanie pohonných látok","kanister, kanister na PHM","44611600-2 Zásobníky; 44610000-9 Cisterny, zásobníky, kontajnery a tlakové nádoby; 60000000-8 Dopravné služby (bez prepravy odpadu)","Tovar; Služba","","https://portal.eks.sk/SpravaKniznice/OpisneFormulareKniznice/VerejnyDetailOpisnehoFormularaKniznice/218899","0","0",
"OF-218901","Po karanténe","Odber, odvoz, zneškodňovanie a likvidácia odpadov.  ","Odber, odvoz, zneškodňovanie a likvidácia odpadov","90510000-5 Likvidácia a spracovanie odpadu; 90512000-9 Služby na prepravu odpadu","Služba","","https://portal.eks.sk/SpravaKniznice/OpisneFormulareKniznice/VerejnyDetailOpisnehoFormularaKniznice/218901","0","0",
"OF-218903","Po karanténe","Výchovno vzdelávacie pomôcky a zariadenie","drevená stolička, ležadlá rozkladacie , stojan na ležadlá, šesťhranný stôl, kresielko, detská kuchyňa, kúpeľňová polička, lavička gymnastická","39144000-3 Nábytok do kúpeľne; 37400000-2 Športový tovar a výbava; 39000000-2 Nábytok (vrátane kancelárskeho nábytku), zariadenie interiéru, domáce spotrebiče (s výnimkou osvetlenia) a čistiace prostriedky; 39161000-8 Nábytok pre materské školy; 39162200-7 Učebné pomôcky a zariadenia; 39516100-3 Bytový textil; 39200000-4 Zariadenie interiéru; 60000000-8 Dopravné služby (bez prepravy odpadu)","Tovar; Služba","","https://portal.eks.sk/SpravaKniznice/OpisneFormulareKniznice/VerejnyDetailOpisnehoFormularaKniznice/218903","0","0",
"OF-218904","Po karanténe","Zber, odvoz a zneškodnenie kuchynského odpadu. ","zber, odber, odvoz, zneškodnenie, kuchynský odpad, likvidácia, biologický rozložiteľný odpad, odpady, jedlé oleje a tuky, manipulácia s odpadmi,","90500000-2 Služby súvisiace s likvidáciou odpadu a odpadom; 90510000-5 Likvidácia a spracovanie odpadu; 90511000-2 Služby na zber odpadu; 90512000-9 Služby na prepravu odpadu; 90513000-6 Služby na spracovanie a likvidáciu nie nebezpečného odpadu","Služba","","https://portal.eks.sk/SpravaKniznice/OpisneFormulareKniznice/VerejnyDetailOpisnehoFormularaKniznice/218904","0","0",
"OF-218906","Po karanténe","Elektródy","Elektródy","31711140-6 Elektródy; 60000000-8 Dopravné služby (bez prepravy odpadu)","Tovar; Služba","","https://portal.eks.sk/SpravaKniznice/OpisneFormulareKniznice/VerejnyDetailOpisnehoFormularaKniznice/218906","0","0",
"OF-218908","Po karanténe","Mobilný telefón","Mobilný telefón","32550000-3 Telefonické zariadenia; 60000000-8 Dopravné služby (bez prepravy odpadu)","Tovar; Služba","","https://portal.eks.sk/SpravaKniznice/OpisneFormulareKniznice/VerejnyDetailOpisnehoFormularaKniznice/218908","1","0",
"OF-218910","Po karanténe","Prírodné hutné drvené kamenivo  (NR - 2020)","Drvený kameň, kamenivo, materiál na údržbu ciest","14212300-3 Drvený a mletý kameň; 44113900-4 Materiály na údržbu ciest; 60000000-8 Dopravné služby (bez prepravy odpadu)","Tovar; Služba","","https://portal.eks.sk/SpravaKniznice/OpisneFormulareKniznice/VerejnyDetailOpisnehoFormularaKniznice/218910","0","0",
"OF-218918","Po karanténe","Technologická linka na čírenie znečistenej vody ","linka na čírenie znečistenej vody","15331000-7 Spracovaná zelenina; 60000000-8 Dopravné služby (bez prepravy odpadu)","Tovar; Služba","","https://portal.eks.sk/SpravaKniznice/OpisneFormulareKniznice/VerejnyDetailOpisnehoFormularaKniznice/218918","0","0",
"OF-218919","Po karanténe","Párty reproduktor v kvalite Blaupunkt PA 25 čierny","reproduktor","32342412-3 Bežné reproduktory; 32342300-5 Mikrofónové a reproduktorové sústavy; 32340000-8 Mikrofóny a reproduktory; 60000000-8 Dopravné služby (bez prepravy odpadu)","Tovar; Služba","","https://portal.eks.sk/SpravaKniznice/OpisneFormulareKniznice/VerejnyDetailOpisnehoFormularaKniznice/218919","0","0",
