"OpisnyFormularIdentifikator","OpisnyFormularStav","OpisnyFormularNazov","OpisnyFormularKlucoveSlova","OpisnyFormularCpv","OpisnyFormularDruh","OpisnyFormularKategoriaSluzieb","OpisnyFormularUrl","OpisnyFormularPocetVyhlasenychZakaziek","OpisnyFormularObchodovanaSumaBezDPH",
"OF-140658","Po karanténe","Zabezpečenie stravovacích služieb formou stravných poukážok","Stravné poukážky, zabezpečenie stravovania zamestnancov ","55520000-1 Služby hromadného stravovania; 30199770-8 Stravné poukážky; 60000000-8 Dopravné služby (bez prepravy odpadu)","Služba; Tovar","","https://portal.eks.sk/SpravaKniznice/OpisneFormulareKniznice/VerejnyDetailOpisnehoFormularaKniznice/140658","0","0",
"OF-140676","Po karanténe","Aminokyseliny 2","Aminokyseliny , Infúzne roztoky ","33692100-8 Infúzne roztoky; 60000000-8 Dopravné služby (bez prepravy odpadu)","Tovar; Služba","","https://portal.eks.sk/SpravaKniznice/OpisneFormulareKniznice/VerejnyDetailOpisnehoFormularaKniznice/140676","0","0",
"OF-140690","Po karanténe","Chemikálie","základné organické a anorganické chemikálie, rôzne organické chemikálie","24300000-7 Základné anorganické a organické chemikálie; 24327000-2 Rôzne organické chemikálie; 60000000-8 Dopravné služby (bez prepravy odpadu)","Tovar; Služba","","https://portal.eks.sk/SpravaKniznice/OpisneFormulareKniznice/VerejnyDetailOpisnehoFormularaKniznice/140690","1","299,980",
"OF-140707","Po karanténe","Laserový diaľkomer, sklonomer a výškomer Nikon Forestry Pro alebo ekvivalent","výškomer, diaľkomer, sklonomer","38636100-3 Lasery; 42000000-6 Priemyselné mechanizmy; 60000000-8 Dopravné služby (bez prepravy odpadu)","Tovar; Služba","","https://portal.eks.sk/SpravaKniznice/OpisneFormulareKniznice/VerejnyDetailOpisnehoFormularaKniznice/140707","0","0",
"OF-140725","Po karanténe","Zabezpečenie stravovacích služieb formou stravných poukážok","Stravné poukážky, zabezpečenie stravovania zamestnancov ","55520000-1 Služby hromadného stravovania; 30199770-8 Stravné poukážky; 60000000-8 Dopravné služby (bez prepravy odpadu)","Služba; Tovar","","https://portal.eks.sk/SpravaKniznice/OpisneFormulareKniznice/VerejnyDetailOpisnehoFormularaKniznice/140725","1","115453,800",
"OF-141989","Po karanténe","Chromatografická plynová kolóna","Chromatografická plynová kolóna, spotrebný materiál","38000000-5 Laboratórne, optické a presné prístroje a vybavenie (s výnimkou skiel); 38434560-9 Chemické analyzátory","Tovar","","https://portal.eks.sk/SpravaKniznice/OpisneFormulareKniznice/VerejnyDetailOpisnehoFormularaKniznice/141989","1","460,240",
"OF-142002","Po karanténe","Serverové licencie","Serverové licencie","48218000-9 Softvérový balík na riadenie licencií; 60000000-8 Dopravné služby (bez prepravy odpadu)","Tovar; Služba","","https://portal.eks.sk/SpravaKniznice/OpisneFormulareKniznice/VerejnyDetailOpisnehoFormularaKniznice/142002","1","23332,500",
"OF-142004","Po karanténe","Kancelárske potreby","Kancelárske potreby, bločky, zošity, zakladače, obálky, laminovacie fólie","30192000-1 Kancelárske potreby; 44617000-8 Škatule/boxy; 30199230-1 Obálky; 30192121-5 Guľôčkové perá; 30192130-1 Ceruzky; 22830000-7 Zošity; 30199720-3 Listový papier; 30199000-0 Papiernický tovar a iné položky; 60000000-8 Dopravné služby (bez prepravy odpadu)","Tovar; Služba","","https://portal.eks.sk/SpravaKniznice/OpisneFormulareKniznice/VerejnyDetailOpisnehoFormularaKniznice/142004","1","556,500",
"OF-142021","Po karanténe","Chladnička s mrazničkou","kombinovaná chladnička s mrazničkou, chladnička, mraznička,","39711110-3 Chladničky s mrazničkou; 60000000-8 Dopravné služby (bez prepravy odpadu)","Tovar; Služba","","https://portal.eks.sk/SpravaKniznice/OpisneFormulareKniznice/VerejnyDetailOpisnehoFormularaKniznice/142021","1","164,000",
"OF-142038","Po karanténe","Priekopové rameno na čistenie ciest, starostlivosť o trávu a mulčovanie","Priekopové rameno","16600000-1 Špeciálne mechanizmy pre poľnohospodárstvo alebo lesníctvo; 60000000-8 Dopravné služby (bez prepravy odpadu)","Tovar; Služba","","https://portal.eks.sk/SpravaKniznice/OpisneFormulareKniznice/VerejnyDetailOpisnehoFormularaKniznice/142038","0","0",
"OF-142055","Po karanténe","Vrecia PE ","Vrecia PE čierne","19640000-4 Polyetylénový odpad a odpadkové vrecká a vaky; 60000000-8 Dopravné služby (bez prepravy odpadu)","Tovar; Služba","","https://portal.eks.sk/SpravaKniznice/OpisneFormulareKniznice/VerejnyDetailOpisnehoFormularaKniznice/142055","0","0",
"OF-142070","Po karanténe","Mini vŕtací a rezací systém pre ortopedické a traumatologické operačné výkony","batériový vŕtací systém, batériový rezací systém, ortopedický operačný motorový systém, traumatologický operačný motorový systém, mini univerzálne batériové telo","33183000-6 Ortopedické podporné prístroje; 60000000-8 Dopravné služby (bez prepravy odpadu)","Tovar; Služba","","https://portal.eks.sk/SpravaKniznice/OpisneFormulareKniznice/VerejnyDetailOpisnehoFormularaKniznice/142070","0","0",
"OF-142072","Po karanténe","Zabezpečenie stravovania zamestnancov formou stravovacích poukážok alebo ekvivalent","stravovacie poukážky, elektronický ekvivalent - stravovacie karty ","55520000-1 Služby hromadného stravovania; 30199770-8 Stravné poukážky; 60000000-8 Dopravné služby (bez prepravy odpadu)","Služba","","https://portal.eks.sk/SpravaKniznice/OpisneFormulareKniznice/VerejnyDetailOpisnehoFormularaKniznice/142072","1","144045,300",
"OF-142087","Po karanténe","Školské lavice a školské stoličky","Školské lavice a školské stoličky","39121100-7 Písacie stoly; 39112000-0 Stoličky; 60161000-4 Doprava balíkov; 60000000-8 Dopravné služby (bez prepravy odpadu)","Tovar; Služba","","https://portal.eks.sk/SpravaKniznice/OpisneFormulareKniznice/VerejnyDetailOpisnehoFormularaKniznice/142087","0","0",
"OF-142102","Po karanténe","Chirurgicko-laparoskopická operačná zostava","Operačná veža, operačná vizualizácia, Videoendoskopická zostava","33162100-4 Prístroje operačnej sály; 33100000-1 Zdravotnícke vybavenie; 33168100-6 Endoskopy; 60000000-8 Dopravné služby (bez prepravy odpadu)","Tovar; Služba","","https://portal.eks.sk/SpravaKniznice/OpisneFormulareKniznice/VerejnyDetailOpisnehoFormularaKniznice/142102","0","0",
"OF-142104","Po karanténe","Nákup služobných motorových vozidiel (2/2017)","služobné motorové vozidlá, osobné automobily, automobily, autá","34110000-1 Osobné automobily; 60000000-8 Dopravné služby (bez prepravy odpadu)","Tovar; Služba","","https://portal.eks.sk/SpravaKniznice/OpisneFormulareKniznice/VerejnyDetailOpisnehoFormularaKniznice/142104","1","46949,000",
"OF-142106","Po karanténe","Kovové šatňové skrinky","šatňa, skrinka, kovová","39150000-8 Rôzny nábytok a vybavenie; 60000000-8 Dopravné služby (bez prepravy odpadu)","Tovar; Služba","","https://portal.eks.sk/SpravaKniznice/OpisneFormulareKniznice/VerejnyDetailOpisnehoFormularaKniznice/142106","1","4499,170",
"OF-136237","Po karanténe","Mikropipeta jednokanálová automatická a príslušenstvo ","Mikropipeta jednokanálová automatická, príslušenstvo, špičky","38437000-7 Laboratórne pipety a príslušenstvo; 33140000-3 Zdravotnícky spotrebný materiál; 19520000-7 Plastové výrobky; 38400000-9 Nástroje na kontrolu fyzikálnych vlastností; 60000000-8 Dopravné služby (bez prepravy odpadu)","Tovar; Služba","","https://portal.eks.sk/SpravaKniznice/OpisneFormulareKniznice/VerejnyDetailOpisnehoFormularaKniznice/136237","1","599,000",
"OF-136639","Po karanténe","Softvéry","softvér","48300000-1 Softvérový balík na vytváranie dokumentov, kreslenie, vytváranie obrázkov, harmonogramov a zlepšovanie produktivity; 48321000-4 Softvérový balík na navrhovanie pomocou počítača (CAD); 48317000-3 Softvérový balík na spracovanie textov; 60000000-8 Dopravné služby (bez prepravy odpadu)","Tovar; Služba","","https://portal.eks.sk/SpravaKniznice/OpisneFormulareKniznice/VerejnyDetailOpisnehoFormularaKniznice/136639","1","2995,000",
"OF-136771","Po karanténe","Dezinfekcia tela a pokožky, dezinfekcia na ruky, dezinfekcia plôch a nástrojov","dezinfekcia, telo, pokožka, ruky, plocha, nástroj","24455000-8 Dezinfekčné prostriedky; 33741300-9 Dezinfekčné prostriedky na ruky; 24950000-8 Špecializované chemické výrobky; 60000000-8 Dopravné služby (bez prepravy odpadu)","Tovar; Služba","","https://portal.eks.sk/SpravaKniznice/OpisneFormulareKniznice/VerejnyDetailOpisnehoFormularaKniznice/136771","0","0",
"OF-140147","Po karanténe","Originálne tonery do tlačiarne HP Color LaserJet Enterprise CP4025, CP4525","Originál, toner, HP CE260X (HP649X)","30125110-5 Toner do laserových tlačiarní/faxových prístrojov; 60000000-8 Dopravné služby (bez prepravy odpadu)","Tovar; Služba","","https://portal.eks.sk/SpravaKniznice/OpisneFormulareKniznice/VerejnyDetailOpisnehoFormularaKniznice/140147","1","208,330",
"OF-138292","Po karanténe","OptiPlex 7050 SFF zostava","Dell, OptiPlex 7050, Monitor P2317H,","30213000-5 Osobné počítače; 60000000-8 Dopravné služby (bez prepravy odpadu)","Tovar; Služba","","https://portal.eks.sk/SpravaKniznice/OpisneFormulareKniznice/VerejnyDetailOpisnehoFormularaKniznice/138292","1","205779,000",
"OF-141255","Po karanténe","Odber, preprava a zneškodňovanie ostatného odpadu zo zdravotnej starostlivosti, číslo podskupiny a druhu odpadu 180103, 180108","odvoz odpadu, likvidácia odpadu, ","90520000-8 Služby súvisiace s rádioaktívnym, toxickým, zdravotníckym a nebezpečným odpadom","Služba","","https://portal.eks.sk/SpravaKniznice/OpisneFormulareKniznice/VerejnyDetailOpisnehoFormularaKniznice/141255","0","0",
"OF-141264","Po karanténe","Sieťové prvky, switche","Ubiquiti, PoE, Switch, Access Point, 10 Gbps, SFP+ Modul","32422000-7 Sieťové komponenty; 32413100-2 Sieťové smerovače; 60000000-8 Dopravné služby (bez prepravy odpadu)","Tovar; Služba","","https://portal.eks.sk/SpravaKniznice/OpisneFormulareKniznice/VerejnyDetailOpisnehoFormularaKniznice/141264","2","4695,000",
"OF-141266","Po karanténe","Originálne tonery a náplne","tonery, náplne, tlačiareň, multifunkčné zariadenie","30125110-5 Toner do laserových tlačiarní/faxových prístrojov; 30125100-2 Tonerové náplne; 60000000-8 Dopravné služby (bez prepravy odpadu)","Tovar; Služba","","https://portal.eks.sk/SpravaKniznice/OpisneFormulareKniznice/VerejnyDetailOpisnehoFormularaKniznice/141266","0","0",
"OF-141289","Po karanténe","Dodávka elektrickej energie s prevzatím zodpovednosti za odchýlky","Elektrická energia, elektrina, prenos elektriny, distribúcia elektriny ","09310000-5 Elektrická energia; 60000000-8 Dopravné služby (bez prepravy odpadu)","Tovar; Služba","","https://portal.eks.sk/SpravaKniznice/OpisneFormulareKniznice/VerejnyDetailOpisnehoFormularaKniznice/141289","0","0",
"OF-141291","Po karanténe","Tonery do tlačiarní /  faxových prístrojov (originálne)","Originálne tonery ","30125110-5 Toner do laserových tlačiarní/faxových prístrojov; 60000000-8 Dopravné služby (bez prepravy odpadu)","Tovar; Služba","","https://portal.eks.sk/SpravaKniznice/OpisneFormulareKniznice/VerejnyDetailOpisnehoFormularaKniznice/141291","0","0",
"OF-141298","Po karanténe","Notebook Lenovo IdeaPad 520 80X2002VCK","notebook, osobný počítač","30213100-6 Prenosné počítače; 60000000-8 Dopravné služby (bez prepravy odpadu)","Tovar; Služba","","https://portal.eks.sk/SpravaKniznice/OpisneFormulareKniznice/VerejnyDetailOpisnehoFormularaKniznice/141298","1","0",
"OF-141321","Po karanténe","Drvené kamenivo na posyp ciest frakcie 4-8 (andezit)","drvené kamenivo na posyp ciest frakcie 4-8","44113910-7 Materiály na zimnú údržbu; 60000000-8 Dopravné služby (bez prepravy odpadu)","Tovar; Služba","","https://portal.eks.sk/SpravaKniznice/OpisneFormulareKniznice/VerejnyDetailOpisnehoFormularaKniznice/141321","1","16660,000",
"OF-141323","Po karanténe","Údržba softvéru prijímačov Trimble NetRx","Aktualizácia firmvéru","72261000-2 Softvérové podporné služby","Služba","","https://portal.eks.sk/SpravaKniznice/OpisneFormulareKniznice/VerejnyDetailOpisnehoFormularaKniznice/141323","0","0",
"OF-141330","Po karanténe","Pranie a chemické čistenie - Žilinský kraj","pranie a chemické čistenie","98310000-9 Pranie a chemické čistenie; 60000000-8 Dopravné služby (bez prepravy odpadu)","Služba","","https://portal.eks.sk/SpravaKniznice/OpisneFormulareKniznice/VerejnyDetailOpisnehoFormularaKniznice/141330","1","13851,400",
"OF-141332","Po karanténe","Skener HP ScanJet, IP telefóny CISCO, skenovacie pero , IKT príslušenstvo ","Skener k PC, IP telefóny, skenovacie pero, IKT príslušenstvo","32252000-4 Telefóny GSM; 30236000-2 Rôzne počítačové vybavenie; 30216110-0 Skenery na používanie s počítačom; 30237430-2 Svetelné perá; 60000000-8 Dopravné služby (bez prepravy odpadu)","Tovar; Služba","","https://portal.eks.sk/SpravaKniznice/OpisneFormulareKniznice/VerejnyDetailOpisnehoFormularaKniznice/141332","2","2233,340",
"OF-141355","Po karanténe","Úžitkové (nákladné) vozidlo do 7,5 tony na prevoz kontajnérov s hákovým nakladačom s dvomi kontajnermi 9 m3","úžítkové, nákladné, kontajner, hákový nakladač, 7,5 tony","16700000-2 Traktory/ťahače; 34220000-5 Prívesy, návesy a pojazdné kontajnery; 34114000-9 Špeciálne vozidlá; 60000000-8 Dopravné služby (bez prepravy odpadu)","Tovar; Služba","","https://portal.eks.sk/SpravaKniznice/OpisneFormulareKniznice/VerejnyDetailOpisnehoFormularaKniznice/141355","1","58200,000",
"OF-137816","Po karanténe","Serverová zostava","server, diskové pole, pevný disk","30233141-1 Nadbytočné pole nezávislých diskov (RAID); 48823000-3 Súborové servery; 30233132-5 Mechaniky pevného disku; 60000000-8 Dopravné služby (bez prepravy odpadu)","Tovar; Služba","","https://portal.eks.sk/SpravaKniznice/OpisneFormulareKniznice/VerejnyDetailOpisnehoFormularaKniznice/137816","0","0",
"OF-138034","Po karanténe","Kancelársky nábytok","Kancelársky stôl, kontajner, kreslá, skrinky, komody, regály, konferenčný stolík","39130000-2 Kancelársky nábytok; 60000000-8 Dopravné služby (bez prepravy odpadu)","Tovar; Služba","","https://portal.eks.sk/SpravaKniznice/OpisneFormulareKniznice/VerejnyDetailOpisnehoFormularaKniznice/138034","1","1100,000",
"OF-138534","Po karanténe","USB kľúč","USB kľúče","30233180-6 Archivačné zariadenia flash pamäte; 60000000-8 Dopravné služby (bez prepravy odpadu)","Tovar; Služba","","https://portal.eks.sk/SpravaKniznice/OpisneFormulareKniznice/VerejnyDetailOpisnehoFormularaKniznice/138534","1","374,990",
"OF-138637","Po karanténe","Náhradné diely na vozidlo Tatra 815 ","náhradné diely, TATRA 815 ","34300000-0 Časti a príslušenstvo vozidiel a ich motorov; 34330000-9 Náhradné diely pre vozidlá na prepravu tovaru, pre dodávky a osobné automobily; 34322000-0 Brzdy a časti bŕzd; 34321100-4 Nápravy","Tovar; Služba","","https://portal.eks.sk/SpravaKniznice/OpisneFormulareKniznice/VerejnyDetailOpisnehoFormularaKniznice/138637","1","2996,700",
"OF-138787","Po karanténe","Tlač a doručenie týždenníka","tlač, noviny, týždenník, doručovanie","79810000-5 Tlačiarenské služby; 79823000-9 Tlačiarenské a doručovateľské služby; 60000000-8 Dopravné služby (bez prepravy odpadu)","Služba","","https://portal.eks.sk/SpravaKniznice/OpisneFormulareKniznice/VerejnyDetailOpisnehoFormularaKniznice/138787","1","52450,000",
"OF-138819","Po karanténe","Dodávka komplexného tlačového riešenia","prenájom tlačových zariadení","79820000-8 Služby súvisiace s tlačou; 60000000-8 Dopravné služby (bez prepravy odpadu); 50313000-2 Údržba a opravy reprografických strojov; 42962000-7 Tlačiarske/kopírovacie a grafické zariadenia; 42960000-3 Ovládací a riadiaci systém, tlačiarenské a grafické vybavenie, vybavenie na automatizáciu kancelárskych prác a spracovanie informácií; 30125100-2 Tonerové náplne; 34913000-0 Rôzne náhradné diely; 30191400-8 Skartovače; 30191140-7 Príslušenstvo na osobnú identifikáciu; 48313000-5 Softvérový balík pre optický čítač znakov (OCR); 48421000-5 Softvérový balík na správu zariadení; 71244000-0 Výpočet nákladov, monitorovanie nákladov; 22455000-4 Identifikačné karty","Služba","","https://portal.eks.sk/SpravaKniznice/OpisneFormulareKniznice/VerejnyDetailOpisnehoFormularaKniznice/138819","1","46666,670",
"OF-126519","Po karanténe","Trvanlivé potraviny","potraviny,džem,výživa,pretlak,konzerva,paštéta,kompót,sterilizovaná zelenina,cestoviny,múka,cukor,strúhanka,strukoviny,soľ,čaj,káva,korenie,kakao,keks,sušienky,diabetické,oblátky,čokoláda,cukríky,slané pečivo,puding,olej,horčica,ocot,ryža,piškóty","15332200-6 Džemy a marmelády, ovocné želé; ovocné alebo orechové pyré a pasty/pretlaky; 15897200-4 Výrobky v konzerve; 15131310-1 Paštéta; 15235000-4 Konzervované ryby; 15332400-8 Konzervované ovocie; 15332410-1 Sušené ovocie; 15331400-1 Nakladaná a/alebo konzervovaná zelenina; 15850000-1 Cestoviny; 15400000-2 Živočíšne alebo rastlinné oleje a tuky; 15612000-1 Obilná alebo rastlinná múka a príbuzné výrobky; 15830000-5 Cukor a jemu príbuzné výrobky; 03211300-6 Ryža; 03212210-5 Suché strukoviny; 15872400-5 Soľ; 15860000-4 Káva, čaj a príbuzné produkty; 15870000-7 Koreniny a chuťové prísady; 15871200-6 Omáčky, miešané korenisté zmesi a zmesi chuťových prísad; 15871250-1 Horčica; 15871100-5 Ocot a jeho náhrady; 15840000-8 Kakao; čokoláda a cukrovinky; 15626000-2 Pudingový prášok; 15820000-2 Sucháre a piškóty; trvanlivé pečivo a cukrovinky; 15899000-6 Kypriaci prášok; 60000000-8 Dopravné služby (bez prepravy odpadu)","Tovar; Služba","","https://portal.eks.sk/SpravaKniznice/OpisneFormulareKniznice/VerejnyDetailOpisnehoFormularaKniznice/126519","1","39999,160",
"OF-141277","Po karanténe","Ovocie a zelenina","ovocie, zelenina","03220000-9 Zelenina, ovocie a orechy; 03222111-4 Banány; 03222321-9 Jablká; 03222220-1 Pomaranče; 03221110-0 Koreňová zelenina; 03221111-7 Červená repa; 03221113-1 Cibuľa; 03221112-4 Mrkva; 03221410-3 Kapusta; 03221420-6 Karfiol; 03221240-0 Paradajka; 03221310-2 Hlávkový šalát; 60000000-8 Dopravné služby (bez prepravy odpadu)","Tovar; Služba","","https://portal.eks.sk/SpravaKniznice/OpisneFormulareKniznice/VerejnyDetailOpisnehoFormularaKniznice/141277","1","7425,000",
"OF-141278","Po karanténe","Prenájom multifunkčných zariadení a s tým súvisiace služby","Prenájom multifunkčných zariadení a s tým súvisiace služby","30121100-4 Fotokopírovacie stroje; 30232110-8 Laserové tlačiarne; 79820000-8 Služby súvisiace s tlačou; 50313200-4 Údržba fotokopírovacích strojov; 50313100-3 Opravy fotokopírovacích strojov; 60000000-8 Dopravné služby (bez prepravy odpadu)","Tovar; Služba","","https://portal.eks.sk/SpravaKniznice/OpisneFormulareKniznice/VerejnyDetailOpisnehoFormularaKniznice/141278","1","7291,670",
"OF-141292","Po karanténe","Propagačné predmety s potlačou","tričko, kľúčenka, potlač","39294100-0 Informačné a propagačné výrobky; 60000000-8 Dopravné služby (bez prepravy odpadu)","Tovar; Služba","","https://portal.eks.sk/SpravaKniznice/OpisneFormulareKniznice/VerejnyDetailOpisnehoFormularaKniznice/141292","1","967,500",
"OF-141309","Po karanténe","Batérie na autobusy Sor NB 12, NB 18,Citelis 18M","Batérie autobusu, Sor NB 12, NB 18,Citelis 18M","31400000-0 Akumulátory, galvanické články a batérie; 31430000-9 Elektrické akumulátory; 60000000-8 Dopravné služby (bez prepravy odpadu)","Tovar","","https://portal.eks.sk/SpravaKniznice/OpisneFormulareKniznice/VerejnyDetailOpisnehoFormularaKniznice/141309","1","1068,880",
"OF-141327","Po karanténe","Osobné motorové vozidlá financované prostredníctvom finančného lízingu","osobné motorové vozidlo, finančný lízing","34100000-8 Motorové vozidlá; 34110000-1 Osobné automobily; 66114000-2 Finančný lízing","Tovar; Služba","","https://portal.eks.sk/SpravaKniznice/OpisneFormulareKniznice/VerejnyDetailOpisnehoFormularaKniznice/141327","0","0",
"OF-141328","Po karanténe","JAZDENÝ dodávkový automobil skriňový","Dodávkový  automobil skriňový, dodávkové motorové vozidlo, preprava osôb a materiálu","34100000-8 Motorové vozidlá; 34136000-9 Dodávkové automobily; 60000000-8 Dopravné služby (bez prepravy odpadu); 34136200-1 Dodávkové automobily skriňové; 34136100-0 Ľahké dodávkové automobily","Tovar; Služba","","https://portal.eks.sk/SpravaKniznice/OpisneFormulareKniznice/VerejnyDetailOpisnehoFormularaKniznice/141328","0","0",
"OF-141342","Po karanténe","Erlenmayerové fľašky","Erlenmayerové fľašky","33793000-5 Sklenené výrobky pre laboratóriá; 60000000-8 Dopravné služby (bez prepravy odpadu)","Tovar; Služba","","https://portal.eks.sk/SpravaKniznice/OpisneFormulareKniznice/VerejnyDetailOpisnehoFormularaKniznice/141342","1","41,670",
"OF-137183","Po karanténe","Náhradné diely do nákladných motorových vozidiel továrenskej značky TATRA","náhradný, náhradné, diel, diely, olejový filter, palivový filter, vzduchový filter, krúžok tesniaci, tesnenie, manžeta, krúžok stierací, matica,  čerpadlo vstrekovacie, čerpadlo podávacie, valec brzdový, posilovač spojky, regulátor tlaku, svetlomet, zrkadlo, guma stieracia, valec teleskopický, nádrž paliva, tachograf, kúrenie, rýchlomer, prepínač, bočnica, čelo zadné, dvere,  kabína, blatník, spúšťač, ventil odvodňovací, zariadenie vypínacie, posilňovač riadenia,  sedadlo, lanko, odlučovač, záves lanový,  ","34300000-0 Časti a príslušenstvo vozidiel a ich motorov; 34312000-7 Časti motorov; 34320000-6 Mechanické náhradné súčiastky okrem motorov a ich častí; 34322000-0 Brzdy a časti bŕzd; 34330000-9 Náhradné diely pre vozidlá na prepravu tovaru, pre dodávky a osobné automobily; 34325100-2 Tlmiče výfuku; 42913500-4 Nasávacie vzduchové filtre; 42913300-2 Olejové filtre; 42514310-8 Vzduchové filtre; 60000000-8 Dopravné služby (bez prepravy odpadu)","Tovar; Služba","","https://portal.eks.sk/SpravaKniznice/OpisneFormulareKniznice/VerejnyDetailOpisnehoFormularaKniznice/137183","1","106242,720",
"OF-140726","Po karanténe","Operačné sanie- hadica","hadica, operačné sanie","33140000-3 Zdravotnícky spotrebný materiál; 33162200-5 Nástroje operačnej sály; 60000000-8 Dopravné služby (bez prepravy odpadu)","Tovar; Služba","","https://portal.eks.sk/SpravaKniznice/OpisneFormulareKniznice/VerejnyDetailOpisnehoFormularaKniznice/140726","0","0",
"OF-140740","Po karanténe","Ručný dynamometer","dynamometer, ručný","38540000-2 Testovacie a meracie stroje a prístroje; 38500000-0 Kontrolné a testovacie prístroje; 60000000-8 Dopravné služby (bez prepravy odpadu)","Tovar; Služba","","https://portal.eks.sk/SpravaKniznice/OpisneFormulareKniznice/VerejnyDetailOpisnehoFormularaKniznice/140740","0","0",
"OF-140743","Po karanténe","Rezy drevín","rezy drevín, arboristické služby,","77211500-7 Údržba stromov; 60000000-8 Dopravné služby (bez prepravy odpadu)","Služba","","https://portal.eks.sk/SpravaKniznice/OpisneFormulareKniznice/VerejnyDetailOpisnehoFormularaKniznice/140743","1","10700,000",
"OF-140744","Po karanténe","Dávkovače","Dávkovače ","42968000-9 Dávkovače; 60000000-8 Dopravné služby (bez prepravy odpadu)","Tovar; Služba","","https://portal.eks.sk/SpravaKniznice/OpisneFormulareKniznice/VerejnyDetailOpisnehoFormularaKniznice/140744","1","10763,000",
"OF-140757","Po karanténe","LAPAROSKOPICKÁ VEŽA","VIDEOREŤAZEC, INSUFLÁCIA, SVETELNÝ ZDROJ,OPTIKA, ENDOSKOPIA, LAPAROSKOPIA, PNEUMATICKÉ RAMENO","33168000-5 Endoskopia, endochirurgické prístroje; 60000000-8 Dopravné služby (bez prepravy odpadu)","Tovar; Služba","","https://portal.eks.sk/SpravaKniznice/OpisneFormulareKniznice/VerejnyDetailOpisnehoFormularaKniznice/140757","0","0",
"OF-140758","Po karanténe","Propagačné predmety s potlačou","dáždnik, USB kľúč, zápisník, hrnček, batoh, prívesok, plaketa, powernotebook, vizitkár, taška","39294100-0 Informačné a propagačné výrobky; 60000000-8 Dopravné služby (bez prepravy odpadu)","Tovar; Služba","","https://portal.eks.sk/SpravaKniznice/OpisneFormulareKniznice/VerejnyDetailOpisnehoFormularaKniznice/140758","1","25000,000",
"OF-140775","Po karanténe","1. Chladnička kombinovaná, 2.Televízor, 3. Dvojplatničkový sporák, 4. Vysávač","chladnička, televízor, dvojplatničkový sporák, vysávač","39711130-9 Chladničky; 39711100-0 Chladničky a mrazničky; 32324000-0 Televízory; 32324100-1 Farebné televízory; 39711440-5 Variče; 31600000-2 Elektrické zariadenia a prístroje; 39710000-2 Elektrické prístroje pre domácnosť; 39713430-6 Vysávače prachu; 60000000-8 Dopravné služby (bez prepravy odpadu)","Tovar; Služba","","https://portal.eks.sk/SpravaKniznice/OpisneFormulareKniznice/VerejnyDetailOpisnehoFormularaKniznice/140775","0","0",
"OF-140776","Po karanténe","Určenie jednorazovej odplaty za zriadenie vecného bremena formou znaleckého posudku","znalecký posudok, vecné bremeno","71319000-7 Služby znalcov (expertíza); 60000000-8 Dopravné služby (bez prepravy odpadu)","Služba","","https://portal.eks.sk/SpravaKniznice/OpisneFormulareKniznice/VerejnyDetailOpisnehoFormularaKniznice/140776","1","100,000",
