"OpisnyFormularIdentifikator","OpisnyFormularStav","OpisnyFormularNazov","OpisnyFormularKlucoveSlova","OpisnyFormularCpv","OpisnyFormularDruh","OpisnyFormularKategoriaSluzieb","OpisnyFormularUrl","OpisnyFormularPocetVyhlasenychZakaziek","OpisnyFormularObchodovanaSumaBezDPH",
"OF-286545","Po karanténe","Lieky ","Analgetiká, anestetiká, vitamíny, srdcovocievny systém, dýchací systém, nervový systém, psycholeptiká, psychoanaleptiká, rôzne iné lieky a liečivá","33610000-9 Liečivá pre výživovú sústavu a látkovú premenu; 33616000-1 Vitamíny; 33690000-3 Rôzne liečivá; 60000000-8 Dopravné služby (bez prepravy odpadu); 33621100-0 Antitrombotické činidlá; 33622100-7 Liečivá pre srdcovú terapiu; 33631100-3 Fungicídy na dermatologické použitie; 33641100-6 Gynekologické antiinfekčné a antiseptické prípravky; 33642100-3 Hypofýzové, hypotalamické hormóny a analogické zlúčeniny; 33651100-9 Látky ničiace baktérie na systémové použitie; 33642300-5 Liečivá pre tyreoidálnu terapiu; 33652300-8 Imunosupresívne činidlá; 33661200-3 Analgetiká; 33691300-3 Ektoparaziticídy vrátane skabicídov, insekticídov a repelentov; 33670000-7 Liečivá pre dýchací systém","Tovar; Služba","","https://portal.eks.sk/SpravaKniznice/OpisneFormulareKniznice/VerejnyDetailOpisnehoFormularaKniznice/286545","0","0",
"OF-287057","Po karanténe","Kancelársky kopírovací papier","Kancelársky kopírovací papier, papier, tlač, kopírovanie","30197644-2 Xerografický papier; 60000000-8 Dopravné služby (bez prepravy odpadu)","Tovar; Služba","","https://portal.eks.sk/SpravaKniznice/OpisneFormulareKniznice/VerejnyDetailOpisnehoFormularaKniznice/287057","0","0",
"OF-287604","Po karanténe","chladiaca skriňa","chladiaca skriňa","39711100-0 Chladničky a mrazničky; 39711124-4 Priemyselné chladničky; 39711130-9 Chladničky; 42513000-5 Chladiace a mraziace zariadenia; 39711123-7 Stojaté chladničky; 60000000-8 Dopravné služby (bez prepravy odpadu)","Tovar; Služba","","https://portal.eks.sk/SpravaKniznice/OpisneFormulareKniznice/VerejnyDetailOpisnehoFormularaKniznice/287604","0","0",
"OF-288367","Po karanténe"," Parný sterilizátor  1x  s chladením a 1x bez chladenia s príslušenstvom","parný sterilizátor","33191100-6 Sterilizátory; 60000000-8 Dopravné služby (bez prepravy odpadu)","Tovar; Služba","","https://portal.eks.sk/SpravaKniznice/OpisneFormulareKniznice/VerejnyDetailOpisnehoFormularaKniznice/288367","0","0",
"OF-288438","Po karanténe","Kancelárske potreby (Rámcová zmluva)","papier, pero, zakladač, obálka, zvýrazňovač, zošit, kniha, popisovač, zvýrazňovač, špagát, obal, mapa, doska","30192000-1 Kancelárske potreby; 30100000-0 Kancelárske stroje, vybavenie a spotrebný materiál s výnimkou počítačov, tlačiarní a nábytku; 30197000-6 Drobné kancelárske vybavenie; 30197643-5 Papier na fotokopírovanie; 30197642-8 Papier na fotokopírovanie a xerografický papier; 30197644-2 Xerografický papier; 30197630-1 Papier na tlač alebo iné grafické účely; 60000000-8 Dopravné služby (bez prepravy odpadu)","Tovar; Služba","","https://portal.eks.sk/SpravaKniznice/OpisneFormulareKniznice/VerejnyDetailOpisnehoFormularaKniznice/288438","0","0",
"OF-288445","Po karanténe","Opakovaná dodávka liekov","analgetiká, anestetiká, srdcovocievny systém, dýchací systém, nervový systém, psycholeptiká, psychoanaleptiká, rôzne iné lieky a liečivá","33610000-9 Liečivá pre výživovú sústavu a látkovú premenu; 33612000-3 Liečivá pre funkčné gastrointestinálne poruchy; 33614000-7 Antidiaroiká, črevné protizápalové/protiinfekčné činidlá; 33615000-4 Liečivá používané pri cukrovke; 33615100-5 Inzulín; 33616000-1 Vitamíny; 33617000-8 Minerálne doplnky; 33620000-2 Liečivá pre krv, krvotvorné orgány a srdcovocievny systém; 33621000-9 Liečivá pre krv a krvotvorné orgány; 33621100-0 Antitrombotické činidlá; 33621200-1 Antihemoragiká; 33621300-2 Antianemické prípravky; 33622000-6 Liečivá pre srdcovocievny systém; 33622200-8 Antihypertenzíva; 33622300-9 Diuretiká; 33630000-5 Liečivá pre dermatológiu a muskuloskeletálny systém; 33631110-6 Kyselina salicilová; 33632000-9 Liečivá pre muskuloskeletálny systém; 33632100-0 Protizápalové a protireumatické prípravky; 33632200-1 Svalové relaxanciá; 33641000-5 Liečivá pre močovopohlavný systém a pohlavné hormóny; 33642200-4 Kortikosteroidy na systémové použitie; 33650000-1 Všeobecné antiinfekčné látky na systémové použitie, očkovacie látky, antineoplastické prostriedky a imunomodulačné činidlá; 33651100-9 Látky ničiace baktérie na systémové použitie; 33651300-1 Fungicídy ničiace baktérie na systémové použitie; 33661000-1 Liečivá pre nervový systém; 33661100-2 Anestetiká; 33661200-3 Analgetiká; 33661500-6 Psycholeptiká; 33662100-9 Oftalmologiká; 33670000-7 Liečivá pre dýchací systém; 33674000-5 Prípravky proti kašľu a nachladnutiu; 33675000-2 Antihistaminiká na systémové použitie; 33690000-3 Rôzne liečivá; 33691000-0 Antiparazitné výrobky, insekticídy a repelenty; 33692000-7 Lekárske roztoky; 33692100-8 Infúzne roztoky; 33698300-2 Tráviace látky; 60000000-8 Dopravné služby (bez prepravy odpadu)","Tovar; Služba","","https://portal.eks.sk/SpravaKniznice/OpisneFormulareKniznice/VerejnyDetailOpisnehoFormularaKniznice/288445","0","0",
"OF-288528","Po karanténe","Laboratórny spotrebný materiál","Petriho miska, sklo hodinové, kopistka, špachtľa, teflónové tesniaca vložka, čistiace utierky, mazivo pre ventily","33140000-3 Zdravotnícky spotrebný materiál; 60000000-8 Dopravné služby (bez prepravy odpadu)","Tovar; Služba","","https://portal.eks.sk/SpravaKniznice/OpisneFormulareKniznice/VerejnyDetailOpisnehoFormularaKniznice/288528","1","0",
"OF-288531","Po karanténe","Chemikálie - Cyklohexán, Hydroxypropyl, Polymeráza","Chemikálie, Cyklohexán, Hydroxypropyl, Polymeráza","24300000-7 Základné anorganické a organické chemikálie; 60000000-8 Dopravné služby (bez prepravy odpadu)","Tovar; Služba","","https://portal.eks.sk/SpravaKniznice/OpisneFormulareKniznice/VerejnyDetailOpisnehoFormularaKniznice/288531","0","0",
"OF-288561","Po karanténe","Bezpečnostno - technická kontrola (BTK) monitor/defibrilátora ZOLL X Series a prenosného pľúcneho ventilátora ZOLL EMV+.","technická, bezpečnostná, monitor/defibrilátor, zoll, series, prenosný, pľúcny, kontrola, ventilátor","50421000-2 Opravy a údržba lekárskych zariadení; 60000000-8 Dopravné služby (bez prepravy odpadu)","Služba","","https://portal.eks.sk/SpravaKniznice/OpisneFormulareKniznice/VerejnyDetailOpisnehoFormularaKniznice/288561","0","0",
"OF-288601","Po karanténe","Bezpečnostno - technická kontrola (BTK) prenosných odsávačiek S-SCORT new-Duet 2314 a Laerdal Suction Unit.","technická, kontrola, defibrilátor, aed 3, zoll, bezpečnostná, s-scort, duet 2314, laerdal, suction, unit","50421000-2 Opravy a údržba lekárskych zariadení; 60000000-8 Dopravné služby (bez prepravy odpadu)","Služba","","https://portal.eks.sk/SpravaKniznice/OpisneFormulareKniznice/VerejnyDetailOpisnehoFormularaKniznice/288601","0","0",
"OF-288613","Po karanténe","Ovocie a zelenina","ovocie, zelenina, banány, citrusové plody, jablká, hrušky, hrozno, slivky, brokolica, cibuľa, kaleráb, kapusta, paradajky, paprika, mrkva, šalát, zeler, zemiaky","03220000-9 Zelenina, ovocie a orechy; 03222200-5 Citrusové plody; 03222320-2 Jablká, hrušky a dule; 03222111-4 Banány; 03222340-8 Hrozno; 03222334-3 Slivky; 03221430-9 Brokolica; 03221113-1 Cibuľa; 03221410-3 Kapusta; 03221240-0 Paradajka; 15872100-2 Paprika; 60000000-8 Dopravné služby (bez prepravy odpadu)","Tovar; Služba","","https://portal.eks.sk/SpravaKniznice/OpisneFormulareKniznice/VerejnyDetailOpisnehoFormularaKniznice/288613","1","0",
"OF-288668","Po karanténe","Bezpečnostno - technická kontrola (BTK) automatického defibrilátora ZOLL AED 3.","btk, technická, automatický, zoll, defibrilátor, aed 3, bezpečnostná","50421000-2 Opravy a údržba lekárskych zariadení; 60000000-8 Dopravné služby (bez prepravy odpadu)","Služba","","https://portal.eks.sk/SpravaKniznice/OpisneFormulareKniznice/VerejnyDetailOpisnehoFormularaKniznice/288668","1","0",
"OF-288672","Po karanténe","Bezpečnostno - technická kontrola (BTK) automatického defibrilátora SCHILLER FRED Easyport.","defibrilátor, bezpečnostná, kontrola, automatický, schiller, fred, easyport, technická","50421000-2 Opravy a údržba lekárskych zariadení; 60000000-8 Dopravné služby (bez prepravy odpadu)","Služba","","https://portal.eks.sk/SpravaKniznice/OpisneFormulareKniznice/VerejnyDetailOpisnehoFormularaKniznice/288672","0","0",
"OF-288678","Po karanténe","Bezpečnostno - technická kontrola (BTK) monitor/defibrilátora LIFEPAK 15 a LIFEPAK 1000.","lifepak, technická, monitor/defibrilátor, bezpečnostná, kontrola","50421000-2 Opravy a údržba lekárskych zariadení; 60000000-8 Dopravné služby (bez prepravy odpadu)","Služba","","https://portal.eks.sk/SpravaKniznice/OpisneFormulareKniznice/VerejnyDetailOpisnehoFormularaKniznice/288678","0","0",
"OF-288846","Po karanténe","Tmely, konzervačné materiály a lepidláTmel, uvoľňovač skrutiek, rezný olej, lepidlo","sadra univerzálna, pena trubičková, studená obaľovaná asfaltová zmes","44831100-5 Tmely; 09211500-6 Oleje znižujúce odpor; 44830000-7 Tmely, plnivá, tesniace tmely a rozpúšťadlá; 60000000-8 Dopravné služby (bez prepravy odpadu)","Tovar; Služba","","https://portal.eks.sk/SpravaKniznice/OpisneFormulareKniznice/VerejnyDetailOpisnehoFormularaKniznice/288846","0","0",
"OF-288898","Po karanténe","Nákup úžitkových motorových vozidiel s nižšou hmotnosťou - nové","úžitkové motorové vozidlá, valníkové, skriňové","34100000-8 Motorové vozidlá; 34144700-5 Úžitkové vozidlá; 60000000-8 Dopravné služby (bez prepravy odpadu)","Tovar; Služba","","https://portal.eks.sk/SpravaKniznice/OpisneFormulareKniznice/VerejnyDetailOpisnehoFormularaKniznice/288898","0","0",
"OF-288931","Po karanténe","Elektroinštalačný materiál","Ističe, osvetlenie, poistky, stýkač, spúšťač motora, EZH, vodič, kábel, svorky, zásuvka, dutinka, samolepky, bužírka, chránička, vývodka","31681000-3 Elektropríslušenstvo; 31000000-6 Elektrické stroje, prístroje, zariadenia a spotrebný tovar; osvetlenie; 60000000-8 Dopravné služby (bez prepravy odpadu)","Tovar; Služba","","https://portal.eks.sk/SpravaKniznice/OpisneFormulareKniznice/VerejnyDetailOpisnehoFormularaKniznice/288931","1","0",
"OF-288941","Po karanténe","Mobilné telefóny","telefón","32552110-1 Bezdrôtové telefóny; 32250000-0 Mobilné telefóny; 60000000-8 Dopravné služby (bez prepravy odpadu)","Tovar; Služba","","https://portal.eks.sk/SpravaKniznice/OpisneFormulareKniznice/VerejnyDetailOpisnehoFormularaKniznice/288941","0","0",
"OF-288954","Po karanténe","HW obnova a podpora systému Flowmon","HW obnova a podpora systému Flowmon","48517000-5 Softvérový balík pre informačné technológie; 60000000-8 Dopravné služby (bez prepravy odpadu)","Tovar; Služba","","https://portal.eks.sk/SpravaKniznice/OpisneFormulareKniznice/VerejnyDetailOpisnehoFormularaKniznice/288954","0","0",
"OF-289012","Po karanténe","Etanol","Etanol, chemikálie, etylalkohol","24300000-7 Základné anorganické a organické chemikálie; 60000000-8 Dopravné služby (bez prepravy odpadu); 24322220-5 Etanol","Tovar; Služba","","https://portal.eks.sk/SpravaKniznice/OpisneFormulareKniznice/VerejnyDetailOpisnehoFormularaKniznice/289012","1","0",
"OF-289050","Po karanténe","Kovové skrine","Kovové skrine","39141300-5 Skrine; 60000000-8 Dopravné služby (bez prepravy odpadu)","Tovar; Služba","","https://portal.eks.sk/SpravaKniznice/OpisneFormulareKniznice/VerejnyDetailOpisnehoFormularaKniznice/289050","1","0",
"OF-289079","Po karanténe","Batériový vŕtací systém pre ortopédiu a traumatológiu","vŕtačka, vŕtací systém, pílka, ortopédia, traumatológia","33160000-9 Operačná technika; 51410000-9 Inštalácia lekárskych zariadení; 60000000-8 Dopravné služby (bez prepravy odpadu)","Tovar; Služba","","https://portal.eks.sk/SpravaKniznice/OpisneFormulareKniznice/VerejnyDetailOpisnehoFormularaKniznice/289079","0","0",
"OF-289100","Po karanténe","Originálne  tonery a príslušenstvo k PC12","tlač písomnosti","30125100-2 Tonerové náplne; 60000000-8 Dopravné služby (bez prepravy odpadu)","Tovar; Služba","","https://portal.eks.sk/SpravaKniznice/OpisneFormulareKniznice/VerejnyDetailOpisnehoFormularaKniznice/289100","1","0",
"OF-289117","Po karanténe","Príslušenstvo k výpočtovej technike : SSD disky, HDMI káble","počítačové príslušenstvo, káble, káblové príslušenstvo, SSD disky","30200000-1 Počítačové zariadenia a spotrebný materiál; 30237000-9 Časti a príslušenstvo počítačov a spotrebný materiál k nim; 30230000-0 Zariadenia súvisiace s počítačmi; 30237200-1 Príslušenstvo počítačov; 30234000-8 Pamäťové médiá; 60000000-8 Dopravné služby (bez prepravy odpadu)","Tovar; Služba","","https://portal.eks.sk/SpravaKniznice/OpisneFormulareKniznice/VerejnyDetailOpisnehoFormularaKniznice/289117","0","0",
"OF-289149","Po karanténe","Výpočtová technika","Počítač,  notebook,  disk","30213000-5 Osobné počítače; 30200000-1 Počítačové zariadenia a spotrebný materiál; 30213300-8 Stolový počítač; 30214000-2 Pracovné stanice; 60000000-8 Dopravné služby (bez prepravy odpadu); 30230000-0 Zariadenia súvisiace s počítačmi; 30237200-1 Príslušenstvo počítačov; 30237300-2 Spotrebný materiál k počítačom; 30213100-6 Prenosné počítače","Tovar; Služba","","https://portal.eks.sk/SpravaKniznice/OpisneFormulareKniznice/VerejnyDetailOpisnehoFormularaKniznice/289149","0","0",
"OF-289158","Po karanténe","Chemikálie na experimentálny výskum","Chemikálie, chlorid ytritý, hexahydrát, chlorid samaritý, bromid ceritý","24300000-7 Základné anorganické a organické chemikálie; 60000000-8 Dopravné služby (bez prepravy odpadu)","Tovar; Služba","","https://portal.eks.sk/SpravaKniznice/OpisneFormulareKniznice/VerejnyDetailOpisnehoFormularaKniznice/289158","2","0",
"OF-289163","Po karanténe","ND do generátorov a elektrocentrál","sada tesnení, filtre","31120000-3 Generátory; 60000000-8 Dopravné služby (bez prepravy odpadu); 31100000-7 Elektromotory, generátory a transformátory; 31161000-2 Časti elektromotorov a generátorov; 31121000-0 Generátorové hnacie agregáty; 42124000-4 Časti čerpadiel, kompresorov, strojov a motorov; 42124330-6 Časti vzduchových kompresorov; 42120000-6 Čerpadlá a kompresory; 31121100-1 Generátorové hnacie agregáty s piestovým vznetovým motorom; 31122000-7 Generátorové jednotky","Tovar; Služba","","https://portal.eks.sk/SpravaKniznice/OpisneFormulareKniznice/VerejnyDetailOpisnehoFormularaKniznice/289163","1","0",
"OF-289173","Po karanténe","Maliarske náradie a pomôcky","štetec zarohový, štetec plochý, štetka maliarska, fólia pvc krycia","37820000-2 Potreby pre maliarov; 60000000-8 Dopravné služby (bez prepravy odpadu)","Tovar; Služba","","https://portal.eks.sk/SpravaKniznice/OpisneFormulareKniznice/VerejnyDetailOpisnehoFormularaKniznice/289173","1","0",
"OF-289186","Po karanténe","GC kolóna (235_24)","kolóna, GC, kapilára","33790000-4 Laboratórny, zdravotnícky alebo farmaceutický sklenený tovar; 60000000-8 Dopravné služby (bez prepravy odpadu)","Tovar; Služba","","https://portal.eks.sk/SpravaKniznice/OpisneFormulareKniznice/VerejnyDetailOpisnehoFormularaKniznice/289186","1","0",
"OF-289203","Po karanténe","Posilňovacia veža","posilňovacia veža","37442900-8 Posilňovacie veže; 60000000-8 Dopravné služby (bez prepravy odpadu)","Tovar; Služba","","https://portal.eks.sk/SpravaKniznice/OpisneFormulareKniznice/VerejnyDetailOpisnehoFormularaKniznice/289203","1","0",
"OF-289216","Po karanténe","Motorové vozidlo - Minibus ","motorové vozidlo, minibus","34120000-4 Motorové vozidlá na prepravu 10 alebo viac osôb; 60000000-8 Dopravné služby (bez prepravy odpadu)","Tovar; Služba","","https://portal.eks.sk/SpravaKniznice/OpisneFormulareKniznice/VerejnyDetailOpisnehoFormularaKniznice/289216","1","0",
"OF-289232","Po karanténe","Čistiace a dezinfekčné prostriedky neosobnej hygieny","Čistiace prostriedky, dezinfekčné prostriedky, umývacie prostriedky, leštiace prostriedky, odmasťovacie prostriedky, prostriedky na odstraňovanie vodného kameňa, vedrá, zmetáky","39800000-0 Čistiace a leštiace výrobky; 39831300-9 Čistiace prostriedky na podlahu; 39831600-2 Čistiace prostriedky na toalety; 39832000-3 Čistiace prostriedky na riad; 39830000-9 Čistiace výrobky; 39831220-4 Odmasťovacie prostriedky; 39831210-1 Saponáty na umývanie riadu; 39831200-8 Saponáty; 24455000-8 Dezinfekčné prostriedky; 39224000-8 Metly a kefy a iné predmety rôznych typov; 39224300-1 Metly a kefy a iné výrobky na upratovanie domácností; 60000000-8 Dopravné služby (bez prepravy odpadu)","Tovar; Služba","","https://portal.eks.sk/SpravaKniznice/OpisneFormulareKniznice/VerejnyDetailOpisnehoFormularaKniznice/289232","1","6833.330",
"OF-289234","Po karanténe","Aktualizácia (support od výrobcu) bezpečnostného prvku siete – HW","odpora, údržba, support","72261000-2 Softvérové podporné služby; 72250000-2 Služby týkajúce sa podpory systému; 50324100-3 Údržba systémov","Služba","","https://portal.eks.sk/SpravaKniznice/OpisneFormulareKniznice/VerejnyDetailOpisnehoFormularaKniznice/289234","0","0",
"OF-289235","Po karanténe","Mikrobiologický bezpečnostný box s laminárnym prúdením","Mikrobiologický bezpečnostný box s laminárnym prúdením","38000000-5 Laboratórne, optické a presné prístroje a vybavenie (s výnimkou skiel); 51430000-5 Inštalácia laboratórnych zariadení; 60000000-8 Dopravné služby (bez prepravy odpadu)","Tovar; Služba","","https://portal.eks.sk/SpravaKniznice/OpisneFormulareKniznice/VerejnyDetailOpisnehoFormularaKniznice/289235","0","0",
"OF-289252","Po karanténe","Tlačové pásky","tlačová páska","30125000-1 Časti a príslušenstvo fotokopírovacích prístrojov; 60000000-8 Dopravné služby (bez prepravy odpadu)","Tovar; Služba","","https://portal.eks.sk/SpravaKniznice/OpisneFormulareKniznice/VerejnyDetailOpisnehoFormularaKniznice/289252","1","0",
"OF-289253","Po karanténe","Oprava a odstránenie závad z revízie bleskozvodu, elektromontážne práce, projekt","Nová zachytávacia sústava s podperami vedenia a pripojenie kovových častí na streche","31216200-5 Bleskozvody; 60000000-8 Dopravné služby (bez prepravy odpadu)","Tovar; Služba","","https://portal.eks.sk/SpravaKniznice/OpisneFormulareKniznice/VerejnyDetailOpisnehoFormularaKniznice/289253","1","0",
"OF-289255","Po karanténe","Motorová nafta s dovozom cisternami s prečerpaním do veľkokapacitnej nádrže (BENCALOR)","motorová nafta, dovoz cisternami, prečerpanie do BENCALORU","09134100-8 Motorová nafta; 60000000-8 Dopravné služby (bez prepravy odpadu)","Tovar; Služba","","https://portal.eks.sk/SpravaKniznice/OpisneFormulareKniznice/VerejnyDetailOpisnehoFormularaKniznice/289255","1","0",
"OF-289257","Po karanténe","Diagnostické činidlá","diagnostické činidlá, materiál, vyšetrovacie metódy","33694000-1 Diagnostické činidlá; 33124130-5 Diagnostický spotrebný materiál; 60000000-8 Dopravné služby (bez prepravy odpadu)","Tovar; Služba","","https://portal.eks.sk/SpravaKniznice/OpisneFormulareKniznice/VerejnyDetailOpisnehoFormularaKniznice/289257","0","0",
"OF-289258","Po karanténe","Podložné sklíčka s PEN membránou na laserovú mikrodisekciu ","zdravotnícky spotrebný materiál, podložné sklíčka","33140000-3 Zdravotnícky spotrebný materiál; 60000000-8 Dopravné služby (bez prepravy odpadu)","Tovar; Služba","","https://portal.eks.sk/SpravaKniznice/OpisneFormulareKniznice/VerejnyDetailOpisnehoFormularaKniznice/289258","1","0",
"OF-289267","Po karanténe","Nádoby a obaly","boxy, stojany","44613800-8 Kontajnery na odpadový materiál; 44610000-9 Cisterny, zásobníky, kontajnery a tlakové nádoby; 60000000-8 Dopravné služby (bez prepravy odpadu)","Tovar; Služba","","https://portal.eks.sk/SpravaKniznice/OpisneFormulareKniznice/VerejnyDetailOpisnehoFormularaKniznice/289267","1","972.960",
"OF-289269","Po karanténe","Stavebné materiály","pur pena, hmoždenky, tyč závitová","44420000-0 Výrobky používané v stavebníctve; 42131110-0 Ventily radiátorov ústredného kúrenia; 44831300-7 Tesniace tmely; 60000000-8 Dopravné služby (bez prepravy odpadu)","Tovar; Služba","","https://portal.eks.sk/SpravaKniznice/OpisneFormulareKniznice/VerejnyDetailOpisnehoFormularaKniznice/289269","1","474.170",
"OF-289270","Po karanténe","Dodávka zemného plynu","Zemný plyn, preprava zemného plynu, distribúcia zemného plynu, služby obchodníka","09123000-7 Zemný plyn; 65200000-5 Rozvod plynu a súvisiace služby","Tovar; Služba","","https://portal.eks.sk/SpravaKniznice/OpisneFormulareKniznice/VerejnyDetailOpisnehoFormularaKniznice/289270","1","0",
"OF-289271","Po karanténe","Nákladné vozidlo  do 7,5 t    s hydraulickou rukou a vyklápacou korbou - 2 ks","Nákladné  vozidlo do 7,5 t","34100000-8 Motorové vozidlá; 34134000-5 Plošinové a vyklápacie nákladné automobily; 34134200-7 Nákladné vozidlá s vyklápaním; 60000000-8 Dopravné služby (bez prepravy odpadu)","Tovar; Služba","","https://portal.eks.sk/SpravaKniznice/OpisneFormulareKniznice/VerejnyDetailOpisnehoFormularaKniznice/289271","1","0",
"OF-289272","Po karanténe","Ostatné interiérové vybavenie																																																	","Kovová skriňa, skrinka pod kopírku, vešiak, kôš, zásobník papierových utierok, dávkovač mydla, držiak toaletného papiera, zrkadlo","39100000-3 Nábytok; 60000000-8 Dopravné služby (bez prepravy odpadu); 39130000-2 Kancelársky nábytok; 30190000-7 Rôzne kancelárske zariadenia a kancelárske potreby","Tovar; Služba","","https://portal.eks.sk/SpravaKniznice/OpisneFormulareKniznice/VerejnyDetailOpisnehoFormularaKniznice/289272","0","0",
"OF-289274","Po karanténe","Elektronické stravovacie poukážky","stravovacie karty, stravné karty, elektronické stravovacie poukážky","30199770-8 Stravné poukážky; 60000000-8 Dopravné služby (bez prepravy odpadu)","Tovar; Služba","","https://portal.eks.sk/SpravaKniznice/OpisneFormulareKniznice/VerejnyDetailOpisnehoFormularaKniznice/289274","1","0",
"OF-289277","Po karanténe","Zlúčeniny na čistenie","Profesionálne tekuté pracie prostriedky, prenájom dávkovacieho zariadenia","39831240-0 Zlúčeniny na čistenie; 42993200-5 Dávkovacie zariadenia; 24000000-4 Chemické výrobky; 39831000-6 Pracie prostriedky; 60000000-8 Dopravné služby (bez prepravy odpadu)","Tovar; Služba","","https://portal.eks.sk/SpravaKniznice/OpisneFormulareKniznice/VerejnyDetailOpisnehoFormularaKniznice/289277","1","10832.000",
"OF-289278","Po karanténe","Školenie podľa ADR","Základné školenie bezpečnostného poradcu ADR, Základné školenie vodičov ADR + rozšírené na prepravu nebezpečných vecí triedy 1, Základné školenie vodičov ADR + rozšírené na prepravu cisternách, Vodiči ADR na triedu 1 - aktualizácia osvedčenia, Vodiči ADR na cisterny - aktualizácia osvedčenia, Vodiči ADR trieda 1 a cisterny - aktualizácia osvedčenia","79632000-3 Školenia a výcvik personálu","Služba","","https://portal.eks.sk/SpravaKniznice/OpisneFormulareKniznice/VerejnyDetailOpisnehoFormularaKniznice/289278","1","0",
"OF-289279","Po karanténe","Filter skladaný a vrecká filtračné","vrecko bezpečnostné, uzatvárateľné, filter","39713431-3 Príslušenstvo k vysávačom prachu; 60000000-8 Dopravné služby (bez prepravy odpadu)","Tovar; Služba","","https://portal.eks.sk/SpravaKniznice/OpisneFormulareKniznice/VerejnyDetailOpisnehoFormularaKniznice/289279","1","0",
"OF-289280","Po karanténe","Kuchynské vybavenie pre domácnosť a kanceláriu","kávovar, rychlovarná kanvica","39711310-5 Elektrické kávovary; 39711320-8 Elektrické čajovary; 60000000-8 Dopravné služby (bez prepravy odpadu)","Tovar; Služba","","https://portal.eks.sk/SpravaKniznice/OpisneFormulareKniznice/VerejnyDetailOpisnehoFormularaKniznice/289280","1","270.830",
"OF-289281","Po karanténe","Ochranné pracovné prostriedky do biologických laboratórií","ochranné pracovné prostriedky, mikina, nohavice, legíny, tričko, obuv","18412000-0 Športové odevy; 18110000-3 Pracovné odevy","Tovar","","https://portal.eks.sk/SpravaKniznice/OpisneFormulareKniznice/VerejnyDetailOpisnehoFormularaKniznice/289281","1","0",
"OF-289282","Po karanténe","Potreby pre verejné stravovanie na jedno použitie","jednorazový obrus netkaná textília rolka","39222100-5 Potreby pre verejné stravovanie na jedno použitie; 33772000-2 Jednorazové papierové výrobky; 60000000-8 Dopravné služby (bez prepravy odpadu)","Tovar; Služba","","https://portal.eks.sk/SpravaKniznice/OpisneFormulareKniznice/VerejnyDetailOpisnehoFormularaKniznice/289282","1","111.670",
"OF-289283","Po karanténe","Parafín v pecičkách","parafín","24300000-7 Základné anorganické a organické chemikálie; 60000000-8 Dopravné služby (bez prepravy odpadu)","Tovar; Služba","","https://portal.eks.sk/SpravaKniznice/OpisneFormulareKniznice/VerejnyDetailOpisnehoFormularaKniznice/289283","1","0",
"OF-289284","Po karanténe","Nafta motorová dovozom cisternami","nafta motorová","09134100-8 Motorová nafta; 60000000-8 Dopravné služby (bez prepravy odpadu)","Tovar; Služba","","https://portal.eks.sk/SpravaKniznice/OpisneFormulareKniznice/VerejnyDetailOpisnehoFormularaKniznice/289284","1","0",
