"OpisnyFormularIdentifikator","OpisnyFormularStav","OpisnyFormularNazov","OpisnyFormularKlucoveSlova","OpisnyFormularCpv","OpisnyFormularDruh","OpisnyFormularKategoriaSluzieb","OpisnyFormularUrl","OpisnyFormularPocetVyhlasenychZakaziek","OpisnyFormularObchodovanaSumaBezDPH",
"OF-209403","Po karanténe","Rozšírenie pamätí a blade servery","disky, server, hardvér, pamäť","48822000-6 Počítačové servery; 48800000-6 Informačné systémy a servery; 60000000-8 Dopravné služby (bez prepravy odpadu)","Tovar; Služba","","https://portal.eks.sk/SpravaKniznice/OpisneFormulareKniznice/VerejnyDetailOpisnehoFormularaKniznice/209403","1","108166,670",
"OF-209404","Po karanténe","Laboratórne pomôcky a príslušenstvo","Laboratórne pomôcky, laboratórne príslušenstvo","33793000-5 Sklenené výrobky pre laboratóriá; 60000000-8 Dopravné služby (bez prepravy odpadu)","Tovar; Služba","","https://portal.eks.sk/SpravaKniznice/OpisneFormulareKniznice/VerejnyDetailOpisnehoFormularaKniznice/209404","1","265,000",
"OF-209406","Po karanténe","Čalúnené váľandy","váľanda, matrac","39143110-0 Postele a lôžkoviny a špeciálne mäkké vybavenie; 60000000-8 Dopravné služby (bez prepravy odpadu)","Tovar; Služba","","https://portal.eks.sk/SpravaKniznice/OpisneFormulareKniznice/VerejnyDetailOpisnehoFormularaKniznice/209406","1","11185,000",
"OF-209407","Po karanténe","Čistiace a hygienické potreby","čistiace prostriedky, hygienické prostriedky, švédske utierky, handry ,metly, textilné rukavice","39800000-0 Čistiace a leštiace výrobky; 39832000-3 Čistiace prostriedky na riad; 39831600-2 Čistiace prostriedky na toalety; 39811100-1 Osviežovač vzduchu; 39831000-6 Pracie prostriedky; 33761000-2 Toaletný papier; 60000000-8 Dopravné služby (bez prepravy odpadu)","Tovar; Služba","","https://portal.eks.sk/SpravaKniznice/OpisneFormulareKniznice/VerejnyDetailOpisnehoFormularaKniznice/209407","1","349,980",
"OF-209409","Po karanténe","Ručné elektrické náradie, ručné náradie","vŕtačka, brašňa, kliešte, kladivo, vysávač","43132300-0 Vŕtačky; 60000000-8 Dopravné služby (bez prepravy odpadu); 44512200-4 Kliešte; 44512300-5 Kladivá; 44512800-0 Skrutkovače; 42999100-6 Vysávače prachu nie pre domácnosť","Tovar; Služba","","https://portal.eks.sk/SpravaKniznice/OpisneFormulareKniznice/VerejnyDetailOpisnehoFormularaKniznice/209409","1","1308,330",
"OF-209410","Po karanténe","Kalibrácia a BTK injekčných dávkovačov B.Braun a infúznych púmp B.Braun ","Kalibrácia, BTK, servis, údržba, injekčné dávkovače, infúzne pumpy, Perfusor compact B.Braun, Infusomat Fms B.Braun, Infusomat Space B.Braun","50433000-9 Kalibrovanie; 50421000-2 Opravy a údržba lekárskych zariadení","Služba","","https://portal.eks.sk/SpravaKniznice/OpisneFormulareKniznice/VerejnyDetailOpisnehoFormularaKniznice/209410","1","0",
"OF-209411","Po karanténe","Letenky: Viedeň - Rím a späť","Letenka, letecká preprava","60410000-5 Pravidelné letecké dopravné služby","Služba","","https://portal.eks.sk/SpravaKniznice/OpisneFormulareKniznice/VerejnyDetailOpisnehoFormularaKniznice/209411","1","162,490",
"OF-209412","Po karanténe","Hygienický a čistiaci tovar","hygienické potreby, čistiace potreby","33770000-8 Papierové hygienické výrobky; 39832000-3 Čistiace prostriedky na riad; 39831300-9 Čistiace prostriedky na podlahu; 39831600-2 Čistiace prostriedky na toalety; 39800000-0 Čistiace a leštiace výrobky; 60000000-8 Dopravné služby (bez prepravy odpadu); 33711900-6 Mydlo; 33761000-2 Toaletný papier; 39811100-1 Osviežovač vzduchu; 39224100-9 Metly","Tovar; Služba","","https://portal.eks.sk/SpravaKniznice/OpisneFormulareKniznice/VerejnyDetailOpisnehoFormularaKniznice/209412","1","264,960",
"OF-209415","Po karanténe","Koberec – metráž - nový","Koberec","39530000-6 Koberce, rohože a predložky; 39531000-3 Koberce; 60000000-8 Dopravné služby (bez prepravy odpadu)","Tovar; Služba","","https://portal.eks.sk/SpravaKniznice/OpisneFormulareKniznice/VerejnyDetailOpisnehoFormularaKniznice/209415","1","786,000",
"OF-209420","Po karanténe","Pracovná zdravotná služba 2020-2021","zdravotná služba","85147000-1 Podnikové zdravotné služby","Služba","","https://portal.eks.sk/SpravaKniznice/OpisneFormulareKniznice/VerejnyDetailOpisnehoFormularaKniznice/209420","1","495,820",
"OF-209422","Po karanténe","Laboratórne vybavenie, zariadenia","Laboratórne vybavenie, zariadenia","38000000-5 Laboratórne, optické a presné prístroje a vybavenie (s výnimkou skiel); 42300000-9 Priemyselné alebo laboratórne pece, spaľovacie pece a rúry (na pečenie); 51430000-5 Inštalácia laboratórnych zariadení; 60000000-8 Dopravné služby (bez prepravy odpadu)","Tovar; Služba","","https://portal.eks.sk/SpravaKniznice/OpisneFormulareKniznice/VerejnyDetailOpisnehoFormularaKniznice/209422","1","51269,170",
"OF-209424","Po karanténe","Osobný počítač ","Osobný počítač,","30213000-5 Osobné počítače; 60000000-8 Dopravné služby (bez prepravy odpadu)","Tovar; Služba","","https://portal.eks.sk/SpravaKniznice/OpisneFormulareKniznice/VerejnyDetailOpisnehoFormularaKniznice/209424","1","0",
"OF-209425","Po karanténe","Tlačivá","tlačivá, tlačoviny","22000000-0 Tlačené výrobky a príbuzné produkty; 60000000-8 Dopravné služby (bez prepravy odpadu); 79810000-5 Tlačiarenské služby","Tovar; Služba","","https://portal.eks.sk/SpravaKniznice/OpisneFormulareKniznice/VerejnyDetailOpisnehoFormularaKniznice/209425","1","0",
"OF-209426","Po karanténe","Obnova podpory pre informačné technológie","podpora, maintenance, údržba","50312600-1 Údržba a opravy zariadení informačných technológií; 50324100-3 Údržba systémov; 50332000-1 Údržba telekomunikačnej infraštruktúry; 60000000-8 Dopravné služby (bez prepravy odpadu)","Služba","","https://portal.eks.sk/SpravaKniznice/OpisneFormulareKniznice/VerejnyDetailOpisnehoFormularaKniznice/209426","1","0",
"OF-209427","Po karanténe","Laboratórne vybavenie ,pomôcky a zariadenia","Laboratórne vybavenie, pomôcky a zariadenia","38000000-5 Laboratórne, optické a presné prístroje a vybavenie (s výnimkou skiel); 33141310-6 Injekčné striekačky; 33192500-7 Skúmavky; 42124320-3 Časti vákuových čerpadiel; 51430000-5 Inštalácia laboratórnych zariadení; 38931000-0 Skúšacie prístroje teploty a vlhkosti; 19520000-7 Plastové výrobky; 18141000-9 Pracovné rukavice; 60000000-8 Dopravné služby (bez prepravy odpadu)","Tovar; Služba","","https://portal.eks.sk/SpravaKniznice/OpisneFormulareKniznice/VerejnyDetailOpisnehoFormularaKniznice/209427","1","0",
"OF-209428","Po karanténe","Zber, odvoz a zneškodnenie biologicky rozložiteľného kuchynského odpadu","kuchynský odpad, zber, odvoz, likvidácia, biologicky rozložiteľný, zmesi tukov a olejov","90510000-5 Likvidácia a spracovanie odpadu; 90512000-9 Služby na prepravu odpadu; 90500000-2 Služby súvisiace s likvidáciou odpadu a odpadom; 90511000-2 Služby na zber odpadu","Služba","","https://portal.eks.sk/SpravaKniznice/OpisneFormulareKniznice/VerejnyDetailOpisnehoFormularaKniznice/209428","1","1291,660",
"OF-209430","Po karanténe","Komponenty IKT","Komponenty IKT","30200000-1 Počítačové zariadenia a spotrebný materiál","Tovar","","https://portal.eks.sk/SpravaKniznice/OpisneFormulareKniznice/VerejnyDetailOpisnehoFormularaKniznice/209430","0","0",
"OF-209431","Po karanténe","Dodávka elektrickej energie","elektrina, dodávka elektrickej energie, distribúcia elektrickej energie","09310000-5 Elektrická energia; 65300000-6 Rozvod elektriny a súvisiace služby","Tovar; Služba","","https://portal.eks.sk/SpravaKniznice/OpisneFormulareKniznice/VerejnyDetailOpisnehoFormularaKniznice/209431","1","0",
"OF-209433","Po karanténe","Hygienické pomôcky a čistiace potreby","čistiace prostriedky na podlahu, WC, riady, tekuté mydlá, hubky na riad, vrecia do koša","39830000-9 Čistiace výrobky; 39831300-9 Čistiace prostriedky na podlahu; 39832100-4 Čistiaci prášok na riad; 39831600-2 Čistiace prostriedky na toalety; 33771000-5 Hygienické výrobky z papiera; 33770000-8 Papierové hygienické výrobky; 39831210-1 Saponáty na umývanie riadu; 39831200-8 Saponáty; 60000000-8 Dopravné služby (bez prepravy odpadu)","Tovar; Služba","","https://portal.eks.sk/SpravaKniznice/OpisneFormulareKniznice/VerejnyDetailOpisnehoFormularaKniznice/209433","1","0",
"OF-209434","Po karanténe","Obálky ","obálky; obálky s vonkajšou potlačou","30199230-1 Obálky; 60000000-8 Dopravné služby (bez prepravy odpadu); 79800000-2 Tlačiarenské a príbuzné služby","Tovar; Služba","","https://portal.eks.sk/SpravaKniznice/OpisneFormulareKniznice/VerejnyDetailOpisnehoFormularaKniznice/209434","1","416,000",
"OF-209435","Po karanténe","Kalibrácia a BTK injekčných a infúznych púmp TERUMO ","kalibrácia, BTK, servis, údržba, injekčná pumpa, infúzna pumpa,  TERUMO TERFUSION SYRINGE PUMP TE-311, TERUMO TERUFUSION SYRINGE PUPMP TE - 331, TERUMO INFUSION PUMP TE - 171, TERUMO TERFUSION INFUSION PUMP TE-LM 700, TERUMO TE-LF600, TERUMO TE-SS700","50433000-9 Kalibrovanie; 50421000-2 Opravy a údržba lekárskych zariadení","Služba","","https://portal.eks.sk/SpravaKniznice/OpisneFormulareKniznice/VerejnyDetailOpisnehoFormularaKniznice/209435","1","1281,670",
"OF-209436","Po karanténe","Stolové počítače, Kancelárske, All-in-one","Stolový počítač All-in-one","60000000-8 Dopravné služby (bez prepravy odpadu); 30213000-5 Osobné počítače; 48600000-4 Databázový a operačný softvérový balík; 30237460-1 Počítačové klávesnice; 30231000-7 Počítačové monitory a konzoly","Služba; Tovar","","https://portal.eks.sk/SpravaKniznice/OpisneFormulareKniznice/VerejnyDetailOpisnehoFormularaKniznice/209436","1","970,000",
"OF-209437","Po karanténe","Strojové zariadenie drevárskej dielne","Olepovačka, kompresor","31600000-2 Elektrické zariadenia a prístroje; 43810000-4 Zariadenia na opracovanie dreva; 60000000-8 Dopravné služby (bez prepravy odpadu); 42123000-7 Kompresory","Tovar; Služba","","https://portal.eks.sk/SpravaKniznice/OpisneFormulareKniznice/VerejnyDetailOpisnehoFormularaKniznice/209437","1","0",
"OF-209440","Po karanténe","Dataprojektor","dataprojektor","38652120-7 Videoprojektory; 60000000-8 Dopravné služby (bez prepravy odpadu)","Tovar; Služba","","https://portal.eks.sk/SpravaKniznice/OpisneFormulareKniznice/VerejnyDetailOpisnehoFormularaKniznice/209440","1","432,410",
"OF-209441","Po karanténe","Skriňa spisová s dverami","Skriňa","39141300-5 Skrine; 60000000-8 Dopravné služby (bez prepravy odpadu)","Tovar; Služba","","https://portal.eks.sk/SpravaKniznice/OpisneFormulareKniznice/VerejnyDetailOpisnehoFormularaKniznice/209441","1","270,000",
"OF-209442","Po karanténe","Počítačová zostava kancelárska s monitorom pivot","osobný počítač, monitor LCD 24"", DDR4,","30231000-7 Počítačové monitory a konzoly; 30213000-5 Osobné počítače; 60000000-8 Dopravné služby (bez prepravy odpadu)","Tovar","","https://portal.eks.sk/SpravaKniznice/OpisneFormulareKniznice/VerejnyDetailOpisnehoFormularaKniznice/209442","0","0",
"OF-209443","Po karanténe","Sušiče rúk","Sušič rúk","39700000-9 Spotrebiče pre domácnosť; 39712300-9 Prístroje na vysušovanie rúk; 60000000-8 Dopravné služby (bez prepravy odpadu)","Tovar; Služba","","https://portal.eks.sk/SpravaKniznice/OpisneFormulareKniznice/VerejnyDetailOpisnehoFormularaKniznice/209443","1","307,500",
"OF-209444","Po karanténe","Toaletný papier ","toaletný papier","33761000-2 Toaletný papier; 60000000-8 Dopravné služby (bez prepravy odpadu)","Tovar; Služba","","https://portal.eks.sk/SpravaKniznice/OpisneFormulareKniznice/VerejnyDetailOpisnehoFormularaKniznice/209444","1","598,330",
"OF-209445","Po karanténe","Spotrebný materiál - kancelárske potreby","kancelárske potreby","30191400-8 Skartovače; 30192000-1 Kancelárske potreby; 60000000-8 Dopravné služby (bez prepravy odpadu)","Tovar; Služba","","https://portal.eks.sk/SpravaKniznice/OpisneFormulareKniznice/VerejnyDetailOpisnehoFormularaKniznice/209445","1","0",
"OF-209446","Po karanténe","Spotrebný materiál do tlačiareň Xerox 6360 Phaser","Fuser, transfer roller","30124100-5 Zapekacie jednotky; 30124300-7 Valce pre kancelárske stroje; 60000000-8 Dopravné služby (bez prepravy odpadu)","Tovar; Služba","","https://portal.eks.sk/SpravaKniznice/OpisneFormulareKniznice/VerejnyDetailOpisnehoFormularaKniznice/209446","1","0",
"OF-209447","Po karanténe","Bezpečnostné značenie","výstraha, značenie","34928470-3 Značenie; 60000000-8 Dopravné služby (bez prepravy odpadu)","Tovar; Služba","","https://portal.eks.sk/SpravaKniznice/OpisneFormulareKniznice/VerejnyDetailOpisnehoFormularaKniznice/209447","0","0",
"OF-209448","Po karanténe","Tlačiarenské služby","tlač, tlačiarenské služby","79810000-5 Tlačiarenské služby; 60000000-8 Dopravné služby (bez prepravy odpadu)","Služba; Tovar","","https://portal.eks.sk/SpravaKniznice/OpisneFormulareKniznice/VerejnyDetailOpisnehoFormularaKniznice/209448","1","68,920",
"OF-209449","Po karanténe","Ochranné osobné pracovné prostriedky","prilba, rukavice, nohavice, bunda, návleky, postroj","18100000-0 Pracovné odevy, špeciálne pracovné odevy a doplnky; 18444111-4 Ochranné prilby; 18141000-9 Pracovné rukavice; 18140000-2 Doplnky pracovných odevov; 60000000-8 Dopravné služby (bez prepravy odpadu)","Tovar; Služba","","https://portal.eks.sk/SpravaKniznice/OpisneFormulareKniznice/VerejnyDetailOpisnehoFormularaKniznice/209449","1","33832,500",
"OF-209450","Po karanténe","Kancelárske potreby","Kancelársky papier, výkresy, fotopapier, laminovacie fólie, popisovače a čistiace spreje na biele keramické tabule,","30192000-1 Kancelárske potreby; 30197620-8 Písací papier; 30197643-5 Papier na fotokopírovanie; 30197642-8 Papier na fotokopírovanie a xerografický papier; 30195700-9 Čistiace súpravy na tabule alebo príslušenstvo; 30192124-6 Fixky; 60000000-8 Dopravné služby (bez prepravy odpadu)","Tovar; Služba","","https://portal.eks.sk/SpravaKniznice/OpisneFormulareKniznice/VerejnyDetailOpisnehoFormularaKniznice/209450","1","0",
"OF-209453","Po karanténe","Páska do tlačiarne Olivetti PR2 plus","tonery, pásky, náplne do tlačiarní","30125100-2 Tonerové náplne; 30232120-1 Ihličkové tlačiarne; 30192320-0 Pásky do tlačiarní; 60000000-8 Dopravné služby (bez prepravy odpadu)","Tovar; Služba","","https://portal.eks.sk/SpravaKniznice/OpisneFormulareKniznice/VerejnyDetailOpisnehoFormularaKniznice/209453","1","29,000",
"OF-209454","Po karanténe","Maliarský materiál","farba, lepidlo, špachtľa, páska, vlnitý papier","44800000-8 Náterové farby, laky a tmely; 24200000-6 Farby a pigmenty; 60000000-8 Dopravné služby (bez prepravy odpadu)","Tovar; Služba","","https://portal.eks.sk/SpravaKniznice/OpisneFormulareKniznice/VerejnyDetailOpisnehoFormularaKniznice/209454","1","1025,000",
"OF-209458","Po karanténe","elektroinštalačný materiál","LED svietidlo, elektrické rozvodové káble","31532000-4 Časti lámp a svietidiel a príslušenstvo k nim; 31532900-3 Žiarivkové svietidlá; 31681000-3 Elektropríslušenstvo; 31524000-5 Príslušenstvo k stropným alebo nástenným svietidlám; 31320000-5 Elektrické rozvodné káble; 60000000-8 Dopravné služby (bez prepravy odpadu)","Tovar; Služba","","https://portal.eks.sk/SpravaKniznice/OpisneFormulareKniznice/VerejnyDetailOpisnehoFormularaKniznice/209458","0","0",
"OF-209460","Po karanténe","Dodanie elektrickej energie","elektrická energia","09310000-5 Elektrická energia; 65300000-6 Rozvod elektriny a súvisiace služby","Tovar; Služba","","https://portal.eks.sk/SpravaKniznice/OpisneFormulareKniznice/VerejnyDetailOpisnehoFormularaKniznice/209460","1","141049,170",
"OF-209461","Po karanténe","Stroj na popcorn s vozíkom","Stroj na popcorn s vozíkom","39220000-0 Kuchynské zariadenie, domáce potreby a potreby pre domáce hospodárstvo a dodávky pre stravovacie zariadenia; 60000000-8 Dopravné služby (bez prepravy odpadu)","Tovar; Služba","","https://portal.eks.sk/SpravaKniznice/OpisneFormulareKniznice/VerejnyDetailOpisnehoFormularaKniznice/209461","1","333,330",
"OF-209463","Po karanténe","LIEKY skupiny G - Urogenitálny systém a pohlavné hormóny","Nystatín, nifuratel, Metronidazol, Klotrimazol, Nifuratel, Metylergometrín, Dinoprostón, Karboprost, Bromokriptín, Progesterón, Dydrogesteron, Trospium, Tamsulosín","33641000-5 Liečivá pre močovopohlavný systém a pohlavné hormóny; 60000000-8 Dopravné služby (bez prepravy odpadu)","Tovar; Služba","","https://portal.eks.sk/SpravaKniznice/OpisneFormulareKniznice/VerejnyDetailOpisnehoFormularaKniznice/209463","0","0",
"OF-209464","Po karanténe","Monitor HP VH240a, 23,8""","Monitor, zobrazovacia jednotka","30231310-3 Ploché displeje; 60000000-8 Dopravné služby (bez prepravy odpadu)","Tovar; Služba","","https://portal.eks.sk/SpravaKniznice/OpisneFormulareKniznice/VerejnyDetailOpisnehoFormularaKniznice/209464","1","0",
"OF-209465","Po karanténe","Tonery 4/2020","toner, tonerová náplň","30125120-8 Toner do fotokopírovacích strojov; 30125100-2 Tonerové náplne; 60000000-8 Dopravné služby (bez prepravy odpadu)","Tovar; Služba","","https://portal.eks.sk/SpravaKniznice/OpisneFormulareKniznice/VerejnyDetailOpisnehoFormularaKniznice/209465","1","0",
"OF-209466","Po karanténe","Náhradné náplne do dávkovačov CWS","náhradná náplň, dezinfekčný prostriedok, WC hygiena","33760000-5 Toaletný papier, vreckovky, uteráky na ruky a servítky; 60000000-8 Dopravné služby (bez prepravy odpadu)","Tovar; Služba","","https://portal.eks.sk/SpravaKniznice/OpisneFormulareKniznice/VerejnyDetailOpisnehoFormularaKniznice/209466","1","600,000",
"OF-209468","Po karanténe","Tabelačný papier 25x12 ""(1+0)","Tabelačný papier","30199330-2 Papier do počítačových tlačiarní v páse; 60000000-8 Dopravné služby (bez prepravy odpadu)","Tovar; Služba","","https://portal.eks.sk/SpravaKniznice/OpisneFormulareKniznice/VerejnyDetailOpisnehoFormularaKniznice/209468","1","0",
"OF-209469","Po karanténe","Stroj na cukrovú vatu s vozíkom","stroj,  cukrová vata, vozík, cukor","39220000-0 Kuchynské zariadenie, domáce potreby a potreby pre domáce hospodárstvo a dodávky pre stravovacie zariadenia; 60000000-8 Dopravné služby (bez prepravy odpadu)","Tovar; Služba","","https://portal.eks.sk/SpravaKniznice/OpisneFormulareKniznice/VerejnyDetailOpisnehoFormularaKniznice/209469","1","270,000",
"OF-209471","Po karanténe","Nábytok","Nábytok, kancelársky nábytok","39100000-3 Nábytok; 39130000-2 Kancelársky nábytok; 60000000-8 Dopravné služby (bez prepravy odpadu)","Tovar; Služba","","https://portal.eks.sk/SpravaKniznice/OpisneFormulareKniznice/VerejnyDetailOpisnehoFormularaKniznice/209471","1","0",
"OF-209472","Po karanténe","Strážna služba v strediskách organizácie","strážna služba, bezpečnosť, stráženie, SBS, súkromná bezpečnostná služba, ochrana objektu, fyzická ochrana objektov, hliadkové služby,","79713000-5 Strážne služby; 79710000-4 Bezpečnostné služby","Služba","","https://portal.eks.sk/SpravaKniznice/OpisneFormulareKniznice/VerejnyDetailOpisnehoFormularaKniznice/209472","1","0",
"OF-209474","Po karanténe","Čistiaci a hygienický materiál","Čistiaci a hygienický materiál","39831300-9 Čistiace prostriedky na podlahu; 39831600-2 Čistiace prostriedky na toalety; 60000000-8 Dopravné služby (bez prepravy odpadu)","Tovar; Služba","","https://portal.eks.sk/SpravaKniznice/OpisneFormulareKniznice/VerejnyDetailOpisnehoFormularaKniznice/209474","0","0",
"OF-209476","Po karanténe","Obstaranie stravných poukážok v papierovej forme","stravné poukážky, dodanie stravných poukážok, zabezpečenie stravovania v zmluvných stravovacích zariadeniach","60000000-8 Dopravné služby (bez prepravy odpadu); 30199770-8 Stravné poukážky","Služba","","https://portal.eks.sk/SpravaKniznice/OpisneFormulareKniznice/VerejnyDetailOpisnehoFormularaKniznice/209476","1","0",
"OF-209477","Po karanténe","Nákup výpočtovej techniky","počítač, notebook, ultrabook, dokovacia stanica, monitor","30213100-6 Prenosné počítače; 30213300-8 Stolový počítač; 30214000-2 Pracovné stanice; 30231000-7 Počítačové monitory a konzoly; 30213000-5 Osobné počítače; 48600000-4 Databázový a operačný softvérový balík; 60000000-8 Dopravné služby (bez prepravy odpadu)","Tovar; Služba","","https://portal.eks.sk/SpravaKniznice/OpisneFormulareKniznice/VerejnyDetailOpisnehoFormularaKniznice/209477","0","0",
"OF-209478","Po karanténe","Kancelársky papier","kancelársky papier, kancelárske potreby,papier","30192000-1 Kancelárske potreby; 60000000-8 Dopravné služby (bez prepravy odpadu)","Tovar; Služba","","https://portal.eks.sk/SpravaKniznice/OpisneFormulareKniznice/VerejnyDetailOpisnehoFormularaKniznice/209478","1","420,000",
"OF-209479","Po karanténe","MS Windows 10 Pro","MS Windows 10 Pro SK (FPP)","48620000-0 Operačné systémy; 48624000-8 Softvérový balík pre operačný systém osobného počítača (PC); 60000000-8 Dopravné služby (bez prepravy odpadu)","Tovar; Služba","","https://portal.eks.sk/SpravaKniznice/OpisneFormulareKniznice/VerejnyDetailOpisnehoFormularaKniznice/209479","1","0",
"OF-209481","Po karanténe","Špeciálne laboratórne pomôcky","laboratórny materiál","33790000-4 Laboratórny, zdravotnícky alebo farmaceutický sklenený tovar","Tovar","","https://portal.eks.sk/SpravaKniznice/OpisneFormulareKniznice/VerejnyDetailOpisnehoFormularaKniznice/209481","1","0",
"OF-209482","Po karanténe","Mulčovač","mulčovač","16000000-5 Poľnohospodárske stroje; 60000000-8 Dopravné služby (bez prepravy odpadu)","Tovar; Služba","","https://portal.eks.sk/SpravaKniznice/OpisneFormulareKniznice/VerejnyDetailOpisnehoFormularaKniznice/209482","1","1450,000",
"OF-209483","Po karanténe","Premietacie plátno","Premietacie plátno pre odbornú učebňu","38653400-1 Premietacie plátna; 60000000-8 Dopravné služby (bez prepravy odpadu)","Tovar; Služba","","https://portal.eks.sk/SpravaKniznice/OpisneFormulareKniznice/VerejnyDetailOpisnehoFormularaKniznice/209483","1","151,270",
"OF-209484","Po karanténe","Tréningové projektily do nesmrtiacej zbrane FN 303 ","nesmrtiaca zbraň, projektily, príslušenstvo","35200000-6 Policajný výstroj; 35220000-2 Výstroj na potláčanie nepokojov; 35312000-4 Plynové pištole; 35331000-3 Strelivo do strelných zbraní a vojnové prostriedky; 35331100-4 Projektily; 60000000-8 Dopravné služby (bez prepravy odpadu)","Tovar; Služba","","https://portal.eks.sk/SpravaKniznice/OpisneFormulareKniznice/VerejnyDetailOpisnehoFormularaKniznice/209484","0","0",
"OF-209485","Po karanténe","Philips SpeechExec Transcription Set LFH7177 ","Transcription","30237000-9 Časti a príslušenstvo počítačov a spotrebný materiál k nim; 32342100-3 Slúchadlá; 60000000-8 Dopravné služby (bez prepravy odpadu)","Tovar; Služba","","https://portal.eks.sk/SpravaKniznice/OpisneFormulareKniznice/VerejnyDetailOpisnehoFormularaKniznice/209485","0","0",
"OF-209486","Po karanténe","Kombinovaná chladnička s mrazničkou","chladnička, mraznička, chladenie, mrazenie, uchovávanie potravín","39220000-0 Kuchynské zariadenie, domáce potreby a potreby pre domáce hospodárstvo a dodávky pre stravovacie zariadenia; 39711110-3 Chladničky s mrazničkou; 60000000-8 Dopravné služby (bez prepravy odpadu); 51000000-9 Inštalačné služby (s výnimkou softvéru)","Tovar; Služba","","https://portal.eks.sk/SpravaKniznice/OpisneFormulareKniznice/VerejnyDetailOpisnehoFormularaKniznice/209486","1","0",
"OF-209487","Po karanténe","Propagačné predmety s potlačou","zápisník, USB, šatka","39294100-0 Informačné a propagačné výrobky; 60000000-8 Dopravné služby (bez prepravy odpadu)","Tovar; Služba","","https://portal.eks.sk/SpravaKniznice/OpisneFormulareKniznice/VerejnyDetailOpisnehoFormularaKniznice/209487","1","825,000",
"OF-209491","Po karanténe","Letenka spiatočná","Letenka","60400000-2 Letecké dopravné služby; 60000000-8 Dopravné služby (bez prepravy odpadu)","Služba","","https://portal.eks.sk/SpravaKniznice/OpisneFormulareKniznice/VerejnyDetailOpisnehoFormularaKniznice/209491","1","593,000",
"OF-209493","Po karanténe","Kompletné krmivo pre dospelé psy veľkých a obrích plemien","krmivo, granule","15700000-5 Krmivo pre zvieratá; 60000000-8 Dopravné služby (bez prepravy odpadu)","Tovar; Služba","","https://portal.eks.sk/SpravaKniznice/OpisneFormulareKniznice/VerejnyDetailOpisnehoFormularaKniznice/209493","1","0",
"OF-209494","Po karanténe","Kancelárske potreby a pomôcky","kancelárske potreby, perá, zošity, papier, zakladače, sponky, spinky, lepidlá, obaly","30192000-1 Kancelárske potreby; 60000000-8 Dopravné služby (bez prepravy odpadu)","Tovar; Služba","","https://portal.eks.sk/SpravaKniznice/OpisneFormulareKniznice/VerejnyDetailOpisnehoFormularaKniznice/209494","1","780,000",
"OF-209496","Po karanténe","Notebook","Notebook, prenosný počítač","30213100-6 Prenosné počítače; 60000000-8 Dopravné služby (bez prepravy odpadu)","Tovar; Služba","","https://portal.eks.sk/SpravaKniznice/OpisneFormulareKniznice/VerejnyDetailOpisnehoFormularaKniznice/209496","1","528,310",
"OF-209497","Po karanténe","Laboratórne chemikálie","chemikália, laboratórium, výskum, pokus","24000000-4 Chemické výrobky; 24300000-7 Základné anorganické a organické chemikálie; 60000000-8 Dopravné služby (bez prepravy odpadu)","Tovar; Služba","","https://portal.eks.sk/SpravaKniznice/OpisneFormulareKniznice/VerejnyDetailOpisnehoFormularaKniznice/209497","1","35,000",
