"OpisnyFormularIdentifikator","OpisnyFormularStav","OpisnyFormularNazov","OpisnyFormularKlucoveSlova","OpisnyFormularCpv","OpisnyFormularDruh","OpisnyFormularKategoriaSluzieb","OpisnyFormularUrl","OpisnyFormularPocetVyhlasenychZakaziek","OpisnyFormularObchodovanaSumaBezDPH",
"OF-262846","Po karanténe","Šatňová skrinka a hračky pre MŠ","šatňová skrinka, nálepky, maňušky","39161000-8 Nábytok pre materské školy; 37524000-7 Hry; 60000000-8 Dopravné služby (bez prepravy odpadu)","Tovar; Služba","","https://portal.eks.sk/SpravaKniznice/OpisneFormulareKniznice/VerejnyDetailOpisnehoFormularaKniznice/262846","1","262,500",
"OF-263384","Po karanténe","Automatický kávovar","kávovar","39710000-2 Elektrické prístroje pre domácnosť; 60000000-8 Dopravné služby (bez prepravy odpadu)","Tovar; Služba","","https://portal.eks.sk/SpravaKniznice/OpisneFormulareKniznice/VerejnyDetailOpisnehoFormularaKniznice/263384","1","549,990",
"OF-263550","Po karanténe","Podlahové krytiny a príslušenstvo ","Podlahové krytiny, laminátová podlaha, PVC prvky, lišty","44112200-0 Podlahové krytiny; 44112210-3 Pevné podlahy; 60000000-8 Dopravné služby (bez prepravy odpadu)","Tovar; Služba","","https://portal.eks.sk/SpravaKniznice/OpisneFormulareKniznice/VerejnyDetailOpisnehoFormularaKniznice/263550","1","750,000",
"OF-263241","Po karanténe","Vybavenie posilňovní","vzpieračské pódium, regál, polica, hrazda","37440000-4 Výstroj na fitnes; 60000000-8 Dopravné služby (bez prepravy odpadu)","Tovar","","https://portal.eks.sk/SpravaKniznice/OpisneFormulareKniznice/VerejnyDetailOpisnehoFormularaKniznice/263241","1","3060,830",
"OF-262348","Po karanténe","Čistiace a dezinfekčné prostriedky","toaletný papier, papierové utierky, čistiace prostriedky, dezinfekčné prostriedky","33761000-2 Toaletný papier; 33763000-6 Papierové uteráky na ruky; 60000000-8 Dopravné služby (bez prepravy odpadu); 39800000-0 Čistiace a leštiace výrobky; 24455000-8 Dezinfekčné prostriedky; 18141000-9 Pracovné rukavice","Tovar","","https://portal.eks.sk/SpravaKniznice/OpisneFormulareKniznice/VerejnyDetailOpisnehoFormularaKniznice/262348","1","1404,170",
"OF-263507","Po karanténe","Objemové stavebné materiály","Objemové stavebné materiály, Sádra plastická","44921000-2 Vápenec a sadrovec; 60000000-8 Dopravné služby (bez prepravy odpadu)","Tovar; Služba","","https://portal.eks.sk/SpravaKniznice/OpisneFormulareKniznice/VerejnyDetailOpisnehoFormularaKniznice/263507","1","0",
"OF-263882","Po karanténe","Motorová píla HUSQVARNA 262 XP - oprava","motorová píla","50530000-9 Opravy a údržba strojov","Služba","","https://portal.eks.sk/SpravaKniznice/OpisneFormulareKniznice/VerejnyDetailOpisnehoFormularaKniznice/263882","1","0",
"OF-262471","Po karanténe","polygrafické služby","polygrafické služby, výroba pečiatok","44423810-2 Gumené pečiatky; 30192153-8 Textové pečiatky; 60000000-8 Dopravné služby (bez prepravy odpadu)","Tovar; Služba","","https://portal.eks.sk/SpravaKniznice/OpisneFormulareKniznice/VerejnyDetailOpisnehoFormularaKniznice/262471","1","211,670",
"OF-262437","Po karanténe","Banner roll-up s grafikou/potlačou a príslušenstvom","banner, grafika, potlač, interiér","39294100-0 Informačné a propagačné výrobky; 60000000-8 Dopravné služby (bez prepravy odpadu)","Tovar; Služba","","https://portal.eks.sk/SpravaKniznice/OpisneFormulareKniznice/VerejnyDetailOpisnehoFormularaKniznice/262437","1","117,440",
"OF-263250","Po karanténe","Kovová šatňová skriňa","skriňa","39160000-1 Školský nábytok; 60000000-8 Dopravné služby (bez prepravy odpadu)","Tovar; Služba","","https://portal.eks.sk/SpravaKniznice/OpisneFormulareKniznice/VerejnyDetailOpisnehoFormularaKniznice/263250","1","250,830",
"OF-263141","Po karanténe","Čistiace a hygienické prostriedky","Čistiace prostriedky","24000000-4 Chemické výrobky; 33000000-0 Zdravotnícke vybavenie, farmaceutický materiál a výrobky osobnej starostlivosti; 60000000-8 Dopravné služby (bez prepravy odpadu)","Tovar; Služba","","https://portal.eks.sk/SpravaKniznice/OpisneFormulareKniznice/VerejnyDetailOpisnehoFormularaKniznice/263141","1","989,000",
"OF-262480","Po karanténe","tablet  ","tablet","30213200-7 Tabletový počítač; 60000000-8 Dopravné služby (bez prepravy odpadu)","Tovar; Služba","","https://portal.eks.sk/SpravaKniznice/OpisneFormulareKniznice/VerejnyDetailOpisnehoFormularaKniznice/262480","1","295,000",
"OF-262603","Po karanténe","Obnova a upgrade virtualizačného prostredia a SAN infraštruktúry pre databázové servery a SAP. Zmena platformy TSM zálohovacieho servera a obnova páskovej knižnice a zálohovacieho úložiska v EXIMBANKE SR","virtualizačné prostredie, infraštruktúra, pásková knižnica, diskové pole","48800000-6 Informačné systémy a servery; 48810000-9 Informačné systémy; 48820000-2 Servery","Tovar; Služba","","https://portal.eks.sk/SpravaKniznice/OpisneFormulareKniznice/VerejnyDetailOpisnehoFormularaKniznice/262603","1","0",
"OF-263444","Po karanténe","Kalibrácie meradiel na meranie fyzikálnych a mechanických vlastnosti materiálu","Kalibrovanie meradiel","50433000-9 Kalibrovanie; 60000000-8 Dopravné služby (bez prepravy odpadu)","Služba","","https://portal.eks.sk/SpravaKniznice/OpisneFormulareKniznice/VerejnyDetailOpisnehoFormularaKniznice/263444","1","0",
"OF-263344","Po karanténe","SAMSUNG Galaxy Tab S8+, 8GB/128GB, Wi-Fi, Dark Gray (SM-X800NZAAEUE) alebo ekvivalent","tablet","30200000-1 Počítačové zariadenia a spotrebný materiál; 60000000-8 Dopravné služby (bez prepravy odpadu)","Tovar; Služba","","https://portal.eks.sk/SpravaKniznice/OpisneFormulareKniznice/VerejnyDetailOpisnehoFormularaKniznice/263344","1","610,000",
"OF-262743","Po karanténe","Zneškodnenie nebezpečných odpadov","nebezpečný odpad, likvidácia, zber, odvoz","90510000-5 Likvidácia a spracovanie odpadu; 90511000-2 Služby na zber odpadu; 90500000-2 Služby súvisiace s likvidáciou odpadu a odpadom; 90512000-9 Služby na prepravu odpadu","Služba","","https://portal.eks.sk/SpravaKniznice/OpisneFormulareKniznice/VerejnyDetailOpisnehoFormularaKniznice/262743","1","1519,170",
"OF-262511","Po karanténe","Podlahové krytiny a príslušenstvo","Linoleum, podlahová krytina","44112200-0 Podlahové krytiny; 44112230-9 Linoleum; 44112220-6 Nepravé podlahy; 60000000-8 Dopravné služby (bez prepravy odpadu)","Tovar; Služba","","https://portal.eks.sk/SpravaKniznice/OpisneFormulareKniznice/VerejnyDetailOpisnehoFormularaKniznice/262511","1","7495,830",
"OF-263862","Po karanténe","Opravy hydraulických častí ","hydraulický valec","50500000-0 Opravy a údržba čerpadiel, ventilov, kohútov a kovových nádob a strojov; 50530000-9 Opravy a údržba strojov; 43328100-9 Hydraulické zariadenia; 60000000-8 Dopravné služby (bez prepravy odpadu)","Služba","","https://portal.eks.sk/SpravaKniznice/OpisneFormulareKniznice/VerejnyDetailOpisnehoFormularaKniznice/263862","1","0",
"OF-263762","Po karanténe","Sanitárna technika a príslušenstvo","guľový ventil, pisoárový ventil, umývadlová batéria, gumové tesnenie, excenter na batériu","44411000-4 Sanitárne výrobky; 42131230-7 Uzatváracie ventily; 39370000-6 Vodoinštalácie; 60000000-8 Dopravné služby (bez prepravy odpadu)","Tovar; Služba","","https://portal.eks.sk/SpravaKniznice/OpisneFormulareKniznice/VerejnyDetailOpisnehoFormularaKniznice/263762","1","0",
"OF-262494","Po karanténe","Tlač publikácie","tlač, tlačiarenské služby, publikácia","79820000-8 Služby súvisiace s tlačou; 22000000-0 Tlačené výrobky a príbuzné produkty; 22120000-7 Publikácie","Služba","","https://portal.eks.sk/SpravaKniznice/OpisneFormulareKniznice/VerejnyDetailOpisnehoFormularaKniznice/262494","1","317,270",
"OF-263012","Po karanténe","Hydina mrazená","Hydina, hydinové mäso, kurčatá, sliepky, morky, kačky","15112000-6 Hydina; 15112130-6 Kurčatá; 15112120-3 Morky; 15112140-9 Kačice; 15000000-8 Potraviny, nápoje, tabak a príbuzné produkty; 60000000-8 Dopravné služby (bez prepravy odpadu)","Tovar; Služba","","https://portal.eks.sk/SpravaKniznice/OpisneFormulareKniznice/VerejnyDetailOpisnehoFormularaKniznice/263012","1","21061,900",
"OF-262093","Po karanténe","Vaky na moč časť č. 1","zdravotnícky spotrebný materiál","33141615-4 Vaky na moč; 60000000-8 Dopravné služby (bez prepravy odpadu)","Tovar; Služba","","https://portal.eks.sk/SpravaKniznice/OpisneFormulareKniznice/VerejnyDetailOpisnehoFormularaKniznice/262093","1","6000,000",
"OF-263261","Po karanténe","Nákup a dodávka elektrospotrebičov pre ubytovacie zariadenia","Pračka automatická, sušička, rýchlovarná kanvica, mikrovlnná rúra, jednodverová chladnička, chladnička s mrazničkou","39713200-5 Práčky a sušičky bielizne; 39711130-9 Chladničky; 39711362-4 Mikrovlné rúry; 39700000-9 Spotrebiče pre domácnosť; 60000000-8 Dopravné služby (bez prepravy odpadu)","Tovar; Služba","","https://portal.eks.sk/SpravaKniznice/OpisneFormulareKniznice/VerejnyDetailOpisnehoFormularaKniznice/263261","1","30500,000",
"OF-263948","Po karanténe","Mikropipeta Eppendor Research Plus Variabel alebo ekvivalent","mikropipeta","38430000-8 Prístroje na detekciu a rozbory; 60000000-8 Dopravné služby (bez prepravy odpadu)","Tovar; Služba","","https://portal.eks.sk/SpravaKniznice/OpisneFormulareKniznice/VerejnyDetailOpisnehoFormularaKniznice/263948","1","0",
"OF-263430","Po karanténe","Nákup lepidiel","chemoprén, lepidlo","24911200-5 Spojivá; 24951400-9 Chemicky upravené tuky a oleje; 24963000-2 Antikorozívne výrobky; 60000000-8 Dopravné služby (bez prepravy odpadu)","Tovar; Služba","","https://portal.eks.sk/SpravaKniznice/OpisneFormulareKniznice/VerejnyDetailOpisnehoFormularaKniznice/263430","1","0",
"OF-262325","Po karanténe","Batérie, monočlánky","batérie, monočlánky","31400000-0 Akumulátory, galvanické články a batérie; 60000000-8 Dopravné služby (bez prepravy odpadu)","Tovar; Služba","","https://portal.eks.sk/SpravaKniznice/OpisneFormulareKniznice/VerejnyDetailOpisnehoFormularaKniznice/262325","1","220,000",
"OF-263965","Po karanténe","Opravy a údržba certifikovaných mobilných trezorov","otvorenie, oprava","98395000-8 Zámočnícke služby; 60000000-8 Dopravné služby (bez prepravy odpadu)","Služba","","https://portal.eks.sk/SpravaKniznice/OpisneFormulareKniznice/VerejnyDetailOpisnehoFormularaKniznice/263965","1","1200,830",
"OF-262594","Po karanténe","Tlač vedeckej monografie","tlač, tlačiarenská služba, výroba tlače, monografia","79810000-5 Tlačiarenské služby; 79800000-2 Tlačiarenské a príbuzné služby; 79823000-9 Tlačiarenské a doručovateľské služby; 79824000-6 Tlačiarenské a distribučné služby; 79820000-8 Služby súvisiace s tlačou; 79821000-5 Konečná úprava tlače; 60000000-8 Dopravné služby (bez prepravy odpadu)","Služba","","https://portal.eks.sk/SpravaKniznice/OpisneFormulareKniznice/VerejnyDetailOpisnehoFormularaKniznice/262594","1","799,090",
"OF-264197","Po karanténe","Náhradné diely na autobusy Iveco First - karoséria","Náhradné diely, autobus, Iveco First","34300000-0 Časti a príslušenstvo vozidiel a ich motorov; 60000000-8 Dopravné služby (bez prepravy odpadu)","Tovar","","https://portal.eks.sk/SpravaKniznice/OpisneFormulareKniznice/VerejnyDetailOpisnehoFormularaKniznice/264197","1","0",
"OF-262425","Po karanténe","Ručné nástroje a príslušenstvo ","Ručné nástroje a príslušenstvo , hrable, fúrik, lopata, páskovač, čakan","44512940-3 Sada náradia; 42415200-0 Pracovné vozíky; 44511340-0 Hrable; 44511310-1 Čakany; 44511300-8 Čakany, škrabky, motyky, hrable a plážové hrable; 44511120-2 Lopaty; 42921310-4 Páskovacie stroje; 44512200-4 Kliešte; 60000000-8 Dopravné služby (bez prepravy odpadu)","Tovar; Služba","","https://portal.eks.sk/SpravaKniznice/OpisneFormulareKniznice/VerejnyDetailOpisnehoFormularaKniznice/262425","1","1200,920",
"OF-262408","Po karanténe","Dielenské stroje na obrábanie kovov","pásová píla, pásová brúska na kov, obrábacie centrum","31720000-9 Elektromechanické zariadenia; 60000000-8 Dopravné služby (bez prepravy odpadu)","Tovar; Služba","","https://portal.eks.sk/SpravaKniznice/OpisneFormulareKniznice/VerejnyDetailOpisnehoFormularaKniznice/262408","1","11077,500",
"OF-262869","Po karanténe","Monitor 27“ Quad HD","monitor","30237000-9 Časti a príslušenstvo počítačov a spotrebný materiál k nim; 60000000-8 Dopravné služby (bez prepravy odpadu)","Tovar; Služba","","https://portal.eks.sk/SpravaKniznice/OpisneFormulareKniznice/VerejnyDetailOpisnehoFormularaKniznice/262869","1","1369,000",
"OF-263971","Po karanténe","„Stolársky materiál“","závesy, výsuvy, lepidlo","44523000-2 Pánty, kovanie a drobné príslušenstvo; 44830000-7 Tmely, plnivá, tesniace tmely a rozpúšťadlá; 60000000-8 Dopravné služby (bez prepravy odpadu)","Tovar; Služba","","https://portal.eks.sk/SpravaKniznice/OpisneFormulareKniznice/VerejnyDetailOpisnehoFormularaKniznice/263971","1","0",
"OF-263218","Po karanténe","Licencie platformy Microsoft Office 365","Softvér, Microsoft Office 365, Microsoft 365, Teams, PowerPoint, Outlook, Word, Excel, Windows","48219300-9 Softvérový balík pre administratívu; 48311000-1 Softvérový balík na riadenie dokumentov; 48515000-1 Softvérový balík pre videokonferencie; 48920000-3 Softvérový balík na automatizáciu kancelárskych prác; 48310000-4 Softvérový balík na vytváranie dokumentov; 48510000-6 Softvérový balík na komunikáciu; 48500000-3 Softvérový balík na komunikáciu a pre multimédiá; 60000000-8 Dopravné služby (bez prepravy odpadu)","Tovar; Služba","","https://portal.eks.sk/SpravaKniznice/OpisneFormulareKniznice/VerejnyDetailOpisnehoFormularaKniznice/263218","1","0",
"OF-262182","Po karanténe","Nové nákladné auto sklápacie so sklápacou korbou a s radlicou na odhŕňanie snehu, kategória N 3 G","nákladné auto sklápacie, sklápacia korba, radlica na odhŕňanie snehu","34134200-7 Nákladné vozidlá s vyklápaním; 34143000-1 Vozidlá na zimnú údržbu ciest","Tovar","","https://portal.eks.sk/SpravaKniznice/OpisneFormulareKniznice/VerejnyDetailOpisnehoFormularaKniznice/262182","1","198500,000",
"OF-262886","Po karanténe","Nákup   stravných poukážok","stravné poukážky, stravné lístky","30199770-8 Stravné poukážky; 60000000-8 Dopravné služby (bez prepravy odpadu)","Tovar; Služba","","https://portal.eks.sk/SpravaKniznice/OpisneFormulareKniznice/VerejnyDetailOpisnehoFormularaKniznice/262886","1","13794,480",
"OF-264220","Po karanténe","Perorálne lieky  I","Lieky","33600000-6 Farmaceutické výrobky","Tovar","","https://portal.eks.sk/SpravaKniznice/OpisneFormulareKniznice/VerejnyDetailOpisnehoFormularaKniznice/264220","1","0",
"OF-262199","Po karanténe","Zdravotná stolička  ","nábytok, kancelársky nábytok, kreslo","39130000-2 Kancelársky nábytok; 39100000-3 Nábytok; 39112000-0 Stoličky","Tovar","","https://portal.eks.sk/SpravaKniznice/OpisneFormulareKniznice/VerejnyDetailOpisnehoFormularaKniznice/262199","1","822,000",
"OF-263888","Po karanténe","Zvukové, obrazové prostriedky a príslušenstvo","projektor","38652120-7 Videoprojektory; 60000000-8 Dopravné služby (bez prepravy odpadu)","Tovar","","https://portal.eks.sk/SpravaKniznice/OpisneFormulareKniznice/VerejnyDetailOpisnehoFormularaKniznice/263888","1","0",
"OF-263135","Po karanténe","Výpočtová technika - notebooky","notebook","30213100-6 Prenosné počítače; 60000000-8 Dopravné služby (bez prepravy odpadu)","Tovar; Služba","","https://portal.eks.sk/SpravaKniznice/OpisneFormulareKniznice/VerejnyDetailOpisnehoFormularaKniznice/263135","1","2030,830",
"OF-263722","Po karanténe","Povinné zmluvné poistenie motorových vozidiel a havarijne poistenie ","povinné zmluvné poistenie, havarijné poistenie","66516100-1 Poistenie zodpovednosti za škodu spôsobenú prevádzkou motorového vozidla; 66514110-0 Poistenie motorových vozidiel","Služba","","https://portal.eks.sk/SpravaKniznice/OpisneFormulareKniznice/VerejnyDetailOpisnehoFormularaKniznice/263722","1","0",
"OF-262265","Po karanténe","Neplánované opravy a ošetrovania prídavných a prípojných zariadení  II.","Servis, opravy a ošetrovanie prídavných a prípojných zariadení vozidiel","50530000-9 Opravy a údržba strojov; 42124150-0 Časti strojov a motorov na hydraulický pohon; 43328100-9 Hydraulické zariadenia; 43313000-0 Snehové pluhy a snehové frézy","Služba","","https://portal.eks.sk/SpravaKniznice/OpisneFormulareKniznice/VerejnyDetailOpisnehoFormularaKniznice/262265","2","5931,300",
"OF-263301","Po karanténe","Okná, dvere a príslušenstvo","Okná, dvere a príslušenstvo","44221000-5 Okná, dvere a súvisiace prvky; 44316000-8 Železiarsky tovar; 60000000-8 Dopravné služby (bez prepravy odpadu)","Tovar; Služba","","https://portal.eks.sk/SpravaKniznice/OpisneFormulareKniznice/VerejnyDetailOpisnehoFormularaKniznice/263301","1","290,830",
"OF-262786","Po karanténe","Dezinfekčné prostriedky","dezinfekcia, hygiena, umývanie","24455000-8 Dezinfekčné prostriedky; 33741300-9 Dezinfekčné prostriedky na ruky; 33713000-1 Výrobky na starostlivosť o nohy; 60000000-8 Dopravné služby (bez prepravy odpadu)","Tovar; Služba","","https://portal.eks.sk/SpravaKniznice/OpisneFormulareKniznice/VerejnyDetailOpisnehoFormularaKniznice/262786","1","773,330",
"OF-262803","Po karanténe","Nákup televíznych prijímačov a držiakov","televízny prijímač, televízor, držiak","32324000-0 Televízory; 30195800-0 Závesné vešiaky alebo držiaky; 60000000-8 Dopravné služby (bez prepravy odpadu)","Tovar; Služba","","https://portal.eks.sk/SpravaKniznice/OpisneFormulareKniznice/VerejnyDetailOpisnehoFormularaKniznice/262803","1","9166,660",
"OF-263035","Po karanténe","Prístroje na meranie elektrických a fyzikálnych vlastností ","prístroj, fyzikálne a elektrické vlastnosti, meranie,","38341300-0 Nástroje na meranie elektrických veličín; 38500000-0 Kontrolné a testovacie prístroje; 38540000-2 Testovacie a meracie stroje a prístroje; 38425700-7 Prístroje na meranie povrchového napätia; 60000000-8 Dopravné služby (bez prepravy odpadu)","Tovar; Služba","","https://portal.eks.sk/SpravaKniznice/OpisneFormulareKniznice/VerejnyDetailOpisnehoFormularaKniznice/263035","1","1673,000",
"OF-262282","Po karanténe","Náhradné diely na autobusy Sor NB12,NB18 - Hnacie ústrojenstvo","Náhradné diely, autobus,Sor NB12,NB18,hnacie ústrojenstvo","34121100-2 Autobusy verejnej dopravy; 42111000-0 Motory a hnacie zariadenia; 60000000-8 Dopravné služby (bez prepravy odpadu)","Tovar","","https://portal.eks.sk/SpravaKniznice/OpisneFormulareKniznice/VerejnyDetailOpisnehoFormularaKniznice/262282","1","2100,000",
"OF-262835","Po karanténe","Zvukové, obrazové prostriedky a príslušenstvo","televízor, reproduktor, mikrofón, držiak, stojan, audiosystém","32300000-6 Televízne a rozhlasové prijímače a prístroje na záznam alebo reprodukciu zvuku alebo obrazu; 32324000-0 Televízory; 32340000-8 Mikrofóny a reproduktory; 30195800-0 Závesné vešiaky alebo držiaky; 60000000-8 Dopravné služby (bez prepravy odpadu)","Tovar; Služba","","https://portal.eks.sk/SpravaKniznice/OpisneFormulareKniznice/VerejnyDetailOpisnehoFormularaKniznice/262835","1","13325,000",
"OF-262686","Po karanténe","Počítačová  technika","osobný počítač, monitor, výpočtová technika, tlačiareň, skener","30000000-9 Kancelárske a počítacie stroje, vybavenie a spotrebný materiál s výnimkou nábytku a softvérových balíkov; 30213000-5 Osobné počítače; 30213100-6 Prenosné počítače; 30213200-7 Tabletový počítač; 30232100-5 Tlačiarne a zapisovače; 30232110-8 Laserové tlačiarne; 30232130-4 Farebné grafické tlačiarne; 48000000-8 Softvérové balíky a informačné systémy; 60000000-8 Dopravné služby (bez prepravy odpadu)","Tovar; Služba","","https://portal.eks.sk/SpravaKniznice/OpisneFormulareKniznice/VerejnyDetailOpisnehoFormularaKniznice/262686","1","16658,330",
"OF-263802","Po karanténe","Paštéty, ryby v oleji","Paštéty, ryby v oleji","15897200-4 Výrobky v konzerve; 60000000-8 Dopravné služby (bez prepravy odpadu); 15871274-5 Nátierky na chlieb; 15131310-1 Paštéta; 15235000-4 Konzervované ryby; 15131490-6 Pripravené bravčové pokrmy; 15131600-1 Hovädzie a teľacie výrobky","Tovar; Služba","","https://portal.eks.sk/SpravaKniznice/OpisneFormulareKniznice/VerejnyDetailOpisnehoFormularaKniznice/263802","1","0",
"OF-262723","Po karanténe","Originálne tonery","originál toner, Xerox, HP, Canon","30125000-1 Časti a príslušenstvo fotokopírovacích prístrojov; 30125120-8 Toner do fotokopírovacích strojov; 30125100-2 Tonerové náplne; 60000000-8 Dopravné služby (bez prepravy odpadu)","Tovar; Služba","","https://portal.eks.sk/SpravaKniznice/OpisneFormulareKniznice/VerejnyDetailOpisnehoFormularaKniznice/262723","1","525,000",
"OF-262362","Po karanténe","Analytické váhy","Analytické váhy","38000000-5 Laboratórne, optické a presné prístroje a vybavenie (s výnimkou skiel); 60000000-8 Dopravné služby (bez prepravy odpadu)","Tovar; Služba","","https://portal.eks.sk/SpravaKniznice/OpisneFormulareKniznice/VerejnyDetailOpisnehoFormularaKniznice/262362","1","850,000",
"OF-263021","Po karanténe","Chemikálie- monoklonové protilátky, reagencie pre prietokovú cytometriu","protilátky, chemikálie, monoklonové protilátky, kit","24000000-4 Chemické výrobky; 38434510-4 Cytometre; 60000000-8 Dopravné služby (bez prepravy odpadu)","Tovar; Služba","","https://portal.eks.sk/SpravaKniznice/OpisneFormulareKniznice/VerejnyDetailOpisnehoFormularaKniznice/263021","1","0",
"OF-263834","Po karanténe","Svietidlá, osvetľovacie zariadenia, svetelné zdroje a príslušenstvo","Žiarivka lineárna, žiarovka LED, objímka","31524120-2 Stropné svetlá; 31524100-6 Príslušenstvo k stropným svietidlám; 60000000-8 Dopravné služby (bez prepravy odpadu)","Tovar; Služba","","https://portal.eks.sk/SpravaKniznice/OpisneFormulareKniznice/VerejnyDetailOpisnehoFormularaKniznice/263834","1","0",
"OF-263559","Po karanténe","Mäso a mäsové výrobky","Bravčové mäso, hovädzie mäso, mäsové výrobky, slanina, klobása,","15113000-3 Bravčové mäso; 15111100-0 Hovädzie mäso; 15130000-8 Mäsové výrobky; 60000000-8 Dopravné služby (bez prepravy odpadu)","Tovar; Služba","","https://portal.eks.sk/SpravaKniznice/OpisneFormulareKniznice/VerejnyDetailOpisnehoFormularaKniznice/263559","1","0",
"OF-262085","Po karanténe","Chirurgické obväzy - elastické ( pruban )","zdravotnícky spotrebný materiál","33141110-4 Chirurgické obväzy; 60000000-8 Dopravné služby (bez prepravy odpadu)","Tovar; Služba","","https://portal.eks.sk/SpravaKniznice/OpisneFormulareKniznice/VerejnyDetailOpisnehoFormularaKniznice/262085","1","13498,000",
"OF-264000","Po karanténe","Batérie, monočlánky","batérie, monočlánky","31400000-0 Akumulátory, galvanické články a batérie; 60000000-8 Dopravné služby (bez prepravy odpadu)","Tovar; Služba","","https://portal.eks.sk/SpravaKniznice/OpisneFormulareKniznice/VerejnyDetailOpisnehoFormularaKniznice/264000","1","0",
"OF-261083","Po karanténe","Softvérová podpora produktov Verizon","Softvérová podpora","72267000-4 Služby na údržbu a opravu softvéru","Služba","","https://portal.eks.sk/SpravaKniznice/OpisneFormulareKniznice/VerejnyDetailOpisnehoFormularaKniznice/261083","1","0",
"OF-262932","Po karanténe","Fototechnika pre projekt","fotoaparát, zrkadlovka, objektív","38651600-9 Digitálne fotoaparáty; 38651100-4 Objektívy do fotografických prístrojov; 60000000-8 Dopravné služby (bez prepravy odpadu)","Tovar; Služba","","https://portal.eks.sk/SpravaKniznice/OpisneFormulareKniznice/VerejnyDetailOpisnehoFormularaKniznice/262932","1","0",
"OF-260960","Po karanténe","Didaktické a učebné pomôcky","Didaktické a učebné pomôcky","39162200-7 Učebné pomôcky a zariadenia; 39162000-5 Vzdelávacie vybavenie","Tovar","","https://portal.eks.sk/SpravaKniznice/OpisneFormulareKniznice/VerejnyDetailOpisnehoFormularaKniznice/260960","1","0",
"OF-263891","Po karanténe","Ostatné interiérové vybavenie 																																																					","Skrinka na kľúče, Skriňa pre ukladanie mobilných telefónov, Držiak toaletného papiera, Gumová rohož, Nástenné hodiny, Sprchový záves, Sprchová hlavica, Žehliaca doska","39151000-5 Rozličný nábytok; 60000000-8 Dopravné služby (bez prepravy odpadu); 39000000-2 Nábytok (vrátane kancelárskeho nábytku), zariadenie interiéru, domáce spotrebiče (s výnimkou osvetlenia) a čistiace prostriedky; 39100000-3 Nábytok; 39150000-8 Rôzny nábytok a vybavenie","Tovar; Služba","","https://portal.eks.sk/SpravaKniznice/OpisneFormulareKniznice/VerejnyDetailOpisnehoFormularaKniznice/263891","1","0",
"OF-263625","Po karanténe","Náhradné diely na autobusy Sor EBN -  podvozok","Náhradné diely, autobus,Sor EBN,podvozok,","34121100-2 Autobusy verejnej dopravy; 34139200-2 Samotný podvozok; 60000000-8 Dopravné služby (bez prepravy odpadu); 34144910-0 Elektrické autobusy","Tovar","","https://portal.eks.sk/SpravaKniznice/OpisneFormulareKniznice/VerejnyDetailOpisnehoFormularaKniznice/263625","1","1760,000",
"OF-262855","Po karanténe","Posypová soľ","Technická posypová soľ, posypová soľ","34927100-2 Soľ na posyp ciest; 60000000-8 Dopravné služby (bez prepravy odpadu)","Tovar; Služba","","https://portal.eks.sk/SpravaKniznice/OpisneFormulareKniznice/VerejnyDetailOpisnehoFormularaKniznice/262855","1","8333,330",
