"OpisnyFormularIdentifikator","OpisnyFormularStav","OpisnyFormularNazov","OpisnyFormularKlucoveSlova","OpisnyFormularCpv","OpisnyFormularDruh","OpisnyFormularKategoriaSluzieb","OpisnyFormularUrl","OpisnyFormularPocetVyhlasenychZakaziek","OpisnyFormularObchodovanaSumaBezDPH",
"OF-296117","Po karanténe","Mikroelúčná SPE platňa ","Mikroelúčná SPE platňa, Polymeric Reversed Phase, microelution 96-well plate, 2mg/well","38000000-5 Laboratórne, optické a presné prístroje a vybavenie (s výnimkou skiel)","Tovar","","https://portal.eks.sk/SpravaKniznice/OpisneFormulareKniznice/VerejnyDetailOpisnehoFormularaKniznice/296117","1","244.000",
"OF-296118","Po karanténe","Originálne atramentové a tonerové náplne ","atrament, atramentové náplne, toner, tonerové náplne","30192113-6 Atramentové náplne; 60000000-8 Dopravné služby (bez prepravy odpadu); 30125100-2 Tonerové náplne","Tovar; Služba","","https://portal.eks.sk/SpravaKniznice/OpisneFormulareKniznice/VerejnyDetailOpisnehoFormularaKniznice/296118","1","518.330",
"OF-296135","Po karanténe","Diagnostické testy a média ","diagnostika, test, médium","33694000-1 Diagnostické činidlá; 60000000-8 Dopravné služby (bez prepravy odpadu)","Tovar; Služba","","https://portal.eks.sk/SpravaKniznice/OpisneFormulareKniznice/VerejnyDetailOpisnehoFormularaKniznice/296135","1","0",
"OF-296150","Po karanténe","Jednorázová podložka pod chorých 60cm x 90cm","podložka pod chorých, inkontinentná podložka, zdravotnícka pomôcka","33198000-4 Výrobky z papiera na nemocničné účely; 33772000-2 Jednorazové papierové výrobky; 33000000-0 Zdravotnícke vybavenie, farmaceutický materiál a výrobky osobnej starostlivosti; 60000000-8 Dopravné služby (bez prepravy odpadu)","Tovar; Služba","","https://portal.eks.sk/SpravaKniznice/OpisneFormulareKniznice/VerejnyDetailOpisnehoFormularaKniznice/296150","1","7090.910",
"OF-296153","Po karanténe","Silikónový kaučuk","chemikálie","24000000-4 Chemické výrobky; 24960000-1 Rôzne chemické výrobky","Tovar","","https://portal.eks.sk/SpravaKniznice/OpisneFormulareKniznice/VerejnyDetailOpisnehoFormularaKniznice/296153","1","115.000",
"OF-296167","Po karanténe"," Rychlovarná antikorová kanvica","kanvica","39711310-5 Elektrické kávovary; 60000000-8 Dopravné služby (bez prepravy odpadu)","Tovar; Služba","","https://portal.eks.sk/SpravaKniznice/OpisneFormulareKniznice/VerejnyDetailOpisnehoFormularaKniznice/296167","1","17.990",
"OF-296168","Po karanténe","Náterové hmoty, farby a riedidlá","náterové hmoty","44810000-1 Náterové farby; 60000000-8 Dopravné služby (bez prepravy odpadu)","Tovar; Služba","","https://portal.eks.sk/SpravaKniznice/OpisneFormulareKniznice/VerejnyDetailOpisnehoFormularaKniznice/296168","1","1000.000",
"OF-296186","Po karanténe","Kancelárske potreby LRS","ceruzka, pero, spony, fólia","30192000-1 Kancelárske potreby; 60000000-8 Dopravné služby (bez prepravy odpadu)","Tovar; Služba","","https://portal.eks.sk/SpravaKniznice/OpisneFormulareKniznice/VerejnyDetailOpisnehoFormularaKniznice/296186","1","250.000",
"OF-296200","Po karanténe","Kamera","objektív, audiovizuálne zariadenia, kamera","32321200-1 Audiovizuálne zariadenia; 38651600-9 Digitálne fotoaparáty; 38651000-3 Fotografické prístroje","Tovar","","https://portal.eks.sk/SpravaKniznice/OpisneFormulareKniznice/VerejnyDetailOpisnehoFormularaKniznice/296200","1","330.830",
"OF-296203","Po karanténe","Ostatné interiérové vybavenie","Ostatné interiérové vybavenie","39290000-1 Rôzne vybavenie a zariadenie interiérov; 60000000-8 Dopravné služby (bez prepravy odpadu)","Tovar; Služba","","https://portal.eks.sk/SpravaKniznice/OpisneFormulareKniznice/VerejnyDetailOpisnehoFormularaKniznice/296203","1","741.670",
"OF-296217","Po karanténe","Učiteľský mikroskop s kamerou","Učiteľský mikroskop, kamera,","38400000-9 Nástroje na kontrolu fyzikálnych vlastností; 60000000-8 Dopravné služby (bez prepravy odpadu)","Tovar; Služba","","https://portal.eks.sk/SpravaKniznice/OpisneFormulareKniznice/VerejnyDetailOpisnehoFormularaKniznice/296217","0","0",
"OF-296218","Po karanténe","Diáre na rok 2025","kalendár, diár","30199792-8 Kalendáre; 39294100-0 Informačné a propagačné výrobky","Tovar","","https://portal.eks.sk/SpravaKniznice/OpisneFormulareKniznice/VerejnyDetailOpisnehoFormularaKniznice/296218","1","105.000",
"OF-296250","Po karanténe","Športové a rekreačné vybavenie","odporová guma, tyč, istenie, adaptér, lavica, vesta","37442000-8 Vybavenie na váhové a odporové cvičenie; 60000000-8 Dopravné služby (bez prepravy odpadu)","Tovar","","https://portal.eks.sk/SpravaKniznice/OpisneFormulareKniznice/VerejnyDetailOpisnehoFormularaKniznice/296250","1","2900.000",
"OF-296253","Po karanténe","Výpočtová kancelárska technika s príslušenstvom","notebook s príslušenstvom, multifunkčné zariadenie.","30213100-6 Prenosné počítače; 30237410-6 Počítačová myš; 30232110-8 Laserové tlačiarne; 60000000-8 Dopravné služby (bez prepravy odpadu)","Tovar; Služba","","https://portal.eks.sk/SpravaKniznice/OpisneFormulareKniznice/VerejnyDetailOpisnehoFormularaKniznice/296253","1","4600.000",
"OF-296267","Po karanténe","Kancelársky nábytok - kancelárska stolička","kancelársky nábytok, kancelárska stolička","39120000-9 Stoly, skrine, písacie stoly a knižnice; 60000000-8 Dopravné služby (bez prepravy odpadu)","Tovar; Služba","","https://portal.eks.sk/SpravaKniznice/OpisneFormulareKniznice/VerejnyDetailOpisnehoFormularaKniznice/296267","0","0",
"OF-296268","Po karanténe","Revízie bezpečnostných vybavení CYPRES","periodická prehliadka, CYPRES, bezpečnostný prístroj","50610000-4 Služby na opravu a údržbu bezpečnostných zariadení; 39523000-4 Padáky; 60000000-8 Dopravné služby (bez prepravy odpadu)","Služba","","https://portal.eks.sk/SpravaKniznice/OpisneFormulareKniznice/VerejnyDetailOpisnehoFormularaKniznice/296268","1","12285.000",
"OF-296285","Po karanténe","PROFESIONÁLNA 3D OPTICKÁ ZVÁRAČKA","optika, zváračka optických vlákien","44315100-2 Príslušenstvo na zváranie; 60000000-8 Dopravné služby (bez prepravy odpadu); 42662100-5 Elektrické zváracie zariadenia","Tovar; Služba","","https://portal.eks.sk/SpravaKniznice/OpisneFormulareKniznice/VerejnyDetailOpisnehoFormularaKniznice/296285","1","833.330",
"OF-296286","Po karanténe","Zabezpečenie nákupu čistiacich potrieb, prostriedkov a hygienického materiálu ","čistiaci prostriedok, chémia na čistenie, toaletný papier, papierové utierky na ruky,kuchynské papierové utierky, servítky, kozmetické utierky","39800000-0 Čistiace a leštiace výrobky; 39830000-9 Čistiace výrobky; 39831200-8 Saponáty; 33711900-6 Mydlo; 39812000-7 Leštidlá a krémy; 39831220-4 Odmasťovacie prostriedky; 39831600-2 Čistiace prostriedky na toalety; 39811100-1 Osviežovač vzduchu; 33700000-7 Predmety osobnej starostlivosti; 33770000-8 Papierové hygienické výrobky; 33760000-5 Toaletný papier, vreckovky, uteráky na ruky a servítky; 33711430-0 Jednorazové utierky; 33141118-0 Utierky; 19640000-4 Polyetylénový odpad a odpadkové vrecká a vaky; 39224330-0 Vedrá; 60000000-8 Dopravné služby (bez prepravy odpadu); 39514500-3 Umývacie žinky","Tovar","","https://portal.eks.sk/SpravaKniznice/OpisneFormulareKniznice/VerejnyDetailOpisnehoFormularaKniznice/296286","1","11416.670",
"OF-295955","Po karanténe","Elektrospotrebiče","chladnička, mikrovlnná rúra, rýchlovarná kanvica, práčka, žehlička, indukčná varná doska, televízor","39700000-9 Spotrebiče pre domácnosť; 32324000-0 Televízory; 60000000-8 Dopravné služby (bez prepravy odpadu)","Tovar; Služba","","https://portal.eks.sk/SpravaKniznice/OpisneFormulareKniznice/VerejnyDetailOpisnehoFormularaKniznice/295955","1","770.000",
"OF-295962","Po karanténe","Pracovné odevy, pracovné rukavice, ochranná obuv ","pracovné odevy, pracovné rukavice, ochranná obuv","18110000-3 Pracovné odevy; 18830000-6 Ochranná obuv; 18141000-9 Pracovné rukavice; 60000000-8 Dopravné služby (bez prepravy odpadu)","Tovar; Služba","","https://portal.eks.sk/SpravaKniznice/OpisneFormulareKniznice/VerejnyDetailOpisnehoFormularaKniznice/295962","1","1324.170",
"OF-295973","Po karanténe","Výmena LED svietidiel","LED svietidlá, spojovací materiál, elektroinštalačné káble ku svietidlám, demontáž a montáž svietidiel, dokončovacie práce, odvoz a likvidácia odpadu","51110000-6 Inštalácia elektrických zariadení; 90500000-2 Služby súvisiace s likvidáciou odpadu a odpadom; 31520000-7 Lampy/svietidlá a príslušenstvo k nim; 45111300-1 Demontážne práce","Služba","","https://portal.eks.sk/SpravaKniznice/OpisneFormulareKniznice/VerejnyDetailOpisnehoFormularaKniznice/295973","0","0",
"OF-295980","Po karanténe","športové a outdoorové oblečenie a príslušenstvo","Bunda, nohavice, skialpinizmus, horolezectvo, priedušnosť, vetruodolnosť","18221200-6 Bundy; 18234000-8 Nohavice; 18333000-2 Polokošele; 31521330-6 Nabíjateľné prenosné elektrické lampy; 60000000-8 Dopravné služby (bez prepravy odpadu)","Tovar; Služba","","https://portal.eks.sk/SpravaKniznice/OpisneFormulareKniznice/VerejnyDetailOpisnehoFormularaKniznice/295980","0","0",
"OF-295987","Po karanténe","Káble, konektory, nabíjačky, káble a rozbočovače pre audio/video","štartovací zdroj","31158100-9 Nabíjače batérií; 60000000-8 Dopravné služby (bez prepravy odpadu)","Tovar; Služba","","https://portal.eks.sk/SpravaKniznice/OpisneFormulareKniznice/VerejnyDetailOpisnehoFormularaKniznice/295987","1","476.670",
"OF-295998","Po karanténe","Poľnohospodárske stroje a príslušenstvo","Poľnohospodárske stroje a príslušenstvo","16311100-9 Kosačky trávnikov, parkov alebo športovísk; 60000000-8 Dopravné služby (bez prepravy odpadu)","Tovar; Služba","","https://portal.eks.sk/SpravaKniznice/OpisneFormulareKniznice/VerejnyDetailOpisnehoFormularaKniznice/295998","0","0",
"OF-296005","Po karanténe","Monitor k PC, Tabletový PC s príslušenstvom ","Monitor, Tabletový počítač, príslušenstvo","30230000-0 Zariadenia súvisiace s počítačmi; 30213200-7 Tabletový počítač; 60000000-8 Dopravné služby (bez prepravy odpadu)","Tovar; Služba","","https://portal.eks.sk/SpravaKniznice/OpisneFormulareKniznice/VerejnyDetailOpisnehoFormularaKniznice/296005","1","929.000",
"OF-296012","Po karanténe","Opravy hasiacich prístrojov ","hasiace prístroje, opravy, tlakové skúšky","50514000-1 Opravy a údržba kovových nádob; 60000000-8 Dopravné služby (bez prepravy odpadu)","Služba","","https://portal.eks.sk/SpravaKniznice/OpisneFormulareKniznice/VerejnyDetailOpisnehoFormularaKniznice/296012","1","1749.990",
"OF-296023","Po karanténe","Vyšetrovacie rukavice nesterilné/sterilné, nitril/latex, nepudrované, chirurgické rukavice","rukavice, nitril, latex, spotrebný zdravotnícky materiál","18424300-0 Jednorazové rukavice; 33140000-3 Zdravotnícky spotrebný materiál; 60000000-8 Dopravné služby (bez prepravy odpadu); 33141420-0 Chirurgické rukavice","Tovar; Služba","","https://portal.eks.sk/SpravaKniznice/OpisneFormulareKniznice/VerejnyDetailOpisnehoFormularaKniznice/296023","1","15097.000",
"OF-296030","Po karanténe","Obuv","pracovná obuv pre zdravotníckych pracovníkov, údržbu","18830000-6 Ochranná obuv; 60000000-8 Dopravné služby (bez prepravy odpadu)","Tovar; Služba","","https://portal.eks.sk/SpravaKniznice/OpisneFormulareKniznice/VerejnyDetailOpisnehoFormularaKniznice/296030","1","0",
"OF-296037","Po karanténe","Elektrické vodiče - monočlánky","Konektor RJ45 pre FTP, Ochrana konektoru RJ45","30200000-1 Počítačové zariadenia a spotrebný materiál; 30213100-6 Prenosné počítače; 60000000-8 Dopravné služby (bez prepravy odpadu)","Tovar; Služba","","https://portal.eks.sk/SpravaKniznice/OpisneFormulareKniznice/VerejnyDetailOpisnehoFormularaKniznice/296037","1","229.160",
"OF-296048","Po karanténe","Hnojivá, pesticídy a semená","postrek na mravce a burinu","24453000-4 Herbicídy; 60000000-8 Dopravné služby (bez prepravy odpadu)","Tovar; Služba","","https://portal.eks.sk/SpravaKniznice/OpisneFormulareKniznice/VerejnyDetailOpisnehoFormularaKniznice/296048","1","600.000",
"OF-296062","Po karanténe","Notebook","Notebook","30213100-6 Prenosné počítače; 60000000-8 Dopravné služby (bez prepravy odpadu)","Tovar; Služba","","https://portal.eks.sk/SpravaKniznice/OpisneFormulareKniznice/VerejnyDetailOpisnehoFormularaKniznice/296062","1","1117.920",
"OF-296073","Po karanténe","Potraviny na zabezpečenie pitného režimu ","neperlivá minerálna voda, neochutená voda, balená voda v bareloch","15981000-8 Minerálne vody; 60000000-8 Dopravné služby (bez prepravy odpadu)","Tovar; Služba","","https://portal.eks.sk/SpravaKniznice/OpisneFormulareKniznice/VerejnyDetailOpisnehoFormularaKniznice/296073","2","3047.220",
"OF-296080","Po karanténe","Stroje na upratovanie","Stroje na upratovanie, upratovací vozík","39713400-7 Stroje na údržbu podláh; 39713410-0 Stroje na čistenie podláh; 60000000-8 Dopravné služby (bez prepravy odpadu)","Tovar; Služba","","https://portal.eks.sk/SpravaKniznice/OpisneFormulareKniznice/VerejnyDetailOpisnehoFormularaKniznice/296080","1","6166.670",
"OF-296087","Po karanténe","Čistiace prostriedky ","čistiace prostriedky, prostriedok na čistenie podláh, toaletný papier, handry","39830000-9 Čistiace výrobky; 60000000-8 Dopravné služby (bez prepravy odpadu)","Tovar; Služba","","https://portal.eks.sk/SpravaKniznice/OpisneFormulareKniznice/VerejnyDetailOpisnehoFormularaKniznice/296087","1","1333.330",
"OF-296105","Po karanténe","Technická a licenčná aktualizácia komunikačného systému so službami na podporu prevádzky","Technická a licenčná aktualizácia, podpora prevádzky,","72260000-5 Služby súvisiace so softvérom; 72267000-4 Služby na údržbu a opravu softvéru","Služba","","https://portal.eks.sk/SpravaKniznice/OpisneFormulareKniznice/VerejnyDetailOpisnehoFormularaKniznice/296105","1","138800.000",
"OF-295864","Po karanténe","Nákup kancelárskeho papiera - formát A4, formát A3","papier","30197642-8 Papier na fotokopírovanie a xerografický papier; 60000000-8 Dopravné služby (bez prepravy odpadu)","Tovar; Služba","","https://portal.eks.sk/SpravaKniznice/OpisneFormulareKniznice/VerejnyDetailOpisnehoFormularaKniznice/295864","1","11498.800",
"OF-295871","Po karanténe","Poľnohospodárske stroje a príslušenstvo","kosačky","16311000-8 Kosačky trávnikov; 60000000-8 Dopravné služby (bez prepravy odpadu)","Tovar; Služba","","https://portal.eks.sk/SpravaKniznice/OpisneFormulareKniznice/VerejnyDetailOpisnehoFormularaKniznice/295871","1","1832.500",
"OF-295878","Po karanténe","Príslušenstvo pre PC a sieťový switch","switch, tlačiareň, disk, reprák","30230000-0 Zariadenia súvisiace s počítačmi; 30234000-8 Pamäťové médiá; 30232110-8 Laserové tlačiarne; 60000000-8 Dopravné služby (bez prepravy odpadu)","Tovar; Služba","","https://portal.eks.sk/SpravaKniznice/OpisneFormulareKniznice/VerejnyDetailOpisnehoFormularaKniznice/295878","1","258.240",
"OF-295896","Po karanténe","Elektroinštalačný materiál","Elektroinštalačný materiál, kábel elektroinštalačný, teplovodivá pasta, Izolačná páska, Štartér 4-65W pre neónové trubice,  WIFI Termostat, HD webkamera,","31651000-4 Elektroizolačná páska; 31224100-3 Zástrčky a zásuvky; 31682000-0 Elektropotreby; 60000000-8 Dopravné služby (bez prepravy odpadu)","Tovar; Služba","","https://portal.eks.sk/SpravaKniznice/OpisneFormulareKniznice/VerejnyDetailOpisnehoFormularaKniznice/295896","1","350.000",
"OF-295903","Po karanténe","Nákup náhradných dielov do osobných automobilov ","Filter olejový, vzduchový, Obloženie brzdové, Kotúč brzdový, tlmič, manžeta, čap, ložisko, tyč stabilizátora, náboj, žhavič, výfuk, stierače","34330000-9 Náhradné diely pre vozidlá na prepravu tovaru, pre dodávky a osobné automobily; 34110000-1 Osobné automobily; 60000000-8 Dopravné služby (bez prepravy odpadu)","Tovar; Služba","","https://portal.eks.sk/SpravaKniznice/OpisneFormulareKniznice/VerejnyDetailOpisnehoFormularaKniznice/295903","1","3000.000",
"OF-295914","Po karanténe","Počítačová zostava","počítač, skriňa, zdroj, procesor, chladič, pamäť, základná doska, grafická karta, pevný disk, SSD, HDD, softvér","30213000-5 Osobné počítače; 60000000-8 Dopravné služby (bez prepravy odpadu)","Tovar; Služba","","https://portal.eks.sk/SpravaKniznice/OpisneFormulareKniznice/VerejnyDetailOpisnehoFormularaKniznice/295914","1","1984.990",
"OF-295921","Po karanténe","Prenosný počítač a monitor","prenosný, počítač,  notebook, monitor","30213100-6 Prenosné počítače; 30230000-0 Zariadenia súvisiace s počítačmi; 60000000-8 Dopravné služby (bez prepravy odpadu)","Tovar; Služba","","https://portal.eks.sk/SpravaKniznice/OpisneFormulareKniznice/VerejnyDetailOpisnehoFormularaKniznice/295921","1","3335.000",
"OF-295946","Po karanténe","Notebook ","notebook","30213000-5 Osobné počítače; 60000000-8 Dopravné služby (bez prepravy odpadu)","Tovar; Služba","","https://portal.eks.sk/SpravaKniznice/OpisneFormulareKniznice/VerejnyDetailOpisnehoFormularaKniznice/295946","1","620.830",
"OF-295953","Po karanténe","Kurzy na nedeštruktívne testovanie materiálov","nedeštruktívne testovanie materiálov NDT podľa  EN 4179 / NAS 410","80511000-9 Školenie pracovníkov","Služba","","https://portal.eks.sk/SpravaKniznice/OpisneFormulareKniznice/VerejnyDetailOpisnehoFormularaKniznice/295953","0","0",
"OF-295964","Po karanténe","Športové a rekreačné vybavenie","stan nožnicový","39522530-1 Stany; 39522100-8 Nepremokavé plachty, ochranné a tieniace plachty; 60000000-8 Dopravné služby (bez prepravy odpadu)","Tovar; Služba","","https://portal.eks.sk/SpravaKniznice/OpisneFormulareKniznice/VerejnyDetailOpisnehoFormularaKniznice/295964","0","0",
"OF-295978","Po karanténe","Televízor SMART","SMART , televízor,","32324100-1 Farebné televízory; 32572000-3 Komunikačný kábel; 60000000-8 Dopravné služby (bez prepravy odpadu)","Tovar; Služba","","https://portal.eks.sk/SpravaKniznice/OpisneFormulareKniznice/VerejnyDetailOpisnehoFormularaKniznice/295978","1","1658.330",
"OF-295989","Po karanténe","Nádoby na medicínsky (infekčný) odpad","nádoba na medicínsky odpad","33141123-8 Nádoby na ostré predmety; 60000000-8 Dopravné služby (bez prepravy odpadu)","Tovar; Služba","","https://portal.eks.sk/SpravaKniznice/OpisneFormulareKniznice/VerejnyDetailOpisnehoFormularaKniznice/295989","1","2050.000",
"OF-295996","Po karanténe","ND do motorových píl továrenskej značky Stihl a Husqvarna","lišta, reťaz, prepravný obal, servisná sada, motorová píla, náhradný diel","42675100-9 Časti reťazových píl; 42650000-7 Pneumatické alebo motorové ručné nástroje; 34913000-0 Rôzne náhradné diely; 60000000-8 Dopravné služby (bez prepravy odpadu)","Tovar; Služba","","https://portal.eks.sk/SpravaKniznice/OpisneFormulareKniznice/VerejnyDetailOpisnehoFormularaKniznice/295996","1","1100.000",
"OF-296003","Po karanténe","Záchranárske vybavenie","lano, istenie, batoh, kladka, blokant, karabína, slučka, vklínenec","35110000-8 Hasičské, záchranárske a bezpečnostné vybavenie; 60000000-8 Dopravné služby (bez prepravy odpadu)","Tovar","","https://portal.eks.sk/SpravaKniznice/OpisneFormulareKniznice/VerejnyDetailOpisnehoFormularaKniznice/296003","1","19972.500",
"OF-296007","Po karanténe","Rôzne počítačové  príslušenstvo","počítač, myš, klávesnica, sluch, zvuk, dokovacia , stanica, kábel, redukcia, kamera, rádio, USB, nabíjať,  mikrofón, pamäť, karta","30237000-9 Časti a príslušenstvo počítačov a spotrebný materiál k nim; 60000000-8 Dopravné služby (bez prepravy odpadu)","Tovar; Služba","","https://portal.eks.sk/SpravaKniznice/OpisneFormulareKniznice/VerejnyDetailOpisnehoFormularaKniznice/296007","1","1674.990",
"OF-296021","Po karanténe","Sterilizačný materiál","sterilizačné sáčky, rolky, hárky","33198200-6 Papierové sterilizačné vrecká alebo odevy z papieroviny; 60000000-8 Dopravné služby (bez prepravy odpadu)","Tovar; Služba","","https://portal.eks.sk/SpravaKniznice/OpisneFormulareKniznice/VerejnyDetailOpisnehoFormularaKniznice/296021","1","4487.230",
"OF-296028","Po karanténe","Laboratórne , diagnostické pomôcky a materiál","striekačka, pipety, miešadlo, balónik","38437000-7 Laboratórne pipety a príslušenstvo; 33790000-4 Laboratórny, zdravotnícky alebo farmaceutický sklenený tovar; 33793000-5 Sklenené výrobky pre laboratóriá; 60000000-8 Dopravné služby (bez prepravy odpadu)","Tovar; Služba","","https://portal.eks.sk/SpravaKniznice/OpisneFormulareKniznice/VerejnyDetailOpisnehoFormularaKniznice/296028","1","2208.330",
"OF-295819","Po karanténe","Opravy a ošetrovanie kontajnerových nakladačov ","Servis vozidiel, opravy vozidiel, údržba vozidiel","50530000-9 Opravy a údržba strojov; 60000000-8 Dopravné služby (bez prepravy odpadu)","Služba","","https://portal.eks.sk/SpravaKniznice/OpisneFormulareKniznice/VerejnyDetailOpisnehoFormularaKniznice/295819","1","3624.200",
"OF-295834","Po karanténe","Kancelársky papier (ekologický výrobok)","kancelársky papier","30197642-8 Papier na fotokopírovanie a xerografický papier; 60000000-8 Dopravné služby (bez prepravy odpadu)","Tovar; Služba","","https://portal.eks.sk/SpravaKniznice/OpisneFormulareKniznice/VerejnyDetailOpisnehoFormularaKniznice/295834","1","3995.830",
"OF-295851","Po karanténe","Čistiace a dezinfekčné prostriedky LRS","vrecia, mydlo, metla, špongia","39800000-0 Čistiace a leštiace výrobky; 39831300-9 Čistiace prostriedky na podlahu; 39832000-3 Čistiace prostriedky na riad; 39831600-2 Čistiace prostriedky na toalety; 60000000-8 Dopravné služby (bez prepravy odpadu)","Tovar; Služba","","https://portal.eks.sk/SpravaKniznice/OpisneFormulareKniznice/VerejnyDetailOpisnehoFormularaKniznice/295851","1","2480.830",
"OF-295852","Po karanténe","Zariadenia na chladenie, mrazenie, práčky, sušičky, žehl. skrina, el. chlad.","Sušičky","39713200-5 Práčky a sušičky bielizne; 60000000-8 Dopravné služby (bez prepravy odpadu)","Tovar; Služba","","https://portal.eks.sk/SpravaKniznice/OpisneFormulareKniznice/VerejnyDetailOpisnehoFormularaKniznice/295852","1","1807.500",
"OF-295865","Po karanténe","Čistiace stroje, podlahové leštiče a príslušenstvo","Vysávač, tepovač, vysávač na popol, vrecka do vysávača, filter, vysokotlakový čistič","39713430-6 Vysávače prachu; 42924740-8 Prístroje na čistenie pod vysokým tlakom; 39713410-0 Stroje na čistenie podláh; 42999100-6 Vysávače prachu nie pre domácnosť; 39713431-3 Príslušenstvo k vysávačom prachu; 60000000-8 Dopravné služby (bez prepravy odpadu)","Tovar; Služba","","https://portal.eks.sk/SpravaKniznice/OpisneFormulareKniznice/VerejnyDetailOpisnehoFormularaKniznice/295865","3","1013.270",
"OF-295866","Po karanténe","Lieky ATC skupiny J01 - časť 2.","Amoxicilín a inhibítor betalaktamázy, Sultamicilín, Cefuroxím, Cefotaxím, Cefixím, Azitromycín, Ciprofloxacín, Vankomycín, Metronidazol","33651100-9 Látky ničiace baktérie na systémové použitie; 60000000-8 Dopravné služby (bez prepravy odpadu)","Tovar; Služba","","https://portal.eks.sk/SpravaKniznice/OpisneFormulareKniznice/VerejnyDetailOpisnehoFormularaKniznice/295866","1","8654.550",
"OF-295869","Po karanténe","Dodávka elektrickej energie ","Elektrina, dodávka elektrickej energie, distribúcia elektrickej energie","09310000-5 Elektrická energia; 65300000-6 Rozvod elektriny a súvisiace služby","Tovar; Služba","","https://portal.eks.sk/SpravaKniznice/OpisneFormulareKniznice/VerejnyDetailOpisnehoFormularaKniznice/295869","1","34920.140",
"OF-295883","Po karanténe","Tonery do tlačiarní mimo rámcovú dohodu","toner, cartridge, náplň, tonerové náplne","30125100-2 Tonerové náplne; 60000000-8 Dopravné služby (bez prepravy odpadu); 30125120-8 Toner do fotokopírovacích strojov; 30125000-1 Časti a príslušenstvo fotokopírovacích prístrojov","Tovar; Služba","","https://portal.eks.sk/SpravaKniznice/OpisneFormulareKniznice/VerejnyDetailOpisnehoFormularaKniznice/295883","1","400.000",
"OF-295884","Po karanténe","Opravy a ošetrovanie nákladných automobilov Mercedes","servisná prehliadka, nákladný automobil Mercedes","50114000-7 Oprava a údržba nákladných vozidiel; 50111000-6 Správa, opravy a údržba vozového parku","Služba","","https://portal.eks.sk/SpravaKniznice/OpisneFormulareKniznice/VerejnyDetailOpisnehoFormularaKniznice/295884","1","932.490",
"OF-295901","Po karanténe","Železiarske výrobky a brusivá","bezpečnostné zámky, kľučky","44316000-8 Železiarsky tovar; 44520000-1 Zámky, kľúče a pánty; 60000000-8 Dopravné služby (bez prepravy odpadu)","Tovar; Služba","","https://portal.eks.sk/SpravaKniznice/OpisneFormulareKniznice/VerejnyDetailOpisnehoFormularaKniznice/295901","1","399.000",
"OF-295902","Po karanténe","Stavebné materiály ","cement, asfalt, betón, štrk, geotextília, fólia","44111200-3 Cement; 44113620-7 Asfalt; 44114100-3 Hotový/surový betón; 14212120-7 Štrk; 19270000-9 Netkané textílie; 60000000-8 Dopravné služby (bez prepravy odpadu)","Tovar; Služba","","https://portal.eks.sk/SpravaKniznice/OpisneFormulareKniznice/VerejnyDetailOpisnehoFormularaKniznice/295902","1","1832.500",
