"OpisnyFormularIdentifikator","OpisnyFormularStav","OpisnyFormularNazov","OpisnyFormularKlucoveSlova","OpisnyFormularCpv","OpisnyFormularDruh","OpisnyFormularKategoriaSluzieb","OpisnyFormularUrl","OpisnyFormularPocetVyhlasenychZakaziek","OpisnyFormularObchodovanaSumaBezDPH",
"OF-169745","Po karanténe","Zimná úprava ciest","Zimná údržba ciest a parkovísk","90620000-9 Odpratávanie snehu","Služba","","https://portal.eks.sk/SpravaKniznice/OpisneFormulareKniznice/VerejnyDetailOpisnehoFormularaKniznice/169745","0","0",
"OF-170921","Po karanténe","Pracovné odevy, pracovná obuv, ochranné pomôcky","pracovný odev, pracovná obuv, ochranné pomôcky","18110000-3 Pracovné odevy; 18100000-0 Pracovné odevy, špeciálne pracovné odevy a doplnky","Tovar","","https://portal.eks.sk/SpravaKniznice/OpisneFormulareKniznice/VerejnyDetailOpisnehoFormularaKniznice/170921","1","0",
"OF-170979","Po karanténe","Repelenty a fungicídy ","chemické prípravky","24000000-4 Chemické výrobky; 60000000-8 Dopravné služby (bez prepravy odpadu)","Tovar; Služba","","https://portal.eks.sk/SpravaKniznice/OpisneFormulareKniznice/VerejnyDetailOpisnehoFormularaKniznice/170979","0","0",
"OF-171153","Po karanténe","Dodávka zemného plynu","Dodávka zemného plynu, preprava ZP, distribúcia ZP, služby obchodníka","09123000-7 Zemný plyn; 60000000-8 Dopravné služby (bez prepravy odpadu)","Tovar; Služba","","https://portal.eks.sk/SpravaKniznice/OpisneFormulareKniznice/VerejnyDetailOpisnehoFormularaKniznice/171153","0","0",
"OF-171175","Po karanténe","Dodávka zemného plynu","Dodávka zemného plynu, preprava ZP, distribúcia ZP, služby obchodníka","09123000-7 Zemný plyn; 60000000-8 Dopravné služby (bez prepravy odpadu)","Tovar; Služba","","https://portal.eks.sk/SpravaKniznice/OpisneFormulareKniznice/VerejnyDetailOpisnehoFormularaKniznice/171175","0","0",
"OF-171260","Po karanténe","Projekčný stavebný Software pre projektovanie a modelovanie oceľových konštrukcií ","Stavebný, Softvér, Modelovanie, Oceľových, Konštrukcíí, ","48100000-9 Softvérový balík pre konkrétne odvetvie","Tovar","","https://portal.eks.sk/SpravaKniznice/OpisneFormulareKniznice/VerejnyDetailOpisnehoFormularaKniznice/171260","0","0",
"OF-171488","Po karanténe","Komponenty pre prácu v laboratóriu (hydroxid sodný)","komponenty, laboratórium, výskum, hydroxid sodný","24311520-8 Hydroxid sodný","Tovar","","https://portal.eks.sk/SpravaKniznice/OpisneFormulareKniznice/VerejnyDetailOpisnehoFormularaKniznice/171488","1","0",
"OF-171489","Po karanténe","cestoviny","cestoviny, kolienka, fliačky, rezance, niťovky, tarhoňa","15800000-6 Rôzne potravinárske výrobky; 60000000-8 Dopravné služby (bez prepravy odpadu)","Tovar; Služba","","https://portal.eks.sk/SpravaKniznice/OpisneFormulareKniznice/VerejnyDetailOpisnehoFormularaKniznice/171489","0","0",
"OF-171543","Po karanténe","Lieky skupiny ATC N01-Anestetiká","Anestetiká","33600000-6 Farmaceutické výrobky; 33661100-2 Anestetiká; 60000000-8 Dopravné služby (bez prepravy odpadu)","Tovar; Služba","","https://portal.eks.sk/SpravaKniznice/OpisneFormulareKniznice/VerejnyDetailOpisnehoFormularaKniznice/171543","1","0",
"OF-171567","Po karanténe","Elektronické komponenty","elektronické súčiastky, komponenty","31710000-6 Elektronické zariadenia; 60000000-8 Dopravné služby (bez prepravy odpadu)","Tovar; Služba","","https://portal.eks.sk/SpravaKniznice/OpisneFormulareKniznice/VerejnyDetailOpisnehoFormularaKniznice/171567","1","0",
"OF-171585","Po karanténe","Tlač - skriptá","tlač, skriptá, tituly","79820000-8 Služby súvisiace s tlačou; 79800000-2 Tlačiarenské a príbuzné služby; 60000000-8 Dopravné služby (bez prepravy odpadu)","Služba; Tovar","","https://portal.eks.sk/SpravaKniznice/OpisneFormulareKniznice/VerejnyDetailOpisnehoFormularaKniznice/171585","1","0",
"OF-171586","Po karanténe","Výmena koncových elektroinštalačných zariadení (svietidiel)","LED, stropné, lineárne, svietidlá, panel, výmena koncových elektroinštalačných zariadení, LED osvetlenie","31000000-6 Elektrické stroje, prístroje, zariadenia a spotrebný tovar; osvetlenie; 31520000-7 Lampy/svietidlá a príslušenstvo k nim; 71632000-7 Technické skúšky; 31681000-3 Elektropríslušenstvo; 45310000-3 Elektroinštalačné práce; 60000000-8 Dopravné služby (bez prepravy odpadu)","Tovar; Služba","","https://portal.eks.sk/SpravaKniznice/OpisneFormulareKniznice/VerejnyDetailOpisnehoFormularaKniznice/171586","1","0",
"OF-171691","Po karanténe","Diagnostický kit","diagnostický kit, molekulárno-biologická analýza prionového génu","33141625-7 Diagnostické súpravy; 60000000-8 Dopravné služby (bez prepravy odpadu)","Tovar; Služba","","https://portal.eks.sk/SpravaKniznice/OpisneFormulareKniznice/VerejnyDetailOpisnehoFormularaKniznice/171691","1","0",
"OF-171695","Po karanténe","Nákup IKT a príslušenstva","počítače, zobrazovacie jednotky, počítačová myš, tablet, nabíjacia stanica, príslušenstvo","34971000-4 Zariadenia s kamerami s vysokou citlivosťou/rýchlosťou; 30213000-5 Osobné počítače; 30231300-0 Zobrazovacie jednotky (obrazovky); 30237200-1 Príslušenstvo počítačov; 30237410-6 Počítačová myš; 60000000-8 Dopravné služby (bez prepravy odpadu)","Tovar; Služba","","https://portal.eks.sk/SpravaKniznice/OpisneFormulareKniznice/VerejnyDetailOpisnehoFormularaKniznice/171695","0","0",
"OF-171705","Po karanténe","Tonery - originál","Tonery, náplne do tlačiarní","30125120-8 Toner do fotokopírovacích strojov; 60000000-8 Dopravné služby (bez prepravy odpadu)","Tovar; Služba","","https://portal.eks.sk/SpravaKniznice/OpisneFormulareKniznice/VerejnyDetailOpisnehoFormularaKniznice/171705","0","0",
"OF-171716","Po karanténe","Server 2U pre virtualizáciu","server, operačná pamäť, procesor","30210000-4 Stroje na spracovanie údajov (hardvér); 60000000-8 Dopravné služby (bez prepravy odpadu)","Tovar; Služba","","https://portal.eks.sk/SpravaKniznice/OpisneFormulareKniznice/VerejnyDetailOpisnehoFormularaKniznice/171716","0","0",
"OF-171727","Po karanténe","Pľúcny ventilátor","pľúcny ventilátor","33157400-9 Lekárske dýchacie prístroje; 51410000-9 Inštalácia lekárskych zariadení; 80561000-4 Zdravotnícke školenia; 60000000-8 Dopravné služby (bez prepravy odpadu)","Tovar; Služba","","https://portal.eks.sk/SpravaKniznice/OpisneFormulareKniznice/VerejnyDetailOpisnehoFormularaKniznice/171727","0","0",
"OF-171754","Po karanténe","Meracie zariadenia na záznam meraných fyzikálnych veličín a príslušenstvo","Meracie zariadenia, meracie prístroje, meracia ústredňa, snímač  teploty, snímač vlhkosti, snímač tlaku, termočlánkový drôt, snímač prietoku, konektor","38410000-2 Meracie nástroje; 38400000-9 Nástroje na kontrolu fyzikálnych vlastností; 60000000-8 Dopravné služby (bez prepravy odpadu)","Tovar; Služba","","https://portal.eks.sk/SpravaKniznice/OpisneFormulareKniznice/VerejnyDetailOpisnehoFormularaKniznice/171754","0","0",
"OF-171760","Po karanténe","Rezací kotúč na betón, šírka rezu minimálne 9,6 mm, priemer 180 mm, vhodný do rezačky divokých prasklín RK 10","rezací kotúč, kotúč","14811300-2 Brúsne kotúče; 60000000-8 Dopravné služby (bez prepravy odpadu)","Tovar; Služba","","https://portal.eks.sk/SpravaKniznice/OpisneFormulareKniznice/VerejnyDetailOpisnehoFormularaKniznice/171760","0","0",
"OF-171776","Po karanténe","Operačný stôl – Úrazová chirurgia","mobilný  operačný stôl,  elektrický, úrazová chirurgia, ","33192230-3 Operačné stoly; 33192200-4 Lekárske stoly; 60000000-8 Dopravné služby (bez prepravy odpadu); 51410000-9 Inštalácia lekárskych zariadení; 80511000-9 Školenie pracovníkov","Tovar; Služba","","https://portal.eks.sk/SpravaKniznice/OpisneFormulareKniznice/VerejnyDetailOpisnehoFormularaKniznice/171776","0","0",
"OF-171777","Po karanténe","Podpora predchádzania vzniku BRKO vybavením domácností kompostérmi - nákup kompostérov","Biologicky rozložiteľný komunálny odpad, záhradné kompostéry, škatule na kompost","39234000-1 Škatule na kompost; 60000000-8 Dopravné služby (bez prepravy odpadu)","Tovar; Služba","","https://portal.eks.sk/SpravaKniznice/OpisneFormulareKniznice/VerejnyDetailOpisnehoFormularaKniznice/171777","0","0",
"OF-171778","Po karanténe","Vozidlo na zvoz vyseparovaného odpadu","vozidlo na zvoz odpadu, zvoz odpadu, zvoz vyseparovaného odpadu","34144511-3 Vozidlá na odvoz smetí; 60000000-8 Dopravné služby (bez prepravy odpadu)","Tovar; Služba","","https://portal.eks.sk/SpravaKniznice/OpisneFormulareKniznice/VerejnyDetailOpisnehoFormularaKniznice/171778","1","0",
"OF-171785","Po karanténe","Vodoinštalačný materiál ","ventil, sifón, ppr rúry, koleno, batéria","42130000-9 Výpusty, kohúty, ventily a podobné príslušenstvo; 44164310-3 Rúry a príslušenstvo (spojky); 42131260-6 Guľové/plavákové ventily; 44167400-2 Kolená; 42131240-0 Priame (guľové) ventily; 44167300-1 Ohyby, nátrubky a príslušenstvo na rúrky; 60000000-8 Dopravné služby (bez prepravy odpadu)","Tovar; Služba","","https://portal.eks.sk/SpravaKniznice/OpisneFormulareKniznice/VerejnyDetailOpisnehoFormularaKniznice/171785","1","0",
"OF-171787","Po karanténe","Náradie, železiarsky tovar","Matica, nit, list pílový, vodováha, skrutkovač, imbusové kľúče, vrtáky, kliešte, kotúč, zámky","44316000-8 Železiarsky tovar; 60000000-8 Dopravné služby (bez prepravy odpadu)","Tovar; Služba","","https://portal.eks.sk/SpravaKniznice/OpisneFormulareKniznice/VerejnyDetailOpisnehoFormularaKniznice/171787","1","0",
"OF-171788","Po karanténe","Notebook ","notebook","30213100-6 Prenosné počítače; 60000000-8 Dopravné služby (bez prepravy odpadu)","Tovar; Služba","","https://portal.eks.sk/SpravaKniznice/OpisneFormulareKniznice/VerejnyDetailOpisnehoFormularaKniznice/171788","0","0",
"OF-171789","Po karanténe","Dodávka elektrickej energie","Elektrina, dodávka elektrickej energie, distribúcia elektrickej energie","09310000-5 Elektrická energia; 65300000-6 Rozvod elektriny a súvisiace služby","Tovar; Služba","","https://portal.eks.sk/SpravaKniznice/OpisneFormulareKniznice/VerejnyDetailOpisnehoFormularaKniznice/171789","0","0",
"OF-171790","Po karanténe","Záhradné kompostéry","Kompostér, doprava","39234000-1 Škatule na kompost; 60000000-8 Dopravné služby (bez prepravy odpadu)","Tovar; Služba","","https://portal.eks.sk/SpravaKniznice/OpisneFormulareKniznice/VerejnyDetailOpisnehoFormularaKniznice/171790","1","0",
"OF-171793","Po karanténe","Kompletné krmivo na skorý odstav prasiatok - predštartér","kompletná kŕmna zmes, pripravené krmivo pre poľnohospodárske a iné zvieratá","15710000-8 Pripravené krmivo pre poľnohospodárske a iné zvieratá; 60000000-8 Dopravné služby (bez prepravy odpadu)","Tovar; Služba","","https://portal.eks.sk/SpravaKniznice/OpisneFormulareKniznice/VerejnyDetailOpisnehoFormularaKniznice/171793","0","0",
"OF-171794","Po karanténe","oprava strešnej krytiny","oprava strešnej krytiny","45261410-1 Strešné izolačné práce; 45261300-7 Klampiarske práce a montáž odkvapových žľabov; 60000000-8 Dopravné služby (bez prepravy odpadu)","Stavebná práca; Tovar; Služba","","https://portal.eks.sk/SpravaKniznice/OpisneFormulareKniznice/VerejnyDetailOpisnehoFormularaKniznice/171794","0","0",
"OF-171796","Po karanténe","Multispektrálna kamera","kamera, multispektrálna","32300000-6 Televízne a rozhlasové prijímače a prístroje na záznam alebo reprodukciu zvuku alebo obrazu; 32333200-8 Videokamery; 32321200-1 Audiovizuálne zariadenia; 34971000-4 Zariadenia s kamerami s vysokou citlivosťou/rýchlosťou; 60000000-8 Dopravné služby (bez prepravy odpadu)","Tovar; Služba","","https://portal.eks.sk/SpravaKniznice/OpisneFormulareKniznice/VerejnyDetailOpisnehoFormularaKniznice/171796","1","0",
"OF-171797","Po karanténe","vata obväzová, skladaná","mäkká vata","33141117-3 Vata; 33141111-1 Priľnavé chirurgické obväzy; 60000000-8 Dopravné služby (bez prepravy odpadu)","Tovar; Služba","","https://portal.eks.sk/SpravaKniznice/OpisneFormulareKniznice/VerejnyDetailOpisnehoFormularaKniznice/171797","0","0",
"OF-171799","Po karanténe","Drevené smrekové pelety svetlé","drevené pelety, pelety, drevné palivá","09111400-4 Drevné palivá; 03417000-6 Drevné zvyšky; 60000000-8 Dopravné služby (bez prepravy odpadu)","Tovar; Služba","","https://portal.eks.sk/SpravaKniznice/OpisneFormulareKniznice/VerejnyDetailOpisnehoFormularaKniznice/171799","1","0",
"OF-171802","Po karanténe","Pesticídy, prídavné a podporné látky a farbivá","chémia","24000000-4 Chemické výrobky; 60000000-8 Dopravné služby (bez prepravy odpadu)","Tovar; Služba","","https://portal.eks.sk/SpravaKniznice/OpisneFormulareKniznice/VerejnyDetailOpisnehoFormularaKniznice/171802","1","0",
"OF-171803","Po karanténe","Pec elektrická kombinovaná s troma rúrami","Pec elektrická statická/teplovzdušná PCE 930 SC","39220000-0 Kuchynské zariadenie, domáce potreby a potreby pre domáce hospodárstvo a dodávky pre stravovacie zariadenia; 60000000-8 Dopravné služby (bez prepravy odpadu)","Tovar; Služba","","https://portal.eks.sk/SpravaKniznice/OpisneFormulareKniznice/VerejnyDetailOpisnehoFormularaKniznice/171803","0","0",
"OF-171804","Po karanténe","Stoly čierne","Stoly čierne","39100000-3 Nábytok; 39160000-1 Školský nábytok; 39134100-1 Počítačové stoly; 45422000-1 Tesárske montážne práce; 60000000-8 Dopravné služby (bez prepravy odpadu)","Tovar; Služba","","https://portal.eks.sk/SpravaKniznice/OpisneFormulareKniznice/VerejnyDetailOpisnehoFormularaKniznice/171804","1","0",
"OF-171805","Po karanténe","Čerstvá zelenina, zemiaky, ovocie","Zelenina, koreňová zelenina, ovocie, zemiaky","03221000-6 Zelenina; 03221110-0 Koreňová zelenina; 03221113-1 Cibuľa; 03221112-4 Mrkva; 03221240-0 Paradajka; 15872100-2 Paprika; 03221270-9 Uhorka; 03221410-3 Kapusta; 15331142-4 Spracovaná kapusta; 03222000-3 Ovocie a orechy; 03222110-7 Tropické ovocie; 03222200-5 Citrusové plody; 03222321-9 Jablká; 03222322-6 Hrušky; 03222111-4 Banány; 03222210-8 Citróny; 03222220-1 Pomaranče; 03222118-3 Kivi; 03222240-7 Mandarínky; 60000000-8 Dopravné služby (bez prepravy odpadu); 03212100-1 Zemiaky; 03222300-6 Netropické ovocie; 03222100-4 Tropické ovocie a orechy","Tovar; Služba","","https://portal.eks.sk/SpravaKniznice/OpisneFormulareKniznice/VerejnyDetailOpisnehoFormularaKniznice/171805","1","0",
"OF-171809","Po karanténe","Zber, odvoz a zneškodnenie nebezpečného odpadu","zber, odvoz, zneškodnenie, nebezpečný odpad, likvidácia","90500000-2 Služby súvisiace s likvidáciou odpadu a odpadom; 90510000-5 Likvidácia a spracovanie odpadu; 90511000-2 Služby na zber odpadu; 90512000-9 Služby na prepravu odpadu; 90520000-8 Služby súvisiace s rádioaktívnym, toxickým, zdravotníckym a nebezpečným odpadom","Služba","","https://portal.eks.sk/SpravaKniznice/OpisneFormulareKniznice/VerejnyDetailOpisnehoFormularaKniznice/171809","0","0",
"OF-171810","Po karanténe","Značkovací sprej","značkovací sprej","44810000-1 Náterové farby; 60000000-8 Dopravné služby (bez prepravy odpadu)","Tovar; Služba","","https://portal.eks.sk/SpravaKniznice/OpisneFormulareKniznice/VerejnyDetailOpisnehoFormularaKniznice/171810","1","0",
"OF-171811","Po karanténe","Prenosné počítače-  notebook,  pamäťové médium, tlačiareň, taška k notebooku","výpočtová technika, notebook, USB pamäťové médium, tlačiareň, taška","30213100-6 Prenosné počítače; 30200000-1 Počítačové zariadenia a spotrebný materiál; 30234000-8 Pamäťové médiá; 18900000-8 Brašnárske výrobky, sedlárske výrobky, vrecká a tašky; 30232110-8 Laserové tlačiarne","Tovar","","https://portal.eks.sk/SpravaKniznice/OpisneFormulareKniznice/VerejnyDetailOpisnehoFormularaKniznice/171811","0","0",
"OF-171817","Po karanténe","Kancelárske potreby","kancelársky papier, zakladač, laminátor, odkladacie mapy, pohár plastový, tácky papierové, folie na laminovanie","30192000-1 Kancelárske potreby; 30197642-8 Papier na fotokopírovanie a xerografický papier; 60000000-8 Dopravné služby (bez prepravy odpadu); 22820000-4 Formuláre","Tovar; Služba","","https://portal.eks.sk/SpravaKniznice/OpisneFormulareKniznice/VerejnyDetailOpisnehoFormularaKniznice/171817","0","0",
"OF-171818","Po karanténe","Grafická karta","Grafická karta, príslušenstvo počítačov","30237000-9 Časti a príslušenstvo počítačov a spotrebný materiál k nim; 60000000-8 Dopravné služby (bez prepravy odpadu)","Tovar; Služba","","https://portal.eks.sk/SpravaKniznice/OpisneFormulareKniznice/VerejnyDetailOpisnehoFormularaKniznice/171818","0","0",
"OF-171819","Po karanténe","Servisná prehliadka motorového vozidla","Servisná prehliadka,  služobné motorové vozidlo, Seat, Škoda","50110000-9 Opravy a údržbárske služby pre motorové vozidlá a súvisiace vybavenie; 50100000-6 Opravy, údržba a súvisiace služby pre vozidlá a príbuzné vybavenie; 60000000-8 Dopravné služby (bez prepravy odpadu)","Služba","","https://portal.eks.sk/SpravaKniznice/OpisneFormulareKniznice/VerejnyDetailOpisnehoFormularaKniznice/171819","0","0",
"OF-171820","Po karanténe","Záhradné kompostéry","Kompostér, doprava","39234000-1 Škatule na kompost; 60000000-8 Dopravné služby (bez prepravy odpadu)","Tovar; Služba","","https://portal.eks.sk/SpravaKniznice/OpisneFormulareKniznice/VerejnyDetailOpisnehoFormularaKniznice/171820","1","0",
"OF-171821","Po karanténe","Doprava autobusom - sústredenie","preprava osôb, autobus","60100000-9 Služby cestnej dopravy; 60140000-1 Nepravidelná osobná doprava; 60000000-8 Dopravné služby (bez prepravy odpadu)","Služba","","https://portal.eks.sk/SpravaKniznice/OpisneFormulareKniznice/VerejnyDetailOpisnehoFormularaKniznice/171821","1","0",
"OF-171822","Po karanténe","Živné pôdy","Živné pôdy, agar","24000000-4 Chemické výrobky; 24300000-7 Základné anorganické a organické chemikálie; 60000000-8 Dopravné služby (bez prepravy odpadu)","Tovar; Služba","","https://portal.eks.sk/SpravaKniznice/OpisneFormulareKniznice/VerejnyDetailOpisnehoFormularaKniznice/171822","1","0",
"OF-171826","Po karanténe","Lieky 1","farmaceutické výrobky, liek, pacient","33600000-6 Farmaceutické výrobky","Tovar; Služba","","https://portal.eks.sk/SpravaKniznice/OpisneFormulareKniznice/VerejnyDetailOpisnehoFormularaKniznice/171826","0","0",
"OF-171827","Po karanténe","Paplón a vankúš set, vankúš","Paplóny,vankúše","39510000-0 Textilné výrobky pre domácnosť; 60000000-8 Dopravné služby (bez prepravy odpadu)","Tovar; Služba","","https://portal.eks.sk/SpravaKniznice/OpisneFormulareKniznice/VerejnyDetailOpisnehoFormularaKniznice/171827","1","0",
"OF-171828","Po karanténe","Náhradné diely na autobusy Solaris U15","Náhradné diely, autobus,Solaris U15","34900000-6 Rôzne dopravné zariadenia a náhradné diely; 34910000-9 Káry ťahané koňom alebo ručne, iné nemechanicky poháňané vozidlá, vozíky na batožinu a rôzne náhradné diely; 34913000-0 Rôzne náhradné diely; 60000000-8 Dopravné služby (bez prepravy odpadu)","Tovar","","https://portal.eks.sk/SpravaKniznice/OpisneFormulareKniznice/VerejnyDetailOpisnehoFormularaKniznice/171828","0","0",
"OF-171829","Po karanténe","Kompostéry","Kompostér, kompostovanie, doprava","39234000-1 Škatule na kompost; 77120000-7 Kompostovanie; 60000000-8 Dopravné služby (bez prepravy odpadu)","Tovar; Služba","","https://portal.eks.sk/SpravaKniznice/OpisneFormulareKniznice/VerejnyDetailOpisnehoFormularaKniznice/171829","0","0",
"OF-171831","Po karanténe","Repasované tonery a originálne tonery","tonerové náplne, tlač, tonery repasované, toner originálny","30125100-2 Tonerové náplne; 30125110-5 Toner do laserových tlačiarní/faxových prístrojov; 90510000-5 Likvidácia a spracovanie odpadu; 60000000-8 Dopravné služby (bez prepravy odpadu)","Tovar; Služba","","https://portal.eks.sk/SpravaKniznice/OpisneFormulareKniznice/VerejnyDetailOpisnehoFormularaKniznice/171831","1","0",
"OF-171835","Po karanténe","Teleskopický manipulátor","teleskopický manipulátor, nakladač s výsuvným ramenom","16000000-5 Poľnohospodárske stroje; 60000000-8 Dopravné služby (bez prepravy odpadu)","Tovar; Služba","","https://portal.eks.sk/SpravaKniznice/OpisneFormulareKniznice/VerejnyDetailOpisnehoFormularaKniznice/171835","0","0",
"OF-171837","Po karanténe","Lieky 2","farmaceutické výrobky, liek, pacient","33600000-6 Farmaceutické výrobky","Tovar; Služba","","https://portal.eks.sk/SpravaKniznice/OpisneFormulareKniznice/VerejnyDetailOpisnehoFormularaKniznice/171837","0","0",
"OF-171838","Po karanténe","Originálne tonery do tlačiarne a multifunkčného zariadenia","toner, tonery, náplne do tlačiarne","30125100-2 Tonerové náplne; 30125110-5 Toner do laserových tlačiarní/faxových prístrojov; 60000000-8 Dopravné služby (bez prepravy odpadu)","Tovar; Služba","","https://portal.eks.sk/SpravaKniznice/OpisneFormulareKniznice/VerejnyDetailOpisnehoFormularaKniznice/171838","1","0",
"OF-171840","Po karanténe","Nákup kompostérov","kompostér, doprava","39234000-1 Škatule na kompost; 60000000-8 Dopravné služby (bez prepravy odpadu)","Tovar; Služba","","https://portal.eks.sk/SpravaKniznice/OpisneFormulareKniznice/VerejnyDetailOpisnehoFormularaKniznice/171840","0","0",
"OF-171841","Po karanténe","Nákup kompostérov","kompostér, doprava","39234000-1 Škatule na kompost; 60000000-8 Dopravné služby (bez prepravy odpadu)","Tovar; Služba","","https://portal.eks.sk/SpravaKniznice/OpisneFormulareKniznice/VerejnyDetailOpisnehoFormularaKniznice/171841","0","0",
"OF-171844","Po karanténe","Lieky 3","farmaceutické výrobky, liek, pacient","33600000-6 Farmaceutické výrobky","Tovar; Služba","","https://portal.eks.sk/SpravaKniznice/OpisneFormulareKniznice/VerejnyDetailOpisnehoFormularaKniznice/171844","0","0",
"OF-171845","Po karanténe","Medical head light, binokulárna lupa","svetlo, lupa, binokulárna lupa, zdravotnícke zariadenia","33110000-4 Zobrazovacie zariadenia na zdravotnícke, stomatologické a veterinárne účely; 60000000-8 Dopravné služby (bez prepravy odpadu)","Tovar; Služba","","https://portal.eks.sk/SpravaKniznice/OpisneFormulareKniznice/VerejnyDetailOpisnehoFormularaKniznice/171845","0","0",
"OF-171847","Po karanténe","Operačný stôl – Úrazová chirurgia","mobilný  operačný stôl,  elektrický, úrazová chirurgia, ","33192230-3 Operačné stoly; 33192200-4 Lekárske stoly; 60000000-8 Dopravné služby (bez prepravy odpadu); 51410000-9 Inštalácia lekárskych zariadení; 80511000-9 Školenie pracovníkov","Tovar; Služba","","https://portal.eks.sk/SpravaKniznice/OpisneFormulareKniznice/VerejnyDetailOpisnehoFormularaKniznice/171847","0","0",
"OF-171850","Po karanténe","Nákup laboratórnych prístrojov - mikrofluidný spektrofotometer, automatický purifikačný systém, verzia 2","Vysokorýchlostný mikrofluidný spektrofotometer, automatický purifikačný systém","38000000-5 Laboratórne, optické a presné prístroje a vybavenie (s výnimkou skiel); 60000000-8 Dopravné služby (bez prepravy odpadu); 38430000-8 Prístroje na detekciu a rozbory; 38434000-6 Analyzátory","Tovar; Služba","","https://portal.eks.sk/SpravaKniznice/OpisneFormulareKniznice/VerejnyDetailOpisnehoFormularaKniznice/171850","0","0",
"OF-171851","Po karanténe","Stravné poukážky","stravné lístky, stravné poukážky, dodanie stravných lístkov, gastrolístky, zabezpečenie stravovania","30199770-8 Stravné poukážky; 60000000-8 Dopravné služby (bez prepravy odpadu)","Tovar; Služba","","https://portal.eks.sk/SpravaKniznice/OpisneFormulareKniznice/VerejnyDetailOpisnehoFormularaKniznice/171851","0","0",
"OF-171853","Po karanténe","Zmes do ostrekovačov "," zmes do ostrekovačov,letná, zimná","24951311-8 Prípravky proti zamŕzaniu; 60000000-8 Dopravné služby (bez prepravy odpadu)","Tovar; Služba","","https://portal.eks.sk/SpravaKniznice/OpisneFormulareKniznice/VerejnyDetailOpisnehoFormularaKniznice/171853","0","0",
"OF-171855","Po karanténe","anorganické a organické chemikálie","anorganické a organické chemikálie","24310000-0 Základné anorganické chemikálie; 24320000-3 Základné organické chemikálie; 60000000-8 Dopravné služby (bez prepravy odpadu)","Tovar; Služba","","https://portal.eks.sk/SpravaKniznice/OpisneFormulareKniznice/VerejnyDetailOpisnehoFormularaKniznice/171855","0","0",
"OF-171856","Po karanténe","Redonova drenážna súprava a Drén Redonov","súprava, fľaša, drén, Redonov","33140000-3 Zdravotnícky spotrebný materiál; 33141600-6 Zberače a zberné vaky, drenáže a súpravy; 33141642-2 Príslušenstvo k drénom; 33141640-8 Drény; 60000000-8 Dopravné služby (bez prepravy odpadu)","Tovar; Služba","","https://portal.eks.sk/SpravaKniznice/OpisneFormulareKniznice/VerejnyDetailOpisnehoFormularaKniznice/171856","0","0",
"OF-171857","Po karanténe","Drén silikónový laparotomický","drén, silikón, laparotómia","33140000-3 Zdravotnícky spotrebný materiál; 33141600-6 Zberače a zberné vaky, drenáže a súpravy; 33141640-8 Drény; 60000000-8 Dopravné služby (bez prepravy odpadu)","Tovar; Služba","","https://portal.eks.sk/SpravaKniznice/OpisneFormulareKniznice/VerejnyDetailOpisnehoFormularaKniznice/171857","0","0",
"OF-171859","Po karanténe","Zmes do ostrekovačov "," zmes do ostrekovačov,letná, zimná","39831240-0 Zlúčeniny na čistenie; 24951310-1 Pripravené tekutiny na odmrazovanie; 60000000-8 Dopravné služby (bez prepravy odpadu)","Tovar; Služba","","https://portal.eks.sk/SpravaKniznice/OpisneFormulareKniznice/VerejnyDetailOpisnehoFormularaKniznice/171859","0","0",
