"OpisnyFormularIdentifikator","OpisnyFormularStav","OpisnyFormularNazov","OpisnyFormularKlucoveSlova","OpisnyFormularCpv","OpisnyFormularDruh","OpisnyFormularKategoriaSluzieb","OpisnyFormularUrl","OpisnyFormularPocetVyhlasenychZakaziek","OpisnyFormularObchodovanaSumaBezDPH",
"OF-258383","Po karanténe"," Papierové stravné poukážky","Papierové stravné poukážky, jedálne, kupóny, gastrolístok","30199770-8 Stravné poukážky; 60000000-8 Dopravné služby (bez prepravy odpadu)","Tovar; Služba","","https://portal.eks.sk/SpravaKniznice/OpisneFormulareKniznice/VerejnyDetailOpisnehoFormularaKniznice/258383","1","0",
"OF-258384","Po karanténe","Výstavné vitríny","výstavná vitrína, sklenená vitrína","39171000-1 Vitríny; 60000000-8 Dopravné služby (bez prepravy odpadu)","Tovar; Služba","","https://portal.eks.sk/SpravaKniznice/OpisneFormulareKniznice/VerejnyDetailOpisnehoFormularaKniznice/258384","0","0",
"OF-258385","Po karanténe","Pranie nemocničnej bielizne","pranie bielizne, dezinfekcia, žehlenie","98310000-9 Pranie a chemické čistenie; 98311000-6 Zber bielizne; 98315000-4 Žehlenie; 60000000-8 Dopravné služby (bez prepravy odpadu)","Služba","","https://portal.eks.sk/SpravaKniznice/OpisneFormulareKniznice/VerejnyDetailOpisnehoFormularaKniznice/258385","1","0",
"OF-258386","Po karanténe","Technická podpora pre súčasne používané licencie Oracle Java SE","Technická podpora, Oracle Java","72261000-2 Softvérové podporné služby","Služba","","https://portal.eks.sk/SpravaKniznice/OpisneFormulareKniznice/VerejnyDetailOpisnehoFormularaKniznice/258386","1","0",
"OF-258387","Po karanténe","OOPP ","obuv, zástera, tričko, nohavice","18830000-6 Ochranná obuv; 18110000-3 Pracovné odevy; 18100000-0 Pracovné odevy, špeciálne pracovné odevy a doplnky; 35113400-3 Ochranné a bezpečnostné odevy; 18141000-9 Pracovné rukavice; 60000000-8 Dopravné služby (bez prepravy odpadu)","Tovar; Služba","","https://portal.eks.sk/SpravaKniznice/OpisneFormulareKniznice/VerejnyDetailOpisnehoFormularaKniznice/258387","1","0",
"OF-258388","Po karanténe","Notebook, počítačové vybavenie a príslušenstvo ","Počítač, pamäť, zdroj, tablet, router","30236000-2 Rôzne počítačové vybavenie; 30230000-0 Zariadenia súvisiace s počítačmi; 60000000-8 Dopravné služby (bez prepravy odpadu)","Tovar; Služba","","https://portal.eks.sk/SpravaKniznice/OpisneFormulareKniznice/VerejnyDetailOpisnehoFormularaKniznice/258388","1","0",
"OF-258389","Po karanténe","Stravné lístky","Jedálne kupóny, stravné poukážky, gastrolístky","30199770-8 Stravné poukážky; 60000000-8 Dopravné služby (bez prepravy odpadu)","Tovar; Služba","","https://portal.eks.sk/SpravaKniznice/OpisneFormulareKniznice/VerejnyDetailOpisnehoFormularaKniznice/258389","1","0",
"OF-258390","Po karanténe","monitor ","monitor","33195100-4 Monitory; 60000000-8 Dopravné služby (bez prepravy odpadu)","Tovar; Služba","","https://portal.eks.sk/SpravaKniznice/OpisneFormulareKniznice/VerejnyDetailOpisnehoFormularaKniznice/258390","1","180,000",
"OF-258391","Po karanténe","Elektronické súčiastky a komponenty","elektronické súčiastky, komponenty","31710000-6 Elektronické zariadenia; 31711110-7 Vysielače s prijímačom (transceivery); 60000000-8 Dopravné služby (bez prepravy odpadu)","Tovar; Služba","","https://portal.eks.sk/SpravaKniznice/OpisneFormulareKniznice/VerejnyDetailOpisnehoFormularaKniznice/258391","1","0",
"OF-258392","Po karanténe","Učebné pomôcky - zdravotnícky sektor","simulátor, model, zdravotnícke pomôcky","33196000-0 Zdravotné pomôcky; 33100000-1 Zdravotnícke vybavenie; 39162200-7 Učebné pomôcky a zariadenia; 60000000-8 Dopravné služby (bez prepravy odpadu)","Tovar; Služba","","https://portal.eks.sk/SpravaKniznice/OpisneFormulareKniznice/VerejnyDetailOpisnehoFormularaKniznice/258392","1","1694,000",
"OF-258393","Po karanténe","Farba na vodorovné dopravné značenie","farba na vozovky, náterové látky, balotina, riedilo","44811000-8 Farba na vozovku; 60000000-8 Dopravné služby (bez prepravy odpadu)","Tovar; Služba","","https://portal.eks.sk/SpravaKniznice/OpisneFormulareKniznice/VerejnyDetailOpisnehoFormularaKniznice/258393","1","10350,000",
"OF-258394","Po karanténe","Počítač All-In-One 27“","Počítač, osobný počítač, all in one, displey, klávesnica, myš","30213000-5 Osobné počítače; 30213300-8 Stolový počítač; 30230000-0 Zariadenia súvisiace s počítačmi; 60000000-8 Dopravné služby (bez prepravy odpadu)","Tovar; Služba","","https://portal.eks.sk/SpravaKniznice/OpisneFormulareKniznice/VerejnyDetailOpisnehoFormularaKniznice/258394","1","6315,830",
"OF-258395","Po karanténe","Stála tabuľa pre projekt Centrum pomoci človeku","informačná tabuľa, stála tabuľa","30195000-2 Tabule; 39294100-0 Informačné a propagačné výrobky; 60000000-8 Dopravné služby (bez prepravy odpadu)","Tovar; Služba","","https://portal.eks.sk/SpravaKniznice/OpisneFormulareKniznice/VerejnyDetailOpisnehoFormularaKniznice/258395","1","0",
"OF-258396","Po karanténe","Svietidlá, osvetľovacie zariadenia, svetelné zdroje a príslušenstvo","Neónové trubice, LED svietidlá, LED trubice, Žiarovky","31519000-7 Žiarivky a neónové lampy; 31519100-8 Žiarivky; 31519200-9 Neónové lampy; 31524000-5 Príslušenstvo k stropným alebo nástenným svietidlám; 31520000-7 Lampy/svietidlá a príslušenstvo k nim; 31524100-6 Príslušenstvo k stropným svietidlám; 31524120-2 Stropné svetlá; 31524200-7 Príslušenstvo pre nástenné svetlá; 31530000-0 Časti lámp a osvetľovacích zariadení; 31531000-7 Žiarovky; 31531100-8 Elektrické trubice; 31532000-4 Časti lámp a svietidiel a príslušenstvo k nim; 31532100-5 Trubicové svietidlá; 31532110-8 Trubicové žiarivky; 31532900-3 Žiarivkové svietidlá; 31532910-6 Žiarivkové trubice; 31532120-1 Kompaktné trubicové žiarivky; 60000000-8 Dopravné služby (bez prepravy odpadu)","Tovar; Služba","","https://portal.eks.sk/SpravaKniznice/OpisneFormulareKniznice/VerejnyDetailOpisnehoFormularaKniznice/258396","0","0",
"OF-258397","Po karanténe","ND do strojov na zemné práce","univerzálny nakladač, UN 053, náhradné diely","34913000-0 Rôzne náhradné diely; 60000000-8 Dopravné služby (bez prepravy odpadu)","Tovar; Služba","","https://portal.eks.sk/SpravaKniznice/OpisneFormulareKniznice/VerejnyDetailOpisnehoFormularaKniznice/258397","1","0",
"OF-258398","Po karanténe","Odvoz a likvidácia nebezpečného odpadu","odpad, likvidácia, zber, preprava","90520000-8 Služby súvisiace s rádioaktívnym, toxickým, zdravotníckym a nebezpečným odpadom; 60000000-8 Dopravné služby (bez prepravy odpadu)","Služba","","https://portal.eks.sk/SpravaKniznice/OpisneFormulareKniznice/VerejnyDetailOpisnehoFormularaKniznice/258398","0","0",
"OF-258399","Po karanténe","Káble, konektory a nabíjačky","kábel, CYSY, CYKY","31321210-7 Káble nízkeho napätia; 44322100-4 Elektroinštalačné káble; 60000000-8 Dopravné služby (bez prepravy odpadu)","Tovar; Služba","","https://portal.eks.sk/SpravaKniznice/OpisneFormulareKniznice/VerejnyDetailOpisnehoFormularaKniznice/258399","1","540,000",
"OF-258400","Po karanténe","Príslušenstvo k výpočtovej technike","záložný zdroj","31111000-7 Adaptéry; 37453300-1 Disky; 30230000-0 Zariadenia súvisiace s počítačmi; 60000000-8 Dopravné služby (bez prepravy odpadu)","Tovar; Služba","","https://portal.eks.sk/SpravaKniznice/OpisneFormulareKniznice/VerejnyDetailOpisnehoFormularaKniznice/258400","1","0",
"OF-258401","Po karanténe","Ozvučenie podujatí","Ozvučenie, Zvuk, Zvuková technika","92370000-5 Služby zvukového technika; 60000000-8 Dopravné služby (bez prepravy odpadu); 92300000-4 Služby v oblasti zábavy; 92312100-2 Zábavné služby divadelnej produkcie, speváckych skupín, hudobných skupín a orchestrov; 51313000-9 Inštalácia zvukových zariadení","Služba","","https://portal.eks.sk/SpravaKniznice/OpisneFormulareKniznice/VerejnyDetailOpisnehoFormularaKniznice/258401","1","0",
"OF-258403","Po karanténe","Športové vybavenie","dopadová plocha","37400000-2 Športový tovar a výbava; 60000000-8 Dopravné služby (bez prepravy odpadu)","Tovar; Služba","","https://portal.eks.sk/SpravaKniznice/OpisneFormulareKniznice/VerejnyDetailOpisnehoFormularaKniznice/258403","1","283,250",
"OF-258404","Po karanténe","Náhradné diely na Sor NB12,NB18 - elektro","Náhradné diely, autobus,Sor,elektro","34121100-2 Autobusy verejnej dopravy; 31610000-5 Elektrické zariadenia pre motory a vozidlá; 60000000-8 Dopravné služby (bez prepravy odpadu)","Tovar","","https://portal.eks.sk/SpravaKniznice/OpisneFormulareKniznice/VerejnyDetailOpisnehoFormularaKniznice/258404","1","1020,000",
"OF-258405","Po karanténe","Technické zabezpečenie pre projekciu na fasádu budovy ","laserová projekcia","98390000-3 Iné služby","Služba","","https://portal.eks.sk/SpravaKniznice/OpisneFormulareKniznice/VerejnyDetailOpisnehoFormularaKniznice/258405","0","0",
"OF-258406","Po karanténe","Náhradné diely na autobusy Solaris U15 - podvozok","Náhradné diely, autobus,Solaris U15,podvozok","34121100-2 Autobusy verejnej dopravy; 34139200-2 Samotný podvozok; 60000000-8 Dopravné služby (bez prepravy odpadu)","Tovar","","https://portal.eks.sk/SpravaKniznice/OpisneFormulareKniznice/VerejnyDetailOpisnehoFormularaKniznice/258406","1","2948,000",
"OF-258407","Po karanténe","Náhradné diely na autobusy Solaris U15 - hnacie ústrojenstvo","Náhradné diely, autobus,Solaris U15,hnacie ústrojenstvo","34121100-2 Autobusy verejnej dopravy; 42111000-0 Motory a hnacie zariadenia; 60000000-8 Dopravné služby (bez prepravy odpadu)","Tovar","","https://portal.eks.sk/SpravaKniznice/OpisneFormulareKniznice/VerejnyDetailOpisnehoFormularaKniznice/258407","1","800,000",
"OF-258408","Po karanténe","Hrnce","varenie, príprava jedla, ohrievanie","39221000-7 Kuchynské vybavenie; 60000000-8 Dopravné služby (bez prepravy odpadu)","Tovar; Služba","","https://portal.eks.sk/SpravaKniznice/OpisneFormulareKniznice/VerejnyDetailOpisnehoFormularaKniznice/258408","1","735,000",
"OF-258409","Po karanténe","Nákup - obrusovina","obrusovina","19513000-5 Pogumované textílie; 60000000-8 Dopravné služby (bez prepravy odpadu)","Tovar; Služba","","https://portal.eks.sk/SpravaKniznice/OpisneFormulareKniznice/VerejnyDetailOpisnehoFormularaKniznice/258409","1","308,330",
"OF-258410","Po karanténe","Zdravotnícke tašky na umiestnenie výbavy a špeciálneho zdravotníckeho materiálu","zdravotnícka taška","33100000-1 Zdravotnícke vybavenie; 60000000-8 Dopravné služby (bez prepravy odpadu)","Tovar; Služba","","https://portal.eks.sk/SpravaKniznice/OpisneFormulareKniznice/VerejnyDetailOpisnehoFormularaKniznice/258410","0","0",
"OF-258413","Po karanténe","Náhradné diely na autobusy Sor EBN - hnacie ústrojenstvo + podvozok","Náhradné diely, autobus,Sor EBN,podvozok, hnacie ústrojenstvo","34121100-2 Autobusy verejnej dopravy; 34139200-2 Samotný podvozok; 60000000-8 Dopravné služby (bez prepravy odpadu); 34144910-0 Elektrické autobusy; 42111000-0 Motory a hnacie zariadenia","Tovar","","https://portal.eks.sk/SpravaKniznice/OpisneFormulareKniznice/VerejnyDetailOpisnehoFormularaKniznice/258413","1","540,000",
"OF-258414","Po karanténe","Tonery","farebné sady tonerov","30125100-2 Tonerové náplne; 60000000-8 Dopravné služby (bez prepravy odpadu)","Tovar; Služba","","https://portal.eks.sk/SpravaKniznice/OpisneFormulareKniznice/VerejnyDetailOpisnehoFormularaKniznice/258414","1","0",
"OF-258415","Po karanténe","Náhradné diely na Sor NB12,NB18 - elektro","Náhradné diely, autobus,Sor,elektro","34121100-2 Autobusy verejnej dopravy; 31610000-5 Elektrické zariadenia pre motory a vozidlá; 60000000-8 Dopravné služby (bez prepravy odpadu)","Tovar","","https://portal.eks.sk/SpravaKniznice/OpisneFormulareKniznice/VerejnyDetailOpisnehoFormularaKniznice/258415","1","470,000",
"OF-258416","Po karanténe","Mlieko a Mliečne výrobky","Mlieko, mliečne výrobky, vajcia","15511000-3 Mlieko; 15550000-8 Mliečne výrobky rôznych druhov; 15543100-7 Syr s modrou plesňou; 15544000-3 Tvrdý syr; 15530000-2 Maslo; 15871273-8 Majonéza; 15412000-9 Tuky; 03142500-3 Vajcia","Tovar; Služba","","https://portal.eks.sk/SpravaKniznice/OpisneFormulareKniznice/VerejnyDetailOpisnehoFormularaKniznice/258416","1","0",
"OF-258417","Po karanténe","Liečivá pre nervový systém a zmyslové orgány (Analgetiká)","Lieky, Analgetiká, Liečivá pre nervový systém a zmyslové orgány","33610000-9 Liečivá pre výživovú sústavu a látkovú premenu; 60000000-8 Dopravné služby (bez prepravy odpadu)","Tovar; Služba","","https://portal.eks.sk/SpravaKniznice/OpisneFormulareKniznice/VerejnyDetailOpisnehoFormularaKniznice/258417","0","0",
"OF-258418","Po karanténe","Nádoby, obaly a obalový materiál","popolnica na odpad , odpadkový kôš, nádoba na separovaný odpad, nádoba na komunálny odpad","34928480-6 Kontajnery a nádoby na odpad a odpadky; 39224340-3 Koše; 60000000-8 Dopravné služby (bez prepravy odpadu)","Tovar; Služba","","https://portal.eks.sk/SpravaKniznice/OpisneFormulareKniznice/VerejnyDetailOpisnehoFormularaKniznice/258418","1","500,000",
"OF-258419","Po karanténe","teplomery, hustomery, vlhkomery a váhy","teplomery, hustomery, vlhkomery a váhy","38412000-6 Teplomery; 60000000-8 Dopravné služby (bez prepravy odpadu)","Tovar; Služba","","https://portal.eks.sk/SpravaKniznice/OpisneFormulareKniznice/VerejnyDetailOpisnehoFormularaKniznice/258419","1","0",
"OF-258420","Po karanténe","Čerstvé ovocie a zelenina","ovocie, zelenina","03220000-9 Zelenina, ovocie a orechy; 03221100-7 Koreňová a hľuzová zelenina; 03221230-7 Papriky; 03221240-0 Paradajka; 03221270-9 Uhorka; 03221410-3 Kapusta; 03221420-6 Karfiol; 03221430-9 Brokolica; 03222111-4 Banány; 03222220-1 Pomaranče; 03222240-7 Mandarínky; 03222321-9 Jablká; 03222322-6 Hrušky; 03222331-2 Marhule; 03222332-9 Broskyne; 03222341-5 Stolové hrozno; 03222210-8 Citróny; 03221112-4 Mrkva; 60000000-8 Dopravné služby (bez prepravy odpadu)","Tovar; Služba","","https://portal.eks.sk/SpravaKniznice/OpisneFormulareKniznice/VerejnyDetailOpisnehoFormularaKniznice/258420","1","0",
"OF-258422","Po karanténe","Lieky ATC skupiny B02","glukóza monohydrát, chlorid sodný, manitol, irigračný roztok","33621200-1 Antihemoragiká; 60000000-8 Dopravné služby (bez prepravy odpadu)","Tovar; Služba","","https://portal.eks.sk/SpravaKniznice/OpisneFormulareKniznice/VerejnyDetailOpisnehoFormularaKniznice/258422","1","0",
"OF-258423","Po karanténe","Školenia, kurzy, semináre","základný kurz vodičov na prepravu nebezpečných vecí ADR  rozšírenie na triedu 1, obnovovacie školenie vodičov ADR rozšírené o triedu 1","80500000-9 Školiace (výcvikové) služby; 79632000-3 Školenia a výcvik personálu; 80510000-2 Služby týkajúce sa odborných školení","Služba","","https://portal.eks.sk/SpravaKniznice/OpisneFormulareKniznice/VerejnyDetailOpisnehoFormularaKniznice/258423","0","0",
"OF-258424","Po karanténe","Tmely, konzervačné materiály a lepidlá","teflonové mazivo, kontaktné lepidlo, Lepidlo disperzné , Loctite si 5660 , Specialist uvoľňujúci penetrant, lepidlo na PVC, sekundové lepidlo , HB BODY 950 sprej čierny , Tesniaci materiál, Výfukový systém , Akrylátový tmel","44831100-5 Tmely; 44831000-4 Tmely, plnivá, tesniace tmely; 60000000-8 Dopravné služby (bez prepravy odpadu)","Tovar; Služba","","https://portal.eks.sk/SpravaKniznice/OpisneFormulareKniznice/VerejnyDetailOpisnehoFormularaKniznice/258424","1","1400,000",
"OF-258425","Po karanténe","Prídavné zariadenia ku traktoru ZETOR Major 60 CL","valčekový samonakladací sypač, predný trojbodový záves, predná odpružená radlica, zimná údržba","16700000-2 Traktory/ťahače; 34390000-7 Príslušenstvo ťahačov/traktorov; 34921000-9 Zariadenia na údržbu ciest; 60000000-8 Dopravné služby (bez prepravy odpadu)","Tovar; Služba","","https://portal.eks.sk/SpravaKniznice/OpisneFormulareKniznice/VerejnyDetailOpisnehoFormularaKniznice/258425","0","0",
"OF-258426","Po karanténe","Voľne stojaca jednodverová chladnička, voľne stojaca kombinovaná chladnička","Voľne stojaca jednodverová chladnička, voľne stojaca kombinovaná chladnička","39711123-7 Stojaté chladničky; 60000000-8 Dopravné služby (bez prepravy odpadu)","Tovar; Služba","","https://portal.eks.sk/SpravaKniznice/OpisneFormulareKniznice/VerejnyDetailOpisnehoFormularaKniznice/258426","1","2666,280",
"OF-258427","Po karanténe","Elektro káble ","káble, svorky, očká","44321000-6 Káble; 44322100-4 Elektroinštalačné káble; 44320000-9 Káble a súvisiace výrobky; 60000000-8 Dopravné služby (bez prepravy odpadu)","Tovar; Služba","","https://portal.eks.sk/SpravaKniznice/OpisneFormulareKniznice/VerejnyDetailOpisnehoFormularaKniznice/258427","1","0",
"OF-258428","Po karanténe","Stravné poukážky","stravné poukážky, dodanie stravných poukážok","30199770-8 Stravné poukážky; 55520000-1 Služby hromadného stravovania; 60000000-8 Dopravné služby (bez prepravy odpadu)","Tovar; Služba","","https://portal.eks.sk/SpravaKniznice/OpisneFormulareKniznice/VerejnyDetailOpisnehoFormularaKniznice/258428","0","0",
"OF-258429","Po karanténe","Objemové stavebné materiály","Asfalt, betón, škárovačka, adhézny mostík, štuková omietka","44113620-7 Asfalt; 44114000-2 Betón; 44111000-1 Stavebné materiály; 44190000-8 Rôzne stavebné materiály; 44192000-2 Iné rôzne stavebné materiály; 60000000-8 Dopravné služby (bez prepravy odpadu)","Tovar; Služba","","https://portal.eks.sk/SpravaKniznice/OpisneFormulareKniznice/VerejnyDetailOpisnehoFormularaKniznice/258429","1","0",
"OF-258430","Po karanténe","Meteostanica s príslušenstvom","meteostanica, informačná tabuľa","34996000-5 Regulačné, bezpečnostné alebo signalizačné zariadenia pre cestnú dopravu","Tovar; Služba","","https://portal.eks.sk/SpravaKniznice/OpisneFormulareKniznice/VerejnyDetailOpisnehoFormularaKniznice/258430","1","0",
"OF-258431","Po karanténe","Stravné lístky","stravné lístky a dodanie stravných lístkov","30199770-8 Stravné poukážky; 60000000-8 Dopravné služby (bez prepravy odpadu)","Tovar; Služba","","https://portal.eks.sk/SpravaKniznice/OpisneFormulareKniznice/VerejnyDetailOpisnehoFormularaKniznice/258431","1","5005,400",
"OF-258432","Po karanténe","Technické plyny  a zásobníky ","technický plyn, tlaková fľaša, oxid uhličitý","24110000-8 Technické plyny; 24112100-3 Oxid uhličitý; 60000000-8 Dopravné služby (bez prepravy odpadu)","Tovar; Služba","","https://portal.eks.sk/SpravaKniznice/OpisneFormulareKniznice/VerejnyDetailOpisnehoFormularaKniznice/258432","0","0",
"OF-258436","Po karanténe","Športové a rekreačné vybavenie a zariadenie ","TRAP BAR, činka, náčinie,","37400000-2 Športový tovar a výbava; 45212140-9 Rekreačné zariadenia; 60000000-8 Dopravné služby (bez prepravy odpadu); 37420000-8 Výbava do telocvične; 37410000-5 Výbava pre športy vo voľnej prírode alebo na ihrisku; 37416000-7 Výbava na voľný čas; 37415000-0 Atletická výbava; 37453000-8 Vybavenie na atletiku; 37442000-8 Vybavenie na váhové a odporové cvičenie; 37426000-0 Zariadenie na cvičenie rovnováhy; 39290000-1 Rôzne vybavenie a zariadenie interiérov; 92610000-0 Prevádzka športovísk; 37450000-7 Vybavenie na vonkajšie a halové športy; 37442100-8 Jednoručné činky; 37442400-8 Lavice alebo stojany na závažia","Tovar; Služba","","https://portal.eks.sk/SpravaKniznice/OpisneFormulareKniznice/VerejnyDetailOpisnehoFormularaKniznice/258436","1","289,000",
"OF-258438","Po karanténe","Značky a súvisiace prvky ","Bezpečnostné nálepky, reflexný trojuholník, reflexná tabuľa","44423400-5 Značky a súvisiace prvky; 60000000-8 Dopravné služby (bez prepravy odpadu)","Tovar; Služba","","https://portal.eks.sk/SpravaKniznice/OpisneFormulareKniznice/VerejnyDetailOpisnehoFormularaKniznice/258438","1","0",
"OF-258439","Po karanténe","Počítač","Počítač","30213000-5 Osobné počítače; 30230000-0 Zariadenia súvisiace s počítačmi; 60000000-8 Dopravné služby (bez prepravy odpadu)","Tovar; Služba","","https://portal.eks.sk/SpravaKniznice/OpisneFormulareKniznice/VerejnyDetailOpisnehoFormularaKniznice/258439","0","0",
"OF-258440","Po karanténe","Rôzne počítačové vybavenie a komponenty PC","základná doska, procesor PC, grafická karta, chladič, operačná pamäť, zdroj, počítačová skriňa, úložisko","30230000-0 Zariadenia súvisiace s počítačmi; 60000000-8 Dopravné služby (bez prepravy odpadu)","Tovar; Služba","","https://portal.eks.sk/SpravaKniznice/OpisneFormulareKniznice/VerejnyDetailOpisnehoFormularaKniznice/258440","0","0",
"OF-258441","Po karanténe","Notebook na spracovanie údajov","notebook, hardvér","30213100-6 Prenosné počítače; 60000000-8 Dopravné služby (bez prepravy odpadu)","Tovar; Služba","","https://portal.eks.sk/SpravaKniznice/OpisneFormulareKniznice/VerejnyDetailOpisnehoFormularaKniznice/258441","0","0",
"OF-258442","Po karanténe","Učebnice pre SOŠ elektrotechnickú odbor mechanik mechatronik","učebnice, knihy, strojárstvo, mechanika, statika, dynamika, škola","22112000-8 Učebnice; 22111000-1 Knihy pre školy; 22160000-9 Brožované knihy; 22110000-4 Tlačené knihy; 60000000-8 Dopravné služby (bez prepravy odpadu)","Tovar; Služba","","https://portal.eks.sk/SpravaKniznice/OpisneFormulareKniznice/VerejnyDetailOpisnehoFormularaKniznice/258442","0","0",
"OF-258443","Po karanténe","Dodávka elektrickej energie","Elektrická energia","09310000-5 Elektrická energia; 65300000-6 Rozvod elektriny a súvisiace služby","Tovar; Služba","","https://portal.eks.sk/SpravaKniznice/OpisneFormulareKniznice/VerejnyDetailOpisnehoFormularaKniznice/258443","0","0",
"OF-258446","Po karanténe","Servis a opravy posypových nadstavieb VSV a SK","oprava, servis, servisné prehliadky, posypové nadstavby","50114000-7 Oprava a údržba nákladných vozidiel","Služba","","https://portal.eks.sk/SpravaKniznice/OpisneFormulareKniznice/VerejnyDetailOpisnehoFormularaKniznice/258446","1","0",
"OF-258447","Po karanténe","Notebooky","Notebooky, dokovacia stanica","30213100-6 Prenosné počítače; 30237100-0 Časti počítačov; 60000000-8 Dopravné služby (bez prepravy odpadu)","Tovar; Služba","","https://portal.eks.sk/SpravaKniznice/OpisneFormulareKniznice/VerejnyDetailOpisnehoFormularaKniznice/258447","0","0",
"OF-258448","Po karanténe","Učebné a výtvarné pomôcky pre MŠ","výkresy, vodové farby, štetce, obrázkové kocky, koberec, paraván, sada zvončekov,kreatívny kufrík, fixky","39162200-7 Učebné pomôcky a zariadenia; 37000000-8 Hudobné nástroje, športový tovar, hry, hračky, materiály pre remeselné a umelecké práce a príslušenstvo; 44812300-8 Školské farby; 30192124-6 Fixky; 37524000-7 Hry; 37524400-1 Hry zamerané na spoluprácu; 60000000-8 Dopravné služby (bez prepravy odpadu)","Tovar; Služba","","https://portal.eks.sk/SpravaKniznice/OpisneFormulareKniznice/VerejnyDetailOpisnehoFormularaKniznice/258448","1","0",
"OF-258450","Po karanténe","Servis produkčnej tlačiarne Konica Minolta bizhub PRO C1060L","servis tlačiarne","30125000-1 Časti a príslušenstvo fotokopírovacích prístrojov; 30124100-5 Zapekacie jednotky; 50310000-1 Údržba a opravy kancelárskych strojov; 60000000-8 Dopravné služby (bez prepravy odpadu)","Tovar; Služba","","https://portal.eks.sk/SpravaKniznice/OpisneFormulareKniznice/VerejnyDetailOpisnehoFormularaKniznice/258450","1","0",
"OF-258452","Po karanténe","Lieky ATC skupiny B03 - Antianemiká","lieky, antianemiká, síran železnatý, hydroxid železitý, železo, kyanokobalamín, kyselina listová","33621300-2 Antianemické prípravky; 60000000-8 Dopravné služby (bez prepravy odpadu)","Tovar; Služba","","https://portal.eks.sk/SpravaKniznice/OpisneFormulareKniznice/VerejnyDetailOpisnehoFormularaKniznice/258452","1","0",
"OF-258453","Po karanténe","Zdravotnícky spotrebný materiál","zirkónové guličky","33140000-3 Zdravotnícky spotrebný materiál; 60000000-8 Dopravné služby (bez prepravy odpadu)","Tovar; Služba","","https://portal.eks.sk/SpravaKniznice/OpisneFormulareKniznice/VerejnyDetailOpisnehoFormularaKniznice/258453","1","0",
"OF-258455","Po karanténe","Tonerové náplne","Tonerové náplne","30125100-2 Tonerové náplne; 30125120-8 Toner do fotokopírovacích strojov; 60000000-8 Dopravné služby (bez prepravy odpadu)","Tovar; Služba","","https://portal.eks.sk/SpravaKniznice/OpisneFormulareKniznice/VerejnyDetailOpisnehoFormularaKniznice/258455","0","0",
"OF-258456","Po karanténe","Dodávka pracovných stolov, regálov.","Regále, pracovné stoly.","39141200-4 Pracovné plochy; 39151100-6 Regály; 60000000-8 Dopravné služby (bez prepravy odpadu)","Tovar; Služba","","https://portal.eks.sk/SpravaKniznice/OpisneFormulareKniznice/VerejnyDetailOpisnehoFormularaKniznice/258456","1","0",
"OF-258457","Po karanténe","Elektronické súčiastky a komponenty","elektronické súčiastky, komponenty","31710000-6 Elektronické zariadenia; 31711100-4 Elektronické komponenty; 60000000-8 Dopravné služby (bez prepravy odpadu)","Tovar; Služba","","https://portal.eks.sk/SpravaKniznice/OpisneFormulareKniznice/VerejnyDetailOpisnehoFormularaKniznice/258457","1","0",
"OF-258458","Po karanténe","Mobilný terminál pre overovanie vstupeniek","vreckový počítač, overovačka","30213500-0 Vreckové počítače","Tovar","","https://portal.eks.sk/SpravaKniznice/OpisneFormulareKniznice/VerejnyDetailOpisnehoFormularaKniznice/258458","1","0",
