"OpisnyFormularIdentifikator","OpisnyFormularStav","OpisnyFormularNazov","OpisnyFormularKlucoveSlova","OpisnyFormularCpv","OpisnyFormularDruh","OpisnyFormularKategoriaSluzieb","OpisnyFormularUrl","OpisnyFormularPocetVyhlasenychZakaziek","OpisnyFormularObchodovanaSumaBezDPH",
"OF-209679","Po karanténe","Mobilný RTG prístroj s C-ramenom s plochým detektorom","RTG, C-rameno, CSI, Plochý detektor","33111400-5 Röntgenové fluoroskopické prístroje; 60000000-8 Dopravné služby (bez prepravy odpadu)","Tovar; Služba","","https://portal.eks.sk/SpravaKniznice/OpisneFormulareKniznice/VerejnyDetailOpisnehoFormularaKniznice/209679","0","0",
"OF-209681","Po karanténe","Kancelárske potreby","papier, kancelária,","30192000-1 Kancelárske potreby; 60000000-8 Dopravné služby (bez prepravy odpadu)","Tovar; Služba","","https://portal.eks.sk/SpravaKniznice/OpisneFormulareKniznice/VerejnyDetailOpisnehoFormularaKniznice/209681","1","0",
"OF-209682","Po karanténe","Pegaspargáza","Pegaspargáza, Antineoplastické a imunomodulačné činidlá","33652000-5 Antineoplastické a imunomodulačné činidlá; 60000000-8 Dopravné služby (bez prepravy odpadu)","Tovar; Služba","","https://portal.eks.sk/SpravaKniznice/OpisneFormulareKniznice/VerejnyDetailOpisnehoFormularaKniznice/209682","1","0",
"OF-209683","Po karanténe","prenosný počítač ","notebook, acer, windows 10, externý SSD disk","30213100-6 Prenosné počítače; 30234500-3 Pamäťové archivačné médiá; 60000000-8 Dopravné služby (bez prepravy odpadu)","Tovar; Služba","","https://portal.eks.sk/SpravaKniznice/OpisneFormulareKniznice/VerejnyDetailOpisnehoFormularaKniznice/209683","1","0",
"OF-209684","Po karanténe","Zber, odvoz a zneškodnenie kuchynského odpadu","zber, odber, odvoz, zneškodnenie, kuchynský odpad, likvidácia, biologický rozložiteľný odpad, odpady, jedlé oleje a tuky, manipulácia s odpadmi,","90500000-2 Služby súvisiace s likvidáciou odpadu a odpadom; 90510000-5 Likvidácia a spracovanie odpadu; 90511000-2 Služby na zber odpadu; 90512000-9 Služby na prepravu odpadu; 90513000-6 Služby na spracovanie a likvidáciu nie nebezpečného odpadu","Služba","","https://portal.eks.sk/SpravaKniznice/OpisneFormulareKniznice/VerejnyDetailOpisnehoFormularaKniznice/209684","1","0",
"OF-209685","Po karanténe","Mini akumulátorová vŕtačka","vŕtačka","33183300-9 Osteosyntetické prístroje; 51410000-9 Inštalácia lekárskych zariadení; 60000000-8 Dopravné služby (bez prepravy odpadu)","Tovar; Služba","","https://portal.eks.sk/SpravaKniznice/OpisneFormulareKniznice/VerejnyDetailOpisnehoFormularaKniznice/209685","0","0",
"OF-209686","Po karanténe","Diagnostická súprava ID Screen Toxoplasmosis Indirect Multi-species ELISA","kit, toxoplazmoza","24960000-1 Rôzne chemické výrobky; 60000000-8 Dopravné služby (bez prepravy odpadu)","Tovar; Služba","","https://portal.eks.sk/SpravaKniznice/OpisneFormulareKniznice/VerejnyDetailOpisnehoFormularaKniznice/209686","1","0",
"OF-209687","Po karanténe","Atómový absorpčný spektrometer","atómovy  absorbčný spektrometer","38433000-9 Spektrometre; 60000000-8 Dopravné služby (bez prepravy odpadu)","Tovar; Služba","","https://portal.eks.sk/SpravaKniznice/OpisneFormulareKniznice/VerejnyDetailOpisnehoFormularaKniznice/209687","1","0",
"OF-209688","Po karanténe","Celulózové papierové produkty - hygienické potreby","toaletný papier, hygienické potreby, obrúsky, celulóza","33760000-5 Toaletný papier, vreckovky, uteráky na ruky a servítky; 33761000-2 Toaletný papier; 39513200-3 Obrúsky; 33771000-5 Hygienické výrobky z papiera; 60000000-8 Dopravné služby (bez prepravy odpadu)","Tovar; Služba","","https://portal.eks.sk/SpravaKniznice/OpisneFormulareKniznice/VerejnyDetailOpisnehoFormularaKniznice/209688","1","0",
"OF-209689","Po karanténe","Pranie a chemické čistenie","pranie, chemické čistenie","98310000-9 Pranie a chemické čistenie; 98311000-6 Zber bielizne; 98312000-3 Čistenie textilu; 98312100-4 Impregnovanie textilu; 98315000-4 Žehlenie; 60000000-8 Dopravné služby (bez prepravy odpadu)","Služba","","https://portal.eks.sk/SpravaKniznice/OpisneFormulareKniznice/VerejnyDetailOpisnehoFormularaKniznice/209689","1","0",
"OF-209690","Po karanténe","Tréningový značkovací náboj 9 mm MMR ","nesmrtiaca zbraň, projektily,","35200000-6 Policajný výstroj; 35312000-4 Plynové pištole; 35331000-3 Strelivo do strelných zbraní a vojnové prostriedky; 35331100-4 Projektily; 60000000-8 Dopravné služby (bez prepravy odpadu)","Tovar; Služba","","https://portal.eks.sk/SpravaKniznice/OpisneFormulareKniznice/VerejnyDetailOpisnehoFormularaKniznice/209690","0","0",
"OF-209691","Po karanténe","Nákup a dodávka kancelárskych potrieb","papier, euroobaly, šanóny, rýchloviazače, ...","30192000-1 Kancelárske potreby; 60000000-8 Dopravné služby (bez prepravy odpadu)","Tovar; Služba","","https://portal.eks.sk/SpravaKniznice/OpisneFormulareKniznice/VerejnyDetailOpisnehoFormularaKniznice/209691","0","0",
"OF-209692","Po karanténe","Kolaboračná platforma Microsoft Office 365 cez program CSP","Office 365","48223000-7 Softvérový balík pre elektronickú poštu; 48920000-3 Softvérový balík na automatizáciu kancelárskych prác","Tovar; Služba","","https://portal.eks.sk/SpravaKniznice/OpisneFormulareKniznice/VerejnyDetailOpisnehoFormularaKniznice/209692","0","0",
"OF-209695","Po karanténe","Príprava novej kampane  pre podávanie žiadostí prostredníctvom IS GSAA","Softvér, konfigurácia, implementácia, migrácia, databáza","72265000-0 Konfigurovanie softvéru; 72263000-6 Implementácia softvéru","Služba","","https://portal.eks.sk/SpravaKniznice/OpisneFormulareKniznice/VerejnyDetailOpisnehoFormularaKniznice/209695","1","0",
"OF-209696","Po karanténe","Originálne Tonery","Originálne tonery a náplne v originálnych baleniach, náplne do tlačiarní a multifunkčných zariadení","30125120-8 Toner do fotokopírovacích strojov; 30125110-5 Toner do laserových tlačiarní/faxových prístrojov; 30125100-2 Tonerové náplne; 60000000-8 Dopravné služby (bez prepravy odpadu)","Tovar; Služba","","https://portal.eks.sk/SpravaKniznice/OpisneFormulareKniznice/VerejnyDetailOpisnehoFormularaKniznice/209696","1","0",
"OF-209697","Po karanténe","Čistiace prostriedky","šampón, handry, saponáty, krémy,","39800000-0 Čistiace a leštiace výrobky; 33711610-6 Šampóny; 39525800-6 Handry na čistenie; 39831200-8 Saponáty; 33711540-4 Nefarmaceutické krémy alebo telové mlieka; 60000000-8 Dopravné služby (bez prepravy odpadu)","Tovar; Služba","","https://portal.eks.sk/SpravaKniznice/OpisneFormulareKniznice/VerejnyDetailOpisnehoFormularaKniznice/209697","0","0",
"OF-209698","Po karanténe","LED stolné lampy","LED stolná lampa","39700000-9 Spotrebiče pre domácnosť; 31520000-7 Lampy/svietidlá a príslušenstvo k nim; 60000000-8 Dopravné služby (bez prepravy odpadu)","Tovar; Služba","","https://portal.eks.sk/SpravaKniznice/OpisneFormulareKniznice/VerejnyDetailOpisnehoFormularaKniznice/209698","1","0",
"OF-209699","Po karanténe","Laboratórny materiál","Laboratórne pomôcky, špičky","33790000-4 Laboratórny, zdravotnícky alebo farmaceutický sklenený tovar; 60000000-8 Dopravné služby (bez prepravy odpadu)","Tovar; Služba","","https://portal.eks.sk/SpravaKniznice/OpisneFormulareKniznice/VerejnyDetailOpisnehoFormularaKniznice/209699","0","0",
"OF-209700","Po karanténe","Reklamné predmety „eTwinning“","eTwinning, propagácia","22460000-2 Obchodno-reklamný materiál, komerčné katalógy a príručky; 60000000-8 Dopravné služby (bez prepravy odpadu)","Tovar; Služba","","https://portal.eks.sk/SpravaKniznice/OpisneFormulareKniznice/VerejnyDetailOpisnehoFormularaKniznice/209700","0","0",
"OF-209701","Po karanténe","Centrálny monitorovací systém (centrálna stanica a monitor vitálnych funkcií – 15 ks)","monitorovací systém,","33195200-5 Centrálne monitorovacie stanice; 33195100-4 Monitory; 33195000-3 Systém monitorovania pacientov; 60000000-8 Dopravné služby (bez prepravy odpadu)","Tovar; Služba","","https://portal.eks.sk/SpravaKniznice/OpisneFormulareKniznice/VerejnyDetailOpisnehoFormularaKniznice/209701","0","0",
"OF-209702","Po karanténe","Odvoz a likvidácia nebezpečného odpadu","Nebezpečný odpad,","90500000-2 Služby súvisiace s likvidáciou odpadu a odpadom; 90520000-8 Služby súvisiace s rádioaktívnym, toxickým, zdravotníckym a nebezpečným odpadom","Služba","","https://portal.eks.sk/SpravaKniznice/OpisneFormulareKniznice/VerejnyDetailOpisnehoFormularaKniznice/209702","1","0",
"OF-209703","Po karanténe","Mobilná klimatizácia s príslušenstvom","klimatizácia","42512000-8 Klimatizačné zariadenia; 39717200-3 Klimatizačné spotrebiče; 39717000-1 Ventilátory a klimatizačné spotrebiče; 42510000-4 Výmenníky tepla, klimatizačné a chladiace zariadenia a filtračné stroje; 60000000-8 Dopravné služby (bez prepravy odpadu)","Tovar; Služba","","https://portal.eks.sk/SpravaKniznice/OpisneFormulareKniznice/VerejnyDetailOpisnehoFormularaKniznice/209703","1","0",
"OF-209704","Po karanténe","Sklápač 16 t","úžitkové motorové vozidlo, nákladné vozidlo","34134200-7 Nákladné vozidlá s vyklápaním; 60000000-8 Dopravné služby (bez prepravy odpadu)","Tovar; Služba","","https://portal.eks.sk/SpravaKniznice/OpisneFormulareKniznice/VerejnyDetailOpisnehoFormularaKniznice/209704","0","0",
"OF-209705","Po karanténe","Tlač novín","tlač, noviny","79810000-5 Tlačiarenské služby; 79823000-9 Tlačiarenské a doručovateľské služby; 60000000-8 Dopravné služby (bez prepravy odpadu); 79920000-9 Balenie a súvisiace služby","Služba","","https://portal.eks.sk/SpravaKniznice/OpisneFormulareKniznice/VerejnyDetailOpisnehoFormularaKniznice/209705","0","0",
"OF-209707","Po karanténe","Sušiaci a skladovací kabinet ","Sušiaci a skladovací kabinet, endoskopy","33168000-5 Endoskopia, endochirurgické prístroje; 39173000-5 Skladovacie jednotky; 60000000-8 Dopravné služby (bez prepravy odpadu)","Tovar; Služba","","https://portal.eks.sk/SpravaKniznice/OpisneFormulareKniznice/VerejnyDetailOpisnehoFormularaKniznice/209707","0","0",
"OF-209708","Po karanténe","Pranie a chemické čistenie","pranie, chemické čistenie","98310000-9 Pranie a chemické čistenie; 98311000-6 Zber bielizne; 98312000-3 Čistenie textilu; 98312100-4 Impregnovanie textilu; 98315000-4 Žehlenie; 60000000-8 Dopravné služby (bez prepravy odpadu)","Služba","","https://portal.eks.sk/SpravaKniznice/OpisneFormulareKniznice/VerejnyDetailOpisnehoFormularaKniznice/209708","1","0",
"OF-209709","Po karanténe","Rohovkový topograf- analyzátor predného segmentu","tonometer, analyzátor","33120000-7 Záznamové systémy a vyšetrovacie prístroje; 60000000-8 Dopravné služby (bez prepravy odpadu)","Tovar; Služba","","https://portal.eks.sk/SpravaKniznice/OpisneFormulareKniznice/VerejnyDetailOpisnehoFormularaKniznice/209709","0","0",
"OF-209710","Po karanténe","Pranie a chemické čistenie","pranie, chemické čistenie","98310000-9 Pranie a chemické čistenie; 98311000-6 Zber bielizne; 98312000-3 Čistenie textilu; 98312100-4 Impregnovanie textilu; 98315000-4 Žehlenie; 60000000-8 Dopravné služby (bez prepravy odpadu)","Služba","","https://portal.eks.sk/SpravaKniznice/OpisneFormulareKniznice/VerejnyDetailOpisnehoFormularaKniznice/209710","1","0",
"OF-209711","Po karanténe","Chemikálie a laboratórny materiál ","agar, indikátor, lieh, petriho miska, pipetovacie špičky","24000000-4 Chemické výrobky; 24322000-7 Alkoholy, fenoly, fenolalkholy a ich halogén-, sulfo-, nitro- alebo nitrozoderiváty; priemyselné mastné alkoholy; 19520000-7 Plastové výrobky; 38437000-7 Laboratórne pipety a príslušenstvo; 60000000-8 Dopravné služby (bez prepravy odpadu)","Tovar; Služba","","https://portal.eks.sk/SpravaKniznice/OpisneFormulareKniznice/VerejnyDetailOpisnehoFormularaKniznice/209711","0","0",
"OF-209712","Po karanténe","Stravné poukážky","stravné poukážky, stravné, poukážky","30199770-8 Stravné poukážky; 60000000-8 Dopravné služby (bez prepravy odpadu)","Tovar; Služba","","https://portal.eks.sk/SpravaKniznice/OpisneFormulareKniznice/VerejnyDetailOpisnehoFormularaKniznice/209712","1","0",
"OF-209713","Po karanténe","Pranie a chemické čistenie","pranie, chemické čistenie","98310000-9 Pranie a chemické čistenie; 98311000-6 Zber bielizne; 98312000-3 Čistenie textilu; 98312100-4 Impregnovanie textilu; 98315000-4 Žehlenie; 60000000-8 Dopravné služby (bez prepravy odpadu)","Služba","","https://portal.eks.sk/SpravaKniznice/OpisneFormulareKniznice/VerejnyDetailOpisnehoFormularaKniznice/209713","1","0",
"OF-209715","Po karanténe","Pranie a chemické čistenie","pranie, chemické čistenie","98310000-9 Pranie a chemické čistenie; 98311000-6 Zber bielizne; 98312000-3 Čistenie textilu; 98312100-4 Impregnovanie textilu; 98315000-4 Žehlenie; 60000000-8 Dopravné služby (bez prepravy odpadu)","Služba","","https://portal.eks.sk/SpravaKniznice/OpisneFormulareKniznice/VerejnyDetailOpisnehoFormularaKniznice/209715","1","0",
"OF-209716","Po karanténe","Pranie a chemické čistenie","pranie, chemické čistenie","98310000-9 Pranie a chemické čistenie; 98311000-6 Zber bielizne; 98312000-3 Čistenie textilu; 98312100-4 Impregnovanie textilu; 98315000-4 Žehlenie; 60000000-8 Dopravné služby (bez prepravy odpadu)","Služba","","https://portal.eks.sk/SpravaKniznice/OpisneFormulareKniznice/VerejnyDetailOpisnehoFormularaKniznice/209716","1","0",
"OF-209718","Po karanténe","Pranie a chemické čistenie","pranie, chemické čistenie","98310000-9 Pranie a chemické čistenie; 98311000-6 Zber bielizne; 98312000-3 Čistenie textilu; 98312100-4 Impregnovanie textilu; 98315000-4 Žehlenie; 60000000-8 Dopravné služby (bez prepravy odpadu)","Služba","","https://portal.eks.sk/SpravaKniznice/OpisneFormulareKniznice/VerejnyDetailOpisnehoFormularaKniznice/209718","1","0",
"OF-209720","Po karanténe","Mäso a mäsové výrobky","mäso, bravčové, hovädzie, chladené, mäsové výrobky","15110000-2 Mäso; 15111100-0 Hovädzie mäso; 15113000-3 Bravčové mäso; 15130000-8 Mäsové výrobky; 60000000-8 Dopravné služby (bez prepravy odpadu); 15112000-6 Hydina; 15112100-7 Čerstvá hydina","Tovar; Služba","","https://portal.eks.sk/SpravaKniznice/OpisneFormulareKniznice/VerejnyDetailOpisnehoFormularaKniznice/209720","0","0",
"OF-209721","Po karanténe","Tenisové rakety","tenisové rakety","37452730-7 Tenisové rakety; 60000000-8 Dopravné služby (bez prepravy odpadu)","Tovar; Služba","","https://portal.eks.sk/SpravaKniznice/OpisneFormulareKniznice/VerejnyDetailOpisnehoFormularaKniznice/209721","0","0",
"OF-209722","Po karanténe","Chemikálie pre imunohistochemické metódy (IHC)","revitalizačný roztok En Vision FLEX Target Retrieval Solution, Low pH (50 x ), chromogen En V FLX  HRP Magenta Subs-Chrom Sys Omnis, primárna protilátka Mo a Hu CD68, Clone PG-M1, primárna protilátka Mo a Hu CD34 Class II, Clone QBEnd","24000000-4 Chemické výrobky; 33694000-1 Diagnostické činidlá; 33124110-9 Diagnostické systémy; 60000000-8 Dopravné služby (bez prepravy odpadu)","Tovar; Služba","","https://portal.eks.sk/SpravaKniznice/OpisneFormulareKniznice/VerejnyDetailOpisnehoFormularaKniznice/209722","1","0",
"OF-209723","Po karanténe","Liečivá používané pri cukrovke 1.časť","liek, liečivá","33615000-4 Liečivá používané pri cukrovke; 60000000-8 Dopravné služby (bez prepravy odpadu)","Tovar; Služba","","https://portal.eks.sk/SpravaKniznice/OpisneFormulareKniznice/VerejnyDetailOpisnehoFormularaKniznice/209723","1","0",
"OF-209724","Po karanténe","Liečivá používané pri cukrovke 2.časť","liek, liečivá","33615000-4 Liečivá používané pri cukrovke; 60000000-8 Dopravné služby (bez prepravy odpadu)","Tovar; Služba","","https://portal.eks.sk/SpravaKniznice/OpisneFormulareKniznice/VerejnyDetailOpisnehoFormularaKniznice/209724","1","0",
"OF-209729","Po karanténe","Kontajnery na separovaný odpad","kontajner, separovaný odpad","44619000-2 Iné kontajnery; 44613800-8 Kontajnery na odpadový materiál; 44613600-6 Kontajnery na kolesách; 34928480-6 Kontajnery a nádoby na odpad a odpadky; 60000000-8 Dopravné služby (bez prepravy odpadu)","Tovar; Služba","","https://portal.eks.sk/SpravaKniznice/OpisneFormulareKniznice/VerejnyDetailOpisnehoFormularaKniznice/209729","1","0",
"OF-209730","Po karanténe","Stravné lístky","stravné poukážky, stravné lístky, dodanie stravných lístkov","30199770-8 Stravné poukážky; 60000000-8 Dopravné služby (bez prepravy odpadu)","Tovar; Služba","","https://portal.eks.sk/SpravaKniznice/OpisneFormulareKniznice/VerejnyDetailOpisnehoFormularaKniznice/209730","0","0",
"OF-209732","Po karanténe","Xerografický valec","tonery do laserových tlačiarní, tonery do multifunkčných zariadení","30125110-5 Toner do laserových tlačiarní/faxových prístrojov; 60000000-8 Dopravné služby (bez prepravy odpadu)","Tovar; Služba","","https://portal.eks.sk/SpravaKniznice/OpisneFormulareKniznice/VerejnyDetailOpisnehoFormularaKniznice/209732","1","0",
"OF-209733","Po karanténe","Diagnostiká","diagnostiká","33141625-7 Diagnostické súpravy; 33694000-1 Diagnostické činidlá; 60000000-8 Dopravné služby (bez prepravy odpadu)","Tovar; Služba","","https://portal.eks.sk/SpravaKniznice/OpisneFormulareKniznice/VerejnyDetailOpisnehoFormularaKniznice/209733","1","0",
"OF-209734","Po karanténe","Nábytkové a spojovacie kovanie, výsuvy, zámky, vložky   ","výsuv, zámok, rozeta, nábytkové koliesko","44523000-2 Pánty, kovanie a drobné príslušenstvo; 44521110-2 Dverové zámky; 60000000-8 Dopravné služby (bez prepravy odpadu)","Tovar; Služba","","https://portal.eks.sk/SpravaKniznice/OpisneFormulareKniznice/VerejnyDetailOpisnehoFormularaKniznice/209734","1","0",
"OF-209737","Po karanténe","Chemikálie čistoty p.a 2020","Chemikálie anorganické a organické, chemikálie čistoty p.a, laboratórne činidlá,anorganické kyseliny a zlúčeniny,kyseliny","24300000-7 Základné anorganické a organické chemikálie; 24310000-0 Základné anorganické chemikálie; 24311000-7 Chemické prvky, anorganické kyseliny a zlúčeniny; 24320000-3 Základné organické chemikálie; 60000000-8 Dopravné služby (bez prepravy odpadu)","Tovar; Služba","","https://portal.eks.sk/SpravaKniznice/OpisneFormulareKniznice/VerejnyDetailOpisnehoFormularaKniznice/209737","0","0",
"OF-209742","Po karanténe","Kancelárske potreby","kancelárske potreby","30192000-1 Kancelárske potreby; 60000000-8 Dopravné služby (bez prepravy odpadu)","Tovar; Služba","","https://portal.eks.sk/SpravaKniznice/OpisneFormulareKniznice/VerejnyDetailOpisnehoFormularaKniznice/209742","1","0",
"OF-209743","Po karanténe","Analytický softvér SAS Visual Analytics","softvér, analytický, štatistika, BI, self service BI, explorácia dát, reporty, SAS, Visual Analytics, interaktívne dashboardy, mobilné BI","48460000-0 Analytický, vedecký, matematický a prognostický softvérový balík; 48461000-7 Analytický alebo vedecký softvérový balík; 48462000-4 Matematický alebo prognostický softvérový balík; 48463000-1 Softvérový balík pre štatistiku; 48480000-6 Softvérový balík pre predaj, marketing a business intelligence; 48482000-0 Softvérový balík pre business intelligence; 60000000-8 Dopravné služby (bez prepravy odpadu)","Tovar; Služba","","https://portal.eks.sk/SpravaKniznice/OpisneFormulareKniznice/VerejnyDetailOpisnehoFormularaKniznice/209743","0","0",
"OF-209744","Po karanténe","Originálne atramentové a tonerové náplne","atrament, atramentové náplne, tonerové náplne","30192113-6 Atramentové náplne; 60000000-8 Dopravné služby (bez prepravy odpadu); 30125100-2 Tonerové náplne","Tovar; Služba","","https://portal.eks.sk/SpravaKniznice/OpisneFormulareKniznice/VerejnyDetailOpisnehoFormularaKniznice/209744","1","0",
"OF-209745","Po karanténe","Dezinfekčné prostriedky","Dezinfekcia plôch, povrchov, nástrojov, rúk a pokožky","24455000-8 Dezinfekčné prostriedky; 33740000-9 Výrobky na starostlivosť o ruky a nechty; 60000000-8 Dopravné služby (bez prepravy odpadu)","Tovar; Služba","","https://portal.eks.sk/SpravaKniznice/OpisneFormulareKniznice/VerejnyDetailOpisnehoFormularaKniznice/209745","0","0",
"OF-209747","Po karanténe","Diagnostiká","diagnostiká","33141625-7 Diagnostické súpravy; 33694000-1 Diagnostické činidlá; 60000000-8 Dopravné služby (bez prepravy odpadu)","Tovar; Služba","","https://portal.eks.sk/SpravaKniznice/OpisneFormulareKniznice/VerejnyDetailOpisnehoFormularaKniznice/209747","1","0",
"OF-209748","Po karanténe","Kancelárske potreby","Kancelárske potreby","30192000-1 Kancelárske potreby; 60000000-8 Dopravné služby (bez prepravy odpadu)","Tovar; Služba","","https://portal.eks.sk/SpravaKniznice/OpisneFormulareKniznice/VerejnyDetailOpisnehoFormularaKniznice/209748","0","0",
"OF-209750","Po karanténe","Dezinfekčné prostriedky","Dezinfekcia plôch, povrchov, nástrojov, rúk a pokožky","24455000-8 Dezinfekčné prostriedky; 33740000-9 Výrobky na starostlivosť o ruky a nechty; 60000000-8 Dopravné služby (bez prepravy odpadu)","Tovar; Služba","","https://portal.eks.sk/SpravaKniznice/OpisneFormulareKniznice/VerejnyDetailOpisnehoFormularaKniznice/209750","0","0",
"OF-209753","Po karanténe","Virkon S 50g","virocídny dezinfekčný prípravok","24000000-4 Chemické výrobky; 60000000-8 Dopravné služby (bez prepravy odpadu)","Tovar; Služba","","https://portal.eks.sk/SpravaKniznice/OpisneFormulareKniznice/VerejnyDetailOpisnehoFormularaKniznice/209753","1","0",
"OF-209754","Po karanténe","Plastové vrecia na odpad","veľké vrecia na odpad, malé vrecia do košov","18930000-7 Vrecia a vaky; 60000000-8 Dopravné služby (bez prepravy odpadu)","Tovar; Služba","","https://portal.eks.sk/SpravaKniznice/OpisneFormulareKniznice/VerejnyDetailOpisnehoFormularaKniznice/209754","1","0",
"OF-209758","Po karanténe","Ventilátor na umelú pľúcnu ventiláciu pre novorodencov","Servoventilátor, zdravotnícke prístroje, ventilátor na umelú ventiláciu pľúc,  univerzálny dýchací prístroj","33157400-9 Lekárske dýchacie prístroje; 51410000-9 Inštalácia lekárskych zariadení; 60000000-8 Dopravné služby (bez prepravy odpadu)","Tovar; Služba","","https://portal.eks.sk/SpravaKniznice/OpisneFormulareKniznice/VerejnyDetailOpisnehoFormularaKniznice/209758","1","0",
"OF-209759","Po karanténe","Poskytovanie služieb spojených s údržbou a rozvojom IS Depozity","poskytovanie služby, údržba a rozvoj IS","72267100-0 Údržba programového vybavenia (softvér) informačných technológií; 60000000-8 Dopravné služby (bez prepravy odpadu)","Služba","","https://portal.eks.sk/SpravaKniznice/OpisneFormulareKniznice/VerejnyDetailOpisnehoFormularaKniznice/209759","1","0",
"OF-209760","Po karanténe","Základné a dlhodobo skladovateľné potraviny","Dodávka potravín pre stravovacie zariadenie, cestoviny, koreniny, nápoje, pochutiny, sterilizované potraviny, kompóty, šaláty","15000000-8 Potraviny, nápoje, tabak a príbuzné produkty; 15600000-4 Mlynské výrobky, škrob a škrobové výrobky; 15820000-2 Sucháre a piškóty; trvanlivé pečivo a cukrovinky; 15830000-5 Cukor a jemu príbuzné výrobky; 15840000-8 Kakao; čokoláda a cukrovinky; 15850000-1 Cestoviny; 15860000-4 Káva, čaj a príbuzné produkty; 15870000-7 Koreniny a chuťové prísady; 15897200-4 Výrobky v konzerve; 15240000-2 Ryby v konzerve a inak pripravené alebo konzervované ryby; 15331400-1 Nakladaná a/alebo konzervovaná zelenina; 15332200-6 Džemy a marmelády, ovocné želé; ovocné alebo orechové pyré a pasty/pretlaky; 15400000-2 Živočíšne alebo rastlinné oleje a tuky; 60000000-8 Dopravné služby (bez prepravy odpadu)","Tovar; Služba","","https://portal.eks.sk/SpravaKniznice/OpisneFormulareKniznice/VerejnyDetailOpisnehoFormularaKniznice/209760","0","0",
"OF-209761","Po karanténe","Čistiace, leštiace a hygienické prostriedky","čistenie, umývanie, leštenie, hygiena, čistiace prostriedky","39800000-0 Čistiace a leštiace výrobky; 39831300-9 Čistiace prostriedky na podlahu; 39832000-3 Čistiace prostriedky na riad; 39813000-4 Brúsne pasty a prášky; 39832100-4 Čistiaci prášok na riad; 39831600-2 Čistiace prostriedky na toalety; 60000000-8 Dopravné služby (bez prepravy odpadu)","Tovar; Služba","","https://portal.eks.sk/SpravaKniznice/OpisneFormulareKniznice/VerejnyDetailOpisnehoFormularaKniznice/209761","0","0",
"OF-209763","Po karanténe","Plechové šatňové skrinky pre žiakov","skrinky","39100000-3 Nábytok; 39151000-5 Rozličný nábytok; 45212230-7 Inštalovanie prezliekarní; 39143121-0 Šatníky; 60000000-8 Dopravné služby (bez prepravy odpadu)","Tovar; Služba","","https://portal.eks.sk/SpravaKniznice/OpisneFormulareKniznice/VerejnyDetailOpisnehoFormularaKniznice/209763","1","0",
"OF-209768","Po karanténe","Čistiace, dezinfekčné, umývacie, pracie prostriedky a hygienické potreby","Čistiace prostriedky, dezinfekčné prostriedky, umývacie prostriedky, odmasťovacie prostriedky, prostriedky na odstraňovanie vodného kameňa, gumové rukavice, handry,","39800000-0 Čistiace a leštiace výrobky; 39831300-9 Čistiace prostriedky na podlahu; 39831600-2 Čistiace prostriedky na toalety; 39832000-3 Čistiace prostriedky na riad; 39830000-9 Čistiace výrobky; 39832100-4 Čistiaci prášok na riad; 39831220-4 Odmasťovacie prostriedky; 39831000-6 Pracie prostriedky; 39831200-8 Saponáty; 39831210-1 Saponáty na umývanie riadu; 39542000-3 Handry; 18141000-9 Pracovné rukavice","Tovar; Služba","","https://portal.eks.sk/SpravaKniznice/OpisneFormulareKniznice/VerejnyDetailOpisnehoFormularaKniznice/209768","1","0",
