"OpisnyFormularIdentifikator","OpisnyFormularStav","OpisnyFormularNazov","OpisnyFormularKlucoveSlova","OpisnyFormularCpv","OpisnyFormularDruh","OpisnyFormularKategoriaSluzieb","OpisnyFormularUrl","OpisnyFormularPocetVyhlasenychZakaziek","OpisnyFormularObchodovanaSumaBezDPH",
"OF-184366","Po karanténe","chlieb a pekárenské výrobky","chlieb, pečivo, pekárenské výrobky","15612500-6 Pekárske výrobky; 15811100-7 Chlieb; 15813000-0 Raňajkové pečivo; 15812100-4 Pečivo; 60000000-8 Dopravné služby (bez prepravy odpadu)","Tovar; Služba","","https://portal.eks.sk/SpravaKniznice/OpisneFormulareKniznice/VerejnyDetailOpisnehoFormularaKniznice/184366","1","0",
"OF-184389","Po karanténe","Nákup pečiva","pečivo","15612500-6 Pekárske výrobky; 60000000-8 Dopravné služby (bez prepravy odpadu)","Tovar; Služba","","https://portal.eks.sk/SpravaKniznice/OpisneFormulareKniznice/VerejnyDetailOpisnehoFormularaKniznice/184389","1","0",
"OF-184223","Po karanténe","Kancelárske potreby","Kancelárske potreby","30190000-7 Rôzne kancelárske zariadenia a kancelárske potreby; 30192000-1 Kancelárske potreby; 60000000-8 Dopravné služby (bez prepravy odpadu); 39800000-0 Čistiace a leštiace výrobky","Tovar; Služba","","https://portal.eks.sk/SpravaKniznice/OpisneFormulareKniznice/VerejnyDetailOpisnehoFormularaKniznice/184223","1","0",
"OF-184123","Po karanténe","Originálne tonery.","Tonery do laserových tlačiarní, Tonery do kopírovacích strojov, Originálne tonery.","30125100-2 Tonerové náplne; 30125120-8 Toner do fotokopírovacích strojov; 30125110-5 Toner do laserových tlačiarní/faxových prístrojov; 90510000-5 Likvidácia a spracovanie odpadu; 60000000-8 Dopravné služby (bez prepravy odpadu)","Tovar; Služba","","https://portal.eks.sk/SpravaKniznice/OpisneFormulareKniznice/VerejnyDetailOpisnehoFormularaKniznice/184123","1","0",
"OF-184262","Po karanténe","Výroba a dodanie propagačných pier","pero, potlač","39294100-0 Informačné a propagačné výrobky; 79800000-2 Tlačiarenské a príbuzné služby; 60000000-8 Dopravné služby (bez prepravy odpadu)","Tovar; Služba","","https://portal.eks.sk/SpravaKniznice/OpisneFormulareKniznice/VerejnyDetailOpisnehoFormularaKniznice/184262","1","0",
"OF-183993","Po karanténe","Stolový PC s príslušenstvom pre MŠ_155","osobný počítať","30213000-5 Osobné počítače; 60000000-8 Dopravné služby (bez prepravy odpadu)","Tovar; Služba","","https://portal.eks.sk/SpravaKniznice/OpisneFormulareKniznice/VerejnyDetailOpisnehoFormularaKniznice/183993","1","0",
"OF-184279","Po karanténe","Podpora predchádzania vzniku biologicky rozložiteľných komunálnych odpadov v obci ","kompostér, kompostovanie, nádoba na kompost, škatuľa na kompost","34928480-6 Kontajnery a nádoby na odpad a odpadky; 60000000-8 Dopravné služby (bez prepravy odpadu)","Tovar; Služba","","https://portal.eks.sk/SpravaKniznice/OpisneFormulareKniznice/VerejnyDetailOpisnehoFormularaKniznice/184279","1","0",
"OF-182307","Po karanténe","Zabezpečenie stravovania zamestnancov formou stravných poukážok","stravovanie, stravné poukážky","55520000-1 Služby hromadného stravovania; 30199770-8 Stravné poukážky; 60000000-8 Dopravné služby (bez prepravy odpadu)","Služba","","https://portal.eks.sk/SpravaKniznice/OpisneFormulareKniznice/VerejnyDetailOpisnehoFormularaKniznice/182307","1","0",
"OF-184176","Po karanténe","Stavebný materiál","stavebné lepidlo, škárovacia hmota, penetrácia","44111000-1 Stavebné materiály; 60000000-8 Dopravné služby (bez prepravy odpadu)","Tovar; Služba","","https://portal.eks.sk/SpravaKniznice/OpisneFormulareKniznice/VerejnyDetailOpisnehoFormularaKniznice/184176","1","0",
"OF-184062","Po karanténe","Bezdrôtový ručný mikrofón pre MŠ_148","mikrofón","32341000-5 Mikrofóny; 37315000-9 Elektrické hudobné nástroje; 60000000-8 Dopravné služby (bez prepravy odpadu)","Tovar; Služba","","https://portal.eks.sk/SpravaKniznice/OpisneFormulareKniznice/VerejnyDetailOpisnehoFormularaKniznice/184062","1","0",
"OF-184311","Po karanténe","Nákup Wyse terminálov","Wyse terminál","30214000-2 Pracovné stanice","Tovar; Služba","","https://portal.eks.sk/SpravaKniznice/OpisneFormulareKniznice/VerejnyDetailOpisnehoFormularaKniznice/184311","1","0",
"OF-184397","Po karanténe","Pranie nemocničnej bielizne","pranie bielizne, dezinfekcia, žehlenie","98310000-9 Pranie a chemické čistenie; 98311000-6 Zber bielizne; 98315000-4 Žehlenie; 60000000-8 Dopravné služby (bez prepravy odpadu)","Služba","","https://portal.eks.sk/SpravaKniznice/OpisneFormulareKniznice/VerejnyDetailOpisnehoFormularaKniznice/184397","1","0",
"OF-184394","Po karanténe","Čistiace a hygienické potreby","Čistiace potreby","39831200-8 Saponáty; 39831210-1 Saponáty na umývanie riadu; 39831300-9 Čistiace prostriedky na podlahu; 39832000-3 Čistiace prostriedky na riad; 39830000-9 Čistiace výrobky; 39831600-2 Čistiace prostriedky na toalety; 39525800-6 Handry na čistenie; 24455000-8 Dezinfekčné prostriedky; 60000000-8 Dopravné služby (bez prepravy odpadu)","Tovar; Služba","","https://portal.eks.sk/SpravaKniznice/OpisneFormulareKniznice/VerejnyDetailOpisnehoFormularaKniznice/184394","1","0",
"OF-184280","Po karanténe","odborné prehliadky a oprava EPS","odborné prehliadky a oprava EPS","50413200-5 Opravy a údržba protipožiarnych zariadení; 60000000-8 Dopravné služby (bez prepravy odpadu)","Služba","","https://portal.eks.sk/SpravaKniznice/OpisneFormulareKniznice/VerejnyDetailOpisnehoFormularaKniznice/184280","1","0",
"OF-184211","Po karanténe","Spotrebný tovar, náhradné diely, príslušenstvo a doplnkový tovar k PC","myš, kábel, adapter","30230000-0 Zariadenia súvisiace s počítačmi; 30237000-9 Časti a príslušenstvo počítačov a spotrebný materiál k nim; 60000000-8 Dopravné služby (bez prepravy odpadu)","Tovar; Služba","","https://portal.eks.sk/SpravaKniznice/OpisneFormulareKniznice/VerejnyDetailOpisnehoFormularaKniznice/184211","1","0",
"OF-184111","Po karanténe","Výpočtová technika","Notebook,tablet","30213000-5 Osobné počítače; 30213100-6 Prenosné počítače; 30213200-7 Tabletový počítač; 60000000-8 Dopravné služby (bez prepravy odpadu)","Tovar; Služba","","https://portal.eks.sk/SpravaKniznice/OpisneFormulareKniznice/VerejnyDetailOpisnehoFormularaKniznice/184111","1","0",
"OF-184380","Po karanténe","  Nákup laserových tonerov  2","tonery","30125110-5 Toner do laserových tlačiarní/faxových prístrojov; 30125100-2 Tonerové náplne; 60000000-8 Dopravné služby (bez prepravy odpadu)","Tovar; Služba","","https://portal.eks.sk/SpravaKniznice/OpisneFormulareKniznice/VerejnyDetailOpisnehoFormularaKniznice/184380","1","0",
"OF-184094","Po karanténe","Dodávka potravín pre stravovacie zriadenie 2019 Mierovo","trvanlivé potraviny, koreniny, konzervy","15000000-8 Potraviny, nápoje, tabak a príbuzné produkty; 03117200-6 Semená rastlín používané v konkrétnych odvetviach; 15241000-9 Nakladané ryby alebo ryby v konzerve; 15242000-6 Pripravené pokrmy z rýb; 15321100-5 Pomarančová šťava; 15321600-0 Jablková šťava; 15321800-2 Koncentrované šťavy; 15332412-5 Spracované hrozienka; 15820000-2 Sucháre a piškóty; trvanlivé pečivo a cukrovinky; 15831200-4 Biely cukor; 15831500-7 Cukrové sirupy; 15831600-8 Med; 15841300-8 Nesladený kakaový prášok; 15842100-3 Čokoláda; 15842200-4 Čokoládové výrobky; 15861100-2 Pražená káva; 15864100-3 Porciovaný čaj; 15871210-9 Sójová omáčka; 15871250-1 Horčica; 15871260-4 Omáčky; 15872100-2 Paprika; 15872200-3 Korenie; 15872300-4 Bylinky; 15891100-1 Mäsové polievky; 15891500-5 Bujóny; 15891900-9 Zeleninové polievky; 15894300-4 Pripravené pokrmy; 15131310-1 Paštéta; 15897200-4 Výrobky v konzerve; 15898000-9 Droždie; 60000000-8 Dopravné služby (bez prepravy odpadu); 15321700-1 Zmesi nekoncentrovaných štiav","Tovar; Služba","","https://portal.eks.sk/SpravaKniznice/OpisneFormulareKniznice/VerejnyDetailOpisnehoFormularaKniznice/184094","1","5810,830",
"OF-184329","Po karanténe","Mobilné zdvíhacie zariadenie pre imobilných pacientov","elektrický zdvihák","33192600-8 Zdvíhacie zariadenie pre zdravotnícke odvetvie; 60000000-8 Dopravné služby (bez prepravy odpadu)","Tovar; Služba","","https://portal.eks.sk/SpravaKniznice/OpisneFormulareKniznice/VerejnyDetailOpisnehoFormularaKniznice/184329","1","0",
"OF-184429","Po karanténe","Stravné poukážky","Stravné lístky, dodávka stravných poukážok","30199770-8 Stravné poukážky; 60000000-8 Dopravné služby (bez prepravy odpadu)","Tovar; Služba","","https://portal.eks.sk/SpravaKniznice/OpisneFormulareKniznice/VerejnyDetailOpisnehoFormularaKniznice/184429","1","0",
"OF-184326","Po karanténe","Regulačný ventil SIEMENS VVF53.15-3,2 alebo ekvivalent","Regulačný ventil, prírubový ventil, ventil","42131140-9 Redukčné tlakové, riadiace, kontrolné a bezpečnostné ventily; 42131141-6 Redukčné tlakové ventily; 42130000-9 Výpusty, kohúty, ventily a podobné príslušenstvo; 60000000-8 Dopravné služby (bez prepravy odpadu)","Tovar; Služba","","https://portal.eks.sk/SpravaKniznice/OpisneFormulareKniznice/VerejnyDetailOpisnehoFormularaKniznice/184326","1","0",
"OF-184226","Po karanténe","Chemikálie, laboratórny a zdravotnícky materiál ","skúmavky s uzáverom, pipetovacie špičky, injekčné striekačky, Eliza kity, protilátky ","19520000-7 Plastové výrobky; 33192500-7 Skúmavky; 24950000-8 Špecializované chemické výrobky; 33141310-6 Injekčné striekačky; 33140000-3 Zdravotnícky spotrebný materiál; 60000000-8 Dopravné služby (bez prepravy odpadu)","Tovar; Služba","","https://portal.eks.sk/SpravaKniznice/OpisneFormulareKniznice/VerejnyDetailOpisnehoFormularaKniznice/184226","1","0",
"OF-184212","Po karanténe","Kuchynské stroje a zariadenia","nárezový stroj, nerezové skrinky","39711200-1 Prístroje na spracovanie potravín; 39221000-7 Kuchynské vybavenie; 60000000-8 Dopravné služby (bez prepravy odpadu)","Tovar; Služba","","https://portal.eks.sk/SpravaKniznice/OpisneFormulareKniznice/VerejnyDetailOpisnehoFormularaKniznice/184212","1","0",
"OF-184143","Po karanténe","Tonery - originál","Tonery, náplne do tlačiarní","30125100-2 Tonerové náplne; 30125110-5 Toner do laserových tlačiarní/faxových prístrojov; 30125120-8 Toner do fotokopírovacích strojov; 60000000-8 Dopravné služby (bez prepravy odpadu)","Tovar; Služba","","https://portal.eks.sk/SpravaKniznice/OpisneFormulareKniznice/VerejnyDetailOpisnehoFormularaKniznice/184143","1","0",
"OF-184247","Po karanténe","Prístroje upratovacie","tepovač, vysávač, vysokotlakový čistič","31000000-6 Elektrické stroje, prístroje, zariadenia a spotrebný tovar; osvetlenie; 60000000-8 Dopravné služby (bez prepravy odpadu)","Tovar; Služba","","https://portal.eks.sk/SpravaKniznice/OpisneFormulareKniznice/VerejnyDetailOpisnehoFormularaKniznice/184247","1","0",
"OF-184233","Po karanténe","Dodávka elektrickej energie (r.2019)","Elektrická energia, elektrina, distribúcia elektrickej energie","09310000-5 Elektrická energia; 65300000-6 Rozvod elektriny a súvisiace služby","Tovar; Služba","","https://portal.eks.sk/SpravaKniznice/OpisneFormulareKniznice/VerejnyDetailOpisnehoFormularaKniznice/184233","1","0",
"OF-184190","Po karanténe","Počítač","PC, počítač, AMD Ryzen 5, Windows 10 Pro ","30213000-5 Osobné počítače; 60000000-8 Dopravné služby (bez prepravy odpadu); 30237000-9 Časti a príslušenstvo počítačov a spotrebný materiál k nim","Tovar; Služba","","https://portal.eks.sk/SpravaKniznice/OpisneFormulareKniznice/VerejnyDetailOpisnehoFormularaKniznice/184190","1","0",
"OF-184122","Po karanténe","Originálne tonery.","Tonery do laserových tlačiarní, Tonery do kopírovacích strojov, Originálne tonery.","30125100-2 Tonerové náplne; 30125120-8 Toner do fotokopírovacích strojov; 30125110-5 Toner do laserových tlačiarní/faxových prístrojov; 90510000-5 Likvidácia a spracovanie odpadu; 60000000-8 Dopravné služby (bez prepravy odpadu)","Tovar; Služba","","https://portal.eks.sk/SpravaKniznice/OpisneFormulareKniznice/VerejnyDetailOpisnehoFormularaKniznice/184122","0","0",
"OF-184022","Po karanténe","SW riešenie v oblasti skladového hospodárstva xCost","SW riešenie v oblasti skladového hospodárstva xCost","48219300-9 Softvérový balík pre administratívu; 60000000-8 Dopravné služby (bez prepravy odpadu)","Tovar; Služba","","https://portal.eks.sk/SpravaKniznice/OpisneFormulareKniznice/VerejnyDetailOpisnehoFormularaKniznice/184022","0","0",
"OF-184408","Po karanténe","Stravovanie zamestnancov prostredníctvom elektronických stravných kariet  a stravných lístkov","Elektronické stravné karty, stravné lístky, zabezpečenie hromadného stravovania zamestnancov","55520000-1 Služby hromadného stravovania; 60000000-8 Dopravné služby (bez prepravy odpadu)","Služba; Tovar","","https://portal.eks.sk/SpravaKniznice/OpisneFormulareKniznice/VerejnyDetailOpisnehoFormularaKniznice/184408","0","0",
"OF-184351","Po karanténe","Konzumné zemiaky","Konzumné zemiaky čerstvé","03212100-1 Zemiaky; 60000000-8 Dopravné služby (bez prepravy odpadu)","Tovar; Služba","","https://portal.eks.sk/SpravaKniznice/OpisneFormulareKniznice/VerejnyDetailOpisnehoFormularaKniznice/184351","0","0",
"OF-184165","Po karanténe","Roletová skrinka uzamykateľná","nábytok, skrinka, roleta","39130000-2 Kancelársky nábytok; 60000000-8 Dopravné služby (bez prepravy odpadu)","Tovar; Služba","","https://portal.eks.sk/SpravaKniznice/OpisneFormulareKniznice/VerejnyDetailOpisnehoFormularaKniznice/184165","0","0",
"OF-179342","Po karanténe","Kancelárske a učebné pomôcky","Kancelárske a učebné pomôcky","30192000-1 Kancelárske potreby; 60000000-8 Dopravné služby (bez prepravy odpadu)","Tovar; Služba","","https://portal.eks.sk/SpravaKniznice/OpisneFormulareKniznice/VerejnyDetailOpisnehoFormularaKniznice/179342","0","0",
"OF-183204","Po karanténe","Katétre na centrálne cievne vstupy","PICC katétre, tunelizované centrálne žilové katétre, katetrizačné sety, centrálne venózne katétre, hemodialyzačné katétre, fixácie a k nim prislúchajúci spotrebný materiál, Grip-lock, Huberove ihly, PICC - periferne zavadzany CVK  s rozsirenym prislusenstvom, jednolumenový, chirurgické kožné lepidlo,","33141200-2 Katétre; 33141000-0 Jednorazový nechemický lekársky spotrebný materiál a hematologický spotrebný materiál; 33141112-8 Náplasti; 60000000-8 Dopravné služby (bez prepravy odpadu)","Tovar; Služba","","https://portal.eks.sk/SpravaKniznice/OpisneFormulareKniznice/VerejnyDetailOpisnehoFormularaKniznice/183204","0","0",
"OF-184297","Po karanténe","Lieky ATC L04 - Imunosupresíva (tocilizumab)","Imunosupresíva, tocilizumab","33652300-8 Imunosupresívne činidlá; 60000000-8 Dopravné služby (bez prepravy odpadu)","Tovar; Služba","","https://portal.eks.sk/SpravaKniznice/OpisneFormulareKniznice/VerejnyDetailOpisnehoFormularaKniznice/184297","0","0",
"OF-180539","Po karanténe","KANCELÁRSKE POTREBY","kancelárske potreby, xerox papier, obálky, perá, ceruzky, euroobaly, zakladače, zvýrazňovače, lepiace pásky, spony, dierovače, laminovacie fólie, nožnice","30190000-7 Rôzne kancelárske zariadenia a kancelárske potreby; 30192000-1 Kancelárske potreby; 30192100-2 Vymazávacie potreby (guma, zmizík); 30192125-3 Zvýrazňovače; 30192130-1 Ceruzky; 30192133-2 Strúhadlá na ceruzky; 30192170-3 Nástenky; 30192800-9 Samolepiace etikety; 30192910-3 Korekčný pás alebo páska; 30192920-6 Korekčná tekutina; 30193200-0 Stolové zásobníky alebo organizéry; 30193700-5 Škatuľa na ukladanie spisov; 30197100-7 Sponky, cvočky, pripináčiky; 30197220-4 Spony na papier; 30197330-8 Dierovače; 30197620-8 Písací papier; 30197644-2 Xerografický papier","Tovar","","https://portal.eks.sk/SpravaKniznice/OpisneFormulareKniznice/VerejnyDetailOpisnehoFormularaKniznice/180539","0","0",
"OF-184426","Po karanténe","Dodávka elektrickej energie","elektrická energia, elektrina","09310000-5 Elektrická energia; 65300000-6 Rozvod elektriny a súvisiace služby","Tovar; Služba","","https://portal.eks.sk/SpravaKniznice/OpisneFormulareKniznice/VerejnyDetailOpisnehoFormularaKniznice/184426","0","0",
"OF-184240","Po karanténe","Pekárenské výrobky","chlieb, rožok, vianočka, sladká buchta, bábovka, bageta, droždie, ","15811100-7 Chlieb; 15811200-8 Rožky; 15898000-9 Droždie; 15812100-4 Pečivo; 15612500-6 Pekárske výrobky; 60000000-8 Dopravné služby (bez prepravy odpadu)","Tovar; Služba","","https://portal.eks.sk/SpravaKniznice/OpisneFormulareKniznice/VerejnyDetailOpisnehoFormularaKniznice/184240","0","0",
"OF-184272","Po karanténe","Tonery do tlačiarne Olivetti d-ColorMF2501  a do tlačiarne Hewlett-Packard color LaserJet Pro M452dn","toner","30125100-2 Tonerové náplne; 60000000-8 Dopravné služby (bez prepravy odpadu)","Tovar; Služba","","https://portal.eks.sk/SpravaKniznice/OpisneFormulareKniznice/VerejnyDetailOpisnehoFormularaKniznice/184272","0","0",
"OF-184284","Po karanténe","Dodávka elektrickej energie","Elektrina","09310000-5 Elektrická energia; 09000000-3 Ropné výrobky, palivo, elektrina a ostatné zdroje energie","Tovar; Služba","","https://portal.eks.sk/SpravaKniznice/OpisneFormulareKniznice/VerejnyDetailOpisnehoFormularaKniznice/184284","1","0",
"OF-184207","Po karanténe","Gymnazista IT odborník – hardware","tablet, sieťová prvky, hardvér, server, tlačiareň","30200000-1 Počítačové zariadenia a spotrebný materiál; 32580000-2 Dátové zariadenia; 60000000-8 Dopravné služby (bez prepravy odpadu)","Tovar; Služba","","https://portal.eks.sk/SpravaKniznice/OpisneFormulareKniznice/VerejnyDetailOpisnehoFormularaKniznice/184207","1","0",
"OF-184316","Po karanténe","Dodávka zemného plynu","Zemný plyn","09123000-7 Zemný plyn; 65200000-5 Rozvod plynu a súvisiace služby","Tovar; Služba","","https://portal.eks.sk/SpravaKniznice/OpisneFormulareKniznice/VerejnyDetailOpisnehoFormularaKniznice/184316","1","0",
"OF-184382","Po karanténe","Stravné lístky na rok 2019","Stravné lístky, stravné poukážky, dodanie stravných lístkov,","30199770-8 Stravné poukážky; 60000000-8 Dopravné služby (bez prepravy odpadu)","Tovar; Služba","","https://portal.eks.sk/SpravaKniznice/OpisneFormulareKniznice/VerejnyDetailOpisnehoFormularaKniznice/184382","1","0",
"OF-184314","Po karanténe","Nákup a dodávka hygienických, dezinfekčných a čistiacich prostriedkov","čistenie, dezinfekcia, hygiena","39830000-9 Čistiace výrobky; 39831000-6 Pracie prostriedky; 33760000-5 Toaletný papier, vreckovky, uteráky na ruky a servítky; 60000000-8 Dopravné služby (bez prepravy odpadu)","Tovar; Služba","","https://portal.eks.sk/SpravaKniznice/OpisneFormulareKniznice/VerejnyDetailOpisnehoFormularaKniznice/184314","0","0",
"OF-184050","Po karanténe","Dopravné prostriedky - traktor, čelný nakladač na traktor, jednonápravový príves  ","traktor, čelný nakladač na traktor, jednonápravový príves","16700000-2 Traktory/ťahače; 34390000-7 Príslušenstvo ťahačov/traktorov; 34220000-5 Prívesy, návesy a pojazdné kontajnery; 60000000-8 Dopravné služby (bez prepravy odpadu)","Tovar; Služba","","https://portal.eks.sk/SpravaKniznice/OpisneFormulareKniznice/VerejnyDetailOpisnehoFormularaKniznice/184050","0","0",
"OF-184205","Po karanténe","Chirurgický šijací materiál ","šitie, chirurgické šitie, nite, chirurgický šijací materiál","33141125-2 Materiál na chirurgické zošívanie; 60000000-8 Dopravné služby (bez prepravy odpadu)","Tovar; Služba","","https://portal.eks.sk/SpravaKniznice/OpisneFormulareKniznice/VerejnyDetailOpisnehoFormularaKniznice/184205","0","0",
"OF-184214","Po karanténe","Drevený nábytok - skrine","skriňa, drevený nábytok","39000000-2 Nábytok (vrátane kancelárskeho nábytku), zariadenie interiéru, domáce spotrebiče (s výnimkou osvetlenia) a čistiace prostriedky; 60000000-8 Dopravné služby (bez prepravy odpadu)","Tovar; Služba","","https://portal.eks.sk/SpravaKniznice/OpisneFormulareKniznice/VerejnyDetailOpisnehoFormularaKniznice/184214","0","0",
"OF-183882","Po karanténe","Nábytok kovový","Nábytok kovový","39100000-3 Nábytok; 39132200-8 Kartotékové skrine; 39141300-5 Skrine; 33192000-2 Zdravotnícky nábytok; 60000000-8 Dopravné služby (bez prepravy odpadu)","Tovar; Služba","","https://portal.eks.sk/SpravaKniznice/OpisneFormulareKniznice/VerejnyDetailOpisnehoFormularaKniznice/183882","0","0",
"OF-184148","Po karanténe","Dopravné prostriedky - traktor, čelný nakladač na traktor, jednonápravový príves  ","traktor, čelný nakladač na traktor, jednonápravový príves","16700000-2 Traktory/ťahače; 34390000-7 Príslušenstvo ťahačov/traktorov; 34220000-5 Prívesy, návesy a pojazdné kontajnery; 60000000-8 Dopravné služby (bez prepravy odpadu)","Tovar; Služba","","https://portal.eks.sk/SpravaKniznice/OpisneFormulareKniznice/VerejnyDetailOpisnehoFormularaKniznice/184148","0","0",
"OF-184409","Po karanténe","Tonery","tonery, originálne tonery, kompatibilné tonery","30125120-8 Toner do fotokopírovacích strojov; 30125100-2 Tonerové náplne; 30125110-5 Toner do laserových tlačiarní/faxových prístrojov; 60000000-8 Dopravné služby (bez prepravy odpadu)","Tovar; Služba","","https://portal.eks.sk/SpravaKniznice/OpisneFormulareKniznice/VerejnyDetailOpisnehoFormularaKniznice/184409","0","0",
"OF-183948","Po karanténe","Likvidácia a spracovanie objemného a komunálneho odpadu","odvoz odpadu, likvidácia odpadu, lis na odpad, kontajner","90513200-8 Likvidácia tuhého komunálneho odpadu; 90500000-2 Služby súvisiace s likvidáciou odpadu a odpadom; 90510000-5 Likvidácia a spracovanie odpadu; 90511000-2 Služby na zber odpadu; 90512000-9 Služby na prepravu odpadu; 90513000-6 Služby na spracovanie a likvidáciu nie nebezpečného odpadu; 90513300-9 Služby na spaľovanie odpadu","Služba","","https://portal.eks.sk/SpravaKniznice/OpisneFormulareKniznice/VerejnyDetailOpisnehoFormularaKniznice/183948","0","0",
"OF-184475","Po karanténe","Tonery do laserových tlačiarní a kopírovacích strojov","Tonery, náplne do tlačiarní, tlač","30125110-5 Toner do laserových tlačiarní/faxových prístrojov; 60112000-6 Služby verejnej cestnej dopravy; 60000000-8 Dopravné služby (bez prepravy odpadu)","Tovar; Služba","","https://portal.eks.sk/SpravaKniznice/OpisneFormulareKniznice/VerejnyDetailOpisnehoFormularaKniznice/184475","0","0",
"OF-183582","Po karanténe","Pravidelný servis a prípadné opravy vzduchotechnických a klimatizačných zariadení","oprava, údržba","50730000-1 Opravy a údržba chladiacich zostáv; 50712000-9 Opravy a údržba mechanických zariadení budov; 50711000-2 Opravy a údržba elektrických zariadení budov","Služba","","https://portal.eks.sk/SpravaKniznice/OpisneFormulareKniznice/VerejnyDetailOpisnehoFormularaKniznice/183582","0","0",
"OF-183714","Po karanténe","Kancelárske potreby","Kancelárske potreby","30190000-7 Rôzne kancelárske zariadenia a kancelárske potreby; 30192000-1 Kancelárske potreby; 60000000-8 Dopravné služby (bez prepravy odpadu); 39800000-0 Čistiace a leštiace výrobky","Tovar; Služba","","https://portal.eks.sk/SpravaKniznice/OpisneFormulareKniznice/VerejnyDetailOpisnehoFormularaKniznice/183714","0","0",
"OF-184107","Po karanténe","Dodávanie čerstvého ovocia a zeleniny pre stravovacie zriadenie 2019 (s osobným odberom vo Zvolene) - Močiar","Ovocie, zelenina","03220000-9 Zelenina, ovocie a orechy; 03212100-1 Zemiaky; 03221100-7 Koreňová a hľuzová zelenina; 03221230-7 Papriky; 03221240-0 Paradajka; 03221260-6 Huby; 03221270-9 Uhorka; 03221310-2 Hlávkový šalát; 03221410-3 Kapusta; 03221420-6 Karfiol; 03221430-9 Brokolica; 03221440-2 Ružičkový kel; 03222111-4 Banány; 03222112-1 Ananás; 03222220-1 Pomaranče; 03222240-7 Mandarínky; 03222321-9 Jablká; 03222322-6 Hrušky; 03222331-2 Marhule; 03222332-9 Broskyne; 03222341-5 Stolové hrozno; 60000000-8 Dopravné služby (bez prepravy odpadu)","Tovar; Služba","","https://portal.eks.sk/SpravaKniznice/OpisneFormulareKniznice/VerejnyDetailOpisnehoFormularaKniznice/184107","0","0",
"OF-184416","Po karanténe","Mäso a mäsové výrobky","mäso, mäsové výrobky, bravčové, hovädzie, hydina","15110000-2 Mäso; 15130000-8 Mäsové výrobky; 15100000-9 Živočíšne výrobky, mäso a mäsové výrobky; 60000000-8 Dopravné služby (bez prepravy odpadu)","Tovar; Služba","","https://portal.eks.sk/SpravaKniznice/OpisneFormulareKniznice/VerejnyDetailOpisnehoFormularaKniznice/184416","0","0",
"OF-184141","Po karanténe","Vybavenie - štiepkovač, veľkoobjemový kontajner - 5 ks, kontajner 1 100 l - 3 ks","štiepkovač, veľkoobjemový kontajner, kontajner 1 100 l ","43414000-8 Drviče; 44613400-4 Skladovacie kontajnery; 44613800-8 Kontajnery na odpadový materiál; 60000000-8 Dopravné služby (bez prepravy odpadu)","Tovar; Služba","","https://portal.eks.sk/SpravaKniznice/OpisneFormulareKniznice/VerejnyDetailOpisnehoFormularaKniznice/184141","0","0",
"OF-184187","Po karanténe","Simulátor na vyšetrenie uší","simulátor, vyšetrenie uši, praktická výučba","34150000-3 Simulátory; 39162200-7 Učebné pomôcky a zariadenia; 60000000-8 Dopravné služby (bez prepravy odpadu)","Tovar; Služba","","https://portal.eks.sk/SpravaKniznice/OpisneFormulareKniznice/VerejnyDetailOpisnehoFormularaKniznice/184187","1","0",
