"OpisnyFormularIdentifikator","OpisnyFormularStav","OpisnyFormularNazov","OpisnyFormularKlucoveSlova","OpisnyFormularCpv","OpisnyFormularDruh","OpisnyFormularKategoriaSluzieb","OpisnyFormularUrl","OpisnyFormularPocetVyhlasenychZakaziek","OpisnyFormularObchodovanaSumaBezDPH",
"OF-253715","Po karanténe","Stavebný materiál","flexibilné lepidlo, sádrová stierka","44190000-8 Rôzne stavebné materiály; 44111000-1 Stavebné materiály; 60000000-8 Dopravné služby (bez prepravy odpadu)","Tovar; Služba","","https://portal.eks.sk/SpravaKniznice/OpisneFormulareKniznice/VerejnyDetailOpisnehoFormularaKniznice/253715","1","0",
"OF-253725","Po karanténe","Audio príslušenstvo","zvuk, mikrofón, slúchadlo","32350000-1 Časti zvukových zariadení a videozariadení; 32351000-8 Príslušenstvo k zvukovým zariadeniam a videozariadeniam; 60000000-8 Dopravné služby (bez prepravy odpadu)","Tovar; Služba","","https://portal.eks.sk/SpravaKniznice/OpisneFormulareKniznice/VerejnyDetailOpisnehoFormularaKniznice/253725","1","0",
"OF-253734","Po karanténe","Elektronické stravné lístky","elektronické stravné lístky, stravovacie karty","30199770-8 Stravné poukážky; 60000000-8 Dopravné služby (bez prepravy odpadu); 30237131-6 Elektronické karty; 55520000-1 Služby hromadného stravovania","Tovar; Služba","","https://portal.eks.sk/SpravaKniznice/OpisneFormulareKniznice/VerejnyDetailOpisnehoFormularaKniznice/253734","1","0",
"OF-253745","Po karanténe","Rezačka asfaltu","Rezačka drážok,  rezanie asfaltu","43312000-3 Mechanizmy na úpravu povrchu vozoviek; 43300000-6 Stavebné stroje a zariadenia; 60000000-8 Dopravné služby (bez prepravy odpadu)","Tovar; Služba","","https://portal.eks.sk/SpravaKniznice/OpisneFormulareKniznice/VerejnyDetailOpisnehoFormularaKniznice/253745","0","0",
"OF-253756","Po karanténe","Ručné LED svietidlo a LED čelová lampa - čelovka","Ručné LED svietidlo a LED čelová lampa - čelovka","31521320-3 Vreckové lampáše; 31521330-6 Nabíjateľné prenosné elektrické lampy; 60000000-8 Dopravné služby (bez prepravy odpadu)","Tovar; Služba","","https://portal.eks.sk/SpravaKniznice/OpisneFormulareKniznice/VerejnyDetailOpisnehoFormularaKniznice/253756","1","63,000",
"OF-253768","Po karanténe","Predĺženie podpory pre zariadenie NetAPP AFF A220 na 6 mesiacov","Predĺženie podpory pre zariadenie NetAPP AFF A220 na 6 mesiacov","72200000-7 Programovanie softvéru a poradenstvo; 71356300-1 Technická podpora; 72000000-5 Služby informačných technológií: konzultácie, vývoj softvéru, internet a podpora; 60000000-8 Dopravné služby (bez prepravy odpadu)","Služba","","https://portal.eks.sk/SpravaKniznice/OpisneFormulareKniznice/VerejnyDetailOpisnehoFormularaKniznice/253768","1","0",
"OF-253754","Po karanténe","Nákup osobných elektromobilov","elektromobil, osobný automobil","34100000-8 Motorové vozidlá; 34144900-7 Vozidlá na elektrický pohon; 60000000-8 Dopravné služby (bez prepravy odpadu)","Tovar; Služba","","https://portal.eks.sk/SpravaKniznice/OpisneFormulareKniznice/VerejnyDetailOpisnehoFormularaKniznice/253754","0","0",
"OF-253766","Po karanténe","Lieky ATC C01: kardiaká","kardiaká","33600000-6 Farmaceutické výrobky","Tovar; Služba","","https://portal.eks.sk/SpravaKniznice/OpisneFormulareKniznice/VerejnyDetailOpisnehoFormularaKniznice/253766","0","0",
"OF-253776","Po karanténe","Pneumatiky na nákladnú techniku","pneumatika, pneumatiky, plášť, plášte, duša, ochranná vložka","34352100-0 Pneumatiky pre nákladné vozidlá; 60000000-8 Dopravné služby (bez prepravy odpadu); 19511000-1 Duše, obruče a ochranné vložky; 19511100-2 Ochranné vložky do ráfika pneumatiky; 19511200-3 Duše","Tovar; Služba","","https://portal.eks.sk/SpravaKniznice/OpisneFormulareKniznice/VerejnyDetailOpisnehoFormularaKniznice/253776","0","0",
"OF-253784","Po karanténe","Dodávka elektrickej energie","Elektrina, dodávka elektrickej energie, distribúcia elektrickej energie","09310000-5 Elektrická energia; 65300000-6 Rozvod elektriny a súvisiace služby","Tovar; Služba","","https://portal.eks.sk/SpravaKniznice/OpisneFormulareKniznice/VerejnyDetailOpisnehoFormularaKniznice/253784","1","0",
"OF-253794","Po karanténe","Umývanie osobných motorových vozidiel","Umývanie, osobné motorové vozidlo","50112300-6 Umývanie osobných motorových vozidiel a podobné služby","Služba","","https://portal.eks.sk/SpravaKniznice/OpisneFormulareKniznice/VerejnyDetailOpisnehoFormularaKniznice/253794","1","0",
"OF-253803","Po karanténe","Kurz excel","Kurz excel, školenie","80533200-1 Počítačové kurzy","Služba","","https://portal.eks.sk/SpravaKniznice/OpisneFormulareKniznice/VerejnyDetailOpisnehoFormularaKniznice/253803","0","0",
"OF-253813","Po karanténe","Kyselina citrónová potravinárska","kyselina, kyselina citrónová","24300000-7 Základné anorganické a organické chemikálie; 24000000-4 Chemické výrobky","Tovar; Služba","","https://portal.eks.sk/SpravaKniznice/OpisneFormulareKniznice/VerejnyDetailOpisnehoFormularaKniznice/253813","1","0",
"OF-253823","Po karanténe","Hygienické a čistiace prostriedky","čistiace prostriedky, hygienické prostriedky","39800000-0 Čistiace a leštiace výrobky; 60000000-8 Dopravné služby (bez prepravy odpadu); 39831200-8 Saponáty; 39831300-9 Čistiace prostriedky na podlahu; 39831600-2 Čistiace prostriedky na toalety; 39811000-0 Prípravky na parfumovanie alebo dezodoráciu miestností; 39812000-7 Leštidlá a krémy; 39833000-0 Protiprachové prostriedky","Tovar; Služba","","https://portal.eks.sk/SpravaKniznice/OpisneFormulareKniznice/VerejnyDetailOpisnehoFormularaKniznice/253823","1","375,000",
"OF-253834","Po karanténe","Obstaranie stravných poukážok a provízie za ich dodávku. alebo ekvivalent","Stravné poukážky, dodanie stravných poukážok","30199770-8 Stravné poukážky; 60000000-8 Dopravné služby (bez prepravy odpadu)","Tovar; Služba","","https://portal.eks.sk/SpravaKniznice/OpisneFormulareKniznice/VerejnyDetailOpisnehoFormularaKniznice/253834","1","0",
"OF-253844","Po karanténe","Stravné poukážky","zabezpečenie stravovania, stravné poukážky,  dodanie stravných poukážok, stravné lístky","55520000-1 Služby hromadného stravovania; 30199770-8 Stravné poukážky; 60000000-8 Dopravné služby (bez prepravy odpadu)","Služba; Tovar","","https://portal.eks.sk/SpravaKniznice/OpisneFormulareKniznice/VerejnyDetailOpisnehoFormularaKniznice/253844","1","0",
"OF-253859","Po karanténe","mrazená zelenina, mrazené ryby a mrazené polotovary, treska v majonéze,mrazená hydina a čerstvé slepačie vajcia","mrazená zelenina, mrazené ryby a mrazené polotovary, treska v majonéze, kuracie prsia mrazené, kuracie stehná mrazené, morčacie prsia mrazené, kurča mrazené, kuracia pečeň,kačacie prsia mrazené, čerstvé slepačie vajcia","15000000-8 Potraviny, nápoje, tabak a príbuzné produkty; 15100000-9 Živočíšne výrobky, mäso a mäsové výrobky; 60000000-8 Dopravné služby (bez prepravy odpadu); 03221000-6 Zelenina; 03310000-5 Ryby, kôrovce a produkty vodného prostredia; 15200000-0 Spracované a konzervované ryby","Tovar; Služba","","https://portal.eks.sk/SpravaKniznice/OpisneFormulareKniznice/VerejnyDetailOpisnehoFormularaKniznice/253859","1","0",
"OF-253869","Po karanténe","Pamätné mince","pamätná minca","22462000-6 Propagačný materiál; 18512100-2 Mince; 18512000-1 Mince a medaily; 60000000-8 Dopravné služby (bez prepravy odpadu)","Tovar; Služba","","https://portal.eks.sk/SpravaKniznice/OpisneFormulareKniznice/VerejnyDetailOpisnehoFormularaKniznice/253869","0","0",
"OF-253877","Po karanténe","čerpadlá, kompresory a príslušenstvo","čerpadlá, kompresory a príslušenstvo","42122220-8 Čerpadlá odpadových vôd; 42123000-7 Kompresory; 42124000-4 Časti čerpadiel, kompresorov, strojov a motorov; 42122440-6 Rotačné čerpadlá; 43134100-2 Ponorné čerpadlá; 60000000-8 Dopravné služby (bez prepravy odpadu)","Tovar; Služba","","https://portal.eks.sk/SpravaKniznice/OpisneFormulareKniznice/VerejnyDetailOpisnehoFormularaKniznice/253877","1","0",
"OF-253886","Po karanténe","Kamera, fotoaparát a príslušenstvo","kamera, fotoaparát, statív, objektív, príslušenstvo","32330000-5 Prístroje na záznam a reprodukciu zvuku a obrazu; 30234000-8 Pamäťové médiá; 60000000-8 Dopravné služby (bez prepravy odpadu)","Tovar; Služba","","https://portal.eks.sk/SpravaKniznice/OpisneFormulareKniznice/VerejnyDetailOpisnehoFormularaKniznice/253886","1","0",
"OF-253895","Po karanténe","Tonery do tlačiarne - originál","toner, tlač","30125100-2 Tonerové náplne; 60000000-8 Dopravné služby (bez prepravy odpadu)","Tovar; Služba","","https://portal.eks.sk/SpravaKniznice/OpisneFormulareKniznice/VerejnyDetailOpisnehoFormularaKniznice/253895","0","0",
"OF-253905","Po karanténe","Zabezpečenie stravovania zamestnancov prostredníctvom elektronickej stravovacej karty","elektronická stravovacia karta, stravné poukážky, stravovacie karty","30199770-8 Stravné poukážky; 60000000-8 Dopravné služby (bez prepravy odpadu)","Tovar; Služba","","https://portal.eks.sk/SpravaKniznice/OpisneFormulareKniznice/VerejnyDetailOpisnehoFormularaKniznice/253905","1","0",
"OF-253914","Po karanténe","Čistiace výrobky a pracie prostriedky ","Čistiace prostriedky, dezinfekčné prostriedky, umývacie prostriedky, odmasťovacie prostriedky, prostriedky na odstraňovanie vodného kameňa, leštiace prostriedky, latexové rukavice, vedrá, handry, zmetáky, špongie.","39800000-0 Čistiace a leštiace výrobky; 39831300-9 Čistiace prostriedky na podlahu; 39831600-2 Čistiace prostriedky na toalety; 39832000-3 Čistiace prostriedky na riad; 39830000-9 Čistiace výrobky; 39831500-1 Čistiace prostriedky na autá; 39832100-4 Čistiaci prášok na riad; 39831220-4 Odmasťovacie prostriedky; 39831000-6 Pracie prostriedky; 39831200-8 Saponáty; 39831210-1 Saponáty na umývanie riadu; 18424300-0 Jednorazové rukavice; 24455000-8 Dezinfekčné prostriedky; 39224000-8 Metly a kefy a iné predmety rôznych typov; 39224330-0 Vedrá; 39224320-7 Špongie; 39224310-4 WC kefy; 39224350-6 Lopatky na smeti; 39542000-3 Handry","Tovar; Služba","","https://portal.eks.sk/SpravaKniznice/OpisneFormulareKniznice/VerejnyDetailOpisnehoFormularaKniznice/253914","1","0",
"OF-253802","Po karanténe","Osobné motorové vozidlo","motorové vozidlo, 8 -miestne","34110000-1 Osobné automobily; 60000000-8 Dopravné služby (bez prepravy odpadu)","Tovar; Služba","","https://portal.eks.sk/SpravaKniznice/OpisneFormulareKniznice/VerejnyDetailOpisnehoFormularaKniznice/253802","0","0",
"OF-253811","Po karanténe","Sondy k prístroju WTW Multi 3430 ","pH sonda, konduktivita, Multi 3430, SenTix 940, TetraCon 925","38410000-2 Meracie nástroje; 60000000-8 Dopravné služby (bez prepravy odpadu)","Tovar; Služba","","https://portal.eks.sk/SpravaKniznice/OpisneFormulareKniznice/VerejnyDetailOpisnehoFormularaKniznice/253811","1","0",
"OF-253820","Po karanténe","Servis nákladných vozidiel Mercedes","Časová ročná prehliadka vozidiel Mercedes Arocs, Actros a Unimog, brzdy, geometria, servisné práce","50111000-6 Správa, opravy a údržba vozového parku; 60000000-8 Dopravné služby (bez prepravy odpadu)","Služba","","https://portal.eks.sk/SpravaKniznice/OpisneFormulareKniznice/VerejnyDetailOpisnehoFormularaKniznice/253820","0","0",
"OF-253833","Po karanténe","Nákup detekčných trubičiek","MSA Air Tester, detekčné trubičky, detekčná trubička, analyzátor plynu","38432100-3 Analyzátory plynu; 60000000-8 Dopravné služby (bez prepravy odpadu)","Tovar; Služba","","https://portal.eks.sk/SpravaKniznice/OpisneFormulareKniznice/VerejnyDetailOpisnehoFormularaKniznice/253833","1","0",
"OF-253843","Po karanténe","Kuchynské vybavenie pre domácnosť a kanceláriu","plne automatický kávovar KRUPS","39711310-5 Elektrické kávovary; 39711300-2 Elektrotepelné prístroje; 39711320-8 Elektrické čajovary; 39710000-2 Elektrické prístroje pre domácnosť; 39711440-5 Variče; 60000000-8 Dopravné služby (bez prepravy odpadu)","Tovar; Služba","","https://portal.eks.sk/SpravaKniznice/OpisneFormulareKniznice/VerejnyDetailOpisnehoFormularaKniznice/253843","0","0",
"OF-253858","Po karanténe","Dodávka elektrickej energie","Elektrická energia, kWh, distribúcia elektrickej energie, dodávka elektriny","09310000-5 Elektrická energia; 65300000-6 Rozvod elektriny a súvisiace služby","Tovar; Služba","","https://portal.eks.sk/SpravaKniznice/OpisneFormulareKniznice/VerejnyDetailOpisnehoFormularaKniznice/253858","1","0",
"OF-253868","Po karanténe","Nákup AKU vŕtačky","vŕtačka, AKU, akumulátorová vŕtačka, uťahovačka","43132300-0 Vŕtačky; 60000000-8 Dopravné služby (bez prepravy odpadu)","Tovar; Služba","","https://portal.eks.sk/SpravaKniznice/OpisneFormulareKniznice/VerejnyDetailOpisnehoFormularaKniznice/253868","1","0",
"OF-253876","Po karanténe","Letné pneumatiky na osobné auto","pneumatiky","34351100-3 Pneumatiky pre motorové vozidlá; 34351000-2 Pneumatiky na ľahkú záťaž; 34350000-5 Pneumatiky na ľahkú záťaž a pneumatiky na vysokú záťaž; 60000000-8 Dopravné služby (bez prepravy odpadu)","Tovar; Služba","","https://portal.eks.sk/SpravaKniznice/OpisneFormulareKniznice/VerejnyDetailOpisnehoFormularaKniznice/253876","1","151,190",
"OF-253885","Po karanténe","Údržba nezastavaných pozemkov - SPO Bratislava","Údržba nezastavaných pozemkov","77314000-4 Údržba pozemkov; 77314100-5 Údržba trávnikov; 60000000-8 Dopravné služby (bez prepravy odpadu)","Služba","","https://portal.eks.sk/SpravaKniznice/OpisneFormulareKniznice/VerejnyDetailOpisnehoFormularaKniznice/253885","0","0",
"OF-253894","Po karanténe","Maliarske potreby","maliarske štetce, valčeky, mriežka","39224210-3 Maliarske štetce; 37820000-2 Potreby pre maliarov; 60000000-8 Dopravné služby (bez prepravy odpadu)","Tovar; Služba","","https://portal.eks.sk/SpravaKniznice/OpisneFormulareKniznice/VerejnyDetailOpisnehoFormularaKniznice/253894","0","0",
"OF-253904","Po karanténe","Generálna oprava TATRA T 815 S1 ","Generálna oprava, nákladné vozidlá","50114100-8 Oprava nákladných vozidiel","Služba","","https://portal.eks.sk/SpravaKniznice/OpisneFormulareKniznice/VerejnyDetailOpisnehoFormularaKniznice/253904","1","0",
"OF-253912","Po karanténe","Učebnice, pracovné zošity základná škola","pracovné zošity, pracovné učebnice","22111000-1 Knihy pre školy; 60000000-8 Dopravné služby (bez prepravy odpadu); 22112000-8 Učebnice","Tovar; Služba","","https://portal.eks.sk/SpravaKniznice/OpisneFormulareKniznice/VerejnyDetailOpisnehoFormularaKniznice/253912","1","6456,180",
"OF-253922","Po karanténe","Komponenty k zostaveniu vlastného PC","LCD monitor, PC skrinka, operačná pamäť, PC zdroj, základná doska, processor, grafická karta, klávesnica, myš","30237000-9 Časti a príslušenstvo počítačov a spotrebný materiál k nim; 60000000-8 Dopravné služby (bez prepravy odpadu)","Tovar; Služba","","https://portal.eks.sk/SpravaKniznice/OpisneFormulareKniznice/VerejnyDetailOpisnehoFormularaKniznice/253922","0","0",
"OF-253933","Po karanténe","Trhacie zariadenie na mechanické skúšky izolačných materiálov (trhacie zariadenie s vybavením na meranie pevnosti v ťahu a ťažnosti káblových izolácií)","trhacie zariadenie, mechanické vlastnosti izolácií, pevnosť v ťahu, ťažnosť","31640000-4 Stroje a prístroje s individuálnymi funkciami; 60000000-8 Dopravné služby (bez prepravy odpadu)","Tovar; Služba","","https://portal.eks.sk/SpravaKniznice/OpisneFormulareKniznice/VerejnyDetailOpisnehoFormularaKniznice/253933","1","0",
"OF-253942","Po karanténe","Nákup drogistického materiálu ","toaletný papier, papierové utierky na ruky,","33763000-6 Papierové uteráky na ruky; 33771000-5 Hygienické výrobky z papiera; 60000000-8 Dopravné služby (bez prepravy odpadu)","Tovar; Služba","","https://portal.eks.sk/SpravaKniznice/OpisneFormulareKniznice/VerejnyDetailOpisnehoFormularaKniznice/253942","1","0",
"OF-253955","Po karanténe","Trvanlivé potraviny, cukrárenské výrobky, koreniny","Bujóny, vývary, koreniny, cukrovinky, sirupy, nápoje, cestoviny","15891500-5 Bujóny; 15891600-6 Vývary; 15891610-9 Zmesi do vývarov; 15891000-0 Polievky a bujóny; 15893300-7 Zmesové mäsové šťavy/omáčky; 15871210-9 Sójová omáčka; 15892100-8 Rastlinné šťavy; 15892200-9 Zeleninové extrakty; 15890000-3 Rôzne potravinové výrobky a sušený tovar; 15870000-7 Koreniny a chuťové prísady; 15865000-9 Bylinkové prímesi; 15842300-5 Cukrovinky; 15842000-2 Čokoláda a cukrovinky; 15884000-8 Dojčenská výživa; 15897200-4 Výrobky v konzerve; 15235000-4 Konzervované ryby; 15321700-1 Zmesi nekoncentrovaných štiav; 15980000-1 Nealkoholické nápoje; 15861000-1 Káva; 15863000-5 Čaj; 15850000-1 Cestoviny; 03212210-5 Suché strukoviny; 15830000-5 Cukor a jemu príbuzné výrobky","Tovar; Služba","","https://portal.eks.sk/SpravaKniznice/OpisneFormulareKniznice/VerejnyDetailOpisnehoFormularaKniznice/253955","0","0",
"OF-253968","Po karanténe","Kŕmne zmesi pre ošípané, prasničky a štartérova kŕmna zmes","krmivá pre ošípané a prasničky","15710000-8 Pripravené krmivo pre poľnohospodárske a iné zvieratá; 60000000-8 Dopravné služby (bez prepravy odpadu)","Tovar; Služba","","https://portal.eks.sk/SpravaKniznice/OpisneFormulareKniznice/VerejnyDetailOpisnehoFormularaKniznice/253968","0","0",
"OF-253787","Po karanténe","Lieky ATC A10: antidiabetiká; A11 Vitamíny; A12 náhrady minerálnych prvkov","antidiabetiká; vitamíny, náhrady minerálnych prvkov","33600000-6 Farmaceutické výrobky; 33616000-1 Vitamíny; 33617000-8 Minerálne doplnky","Tovar; Služba","","https://portal.eks.sk/SpravaKniznice/OpisneFormulareKniznice/VerejnyDetailOpisnehoFormularaKniznice/253787","0","0",
"OF-253798","Po karanténe","Elektroforetické súpravy na separáciu bielkovín","laboratórium, bielkoviny, separácia","33694000-1 Diagnostické činidlá; 60000000-8 Dopravné služby (bez prepravy odpadu)","Tovar; Služba","","https://portal.eks.sk/SpravaKniznice/OpisneFormulareKniznice/VerejnyDetailOpisnehoFormularaKniznice/253798","1","0",
"OF-253807","Po karanténe","Výpočtová technika /notebook, All-In-One/","notebook, osobný počítač, výpočtová technika","30213000-5 Osobné počítače; 50324000-2 Podporné služby pre osobné počítače; 60000000-8 Dopravné služby (bez prepravy odpadu)","Tovar; Služba","","https://portal.eks.sk/SpravaKniznice/OpisneFormulareKniznice/VerejnyDetailOpisnehoFormularaKniznice/253807","1","0",
"OF-253816","Po karanténe","Elektrická energia","elektrina, elektrická energia","09310000-5 Elektrická energia; 65300000-6 Rozvod elektriny a súvisiace služby","Tovar; Služba","","https://portal.eks.sk/SpravaKniznice/OpisneFormulareKniznice/VerejnyDetailOpisnehoFormularaKniznice/253816","1","0",
"OF-253827","Po karanténe","Poskytovanie služieb podpory a prevádzky ","správa","72250000-2 Služby týkajúce sa podpory systému","Služba","","https://portal.eks.sk/SpravaKniznice/OpisneFormulareKniznice/VerejnyDetailOpisnehoFormularaKniznice/253827","0","0",
"OF-253837","Po karanténe","MONOČLÁNKY A BATÉRIE","monočlánky, batérie, náhradné akumulátory","31400000-0 Akumulátory, galvanické články a batérie; 31411000-0 Alkalické batérie; 60000000-8 Dopravné služby (bez prepravy odpadu)","Tovar; Služba","","https://portal.eks.sk/SpravaKniznice/OpisneFormulareKniznice/VerejnyDetailOpisnehoFormularaKniznice/253837","0","0",
"OF-253848","Po karanténe","Potreby pre verejné stravovanie na jedno použitie","menubox, termomiska, termoviečko, servítky","39222100-5 Potreby pre verejné stravovanie na jedno použitie; 60000000-8 Dopravné služby (bez prepravy odpadu)","Tovar; Služba","","https://portal.eks.sk/SpravaKniznice/OpisneFormulareKniznice/VerejnyDetailOpisnehoFormularaKniznice/253848","1","0",
"OF-253862","Po karanténe","Spracované ovocie a zelenina","spracované ovocie a zelenina, nakladaná alebo konzervovaná zelenina, džemy, marmelády","15300000-1 Ovocie, zelenina a súvisiace výrobky; 15331400-1 Nakladaná a/alebo konzervovaná zelenina; 15332200-6 Džemy a marmelády, ovocné želé; ovocné alebo orechové pyré a pasty/pretlaky; 60000000-8 Dopravné služby (bez prepravy odpadu)","Tovar; Služba","","https://portal.eks.sk/SpravaKniznice/OpisneFormulareKniznice/VerejnyDetailOpisnehoFormularaKniznice/253862","0","0",
"OF-253872","Po karanténe","Diagnostický materiál","diagnostický materiál","33124130-5 Diagnostický spotrebný materiál; 33694000-1 Diagnostické činidlá; 60000000-8 Dopravné služby (bez prepravy odpadu)","Tovar; Služba","","https://portal.eks.sk/SpravaKniznice/OpisneFormulareKniznice/VerejnyDetailOpisnehoFormularaKniznice/253872","1","0",
"OF-253880","Po karanténe","Strelivo určené na športové účely","strelivo, náboje","35331500-8 Náboje; 35331000-3 Strelivo do strelných zbraní a vojnové prostriedky; 60000000-8 Dopravné služby (bez prepravy odpadu)","Tovar; Služba","","https://portal.eks.sk/SpravaKniznice/OpisneFormulareKniznice/VerejnyDetailOpisnehoFormularaKniznice/253880","1","0",
"OF-253889","Po karanténe","Tlačiarenské služby","tlač, tlačiarenské služby","79810000-5 Tlačiarenské služby; 60000000-8 Dopravné služby (bez prepravy odpadu)","Služba; Tovar","","https://portal.eks.sk/SpravaKniznice/OpisneFormulareKniznice/VerejnyDetailOpisnehoFormularaKniznice/253889","1","0",
"OF-253898","Po karanténe","Uzavretý vákuový odberový systém, nádoby na ostré predmety","odberový systém, punkcia ciev, prístroje na odber vzoriek krvi, nádoby na ostré predmety","33141300-3 Punkcia ciev, prístroje na odber vzoriek krvi; 33141123-8 Nádoby na ostré predmety; 60000000-8 Dopravné služby (bez prepravy odpadu)","Tovar; Služba","","https://portal.eks.sk/SpravaKniznice/OpisneFormulareKniznice/VerejnyDetailOpisnehoFormularaKniznice/253898","1","0",
"OF-253908","Po karanténe","Náhradné diely na autobusy Sor NB12,NB18 - podvozok","Náhradné diely, autobus,Sor NB12,NB18,podvozok","34121100-2 Autobusy verejnej dopravy; 34139200-2 Samotný podvozok; 60000000-8 Dopravné služby (bez prepravy odpadu)","Tovar","","https://portal.eks.sk/SpravaKniznice/OpisneFormulareKniznice/VerejnyDetailOpisnehoFormularaKniznice/253908","1","0",
"OF-253917","Po karanténe","Rukavice jednorázové - veľkosť L","rukavice,bezlatexové,vyšetrovacie,nesterilné,nepúdrované,nitrilové","18424300-0 Jednorazové rukavice; 60000000-8 Dopravné služby (bez prepravy odpadu)","Tovar; Služba","","https://portal.eks.sk/SpravaKniznice/OpisneFormulareKniznice/VerejnyDetailOpisnehoFormularaKniznice/253917","0","0",
"OF-253926","Po karanténe","mrazená zelenina a ovocie, mrazené polotovary","mrazená zelenina, mrazené ovocie, mrazené polotovary","15000000-8 Potraviny, nápoje, tabak a príbuzné produkty; 15330000-0 Spracované ovocie a zelenina; 15331000-7 Spracovaná zelenina; 15331100-8 Čerstvá alebo mrazená zelenina; 60000000-8 Dopravné služby (bez prepravy odpadu)","Tovar; Služba","","https://portal.eks.sk/SpravaKniznice/OpisneFormulareKniznice/VerejnyDetailOpisnehoFormularaKniznice/253926","0","0",
"OF-253938","Po karanténe","Špeciálny zdravotnícky materiál","lekárske ihly, injekčné striekačky, potreby na infúziu","33194120-3 Potreby na infúzie; 33141320-9 Lekárske ihly; 33141310-6 Injekčné striekačky; 60000000-8 Dopravné služby (bez prepravy odpadu)","Tovar","","https://portal.eks.sk/SpravaKniznice/OpisneFormulareKniznice/VerejnyDetailOpisnehoFormularaKniznice/253938","1","0",
"OF-253948","Po karanténe","Nerezové termoobedáre – stravovanie seniorov","nerezové termoobedáre","39221130-7 Nádoby na jedlo; 60000000-8 Dopravné služby (bez prepravy odpadu)","Tovar; Služba","","https://portal.eks.sk/SpravaKniznice/OpisneFormulareKniznice/VerejnyDetailOpisnehoFormularaKniznice/253948","0","0",
"OF-253961","Po karanténe","Paplóny a vankúše, posteľná plachta, posteľná bielizeň","Paplóny a vankúše, posteľná plachta, posteľná bielizeň","39510000-0 Textilné výrobky pre domácnosť; 60000000-8 Dopravné služby (bez prepravy odpadu)","Tovar; Služba","","https://portal.eks.sk/SpravaKniznice/OpisneFormulareKniznice/VerejnyDetailOpisnehoFormularaKniznice/253961","1","0",
"OF-253782","Po karanténe","Rukávový znak, nášivka","Vojenský rukávový znak, nášivka","39561133-3 Insígnie; 98393000-4 Krajčírske služby; 39561000-2 Tyl, krajka, stuhy, lemovky a výšivky; 60000000-8 Dopravné služby (bez prepravy odpadu)","Tovar; Služba","","https://portal.eks.sk/SpravaKniznice/OpisneFormulareKniznice/VerejnyDetailOpisnehoFormularaKniznice/253782","0","0",
"OF-253790","Po karanténe","Záchranárske vybavenie - Snežnice ","Snežnice","37411000-2 Zimný výstroj; 37411100-3 Lyžiarsky a snowboardový výstroj; 37411110-6 Lyžiarske topánky; 37411140-5 Viazania; 60000000-8 Dopravné služby (bez prepravy odpadu); 37410000-5 Výbava pre športy vo voľnej prírode alebo na ihrisku","Tovar; Služba","","https://portal.eks.sk/SpravaKniznice/OpisneFormulareKniznice/VerejnyDetailOpisnehoFormularaKniznice/253790","0","0",
"OF-253801","Po karanténe","Nákup mazacieho lisu","mazací lis, lis","42636000-3 Lisy; 60000000-8 Dopravné služby (bez prepravy odpadu)","Tovar; Služba","","https://portal.eks.sk/SpravaKniznice/OpisneFormulareKniznice/VerejnyDetailOpisnehoFormularaKniznice/253801","1","0",
