"OpisnyFormularIdentifikator","OpisnyFormularStav","OpisnyFormularNazov","OpisnyFormularKlucoveSlova","OpisnyFormularCpv","OpisnyFormularDruh","OpisnyFormularKategoriaSluzieb","OpisnyFormularUrl","OpisnyFormularPocetVyhlasenychZakaziek","OpisnyFormularObchodovanaSumaBezDPH",
"OF-276625","Po karanténe","Propagačné predmety s potlačou","predmety","39294100-0 Informačné a propagačné výrobky; 60000000-8 Dopravné služby (bez prepravy odpadu)","Tovar; Služba","","https://portal.eks.sk/SpravaKniznice/OpisneFormulareKniznice/VerejnyDetailOpisnehoFormularaKniznice/276625","0","0",
"OF-276626","Po karanténe","Benzínový drvič konárov STIHL GH 460 C a HECHT 6208 - výlučne originál bez náhrady","Drvička dreva, štiepkovač dreva, konárov, vetiev úžitkové stroje","42642100-9 Obrábacie stroje na drevo; 16000000-5 Poľnohospodárske stroje; 42900000-5 Rôzne strojové zariadenia na všeobecné a osobitné účely; 60000000-8 Dopravné služby (bez prepravy odpadu); 03100000-2 Poľnohospodárske a záhradnícke produkty; 16600000-1 Špeciálne mechanizmy pre poľnohospodárstvo alebo lesníctvo","Tovar; Služba","","https://portal.eks.sk/SpravaKniznice/OpisneFormulareKniznice/VerejnyDetailOpisnehoFormularaKniznice/276626","1","0",
"OF-276627","Po karanténe","Benzínový drvič konárov STIHL GH 460 C - výlučne originál bez náhrady","Drvička dreva, štiepkovač dreva, konárov, vetiev úžitkové stroje","42642100-9 Obrábacie stroje na drevo; 16000000-5 Poľnohospodárske stroje; 42900000-5 Rôzne strojové zariadenia na všeobecné a osobitné účely; 60000000-8 Dopravné služby (bez prepravy odpadu); 03100000-2 Poľnohospodárske a záhradnícke produkty; 16600000-1 Špeciálne mechanizmy pre poľnohospodárstvo alebo lesníctvo","Tovar; Služba","","https://portal.eks.sk/SpravaKniznice/OpisneFormulareKniznice/VerejnyDetailOpisnehoFormularaKniznice/276627","0","0",
"OF-276628","Po karanténe","Benzínový drvič konárov HECHT 6208 - výlučne originál bez náhrady","Drvička dreva, štiepkovač dreva, konárov, vetiev úžitkové stroje","42642100-9 Obrábacie stroje na drevo; 16000000-5 Poľnohospodárske stroje; 42900000-5 Rôzne strojové zariadenia na všeobecné a osobitné účely; 60000000-8 Dopravné služby (bez prepravy odpadu); 03100000-2 Poľnohospodárske a záhradnícke produkty; 16600000-1 Špeciálne mechanizmy pre poľnohospodárstvo alebo lesníctvo","Tovar; Služba","","https://portal.eks.sk/SpravaKniznice/OpisneFormulareKniznice/VerejnyDetailOpisnehoFormularaKniznice/276628","0","0",
"OF-276629","Po karanténe","Nabíjačka auto batérií 6-12-24-36-48 V","nabíjačka, nabíjačka autobatérií, nabíjačka batérií","31158100-9 Nabíjače batérií; 31681500-8 Nabíjačky; 31158000-8 Nabíjače; 31431000-6 Olovené akumulátory; 60000000-8 Dopravné služby (bez prepravy odpadu)","Tovar","","https://portal.eks.sk/SpravaKniznice/OpisneFormulareKniznice/VerejnyDetailOpisnehoFormularaKniznice/276629","0","0",
"OF-276630","Po karanténe","Vybavenie posilňovní","veslovací trenažér, posilňovacie stroje","37441400-5 Veslárske trenažéry; 60000000-8 Dopravné služby (bez prepravy odpadu); 37400000-2 Športový tovar a výbava; 37442900-8 Posilňovacie veže; 37441100-2 Bežecké pásy","Tovar; Služba","","https://portal.eks.sk/SpravaKniznice/OpisneFormulareKniznice/VerejnyDetailOpisnehoFormularaKniznice/276630","1","0",
"OF-276631","Po karanténe","Športové a rekreačné vybavenie","činky, expander, odporové gumy, podložka na cvičenie","37400000-2 Športový tovar a výbava; 60000000-8 Dopravné služby (bez prepravy odpadu); 37420000-8 Výbava do telocvične; 37442820-2 Posilňovacie gumy; 37442800-8 Posilňovacie pásky a gumy; 45212140-9 Rekreačné zariadenia; 37421000-5 Žinenky do telocviční","Tovar; Služba","","https://portal.eks.sk/SpravaKniznice/OpisneFormulareKniznice/VerejnyDetailOpisnehoFormularaKniznice/276631","1","0",
"OF-276633","Po karanténe","Maliarske náradie a pomôcky","Maliarske štetce, štetky, valčeky, pásky.","39224210-3 Maliarske štetce; 60000000-8 Dopravné služby (bez prepravy odpadu)","Tovar; Služba","","https://portal.eks.sk/SpravaKniznice/OpisneFormulareKniznice/VerejnyDetailOpisnehoFormularaKniznice/276633","0","0",
"OF-276634","Po karanténe","Kontrola hasiacich prístrojov","hasiace prístroje, prenosné","71356100-9 Technická kontrola; 60000000-8 Dopravné služby (bez prepravy odpadu)","Služba","","https://portal.eks.sk/SpravaKniznice/OpisneFormulareKniznice/VerejnyDetailOpisnehoFormularaKniznice/276634","0","0",
"OF-276636","Po karanténe","Poľný nábytok a vybavenie ","poľný nábytok, poľné lehátka","39522520-8 Poľné lôžka; 60000000-8 Dopravné služby (bez prepravy odpadu)","Tovar; Služba","","https://portal.eks.sk/SpravaKniznice/OpisneFormulareKniznice/VerejnyDetailOpisnehoFormularaKniznice/276636","1","0",
"OF-276637","Po karanténe","Elektroinštalačný materiál","vydlica, prúdový chránič, zástrčka, merací kolík","31681300-6 Elektrické obvody; 60000000-8 Dopravné služby (bez prepravy odpadu); 38410000-2 Meracie nástroje; 38300000-8 Meracie prístroje; 31224100-3 Zástrčky a zásuvky; 31681400-7 Elektrické súčiastky","Tovar; Služba","","https://portal.eks.sk/SpravaKniznice/OpisneFormulareKniznice/VerejnyDetailOpisnehoFormularaKniznice/276637","1","0",
"OF-276638","Po karanténe","Umývanie osobných motorových vozidiel","Umývanie osobných motorových vozidiel, tepovanie a čistenie interiéru","50112300-6 Umývanie osobných motorových vozidiel a podobné služby","Služba","","https://portal.eks.sk/SpravaKniznice/OpisneFormulareKniznice/VerejnyDetailOpisnehoFormularaKniznice/276638","1","0",
"OF-276639","Po karanténe","Náhradné diely na autobusy Sor NB12,NB18 - Hnacie ústrojenstvo","Náhradné diely, autobus,Sor NB12,NB18,hnacie ústrojenstvo","34121100-2 Autobusy verejnej dopravy; 42111000-0 Motory a hnacie zariadenia; 60000000-8 Dopravné služby (bez prepravy odpadu)","Tovar","","https://portal.eks.sk/SpravaKniznice/OpisneFormulareKniznice/VerejnyDetailOpisnehoFormularaKniznice/276639","1","0",
"OF-276640","Po karanténe","Zariadenia na vykurovanie a ohrev vzduchu a príslušenstvo","NAFTOVÝ ,OHRIEVAČ, MASTER,BV ,77E , POKOJOVÝ TERMOSTAT , MASTER Pružná hadica , Nerezová rúra , Konvektor Sencor","39721310-8 Ohrievače vzduchu; 60000000-8 Dopravné služby (bez prepravy odpadu)","Tovar; Služba","","https://portal.eks.sk/SpravaKniznice/OpisneFormulareKniznice/VerejnyDetailOpisnehoFormularaKniznice/276640","1","0",
"OF-276641","Po karanténe","Náhradné diely na autobusy Sor NB12, NB18 ","Náhradné diely, autobus ,Sor","34121100-2 Autobusy verejnej dopravy; 34121200-3 Kĺbové autobusy; 60000000-8 Dopravné služby (bez prepravy odpadu)","Tovar; Služba","","https://portal.eks.sk/SpravaKniznice/OpisneFormulareKniznice/VerejnyDetailOpisnehoFormularaKniznice/276641","1","0",
"OF-276642","Po karanténe","Náhradné diely na autobusy Sor NB12,NB18 - podvozok","Náhradné diely, autobus,Sor NB12,NB18,podvozok","34121100-2 Autobusy verejnej dopravy; 34139200-2 Samotný podvozok; 60000000-8 Dopravné služby (bez prepravy odpadu)","Tovar","","https://portal.eks.sk/SpravaKniznice/OpisneFormulareKniznice/VerejnyDetailOpisnehoFormularaKniznice/276642","1","0",
"OF-276644","Po karanténe","Náhradné diely na autobusy Sor NB12,NB18 - podvozok","Náhradné diely, autobus,Sor NB12,NB18,podvozok","34121100-2 Autobusy verejnej dopravy; 34139200-2 Samotný podvozok; 60000000-8 Dopravné služby (bez prepravy odpadu)","Tovar","","https://portal.eks.sk/SpravaKniznice/OpisneFormulareKniznice/VerejnyDetailOpisnehoFormularaKniznice/276644","1","0",
"OF-276645","Po karanténe","Náhradné diely na autobusy Citelis","Náhradné diely, autobus ,Citelis","34121100-2 Autobusy verejnej dopravy; 34121200-3 Kĺbové autobusy; 60000000-8 Dopravné služby (bez prepravy odpadu)","Tovar; Služba","","https://portal.eks.sk/SpravaKniznice/OpisneFormulareKniznice/VerejnyDetailOpisnehoFormularaKniznice/276645","1","0",
"OF-276648","Po karanténe","Náhradné diely na autobusy Sor NB12,NB18 - Hnacie ústrojenstvo","Náhradné diely, autobus,Sor NB12,NB18,hnacie ústrojenstvo","34121100-2 Autobusy verejnej dopravy; 42111000-0 Motory a hnacie zariadenia; 60000000-8 Dopravné služby (bez prepravy odpadu)","Tovar","","https://portal.eks.sk/SpravaKniznice/OpisneFormulareKniznice/VerejnyDetailOpisnehoFormularaKniznice/276648","1","0",
"OF-276650","Po karanténe","Náhradné diely na autobusy Solaris U15 - podvozok","Náhradné diely, autobus,Solaris U15,podvozok","34121100-2 Autobusy verejnej dopravy; 34139200-2 Samotný podvozok; 60000000-8 Dopravné služby (bez prepravy odpadu)","Tovar","","https://portal.eks.sk/SpravaKniznice/OpisneFormulareKniznice/VerejnyDetailOpisnehoFormularaKniznice/276650","1","0",
"OF-276651","Po karanténe","Náhradné diely na autobusy Solaris U15 - hnacie ústrojenstvo","Náhradné diely, autobus,Solaris U15,hnacie ústrojenstvo","34121100-2 Autobusy verejnej dopravy; 42111000-0 Motory a hnacie zariadenia; 60000000-8 Dopravné služby (bez prepravy odpadu)","Tovar","","https://portal.eks.sk/SpravaKniznice/OpisneFormulareKniznice/VerejnyDetailOpisnehoFormularaKniznice/276651","1","0",
"OF-276652","Po karanténe","Náterové hmoty, farby a riedidlá","Syntetická farba","44810000-1 Náterové farby; 60000000-8 Dopravné služby (bez prepravy odpadu)","Tovar; Služba","","https://portal.eks.sk/SpravaKniznice/OpisneFormulareKniznice/VerejnyDetailOpisnehoFormularaKniznice/276652","1","0",
"OF-276653","Po karanténe","Hadicové sety k artroskopickej pumpe FMS VUE I, FMS VUE II","Hadicový set jednodenný, prívodný, prívodný a odsávací, hadicové sety jednorazové","33140000-3 Zdravotnícky spotrebný materiál; 60000000-8 Dopravné služby (bez prepravy odpadu)","Tovar; Služba","","https://portal.eks.sk/SpravaKniznice/OpisneFormulareKniznice/VerejnyDetailOpisnehoFormularaKniznice/276653","0","0",
"OF-276656","Po karanténe","Trubky, potrubia, hadice a armatúry","hadica 50 metrov, oceľová trubka","19500000-1 Gumené a plastové materiály; 19520000-7 Plastové výrobky; 44167000-8 Rôzne príslušenstvo na trubice; 44165000-4 Hadice, stúpacie potrubia a objímky; 44165100-5 Hadice; 19000000-6 Koža a textílie, plastové a gumené materiály","Tovar; Služba","","https://portal.eks.sk/SpravaKniznice/OpisneFormulareKniznice/VerejnyDetailOpisnehoFormularaKniznice/276656","0","0",
"OF-276657","Po karanténe","Nákup licencií Windows Server Datacenter","operačný systém, licencie","48620000-0 Operačné systémy; 72250000-2 Služby týkajúce sa podpory systému","Tovar; Služba","","https://portal.eks.sk/SpravaKniznice/OpisneFormulareKniznice/VerejnyDetailOpisnehoFormularaKniznice/276657","1","0",
"OF-276658","Po karanténe","Žiarovo pozinkované rúry  ZN 2"" (Ø 60 mm)","rúry, stĺpy, stožiare","44144000-1 Stĺpy; 44212200-1 Piliere, stožiare, veže, pylóny a stĺpy; 60000000-8 Dopravné služby (bez prepravy odpadu)","Tovar; Služba","","https://portal.eks.sk/SpravaKniznice/OpisneFormulareKniznice/VerejnyDetailOpisnehoFormularaKniznice/276658","0","0",
"OF-276660","Po karanténe","Nákup pásky vulkanizačnej","páska elektroizolačná, páska vulkanizačná","31651000-4 Elektroizolačná páska; 60000000-8 Dopravné služby (bez prepravy odpadu)","Tovar; Služba","","https://portal.eks.sk/SpravaKniznice/OpisneFormulareKniznice/VerejnyDetailOpisnehoFormularaKniznice/276660","0","0",
"OF-276661","Po karanténe","Objemové stavebné materiály ","Betónová zmes, sadra biela, jadrová omietka, pena nízkoexpanzná trubičková 750 ml, Hĺbková penetrácia NANO, kanister, 5 l, Makadam 4-8 drvené kamenivo vápenec","44111000-1 Stavebné materiály; 60000000-8 Dopravné služby (bez prepravy odpadu); 44114100-3 Hotový/surový betón; 44921000-2 Vápenec a sadrovec; 44831300-7 Tesniace tmely; 14212300-3 Drvený a mletý kameň; 44114000-2 Betón","Tovar; Služba","","https://portal.eks.sk/SpravaKniznice/OpisneFormulareKniznice/VerejnyDetailOpisnehoFormularaKniznice/276661","0","0",
"OF-276662","Po karanténe","Maliarske náradie a pomôcky","Maliarske štetce","39224210-3 Maliarske štetce; 60000000-8 Dopravné služby (bez prepravy odpadu)","Tovar; Služba","","https://portal.eks.sk/SpravaKniznice/OpisneFormulareKniznice/VerejnyDetailOpisnehoFormularaKniznice/276662","1","0",
"OF-276663","Po karanténe","Prenosné svietidlá a príslušenstvo","prenosné svietidlo, osvetľovací systém","31521330-6 Nabíjateľné prenosné elektrické lampy; 31521300-7 Prenosné elektrické lampy; 60000000-8 Dopravné služby (bez prepravy odpadu)","Tovar; Služba","","https://portal.eks.sk/SpravaKniznice/OpisneFormulareKniznice/VerejnyDetailOpisnehoFormularaKniznice/276663","0","0",
"OF-276664","Po karanténe","Kovové tyče, plechy, fólie a profily","kovové profily, tyče, plechy, pásovina","44334000-0 Profily; 44170000-2 Dosky, plechy, pásy a fólie súvisiace so stavebnými materiálmi; 44331000-9 Tyče; 14622000-7 Oceľ; 44330000-2 Tyče, prúty, drôty a profily používané v stavebníctve; 44112120-5 Profilové diely; 44172000-6 Plechy (stavebné); 60000000-8 Dopravné služby (bez prepravy odpadu)","Tovar; Služba","","https://portal.eks.sk/SpravaKniznice/OpisneFormulareKniznice/VerejnyDetailOpisnehoFormularaKniznice/276664","1","0",
"OF-276666","Po karanténe","Stavebné materiály","Stavebné materiály, Natĺkacia hmoždinka, Sada mobilného oplotenia, Doska sadrokartónová","44111000-1 Stavebné materiály; 60000000-8 Dopravné služby (bez prepravy odpadu); 44192000-2 Iné rôzne stavebné materiály; 44420000-0 Výrobky používané v stavebníctve","Tovar; Služba","","https://portal.eks.sk/SpravaKniznice/OpisneFormulareKniznice/VerejnyDetailOpisnehoFormularaKniznice/276666","0","0",
"OF-276667","Po karanténe","Maliarske náradie a pomôcky","štetec, valček,","39224210-3 Maliarske štetce; 37820000-2 Potreby pre maliarov; 60000000-8 Dopravné služby (bez prepravy odpadu)","Tovar; Služba","","https://portal.eks.sk/SpravaKniznice/OpisneFormulareKniznice/VerejnyDetailOpisnehoFormularaKniznice/276667","1","0",
"OF-276675","Po karanténe","Kuchynské vybavenie pre domácnosť a kanceláriu","chafing, servírovací ohrev, kuchynské vybavenie","39221000-7 Kuchynské vybavenie; 60000000-8 Dopravné služby (bez prepravy odpadu); 39221100-8 Kuchynské potreby; 39220000-0 Kuchynské zariadenie, domáce potreby a potreby pre domáce hospodárstvo a dodávky pre stravovacie zariadenia; 39141000-2 Kuchynský nábytok a vybavenie; 39221130-7 Nádoby na jedlo","Tovar; Služba","","https://portal.eks.sk/SpravaKniznice/OpisneFormulareKniznice/VerejnyDetailOpisnehoFormularaKniznice/276675","1","0",
"OF-276678","Po karanténe","Nástroje pre Kreatívne centrum Trnava","Nástroje","44510000-8 Nástroje; 44511000-5 Ručné nástroje; 44512000-2 Rôzne ručné nástroje; 60000000-8 Dopravné služby (bez prepravy odpadu)","Tovar; Služba","","https://portal.eks.sk/SpravaKniznice/OpisneFormulareKniznice/VerejnyDetailOpisnehoFormularaKniznice/276678","0","0",
"OF-276681","Po karanténe","Kuchynské vybavenie pre domácnosť a kanceláriu","chafing, servírovací ohrev, kuchynské vybavenie","42642100-9 Obrábacie stroje na drevo; 60000000-8 Dopravné služby (bez prepravy odpadu); 43800000-1 Dielenské zariadenia; 44512000-2 Rôzne ručné nástroje; 44511000-5 Ručné nástroje; 42642000-8 Obrábacie stroje na drevo, kosti, korok, tvrdú gumu alebo tvrdé plasty; 42623000-9 Frézovačky","Tovar; Služba","","https://portal.eks.sk/SpravaKniznice/OpisneFormulareKniznice/VerejnyDetailOpisnehoFormularaKniznice/276681","0","0",
"OF-276691","Po karanténe","Železiarske výrobky a brusivá","Železiarske výrobky","44316000-8 Železiarsky tovar; 44531600-7 Matice; 44532200-0 Podložky/tesnenia; 60000000-8 Dopravné služby (bez prepravy odpadu)","Tovar; Služba","","https://portal.eks.sk/SpravaKniznice/OpisneFormulareKniznice/VerejnyDetailOpisnehoFormularaKniznice/276691","0","0",
"OF-276693","Po karanténe","Motorová nafta","pohonné hmoty, palivá, nafta","09134100-8 Motorová nafta; 60000000-8 Dopravné služby (bez prepravy odpadu)","Tovar; Služba","","https://portal.eks.sk/SpravaKniznice/OpisneFormulareKniznice/VerejnyDetailOpisnehoFormularaKniznice/276693","0","0",
"OF-276695","Po karanténe","Satelitné súpravy a príslušenstvo","Skylink karta","32530000-7 Komunikačné zariadenia týkajúce sa satelitného prenosu; 32531000-4 Satelitné komunikačné zariadenia; 32224000-9 Prístroj na televízne vysielanie; 60000000-8 Dopravné služby (bez prepravy odpadu)","Tovar; Služba","","https://portal.eks.sk/SpravaKniznice/OpisneFormulareKniznice/VerejnyDetailOpisnehoFormularaKniznice/276695","0","0",
"OF-276698","Po karanténe","Nitrilové rukavice, pracovné rukavice, chemické rukavice, chemické masky, filtre na chemické masky, respirátory, ochranné okuliare","rukavice, ochranné a pracovné pomôcky","18424300-0 Jednorazové rukavice; 18141000-9 Pracovné rukavice; 60000000-8 Dopravné služby (bez prepravy odpadu)","Tovar; Služba","","https://portal.eks.sk/SpravaKniznice/OpisneFormulareKniznice/VerejnyDetailOpisnehoFormularaKniznice/276698","1","0",
