"OpisnyFormularIdentifikator","OpisnyFormularStav","OpisnyFormularNazov","OpisnyFormularKlucoveSlova","OpisnyFormularCpv","OpisnyFormularDruh","OpisnyFormularKategoriaSluzieb","OpisnyFormularUrl","OpisnyFormularPocetVyhlasenychZakaziek","OpisnyFormularObchodovanaSumaBezDPH",
"OF-254033","Po karanténe","Súbor IKT vybavenia pre projekty: ""Zlepšenie vzdelanostnej úrovne žiakov v oblasti IT"" a ""Spoločný rozvoj bezpečnostných inštitucionálnych kapacít""","IKT, notebook, tablet, interaktívna tabuľa","30200000-1 Počítačové zariadenia a spotrebný materiál; 60000000-8 Dopravné služby (bez prepravy odpadu); 30213100-6 Prenosné počítače","Tovar; Služba","","https://portal.eks.sk/SpravaKniznice/OpisneFormulareKniznice/VerejnyDetailOpisnehoFormularaKniznice/254033","0","0",
"OF-254044","Po karanténe","Kit pre PCR v reálnom čase na báze SYBR Green I","chemikálie, diagnostický kit","24000000-4 Chemické výrobky; 24300000-7 Základné anorganické a organické chemikálie; 60000000-8 Dopravné služby (bez prepravy odpadu)","Tovar; Služba","","https://portal.eks.sk/SpravaKniznice/OpisneFormulareKniznice/VerejnyDetailOpisnehoFormularaKniznice/254044","0","0",
"OF-254053","Po karanténe","Katiónaktívna asfaltová emulzia C65 B4","asfaltová emulzia, katiónaktívna emulzia, vysprávky živičných krytov, údržba vozovky","44113700-2 Materiály na opravu ciest; 44113900-4 Materiály na údržbu ciest; 44113600-1 Bitúmen a asfalt","Tovar","","https://portal.eks.sk/SpravaKniznice/OpisneFormulareKniznice/VerejnyDetailOpisnehoFormularaKniznice/254053","0","0",
"OF-254064","Po karanténe","Kuchynské vybavenie pre domácnosť a kanceláriu","mikrovlnná rúra, elektrická stolná dvojplatnička, elektrický varič, elektrický kávovar, rýchlovarná kanvica, celoelektrický sporák","39711300-2 Elektrotepelné prístroje; 60000000-8 Dopravné služby (bez prepravy odpadu)","Tovar; Služba","","https://portal.eks.sk/SpravaKniznice/OpisneFormulareKniznice/VerejnyDetailOpisnehoFormularaKniznice/254064","0","0",
"OF-254078","Po karanténe","Informačná tabuľa - KN-KN ImproTrans","Informačná tabuľa, tabule","39294100-0 Informačné a propagačné výrobky; 30195000-2 Tabule; 60000000-8 Dopravné služby (bez prepravy odpadu)","Tovar; Služba","","https://portal.eks.sk/SpravaKniznice/OpisneFormulareKniznice/VerejnyDetailOpisnehoFormularaKniznice/254078","1","0",
"OF-254086","Po karanténe","Kancelárske potreby","zošit, obálky, zakladač pákový, rýchloviazače, zvýrazňovač, perá, lepidlá","30199230-1 Obálky; 22851000-0 Rýchloviazače; 22852000-7 Zakladače; 22830000-7 Zošity; 22816000-3 Bloky; 30192800-9 Samolepiace etikety; 60000000-8 Dopravné služby (bez prepravy odpadu)","Tovar; Služba","","https://portal.eks.sk/SpravaKniznice/OpisneFormulareKniznice/VerejnyDetailOpisnehoFormularaKniznice/254086","1","0",
"OF-254094","Po karanténe","1. Kamenivo pre vysprávky tryskovou metódou","drvený kameň, drvený kameň frakcie: 2-4, 2-5, kamenivo do bitúmenových zmesí","14212430-3 Kamenná drvina; 60000000-8 Dopravné služby (bez prepravy odpadu)","Tovar; Služba","","https://portal.eks.sk/SpravaKniznice/OpisneFormulareKniznice/VerejnyDetailOpisnehoFormularaKniznice/254094","0","0",
"OF-254102","Po karanténe","OOPP - okuliare, štuple, vesty","okuliare, chrániče sluchu, vesty","35113440-5 Reflexné vesty; 35113430-2 Bezpečnostné vesty; 33735100-2 Ochranné okuliare; 18141000-9 Pracovné rukavice; 60000000-8 Dopravné služby (bez prepravy odpadu)","Tovar; Služba","","https://portal.eks.sk/SpravaKniznice/OpisneFormulareKniznice/VerejnyDetailOpisnehoFormularaKniznice/254102","1","0",
"OF-254113","Po karanténe","Originálne odpadové nádoby na toner do multifunkčného zariadenia","odpadová nádoba","30125000-1 Časti a príslušenstvo fotokopírovacích prístrojov; 60000000-8 Dopravné služby (bez prepravy odpadu)","Tovar; Služba","","https://portal.eks.sk/SpravaKniznice/OpisneFormulareKniznice/VerejnyDetailOpisnehoFormularaKniznice/254113","1","0",
"OF-254123","Po karanténe","Stojan pod monitor","kancelárske potreby, stojan pod monitor","30192000-1 Kancelárske potreby; 60000000-8 Dopravné služby (bez prepravy odpadu)","Tovar; Služba","","https://portal.eks.sk/SpravaKniznice/OpisneFormulareKniznice/VerejnyDetailOpisnehoFormularaKniznice/254123","1","0",
"OF-254133","Po karanténe","Prenájom kontajnera vrátane nakládky, odvozu  a ekologickej likvidácie odpadu","kontajner, nakládka, odvoz, likvidácia, odpad","63110000-3 Manipulácia s nákladom; 63111000-0 Manipulácia s kontajnermi; 90512000-9 Služby na prepravu odpadu; 90510000-5 Likvidácia a spracovanie odpadu","Služba","","https://portal.eks.sk/SpravaKniznice/OpisneFormulareKniznice/VerejnyDetailOpisnehoFormularaKniznice/254133","0","0",
"OF-254147","Po karanténe","Dodávka kancelárskych potrieb","kancelárske potreby","30192000-1 Kancelárske potreby; 30190000-7 Rôzne kancelárske zariadenia a kancelárske potreby; 60000000-8 Dopravné služby (bez prepravy odpadu)","Tovar; Služba","","https://portal.eks.sk/SpravaKniznice/OpisneFormulareKniznice/VerejnyDetailOpisnehoFormularaKniznice/254147","0","0",
"OF-253951","Po karanténe","Originálne tonery","originál toner, HP, Xerox, Brother","30125000-1 Časti a príslušenstvo fotokopírovacích prístrojov; 30125120-8 Toner do fotokopírovacích strojov; 30125100-2 Tonerové náplne; 60000000-8 Dopravné služby (bez prepravy odpadu)","Tovar; Služba","","https://portal.eks.sk/SpravaKniznice/OpisneFormulareKniznice/VerejnyDetailOpisnehoFormularaKniznice/253951","1","0",
"OF-253963","Po karanténe","Senzory na meranie SpO2, PR","Senzory na meranie SpO2, PR","33140000-3 Zdravotnícky spotrebný materiál; 60000000-8 Dopravné služby (bez prepravy odpadu)","Tovar; Služba","","https://portal.eks.sk/SpravaKniznice/OpisneFormulareKniznice/VerejnyDetailOpisnehoFormularaKniznice/253963","0","0",
"OF-253974","Po karanténe","Granulované rýchlorozpustné hnojivo","Hnojivo pre všetky trávnaté plochy","24440000-0 Rôzne hnojivá; 60000000-8 Dopravné služby (bez prepravy odpadu)","Tovar; Služba","","https://portal.eks.sk/SpravaKniznice/OpisneFormulareKniznice/VerejnyDetailOpisnehoFormularaKniznice/253974","0","0",
"OF-253984","Po karanténe","IKT zariadenia","notebook, puzdro, modem, disk, projektor, kábel, laser, ukazovátko, zdroj","30200000-1 Počítačové zariadenia a spotrebný materiál; 30213100-6 Prenosné počítače; 30237270-2 Puzdrá na prenosné počítače; 32552410-4 Modemy; 30234000-8 Pamäťové médiá; 38652120-7 Videoprojektory; 32562100-1 Káble s optickým káblom na prenos informácií; 60000000-8 Dopravné služby (bez prepravy odpadu)","Tovar; Služba","","https://portal.eks.sk/SpravaKniznice/OpisneFormulareKniznice/VerejnyDetailOpisnehoFormularaKniznice/253984","0","0",
"OF-253996","Po karanténe","Stravné poukážky","stravná poukážka","30199770-8 Stravné poukážky; 60000000-8 Dopravné služby (bez prepravy odpadu)","Tovar; Služba","","https://portal.eks.sk/SpravaKniznice/OpisneFormulareKniznice/VerejnyDetailOpisnehoFormularaKniznice/253996","1","0",
"OF-254005","Po karanténe","Špecialny zdravotnícky materiál - centrálny venózny vstup určený na použitie pri dlhodobej chemoterapeutickej liečbe","centrálne venózne katétre,  PICC s rozšírenym príslušenstvom,","33141200-2 Katétre; 33141240-4 Príslušenstvo ku katétrom; 60000000-8 Dopravné služby (bez prepravy odpadu)","Tovar; Služba","","https://portal.eks.sk/SpravaKniznice/OpisneFormulareKniznice/VerejnyDetailOpisnehoFormularaKniznice/254005","0","0",
"OF-254016","Po karanténe","Dezinfekčné prostriedky","Dezinfekcia, dezinfekčné prostriedky na veľké plochy a povrchy","24455000-8 Dezinfekčné prostriedky; 60000000-8 Dopravné služby (bez prepravy odpadu)","Tovar; Služba","","https://portal.eks.sk/SpravaKniznice/OpisneFormulareKniznice/VerejnyDetailOpisnehoFormularaKniznice/254016","1","0",
"OF-254027","Po karanténe","Ručné nástroje a príslušenstvo","Montážna páka, sada kľúčov, kliešte, brzdové piesty, magnetické misky, pinzeta, sťahovaky pružín","44511000-5 Ručné nástroje; 44512000-2 Rôzne ručné nástroje; 44512940-3 Sada náradia; 43800000-1 Dielenské zariadenia; 18900000-8 Brašnárske výrobky, sedlárske výrobky, vrecká a tašky; 44511510-3 Listy (čepele) do ručných píl; 60000000-8 Dopravné služby (bez prepravy odpadu)","Tovar; Služba","","https://portal.eks.sk/SpravaKniznice/OpisneFormulareKniznice/VerejnyDetailOpisnehoFormularaKniznice/254027","0","0",
"OF-254036","Po karanténe","Stravné poukážky","stravné poukážky, stravné, poukážky","30199770-8 Stravné poukážky; 60000000-8 Dopravné služby (bez prepravy odpadu)","Tovar; Služba","","https://portal.eks.sk/SpravaKniznice/OpisneFormulareKniznice/VerejnyDetailOpisnehoFormularaKniznice/254036","1","0",
"OF-254047","Po karanténe","Výpočtová technika","AiO, počítač, NTB, notebook, tablet, čítačka kariet, USB kábel","30213000-5 Osobné počítače; 30213100-6 Prenosné počítače; 30237270-2 Puzdrá na prenosné počítače; 30213200-7 Tabletový počítač; 60000000-8 Dopravné služby (bez prepravy odpadu)","Tovar; Služba","","https://portal.eks.sk/SpravaKniznice/OpisneFormulareKniznice/VerejnyDetailOpisnehoFormularaKniznice/254047","0","0",
"OF-254058","Po karanténe","Múka, krupica, krúpy, ovsené vločky","Múka hladká, múka polohrubá, krupica, jačmenné krúpy, ovsené vločky","15612130-1 Hladká múka; 15612110-5 Hrubá múka; 15625000-5 Krupica; 15613380-5 Ovsené vločky; 60000000-8 Dopravné služby (bez prepravy odpadu)","Tovar; Služba","","https://portal.eks.sk/SpravaKniznice/OpisneFormulareKniznice/VerejnyDetailOpisnehoFormularaKniznice/254058","0","0",
"OF-254069","Po karanténe","Strážna služba","Strážna služba","79713000-5 Strážne služby; 79715000-9 Hliadkové služby","Služba","","https://portal.eks.sk/SpravaKniznice/OpisneFormulareKniznice/VerejnyDetailOpisnehoFormularaKniznice/254069","0","0",
"OF-254081","Po karanténe","Náhradné diely na autobusy Solaris U 15 - elektro","Náhradné diely, autobusy Solaris U15 -elektro","34121100-2 Autobusy verejnej dopravy; 31610000-5 Elektrické zariadenia pre motory a vozidlá; 60000000-8 Dopravné služby (bez prepravy odpadu)","Tovar","","https://portal.eks.sk/SpravaKniznice/OpisneFormulareKniznice/VerejnyDetailOpisnehoFormularaKniznice/254081","1","0",
"OF-254089","Po karanténe","Náhradné diely na Sor NB12,NB18 - elektro","Náhradné diely, autobus,Sor,elektro","34121100-2 Autobusy verejnej dopravy; 31610000-5 Elektrické zariadenia pre motory a vozidlá; 60000000-8 Dopravné služby (bez prepravy odpadu)","Tovar","","https://portal.eks.sk/SpravaKniznice/OpisneFormulareKniznice/VerejnyDetailOpisnehoFormularaKniznice/254089","1","0",
"OF-254097","Po karanténe","Zariadenia na klimatizáciu, chladenie vzduchu a príslušenstvo","mobilná klimatizácia, prenosná klimatizácia, klimatizácia, stĺpový ventilátor","39717200-3 Klimatizačné spotrebiče; 39717000-1 Ventilátory a klimatizačné spotrebiče; 39714100-1 Ventilátory; 60000000-8 Dopravné služby (bez prepravy odpadu)","Tovar; Služba","","https://portal.eks.sk/SpravaKniznice/OpisneFormulareKniznice/VerejnyDetailOpisnehoFormularaKniznice/254097","0","0",
"OF-254107","Po karanténe","Laboratórne komponenty využiteľné v laboratóriách","laboratórne komponenty, chemikálie, laboratórne pomôcky","24000000-4 Chemické výrobky; 24960000-1 Rôzne chemické výrobky","Tovar","","https://portal.eks.sk/SpravaKniznice/OpisneFormulareKniznice/VerejnyDetailOpisnehoFormularaKniznice/254107","0","0",
"OF-254116","Po karanténe","Stravné poukážky","Stravné poukážky,stravné lístky, gastro lístky","30199770-8 Stravné poukážky; 60000000-8 Dopravné služby (bez prepravy odpadu)","Tovar; Služba","","https://portal.eks.sk/SpravaKniznice/OpisneFormulareKniznice/VerejnyDetailOpisnehoFormularaKniznice/254116","1","0",
"OF-254126","Po karanténe","Zariadenia na chladenie, mrazenie a príslušenstvo","mraznička, chladnička","39711100-0 Chladničky a mrazničky; 42513000-5 Chladiace a mraziace zariadenia; 39711130-9 Chladničky; 39221000-7 Kuchynské vybavenie; 60000000-8 Dopravné služby (bez prepravy odpadu)","Tovar; Služba","","https://portal.eks.sk/SpravaKniznice/OpisneFormulareKniznice/VerejnyDetailOpisnehoFormularaKniznice/254126","0","0",
"OF-253979","Po karanténe","Základné potraviny a vajcia","trvanlivé potraviny, lekvár, kompót, oleje, cestoviny, ryža, cukor, čaj, vajcia, orechy, huby, chuťové prísady","15890000-3 Rôzne potravinové výrobky a sušený tovar; 15330000-0 Spracované ovocie a zelenina; 15332200-6 Džemy a marmelády, ovocné želé; ovocné alebo orechové pyré a pasty/pretlaky; 15612000-1 Obilná alebo rastlinná múka a príbuzné výrobky; 15411100-3 Rastlinné oleje; 15831000-2 Cukor; 03211300-6 Ryža; 15870000-7 Koreniny a chuťové prísady; 03142500-3 Vajcia; 03221260-6 Huby; 60000000-8 Dopravné služby (bez prepravy odpadu)","Tovar; Služba","","https://portal.eks.sk/SpravaKniznice/OpisneFormulareKniznice/VerejnyDetailOpisnehoFormularaKniznice/253979","0","0",
"OF-253988","Po karanténe","Dodávka elektrickej energie","Elektrická energia, distribúcia elektrickej energie, dodávka elektriny","09310000-5 Elektrická energia","Tovar; Služba","","https://portal.eks.sk/SpravaKniznice/OpisneFormulareKniznice/VerejnyDetailOpisnehoFormularaKniznice/253988","0","0",
"OF-254000","Po karanténe","Originálne tonery, atramentové náplne, pásky a náhradné diely pre tlačiarne, kopírovacie a multifunkčné zariadenia.","toner, tonery, tonerové náplne","30125100-2 Tonerové náplne; 30125120-8 Toner do fotokopírovacích strojov; 30125110-5 Toner do laserových tlačiarní/faxových prístrojov; 30192113-6 Atramentové náplne; 60000000-8 Dopravné služby (bez prepravy odpadu)","Tovar; Služba","","https://portal.eks.sk/SpravaKniznice/OpisneFormulareKniznice/VerejnyDetailOpisnehoFormularaKniznice/254000","0","0",
"OF-254008","Po karanténe","Železiarske výrobky a brusivá","Brúsny papier, rezný kotúč, zámok visiaci, drôt plombovací, skrutka do dreva, vrták, závlačka, pletivo","14522300-9 Šmirgeľ; 44316000-8 Železiarsky tovar; 44521000-8 Rôzne visiace zámky a zámky; 19520000-7 Plastové výrobky; 44531100-2 Skrutky do dreva; 44312300-3 Ostnatý drôt; 44313000-7 Kovové pletivo; 39516120-9 Podložky","Tovar; Služba","","https://portal.eks.sk/SpravaKniznice/OpisneFormulareKniznice/VerejnyDetailOpisnehoFormularaKniznice/254008","0","0",
"OF-254022","Po karanténe","Servis nákladných vozidiel Mercedes","Časová ročná prehliadka vozidiel Mercedes Arocs, Actros a Unimog, brzdy, geometria, servisné práce","50111000-6 Správa, opravy a údržba vozového parku; 60000000-8 Dopravné služby (bez prepravy odpadu)","Služba","","https://portal.eks.sk/SpravaKniznice/OpisneFormulareKniznice/VerejnyDetailOpisnehoFormularaKniznice/254022","0","0",
"OF-254031","Po karanténe","Priemyselná vysokootáčková automatická práčka odpružená ","priemyselná automatická práčka odpružená","42716120-5 Práčky; 60000000-8 Dopravné služby (bez prepravy odpadu)","Tovar; Služba","","https://portal.eks.sk/SpravaKniznice/OpisneFormulareKniznice/VerejnyDetailOpisnehoFormularaKniznice/254031","1","0",
"OF-254040","Po karanténe","Nákup vysokozdvižného vozíka","Vysokozdvižný vozík stredný so spaľovacím dieselovým motorom","42415110-2 Vysokozdvižné vozíky; 42415210-3 Pracovné vozíky opatrené manipulačným zariadením; 60000000-8 Dopravné služby (bez prepravy odpadu); 42400000-0 Zdvižné a manipulačné zariadenia a ich časti; 42415100-9 Zdvižné vozíky; 42415000-8 Vysokozdvižné vozíky, pracovné nákladné vozidlá, ťahače používané na železničných nástupištiach","Tovar","","https://portal.eks.sk/SpravaKniznice/OpisneFormulareKniznice/VerejnyDetailOpisnehoFormularaKniznice/254040","0","0",
"OF-254051","Po karanténe","Váha žeriavová","váha","38300000-8 Meracie prístroje; 60000000-8 Dopravné služby (bez prepravy odpadu)","Tovar; Služba","","https://portal.eks.sk/SpravaKniznice/OpisneFormulareKniznice/VerejnyDetailOpisnehoFormularaKniznice/254051","1","0",
"OF-254062","Po karanténe","Asfaltová emulzia C65B4 alebo ekvivalent  ( rok 2022 )","asfaltová emulzia, spojovací náter, spojovací nástrek","44113700-2 Materiály na opravu ciest; 44113800-3 Materiály na úpravu povrchu ciest; 44113600-1 Bitúmen a asfalt; 44113900-4 Materiály na údržbu ciest; 60000000-8 Dopravné služby (bez prepravy odpadu)","Tovar; Služba","","https://portal.eks.sk/SpravaKniznice/OpisneFormulareKniznice/VerejnyDetailOpisnehoFormularaKniznice/254062","0","0",
"OF-254075","Po karanténe","Nízkozdvižný ručný vozík a kliešte segerové","vozík, kliešte","42415210-3 Pracovné vozíky opatrené manipulačným zariadením; 44511000-5 Ručné nástroje; 60000000-8 Dopravné služby (bez prepravy odpadu)","Tovar; Služba","","https://portal.eks.sk/SpravaKniznice/OpisneFormulareKniznice/VerejnyDetailOpisnehoFormularaKniznice/254075","1","0",
"OF-254084","Po karanténe","Náhradné diely na autobusy Solaris U15 - podvozok","Náhradné diely, autobus,Solaris U15,podvozok","34121100-2 Autobusy verejnej dopravy; 34139200-2 Samotný podvozok; 60000000-8 Dopravné služby (bez prepravy odpadu)","Tovar","","https://portal.eks.sk/SpravaKniznice/OpisneFormulareKniznice/VerejnyDetailOpisnehoFormularaKniznice/254084","1","0",
"OF-254092","Po karanténe","Rukávový znak, nášivka","Vojenský rukávový znak, nášivka","39561133-3 Insígnie; 98393000-4 Krajčírske služby; 39561000-2 Tyl, krajka, stuhy, lemovky a výšivky; 60000000-8 Dopravné služby (bez prepravy odpadu)","Tovar; Služba","","https://portal.eks.sk/SpravaKniznice/OpisneFormulareKniznice/VerejnyDetailOpisnehoFormularaKniznice/254092","0","0",
"OF-254100","Po karanténe","Mäso a mäsové výrobky","bravčové mäso, hovädzie mäso, mäsové výrobky","15100000-9 Živočíšne výrobky, mäso a mäsové výrobky; 15113000-3 Bravčové mäso; 15111100-0 Hovädzie mäso; 15130000-8 Mäsové výrobky; 60000000-8 Dopravné služby (bez prepravy odpadu)","Tovar; Služba","","https://portal.eks.sk/SpravaKniznice/OpisneFormulareKniznice/VerejnyDetailOpisnehoFormularaKniznice/254100","0","0",
"OF-254110","Po karanténe","Náhradné diely na Sor NB12,NB18 - elektro","Náhradné diely, autobus,Sor,elektro","34121100-2 Autobusy verejnej dopravy; 31610000-5 Elektrické zariadenia pre motory a vozidlá; 60000000-8 Dopravné služby (bez prepravy odpadu)","Tovar","","https://portal.eks.sk/SpravaKniznice/OpisneFormulareKniznice/VerejnyDetailOpisnehoFormularaKniznice/254110","1","0",
"OF-254121","Po karanténe","Kolesový traktor a čelný nakladač","traktor, čelný nakladač, nakladač,","16700000-2 Traktory/ťahače; 43250000-0 Čelné lopatové nakladače; 60000000-8 Dopravné služby (bez prepravy odpadu)","Tovar; Služba","","https://portal.eks.sk/SpravaKniznice/OpisneFormulareKniznice/VerejnyDetailOpisnehoFormularaKniznice/254121","1","0",
"OF-254131","Po karanténe","Respirátor FFP2 bez výdychového ventilu","respirátor, FFP2, výdychový, ventil, s gumičkami, OOPP","33140000-3 Zdravotnícky spotrebný materiál; 60000000-8 Dopravné služby (bez prepravy odpadu)","Tovar; Služba","","https://portal.eks.sk/SpravaKniznice/OpisneFormulareKniznice/VerejnyDetailOpisnehoFormularaKniznice/254131","0","0",
"OF-254145","Po karanténe","Kalibrácie meracích prístrojov - CMS ","Kalibrácia","50433000-9 Kalibrovanie; 60000000-8 Dopravné služby (bez prepravy odpadu)","Služba","","https://portal.eks.sk/SpravaKniznice/OpisneFormulareKniznice/VerejnyDetailOpisnehoFormularaKniznice/254145","0","0",
"OF-253976","Po karanténe","Mäso a mäsové výrobky","bravčové mäso, hovädzie mäso, hydina, mäsové výrobky","15100000-9 Živočíšne výrobky, mäso a mäsové výrobky; 15113000-3 Bravčové mäso; 15111100-0 Hovädzie mäso; 15112000-6 Hydina; 15130000-8 Mäsové výrobky; 60000000-8 Dopravné služby (bez prepravy odpadu)","Tovar; Služba","","https://portal.eks.sk/SpravaKniznice/OpisneFormulareKniznice/VerejnyDetailOpisnehoFormularaKniznice/253976","0","0",
"OF-253986","Po karanténe","Senzory na meranie SpO2, PR, Pi, PVi","Senzory na meranie SpO2, PR, Pi, PVi","33140000-3 Zdravotnícky spotrebný materiál; 60000000-8 Dopravné služby (bez prepravy odpadu)","Tovar; Služba","","https://portal.eks.sk/SpravaKniznice/OpisneFormulareKniznice/VerejnyDetailOpisnehoFormularaKniznice/253986","0","0",
"OF-253998","Po karanténe","Pranie, chemické čistenie a žehlenie bielizne a textilu, jeho odvoz a dovoz podľa požiadaviek objednávateľa","pranie a chemické čistenie, žehlenie, bielizeň, textil","98310000-9 Pranie a chemické čistenie; 98315000-4 Žehlenie; 60000000-8 Dopravné služby (bez prepravy odpadu)","Služba","","https://portal.eks.sk/SpravaKniznice/OpisneFormulareKniznice/VerejnyDetailOpisnehoFormularaKniznice/253998","1","0",
"OF-254007","Po karanténe","Bahenný kôš","kôš, bahenný, vpuste","44131000-7 Kanalizačné šachty; 34920000-2 Cestné príslušenstvo","Tovar","","https://portal.eks.sk/SpravaKniznice/OpisneFormulareKniznice/VerejnyDetailOpisnehoFormularaKniznice/254007","0","0",
"OF-254021","Po karanténe","Originálne tonery","originál toner, Xerox, Canon, HP","30125000-1 Časti a príslušenstvo fotokopírovacích prístrojov; 30125120-8 Toner do fotokopírovacích strojov; 30125100-2 Tonerové náplne; 60000000-8 Dopravné služby (bez prepravy odpadu)","Tovar; Služba","","https://portal.eks.sk/SpravaKniznice/OpisneFormulareKniznice/VerejnyDetailOpisnehoFormularaKniznice/254021","1","0",
"OF-254029","Po karanténe"," Štiepkovač za traktor ","štiepkovač, traktor","43414000-8 Drviče; 34390000-7 Príslušenstvo ťahačov/traktorov; 60000000-8 Dopravné služby (bez prepravy odpadu)","Tovar; Služba","","https://portal.eks.sk/SpravaKniznice/OpisneFormulareKniznice/VerejnyDetailOpisnehoFormularaKniznice/254029","1","0",
"OF-254039","Po karanténe","Dodanie darčekových poukážok s univerzálnym využitím","Darčekové poukážky","30199750-2 Poukážky; 60000000-8 Dopravné služby (bez prepravy odpadu)","Tovar; Služba","","https://portal.eks.sk/SpravaKniznice/OpisneFormulareKniznice/VerejnyDetailOpisnehoFormularaKniznice/254039","1","0",
"OF-254049","Po karanténe","Kancelárske potreby","Kancelárske potreby","30192000-1 Kancelárske potreby; 60000000-8 Dopravné služby (bez prepravy odpadu)","Tovar; Služba","","https://portal.eks.sk/SpravaKniznice/OpisneFormulareKniznice/VerejnyDetailOpisnehoFormularaKniznice/254049","1","0",
"OF-254061","Po karanténe","Hlbokozmrazená hydina, hlbokozmrazená zelenina, mrazené polotovary","Hlbokozmrazené potraviny, hlbokozmrazená hydina,hlbokozmrazená zelenina, mrazené polotovary","15896000-5 Hlboko zmrazené výrobky; 15331170-9 Mrazená zelenina; 15311000-1 Mrazené zemiaky; 60000000-8 Dopravné služby (bez prepravy odpadu)","Tovar; Služba","","https://portal.eks.sk/SpravaKniznice/OpisneFormulareKniznice/VerejnyDetailOpisnehoFormularaKniznice/254061","0","0",
"OF-254074","Po karanténe","Dodávka zemného plynu","zemný plyn","09123000-7 Zemný plyn; 60000000-8 Dopravné služby (bez prepravy odpadu)","Tovar; Služba","","https://portal.eks.sk/SpravaKniznice/OpisneFormulareKniznice/VerejnyDetailOpisnehoFormularaKniznice/254074","0","0",
"OF-254083","Po karanténe","Náhradné diely na autobusy Solaris U15 - hnacie ústrojenstvo","Náhradné diely, autobus,Solaris U15,hnacie ústrojenstvo","34121100-2 Autobusy verejnej dopravy; 42111000-0 Motory a hnacie zariadenia; 60000000-8 Dopravné služby (bez prepravy odpadu)","Tovar","","https://portal.eks.sk/SpravaKniznice/OpisneFormulareKniznice/VerejnyDetailOpisnehoFormularaKniznice/254083","1","0",
"OF-254091","Po karanténe","Anestézia a resuscitácia","zdravotnícky spotrebný materiál","33170000-2 Anestézia a resuscitácia; 60000000-8 Dopravné služby (bez prepravy odpadu)","Tovar; Služba","","https://portal.eks.sk/SpravaKniznice/OpisneFormulareKniznice/VerejnyDetailOpisnehoFormularaKniznice/254091","1","0",
"OF-254099","Po karanténe","kancelárske potreby","papier","30192000-1 Kancelárske potreby; 60000000-8 Dopravné služby (bez prepravy odpadu)","Tovar; Služba","","https://portal.eks.sk/SpravaKniznice/OpisneFormulareKniznice/VerejnyDetailOpisnehoFormularaKniznice/254099","0","0",
"OF-254109","Po karanténe","Lieky ostatné - ATC skupiny N05","Alprazolam, Aripiprazol, Bromazepam, Dexmedetomidín, Diazepam, Haloperidol, Hydroxyzín,  Chlórprotixén, Levomepromazín, Mefenoxalón, Midazolam, Olanzapín, Oxazepam, Risperidón, Tiaprid,","33661500-6 Psycholeptiká; 60000000-8 Dopravné služby (bez prepravy odpadu)","Tovar; Služba","","https://portal.eks.sk/SpravaKniznice/OpisneFormulareKniznice/VerejnyDetailOpisnehoFormularaKniznice/254109","0","0",
"OF-254120","Po karanténe","Maliarske náradie a pomôcky ","Maliarska páska, štetce, valčeky,  súprava na maľovanie, teflonová páska","37820000-2 Potreby pre maliarov; 44424200-0 Priľnavé pásky; 60000000-8 Dopravné služby (bez prepravy odpadu); 39224210-3 Maliarske štetce; 34312500-2 Tesnenia","Tovar; Služba","","https://portal.eks.sk/SpravaKniznice/OpisneFormulareKniznice/VerejnyDetailOpisnehoFormularaKniznice/254120","0","0",
