"OpisnyFormularIdentifikator","OpisnyFormularStav","OpisnyFormularNazov","OpisnyFormularKlucoveSlova","OpisnyFormularCpv","OpisnyFormularDruh","OpisnyFormularKategoriaSluzieb","OpisnyFormularUrl","OpisnyFormularPocetVyhlasenychZakaziek","OpisnyFormularObchodovanaSumaBezDPH",
"OF-216793","Po karanténe","Elektroinštalačný materiál","poistky, ističe, káble, spínače, zásuvky, svietidlá","31211300-1 Poistky; 31214100-0 Spínače; 31224100-3 Zástrčky a zásuvky; 31342000-5 Svorky izolovaných káblov; 32442100-4 Svorkovnice; 44321000-6 Káble; 31520000-7 Lampy/svietidlá a príslušenstvo k nim; 60000000-8 Dopravné služby (bez prepravy odpadu)","Tovar; Služba","","https://portal.eks.sk/SpravaKniznice/OpisneFormulareKniznice/VerejnyDetailOpisnehoFormularaKniznice/216793","0","0",
"OF-220964","Po karanténe","Nákup osobného motorového vozidla formou operatívneho leasingu","operatívny leasing, lízing, osobný automobil","34100000-8 Motorové vozidlá; 66114000-2 Finančný lízing; 60000000-8 Dopravné služby (bez prepravy odpadu)","Tovar; Služba","","https://portal.eks.sk/SpravaKniznice/OpisneFormulareKniznice/VerejnyDetailOpisnehoFormularaKniznice/220964","0","0",
"OF-220981","Po karanténe","Okná, dvere a súvisiace prvky","Sprchový záves, siete proti hmyzu, kľučky, dverové kovanie, dverové prahy","39515100-6 Záclony/závesy; 39525500-3 Siete proti hmyzu; 44112600-4 Zvuková izolácia; 44221000-5 Okná, dvere a súvisiace prvky; 44221213-1 Dverové prahy; 60000000-8 Dopravné služby (bez prepravy odpadu)","Tovar; Služba","","https://portal.eks.sk/SpravaKniznice/OpisneFormulareKniznice/VerejnyDetailOpisnehoFormularaKniznice/220981","0","0",
"OF-221355","Po karanténe","Strážna služba","strážna služba","79713000-5 Strážne služby","Služba","","https://portal.eks.sk/SpravaKniznice/OpisneFormulareKniznice/VerejnyDetailOpisnehoFormularaKniznice/221355","1","0",
"OF-221500","Po karanténe","Analýza zhody stavu kybernetickej bezpečnosti s požiadavkami zákona, ","Štúdia realizovateľnosti, poradenská služba, analýza, strategické prehodnotenie informačných systémov alebo technológie, analýza údajov, právna analýza","71241000-9 Štúdia realizovateľnosti, poradenská služba, analýza; 72222100-8 Strategické prehodnotenie informačných systémov alebo technológie; 72316000-3 Analýza údajov","Služba","","https://portal.eks.sk/SpravaKniznice/OpisneFormulareKniznice/VerejnyDetailOpisnehoFormularaKniznice/221500","0","0",
"OF-221681","Po karanténe","Dodávka originálnych atramentových a tonerových kaziet  ","tonerová kazeta, atramentová kazeta, tlačová páska, valec","30125100-2 Tonerové náplne; 30125110-5 Toner do laserových tlačiarní/faxových prístrojov; 30192320-0 Pásky do tlačiarní; 60000000-8 Dopravné služby (bez prepravy odpadu)","Tovar; Služba","","https://portal.eks.sk/SpravaKniznice/OpisneFormulareKniznice/VerejnyDetailOpisnehoFormularaKniznice/221681","0","0",
"OF-221801","Po karanténe","Monitor 16"" Philips 162B9T alebo ekvivalent","monitor, IT, hardware, hardver, PC príslušenstvo, doprava, informatika,","30200000-1 Počítačové zariadenia a spotrebný materiál; 30230000-0 Zariadenia súvisiace s počítačmi; 30231000-7 Počítačové monitory a konzoly; 30231300-0 Zobrazovacie jednotky (obrazovky); 30231310-3 Ploché displeje; 60000000-8 Dopravné služby (bez prepravy odpadu)","Tovar; Služba","","https://portal.eks.sk/SpravaKniznice/OpisneFormulareKniznice/VerejnyDetailOpisnehoFormularaKniznice/221801","0","0",
"OF-221809","Po karanténe","Kancelárska stolička otočná so synchrónnou mechanikou.","kancelárska stolička, kancelárske kreslo","39113100-8 Kreslá; 60000000-8 Dopravné služby (bez prepravy odpadu); 39130000-2 Kancelársky nábytok; 39113000-7 Rôzne sedadlá a stoličky","Tovar; Služba","","https://portal.eks.sk/SpravaKniznice/OpisneFormulareKniznice/VerejnyDetailOpisnehoFormularaKniznice/221809","1","0",
"OF-221873","Po karanténe","Kancelársky papier - ekologicky vyrobený","Kancelársky papier - ekologicky vyrobený","30197644-2 Xerografický papier","Tovar","","https://portal.eks.sk/SpravaKniznice/OpisneFormulareKniznice/VerejnyDetailOpisnehoFormularaKniznice/221873","1","0",
"OF-221878","Po karanténe","Diagnostický spotrebný materiál pre prenatálny skríning","Diagnostický spotrebný materiál pre prenatálny skríning","33124130-5 Diagnostický spotrebný materiál; 33141625-7 Diagnostické súpravy; 60000000-8 Dopravné služby (bez prepravy odpadu)","Tovar; Služba","","https://portal.eks.sk/SpravaKniznice/OpisneFormulareKniznice/VerejnyDetailOpisnehoFormularaKniznice/221878","0","0",
"OF-221980","Po karanténe","Športové a rekreačné vybavenie","bežecký pás, cyklotrenažér, stôl na stolný tenis, činky, bosu, tenisová raketa, posilňopvacia veža, tenisové loptičky, tenisové rakety, žinenka, florbalová hokejka, florbalová loptička, vak na florbalové loptičky, vak na florbalové hokejky, TRX systém, raketa na stolný tenis, loptičky na stolný tenis","37441100-2 Bežecké pásy; 37441300-4 Stacionárne bicykle; 37461500-2 Stoly na stolný tenis; 37442100-8 Jednoručné činky; 37441700-8 Cvičné lopty; 37452730-7 Tenisové rakety; 37442400-8 Lavice alebo stojany na závažia; 37442900-8 Posilňovacie veže; 37461520-8 Stolnotenisové rakety; 37421000-5 Žinenky do telocviční; 37452710-1 Tenisové loptičky; 37535292-0 Laná na šplhanie; 37420000-8 Výbava do telocvične; 60000000-8 Dopravné služby (bez prepravy odpadu)","Tovar; Služba","","https://portal.eks.sk/SpravaKniznice/OpisneFormulareKniznice/VerejnyDetailOpisnehoFormularaKniznice/221980","1","0",
"OF-221998","Po karanténe","Laboratórna sušiareň","sušička, vzorky","42300000-9 Priemyselné alebo laboratórne pece, spaľovacie pece a rúry (na pečenie); 60000000-8 Dopravné služby (bez prepravy odpadu)","Tovar; Služba","","https://portal.eks.sk/SpravaKniznice/OpisneFormulareKniznice/VerejnyDetailOpisnehoFormularaKniznice/221998","0","0",
"OF-222015","Po karanténe","Taniere","taniere","39221210-2 Taniere; 60000000-8 Dopravné služby (bez prepravy odpadu)","Tovar; Služba","","https://portal.eks.sk/SpravaKniznice/OpisneFormulareKniznice/VerejnyDetailOpisnehoFormularaKniznice/222015","0","0",
"OF-222027","Po karanténe","Prietokomer a odberové čerpadlo","prietokomer","38000000-5 Laboratórne, optické a presné prístroje a vybavenie (s výnimkou skiel); 60000000-8 Dopravné služby (bez prepravy odpadu)","Tovar; Služba","","https://portal.eks.sk/SpravaKniznice/OpisneFormulareKniznice/VerejnyDetailOpisnehoFormularaKniznice/222027","0","0",
"OF-222103","Po karanténe","Originálne tonerové náplne a príslušenstvo","tonery, náplne, originály, farby, príslušenstvo","30125100-2 Tonerové náplne; 60000000-8 Dopravné služby (bez prepravy odpadu)","Tovar; Služba","","https://portal.eks.sk/SpravaKniznice/OpisneFormulareKniznice/VerejnyDetailOpisnehoFormularaKniznice/222103","1","0",
"OF-222104","Po karanténe","Učebnice ","učebnice, základná škola","22112000-8 Učebnice; 60000000-8 Dopravné služby (bez prepravy odpadu)","Tovar; Služba","","https://portal.eks.sk/SpravaKniznice/OpisneFormulareKniznice/VerejnyDetailOpisnehoFormularaKniznice/222104","1","0",
"OF-222113","Po karanténe","Nákup originál tonerov","tonerové kazety, tonery, originálne tonery, tonerové náplne, tlač","30125100-2 Tonerové náplne; 30125120-8 Toner do fotokopírovacích strojov; 30125110-5 Toner do laserových tlačiarní/faxových prístrojov","Tovar","","https://portal.eks.sk/SpravaKniznice/OpisneFormulareKniznice/VerejnyDetailOpisnehoFormularaKniznice/222113","0","0",
"OF-222121","Po karanténe","Ohrievacie teleso na ohrev vzduchu","teleso, ohrev vzduchu, vykurovanie, špirála","31670000-3 Elektrické časti strojov alebo prístrojov; 60000000-8 Dopravné služby (bez prepravy odpadu)","Tovar; Služba","","https://portal.eks.sk/SpravaKniznice/OpisneFormulareKniznice/VerejnyDetailOpisnehoFormularaKniznice/222121","1","0",
"OF-222123","Po karanténe","Príslušenstvo k pľúcnym ventilátorom HAMILTON C1","Zdravotnícke prístroje, ventilátor na umelú ventiláciu pľúc, transportný ventilátor, univerzálny dýchací prístroj, servoventilátor","33157400-9 Lekárske dýchacie prístroje; 60000000-8 Dopravné služby (bez prepravy odpadu); 51410000-9 Inštalácia lekárskych zariadení","Tovar; Služba","","https://portal.eks.sk/SpravaKniznice/OpisneFormulareKniznice/VerejnyDetailOpisnehoFormularaKniznice/222123","1","0",
"OF-222141","Po karanténe","Notebooky, PC a počítačové príslušenstvo","Notebooky, All in one, SSD disk, streambox, pamäťová karta, externý disk, monitor","30200000-1 Počítačové zariadenia a spotrebný materiál; 30233100-2 Počítačové pamäťové jednotky; 30213100-6 Prenosné počítače; 30237000-9 Časti a príslušenstvo počítačov a spotrebný materiál k nim; 30231000-7 Počítačové monitory a konzoly; 60000000-8 Dopravné služby (bez prepravy odpadu)","Tovar; Služba","","https://portal.eks.sk/SpravaKniznice/OpisneFormulareKniznice/VerejnyDetailOpisnehoFormularaKniznice/222141","1","0",
"OF-222156","Po karanténe","Špeciálne chemikálie a laboratórny materiál","chemikálie, laboratórne pomôcky, miska na váženie, špachtle, pinzety, sklenený kahan","24960000-1 Rôzne chemické výrobky; 24000000-4 Chemické výrobky; 38000000-5 Laboratórne, optické a presné prístroje a vybavenie (s výnimkou skiel); 33790000-4 Laboratórny, zdravotnícky alebo farmaceutický sklenený tovar","Tovar","","https://portal.eks.sk/SpravaKniznice/OpisneFormulareKniznice/VerejnyDetailOpisnehoFormularaKniznice/222156","1","0",
"OF-222181","Po karanténe","Drogistický tovar","prací prášok, čistiaci prostriedok, mydlo, dezinfekcia, aviváž, mop, vrecia, farba, lak, lepidlo, pasta, rukavice, sitko, gél","39831000-6 Pracie prostriedky; 39830000-9 Čistiace výrobky; 33711900-6 Mydlo; 18930000-7 Vrecia a vaky; 18141000-9 Pracovné rukavice; 44820000-4 Laky; 44810000-1 Náterové farby","Tovar; Služba","","https://portal.eks.sk/SpravaKniznice/OpisneFormulareKniznice/VerejnyDetailOpisnehoFormularaKniznice/222181","1","0",
"OF-222202","Po karanténe","Panel NA ANALÝZU 22 POTKANÍCH cytokínov a chemokínov ","Panel NA ANALÝZU 22 POTKANÍCH cytokínov a chemokínov","33140000-3 Zdravotnícky spotrebný materiál; 24000000-4 Chemické výrobky; 33141625-7 Diagnostické súpravy; 60000000-8 Dopravné služby (bez prepravy odpadu)","Tovar; Služba","","https://portal.eks.sk/SpravaKniznice/OpisneFormulareKniznice/VerejnyDetailOpisnehoFormularaKniznice/222202","1","0",
"OF-222210","Po karanténe","PC komponenty 22/2020","skrinka pc, procesor, pamäť, základná doska, grafická karta, SSD disk, operačný systém, klávesnica, myš, DVD mechanika, monitor,zdroj","30211500-6 Centrálne riadiace jednotky (CPU) alebo procesory; 30237100-0 Časti počítačov; 30233132-5 Mechaniky pevného disku; 30233100-2 Počítačové pamäťové jednotky; 30237140-2 Základné dosky; 30237130-9 Počítačové karty; 30231000-7 Počítačové monitory a konzoly; 48620000-0 Operačné systémy; 30237460-1 Počítačové klávesnice; 30233152-1 Čítačka a/alebo vypaľovačka digitálnych univerzálnych diskov (DVD); 30237410-6 Počítačová myš; 60000000-8 Dopravné služby (bez prepravy odpadu)","Tovar; Služba","","https://portal.eks.sk/SpravaKniznice/OpisneFormulareKniznice/VerejnyDetailOpisnehoFormularaKniznice/222210","1","0",
"OF-222211","Po karanténe","IKT zariadenia","telefón, tablet","30200000-1 Počítačové zariadenia a spotrebný materiál; 30213100-6 Prenosné počítače; 32250000-0 Mobilné telefóny; 60000000-8 Dopravné služby (bez prepravy odpadu)","Tovar; Služba","","https://portal.eks.sk/SpravaKniznice/OpisneFormulareKniznice/VerejnyDetailOpisnehoFormularaKniznice/222211","1","0",
"OF-222229","Po karanténe","Nákup osobného motorového vozidla pre ŠT 1 a ŠT 2","automobil, osobný, preprava osôb","34115200-8 Motorové vozidlá na prepravu menej než 10 osôb","Tovar","","https://portal.eks.sk/SpravaKniznice/OpisneFormulareKniznice/VerejnyDetailOpisnehoFormularaKniznice/222229","0","0",
"OF-222236","Po karanténe","Vrecia na odpad, toaletný papier, čistiace prostriedky","Vrecia na odpad, toaletný papier, čistiace prostriedky","19640000-4 Polyetylénový odpad a odpadkové vrecká a vaky; 60000000-8 Dopravné služby (bez prepravy odpadu); 33761000-2 Toaletný papier; 24455000-8 Dezinfekčné prostriedky; 39800000-0 Čistiace a leštiace výrobky","Tovar; Služba","","https://portal.eks.sk/SpravaKniznice/OpisneFormulareKniznice/VerejnyDetailOpisnehoFormularaKniznice/222236","0","0",
"OF-222240","Po karanténe","Chemikálie","toluén, octan amónny, etylalkohol, kyselina sírová, metanol, peroxid vodíka","24300000-7 Základné anorganické a organické chemikálie; 60000000-8 Dopravné služby (bez prepravy odpadu)","Tovar; Služba","","https://portal.eks.sk/SpravaKniznice/OpisneFormulareKniznice/VerejnyDetailOpisnehoFormularaKniznice/222240","1","0",
"OF-222245","Po karanténe","PC pre riaditeľstvo","PC","30213300-8 Stolový počítač; 60000000-8 Dopravné služby (bez prepravy odpadu)","Tovar; Služba","","https://portal.eks.sk/SpravaKniznice/OpisneFormulareKniznice/VerejnyDetailOpisnehoFormularaKniznice/222245","1","0",
"OF-222250","Po karanténe","Upratovanie dopravných prostriedkov - električky a autobusy","upratovanie, upratovanie vozidiel, čistenie priestoru, čistenie podlahy,  tepovanie, tepovanie stoličiek, vysávanie utretie prachu","90910000-9 Upratovacie služby; 90917000-8 Čistenie dopravných zariadení","Služba; Tovar","","https://portal.eks.sk/SpravaKniznice/OpisneFormulareKniznice/VerejnyDetailOpisnehoFormularaKniznice/222250","1","0",
"OF-222251","Po karanténe","Laboratórne chemikália","chemikália, laboratórium, výskum, pokus","24000000-4 Chemické výrobky; 24300000-7 Základné anorganické a organické chemikálie; 60000000-8 Dopravné služby (bez prepravy odpadu)","Tovar; Služba","","https://portal.eks.sk/SpravaKniznice/OpisneFormulareKniznice/VerejnyDetailOpisnehoFormularaKniznice/222251","1","0",
"OF-222252","Po karanténe","Laboratórny spotrebný materiál ","materiál, laboratórium, výskum, pokus","38000000-5 Laboratórne, optické a presné prístroje a vybavenie (s výnimkou skiel); 33793000-5 Sklenené výrobky pre laboratóriá; 33192500-7 Skúmavky; 60000000-8 Dopravné služby (bez prepravy odpadu)","Tovar; Služba","","https://portal.eks.sk/SpravaKniznice/OpisneFormulareKniznice/VerejnyDetailOpisnehoFormularaKniznice/222252","1","0",
"OF-222254","Po karanténe","Laboratórne chemikálie","chemikália, laboratórium, výskum, pokus","24000000-4 Chemické výrobky; 24300000-7 Základné anorganické a organické chemikálie; 60000000-8 Dopravné služby (bez prepravy odpadu)","Tovar; Služba","","https://portal.eks.sk/SpravaKniznice/OpisneFormulareKniznice/VerejnyDetailOpisnehoFormularaKniznice/222254","1","0",
"OF-222255","Po karanténe","Odber, odvoz, zneškodňovanie a likvidácia ostatných odpadov.  ","Odber, odvoz, zneškodňovanie a likvidácia odpadov, lapač tukov, odlučovač tukov, jedlé olje a tuky","90510000-5 Likvidácia a spracovanie odpadu; 90512000-9 Služby na prepravu odpadu","Služba","","https://portal.eks.sk/SpravaKniznice/OpisneFormulareKniznice/VerejnyDetailOpisnehoFormularaKniznice/222255","1","0",
"OF-222256","Po karanténe","HW maintenance zariadení","hardvér, maintenance, technická podpora","72250000-2 Služby týkajúce sa podpory systému; 72222300-0 Služby informačných technológií; 72610000-9 Počítačové podporné služby","Služba","","https://portal.eks.sk/SpravaKniznice/OpisneFormulareKniznice/VerejnyDetailOpisnehoFormularaKniznice/222256","0","0",
"OF-222257","Po karanténe","Precision Plus Protein™ Dual Color Standards","proteínový ladder","24950000-8 Špecializované chemické výrobky; 60000000-8 Dopravné služby (bez prepravy odpadu)","Tovar; Služba","","https://portal.eks.sk/SpravaKniznice/OpisneFormulareKniznice/VerejnyDetailOpisnehoFormularaKniznice/222257","0","0",
"OF-222261","Po karanténe","Čistiace, hygienické a dezinfekčné prostriedky ","čistiace prostriedky, dezinfekčné prostriedky, hygienické prostriedky","33700000-7 Predmety osobnej starostlivosti; 39800000-0 Čistiace a leštiace výrobky; 24455000-8 Dezinfekčné prostriedky; 60000000-8 Dopravné služby (bez prepravy odpadu)","Tovar; Služba","","https://portal.eks.sk/SpravaKniznice/OpisneFormulareKniznice/VerejnyDetailOpisnehoFormularaKniznice/222261","1","0",
"OF-222262","Po karanténe","Predĺženie služieb aktualizácie pre serverové licencie a používateľské licencie systému Wallstreet Suite","aktualizácia, podpora","72000000-5 Služby informačných technológií: konzultácie, vývoj softvéru, internet a podpora","Služba","","https://portal.eks.sk/SpravaKniznice/OpisneFormulareKniznice/VerejnyDetailOpisnehoFormularaKniznice/222262","1","0",
"OF-222264","Po karanténe","Pracovný notebook","modelová rada Acer Travel Mate, notebook","30213000-5 Osobné počítače; 60000000-8 Dopravné služby (bez prepravy odpadu)","Tovar; Služba","","https://portal.eks.sk/SpravaKniznice/OpisneFormulareKniznice/VerejnyDetailOpisnehoFormularaKniznice/222264","1","0",
"OF-222266","Po karanténe","Opravy prenosných a pojazdných hasiacich prístrojov ","Hasiaci prístroj, oprava, tlaková skúška","50514000-1 Opravy a údržba kovových nádob; 71356100-9 Technická kontrola; 60000000-8 Dopravné služby (bez prepravy odpadu)","Služba","","https://portal.eks.sk/SpravaKniznice/OpisneFormulareKniznice/VerejnyDetailOpisnehoFormularaKniznice/222266","1","0",
"OF-222267","Po karanténe","Chladnička pre laboratórne účely","chladnička","38000000-5 Laboratórne, optické a presné prístroje a vybavenie (s výnimkou skiel); 60000000-8 Dopravné služby (bez prepravy odpadu)","Tovar; Služba","","https://portal.eks.sk/SpravaKniznice/OpisneFormulareKniznice/VerejnyDetailOpisnehoFormularaKniznice/222267","1","0",
"OF-222268","Po karanténe","certifikovaný pracovný odev a certifikovaná obuv","pracovný odev, pracovná obuv","18110000-3 Pracovné odevy; 18830000-6 Ochranná obuv; 60000000-8 Dopravné služby (bez prepravy odpadu)","Tovar; Služba","","https://portal.eks.sk/SpravaKniznice/OpisneFormulareKniznice/VerejnyDetailOpisnehoFormularaKniznice/222268","1","0",
"OF-222269","Po karanténe","Dodávka plastových profilov pre výrobu plastových okien a dverí","plastové profily","19500000-1 Gumené a plastové materiály; 60000000-8 Dopravné služby (bez prepravy odpadu)","Tovar; Služba","","https://portal.eks.sk/SpravaKniznice/OpisneFormulareKniznice/VerejnyDetailOpisnehoFormularaKniznice/222269","0","0",
"OF-222272","Po karanténe","IKT a  príslušenstvo počítačov","Tablet PC, tlačiareň, SSD disk, RAM pamäte","30213100-6 Prenosné počítače; 30232110-8 Laserové tlačiarne; 30237000-9 Časti a príslušenstvo počítačov a spotrebný materiál k nim; 32330000-5 Prístroje na záznam a reprodukciu zvuku a obrazu; 60000000-8 Dopravné služby (bez prepravy odpadu)","Tovar; Služba","","https://portal.eks.sk/SpravaKniznice/OpisneFormulareKniznice/VerejnyDetailOpisnehoFormularaKniznice/222272","0","0",
"OF-222274","Po karanténe","Výmena čelného skla na vozidle Mercedes - Benz, Unimog U 400","čelné sklo","34300000-0 Časti a príslušenstvo vozidiel a ich motorov; 50112120-0 Výmena čelných skiel; 60000000-8 Dopravné služby (bez prepravy odpadu); 50110000-9 Opravy a údržbárske služby pre motorové vozidlá a súvisiace vybavenie; 50000000-5 Opravárske a údržbárske služby","Tovar; Služba","","https://portal.eks.sk/SpravaKniznice/OpisneFormulareKniznice/VerejnyDetailOpisnehoFormularaKniznice/222274","1","0",
"OF-222276","Po karanténe","Dezinfekčné prostriedky","Dezinfekčné prostriedky","24455000-8 Dezinfekčné prostriedky; 33741300-9 Dezinfekčné prostriedky na ruky; 60000000-8 Dopravné služby (bez prepravy odpadu)","Tovar; Služba","","https://portal.eks.sk/SpravaKniznice/OpisneFormulareKniznice/VerejnyDetailOpisnehoFormularaKniznice/222276","1","0",
"OF-222277","Po karanténe","Tonerové náplne, valce a pásky do rôznych druhov tlačiarní, kopírovacích strojov a multifunkčných zariadení.","tonery, valce, pásky","30125100-2 Tonerové náplne; 30124300-7 Valce pre kancelárske stroje; 30192320-0 Pásky do tlačiarní; 90500000-2 Služby súvisiace s likvidáciou odpadu a odpadom","Tovar; Služba","","https://portal.eks.sk/SpravaKniznice/OpisneFormulareKniznice/VerejnyDetailOpisnehoFormularaKniznice/222277","0","0",
"OF-222278","Po karanténe","Sanitárna technika-Pákové batérie, prietokové ohrievače, Vodoinštalačný materiál ","Vodoinštalačný materiál, Pákové batérie, prietokové ohrievače","44411000-4 Sanitárne výrobky; 60000000-8 Dopravné služby (bez prepravy odpadu)","Tovar; Služba","","https://portal.eks.sk/SpravaKniznice/OpisneFormulareKniznice/VerejnyDetailOpisnehoFormularaKniznice/222278","1","0",
"OF-222279","Po karanténe","Laboratórne diagnostiká a spotrebný laboratórny materiál pre zdravotníctvo","Laboratórny materiál, diagnostický materiál, sáčky, spotrebný materiál,podávač","33694000-1 Diagnostické činidlá; 60000000-8 Dopravné služby (bez prepravy odpadu)","Tovar; Služba","","https://portal.eks.sk/SpravaKniznice/OpisneFormulareKniznice/VerejnyDetailOpisnehoFormularaKniznice/222279","1","0",
"OF-222281","Po karanténe","Líniový laser + prijímač","autotransformátor","38300000-8 Meracie prístroje","Tovar","","https://portal.eks.sk/SpravaKniznice/OpisneFormulareKniznice/VerejnyDetailOpisnehoFormularaKniznice/222281","1","0",
"OF-222283","Po karanténe","Drvené kamenivo na posyp ciest frakcie 4-8 (ANDEZIT) ","Drvené kamenivo na posyp ciest frakcie 4-8 (ANDEZIT)","44113910-7 Materiály na zimnú údržbu; 60000000-8 Dopravné služby (bez prepravy odpadu)","Tovar; Služba","","https://portal.eks.sk/SpravaKniznice/OpisneFormulareKniznice/VerejnyDetailOpisnehoFormularaKniznice/222283","0","0",
"OF-222284","Po karanténe","Príslušenstvo k PC","slúchadlá, externý hdd, monitor, externá mechanika","32342100-3 Slúchadlá; 30234000-8 Pamäťové médiá; 33195100-4 Monitory; 60000000-8 Dopravné služby (bez prepravy odpadu)","Tovar; Služba","","https://portal.eks.sk/SpravaKniznice/OpisneFormulareKniznice/VerejnyDetailOpisnehoFormularaKniznice/222284","1","0",
"OF-222285","Po karanténe","Príslušenstvo k Alkotestom","Ústne násadky","38900000-4 Rôzne vyhodnocovacie a testovacie nástroje; 35000000-4 Bezpečnostné, hasičské, policajné a ochranné vybavenie; 38431000-5 Detekčné prístroje; 60000000-8 Dopravné služby (bez prepravy odpadu)","Tovar; Služba","","https://portal.eks.sk/SpravaKniznice/OpisneFormulareKniznice/VerejnyDetailOpisnehoFormularaKniznice/222285","1","0",
"OF-222286","Po karanténe","Náhradné diely na autobusy Sor NB12,NB18 - Hnacie ústrojenstvo","Náhradné diely, autobus,Sor NB12,NB18,hnacie ústrojenstvo","34300000-0 Časti a príslušenstvo vozidiel a ich motorov; 60000000-8 Dopravné služby (bez prepravy odpadu)","Tovar","","https://portal.eks.sk/SpravaKniznice/OpisneFormulareKniznice/VerejnyDetailOpisnehoFormularaKniznice/222286","1","0",
"OF-222287","Po karanténe","Tabletový počítač","tabletový počítač","30213200-7 Tabletový počítač; 60000000-8 Dopravné služby (bez prepravy odpadu)","Tovar; Služba","","https://portal.eks.sk/SpravaKniznice/OpisneFormulareKniznice/VerejnyDetailOpisnehoFormularaKniznice/222287","1","0",
"OF-222289","Po karanténe","Náhradné diely na autobusy Sor NB12,NB18 - Hnacie ústrojenstvo","Náhradné diely, autobus,Sor NB12,NB18,hnacie ústrojenstvo","34300000-0 Časti a príslušenstvo vozidiel a ich motorov; 60000000-8 Dopravné služby (bez prepravy odpadu)","Tovar","","https://portal.eks.sk/SpravaKniznice/OpisneFormulareKniznice/VerejnyDetailOpisnehoFormularaKniznice/222289","1","0",
"OF-222290","Po karanténe","Elektronické zariadenia a komponenty","mikropočítač, DC/AC konvertor, nabíjací adaptér, všesmerové riadené kolesá, BLDC motor s prevodovkou.","31710000-6 Elektronické zariadenia; 31711000-3 Elektronický spotrebný materiál; 31711100-4 Elektronické komponenty; 60000000-8 Dopravné služby (bez prepravy odpadu)","Tovar; Služba","","https://portal.eks.sk/SpravaKniznice/OpisneFormulareKniznice/VerejnyDetailOpisnehoFormularaKniznice/222290","0","0",
"OF-222291","Po karanténe","Nákup príslušenstva Informačno komunikačných technológií","výpočtová technika, príslušenstvo k počítačom","30233180-6 Archivačné zariadenia flash pamäte; 30233132-5 Mechaniky pevného disku; 30200000-1 Počítačové zariadenia a spotrebný materiál; 60000000-8 Dopravné služby (bez prepravy odpadu)","Tovar; Služba","","https://portal.eks.sk/SpravaKniznice/OpisneFormulareKniznice/VerejnyDetailOpisnehoFormularaKniznice/222291","0","0",
"OF-222292","Po karanténe","Farebné tonery","Tonery","30125120-8 Toner do fotokopírovacích strojov; 60000000-8 Dopravné služby (bez prepravy odpadu)","Tovar; Služba","","https://portal.eks.sk/SpravaKniznice/OpisneFormulareKniznice/VerejnyDetailOpisnehoFormularaKniznice/222292","0","0",
"OF-222293","Po karanténe","Náhradné diely na Sor NB12,NB18 - elektro","Náhradné diely, autobus,Sor,elektro","34300000-0 Časti a príslušenstvo vozidiel a ich motorov; 60000000-8 Dopravné služby (bez prepravy odpadu)","Tovar","","https://portal.eks.sk/SpravaKniznice/OpisneFormulareKniznice/VerejnyDetailOpisnehoFormularaKniznice/222293","1","0",
