"OpisnyFormularIdentifikator","OpisnyFormularStav","OpisnyFormularNazov","OpisnyFormularKlucoveSlova","OpisnyFormularCpv","OpisnyFormularDruh","OpisnyFormularKategoriaSluzieb","OpisnyFormularUrl","OpisnyFormularPocetVyhlasenychZakaziek","OpisnyFormularObchodovanaSumaBezDPH",
"OF-218744","Po karanténe","Čistiace autopotreby","Autopotreby, autokozmetika, kvapalina do ostrekovačov, čistič kontaktov, čistič diskov automobilov,  spray na čistenie bŕzd, čistič diskov kolies, sprej na palubné dosky, oživovač pneu, odhrdzovač, autošampón, odstraňovač hmyzu","39831500-1 Čistiace prostriedky na autá; 39831240-0 Zlúčeniny na čistenie; 24951310-1 Pripravené tekutiny na odmrazovanie; 24963000-2 Antikorozívne výrobky; 39831220-4 Odmasťovacie prostriedky; 60000000-8 Dopravné služby (bez prepravy odpadu)","Tovar; Služba","","https://portal.eks.sk/SpravaKniznice/OpisneFormulareKniznice/VerejnyDetailOpisnehoFormularaKniznice/218744","0","0",
"OF-218745","Po karanténe","kancelárske potreby","zakladač, pero, tuha, pentelka, kancelársky papier, bločky, zošívačka, listové spony a klipy","30192000-1 Kancelárske potreby; 30197642-8 Papier na fotokopírovanie a xerografický papier; 22851000-0 Rýchloviazače; 30124510-2 Popisovače; 60000000-8 Dopravné služby (bez prepravy odpadu)","Tovar; Služba","","https://portal.eks.sk/SpravaKniznice/OpisneFormulareKniznice/VerejnyDetailOpisnehoFormularaKniznice/218745","0","0",
"OF-218746","Po karanténe","Nákup nových originálnych, nerepasovaných a nekompatibilných tonerových náplní do tlačiarní ","tonery, náplne do tlačiarní","30125100-2 Tonerové náplne; 60000000-8 Dopravné služby (bez prepravy odpadu)","Tovar; Služba","","https://portal.eks.sk/SpravaKniznice/OpisneFormulareKniznice/VerejnyDetailOpisnehoFormularaKniznice/218746","1","0",
"OF-218747","Po karanténe","Združená dodávka plynu","zemný plyn, plyn","09123000-7 Zemný plyn; 60000000-8 Dopravné služby (bez prepravy odpadu)","Tovar; Služba","","https://portal.eks.sk/SpravaKniznice/OpisneFormulareKniznice/VerejnyDetailOpisnehoFormularaKniznice/218747","0","0",
"OF-218749","Po karanténe","Papier na fotokopírovanie a xerografický papier","papier, kancelársky papier, tabelačný papier","30197642-8 Papier na fotokopírovanie a xerografický papier; 60000000-8 Dopravné služby (bez prepravy odpadu)","Tovar; Služba","","https://portal.eks.sk/SpravaKniznice/OpisneFormulareKniznice/VerejnyDetailOpisnehoFormularaKniznice/218749","1","0",
"OF-218750","Po karanténe","Príslušenstvo počítačov","Príslušenstvo počítačov","30237200-1 Príslušenstvo počítačov; 60000000-8 Dopravné služby (bez prepravy odpadu)","Tovar; Služba","","https://portal.eks.sk/SpravaKniznice/OpisneFormulareKniznice/VerejnyDetailOpisnehoFormularaKniznice/218750","1","0",
"OF-218752","Po karanténe","Plastové stoličky","stoličky záhradné, stoličky plastové","39100000-3 Nábytok; 39113000-7 Rôzne sedadlá a stoličky; 39113100-8 Kreslá; 60000000-8 Dopravné služby (bez prepravy odpadu)","Tovar","","https://portal.eks.sk/SpravaKniznice/OpisneFormulareKniznice/VerejnyDetailOpisnehoFormularaKniznice/218752","1","0",
"OF-218753","Po karanténe","Letecký olej AeroShell Fluid 41 Superclean","letecký olej, kvapalina","09211000-1 Mazacie oleje a mazivá; 60000000-8 Dopravné služby (bez prepravy odpadu)","Tovar; Služba","","https://portal.eks.sk/SpravaKniznice/OpisneFormulareKniznice/VerejnyDetailOpisnehoFormularaKniznice/218753","0","0",
"OF-218754","Po karanténe","Prenosný počítač -Notebook 15""","Prenosný počítač, Notebook 15""","30213100-6 Prenosné počítače; 60000000-8 Dopravné služby (bez prepravy odpadu)","Tovar; Služba","","https://portal.eks.sk/SpravaKniznice/OpisneFormulareKniznice/VerejnyDetailOpisnehoFormularaKniznice/218754","1","0",
"OF-218756","Po karanténe","Antitrombín III","Antitrombín III, Antitrombotické činidlá","33621100-0 Antitrombotické činidlá; 60000000-8 Dopravné služby (bez prepravy odpadu)","Tovar; Služba","","https://portal.eks.sk/SpravaKniznice/OpisneFormulareKniznice/VerejnyDetailOpisnehoFormularaKniznice/218756","0","0",
"OF-218757","Po karanténe","Zariadenia súvisiace s počítačmi","počítač, monitor, grafická karta","30230000-0 Zariadenia súvisiace s počítačmi; 30237000-9 Časti a príslušenstvo počítačov a spotrebný materiál k nim; 60000000-8 Dopravné služby (bez prepravy odpadu)","Tovar; Služba","","https://portal.eks.sk/SpravaKniznice/OpisneFormulareKniznice/VerejnyDetailOpisnehoFormularaKniznice/218757","1","0",
"OF-218758","Po karanténe","PVC podlahovina","linoleum PVC","44112200-0 Podlahové krytiny; 33682000-4 Gumené krytiny; 44112230-9 Linoleum; 60000000-8 Dopravné služby (bez prepravy odpadu)","Tovar; Služba","","https://portal.eks.sk/SpravaKniznice/OpisneFormulareKniznice/VerejnyDetailOpisnehoFormularaKniznice/218758","1","0",
"OF-218760","Po karanténe","Čistiace auto potreby","čistiace potreby do automobilov, čistiace autopotreby","39831500-1 Čistiace prostriedky na autá; 60000000-8 Dopravné služby (bez prepravy odpadu)","Tovar; Služba","","https://portal.eks.sk/SpravaKniznice/OpisneFormulareKniznice/VerejnyDetailOpisnehoFormularaKniznice/218760","1","0",
"OF-218761","Po karanténe","Kancelárske potreby","Kancelárske potreby","30192000-1 Kancelárske potreby; 60000000-8 Dopravné služby (bez prepravy odpadu)","Tovar; Služba","","https://portal.eks.sk/SpravaKniznice/OpisneFormulareKniznice/VerejnyDetailOpisnehoFormularaKniznice/218761","1","0",
"OF-218762","Po karanténe","Beztlakový ohrievač vody","ohrievač vody","39700000-9 Spotrebiče pre domácnosť; 60000000-8 Dopravné služby (bez prepravy odpadu)","Tovar; Služba","","https://portal.eks.sk/SpravaKniznice/OpisneFormulareKniznice/VerejnyDetailOpisnehoFormularaKniznice/218762","1","0",
"OF-218763","Po karanténe","Oprava kuchyne KTN ISO 1C ","kontajnerová kuchyňa, KTN ISO 1C, umývačka bieleho riadu","50883000-8 Opravy a údržba zariadenia pre verejné stravovanie; 60000000-8 Dopravné služby (bez prepravy odpadu); 50530000-9 Opravy a údržba strojov; 50882000-1 Opravy a údržba zariadenia reštaurácií","Služba","","https://portal.eks.sk/SpravaKniznice/OpisneFormulareKniznice/VerejnyDetailOpisnehoFormularaKniznice/218763","1","0",
"OF-218764","Po karanténe"," Nákup multifunkčných CB zariadení - tlačiarní","tlačiarne, kopírky, skenery, faxy, multifunkčné zariadenia","30232100-5 Tlačiarne a zapisovače; 60000000-8 Dopravné služby (bez prepravy odpadu)","Tovar; Služba","","https://portal.eks.sk/SpravaKniznice/OpisneFormulareKniznice/VerejnyDetailOpisnehoFormularaKniznice/218764","0","0",
"OF-218765","Po karanténe","Železiarske výrobky a brusivá","kotúč, rezný, brusný, tesnenie, zámok, spony,","14811300-2 Brúsne kotúče; 14522300-9 Šmirgeľ; 34312500-2 Tesnenia; 44521210-3 Visiace zámky; 44530000-4 Upínadlá/spony; 60000000-8 Dopravné služby (bez prepravy odpadu)","Tovar; Služba","","https://portal.eks.sk/SpravaKniznice/OpisneFormulareKniznice/VerejnyDetailOpisnehoFormularaKniznice/218765","1","0",
"OF-218766","Po karanténe","Tepovač, Vysávač na mokré a suché vysávanie","vysávač, elektrický, bezsáčkový, vysávanie, vysávač prachu, tepovanie, tepovací vysávač, tepovač, extraktor, prislušenstvo","42995000-7 Rôzne čistiace stroje; 42999100-6 Vysávače prachu nie pre domácnosť; 39713430-6 Vysávače prachu; 60000000-8 Dopravné služby (bez prepravy odpadu)","Tovar; Služba","","https://portal.eks.sk/SpravaKniznice/OpisneFormulareKniznice/VerejnyDetailOpisnehoFormularaKniznice/218766","1","0",
"OF-218768","Po karanténe","Stavebný materiál ","cement, omietka, dvere, flexibilné lepidlo, vedro, tmel","44111200-3 Cement; 44190000-8 Rôzne stavebné materiály; 44221200-7 Dvere; 60000000-8 Dopravné služby (bez prepravy odpadu)","Tovar; Služba","","https://portal.eks.sk/SpravaKniznice/OpisneFormulareKniznice/VerejnyDetailOpisnehoFormularaKniznice/218768","0","0",
"OF-218771","Po karanténe","Nákup plastových gombíkových plomb.","plomba, gombíková, plastová, plastové, na plombovanie, potreby, plombovacie, plomby","19520000-7 Plastové výrobky; 60000000-8 Dopravné služby (bez prepravy odpadu)","Tovar; Služba","","https://portal.eks.sk/SpravaKniznice/OpisneFormulareKniznice/VerejnyDetailOpisnehoFormularaKniznice/218771","0","0",
"OF-218772","Po karanténe","Prenosné počítače","notebook, výpočtová technika","30200000-1 Počítačové zariadenia a spotrebný materiál; 30213100-6 Prenosné počítače; 60000000-8 Dopravné služby (bez prepravy odpadu)","Tovar; Služba","","https://portal.eks.sk/SpravaKniznice/OpisneFormulareKniznice/VerejnyDetailOpisnehoFormularaKniznice/218772","1","0",
"OF-218773","Po karanténe","Rozhlasové a televízne prijímače a príslušenstvo","televízor, minisystém","32324100-1 Farebné televízory; 32331300-5 Prístroje na reprodukciu zvuku; 60000000-8 Dopravné služby (bez prepravy odpadu)","Tovar; Služba","","https://portal.eks.sk/SpravaKniznice/OpisneFormulareKniznice/VerejnyDetailOpisnehoFormularaKniznice/218773","0","0",
"OF-218774","Po karanténe","Zvýšenie kvality vzdelávania na gymnáziu – didaktické prostriedky","didaktické prostriedky","39162200-7 Učebné pomôcky a zariadenia; 60000000-8 Dopravné služby (bez prepravy odpadu)","Tovar; Služba","","https://portal.eks.sk/SpravaKniznice/OpisneFormulareKniznice/VerejnyDetailOpisnehoFormularaKniznice/218774","0","0",
"OF-218775","Po karanténe","USG prístroj pre Urologickú kliniku","Ultrasonografický prístroj","33124120-2 Diagnostické ultrazvukové prístroje; 60000000-8 Dopravné služby (bez prepravy odpadu)","Tovar; Služba","","https://portal.eks.sk/SpravaKniznice/OpisneFormulareKniznice/VerejnyDetailOpisnehoFormularaKniznice/218775","0","0",
"OF-218777","Po karanténe","Odvoz a likvidácia kuchynského odpadu","Odlučovač tukov, lapač tukov, odvoz, likvidácia, kuchynský odpad","90500000-2 Služby súvisiace s likvidáciou odpadu a odpadom; 90512000-9 Služby na prepravu odpadu","Služba","","https://portal.eks.sk/SpravaKniznice/OpisneFormulareKniznice/VerejnyDetailOpisnehoFormularaKniznice/218777","0","0",
"OF-218778","Po karanténe","Mobilná klimatizácia","Mobilná klimatizácia, prenosná klimatizácia","39717000-1 Ventilátory a klimatizačné spotrebiče; 39717200-3 Klimatizačné spotrebiče; 60000000-8 Dopravné služby (bez prepravy odpadu)","Tovar; Služba","","https://portal.eks.sk/SpravaKniznice/OpisneFormulareKniznice/VerejnyDetailOpisnehoFormularaKniznice/218778","0","0",
"OF-218780","Po karanténe","Elektroinštalačný materiál","Zásuvka 400V/32A, HELLA 8JA 001 931-071 ZÁSTRČKA 2 POLOVA NATO","44321000-6 Káble; 44322100-4 Elektroinštalačné káble; 44322000-3 Príslušenstvo ku káblom; 44320000-9 Káble a súvisiace výrobky; 44322400-7 Káblové príchytky (spony); 31224000-2 Spájacie a kontaktné prvky; 31224100-3 Zástrčky a zásuvky; 31224400-6 Spájacie káble; 31224500-7 Koncovky; 60000000-8 Dopravné služby (bez prepravy odpadu)","Tovar; Služba","","https://portal.eks.sk/SpravaKniznice/OpisneFormulareKniznice/VerejnyDetailOpisnehoFormularaKniznice/218780","0","0",
"OF-218781","Po karanténe","Elektroinštalačný materiál","Prepojovací kábel s TELWIN STARTRONIC 530","44321000-6 Káble; 44322100-4 Elektroinštalačné káble; 44322000-3 Príslušenstvo ku káblom; 44320000-9 Káble a súvisiace výrobky; 44322400-7 Káblové príchytky (spony); 31224000-2 Spájacie a kontaktné prvky; 31224100-3 Zástrčky a zásuvky; 31224400-6 Spájacie káble; 31224500-7 Koncovky; 60000000-8 Dopravné služby (bez prepravy odpadu)","Tovar; Služba","","https://portal.eks.sk/SpravaKniznice/OpisneFormulareKniznice/VerejnyDetailOpisnehoFormularaKniznice/218781","0","0",
"OF-218782","Po karanténe","Kontroly prenosných hasiacich prístrojov ","hasiaci prístroj, kontrola","71356100-9 Technická kontrola; 50514000-1 Opravy a údržba kovových nádob; 60000000-8 Dopravné služby (bez prepravy odpadu)","Služba","","https://portal.eks.sk/SpravaKniznice/OpisneFormulareKniznice/VerejnyDetailOpisnehoFormularaKniznice/218782","0","0",
"OF-218783","Po karanténe","Rôzne potraviny","spracované ovocie, kompóty, sterelizovaná zelenina, džemy, rastlinné oleje, trvanlivé potraviny, džús, paštéty, suché strukoviny, mak","15000000-8 Potraviny, nápoje, tabak a príbuzné produkty; 15320000-7 Ovocné a zeleninové šťavy; 15330000-0 Spracované ovocie a zelenina; 15420000-8 Rafinované oleje a tuky; 15890000-3 Rôzne potravinové výrobky a sušený tovar; 60000000-8 Dopravné služby (bez prepravy odpadu)","Tovar; Služba","","https://portal.eks.sk/SpravaKniznice/OpisneFormulareKniznice/VerejnyDetailOpisnehoFormularaKniznice/218783","0","0",
"OF-218784","Po karanténe","Rôzne potraviny I","mlynské výrobky, rastlinné oleje, koreniny, cestoviny, chuťové prísady, trvanlivé potraviny","15612100-2 Pšeničná múka; 15870000-7 Koreniny a chuťové prísady; 15850000-1 Cestoviny; 15820000-2 Sucháre a piškóty; trvanlivé pečivo a cukrovinky; 60000000-8 Dopravné služby (bez prepravy odpadu)","Tovar; Služba","","https://portal.eks.sk/SpravaKniznice/OpisneFormulareKniznice/VerejnyDetailOpisnehoFormularaKniznice/218784","0","0",
"OF-218786","Po karanténe","Služby a podpora PACS ","DICOM, PACS","48800000-6 Informačné systémy a servery; 60000000-8 Dopravné služby (bez prepravy odpadu)","Tovar; Služba","","https://portal.eks.sk/SpravaKniznice/OpisneFormulareKniznice/VerejnyDetailOpisnehoFormularaKniznice/218786","0","0",
"OF-218788","Po karanténe","Antibakteriálne ochranné textilné rúška na tvár na opakované použitie","rúško, ochrana","33000000-0 Zdravotnícke vybavenie, farmaceutický materiál a výrobky osobnej starostlivosti; 60000000-8 Dopravné služby (bez prepravy odpadu)","Tovar; Služba","","https://portal.eks.sk/SpravaKniznice/OpisneFormulareKniznice/VerejnyDetailOpisnehoFormularaKniznice/218788","1","0",
"OF-218789","Po karanténe","Destilovaná voda","destilovaná voda,","24316000-2 Destilovaná voda; 60000000-8 Dopravné služby (bez prepravy odpadu)","Tovar; Služba","","https://portal.eks.sk/SpravaKniznice/OpisneFormulareKniznice/VerejnyDetailOpisnehoFormularaKniznice/218789","1","0",
"OF-218791","Po karanténe","Chemikálie pre molekulovú biológiu - DNA polymeráza","DNA, polymeráza, PCR, výskum","24960000-1 Rôzne chemické výrobky; 60000000-8 Dopravné služby (bez prepravy odpadu)","Tovar; Služba","","https://portal.eks.sk/SpravaKniznice/OpisneFormulareKniznice/VerejnyDetailOpisnehoFormularaKniznice/218791","0","0",
"OF-218792","Po karanténe","Notebook","výkonný herný notebook","30213100-6 Prenosné počítače; 60000000-8 Dopravné služby (bez prepravy odpadu); 30237200-1 Príslušenstvo počítačov","Tovar; Služba","","https://portal.eks.sk/SpravaKniznice/OpisneFormulareKniznice/VerejnyDetailOpisnehoFormularaKniznice/218792","1","0",
"OF-218793","Po karanténe","Dodávka potravín - mlieko, mliečne výrobky a vajcia pre Objednávateľa","Potraviny - mlieko, mliečne výrobky a vajcia","15500000-3 Mliečne výrobky; 15550000-8 Mliečne výrobky rôznych druhov; 03142500-3 Vajcia; 15540000-5 Syrárske výrobky; 15510000-6 Mlieko a smotana; 15541000-2 Lahôdkový syr; 15542000-9 Čerstvý (nevyzretý) syr; 15543000-6 Strúhaný, práškový, syr s modrou plesňou a iný syr; 15544000-3 Tvrdý syr; 15545000-0 Syrové nátierky; 15551000-5 Jogurt a ostatné fermentované mliečne výrobky; 15552000-2 Kazeín; 15553000-9 Laktóza alebo laktózový sirup; 15554000-6 Srvátka; 15555000-3 Zmrzlina a podobné výrobky; 60000000-8 Dopravné služby (bez prepravy odpadu)","Tovar; Služba","","https://portal.eks.sk/SpravaKniznice/OpisneFormulareKniznice/VerejnyDetailOpisnehoFormularaKniznice/218793","0","0",
"OF-218794","Po karanténe","Batéria, alkalické batérie","monočlánok AAA, gombíkové batérie","31400000-0 Akumulátory, galvanické články a batérie; 60000000-8 Dopravné služby (bez prepravy odpadu)","Tovar; Služba","","https://portal.eks.sk/SpravaKniznice/OpisneFormulareKniznice/VerejnyDetailOpisnehoFormularaKniznice/218794","1","0",
"OF-218795","Po karanténe","Kombinovaná chladnička s mrazničkou","spotrebiče pre domácnosť","39711110-3 Chladničky s mrazničkou; 60000000-8 Dopravné služby (bez prepravy odpadu)","Tovar; Služba","","https://portal.eks.sk/SpravaKniznice/OpisneFormulareKniznice/VerejnyDetailOpisnehoFormularaKniznice/218795","1","0",
"OF-218796","Po karanténe","Notebook","notebook, prenosný počítač + príslušenstvo","30213100-6 Prenosné počítače; 60000000-8 Dopravné služby (bez prepravy odpadu)","Tovar; Služba","","https://portal.eks.sk/SpravaKniznice/OpisneFormulareKniznice/VerejnyDetailOpisnehoFormularaKniznice/218796","1","0",
"OF-218797","Po karanténe","Chemikálie pre izoláciu RNA, DNA a RT PCR","DNA, PCR, RNA, výskum","24960000-1 Rôzne chemické výrobky; 60000000-8 Dopravné služby (bez prepravy odpadu)","Tovar; Služba","","https://portal.eks.sk/SpravaKniznice/OpisneFormulareKniznice/VerejnyDetailOpisnehoFormularaKniznice/218797","0","0",
"OF-218799","Po karanténe","Železiarske výrobky a brusivá - drôtená kefa","železiarske výrobky, matice, podložky, brusivá","14811300-2 Brúsne kotúče; 44316000-8 Železiarsky tovar; 60000000-8 Dopravné služby (bez prepravy odpadu)","Tovar; Služba","","https://portal.eks.sk/SpravaKniznice/OpisneFormulareKniznice/VerejnyDetailOpisnehoFormularaKniznice/218799","1","0",
"OF-218800","Po karanténe","Ovocie a zelenina","ovocie, zelenina","03220000-9 Zelenina, ovocie a orechy; 60000000-8 Dopravné služby (bez prepravy odpadu); 03221000-6 Zelenina; 03222000-3 Ovocie a orechy","Tovar; Služba","","https://portal.eks.sk/SpravaKniznice/OpisneFormulareKniznice/VerejnyDetailOpisnehoFormularaKniznice/218800","0","0",
"OF-218801","Po karanténe","Materiál na vodorovné dopravné značenie : farba , balotina , riedidlo ","náterové látky, farba na vozovky, balotina, riedidlo","44811000-8 Farba na vozovku; 60000000-8 Dopravné služby (bez prepravy odpadu)","Tovar; Služba","","https://portal.eks.sk/SpravaKniznice/OpisneFormulareKniznice/VerejnyDetailOpisnehoFormularaKniznice/218801","0","0",
"OF-218803","Po karanténe","Mäso a mäsové výrobky","potraviny, bravčové mäso, hovädzie mäso, mäsové výrobky","15131400-9 Bravčové výrobky; 15113000-3 Bravčové mäso; 15111100-0 Hovädzie mäso; 15100000-9 Živočíšne výrobky, mäso a mäsové výrobky; 15131220-3 Slanina; 15131230-6 Saláma; 15131410-2 Šunka; 60000000-8 Dopravné služby (bez prepravy odpadu)","Tovar; Služba","","https://portal.eks.sk/SpravaKniznice/OpisneFormulareKniznice/VerejnyDetailOpisnehoFormularaKniznice/218803","0","0",
"OF-218804","Po karanténe","Teplovzdušný konvektor","Teplovzdušný konvektor","39721310-8 Ohrievače vzduchu; 60000000-8 Dopravné služby (bez prepravy odpadu)","Tovar; Služba","","https://portal.eks.sk/SpravaKniznice/OpisneFormulareKniznice/VerejnyDetailOpisnehoFormularaKniznice/218804","0","0",
"OF-218805","Po karanténe","Anestéziologická pracovná stanica","anestézia","33172100-7 Prístroje na anestéziu; 60000000-8 Dopravné služby (bez prepravy odpadu)","Tovar; Služba","","https://portal.eks.sk/SpravaKniznice/OpisneFormulareKniznice/VerejnyDetailOpisnehoFormularaKniznice/218805","0","0",
"OF-218806","Po karanténe","Prenosný počítač","Notebook, Laptop, HP, Probook","30213100-6 Prenosné počítače; 60000000-8 Dopravné služby (bez prepravy odpadu)","Tovar; Služba","","https://portal.eks.sk/SpravaKniznice/OpisneFormulareKniznice/VerejnyDetailOpisnehoFormularaKniznice/218806","0","0",
"OF-218807","Po karanténe","autokozmetika pre automatickú umývaciu linku ISTOBAL M22","autokozmetika, umývacia linka","60000000-8 Dopravné služby (bez prepravy odpadu); 39800000-0 Čistiace a leštiace výrobky; 39812300-0 Leštiace vosky; 39831500-1 Čistiace prostriedky na autá; 24951000-5 Mazivá a mazacie oleje","Služba; Tovar","","https://portal.eks.sk/SpravaKniznice/OpisneFormulareKniznice/VerejnyDetailOpisnehoFormularaKniznice/218807","0","0",
"OF-218811","Po karanténe","Mrazené potraviny","Mrazené potraviny","15220000-6 Mrazené ryby, rybie filé a ostatné rybie mäso; 15311000-1 Mrazené zemiaky; 60000000-8 Dopravné služby (bez prepravy odpadu); 15896000-5 Hlboko zmrazené výrobky; 15221000-3 Mrazené ryby; 15311100-2 Hranolčeky; 15851220-6 Plnené cestoviny","Tovar; Služba","","https://portal.eks.sk/SpravaKniznice/OpisneFormulareKniznice/VerejnyDetailOpisnehoFormularaKniznice/218811","0","0",
"OF-218813","Po karanténe","Vybavenie oddelenia","odpadkový kôš, kúpeľňový záves, kuchynské vybavenie","39221000-7 Kuchynské vybavenie; 39224340-3 Koše; 39831000-6 Pracie prostriedky; 60000000-8 Dopravné služby (bez prepravy odpadu)","Tovar; Služba","","https://portal.eks.sk/SpravaKniznice/OpisneFormulareKniznice/VerejnyDetailOpisnehoFormularaKniznice/218813","0","0",
"OF-218816","Po karanténe","Ručné nástroje a príslušenstvo","Skrutkovač akumulátorový, ručné náradie, sada náradia","42652000-1 Ručné elektromechanické nástroje; 44512800-0 Skrutkovače; 60000000-8 Dopravné služby (bez prepravy odpadu); 44512940-3 Sada náradia","Tovar; Služba","","https://portal.eks.sk/SpravaKniznice/OpisneFormulareKniznice/VerejnyDetailOpisnehoFormularaKniznice/218816","0","0",
"OF-218820","Po karanténe","Nemocničné lôžka","Nemocničné lôžko","33192120-9 Nemocničné lôžka; 60000000-8 Dopravné služby (bez prepravy odpadu)","Tovar; Služba","","https://portal.eks.sk/SpravaKniznice/OpisneFormulareKniznice/VerejnyDetailOpisnehoFormularaKniznice/218820","0","0",
"OF-218822","Po karanténe","Fritéza, nárezový stroj, umývačka riadu","Fritéza, nárezový stroj, umývačka riadu","39312000-2 Zariadenia na prípravu jedál; 39310000-8 Zariadenia hromadného stravovania; 60000000-8 Dopravné služby (bez prepravy odpadu)","Tovar; Služba","","https://portal.eks.sk/SpravaKniznice/OpisneFormulareKniznice/VerejnyDetailOpisnehoFormularaKniznice/218822","0","0",
"OF-218823","Po karanténe","Stolik - vozík viacúčelový 2 policový  , 1 zásuvka ","stolík- vozík","39290000-1 Rôzne vybavenie a zariadenie interiérov; 60000000-8 Dopravné služby (bez prepravy odpadu)","Tovar; Služba","","https://portal.eks.sk/SpravaKniznice/OpisneFormulareKniznice/VerejnyDetailOpisnehoFormularaKniznice/218823","0","0",
"OF-218824","Po karanténe","Výpočtová technika - dodanie I.","kamera, dron","30232000-4 Periférne vybavenie; 60000000-8 Dopravné služby (bez prepravy odpadu)","Tovar; Služba","","https://portal.eks.sk/SpravaKniznice/OpisneFormulareKniznice/VerejnyDetailOpisnehoFormularaKniznice/218824","0","0",
"OF-218825","Po karanténe","Základné a dlhodobo skladovateľné potraviny","Dodávka potravín pre stravovacie zariadenie, cestoviny, koreniny, nápoje, pochutiny, sterilizované potraviny, kompóty, šaláty","15000000-8 Potraviny, nápoje, tabak a príbuzné produkty; 15600000-4 Mlynské výrobky, škrob a škrobové výrobky; 15820000-2 Sucháre a piškóty; trvanlivé pečivo a cukrovinky; 15830000-5 Cukor a jemu príbuzné výrobky; 15840000-8 Kakao; čokoláda a cukrovinky; 15850000-1 Cestoviny; 15860000-4 Káva, čaj a príbuzné produkty; 15870000-7 Koreniny a chuťové prísady; 15897200-4 Výrobky v konzerve; 15240000-2 Ryby v konzerve a inak pripravené alebo konzervované ryby; 15331400-1 Nakladaná a/alebo konzervovaná zelenina; 15332200-6 Džemy a marmelády, ovocné želé; ovocné alebo orechové pyré a pasty/pretlaky; 15400000-2 Živočíšne alebo rastlinné oleje a tuky; 60000000-8 Dopravné služby (bez prepravy odpadu)","Tovar; Služba","","https://portal.eks.sk/SpravaKniznice/OpisneFormulareKniznice/VerejnyDetailOpisnehoFormularaKniznice/218825","0","0",
"OF-218827","Po karanténe","Plynový varný kotol","Plynový varný kotol, Gastro zariadenie, Kuchynské zariadenie","39220000-0 Kuchynské zariadenie, domáce potreby a potreby pre domáce hospodárstvo a dodávky pre stravovacie zariadenia; 39221000-7 Kuchynské vybavenie; 39310000-8 Zariadenia hromadného stravovania; 39314000-6 Priemyselné vybavenie kuchýň; 39312000-2 Zariadenia na prípravu jedál; 60000000-8 Dopravné služby (bez prepravy odpadu)","Tovar; Služba","","https://portal.eks.sk/SpravaKniznice/OpisneFormulareKniznice/VerejnyDetailOpisnehoFormularaKniznice/218827","0","0",
"OF-218829","Po karanténe","Odber, odvoz, zneškodňovanie a likvidácia odpadov ","Odber, odvoz, zneškodňovanie a likvidácia odpadov","90510000-5 Likvidácia a spracovanie odpadu; 90500000-2 Služby súvisiace s likvidáciou odpadu a odpadom; 90512000-9 Služby na prepravu odpadu","Služba","","https://portal.eks.sk/SpravaKniznice/OpisneFormulareKniznice/VerejnyDetailOpisnehoFormularaKniznice/218829","1","0",
"OF-218830","Po karanténe","Kancelársky softvér","kancelársky softvér","48219300-9 Softvérový balík pre administratívu; 60000000-8 Dopravné služby (bez prepravy odpadu)","Tovar; Služba","","https://portal.eks.sk/SpravaKniznice/OpisneFormulareKniznice/VerejnyDetailOpisnehoFormularaKniznice/218830","0","0",
"OF-218831","Po karanténe","Odber, odvoz, zneškodňovanie a likvidácia odpadov.  ","Odber, odvoz, zneškodňovanie a likvidácia odpadov","90510000-5 Likvidácia a spracovanie odpadu; 90512000-9 Služby na prepravu odpadu","Služba","","https://portal.eks.sk/SpravaKniznice/OpisneFormulareKniznice/VerejnyDetailOpisnehoFormularaKniznice/218831","0","0",
