"OpisnyFormularIdentifikator","OpisnyFormularStav","OpisnyFormularNazov","OpisnyFormularKlucoveSlova","OpisnyFormularCpv","OpisnyFormularDruh","OpisnyFormularKategoriaSluzieb","OpisnyFormularUrl","OpisnyFormularPocetVyhlasenychZakaziek","OpisnyFormularObchodovanaSumaBezDPH",
"OF-264277","Po karanténe","Dezinfekčné prípravky na dezinfekciu povrchov, lekárskych nástrojov a kože","antiseptiká, dezinfekčné prípravky, dezinfekcia","33631600-8 Antiseptiká a dezinfekčné prostriedky; 60000000-8 Dopravné služby (bez prepravy odpadu)","Tovar; Služba","","https://portal.eks.sk/SpravaKniznice/OpisneFormulareKniznice/VerejnyDetailOpisnehoFormularaKniznice/264277","0","0",
"OF-264320","Po karanténe","Tlačiarenské služby","tlač, tlačiarenské služby","79810000-5 Tlačiarenské služby; 60000000-8 Dopravné služby (bez prepravy odpadu)","Služba; Tovar","","https://portal.eks.sk/SpravaKniznice/OpisneFormulareKniznice/VerejnyDetailOpisnehoFormularaKniznice/264320","0","0",
"OF-264343","Po karanténe","Nákup výpočtovej techniky  3","výpočtová technika","30213000-5 Osobné počítače; 42960000-3 Ovládací a riadiaci systém, tlačiarenské a grafické vybavenie, vybavenie na automatizáciu kancelárskych prác a spracovanie informácií; 60000000-8 Dopravné služby (bez prepravy odpadu)","Tovar; Služba","","https://portal.eks.sk/SpravaKniznice/OpisneFormulareKniznice/VerejnyDetailOpisnehoFormularaKniznice/264343","0","0",
"OF-263075","Po karanténe","Telefónne aparáty","telefón","32552100-8 Telefónne prístroje; 60000000-8 Dopravné služby (bez prepravy odpadu); 32551100-1 Telefónne prípojky","Tovar; Služba","","https://portal.eks.sk/SpravaKniznice/OpisneFormulareKniznice/VerejnyDetailOpisnehoFormularaKniznice/263075","0","0",
"OF-263175","Po karanténe","Implementácia bezpečnostnej integračnej platformy SIEM ","kybernetická bezpečnosť, platforma, SIEM, implementácia, konfigurácia, inštalácia","72265000-0 Konfigurovanie softvéru; 72263000-6 Implementácia softvéru; 51612000-5 Inštalácia zariadení na spracovanie informácií; 48730000-4 Softvérový balík na zaistenie bezpečnosti","Služba","","https://portal.eks.sk/SpravaKniznice/OpisneFormulareKniznice/VerejnyDetailOpisnehoFormularaKniznice/263175","0","0",
"OF-264186","Po karanténe","Odber, odvoz, zneškodňovanie a likvidácia odpadov ","Odber, odvoz, zneškodňovanie a likvidácia odpadov","90510000-5 Likvidácia a spracovanie odpadu; 90500000-2 Služby súvisiace s likvidáciou odpadu a odpadom; 90512000-9 Služby na prepravu odpadu","Služba","","https://portal.eks.sk/SpravaKniznice/OpisneFormulareKniznice/VerejnyDetailOpisnehoFormularaKniznice/264186","0","0",
"OF-264286","Po karanténe","Jednorazové plienky a podložky ","jednorazové plienky, podložky.","33751000-9 Jednorazové plienky; 33772000-2 Jednorazové papierové výrobky; 60000000-8 Dopravné služby (bez prepravy odpadu)","Tovar; Služba","","https://portal.eks.sk/SpravaKniznice/OpisneFormulareKniznice/VerejnyDetailOpisnehoFormularaKniznice/264286","0","0",
"OF-264452","Po karanténe","Opravy a revízie individuálnych dýchacích prístrojov","Opravy a revízie individuálnych dýchacích prístrojov Dräger","50413200-5 Opravy a údržba protipožiarnych zariadení; 60000000-8 Dopravné služby (bez prepravy odpadu)","Služba","","https://portal.eks.sk/SpravaKniznice/OpisneFormulareKniznice/VerejnyDetailOpisnehoFormularaKniznice/264452","0","0",
"OF-264352","Po karanténe","Letenka spiatočná","letenka","60400000-2 Letecké dopravné služby; 60000000-8 Dopravné služby (bez prepravy odpadu)","Služba","","https://portal.eks.sk/SpravaKniznice/OpisneFormulareKniznice/VerejnyDetailOpisnehoFormularaKniznice/264352","0","0",
"OF-264143","Po karanténe","hemokultivačné liekovky","hemokultivačné liekovky, kultivácia mikroorganizmov","24000000-4 Chemické výrobky","Tovar","","https://portal.eks.sk/SpravaKniznice/OpisneFormulareKniznice/VerejnyDetailOpisnehoFormularaKniznice/264143","0","0",
"OF-262414","Po karanténe","Hutný materiál","profilová oceľ, plechy, betonárska oceľ, jäkel, pásovina, profil I, profil L, profil U, rúra oceľová, kari rohož, zvárané siete","44330000-2 Tyče, prúty, drôty a profily používané v stavebníctve; 60000000-8 Dopravné služby (bez prepravy odpadu)","Tovar; Služba","","https://portal.eks.sk/SpravaKniznice/OpisneFormulareKniznice/VerejnyDetailOpisnehoFormularaKniznice/262414","0","0",
"OF-263626","Po karanténe","Náhradné diely na Sor NB12,NB18 - elektro","Náhradné diely, autobus,Sor,elektro","34121100-2 Autobusy verejnej dopravy; 31610000-5 Elektrické zariadenia pre motory a vozidlá; 60000000-8 Dopravné služby (bez prepravy odpadu)","Tovar","","https://portal.eks.sk/SpravaKniznice/OpisneFormulareKniznice/VerejnyDetailOpisnehoFormularaKniznice/263626","1","1699,800",
"OF-262647","Po karanténe","Základné potraviny a vajcia","trvanlivé potraviny, lekvár, kompót, oleje, cestoviny, ryža, cukor, čaj, vajcia, chuťové prísady","15890000-3 Rôzne potravinové výrobky a sušený tovar; 15330000-0 Spracované ovocie a zelenina; 15332200-6 Džemy a marmelády, ovocné želé; ovocné alebo orechové pyré a pasty/pretlaky; 15612000-1 Obilná alebo rastlinná múka a príbuzné výrobky; 15411100-3 Rastlinné oleje; 15831000-2 Cukor; 03211300-6 Ryža; 15870000-7 Koreniny a chuťové prísady; 60000000-8 Dopravné služby (bez prepravy odpadu)","Tovar; Služba","","https://portal.eks.sk/SpravaKniznice/OpisneFormulareKniznice/VerejnyDetailOpisnehoFormularaKniznice/262647","1","0",
"OF-263165","Po karanténe","Čerstvá zelenina a ovocie","Zelenina, koreňová zelenina, ovocie","03221000-6 Zelenina; 03221110-0 Koreňová zelenina; 03221113-1 Cibuľa; 03221112-4 Mrkva; 03221240-0 Paradajka; 15872100-2 Paprika; 03221270-9 Uhorka; 03221410-3 Kapusta; 15331142-4 Spracovaná kapusta; 03222000-3 Ovocie a orechy; 03222110-7 Tropické ovocie; 03222200-5 Citrusové plody; 03222321-9 Jablká; 03222322-6 Hrušky; 03222111-4 Banány; 03222210-8 Citróny; 03222220-1 Pomaranče; 03222118-3 Kivi; 03222240-7 Mandarínky; 60000000-8 Dopravné služby (bez prepravy odpadu); 03222300-6 Netropické ovocie; 03222100-4 Tropické ovocie a orechy","Tovar; Služba","","https://portal.eks.sk/SpravaKniznice/OpisneFormulareKniznice/VerejnyDetailOpisnehoFormularaKniznice/263165","1","0",
"OF-263440","Po karanténe","Mobilný telefón s príslušenstvom","mobilný telefón, nabíjačka, púzdro, SMART hodinky","32550000-3 Telefonické zariadenia; 30230000-0 Zariadenia súvisiace s počítačmi; 60000000-8 Dopravné služby (bez prepravy odpadu)","Tovar; Služba","","https://portal.eks.sk/SpravaKniznice/OpisneFormulareKniznice/VerejnyDetailOpisnehoFormularaKniznice/263440","1","2567,900",
"OF-263915","Po karanténe","Videokonferenčný systém","Zariadenie na vidoekonferencie","32232000-8 Zariadenie na videokonferencie","Tovar; Služba","","https://portal.eks.sk/SpravaKniznice/OpisneFormulareKniznice/VerejnyDetailOpisnehoFormularaKniznice/263915","1","0",
"OF-262504","Po karanténe","Tonery - originál","Tonery, náplne do tlačiarní","30125100-2 Tonerové náplne; 30125110-5 Toner do laserových tlačiarní/faxových prístrojov; 60000000-8 Dopravné služby (bez prepravy odpadu)","Tovar; Služba","","https://portal.eks.sk/SpravaKniznice/OpisneFormulareKniznice/VerejnyDetailOpisnehoFormularaKniznice/262504","1","390,000",
"OF-263540","Po karanténe","Nádoby,obaly a obalový materál","Stojan na odpadkové vrecia, vrecia na odpad","34928480-6 Kontajnery a nádoby na odpad a odpadky; 18930000-7 Vrecia a vaky; 60000000-8 Dopravné služby (bez prepravy odpadu)","Tovar; Služba","","https://portal.eks.sk/SpravaKniznice/OpisneFormulareKniznice/VerejnyDetailOpisnehoFormularaKniznice/263540","1","324,060",
"OF-263065","Po karanténe","Záťažový elektrokardiograf","Záťažový elektrokardiograf","33123200-0 Elektrokardiografické prístroje; 33100000-1 Zdravotnícke vybavenie; 60000000-8 Dopravné služby (bez prepravy odpadu)","Tovar; Služba","","https://portal.eks.sk/SpravaKniznice/OpisneFormulareKniznice/VerejnyDetailOpisnehoFormularaKniznice/263065","1","0",
"OF-263208","Po karanténe","Chemikálie pre laboratória","anorganické a organické chemikálie","24300000-7 Základné anorganické a organické chemikálie; 24310000-0 Základné anorganické chemikálie; 24315000-5 Rôzne anorganické chemikálie; 24320000-3 Základné organické chemikálie; 60000000-8 Dopravné služby (bez prepravy odpadu)","Tovar; Služba","","https://portal.eks.sk/SpravaKniznice/OpisneFormulareKniznice/VerejnyDetailOpisnehoFormularaKniznice/263208","1","0",
"OF-262879","Po karanténe","Tablet s príslušenstvom","tablet","30213200-7 Tabletový počítač; 60000000-8 Dopravné služby (bez prepravy odpadu)","Tovar; Služba","","https://portal.eks.sk/SpravaKniznice/OpisneFormulareKniznice/VerejnyDetailOpisnehoFormularaKniznice/262879","1","1260,000",
"OF-263758","Po karanténe","Keramická filtračná vložka CEE 9 ","Keramická filtračná vložka","42955000-5 Časti filtračných zariadení; 60000000-8 Dopravné služby (bez prepravy odpadu)","Tovar; Služba","","https://portal.eks.sk/SpravaKniznice/OpisneFormulareKniznice/VerejnyDetailOpisnehoFormularaKniznice/263758","0","0",
"OF-264176","Po karanténe","Karimatka samonafukovacia","karimatka, spacia podložka","37414100-4 Spacie podložky; 37440000-4 Výstroj na fitnes; 37414000-3 Potreby na táborenie; 60000000-8 Dopravné služby (bez prepravy odpadu)","Tovar; Služba","","https://portal.eks.sk/SpravaKniznice/OpisneFormulareKniznice/VerejnyDetailOpisnehoFormularaKniznice/264176","0","0",
"OF-262590","Po karanténe","stolové počítače s SSD diskom pre firemné prostredie, iné príslušenstvo","desktop, SSD, 512GB, 16GB, záruka, USB-C, midi tower, veža, dokovacia stanica","30230000-0 Zariadenia súvisiace s počítačmi; 30237000-9 Časti a príslušenstvo počítačov a spotrebný materiál k nim; 60000000-8 Dopravné služby (bez prepravy odpadu); 30213000-5 Osobné počítače","Tovar; Služba","","https://portal.eks.sk/SpravaKniznice/OpisneFormulareKniznice/VerejnyDetailOpisnehoFormularaKniznice/262590","0","0",
"OF-262922","Po karanténe","Kotly elektrické varný 300 l, 100 l a 85 l","elektrický varný kotol","39314000-6 Priemyselné vybavenie kuchýň; 39310000-8 Zariadenia hromadného stravovania; 39312200-4 Zariadenia závodných jedální; 39312000-2 Zariadenia na prípravu jedál; 51100000-3 Inštalácia elektrických a mechanických zariadení; 60000000-8 Dopravné služby (bez prepravy odpadu)","Tovar; Služba","","https://portal.eks.sk/SpravaKniznice/OpisneFormulareKniznice/VerejnyDetailOpisnehoFormularaKniznice/262922","0","0",
"OF-263933","Po karanténe","Nákup a dodanie krmív pre lososovité ryby ","krmivo pre ryby","15711000-5 Krmivo pre ryby; 60000000-8 Dopravné služby (bez prepravy odpadu)","Tovar; Služba","","https://portal.eks.sk/SpravaKniznice/OpisneFormulareKniznice/VerejnyDetailOpisnehoFormularaKniznice/263933","0","0",
"OF-263558","Po karanténe","Dielenské vybavenie","Kompresor","43800000-1 Dielenské zariadenia; 60000000-8 Dopravné služby (bez prepravy odpadu); 42124000-4 Časti čerpadiel, kompresorov, strojov a motorov; 42123000-7 Kompresory; 42123600-3 Piestové objemové kompresory","Tovar; Služba","","https://portal.eks.sk/SpravaKniznice/OpisneFormulareKniznice/VerejnyDetailOpisnehoFormularaKniznice/263558","0","0",
"OF-263701","Po karanténe","Akumulátorové batérie a elektrolyt - kyselina sírová do AKB","kyselina sírová, elektrolyt, AKB, akumulátorové batérie","24311411-1 Kyselina sírová; 31431000-6 Olovené akumulátory; 60000000-8 Dopravné služby (bez prepravy odpadu)","Tovar; Služba","","https://portal.eks.sk/SpravaKniznice/OpisneFormulareKniznice/VerejnyDetailOpisnehoFormularaKniznice/263701","0","0",
"OF-263658","Po karanténe","Trvanlivé potraviny a koreniny","trvanlivé potraviny, koreniny, chuťové prísady","15842000-2 Čokoláda a cukrovinky; 15820000-2 Sucháre a piškóty; trvanlivé pečivo a cukrovinky; 15863100-6 Zelený čaj; 15863200-7 Čierny čaj; 15871210-9 Sójová omáčka; 15871260-4 Omáčky; 15871270-7 Miešané korenisté zmesi; 15891500-5 Bujóny; 15892400-1 Zahusťovadlá; 15893300-7 Zmesové mäsové šťavy/omáčky; 15872100-2 Paprika; 15872200-3 Korenie; 15872300-4 Bylinky; 60000000-8 Dopravné služby (bez prepravy odpadu)","Tovar; Služba","","https://portal.eks.sk/SpravaKniznice/OpisneFormulareKniznice/VerejnyDetailOpisnehoFormularaKniznice/263658","0","0",
"OF-263515","Po karanténe","Wifi kontrolery ","Wifi kontrolery","32413000-1 Integrované siete; 60000000-8 Dopravné služby (bez prepravy odpadu)","Tovar; Služba","","https://portal.eks.sk/SpravaKniznice/OpisneFormulareKniznice/VerejnyDetailOpisnehoFormularaKniznice/263515","0","0",
"OF-262479","Po karanténe","Vajcia   12-09","Vajcia, vajcia slepačie, vajcia slepačie čerstvé","03142500-3 Vajcia; 60000000-8 Dopravné služby (bez prepravy odpadu)","Tovar; Služba","","https://portal.eks.sk/SpravaKniznice/OpisneFormulareKniznice/VerejnyDetailOpisnehoFormularaKniznice/262479","0","0",
"OF-263026","Po karanténe","Odvoz komunálneho odpadu v kontajneroch s objemom  10 m3","odvoz a likvidácia veľkorozmerného, drobného stavebného odpadu a zmiešaného komunálneho odpadu","90512000-9 Služby na prepravu odpadu; 34144511-3 Vozidlá na odvoz smetí; 60000000-8 Dopravné služby (bez prepravy odpadu)","Služba","","https://portal.eks.sk/SpravaKniznice/OpisneFormulareKniznice/VerejnyDetailOpisnehoFormularaKniznice/263026","0","0",
"OF-264048","Po karanténe","Spotrebný materiál pre tlačiarenské zariadenia","toner, zapekacie jednotky, valce pre kancelárske stroje","30125100-2 Tonerové náplne; 90510000-5 Likvidácia a spracovanie odpadu; 60000000-8 Dopravné služby (bez prepravy odpadu); 30124400-8 Zásobníky na sponky; 30124300-7 Valce pre kancelárske stroje; 30125110-5 Toner do laserových tlačiarní/faxových prístrojov; 30125120-8 Toner do fotokopírovacích strojov; 30124100-5 Zapekacie jednotky","Tovar; Služba","","https://portal.eks.sk/SpravaKniznice/OpisneFormulareKniznice/VerejnyDetailOpisnehoFormularaKniznice/264048","0","0",
"OF-263779","Po karanténe","Mini počítač","výpočtová technika, počítač","30200000-1 Počítačové zariadenia a spotrebný materiál; 30213000-5 Osobné počítače; 30237000-9 Časti a príslušenstvo počítačov a spotrebný materiál k nim","Tovar","","https://portal.eks.sk/SpravaKniznice/OpisneFormulareKniznice/VerejnyDetailOpisnehoFormularaKniznice/263779","0","0",
"OF-264280","Po karanténe","Čistiace a hygienické prostriedky","Mydlo, vrecia, handra, čistiace prostriedky, hygienické prostriedky, utierky, metla, zmeták, toaletný papier, servítky, dezinfekčný prostriedok, krém na ruky, papierové utierky, rukavice","39800000-0 Čistiace a leštiace výrobky; 60000000-8 Dopravné služby (bez prepravy odpadu); 39832000-3 Čistiace prostriedky na riad; 39830000-9 Čistiace výrobky; 33761000-2 Toaletný papier; 33763000-6 Papierové uteráky na ruky; 33764000-3 Papierové servítky; 39831300-9 Čistiace prostriedky na podlahu; 39831600-2 Čistiace prostriedky na toalety; 39542000-3 Handry; 33711610-6 Šampóny; 33711900-6 Mydlo; 33741100-7 Čistiace prostriedky na ruky; 33741200-8 Krémy na ruky alebo telové mlieka; 39224100-9 Metly; 39224310-4 WC kefy; 39224320-7 Špongie; 39224330-0 Vedrá; 39224340-3 Koše; 39224350-6 Lopatky na smeti","Tovar; Služba","","https://portal.eks.sk/SpravaKniznice/OpisneFormulareKniznice/VerejnyDetailOpisnehoFormularaKniznice/264280","0","0",
"OF-264180","Po karanténe","Opravy a údržba mobilných klimatizačných zariadení","oprava, výmena, servis, mobilná klimatizácia, čistenie klimatizácie","50510000-3 Opravy a údržba čerpadiel, ventilov, kohútov a kovových nádob; 50530000-9 Opravy a údržba strojov; 60000000-8 Dopravné služby (bez prepravy odpadu)","Služba","","https://portal.eks.sk/SpravaKniznice/OpisneFormulareKniznice/VerejnyDetailOpisnehoFormularaKniznice/264180","0","0",
"OF-262843","Po karanténe","Osobné počítače, notebooky, skartovačka, klávesnica","PC, notebook, skartovačka, klavesnica","30213000-5 Osobné počítače; 30213100-6 Prenosné počítače; 30237460-1 Počítačové klávesnice; 30191400-8 Skartovače; 60000000-8 Dopravné služby (bez prepravy odpadu)","Tovar; Služba","","https://portal.eks.sk/SpravaKniznice/OpisneFormulareKniznice/VerejnyDetailOpisnehoFormularaKniznice/262843","0","0",
"OF-264097","Po karanténe","ND do prívesov a návesov ","svetlo obrysové, svetlo zadné, odrazka, zástrčka, rozvádzač, ventil, valec brzdový","34200000-9 Karosérie vozidiel, prívesy alebo návesy; 34223300-9 Prívesy; 34913000-0 Rôzne náhradné diely; 60000000-8 Dopravné služby (bez prepravy odpadu)","Tovar; Služba","","https://portal.eks.sk/SpravaKniznice/OpisneFormulareKniznice/VerejnyDetailOpisnehoFormularaKniznice/264097","0","0",
"OF-263029","Po karanténe","Kancelársky papier","kancelársky papier, papier do tlačiarní","30197643-5 Papier na fotokopírovanie; 30199000-0 Papiernický tovar a iné položky; 60000000-8 Dopravné služby (bez prepravy odpadu)","Tovar; Služba","","https://portal.eks.sk/SpravaKniznice/OpisneFormulareKniznice/VerejnyDetailOpisnehoFormularaKniznice/263029","0","0",
"OF-263361","Po karanténe","Pevný disk 2,5“ 128MB SATA III 5,4k","výpočtová technika, disk","30200000-1 Počítačové zariadenia a spotrebný materiál; 60000000-8 Dopravné služby (bez prepravy odpadu)","Tovar; Služba","","https://portal.eks.sk/SpravaKniznice/OpisneFormulareKniznice/VerejnyDetailOpisnehoFormularaKniznice/263361","0","0",
"OF-264415","Po karanténe","Platforma pre umiestnenie senzorov","simulátor, platforma","34740000-6 Zariadenia lietadiel alebo kozmických lodí, trenažérov, simulátorov a súvisiace časti; 60000000-8 Dopravné služby (bez prepravy odpadu)","Tovar; Služba","","https://portal.eks.sk/SpravaKniznice/OpisneFormulareKniznice/VerejnyDetailOpisnehoFormularaKniznice/264415","0","0",
"OF-263562","Po karanténe","Osobný počítač (All-in-One), prenosný počítač (notebook)","all in one, notebook","30213000-5 Osobné počítače; 30213100-6 Prenosné počítače","Tovar; Služba","","https://portal.eks.sk/SpravaKniznice/OpisneFormulareKniznice/VerejnyDetailOpisnehoFormularaKniznice/263562","0","0",
"OF-263997","Po karanténe","Výrobník sódy","výrobník, sódostroj, elektrospotrebiče","39710000-2 Elektrické prístroje pre domácnosť; 60000000-8 Dopravné služby (bez prepravy odpadu)","Tovar; Služba","","https://portal.eks.sk/SpravaKniznice/OpisneFormulareKniznice/VerejnyDetailOpisnehoFormularaKniznice/263997","0","0",
"OF-264329","Po karanténe","Priemyselná práčka s oceľovým podstavcom","vysokootáčková práčka, podstavec","42716120-5 Práčky; 60000000-8 Dopravné služby (bez prepravy odpadu)","Tovar; Služba","","https://portal.eks.sk/SpravaKniznice/OpisneFormulareKniznice/VerejnyDetailOpisnehoFormularaKniznice/264329","0","0",
"OF-263980","Po karanténe","Náhradné svetelné zdroje do existujúcich klasických halogénových reflektorov","osvetľovacie zariadenia, elektrické žiarovky, halogénové žiarovky","31500000-1 Osvetľovacie zariadenia a elektrické žiarovky; 31512100-9 Halogénové žiarovky, lineárne; 60000000-8 Dopravné služby (bez prepravy odpadu)","Tovar; Služba","","https://portal.eks.sk/SpravaKniznice/OpisneFormulareKniznice/VerejnyDetailOpisnehoFormularaKniznice/263980","0","0",
"OF-262308","Po karanténe","Zariadenie pre úpravu zdravotníckeho odpadu - dekontaminačná jednotka","zdravotnícky, odpad, dekontaminácia, úprava,","42924720-2 Dekontaminačné zariadenia; 90524400-0 Zber, doprava a likvidácia nemocničného odpadu; 60000000-8 Dopravné služby (bez prepravy odpadu)","Tovar; Služba","","https://portal.eks.sk/SpravaKniznice/OpisneFormulareKniznice/VerejnyDetailOpisnehoFormularaKniznice/262308","0","0",
"OF-261521","Po karanténe","Vreckové, panelové a HEPA filtre do vzduchotechniky","vreckový filter, panelový filter, HEPA filter, filter do vzduchotechniky","42913000-9 Olejové, benzínové a nasávacie vzduchové filtre; 42913500-4 Nasávacie vzduchové filtre; 42514310-8 Vzduchové filtre; 60000000-8 Dopravné služby (bez prepravy odpadu)","Tovar; Služba","","https://portal.eks.sk/SpravaKniznice/OpisneFormulareKniznice/VerejnyDetailOpisnehoFormularaKniznice/261521","0","0",
"OF-263825","Po karanténe","Dezinfekčné prípravky na dezinfekciu povrchov, lekárskych nástrojov a kože","antiseptiká, dezinfekčné prípravky, dezinfekcia","33631600-8 Antiseptiká a dezinfekčné prostriedky; 60000000-8 Dopravné služby (bez prepravy odpadu)","Tovar; Služba","","https://portal.eks.sk/SpravaKniznice/OpisneFormulareKniznice/VerejnyDetailOpisnehoFormularaKniznice/263825","0","0",
"OF-264134","Po karanténe","Elektroinštalačný materiál","Zásuvka, Štartér pre neónové trubice, Vypínač, Zásuvka rozbočovacia","31000000-6 Elektrické stroje, prístroje, zariadenia a spotrebný tovar; osvetlenie; 31200000-8 Rozvod elektriny a regulačné prístroje; 31530000-0 Časti lámp a osvetľovacích zariadení; 31710000-6 Elektronické zariadenia; 60000000-8 Dopravné služby (bez prepravy odpadu)","Tovar; Služba","","https://portal.eks.sk/SpravaKniznice/OpisneFormulareKniznice/VerejnyDetailOpisnehoFormularaKniznice/264134","0","0",
"OF-264034","Po karanténe","Kovové tyče, plechy, fólie a profily","Plechy, Profily, Tyče, Jakel,","44172000-6 Plechy (stavebné); 14622000-7 Oceľ; 44450000-9 Mäkká oceľ; 44170000-2 Dosky, plechy, pásy a fólie súvisiace so stavebnými materiálmi; 44331000-9 Tyče; 44330000-2 Tyče, prúty, drôty a profily používané v stavebníctve; 44334000-0 Profily; 60000000-8 Dopravné služby (bez prepravy odpadu)","Tovar; Služba","","https://portal.eks.sk/SpravaKniznice/OpisneFormulareKniznice/VerejnyDetailOpisnehoFormularaKniznice/264034","0","0",
"OF-262966","Po karanténe","Náhradné diely na autobusy Solaris - kúrenie Eberspächer","Náhradné diely, autobus, Solaris, kúrenie Eberspächer","34121100-2 Autobusy verejnej dopravy; 39715200-9 Kúrenie; 60000000-8 Dopravné služby (bez prepravy odpadu)","Tovar","","https://portal.eks.sk/SpravaKniznice/OpisneFormulareKniznice/VerejnyDetailOpisnehoFormularaKniznice/262966","0","0",
"OF-263868","Po karanténe","Laboratórny spotrebný materiál","materiál, laboratórium, výskum, pokus","38000000-5 Laboratórne, optické a presné prístroje a vybavenie (s výnimkou skiel); 60000000-8 Dopravné služby (bez prepravy odpadu)","Tovar; Služba","","https://portal.eks.sk/SpravaKniznice/OpisneFormulareKniznice/VerejnyDetailOpisnehoFormularaKniznice/263868","0","0",
"OF-263364","Po karanténe","PC Tower","výpočtová technika, stolový počítač","30200000-1 Počítačové zariadenia a spotrebný materiál; 60000000-8 Dopravné služby (bez prepravy odpadu)","Tovar; Služba","","https://portal.eks.sk/SpravaKniznice/OpisneFormulareKniznice/VerejnyDetailOpisnehoFormularaKniznice/263364","0","0",
"OF-264091","Po karanténe","Úžitkové motorové vozidlá  pick-up","motorové vozidlo, úžitkové motorové vozidlo","34000000-7 Prepravné zariadenia a pomocné výrobky na prepravu; 34100000-8 Motorové vozidlá; 34113000-2 Vozidlá s náhonom štyroch kolies; 34113200-4 Terénne a cestné vozidlá; 60000000-8 Dopravné služby (bez prepravy odpadu)","Tovar; Služba","","https://portal.eks.sk/SpravaKniznice/OpisneFormulareKniznice/VerejnyDetailOpisnehoFormularaKniznice/264091","0","0",
"OF-263264","Po karanténe","Vybavenie posilňovní","hrazda, lavica na posilňovanie, set činiek","37442000-8 Vybavenie na váhové a odporové cvičenie; 37442100-8 Jednoručné činky; 37442200-8 Obojručné činky; 37442400-8 Lavice alebo stojany na závažia; 60000000-8 Dopravné služby (bez prepravy odpadu)","Tovar; Služba","","https://portal.eks.sk/SpravaKniznice/OpisneFormulareKniznice/VerejnyDetailOpisnehoFormularaKniznice/263264","0","0",
"OF-263055","Po karanténe","Nové osobné služobné motorové vozidlá COMBI","osobné motorové vozidlo, automobil, 5 miestne,","34100000-8 Motorové vozidlá; 34115200-8 Motorové vozidlá na prepravu menej než 10 osôb; 34110000-1 Osobné automobily; 60000000-8 Dopravné služby (bez prepravy odpadu)","Tovar; Služba","","https://portal.eks.sk/SpravaKniznice/OpisneFormulareKniznice/VerejnyDetailOpisnehoFormularaKniznice/263055","0","0",
"OF-262657","Po karanténe","PC monitory","PC monitory","33195100-4 Monitory; 30237100-0 Časti počítačov; 60000000-8 Dopravné služby (bez prepravy odpadu)","Tovar; Služba","","https://portal.eks.sk/SpravaKniznice/OpisneFormulareKniznice/VerejnyDetailOpisnehoFormularaKniznice/262657","0","0",
"OF-262989","Po karanténe","Predĺženie softvérovej podpory pre produkt Kerio Control GOV a AV pre 250 používateľov.","podpora, Kerio Control GOV","72250000-2 Služby týkajúce sa podpory systému; 60000000-8 Dopravné služby (bez prepravy odpadu)","Služba","","https://portal.eks.sk/SpravaKniznice/OpisneFormulareKniznice/VerejnyDetailOpisnehoFormularaKniznice/262989","0","0",
"OF-264200","Po karanténe","Dodávka zemného plynu pre odberné miesta obstarávateľa na jeden rok ","Dodávka zemného plynu, fixné tarify, distribúcia","09123000-7 Zemný plyn; 60000000-8 Dopravné služby (bez prepravy odpadu)","Tovar; Služba","","https://portal.eks.sk/SpravaKniznice/OpisneFormulareKniznice/VerejnyDetailOpisnehoFormularaKniznice/264200","0","0",
