"OpisnyFormularIdentifikator","OpisnyFormularStav","OpisnyFormularNazov","OpisnyFormularKlucoveSlova","OpisnyFormularCpv","OpisnyFormularDruh","OpisnyFormularKategoriaSluzieb","OpisnyFormularUrl","OpisnyFormularPocetVyhlasenychZakaziek","OpisnyFormularObchodovanaSumaBezDPH",
"OF-141426","Po karanténe","Laserový diaľkomer, sklonomer a výškomer Nikon Forestry Pro alebo ekvivalent","výškomer, diaľkomer, sklonomer","38636100-3 Lasery; 42000000-6 Priemyselné mechanizmy; 60000000-8 Dopravné služby (bez prepravy odpadu)","Tovar; Služba","","https://portal.eks.sk/SpravaKniznice/OpisneFormulareKniznice/VerejnyDetailOpisnehoFormularaKniznice/141426","1","699,890",
"OF-141429","Po karanténe","Tonery, kazety, pásky a valce do jednotlivých tlačiarni","Originálne tonery, fotokopírovanie, tlač","30125100-2 Tonerové náplne; 60000000-8 Dopravné služby (bez prepravy odpadu); 30125120-8 Toner do fotokopírovacích strojov; 30125110-5 Toner do laserových tlačiarní/faxových prístrojov","Tovar; Služba","","https://portal.eks.sk/SpravaKniznice/OpisneFormulareKniznice/VerejnyDetailOpisnehoFormularaKniznice/141429","1","13399,000",
"OF-141444","Po karanténe","Softvérové produkty","Softvérové produkty, softvérové balíky, informačné systémy","48000000-8 Softvérové balíky a informačné systémy; 48900000-7 Rôzne softvérové balíky a počítačové systémy; 48310000-4 Softvérový balík na vytváranie dokumentov; 48326000-9 Softvérový balík na vytváranie máp; 48322000-1 Grafický softvérový balík; 48460000-0 Analytický, vedecký, matematický a prognostický softvérový balík; 60000000-8 Dopravné služby (bez prepravy odpadu)","Tovar; Služba","","https://portal.eks.sk/SpravaKniznice/OpisneFormulareKniznice/VerejnyDetailOpisnehoFormularaKniznice/141444","0","0",
"OF-141461","Po karanténe","Interiérové dvere","Výrobky stavebného stolárstva","44221200-7 Dvere; 60000000-8 Dopravné služby (bez prepravy odpadu)","Tovar; Služba","","https://portal.eks.sk/SpravaKniznice/OpisneFormulareKniznice/VerejnyDetailOpisnehoFormularaKniznice/141461","1","1500,000",
"OF-141476","Po karanténe","Čistiace a leštiace výrobky","čistiace výrobky,","39800000-0 Čistiace a leštiace výrobky; 39831300-9 Čistiace prostriedky na podlahu; 39831600-2 Čistiace prostriedky na toalety; 60000000-8 Dopravné služby (bez prepravy odpadu)","Tovar; Služba","","https://portal.eks.sk/SpravaKniznice/OpisneFormulareKniznice/VerejnyDetailOpisnehoFormularaKniznice/141476","1","1236,000",
"OF-141493","Po karanténe","tonerové náplne","originálny toner do laserových tlačiarní, ","30125100-2 Tonerové náplne; 30125110-5 Toner do laserových tlačiarní/faxových prístrojov; 60000000-8 Dopravné služby (bez prepravy odpadu)","Tovar; Služba","","https://portal.eks.sk/SpravaKniznice/OpisneFormulareKniznice/VerejnyDetailOpisnehoFormularaKniznice/141493","1","5408,330",
"OF-141511","Po karanténe","Servisná prehliadka motorového vozidla","Servisná prehliadka,  služobné motorové vozidlo, Fiat Ducato","50110000-9 Opravy a údržbárske služby pre motorové vozidlá a súvisiace vybavenie; 50113200-2 Údržba autobusov; 60000000-8 Dopravné služby (bez prepravy odpadu)","Služba","","https://portal.eks.sk/SpravaKniznice/OpisneFormulareKniznice/VerejnyDetailOpisnehoFormularaKniznice/141511","0","0",
"OF-141529","Po karanténe","Xerox papier, kancelárske potreby","xerox papier, papier na fotokopírovanie, xerografický papier, ceruza, zošívačka, obálky","30197642-8 Papier na fotokopírovanie a xerografický papier; 30192000-1 Kancelárske potreby","Tovar; Služba","","https://portal.eks.sk/SpravaKniznice/OpisneFormulareKniznice/VerejnyDetailOpisnehoFormularaKniznice/141529","1","1690,830",
"OF-140978","Po karanténe","Pracovné odevy, obuv a pomôcky do terénu","bunda, topánky, pracovné odevy, nohavice, ","18100000-0 Pracovné odevy, špeciálne pracovné odevy a doplnky; 18815100-6 Vysoké topánky po členky; 60000000-8 Dopravné služby (bez prepravy odpadu)","Tovar; Služba","","https://portal.eks.sk/SpravaKniznice/OpisneFormulareKniznice/VerejnyDetailOpisnehoFormularaKniznice/140978","1","642,000",
"OF-140992","Po karanténe","Oplotenie a jeho súčasti","pletivo, stĺpiky, betónová zmes","44144000-1 Stĺpy; 44312000-0 Drôt na ploty; 44313200-9 Drôtené pletivo; 44400000-4 Rôzne montované výrobky a súvisiace diely; 60000000-8 Dopravné služby (bez prepravy odpadu); 44114000-2 Betón","Tovar; Služba","","https://portal.eks.sk/SpravaKniznice/OpisneFormulareKniznice/VerejnyDetailOpisnehoFormularaKniznice/140992","1","1339,990",
"OF-141009","Po karanténe","Mitraclip - systém na rekonštrukciu insuficientnej mitrálnej chlopne aproximáciou tkaniva","chlopňa, rekonštrukcia, mitrálna chlopňa, aproximácia cípov, regurgitácia","33000000-0 Zdravotnícke vybavenie, farmaceutický materiál a výrobky osobnej starostlivosti; 33180000-5 Funkčná podpora; 60000000-8 Dopravné služby (bez prepravy odpadu)","Tovar; Služba","","https://portal.eks.sk/SpravaKniznice/OpisneFormulareKniznice/VerejnyDetailOpisnehoFormularaKniznice/141009","0","0",
"OF-141010","Po karanténe","Motorový krovinorez STIHL FS 70 C-E","Krovinorez, motorový, Stihl","16311100-9 Kosačky trávnikov, parkov alebo športovísk; 60000000-8 Dopravné služby (bez prepravy odpadu)","Tovar; Služba","","https://portal.eks.sk/SpravaKniznice/OpisneFormulareKniznice/VerejnyDetailOpisnehoFormularaKniznice/141010","1","458,250",
"OF-141027","Po karanténe","Vrecia na odpad","Vrecia na odpad PE","19640000-4 Polyetylénový odpad a odpadkové vrecká a vaky; 60000000-8 Dopravné služby (bez prepravy odpadu)","Tovar; Služba","","https://portal.eks.sk/SpravaKniznice/OpisneFormulareKniznice/VerejnyDetailOpisnehoFormularaKniznice/141027","0","0",
"OF-141028","Po karanténe","Organizačno - technické zabezpečenie konferencie","konferencia, konferenčná miestnosť, konferenčná technika, cateringové služby ","55120000-7 Služby na organizovanie stretnutí a konferencií v hoteloch; 55300000-3 Reštauračné služby a podávanie jedál","Služba","","https://portal.eks.sk/SpravaKniznice/OpisneFormulareKniznice/VerejnyDetailOpisnehoFormularaKniznice/141028","1","4555,590",
"OF-141059","Po karanténe","Laparoskopická veža","Laparoskopická veža, laparoskopická kamera, laparoskopická kamerová hlavica, optika, svet.kábel, laparoskopický svetelný zdroj, insuflátor, odsávací a irigačný systém, elektrochirurgická jednotka","33164000-7 Laparoskopické prístroje; 60000000-8 Dopravné služby (bez prepravy odpadu)","Tovar; Služba","","https://portal.eks.sk/SpravaKniznice/OpisneFormulareKniznice/VerejnyDetailOpisnehoFormularaKniznice/141059","0","0",
"OF-141060","Po karanténe","Mini vŕtací a rezací systém pre ortopedické a traumatologické operačné výkony","batériový vŕtací systém, batériový rezací systém, ortopedický operačný motorový systém, traumatologický operačný motorový systém, mini univerzálne batériové telo","33183000-6 Ortopedické podporné prístroje; 60000000-8 Dopravné služby (bez prepravy odpadu)","Tovar; Služba","","https://portal.eks.sk/SpravaKniznice/OpisneFormulareKniznice/VerejnyDetailOpisnehoFormularaKniznice/141060","0","0",
"OF-141092","Po karanténe","Digitálny fotoaparát s vysokorýchlostným záznamom, s pamäťovou kartou a so statívom","Digitálny fotoaparát, vysokorýchlostný záznam, pamäťová karta, statív, diaľkové ovládanie","38650000-6 Fotografické zariadenia; 38651600-9 Digitálne fotoaparáty; 60000000-8 Dopravné služby (bez prepravy odpadu)","Tovar; Služba","","https://portal.eks.sk/SpravaKniznice/OpisneFormulareKniznice/VerejnyDetailOpisnehoFormularaKniznice/141092","2","2185,000",
"OF-141109","Po karanténe","Mäso a mäsové výrobky","Mäso bravčové, hovädzie, mäsové výrobky, chladené","15110000-2 Mäso; 15130000-8 Mäsové výrobky; 60000000-8 Dopravné služby (bez prepravy odpadu); 15113000-3 Bravčové mäso; 15111100-0 Hovädzie mäso; 15131230-6 Saláma; 15131220-3 Slanina; 15112130-6 Kurčatá; 15112140-9 Kačice; 15112000-6 Hydina; 15131410-2 Šunka; 15131130-5 Klobásy/párky/saláma/jaternice","Tovar; Služba","","https://portal.eks.sk/SpravaKniznice/OpisneFormulareKniznice/VerejnyDetailOpisnehoFormularaKniznice/141109","1","0",
"OF-141110","Po karanténe","Počítačová zostava","Osobný počítať s monitorom, klávesnicou a myšou","30213000-5 Osobné počítače; 33195100-4 Monitory; 30237200-1 Príslušenstvo počítačov; 60000000-8 Dopravné služby (bez prepravy odpadu)","Tovar; Služba","","https://portal.eks.sk/SpravaKniznice/OpisneFormulareKniznice/VerejnyDetailOpisnehoFormularaKniznice/141110","1","480,000",
"OF-141128","Po karanténe","Učebné pomôcky","lego, tyče, paličky, guličky, pentominá, zlomky, výrezy, kufor","39162200-7 Učebné pomôcky a zariadenia; 60000000-8 Dopravné služby (bez prepravy odpadu)","Tovar; Služba","","https://portal.eks.sk/SpravaKniznice/OpisneFormulareKniznice/VerejnyDetailOpisnehoFormularaKniznice/141128","1","1132,500",
"OF-141142","Po karanténe","Výroba archivačných krabíc","Archivačné krabice, doprava na miesto plnenia","30199500-5 Škatuľové zaraďovače, listové priehradky, skladovacie škatule a podobné výrobky; 60000000-8 Dopravné služby (bez prepravy odpadu)","Tovar; Služba","","https://portal.eks.sk/SpravaKniznice/OpisneFormulareKniznice/VerejnyDetailOpisnehoFormularaKniznice/141142","1","2020,000",
"OF-141159","Po karanténe","Tonery do laserových tlačiarní a kopírovacích strojov","Tonery, náplne do tlačiarní, tlač, atrament","30125110-5 Toner do laserových tlačiarní/faxových prístrojov; 60112000-6 Služby verejnej cestnej dopravy; 60000000-8 Dopravné služby (bez prepravy odpadu)","Tovar; Služba","","https://portal.eks.sk/SpravaKniznice/OpisneFormulareKniznice/VerejnyDetailOpisnehoFormularaKniznice/141159","0","0",
"OF-141160","Po karanténe","Záložný zdroj UPS Fortron PPF18A1401 vrátane rack vodiacich líšt do racku","UPS, záložný zdroj napájania z elektrickej siete, batéria","31154000-0 Zdroje nepretržitého/stáleho napájania; 60000000-8 Dopravné služby (bez prepravy odpadu); 31440000-2 Batérie","Tovar; Služba","","https://portal.eks.sk/SpravaKniznice/OpisneFormulareKniznice/VerejnyDetailOpisnehoFormularaKniznice/141160","0","0",
"OF-141419","Po karanténe","Plastové dosky z recyklovaného plastu TOPeco TM s ochrannou známkou","plastové dosky, recyklovaný plast TOPeco, plastové doky s výstuhou, plastové dosky bez výstuhy - mestské lavičky a pieskoviská","19520000-7 Plastové výrobky; 60000000-8 Dopravné služby (bez prepravy odpadu)","Tovar; Služba","","https://portal.eks.sk/SpravaKniznice/OpisneFormulareKniznice/VerejnyDetailOpisnehoFormularaKniznice/141419","1","19989,000",
"OF-141434","Po karanténe","Oceľové zvodidlo Fracasso - súčasti","zvodidlá,  bezpečnostné zariadenia, vybavenie pozemnej komunikácie","44000000-0 Stavebné konštrukcie a materiály; pomocné výrobky pre konštrukcie (s výnimkou elektrických prístrojov); 44113700-2 Materiály na opravu ciest; 60000000-8 Dopravné služby (bez prepravy odpadu)","Tovar; Služba","","https://portal.eks.sk/SpravaKniznice/OpisneFormulareKniznice/VerejnyDetailOpisnehoFormularaKniznice/141434","1","6700,000",
"OF-141436","Po karanténe","Klinix boxy, nádoby na drobné ostré predmety","Klinix boxy, nádoby na ostré predmety, nádoby na biologický odpad, nádoby na zdravotnícky odpad","44613800-8 Kontajnery na odpadový materiál; 33141123-8 Nádoby na ostré predmety; 60000000-8 Dopravné služby (bez prepravy odpadu)","Tovar; Služba","","https://portal.eks.sk/SpravaKniznice/OpisneFormulareKniznice/VerejnyDetailOpisnehoFormularaKniznice/141436","0","0",
"OF-141451","Po karanténe","Čerstvý chlieb, pečivo a pekárske výrobky","chlieb, pečivo, rožky, kaiserka, sladké pečivo, závin, múčnik, vianočka, brioška, šatôčka, strúhanka, závin, ","15811000-6 Pekársky tovar; 15811100-7 Chlieb; 15811200-8 Rožky; 15812100-4 Pečivo; 15812120-0 Koláče; 15812122-4 Sladké koláče; 15612500-6 Pekárske výrobky; 15813000-0 Raňajkové pečivo; 60000000-8 Dopravné služby (bez prepravy odpadu)","Tovar; Služba","","https://portal.eks.sk/SpravaKniznice/OpisneFormulareKniznice/VerejnyDetailOpisnehoFormularaKniznice/141451","0","0",
"OF-141470","Po karanténe","Nové nové pracovné odevy a nová ochranná obuv 2017","Ochranná obuv a pracovné odevy","18830000-6 Ochranná obuv; 18110000-3 Pracovné odevy; 60000000-8 Dopravné služby (bez prepravy odpadu)","Tovar; Služba","","https://portal.eks.sk/SpravaKniznice/OpisneFormulareKniznice/VerejnyDetailOpisnehoFormularaKniznice/141470","1","6420,830",
"OF-141485","Po karanténe","Chladnička s mrazničkou","chladnička, mraznička","39711110-3 Chladničky s mrazničkou; 60000000-8 Dopravné služby (bez prepravy odpadu)","Tovar","","https://portal.eks.sk/SpravaKniznice/OpisneFormulareKniznice/VerejnyDetailOpisnehoFormularaKniznice/141485","1","216,670",
"OF-141504","Po karanténe","Silver Nanoparticles Water Dispersion        ","Silver Nanoparticles Water Dispersion","24310000-0 Základné anorganické chemikálie","Tovar","","https://portal.eks.sk/SpravaKniznice/OpisneFormulareKniznice/VerejnyDetailOpisnehoFormularaKniznice/141504","0","0",
"OF-141519","Po karanténe","Tričká s potlačou na propagačné účely ","Tričká, reklamný propagačný materiál, potlač","18331000-8 Tričká s krátkym rukávom; 39294100-0 Informačné a propagačné výrobky; 79341000-6 Reklamné služby; 79342200-5 Propagačné služby; 22462000-6 Propagačný materiál; 18300000-2 Odevy; 60000000-8 Dopravné služby (bez prepravy odpadu)","Tovar; Služba","","https://portal.eks.sk/SpravaKniznice/OpisneFormulareKniznice/VerejnyDetailOpisnehoFormularaKniznice/141519","1","229,170",
"OF-141521","Po karanténe","Čistiace a hygienické prostriedky","čistiace prostriedky, hygienické prostriedky, dezinfekčné prostriedky, umývacie prostriedky, toaletný papier","39800000-0 Čistiace a leštiace výrobky; 39830000-9 Čistiace výrobky; 60000000-8 Dopravné služby (bez prepravy odpadu); 18424000-7 Rukavice","Tovar; Služba","","https://portal.eks.sk/SpravaKniznice/OpisneFormulareKniznice/VerejnyDetailOpisnehoFormularaKniznice/141521","1","99,160",
"OF-141534","Po karanténe","Rôzne potravinárske výrobky (127_2017/5)","mlieko trvanlivé UHT, káva, smotana do kávy, čaj","15800000-6 Rôzne potravinárske výrobky; 15511210-8 Ultravysoko zohriate mlieko; 15864100-3 Porciovaný čaj; 15863000-5 Čaj; 15861000-1 Káva; 15512000-0 Smotana; 60000000-8 Dopravné služby (bez prepravy odpadu)","Tovar; Služba","","https://portal.eks.sk/SpravaKniznice/OpisneFormulareKniznice/VerejnyDetailOpisnehoFormularaKniznice/141534","1","305,000",
"OF-141536","Po karanténe","Kopírovací stroj  ","Kopírka, tlačiareň, skener ","30121100-4 Fotokopírovacie stroje; 60000000-8 Dopravné služby (bez prepravy odpadu)","Tovar; Služba","","https://portal.eks.sk/SpravaKniznice/OpisneFormulareKniznice/VerejnyDetailOpisnehoFormularaKniznice/141536","2","1228,830",
"OF-141553","Po karanténe","Mäso čerstvé (hovädie, bravčové, telacie ostatné čerstvé mäsá) ","čerstvé hovädzie, bravčové, teľacie, jahňacie a baranie mäso","15110000-2 Mäso; 60000000-8 Dopravné služby (bez prepravy odpadu)","Tovar; Služba","","https://portal.eks.sk/SpravaKniznice/OpisneFormulareKniznice/VerejnyDetailOpisnehoFormularaKniznice/141553","1","0",
"OF-141568","Po karanténe","Zámočnícky materiál","Zámky, visiace zámky, rezné kotúče, skrutky do dreva","44521100-9 Zámky; 44521210-3 Visiace zámky; 44531100-2 Skrutky do dreva; 60000000-8 Dopravné služby (bez prepravy odpadu)","Tovar; Služba","","https://portal.eks.sk/SpravaKniznice/OpisneFormulareKniznice/VerejnyDetailOpisnehoFormularaKniznice/141568","1","154,000",
"OF-141570","Po karanténe","Rekuperačná vzduchotechnická jednotka na sušenie prádla","Dodávka a montáž rekuperačnej vzduchotechnickej jednotky,meranie, regulácia, ovládanie,vzduchotechnické rozvody","44622100-7 Zariadenia na rekuperáciu (obnovu) tepla; 60000000-8 Dopravné služby (bez prepravy odpadu)","Tovar; Stavebná práca","","https://portal.eks.sk/SpravaKniznice/OpisneFormulareKniznice/VerejnyDetailOpisnehoFormularaKniznice/141570","1","11799,000",
"OF-141585","Po karanténe","Kity","kity, laboratórne činidlá","33696500-0 Laboratórne činidlá; 60000000-8 Dopravné služby (bez prepravy odpadu)","Tovar; Služba","","https://portal.eks.sk/SpravaKniznice/OpisneFormulareKniznice/VerejnyDetailOpisnehoFormularaKniznice/141585","1","236,300",
"OF-140020","Po karanténe","Renovácia drevených okien na pamiatkovo chránenom objekte","okná, renovácia, nátery, tmelenie, oprava kovaní okien, ","50712000-9 Opravy a údržba mechanických zariadení budov; 45442190-5 Odstraňovanie náterov; 45442180-2 Opakované natieranie a maľovanie","Služba; Stavebná práca","","https://portal.eks.sk/SpravaKniznice/OpisneFormulareKniznice/VerejnyDetailOpisnehoFormularaKniznice/140020","1","51449,170",
"OF-140027","Po karanténe","Traktor pre zberný dvor s príslušenstvom","Traktor, čelný nakladač, traktorový náves, vaňový kontajner","16700000-2 Traktory/ťahače; 34223000-6 Prívesy a návesy; 43250000-0 Čelné lopatové nakladače; 44619000-2 Iné kontajnery; 60000000-8 Dopravné služby (bez prepravy odpadu)","Tovar; Služba","","https://portal.eks.sk/SpravaKniznice/OpisneFormulareKniznice/VerejnyDetailOpisnehoFormularaKniznice/140027","0","0",
"OF-140052","Po karanténe","Urologická operačná zostava","Operačná veža, operačná vizualizácia, Videoendoskopická zostava","33100000-1 Zdravotnícke vybavenie; 33162100-4 Prístroje operačnej sály; 33168100-6 Endoskopy; 60000000-8 Dopravné služby (bez prepravy odpadu)","Tovar; Služba","","https://portal.eks.sk/SpravaKniznice/OpisneFormulareKniznice/VerejnyDetailOpisnehoFormularaKniznice/140052","0","0",
"OF-140059","Po karanténe","Biela magnetická tabuľa","tabuľa","30195900-1 Biele tabule a magnetické tabule","Tovar","","https://portal.eks.sk/SpravaKniznice/OpisneFormulareKniznice/VerejnyDetailOpisnehoFormularaKniznice/140059","1","206,450",
"OF-140063","Po karanténe","Agro pneumatiky na poľnohospodársky stroj","pneumatiky, agro, poľnohospodársky stroj, náhradné diely, fekálny príves","34352300-2 Pneumatiky pre poľnohospodárske stroje; 60000000-8 Dopravné služby (bez prepravy odpadu)","Tovar; Služba","","https://portal.eks.sk/SpravaKniznice/OpisneFormulareKniznice/VerejnyDetailOpisnehoFormularaKniznice/140063","1","959,500",
"OF-140070","Po karanténe","Benzínová motorová píla Stihl MS 261","benzínová motorová píla Stihl MS 261","16160000-4 Rôzne záhradnícke potreby; 60000000-8 Dopravné služby (bez prepravy odpadu)","Tovar; Služba","","https://portal.eks.sk/SpravaKniznice/OpisneFormulareKniznice/VerejnyDetailOpisnehoFormularaKniznice/140070","1","399,000",
"OF-140077","Po karanténe","Originálne náhradne diely na služobné motorové vozidlo Volkswagen Passat","Volkswagen Passat, brzdy, spojovacie tyče, hriadeľ kolesa, svetlomet, remeň ozubený, tlmiče, klinový remeň, vodné čerpadlo","34300000-0 Časti a príslušenstvo vozidiel a ich motorov","Tovar; Služba","","https://portal.eks.sk/SpravaKniznice/OpisneFormulareKniznice/VerejnyDetailOpisnehoFormularaKniznice/140077","0","0",
"OF-140084","Po karanténe","Dezinfekčné a pracie prostriedky pre práčovňu","dezinfekčné prostriedky, dezinfekcia, pracie prostriedky","24455000-8 Dezinfekčné prostriedky; 39831000-6 Pracie prostriedky; 60000000-8 Dopravné služby (bez prepravy odpadu)","Tovar; Služba","","https://portal.eks.sk/SpravaKniznice/OpisneFormulareKniznice/VerejnyDetailOpisnehoFormularaKniznice/140084","1","6530,000",
"OF-140095","Po karanténe","Náhradné diely na horskú kosačku Reform 3000","náhradné diely, horská kosačka, Reform 3000","16310000-1 Kosačky; 16800000-3 Časti poľnohospodárskych a lesníckych mechanizmov; 60000000-8 Dopravné služby (bez prepravy odpadu)","Tovar; Služba","","https://portal.eks.sk/SpravaKniznice/OpisneFormulareKniznice/VerejnyDetailOpisnehoFormularaKniznice/140095","1","940,000",
"OF-140102","Po karanténe","Ponorné čerpadlá ","ponorné čerpadlo","31681200-5 Elektrické čerpadlá; 60000000-8 Dopravné služby (bez prepravy odpadu)","Tovar; Služba","","https://portal.eks.sk/SpravaKniznice/OpisneFormulareKniznice/VerejnyDetailOpisnehoFormularaKniznice/140102","1","1449,170",
"OF-140109","Po karanténe","Monoklonové protilátky","monoklonové protilátky, cytometria","33651510-6 Antiséra; 60000000-8 Dopravné služby (bez prepravy odpadu)","Tovar; Služba","","https://portal.eks.sk/SpravaKniznice/OpisneFormulareKniznice/VerejnyDetailOpisnehoFormularaKniznice/140109","1","710,000",
"OF-140113","Po karanténe","Zber, odvoz a zneškodnenie biologicky rozložiteľného kuchynského odpadu","kuchynský odpad, zber, odvoz, likvidácia, biologicky rozložiteľný, zmesi tukov a olejov","90510000-5 Likvidácia a spracovanie odpadu; 90512000-9 Služby na prepravu odpadu; 90500000-2 Služby súvisiace s likvidáciou odpadu a odpadom; 90511000-2 Služby na zber odpadu","Služba","","https://portal.eks.sk/SpravaKniznice/OpisneFormulareKniznice/VerejnyDetailOpisnehoFormularaKniznice/140113","1","1599,980",
"OF-140120","Po karanténe","Účinná látka IOPROMID 370  - ATC skupina V08AB05","kontrastné látky, kontrasty, iopromid","33696800-3 Kontrastné prostriedky na röntgenovanie; 60000000-8 Dopravné služby (bez prepravy odpadu)","Tovar; Služba","","https://portal.eks.sk/SpravaKniznice/OpisneFormulareKniznice/VerejnyDetailOpisnehoFormularaKniznice/140120","1","7769,000",
"OF-140138","Po karanténe","Turistický batoh","Turistický batoh","18931100-5 Batohy","Tovar","","https://portal.eks.sk/SpravaKniznice/OpisneFormulareKniznice/VerejnyDetailOpisnehoFormularaKniznice/140138","0","0",
"OF-140145","Po karanténe","Topánky členkové ","Topánky členkové ","18815100-6 Vysoké topánky po členky; 60000000-8 Dopravné služby (bez prepravy odpadu); 18800000-7 Obuv","Tovar; Služba","","https://portal.eks.sk/SpravaKniznice/OpisneFormulareKniznice/VerejnyDetailOpisnehoFormularaKniznice/140145","1","137,500",
"OF-134272","Po karanténe","Lenovo Legion Y720-15IKB (80VR0028CK)","notebook, prenosné počítače","30213100-6 Prenosné počítače; 60000000-8 Dopravné služby (bez prepravy odpadu)","Tovar; Služba","","https://portal.eks.sk/SpravaKniznice/OpisneFormulareKniznice/VerejnyDetailOpisnehoFormularaKniznice/134272","2","2666,640",
"OF-137948","Po karanténe","Kancelárske skrine, stoly, stoličky, kreslá","Kancelársky nábytok","39130000-2 Kancelársky nábytok; 60000000-8 Dopravné služby (bez prepravy odpadu)","Tovar; Služba","","https://portal.eks.sk/SpravaKniznice/OpisneFormulareKniznice/VerejnyDetailOpisnehoFormularaKniznice/137948","1","4234,170",
"OF-138280","Po karanténe","Traktor","Traktor, údržba ciest a verejných priestranstiev","16700000-2 Traktory/ťahače; 16000000-5 Poľnohospodárske stroje; 60000000-8 Dopravné služby (bez prepravy odpadu)","Tovar; Služba","","https://portal.eks.sk/SpravaKniznice/OpisneFormulareKniznice/VerejnyDetailOpisnehoFormularaKniznice/138280","1","0",
"OF-141177","Po karanténe","Uzamykateľná kovová šatňová skriňa ","kovová skriňa","39122000-3 Skrine a knižnice; 60000000-8 Dopravné služby (bez prepravy odpadu)","Tovar; Služba","","https://portal.eks.sk/SpravaKniznice/OpisneFormulareKniznice/VerejnyDetailOpisnehoFormularaKniznice/141177","1","132,500",
"OF-141178","Po karanténe","Farebné multifunkčné zariadenie A3","farebné multifunkčné zariadenie A3","30232130-4 Farebné grafické tlačiarne; 60000000-8 Dopravné služby (bez prepravy odpadu)","Tovar; Služba","","https://portal.eks.sk/SpravaKniznice/OpisneFormulareKniznice/VerejnyDetailOpisnehoFormularaKniznice/141178","0","0",
"OF-141192","Po karanténe","kancelársky nábytok","kancelárske kreslo, váľanda","39000000-2 Nábytok (vrátane kancelárskeho nábytku), zariadenie interiéru, domáce spotrebiče (s výnimkou osvetlenia) a čistiace prostriedky; 39130000-2 Kancelársky nábytok; 60000000-8 Dopravné služby (bez prepravy odpadu)","Tovar; Služba","","https://portal.eks.sk/SpravaKniznice/OpisneFormulareKniznice/VerejnyDetailOpisnehoFormularaKniznice/141192","1","1180,000",
"OF-141195","Po karanténe","Nástenné klimatizačné Jednotky s montážou","Klimatizačné jednotky, klimatizácie","42512000-8 Klimatizačné zariadenia; 60000000-8 Dopravné služby (bez prepravy odpadu); 42512200-0 Nástenné klimatizačné mechanizmy; 45331220-4 Inštalovanie klimatizácie","Tovar; Služba","","https://portal.eks.sk/SpravaKniznice/OpisneFormulareKniznice/VerejnyDetailOpisnehoFormularaKniznice/141195","1","3332,900",
"OF-141209","Po karanténe","Zber, odvoz a likvidácia odpadu","Odpad, zber odpadu, odvoz odpadu, likvidácia odpadu, odpadové hospodárstvo, komunálny odpad, likvidácia tuhého komunálneho odpadu, zber a odvoz separovaného odpadu","90511100-3 Zber tuhého komunálneho odpadu; 90500000-2 Služby súvisiace s likvidáciou odpadu a odpadom; 90511000-2 Služby na zber odpadu; 90512000-9 Služby na prepravu odpadu","Služba","","https://portal.eks.sk/SpravaKniznice/OpisneFormulareKniznice/VerejnyDetailOpisnehoFormularaKniznice/141209","0","0",
