"OpisnyFormularIdentifikator","OpisnyFormularStav","OpisnyFormularNazov","OpisnyFormularKlucoveSlova","OpisnyFormularCpv","OpisnyFormularDruh","OpisnyFormularKategoriaSluzieb","OpisnyFormularUrl","OpisnyFormularPocetVyhlasenychZakaziek","OpisnyFormularObchodovanaSumaBezDPH",
"OF-184088","Po karanténe","Vodoinštalačný materiál II","PPR, ventil, umývadlo","44411300-7 Umývadlá; 44400000-4 Rôzne montované výrobky a súvisiace diely; 44410000-7 Predmety do kúpeľní a kuchýň; 42131220-4 Prívodné ventily; 60000000-8 Dopravné služby (bez prepravy odpadu)","Tovar; Služba","","https://portal.eks.sk/SpravaKniznice/OpisneFormulareKniznice/VerejnyDetailOpisnehoFormularaKniznice/184088","1","0",
"OF-184317","Po karanténe","Multifunkčná farebná atramentová tlačiareň","atramentová tlačiareň, multifunkčná tlačiareň","30232150-0 Atramentové tlačiarne; 60000000-8 Dopravné služby (bez prepravy odpadu); 30232100-5 Tlačiarne a zapisovače","Tovar; Služba","","https://portal.eks.sk/SpravaKniznice/OpisneFormulareKniznice/VerejnyDetailOpisnehoFormularaKniznice/184317","1","0",
"OF-184306","Po karanténe","Kancelárske potreby","zakladač, rýchloviazač, pero, ceruzka, spony, lepidlo, záznamová kniha, atď.","30192000-1 Kancelárske potreby","Tovar","","https://portal.eks.sk/SpravaKniznice/OpisneFormulareKniznice/VerejnyDetailOpisnehoFormularaKniznice/184306","1","0",
"OF-184349","Po karanténe","Univerzálny kuchynský robot","robot, varenie, príprava jedla","39221000-7 Kuchynské vybavenie; 60000000-8 Dopravné služby (bez prepravy odpadu)","Tovar; Služba","","https://portal.eks.sk/SpravaKniznice/OpisneFormulareKniznice/VerejnyDetailOpisnehoFormularaKniznice/184349","1","0",
"OF-184149","Po karanténe","Kontinuálny hemodialyzačný prístroj","hemodialýza, hemodialyzačný prístroj","33181100-3 Hemodialyzačné prístroje; 60000000-8 Dopravné služby (bez prepravy odpadu)","Tovar; Služba","","https://portal.eks.sk/SpravaKniznice/OpisneFormulareKniznice/VerejnyDetailOpisnehoFormularaKniznice/184149","1","0",
"OF-184106","Po karanténe","Dodávanie čerstvého ovocia a zeleniny pre stravovacie zriadenie 2019 Mierovo","Ovocie, zelenina","03220000-9 Zelenina, ovocie a orechy; 03212100-1 Zemiaky; 03221100-7 Koreňová a hľuzová zelenina; 03221230-7 Papriky; 03221240-0 Paradajka; 03221260-6 Huby; 03221270-9 Uhorka; 03221310-2 Hlávkový šalát; 03221410-3 Kapusta; 03221420-6 Karfiol; 03221430-9 Brokolica; 03221440-2 Ružičkový kel; 03222111-4 Banány; 03222112-1 Ananás; 03222220-1 Pomaranče; 03222240-7 Mandarínky; 03222321-9 Jablká; 03222322-6 Hrušky; 03222331-2 Marhule; 03222332-9 Broskyne; 03222341-5 Stolové hrozno; 60000000-8 Dopravné služby (bez prepravy odpadu)","Tovar; Služba","","https://portal.eks.sk/SpravaKniznice/OpisneFormulareKniznice/VerejnyDetailOpisnehoFormularaKniznice/184106","1","1568,330",
"OF-184206","Po karanténe","Učebná pomôcka - Dentálna figurína pre nácvik RTG techník","figurína, výukový model, učebná pomôcka","39162200-7 Učebné pomôcky a zariadenia; 60000000-8 Dopravné služby (bez prepravy odpadu)","Tovar; Služba","","https://portal.eks.sk/SpravaKniznice/OpisneFormulareKniznice/VerejnyDetailOpisnehoFormularaKniznice/184206","1","0",
"OF-184192","Po karanténe","Tonery - originál","Tonery, náplne do tlačiarní, kopírky a multifunkčného zariadenia","30125100-2 Tonerové náplne; 60000000-8 Dopravné služby (bez prepravy odpadu)","Tovar; Služba","","https://portal.eks.sk/SpravaKniznice/OpisneFormulareKniznice/VerejnyDetailOpisnehoFormularaKniznice/184192","1","0",
"OF-184292","Po karanténe","1 spiatočná letenka z Viedne do Bruselu","letenka, poistenie storna leteniek","60410000-5 Pravidelné letecké dopravné služby","Služba","","https://portal.eks.sk/SpravaKniznice/OpisneFormulareKniznice/VerejnyDetailOpisnehoFormularaKniznice/184292","1","0",
"OF-184424","Po karanténe","Ostatné trvanlivé potraviny a cukrárenské výrobky","Bujóny, vývary, rastlinné šťavy, zeleninové extrakty, zmesové mäsové šťavy ","15891500-5 Bujóny; 15891600-6 Vývary; 15891610-9 Zmesi do vývarov; 15891000-0 Polievky a bujóny; 15893300-7 Zmesové mäsové šťavy/omáčky; 15871210-9 Sójová omáčka; 15892100-8 Rastlinné šťavy; 15892200-9 Zeleninové extrakty; 15871250-1 Horčica; 15890000-3 Rôzne potravinové výrobky a sušený tovar; 15870000-7 Koreniny a chuťové prísady; 15865000-9 Bylinkové prímesi; 15842300-5 Cukrovinky; 15842000-2 Čokoláda a cukrovinky; 15884000-8 Dojčenská výživa; 15897200-4 Výrobky v konzerve; 15235000-4 Konzervované ryby; 15321700-1 Zmesi nekoncentrovaných štiav; 15980000-1 Nealkoholické nápoje; 15861000-1 Káva; 15863000-5 Čaj","Tovar; Služba","","https://portal.eks.sk/SpravaKniznice/OpisneFormulareKniznice/VerejnyDetailOpisnehoFormularaKniznice/184424","1","0",
"OF-184006","Po karanténe","Kuchynské potreby pre ŠJ_147","krájač zeleniny, strúhač zeleniny, vymeniteľné disky","39221000-7 Kuchynské vybavenie; 39220000-0 Kuchynské zariadenie, domáce potreby a potreby pre domáce hospodárstvo a dodávky pre stravovacie zariadenia; 39314000-6 Priemyselné vybavenie kuchýň; 60000000-8 Dopravné služby (bez prepravy odpadu)","Tovar; Služba","","https://portal.eks.sk/SpravaKniznice/OpisneFormulareKniznice/VerejnyDetailOpisnehoFormularaKniznice/184006","1","0",
"OF-184381","Po karanténe","Elektrická požiarna signalizácia ","požiarna signalizácia, elektrická požiarna signalizácia","31625200-5 Požiarne poplašné systémy; 35111000-5 Protipožiarne zariadenia; 34942000-2 Signalizačné zariadenia","Tovar; Služba","","https://portal.eks.sk/SpravaKniznice/OpisneFormulareKniznice/VerejnyDetailOpisnehoFormularaKniznice/184381","1","0",
"OF-184124","Po karanténe","Konvektomat","konvektomat, dodávka a montáž","39312000-2 Zariadenia na prípravu jedál; 60000000-8 Dopravné služby (bez prepravy odpadu)","Tovar; Služba","","https://portal.eks.sk/SpravaKniznice/OpisneFormulareKniznice/VerejnyDetailOpisnehoFormularaKniznice/184124","1","0",
"OF-184038","Po karanténe","BasoFlowEx","diagnostický kit, imunológia","33141625-7 Diagnostické súpravy; 60000000-8 Dopravné služby (bez prepravy odpadu)","Tovar; Služba","","https://portal.eks.sk/SpravaKniznice/OpisneFormulareKniznice/VerejnyDetailOpisnehoFormularaKniznice/184038","1","0",
"OF-184181","Po karanténe","Kachle THORMA FILEX - H","kachle","39220000-0 Kuchynské zariadenie, domáce potreby a potreby pre domáce hospodárstvo a dodávky pre stravovacie zariadenia; 60000000-8 Dopravné služby (bez prepravy odpadu)","Tovar; Služba","","https://portal.eks.sk/SpravaKniznice/OpisneFormulareKniznice/VerejnyDetailOpisnehoFormularaKniznice/184181","1","0",
"OF-184399","Po karanténe","Náhradný diel na snehovú radlicu","snehová radlica, náhradný diel","34913000-0 Rôzne náhradné diely; 43313000-0 Snehové pluhy a snehové frézy; 60000000-8 Dopravné služby (bez prepravy odpadu)","Tovar; Služba","","https://portal.eks.sk/SpravaKniznice/OpisneFormulareKniznice/VerejnyDetailOpisnehoFormularaKniznice/184399","1","0",
"OF-179905","Po karanténe","Kancelárske potreby, pracovné diáre, plánovacie kalendáre , daňové tlačivá na rok 2019","kancelárske potreby, pracovné diáre, kalendáre, tlačivá ","22000000-0 Tlačené výrobky a príbuzné produkty; 30192000-1 Kancelárske potreby; 60000000-8 Dopravné služby (bez prepravy odpadu)","Tovar; Služba","","https://portal.eks.sk/SpravaKniznice/OpisneFormulareKniznice/VerejnyDetailOpisnehoFormularaKniznice/179905","1","0",
"OF-184167","Po karanténe","Chladnička s mrazničkou Gorenje RK 6192 AX","Chladnička s mrazničkou","39711110-3 Chladničky s mrazničkou; 60000000-8 Dopravné služby (bez prepravy odpadu)","Tovar; Služba","","https://portal.eks.sk/SpravaKniznice/OpisneFormulareKniznice/VerejnyDetailOpisnehoFormularaKniznice/184167","1","0",
"OF-184442","Po karanténe","Zemiaky","zemiaky konzumné, ","03212100-1 Zemiaky; 03200000-3 Obilniny, zemiaky, zelenina, ovocie a orechy; 03210000-6 Obilniny a zemiaky; 15310000-4 Zemiaky a zemiakové výrobky; 60000000-8 Dopravné služby (bez prepravy odpadu)","Tovar; Služba","","https://portal.eks.sk/SpravaKniznice/OpisneFormulareKniznice/VerejnyDetailOpisnehoFormularaKniznice/184442","1","0",
"OF-184482","Po karanténe","Storage server - diskové pole","Storage server - diskové pole","48820000-2 Servery","Tovar; Služba","","https://portal.eks.sk/SpravaKniznice/OpisneFormulareKniznice/VerejnyDetailOpisnehoFormularaKniznice/184482","0","0",
"OF-183248","Po karanténe","Oftalmologický operačný mikroskop","mikroskop","33000000-0 Zdravotnícke vybavenie, farmaceutický materiál a výrobky osobnej starostlivosti; 33100000-1 Zdravotnícke vybavenie; 33120000-7 Záznamové systémy a vyšetrovacie prístroje; 33124100-6 Diagnostické prístroje; 33124110-9 Diagnostické systémy; 60000000-8 Dopravné služby (bez prepravy odpadu)","Tovar; Služba","","https://portal.eks.sk/SpravaKniznice/OpisneFormulareKniznice/VerejnyDetailOpisnehoFormularaKniznice/183248","0","0",
"OF-184150","Po karanténe","Posteľná bielizeň - obliečky na vankúše a paplóny","Návlek na paplón, návlek na vankúš, obliečka, návlečka","39512000-4 Posteľná bielizeň; 60000000-8 Dopravné služby (bez prepravy odpadu)","Tovar; Služba","","https://portal.eks.sk/SpravaKniznice/OpisneFormulareKniznice/VerejnyDetailOpisnehoFormularaKniznice/184150","0","0",
"OF-184307","Po karanténe","Konzultačné služby k platforme SAS Viya","#SAS, SAS Viya, Konzultácie, štatistika, analytika, Viya","72000000-5 Služby informačných technológií: konzultácie, vývoj softvéru, internet a podpora; 60000000-8 Dopravné služby (bez prepravy odpadu)","Služba","","https://portal.eks.sk/SpravaKniznice/OpisneFormulareKniznice/VerejnyDetailOpisnehoFormularaKniznice/184307","0","0",
"OF-184263","Po karanténe","Obnova podpory licencií Microsoft","licencia, Microsoft, obnova","72250000-2 Služby týkajúce sa podpory systému; 60000000-8 Dopravné služby (bez prepravy odpadu)","Služba; Tovar","","https://portal.eks.sk/SpravaKniznice/OpisneFormulareKniznice/VerejnyDetailOpisnehoFormularaKniznice/184263","0","0",
"OF-184377","Po karanténe","Originálny toner - obj. č. 17/2018","tonery, náplne do tlačiarní","30125100-2 Tonerové náplne; 30192113-6 Atramentové náplne; 30125110-5 Toner do laserových tlačiarní/faxových prístrojov; 60000000-8 Dopravné služby (bez prepravy odpadu)","Tovar; Služba","","https://portal.eks.sk/SpravaKniznice/OpisneFormulareKniznice/VerejnyDetailOpisnehoFormularaKniznice/184377","0","0",
"OF-184195","Po karanténe","Toner - originál  HP 740 / ORO","originál toner, kazetová náplne","30125100-2 Tonerové náplne; 60000000-8 Dopravné služby (bez prepravy odpadu)","Tovar; Služba","","https://portal.eks.sk/SpravaKniznice/OpisneFormulareKniznice/VerejnyDetailOpisnehoFormularaKniznice/184195","0","0",
"OF-184278","Po karanténe","sterilizačný obalový materiál","obalový materiál, vrecká, rolky, sterilizačné vrecká","33198200-6 Papierové sterilizačné vrecká alebo odevy z papieroviny","Tovar; Služba","","https://portal.eks.sk/SpravaKniznice/OpisneFormulareKniznice/VerejnyDetailOpisnehoFormularaKniznice/184278","0","0",
"OF-184427","Po karanténe","Nákup ovocia a zeleniny","ovocie a zelenina","15300000-1 Ovocie, zelenina a súvisiace výrobky; 60000000-8 Dopravné služby (bez prepravy odpadu)","Tovar; Služba","","https://portal.eks.sk/SpravaKniznice/OpisneFormulareKniznice/VerejnyDetailOpisnehoFormularaKniznice/184427","0","0",
"OF-184146","Po karanténe","Tlač publikácie","tlač, tlačiarenske služby, tlač publikácie, výroba publikácie","79800000-2 Tlačiarenské a príbuzné služby; 79822000-2 Sadzba; 79971000-1 Knihárske služby a apretácia (dokončovanie); 60000000-8 Dopravné služby (bez prepravy odpadu)","Služba","","https://portal.eks.sk/SpravaKniznice/OpisneFormulareKniznice/VerejnyDetailOpisnehoFormularaKniznice/184146","0","0",
"OF-183909","Po karanténe","Nákup zariadení do ambulancie","zariadenie, ambulancia, dezinfektor, kabinet, endoskopia","33190000-8 Rôzne lekárske zariadenia a výrobky; 48100000-9 Softvérový balík pre konkrétne odvetvie; 60000000-8 Dopravné služby (bez prepravy odpadu)","Tovar; Služba","","https://portal.eks.sk/SpravaKniznice/OpisneFormulareKniznice/VerejnyDetailOpisnehoFormularaKniznice/183909","0","0",
"OF-184310","Po karanténe","Licencie pre tlačový SW a licencie CAL","nákup, tovar, licencia","48000000-8 Softvérové balíky a informačné systémy; 60000000-8 Dopravné služby (bez prepravy odpadu)","Tovar; Služba","","https://portal.eks.sk/SpravaKniznice/OpisneFormulareKniznice/VerejnyDetailOpisnehoFormularaKniznice/184310","0","0",
"OF-184327","Po karanténe","Plachta biela s pásikom - zábalová (v.18)","plachta biela, posteľná bielizeň","39512100-5 Plachty; 60000000-8 Dopravné služby (bez prepravy odpadu)","Tovar; Služba","","https://portal.eks.sk/SpravaKniznice/OpisneFormulareKniznice/VerejnyDetailOpisnehoFormularaKniznice/184327","0","0",
"OF-184127","Po karanténe","STOLIČKY, SEDAČKA","jedálenská stolička, dvojkreslo, trojkreslo","39113000-7 Rôzne sedadlá a stoličky; 60000000-8 Dopravné služby (bez prepravy odpadu)","Tovar; Služba","","https://portal.eks.sk/SpravaKniznice/OpisneFormulareKniznice/VerejnyDetailOpisnehoFormularaKniznice/184127","0","0",
"OF-184296","Po karanténe","Lieky ATC L04 - Imunosupresíva (infliximab)","Imunosupresíva, infliximab","33652300-8 Imunosupresívne činidlá; 60000000-8 Dopravné služby (bez prepravy odpadu)","Tovar; Služba","","https://portal.eks.sk/SpravaKniznice/OpisneFormulareKniznice/VerejnyDetailOpisnehoFormularaKniznice/184296","0","0",
"OF-184486","Po karanténe","Informačno-komunikačné technológie","tablet, dron, náhradné batérie","30213200-7 Tabletový počítač; 34711200-6 Bezpilotné lietadlá; 60000000-8 Dopravné služby (bez prepravy odpadu)","Tovar; Služba","","https://portal.eks.sk/SpravaKniznice/OpisneFormulareKniznice/VerejnyDetailOpisnehoFormularaKniznice/184486","0","0",
"OF-184403","Po karanténe","Mlieko a mliečne výrobky","Mlieko, mliečne výrobky,  jogurt, syr, maslo, tvaroh, bryndza, smotana","15511000-3 Mlieko; 15551000-5 Jogurt a ostatné fermentované mliečne výrobky; 15500000-3 Mliečne výrobky; 15550000-8 Mliečne výrobky rôznych druhov; 15551300-8 Jogurt; 15530000-2 Maslo; 15542200-1 Mäkký syr; 15544000-3 Tvrdý syr; 15545000-0 Syrové nátierky; 15540000-5 Syrárske výrobky; 15512000-0 Smotana; 60000000-8 Dopravné služby (bez prepravy odpadu)","Tovar; Služba","","https://portal.eks.sk/SpravaKniznice/OpisneFormulareKniznice/VerejnyDetailOpisnehoFormularaKniznice/184403","0","0",
"OF-184318","Po karanténe","Mlieko a mliečne výrobky","Mlieko, smotana, jogurty, puding, mliečna ryža, tvaroh, bryndza, syry, tatárska omáčka, majonéza","15500000-3 Mliečne výrobky; 15511000-3 Mlieko; 15512000-0 Smotana; 15551300-8 Jogurt; 15551000-5 Jogurt a ostatné fermentované mliečne výrobky; 15540000-5 Syrárske výrobky; 15550000-8 Mliečne výrobky rôznych druhov; 15871273-8 Majonéza","Tovar; Služba","","https://portal.eks.sk/SpravaKniznice/OpisneFormulareKniznice/VerejnyDetailOpisnehoFormularaKniznice/184318","0","0",
"OF-184235","Po karanténe","Osobné a ochranné pracovné prostriedky","Nohavice lekárske , plášť lekársky , košeľa s výstrihom ""V"", tričko s výstrihom do ""V"" krátky rukáv,  tričko s okrúhlym výstrihom - dlhý rukáv, vesta flísová, mikina flísová, pracovná obuv, tričko s golierom - zapínanie na gombíky, nohavice reflexné, košeľa reflexná, tričko, mikina wind stoper, vetrovka reflexná, vesta reflexná, monterková blúza, monterkové nohavice, pracovná bunda,  ochranné rukavice, pracovné rukavice, ponožky, čiapka, krátke nohavice","18100000-0 Pracovné odevy, špeciálne pracovné odevy a doplnky; 18200000-1 Zvršky; 18300000-2 Odevy; 18400000-3 Špeciálne odevy a doplnky; 18800000-7 Obuv; 35113440-5 Reflexné vesty; 60000000-8 Dopravné služby (bez prepravy odpadu)","Tovar; Služba","","https://portal.eks.sk/SpravaKniznice/OpisneFormulareKniznice/VerejnyDetailOpisnehoFormularaKniznice/184235","0","0",
"OF-184269","Po karanténe","Stravné poukážky","stravné poukážky, dodanie stravných poukážok","30199770-8 Stravné poukážky; 60000000-8 Dopravné služby (bez prepravy odpadu); 55520000-1 Služby hromadného stravovania","Tovar; Služba","","https://portal.eks.sk/SpravaKniznice/OpisneFormulareKniznice/VerejnyDetailOpisnehoFormularaKniznice/184269","0","0",
"OF-184352","Po karanténe","Čerstvé ovocie a zelenina","banány, broskyne, jablká, kapusta, kiwi, marhule, petržlen, pomaranče, mrkva, hrušky","03220000-9 Zelenina, ovocie a orechy; 03222111-4 Banány; 03222332-9 Broskyne; 03222340-8 Hrozno; 03222321-9 Jablká; 03221410-3 Kapusta; 03222240-7 Mandarínky; 03222331-2 Marhule; 03221112-4 Mrkva; 15872100-2 Paprika; 15331130-7 Fazuľa, hrach, paprika, paradajky a iná zelenina; 03222220-1 Pomaranče; 03221310-2 Hlávkový šalát; 60000000-8 Dopravné služby (bez prepravy odpadu)","Tovar; Služba","","https://portal.eks.sk/SpravaKniznice/OpisneFormulareKniznice/VerejnyDetailOpisnehoFormularaKniznice/184352","0","0",
"OF-184418","Po karanténe","Dodávka elektrickej energie ","Elektrická energia, elektrina","09310000-5 Elektrická energia; 65300000-6 Rozvod elektriny a súvisiace služby","Tovar; Služba","","https://portal.eks.sk/SpravaKniznice/OpisneFormulareKniznice/VerejnyDetailOpisnehoFormularaKniznice/184418","0","0",
"OF-184084","Po karanténe","Posteľné detské obliečky, uteráky  ","Obliečky na detské paplóny a vankúše, bavlna, uteráky","39512000-4 Posteľná bielizeň; 60000000-8 Dopravné služby (bez prepravy odpadu)","Tovar; Služba","","https://portal.eks.sk/SpravaKniznice/OpisneFormulareKniznice/VerejnyDetailOpisnehoFormularaKniznice/184084","0","0",
"OF-184422","Po karanténe","Nákup posteľnej bielizne a uterákov (1).","posteľná bielizeň, uteráky, osúšky.","39512000-4 Posteľná bielizeň; 39514100-9 Uteráky; 60000000-8 Dopravné služby (bez prepravy odpadu)","Tovar; Služba","","https://portal.eks.sk/SpravaKniznice/OpisneFormulareKniznice/VerejnyDetailOpisnehoFormularaKniznice/184422","0","0",
"OF-184229","Po karanténe","Vývary a koreniny","Vývary, korenia, kečup, čaj, horčica, ocot","15891600-6 Vývary; 15870000-7 Koreniny a chuťové prísady; 60000000-8 Dopravné služby (bez prepravy odpadu); 15864100-3 Porciovaný čaj; 15871000-4 Ocot; omáčky; miešané korenisté zmesi; horčičná múčka a prášok; pripravená horčica; 15871230-5 Paradajkový kečup; 15871250-1 Horčica","Tovar; Služba","","https://portal.eks.sk/SpravaKniznice/OpisneFormulareKniznice/VerejnyDetailOpisnehoFormularaKniznice/184229","1","0",
"OF-184129","Po karanténe","Diagnostický test","diagnostický test, konfirmačné vyšetrenie","33694000-1 Diagnostické činidlá; 60000000-8 Dopravné služby (bez prepravy odpadu)","Tovar; Služba","","https://portal.eks.sk/SpravaKniznice/OpisneFormulareKniznice/VerejnyDetailOpisnehoFormularaKniznice/184129","1","0",
"OF-184361","Po karanténe","Spracované zemiaky","Spracované zemiaky čistené","15313000-5 Spracované zemiaky; 60000000-8 Dopravné služby (bez prepravy odpadu)","Tovar; Služba","","https://portal.eks.sk/SpravaKniznice/OpisneFormulareKniznice/VerejnyDetailOpisnehoFormularaKniznice/184361","1","0",
"OF-184112","Po karanténe","Hodinky","Náramkové hodinky, hodinky, hodinárske výrobky","18522000-4 Náramkové hodinky; 18521000-7 Hodinky; 18520000-0 Hodinkárske výrobky; 31710000-6 Elektronické zariadenia; 60000000-8 Dopravné služby (bez prepravy odpadu)","Tovar; Služba","","https://portal.eks.sk/SpravaKniznice/OpisneFormulareKniznice/VerejnyDetailOpisnehoFormularaKniznice/184112","1","0",
"OF-184161","Po karanténe","GORENJE RK 6192 AW","Chladnička s mrazničkou","39711110-3 Chladničky s mrazničkou; 60000000-8 Dopravné služby (bez prepravy odpadu)","Tovar; Služba","","https://portal.eks.sk/SpravaKniznice/OpisneFormulareKniznice/VerejnyDetailOpisnehoFormularaKniznice/184161","1","0",
"OF-184244","Po karanténe","Kuchynská linka","linka, kuchyňa, pracovná doska","39141000-2 Kuchynský nábytok a vybavenie; 39141400-6 Vstavané kuchyne; 60000000-8 Dopravné služby (bez prepravy odpadu)","Tovar; Služba","","https://portal.eks.sk/SpravaKniznice/OpisneFormulareKniznice/VerejnyDetailOpisnehoFormularaKniznice/184244","1","0",
"OF-184144","Po karanténe","Informačný systém pre poskytovateľa sociálnych služieb ( prenájom formou licencie na 6 mesiacov )","informačný systém, software, sociálne služby, stravovanie, dochádzka ","48000000-8 Softvérové balíky a informačné systémy; 48810000-9 Informačné systémy; 48814100-8 Ošetrovateľské informačné systémy; 72222300-0 Služby informačných technológií; 72263000-6 Implementácia softvéru; 60000000-8 Dopravné služby (bez prepravy odpadu); 48800000-6 Informačné systémy a servery","Tovar; Služba","","https://portal.eks.sk/SpravaKniznice/OpisneFormulareKniznice/VerejnyDetailOpisnehoFormularaKniznice/184144","1","0",
"OF-184193","Po karanténe","Kartotečná skrinka kovová- 4 zásuvková","Registračná skrinka, listkovnica kovová","39132200-8 Kartotékové skrine; 60000000-8 Dopravné služby (bez prepravy odpadu)","Tovar; Služba","","https://portal.eks.sk/SpravaKniznice/OpisneFormulareKniznice/VerejnyDetailOpisnehoFormularaKniznice/184193","1","0",
"OF-184293","Po karanténe","Biela technika","chladnička, mraznička, mikrovlnná rúra","39700000-9 Spotrebiče pre domácnosť; 60000000-8 Dopravné služby (bez prepravy odpadu)","Tovar; Služba","","https://portal.eks.sk/SpravaKniznice/OpisneFormulareKniznice/VerejnyDetailOpisnehoFormularaKniznice/184293","1","0",
"OF-184276","Po karanténe","Papierové stravné poukážky","stravné poukážky, stravné lístky, dodanie stravných lístkov  ","30199770-8 Stravné poukážky; 60000000-8 Dopravné služby (bez prepravy odpadu)","Tovar; Služba","","https://portal.eks.sk/SpravaKniznice/OpisneFormulareKniznice/VerejnyDetailOpisnehoFormularaKniznice/184276","1","0",
"OF-184480","Po karanténe","Stavebný materiál VI.","keramický obklad, sieťka, flexibilné lepidlo, škárovacia hmota, dvere obložkové, pórobetón","44111900-0 Keramické dlaždice; 44111200-3 Cement; 44221200-7 Dvere; 60000000-8 Dopravné služby (bez prepravy odpadu)","Tovar; Služba","","https://portal.eks.sk/SpravaKniznice/OpisneFormulareKniznice/VerejnyDetailOpisnehoFormularaKniznice/184480","0","0",
"OF-142081","Po karanténe","Nákup spotrebného materiálu pre chromatografiu","spotrebný materiál, chromatografia, injekčné striekačky","33140000-3 Zdravotnícky spotrebný materiál; 33141310-6 Injekčné striekačky","Tovar; Služba","","https://portal.eks.sk/SpravaKniznice/OpisneFormulareKniznice/VerejnyDetailOpisnehoFormularaKniznice/142081","0","0",
"OF-183725","Po karanténe","Trvanlivé potraviny a koreniny","trvanlivé potraviny, koreniny, chuťové prísady","15842000-2 Čokoláda a cukrovinky; 15870000-7 Koreniny a chuťové prísady; 15891500-5 Bujóny; 15891410-7 Polievkové zmesi; 60000000-8 Dopravné služby (bez prepravy odpadu)","Tovar; Služba","","https://portal.eks.sk/SpravaKniznice/OpisneFormulareKniznice/VerejnyDetailOpisnehoFormularaKniznice/183725","0","0",
"OF-184412","Po karanténe","Mydriaticko-nemydriatická fundus kamera","oftalmologické prístroje, fundus kamera,optický uhol, režim snímania, zoom","33122000-1 Oftalmologické prístroje; 51410000-9 Inštalácia lekárskych zariadení; 60000000-8 Dopravné služby (bez prepravy odpadu)","Tovar; Služba","","https://portal.eks.sk/SpravaKniznice/OpisneFormulareKniznice/VerejnyDetailOpisnehoFormularaKniznice/184412","0","0",
"OF-184343","Po karanténe","Trvanlivé potraviny a koreniny","trvanlivé potraviny, koreniny, chuťové prísady, cukrovinky, výrobky v konzerve","15842000-2 Čokoláda a cukrovinky; 15870000-7 Koreniny a chuťové prísady; 15891500-5 Bujóny; 15897200-4 Výrobky v konzerve; 15240000-2 Ryby v konzerve a inak pripravené alebo konzervované ryby; 60000000-8 Dopravné služby (bez prepravy odpadu)","Tovar; Služba","","https://portal.eks.sk/SpravaKniznice/OpisneFormulareKniznice/VerejnyDetailOpisnehoFormularaKniznice/184343","0","0",
"OF-184294","Po karanténe","Zemiaky čerstvé","Zemiaky, Zelenina","03212100-1 Zemiaky; 60000000-8 Dopravné služby (bez prepravy odpadu)","Tovar; Služba","","https://portal.eks.sk/SpravaKniznice/OpisneFormulareKniznice/VerejnyDetailOpisnehoFormularaKniznice/184294","0","0",
"OF-184126","Po karanténe","Elektrolyty ","Elektrolyty, Infúzne roztoky","33692100-8 Infúzne roztoky; 60000000-8 Dopravné služby (bez prepravy odpadu)","Tovar; Služba","","https://portal.eks.sk/SpravaKniznice/OpisneFormulareKniznice/VerejnyDetailOpisnehoFormularaKniznice/184126","0","0",
"OF-184312","Po karanténe","Dodávka originálnych tonerov","tonery pre HP Laser Jet Pro 400M451 mw, Samsung Xpress M2070W, HP LJ 1018-20, HP Laser Jet M12a.","30125100-2 Tonerové náplne; 60000000-8 Dopravné služby (bez prepravy odpadu)","Tovar; Služba","","https://portal.eks.sk/SpravaKniznice/OpisneFormulareKniznice/VerejnyDetailOpisnehoFormularaKniznice/184312","0","0",
