"IdentifikatorZakazky","IdentifikatorZmluvy","ObjednavatelObchodneMeno","ObjednavatelICO","ObjednavatelStat","ObjednavatelObec","ObjednavatelPSC","ObjednavatelUlica","DodavatelObchodneMeno","DodavatelICO","DodavatelStat","DodavatelObec","DodavatelPSC","DodavatelUlica","ZmluvnyVztah","OpisnyFormularNazov","OpisnyFormularCpv","OpisnyFormularDruh","OpisnyFormularKategoriaSluzieb","MiestoPlneniaStat","MiestoPlneniaKraj","MiestoPlneniaOkres","MiestoPlneniaObec","MiestoPlneniaUlica","LehotaPlneniaOd","LehotaPlneniaDo","LehotaPlneniaPresne","MnozstvoJednotka","MnozstvoHodnota","CenaBezDPH","CenaSadzbaDPH","CenaVrataneDPH","Uspora","DatumZazmluvnenia",
"Z201829007","Z201829007_Z","Univerzita Komenského v Bratislave","00397865","Slovenská republika","Bratislava","81499","Šafárikovo nám. 6","BIOTECH s.r.o.","35768444","Slovenská republika","Bratislava","84105","Kresánkova 12","Kúpna zmluva","Médiá pre kultiváciu neuronálnych buniek a špičky na pipety","19520000-7 Plastové výrobky;24000000-4 Chemické výrobky;24900000-3 Čisté a rôzne chemické výrobky;24950000-8 Špecializované chemické výrobky;24960000-1 Rôzne chemické výrobky;60000000-8 Dopravné služby (bez prepravy odpadu)","Tovar;Služba","","Slovenská republika","Žilinský","Martin","Martin","Jesseniova lekárska fakulta v Martine; Ústav patologickej fyziológie; 1.poschodie Malá Hora 4C; 03601 Martin","10.8.2018 9:00:00","10.8.2018 14:00:00","","Kompletný predmet zákazky","1,0000","1575,000","","","0,000","12.7.2018 14:03:59",
"Z201829009","Z201829009_Z","Univerzita Komenského v Bratislave","00397865","Slovenská republika","Bratislava","81499","Šafárikovo nám. 6","BioVendor Slovakia s. r. o.","46265082","Slovenská republika","Bratislava-Petržalka","85101","Kopčianska 80","Kúpna zmluva","Sada aplikačných masiek a závažie na stanovenie multimérov VonWillebrandovho faktora","33694000-1 Diagnostické činidlá;33696500-0 Laboratórne činidlá;60000000-8 Dopravné služby (bez prepravy odpadu)","Tovar;Služba","","Slovenská republika","Žilinský","Martin","Martin","Klinika hematológie a transfuziológie JLF UK a UNM, Kollárova 2, 036 59 Martin, Slovensko","19.7.2018 9:00:00","2.8.2018 14:00:00","","Kompletný predmet zákazky","1,0000","480,000","20,000","576,000","0,000","12.7.2018 14:05:59",
"Z201829010","Z201829010_Z","Univerzita Komenského v Bratislave","00397865","Slovenská republika","Bratislava","81499","Šafárikovo nám. 6","BioVendor Slovakia s. r. o.","46265082","Slovenská republika","Bratislava-Petržalka","85101","Kopčianska 80","Kúpna zmluva","Elektroforetický kit na stanovenie multimérov VonWillebrandovho faktora","33694000-1 Diagnostické činidlá;33696500-0 Laboratórne činidlá;60000000-8 Dopravné služby (bez prepravy odpadu)","Tovar;Služba","","Slovenská republika","Žilinský","Martin","Martin","Klinika hematológie a transfuziológie JLF UK a UNM, Kollárova 2, 036 59 Martin, Slovensko","19.7.2018 9:00:00","2.8.2018 14:00:00","","Kompletný predmet zákazky","1,0000","2100,000","","","0,000","12.7.2018 14:10:00",
"Z201829012","Z201829012_Z","Bábkové divadlo v Košiciach","31297811","Slovenská republika","Košice","04001","Tajovského 4","Ground Transportation Logistics Management s.r.o.","47452951","Slovenská republika","Bratislava","83206","Karpatske namestie 10","Zmluva o poskytovaní služieb","Medzinárodná autobusová doprava","60140000-1 Nepravidelná osobná doprava","Služba","","Slovenská republika","Košický","Košice","Košice","Tajovského 4","25.8.2018 8:00:00","28.8.2018 4:00:00","","ks","1,0000","1916,670","20,000","2300,000","124,000","13.7.2018 12:38:00",
"Z201829013","Z201829013_Z","Univerzita Komenského v Bratislave","00397865","Slovenská republika","Bratislava","81499","Šafárikovo nám. 6","SARSTEDT spol. s r.o.","31359825","Slovenská republika","Bratislava","85101","Údernícka 11","Kúpna zmluva","laboratórne plasty","38437000-7 Laboratórne pipety a príslušenstvo;60000000-8 Dopravné služby (bez prepravy odpadu)","Tovar;Služba","","Slovenská republika","Bratislavský","Bratislava","Bratislava","V. Interná klinika LF UK a UNB,  priestory Vedeckého parku UK Ilkovičova 8, 841 04 Bratislava","19.7.2018 9:00:00","26.7.2018 14:00:00","","Kompletný predmet zákazky","1,0000","990,000","","","1110,000","12.7.2018 14:31:59",
"Z201829011","Z201829011_Z","Ústav na výkon väzby a Ústav na výkon trestu odňatia slobody","00738409","Slovenská republika","Prešov","08113","Kpt. Nálepku 1","C-TRADE, spol. s r.o.","36597180","Slovenská republika","Košice","04013","Budapeštianska 2452/48","Kúpna zmluva","Náterové, farby, laky a tmely, riedidlá","44800000-8 Náterové farby, laky a tmely;44832200-3 Riedidlá;60000000-8 Dopravné služby (bez prepravy odpadu)","Tovar;Služba","","Slovenská republika","Prešovský","Prešov","Prešov","Pionierska 31","23.7.2018 13:24:00","27.7.2018 13:24:00","","Podľa technickej špecifikácie predmetu zákazky","1,0000","","","1749,000","0,000","12.7.2018 14:38:00",
"Z201829014","Z201829014_Z","Univerzita Komenského v Bratislave","00397865","Slovenská republika","Bratislava","81499","Šafárikovo nám. 6","Scintila, s.r.o.","25557858","Česká republika","Jihlava","586 01","Úvoz 173/18","Kúpna zmluva","ELISA Kity","33694000-1 Diagnostické činidlá;60000000-8 Dopravné služby (bez prepravy odpadu)","Tovar;Služba","","Slovenská republika","Bratislavský","Bratislava","Bratislava","Imunologický ústav, Špitálska 24, 811 08 Bratislava","18.7.2018 9:00:00","20.7.2018 14:00:00","","Kompletný predmet zákazky","1,0000","1250,000","10,000","1375,000","600,000","12.7.2018 14:46:00",
"Z201829016","Z201829016_Z","Univerzita Komenského v Bratislave","00397865","Slovenská republika","Bratislava","81499","Šafárikovo nám. 6","DYNEX Servis spol. s r.o.","36030848","Slovenská republika","Banská Bystrica","97404","Nové Kalište 17","Kúpna zmluva","kity","33694000-1 Diagnostické činidlá;60000000-8 Dopravné služby (bez prepravy odpadu)","Tovar;Služba","","Slovenská republika","Bratislavský","Bratislava","Bratislava","Fyziologický ústav, miestnosť 19, Sasinkova 2, 813 72 Bratislava","19.7.2018 9:00:00","26.7.2018 14:00:00","","Kompletný predmet zákazky","1,0000","1166,160","","","0,000","12.7.2018 14:23:59",
"Z201829017","Z201829017_Z","Slovenské národné múzeum","00164721","Slovenská republika","Bratislava","81006","Vajanského nábrežie 2","NIBIA s.r.o.","45408581","Slovenská republika","Partizánske","95801","Nitrianska 99","Kúpna zmluva","pracovný odev a obuv","18110000-3 Pracovné odevy;18830000-6 Ochranná obuv;60000000-8 Dopravné služby (bez prepravy odpadu)","Tovar;Služba","","Slovenská republika","Bratislavský","Pezinok","Častá","Hrad Červený Kameň 1","","","25.7.2018 15:00:00","ks","20,0000","529,000","20,000","634,800","1,000","12.7.2018 15:38:00",
"Z201829018","Z201829018_Z","Slovenské národné múzeum","00164721","Slovenská republika","Bratislava","81006","Vajanského nábrežie 2","IMAO electric, s. r. o.","44007841","Slovenská republika","Považská Bystrica","017 01","Mládežnícka 108","Kúpna zmluva","žiarovky ","31512100-9 Halogénové žiarovky, lineárne;31531000-7 Žiarovky;31531100-8 Elektrické trubice;60000000-8 Dopravné služby (bez prepravy odpadu)","Tovar;Služba","","Slovenská republika","Bratislavský","Pezinok","Častá","Hrad Červený Kameň 1","","","25.7.2018 15:00:00","ks","350,0000","165,000","20,000","198,000","85,000","12.7.2018 15:38:00",
"Z201829020","Z201829020_Z","Mesto Zlaté Moravce","00308676","Slovenská republika","Zlaté Moravce","95301","1.mája 2","ba kieho, s.r.o. ","36048101","Slovenská republika","Zvolen","96001","ul. A. Hlinku 2311/16","Kúpna zmluva","Obstaranie záhradných kompostérov pre domácnosti","39234000-1 Škatule na kompost;60000000-8 Dopravné služby (bez prepravy odpadu)","Tovar;Služba","","Slovenská republika","Nitriansky","","","","30.8.2018 13:56:00","28.9.2018 12:00:00","","ks","2042,0000","135000,000","20,000","162000,000","6000,000","17.7.2018 10:38:00",
"Z201829019","Z201829019_Z","Ústav na výkon väzby a Ústav na výkon trestu odňatia slobody","00738409","Slovenská republika","Prešov","08113","Kpt. Nálepku 1","Kovsmol, s.r.o.","36501921","Slovenská republika","Prešov","08006","Družstevná 34","Kúpna zmluva","Železný tovar","44316000-8 Železiarsky tovar;60000000-8 Dopravné služby (bez prepravy odpadu)","Tovar;Služba","","Slovenská republika","Prešovský","Prešov","Prešov","Pionierska 31","16.7.2018 13:42:00","27.7.2018 13:44:00","","podľa technickej špecifikácie predmetu zákazky","1,0000","","","6500,000","0,000","12.7.2018 15:08:00",
"Z201829022","Z201829022_Z","Technické a záhradnícke služby mesta Michalovce","186490","Slovenská republika","Michalovce","07101","Partizánska 55","ContiTrade Slovakia s.r.o.","36336556","Slovenská republika","Púchov","02001","Terézie Vansovej 1054","Kúpna zmluva","Pneumatika 315/70R22,5 a jej prezutie ","34352100-0 Pneumatiky pre nákladné vozidlá;50116500-6 Opravy pneumatík vrátane montáže a vyvažovania;60000000-8 Dopravné služby (bez prepravy odpadu)","Tovar;Služba","","Slovenská republika","Košický","Michalovce","Michalovce","Partizánska 55","16.7.2018 8:00:00","18.7.2018 14:00:00","","ks","8,0000","2640,000","20,000","3168,000","0,000","12.7.2018 14:53:59",
"Z201829023","Z201829023_Z","Spišská katolícka charita","35514221","Slovenská republika","Spišská Nová Ves","05201","Slovenská 1765/30","JURIGA spol. s r. o.","31344194","Slovenská republika","Bratislava","85101","Gercenova 3","Kúpna zmluva","Dodávka originálnych a alternatívnych tonerov do tlačiarní","30125100-2 Tonerové náplne;60000000-8 Dopravné služby (bez prepravy odpadu)","Tovar;Služba","","Slovenská republika","Košický","Spišská Nová Ves","Spišské Vlachy","Dom Charitas sv. Damiána de Veuster, Požiarnická 49","17.7.2018 9:00:00","20.7.2018 12:00:00","","ks","14,0000","143,320","20,000","171,990","28,000","13.7.2018 11:03:59",
"Z201829027","Z201829027_Z","Univerzita Konštantína Filozofa v Nitre","00157716","Slovenská republika","Nitra","94974","Trieda Andreja Hlinku 1","KASON, s.r.o.","51662787","Slovenská republika","Nitra","94905","Dvorčianska 815    ","Kúpna zmluva","Atramentová tlačiareň, farebné atramentové náplne","30125100-2 Tonerové náplne;30232150-0 Atramentové tlačiarne","Tovar","","Slovenská republika","Nitriansky","Nitra","Nitra","Štefánikova ul.č.67","17.7.2018 9:00:00","10.8.2018 15:00:00","","súbor","1,0000","280,880","20,000","337,060","0,010","13.7.2018 9:38:00",
"Z201828428","Z201828428_Z","Štatistický úrad Slovenskej republiky","00166197","Slovenská republika","Bratislava","82467","Miletičova 3","KASON, s.r.o.","51662787","Slovenská republika","Nitra","94905","Dvorčianska 815    ","Kúpna zmluva","Osobné počítače s príslušenstvom a monitory","30213000-5 Osobné počítače;30213300-8 Stolový počítač;30230000-0 Zariadenia súvisiace s počítačmi;30231000-7 Počítačové monitory a konzoly;60000000-8 Dopravné služby (bez prepravy odpadu)","Tovar;Služba","","Slovenská republika","Bratislavský","Bratislava II","Bratislava - mestská časť Ružinov","Miletičova 3","18.7.2018 9:00:00","24.7.2018 13:00:00","","položka","5,0000","15491,670","20,000","18590,000","645,040","12.7.2018 15:56:00",
"Z201829031","Z201829031_Z","Domov pre seniorov","00691798","Slovenská republika","Stará Ľubovňa","06401","Mierová 88","PC SEMA, s.r.o.","36426041","Slovenská republika","Žilina","01001","Bôrická cesta 103","Rámcová dohoda","Originálne tonery","22610000-9 Tlačiarenské farby, atramenty;60000000-8 Dopravné služby (bez prepravy odpadu)","Tovar;Služba","","Slovenská republika","Prešovský","Stará Ľubovňa","Stará Ľubovňa","Mierová 88","","","","ks","227,0000","13100,000","20,000","15720,000","7116,000","13.7.2018 16:00:00",
"Z201827359","Z201827359_Z","Národný onkologický ústav","00165336","Slovenská republika","Bratislava","83110","Klenová 1","MABONEX SLOVAKIA spol. s r.o. ","31428819","Slovenská republika","Piešťany","92101","Krajinská cesta 3","Rámcová dohoda","Mrazená zelenina a mrazené ryby","15220000-6 Mrazené ryby, rybie filé a ostatné rybie mäso;15331170-9 Mrazená zelenina;60000000-8 Dopravné služby (bez prepravy odpadu)","Tovar;Služba","","Slovenská republika","Bratislavský","Bratislava III","Bratislava - mestská časť Nové Mesto","Klenová č. 1","","","","kg","2720,0000","4800,000","20,000","5760,000","200,000","13.7.2018 8:42:00",
"Z201829101","Z201829101_Z","Fakultná nemocnica s poliklinikou J.A.Reimana Prešov","00610577","Slovenská republika","Prešov","08181","Hollého 14","TATRAPEKO, a.s.","36455938","Slovenská republika","Liptovský Mikuláš","031 01","1. mája 1919","Rámcová dohoda","Pekárske výrobky","15811000-6 Pekársky tovar;15811100-7 Chlieb;15811200-8 Rožky;15812100-4 Pečivo;15812120-0 Koláče;15812122-4 Sladké koláče;60000000-8 Dopravné služby (bez prepravy odpadu)","Tovar;Služba","","Slovenská republika","Prešovský","Prešov","Prešov","Hollého 14","","","","ks, bal.","454110,0000","58412,300","20,000","70094,760","0,000","13.7.2018 11:07:59",
"Z201829098","Z201829098_Z","Prešovský samosprávny kraj","37870475","Slovenská republika","Prešov","08001","Námestie mieru 2","Marek Špeťko - IMEX","41648242","Slovenská republika","Nitra","94901","Bulharská 1256/24","Kúpna zmluva","Čistiace potreby a hygienické potreby","39830000-9 Čistiace výrobky;60000000-8 Dopravné služby (bez prepravy odpadu)","Tovar;Služba","","Slovenská republika","Prešovský","Prešov","Prešov","Námestie mieru 2","17.7.2018 8:30:00","18.7.2018 13:30:00","","súbor","1,0000","1708,330","20,000","2050,000","1332,000","13.7.2018 9:26:00",
"Z201829090","Z201829090_Z","Psychiatrická nemocnica Philippa Pinela Pezinok","30801397","Slovenská republika","Pezinok","90218","Malacká cesta 63","CLEAN TONERY, s.r.o.","35891866","Slovenská republika","Pezinok","90201","Za Hradbami 27","Kúpna zmluva","Tonery do laserových tlačiarní a kopírovacích strojov","30125110-5 Toner do laserových tlačiarní/faxových prístrojov;60000000-8 Dopravné služby (bez prepravy odpadu);60112000-6 Služby verejnej cestnej dopravy","Tovar;Služba","","Slovenská republika","Bratislavský","Pezinok","Pezinok","Malacká cesta č. 63","16.7.2018 9:00:00","18.7.2018 13:00:00","","celok","1,0000","540,800","20,000","648,960","0,000","13.7.2018 9:38:01",
"Z201829104","Z201829104_Z","Výskumný ústav vodného hospodárstva","00156850","Slovenská republika","Bratislava","81249","Nábr. arm. gen. L. Svobodu 5","CENTRALCHEM, s.r.o. ","31625444","Slovenská republika","Banská Bystrica","97401","Cementárenská cesta 16","Kúpna zmluva","Chemikálie","24300000-7 Základné anorganické a organické chemikálie;24900000-3 Čisté a rôzne chemické výrobky;60000000-8 Dopravné služby (bez prepravy odpadu)","Tovar;Služba","","Slovenská republika","Bratislavský","Bratislava I","Bratislava - mestská časť Staré Mesto","Nábr. arm. gen. L. Svobodu 5, ","19.7.2018 8:00:00","17.8.2018 14:00:00","","celý rozsah špecifikácie","1,0000","524,000","","","0,000","16.7.2018 11:37:59",
"Z201829106","Z201829106_Z","Nemocnica s poliklinikou Považská Bystrica","00610411","Slovenská republika","Považská Bystrica","01726","Nemocničná 986","Perfect Distribution a. s. - organizačná zložka","47719150","Slovenská republika","Kočovce","91631","Kočovce 244","Kúpna zmluva","Nádoby na medicínsky (infekčný) odpad","33141123-8 Nádoby na ostré predmety;60000000-8 Dopravné služby (bez prepravy odpadu)","Tovar;Služba","","Slovenská republika","Trenčiansky","Považská Bystrica","Považská Bystrica","Nemocničná 986","","","27.7.2018 14:00:00","ks","260,0000","475,000","20,000","570,000","17,000","13.7.2018 9:38:01",
"Z201828685","Z201828685_Z","Ministerstvo obrany Slovenskej republiky","30845572","Slovenská republika","Bratislava","83247","Kutuzovova 8","TEMPEST a.s.","31326650","Slovenská republika","Bratislava","82104","Galvaniho 17/B","Zmluva o poskytovaní služieb","Oprava CallManager-u výmenou","31440000-2 Batérie;50334120-2 Zvyšovanie parametrov telefónnych spínacích zariadení;60000000-8 Dopravné služby (bez prepravy odpadu)","Služba;Tovar","","Slovenská republika","Žilinský","Ružomberok","Ružomberok","Zarevúca 2","20.7.2018 11:16:00","31.12.2018 11:16:00","","ks","1,0000","20560,000","20,000","24672,000","0,000","13.7.2018 12:38:01",
"Z201828480","Z201828480_Z","Ministerstvo obrany Slovenskej republiky","30845572","Slovenská republika","Bratislava","83247","Kutuzovova 8","Applipower, s.r.o.","44999631","Slovenská republika","Žilina","01001","Bytčická 2","Kúpna zmluva","Oprava záložného zdroja napájania výmenou","31154000-0 Zdroje nepretržitého/stáleho napájania;51112100-1 Inštalácia zariadení na rozvod elektriny;60000000-8 Dopravné služby (bez prepravy odpadu)","Služba;Tovar","","Slovenská republika","Žilinský","Ružomberok","Ružomberok","Zarevúca 2","20.7.2018 12:00:00","31.12.2018 12:00:00","","ks","1,0000","2791,670","20,000","3350,000","20143,600","13.7.2018 14:02:00",
"Z201829108","Z201829108_Z","Špecializovaný liečebný ústav Marína, štátny podnik","00165476","Slovenská republika","Kováčová","96237","Sládkovičova 311/3","Ing. Iveta Janíková","34559671","Slovenská republika","Bratislava","82108","Palkovičova 245/15","Kúpna zmluva","Vrecia na odpad, handry na čistenie, toaletný papier, servítky, čistiace prostriedky","19640000-4 Polyetylénový odpad a odpadkové vrecká a vaky;24455000-8 Dezinfekčné prostriedky;33761000-2 Toaletný papier;33763000-6 Papierové uteráky na ruky;33764000-3 Papierové servítky;39525800-6 Handry na čistenie;39800000-0 Čistiace a leštiace výrobky;60000000-8 Dopravné služby (bez prepravy odpadu)","Tovar;Služba","","Slovenská republika","Banskobystrický","Zvolen","Kováčová","Sládkovičova 311/3","16.7.2018 8:00:00","14.9.2018 14:00:00","","celok","1,0000","3747,500","20,000","4497,000","263,010","13.7.2018 10:12:00",
"Z201829113","Z201829113_Z","TSM Dubnica nad Váhom, s. r. o.","36312941","Slovenská republika","Dubnica nad Váhom","01841","Nádražná 4007 P. O. BOX 121","Ladislav Máté - FiMa","30506506","Slovenská republika","Fiľakovo","98601","Vajanského 1","Kúpna zmluva","kontajner na zber triedeného odpadu","34928480-6 Kontajnery a nádoby na odpad a odpadky;60000000-8 Dopravné služby (bez prepravy odpadu)","Tovar;Služba","","Slovenská republika","Trenčiansky","Ilava","Dubnica nad Váhom","Sládkovičova 1678/21","","","25.7.2018 9:01:00","ks","10,0000","1997,000","20,000","2396,400","3,000","16.7.2018 9:40:00",
"Z201829115","Z201829115_Z","Národné poľnohospodárske a potravinárske centrum","42337402","Slovenská republika","Lužianky","95141","Hlohovecká 2","TATRACHEMA VD","31434193","Slovenská republika","Trnava","91702","Bulharská 40","Rámcová dohoda","Čistiace prostriedky","39830000-9 Čistiace výrobky;60000000-8 Dopravné služby (bez prepravy odpadu)","Tovar;Služba","","Slovenská republika","Banskobystrický","Banská Bystrica","Banská Bystrica","NPPC-Výskumný ústav trávnych porastov a horského poľnohospodárstva, Mládežnícka 36, 974 21 Banská Bystrica","","","","počet položiek","24,0000","455,000","20,000","546,000","146,000","13.7.2018 10:08:00",
"Z201829116","Z201829116_Z","TSM Dubnica nad Váhom, s. r. o.","36312941","Slovenská republika","Dubnica nad Váhom","01841","Nádražná 4007 P. O. BOX 121","BINS s.r.o.","45510393","Slovenská republika","Nitra","949 01","Vašinova 61","Kúpna zmluva","kontajner na zber triedeného odpadu","34928480-6 Kontajnery a nádoby na odpad a odpadky;60000000-8 Dopravné služby (bez prepravy odpadu)","Tovar;Služba","","Slovenská republika","Trenčiansky","Ilava","Dubnica nad Váhom","Sládkovičova 1678/21","","","25.7.2018 9:06:00","ks","5,0000","975,000","20,000","1170,000","25,000","16.7.2018 9:44:00",
"Z201829122","Z201829122_Z","Národné poľnohospodárske a potravinárske centrum","42337402","Slovenská republika","Lužianky","95141","Hlohovecká 2","KRIDLA s.r.o","36466778","Slovenská republika","Humenne","06601","Mierova 94","Rámcová dohoda","Hygienické a čistiace potreby","39830000-9 Čistiace výrobky;60000000-8 Dopravné služby (bez prepravy odpadu)","Tovar;Služba","","Slovenská republika","Košický","Michalovce","Michalovce","NPPC- Výskumný ústav agroekológie, Špitálska 1273, 071 01 Michalovce","","","","počet položiek","23,0000","230,000","20,000","276,000","4,250","13.7.2018 10:38:00",
"Z201829119","Z201829119_Z","Obec Dvorníky","00312495","Slovenská republika","Dvorníky","92056","Dvorníky 428","GROSSA NOVA s.r.o.","36024210","Slovenská republika","Nitra","95050","Dlhá 4","Kúpna zmluva","Technologické vybavenie zberného dvora - traktor, čelný nakladač k traktoru, nosič kontajnerov, štiepkovač drevnej hmoty k traktoru,  jednonápravový príves s trojstranným vyklápaním, vaňové kontajnery, mobilná víha ","16700000-2 Traktory/ťahače;34000000-7 Prepravné zariadenia a pomocné výrobky na prepravu;34223000-6 Prívesy a návesy;34390000-7 Príslušenstvo ťahačov/traktorov;43250000-0 Čelné lopatové nakladače;44613000-0 Veľké kontajnery;60000000-8 Dopravné služby (bez prepravy odpadu)","Tovar;Služba","","Slovenská republika","Trnavský","Hlohovec","Dvorníky","","3.9.2018 9:00:00","29.3.2019 12:00:00","","ks","9,0000","","","250680,000","120,000","13.7.2018 11:38:01",
"Z201829033","Z201829033_Z","Obec Zborov nad Bystricou ","00314366","Slovenská republika","Zborov nad Bystricou ","02303","Zborov nad Bystricou 223","MEVA-SK s.r.o. Rožňava","31681051","Slovenská republika","Brzotín, časť Bak","04951","Krátka 574","Kúpna zmluva","Kompostéry","39234000-1 Škatule na kompost;60000000-8 Dopravné služby (bez prepravy odpadu);77120000-7 Kompostovanie","Tovar;Služba","","Slovenská republika","Žilinský","Čadca","Zborov nad Bystricou","Obecný úrad 223","22.10.2018 10:00:00","31.10.2018 10:00:00","","kus","755,0000","52333,330","20,000","62800,000","33078,000","13.7.2018 11:24:00",
"Z201829121","Z201829121_Z","Psychiatrická nemocnica Philippa Pinela Pezinok","30801397","Slovenská republika","Pezinok","90218","Malacká cesta 63","Xepap, spol. s r. o.","31628605","Slovenská republika","Zvolen","96001","Jesenského 4703","Kúpna zmluva","Kancelársky papier alebo ekvivalent v.01","30197620-8 Písací papier;30197642-8 Papier na fotokopírovanie a xerografický papier","Tovar;Služba","","Slovenská republika","Bratislavský","Pezinok","Pezinok","Malacká cesta č. 63","18.7.2018 11:00:00","20.7.2018 13:00:00","","balík","500,0000","1049,170","20,000","1259,000","41,000","16.7.2018 10:41:59",
"Z201829123","Z201829123_Z","Krajské osvetové stredisko v Nitre","36102709","Slovenská republika","Nitra","94901","Fatranská 3","EQUILIBRIA, s.r.o.","36582051","Slovenská republika","Košice","04011","Krásnohorská 82","Zmluva o dielo","Tlač zbierky ľudových piesní - EJ,HORA,HORA","60000000-8 Dopravné služby (bez prepravy odpadu);79810000-5 Tlačiarenské služby","Služba","","Slovenská republika","Nitriansky","Nitra","Nitra","Fatranská 3","","","10.8.2018 15:00:00","ks","300,0000","320,000","10,000","352,000","147,400","13.7.2018 13:03:03",
"Z201829124","Z201829124_Z","Fakultná nemocnica s poliklinikou J.A.Reimana Prešov","00610577","Slovenská republika","Prešov","08181","Hollého 14","LASER servis, spol. s.r.o. ","35755989","Slovenská republika","Šenkvice","90081","Lipová 3","Kúpna zmluva","repasované tonery","30125110-5 Toner do laserových tlačiarní/faxových prístrojov;60000000-8 Dopravné služby (bez prepravy odpadu)","Tovar;Služba","","Slovenská republika","Prešovský","Prešov","Prešov","Hollého  14","","","24.7.2018 11:26:00","ks","273,0000","1229,990","20,000","1475,990","124,010","13.7.2018 11:35:59",
"Z201829112","Z201829112_Z","LESY Slovenskej republiky, štátny podnik","36038351","Slovenská republika","Banská Bystrica","97566","Námestie SNP 8","AGROFERT, a. s., organizačná zložka Agrochémia ","36862126","Slovenská republika","Bratislava","83605","Nobelova 34","Kúpna zmluva","Pesticídy, prídavné a podporné látky a farbivá","24000000-4 Chemické výrobky;60000000-8 Dopravné služby (bez prepravy odpadu)","Tovar;Služba","","Slovenská republika","Košický","Košice","Košice","Tranovského 19, Košice","16.7.2018 7:00:00","31.7.2018 14:00:00","","celok","1,0000","28000,000","20,000","33600,000","0,000","13.7.2018 10:08:00",
"Z201829126","Z201829126_Z","Technická univerzita vo Zvolene","00397440","Slovenská republika","Zvolen","96053","T. G. Masaryka 24","ITSK, s.r.o.","36556050","Slovenská republika","Nitra","94905","Zelená 29","Kúpna zmluva","Spotrebiče - sporák, bojler, teplovzdušný konvektor","39711420-9 Trúby;39711440-5 Variče;39715000-7 Ohrievače vody a vykurovanie budov; inštalačné zariadenia;39715240-1 Prístroje na elektrické vykurovanie priestoru;60000000-8 Dopravné služby (bez prepravy odpadu)","Tovar;Služba","","Slovenská republika","Banskobystrický","Zvolen","Zvolen","T.G. Masaryka 24","20.7.2018 8:00:00","26.7.2018 14:00:00","","súbor podľa technickej špecifikácie","1,0000","855,820","20,000","1026,980","0,020","13.7.2018 10:38:00",
