"IdentifikatorZakazky","IdentifikatorZmluvy","ObjednavatelObchodneMeno","ObjednavatelICO","ObjednavatelStat","ObjednavatelObec","ObjednavatelPSC","ObjednavatelUlica","DodavatelObchodneMeno","DodavatelICO","DodavatelStat","DodavatelObec","DodavatelPSC","DodavatelUlica","ZmluvnyVztah","OpisnyFormularNazov","OpisnyFormularCpv","OpisnyFormularDruh","OpisnyFormularKategoriaSluzieb","MiestoPlneniaStat","MiestoPlneniaKraj","MiestoPlneniaOkres","MiestoPlneniaObec","MiestoPlneniaUlica","LehotaPlneniaOd","LehotaPlneniaDo","LehotaPlneniaPresne","MnozstvoJednotka","MnozstvoHodnota","CenaBezDPH","CenaSadzbaDPH","CenaVrataneDPH","Uspora","DatumZazmluvnenia","IdStavVCrz",
"Z201848181","Z201848181_Z","Ministerstvo obrany Slovenskej republiky","30845572","Slovenská republika","Bratislava","83247","Kutuzovova 8","TR TECHNIC s.r.o.","45906114","Slovenská republika","Lukavica","08621","39","Kúpna zmluva","dielenské vybavenie","31170000-8 Transformátory;43800000-1 Dielenské zariadenia","Tovar;Služba","","Slovenská republika","Nitriansky","Nitra","Nitra","Novozámocká 1","12.11.2018 7:00:00","16.11.2018 14:00:00","","pol.1-1ks,pol.2-1ks,pol.3-1ks,pol.4-1ks","4,0000","490,830","20,000","589,000","144,990","8.11.2018 11:20:00","2",
"Z201848098","Z201848098_Z","Kancelária Národnej rady Slovenskej republiky","00151491","Slovenská republika","Bratislava - Staré Mesto","81280","Nám. Alexandra Dubčeka 1","JURIGA spol. s r. o.","31344194","Slovenská republika","Bratislava","85101","Gercenova 3","Kúpna zmluva","Nákup tonerov","30125100-2 Tonerové náplne;60000000-8 Dopravné služby (bez prepravy odpadu)","Tovar;Služba","","Slovenská republika","Bratislavský","Pezinok","Častá","Častá - Papiernička, 900 89 Častá","","","14.11.2018 10:00:00","kus podľa technickej špecifikácie","33,0000","1666,660","20,000","1999,990","520,010","8.11.2018 11:20:00","2",
"Z201848118","Z201848118_Z","Kancelária Národnej rady Slovenskej republiky","00151491","Slovenská republika","Bratislava - Staré Mesto","81280","Nám. Alexandra Dubčeka 1","Slavka Ivanová-Štýl","41803523","Slovenská republika","Vranov nad Topľou","09302","Sládkovičova 1970/12","Kúpna zmluva","Profesionálny chrbtový fúkač","42650000-7 Pneumatické alebo motorové ručné nástroje;60000000-8 Dopravné služby (bez prepravy odpadu)","Tovar;Služba","","Slovenská republika","Bratislavský","Pezinok","Častá","Častá - Papiernička, 900 89 Častá","","","16.11.2018 10:00:00","kus podľa technickej špecifikácie","1,0000","408,330","20,000","490,000","249,990","8.11.2018 11:20:00","2",
"Z201846676","Z201846676_Z","Slovenská technická univerzita v Bratislave","00397687","Slovenská republika","Bratislava","81243","Vazovova 5","X logistics, s.r.o.","47899948","Slovenská republika","Nitra","94905","Dvorčianska 815","Kúpna zmluva","USB kľúč Corsair","30234600-4 Flash pamäť;30237132-3 Rozhranie univerzálnej sériovej zbernice (USB);37453300-1 Disky;60000000-8 Dopravné služby (bez prepravy odpadu)","Tovar;Služba","","Slovenská republika","Bratislavský","Bratislava","Bratislava","Radlinského 11","12.11.2018 8:00:00","19.11.2018 15:30:00","","ks","1,0000","109,000","20,000","130,800","57,670","8.11.2018 11:22:00","2",
"Z201848186","Z201848186_Z","Univerzitná nemocnica Bratislava","31813861","Slovenská republika","Bratislava","82101","Pažítková 4","BMT, s.r.o.","31444571","Slovenská republika","Piešťany","92101","Pod Párovcami 7271/165","Kúpna zmluva","Parné sterilizátory","33191000-5 Sterilizačné, dezinfekčné a hygienické prístroje;33191100-6 Sterilizátory;51410000-9 Inštalácia lekárskych zariadení;60000000-8 Dopravné služby (bez prepravy odpadu)","Tovar;Služba","","Slovenská republika","Bratislavský","Bratislava III","Bratislava - mestská časť Nové Mesto","Limbová 5","19.11.2018 8:00:00","7.12.2018 14:00:00","","ks","3,0000","135277,500","20,000","162333,000","26,400","8.11.2018 11:24:00","2",
"Z201848107","Z201848107_Z","Kancelária Národnej rady Slovenskej republiky","00151491","Slovenská republika","Bratislava - Staré Mesto","81280","Nám. Alexandra Dubčeka 1","CLEAN TONERY, s.r.o.","35891866","Slovenská republika","Pezinok","90201","Za Hradbami 27","Kúpna zmluva","Tonery","30125100-2 Tonerové náplne;60000000-8 Dopravné služby (bez prepravy odpadu)","Tovar;Služba","","Slovenská republika","","","","","","","13.11.2018 10:00:00","kus podľa technickej špecifikácie","8,0000","441,670","20,000","530,000","267,650","8.11.2018 11:24:00","2",
"Z201848151","Z201848151_Z","""VEK NÁDEJE"", Zariadenie sociálnych služieb Nové Zámky","00655341","Slovenská republika","Nové Zámky ","94059","Šoltésovej 2 ","TriCare s. r. o.","51053608","Slovenská republika","Bratislava","82106","Dudvážska 5112/31","Kúpna zmluva","Nákup a dodanie elektricky polohovateľných lôžok ","33192130-2 Motorizované lôžka;39143112-4 Matrace;60000000-8 Dopravné služby (bez prepravy odpadu)","Tovar;Služba","","Slovenská republika","Nitriansky","Nové Zámky","Nové Zámky","Šoltésovej č.2","15.11.2018 7:00:00","7.12.2018 15:00:00","","kus","20,0000","10132,500","20,000","12159,000","1519,800","8.11.2018 11:26:00","2",
"Z201848197","Z201848197_Z","Ministerstvo obrany Slovenskej republiky","30845572","Slovenská republika","Bratislava","83247","Kutuzovova 8","euroAT, s.r.o.","47462752","Slovenská republika","Bardejov","08501","Priemyselná 1454/4","Kúpna zmluva","silón žací do krovinorezu","44311000-3 Lanká;60000000-8 Dopravné služby (bez prepravy odpadu)","Tovar;Služba","2. Služby pozemnej dopravy, vrátane služieb pancierových automobilov a kuriérskych služieb okrem prepravy poštových zásielok","Slovenská republika","Nitriansky","Nitra","Nitra","Novozámocká 1","12.11.2018 7:00:00","16.11.2018 14:00:00","","metrov","7000,0000","283,330","20,000","340,000","41,000","8.11.2018 11:34:00","2",
"Z201847761","Z201847761_Z","Prešovská univerzita v Prešove","17070775","Slovenská republika","Prešov","08001","Ul. 17. novembra 15","UniKnihy.sk, s.r.o.","36683132","Slovenská republika","Bratislava-Staré Mesto","81106","Vysoká 12","Kúpna zmluva","Knihy - nákup odbornej odbornej českej literatúry","22110000-4 Tlačené knihy;22111000-1 Knihy pre školy;22160000-9 Brožované knihy;60000000-8 Dopravné služby (bez prepravy odpadu)","Tovar;Služba","","Slovenská republika","Prešovský","Prešov","Prešov","ul. 17 novembra č. 1, PU v Prešove-Filozofická fakulta, Inštitút psychológie","","","3.12.2018 13:00:00","ks","6,0000","73,640","10,000","81,000","0,130","8.11.2018 11:38:00","2",
"Z201848142","Z201848142_Z","Národná diaľničná spoločnosť, a.s.","35919001","Slovenská republika","Bratislava","84104","Dúbravská cesta 14","MP KANAL service s.r.o. ","45965838","Slovenská republika","Prešov","08001","Mojmírova 7","Zmluva o poskytovaní služieb","Vytiahnutie, odvoz a likvidácia odpadových vôd a kalov zo žúmp.","90512000-9 Služby na prepravu odpadu;90513000-6 Služby na spracovanie a likvidáciu nie nebezpečného odpadu","Služba","","Slovenská republika","Prešovský","Prešov","Malý Šariš","","9.11.2018 12:00:00","28.2.2019 9:16:00","","meter kubický","1500,0000","9990,000","20,000","11988,000","0,000","8.11.2018 11:38:00","2",
"Z201848149","Z201848149_Z","Úrad podpredsedu vlády Slovenskej republiky pre investície a informatizáciu","50349287","Slovenská republika","Bratislava","81105","Štefániková  15","BiZZdesign Central Europe, s. r. o.","47076950","Slovenská republika","Bratislava","81101","Nedbalova 12","Kúpna zmluva","Zabezpečenie  licencií nástroja BizzDesign pre MetaIS 2","48000000-8 Softvérové balíky a informačné systémy;60000000-8 Dopravné služby (bez prepravy odpadu)","Tovar;Služba","","Slovenská republika","Bratislavský","Bratislava I","Bratislava - mestská časť Staré Mesto","Štefánikova 15","12.11.2018 9:00:00","30.6.2019 23:59:00","","ks","210,0000","94798,560","20,000","113758,270","0,000","8.11.2018 11:38:00","2",
"Z201848199","Z201848199_Z","Centrum biológie rastlín a biodiverzity Slovenskej akadémie vied","00679089","Slovenská republika","Bratislava","84523","Dúbravská cesta 9","LABO - SK, s.r.o.","36365556","Slovenská republika","Bratislava","81102","Slávičie údolie 102/A","Kúpna zmluva","Materiál a chémia na PAGE","33696600-1 Činidlá pre elektroforézu;60000000-8 Dopravné služby (bez prepravy odpadu)","Tovar;Služba","","Slovenská republika","Bratislavský","Bratislava IV","Bratislava - mestská časť Karlova Ves","Dúbravská cesta 9","12.11.2018 10:50:00","27.11.2018 10:50:00","","Sada","1,0000","","","678,050","0,000","8.11.2018 11:38:00","2",
"Z201847780","Z201847780_Z","Slovenská technická univerzita v Bratislave","00397687","Slovenská republika","Bratislava","81243","Vazovova 5","X logistics, s.r.o.","47899948","Slovenská republika","Nitra","94905","Dvorčianska 815","Kúpna zmluva","Elektronické a počítačové vybavenie","30213100-6 Prenosné počítače;30236000-2 Rôzne počítačové vybavenie;31710000-6 Elektronické zariadenia;60000000-8 Dopravné služby (bez prepravy odpadu)","Tovar;Služba","","Slovenská republika","Bratislavský","Bratislava I","Bratislava - mestská časť Staré Mesto","Radlinského 9","13.11.2018 10:00:00","22.11.2018 14:00:00","","položka","27,0000","5909,000","20,000","7090,800","91,000","8.11.2018 11:40:00","2",
"Z201848167","Z201848167_Z","Žilinská univerzita v Žiline","00397563","Slovenská republika","Žilina","01026","Univerzitná 8215/1","DASTIN s.r.o.","36178829","Slovenská republika","Košice","04001","Palmová 7","Kúpna zmluva","Elektronické súčiastky a komponenty","31710000-6 Elektronické zariadenia;31711100-4 Elektronické komponenty;60000000-8 Dopravné služby (bez prepravy odpadu)","Tovar;Služba","","Slovenská republika","Žilinský","Žilina","Žilina","Univerzitná 8215/1, 010 26 Žilina, Elektrotechnická fakulta, KTEBI","12.11.2018 8:00:00","3.12.2018 14:00:00","","celok","1,0000","159,990","20,000","191,990","40,010","8.11.2018 11:40:00","2",
"Z201848201","Z201848201_Z","Ministerstvo obrany Slovenskej republiky","30845572","Slovenská republika","Bratislava","83247","Kutuzovova 8","euroAT, s.r.o.","47462752","Slovenská republika","Bardejov","08501","Priemyselná 1454/4","Kúpna zmluva","Páska vytyčovacia","44424300-1 Reflexné pásky;60000000-8 Dopravné služby (bez prepravy odpadu)","Tovar;Služba","2. Služby pozemnej dopravy, vrátane služieb pancierových automobilov a kuriérskych služieb okrem prepravy poštových zásielok","Slovenská republika","Nitriansky","Nitra","Nitra","Novozámocká 1","12.11.2018 7:00:00","16.11.2018 14:00:00","","ks","21,0000","87,500","20,000","105,000","0,000","8.11.2018 11:44:00","2",
"Z201848202","Z201848202_Z","Univerzita sv. Cyrila a Metoda v Trnave","36078913","Slovenská republika","Trnava","91701","Nám. J. Herdu 2","Ecoli s.r.o.","35815906","Slovenská republika","Bratislava 47","84103","Studenohorská 12","Kúpna zmluva","Oligonukleotidy, primery ","24000000-4 Chemické výrobky;24300000-7 Základné anorganické a organické chemikálie;60000000-8 Dopravné služby (bez prepravy odpadu)","Tovar;Služba","","Slovenská republika","Trnavský","Trnava","Špačince","Hlavná 418, 919 51 Špačince","12.11.2018 8:30:00","23.11.2018 14:30:00","","bázové páry","3000,0000","6000,000","10,000","6600,000","0,000","8.11.2018 11:54:00","2",
"Z201848110","Z201848110_Z","Mesto Strážske","00325813","Slovenská republika","Strážske","07222","Nám. A. Dubčeka 300","Eurokomp group s. r. o.","51217368","Slovenská republika","Plešivec","04911","Štítnická 283","Kúpna zmluva","Predchádzanie vzniku BRKO obstaraním záhradných kompostérov v meste ","34928480-6 Kontajnery a nádoby na odpad a odpadky;60000000-8 Dopravné služby (bez prepravy odpadu)","Tovar;Služba","","Slovenská republika","Košický","Michalovce","Strážske","","11.11.2018 8:00:00","26.2.2019 12:00:00","","ks","968,0000","66666,670","20,000","80000,000","36340,000","8.11.2018 11:54:00","2",
"Z201846138","Z201846138_Z","ŠTÁTNE LESY TATRANSKÉHO NÁRODNÉHO PARKU TATRANSKÁ LOMNICA ","31966977","Slovenská republika","Tatranská Lomnica","05960","66","Pavel Scholtz","43206735","Slovenská republika","Banska Bystrica","97404","THK 2","Kúpna zmluva","Licencie Microsoft Office 2019 - pre podnikateľov (Slovenská verzia) / Professional (Slovenská verzia)","48310000-4 Softvérový balík na vytváranie dokumentov;60000000-8 Dopravné služby (bez prepravy odpadu)","Tovar;Služba","","Slovenská republika","Prešovský","Poprad","Tatranská Lomnica","č. 66","12.11.2018 8:00:00","30.11.2018 14:00:00","","ks","10,0000","2250,000","2,000","2295,000","150,000","8.11.2018 12:04:00","2",
"Z201848178","Z201848178_Z","Technické služby mesta Prešov a.s.","31718914","Slovenská republika","Prešov","08001","Bajkalská 33","SCANIA SLOVAKIA s.r.o.","35826649","Slovenská republika","Senec   ","90301","Diaľničná cesta 4570/2A ","Kúpna zmluva","Jazdené trojnápravové vozidlo s 22 m3 nadstavbou na komunálny odpad","34114000-9 Špeciálne vozidlá;34144510-6 Vozidlá na smeti;60000000-8 Dopravné služby (bez prepravy odpadu)","Tovar;Služba","","Slovenská republika","Prešovský","Prešov","Prešov","Jesenná 3","13.11.2018 10:13:00","16.11.2018 10:13:00","","ks","1,0000","96900,000","20,000","116280,000","6100,000","8.11.2018 12:08:00","2",
"Z201848205","Z201848205_Z","Fakultná nemocnica s poliklinikou J.A.Reimana Prešov","00610577","Slovenská republika","Prešov","08181","Hollého 14","INMEDIA, spol. s r.o.","36019208","Slovenská republika","Zvolen","96001","Námestie SNP 11","Kúpna zmluva","Vajcia","03142500-3 Vajcia;60000000-8 Dopravné služby (bez prepravy odpadu)","Tovar;Služba","","Slovenská republika","Prešovský","Prešov","Prešov","Hollého 14","12.11.2018 7:00:00","12.12.2018 15:00:00","","ks","10000,0000","790,830","20,000","949,000","0,990","8.11.2018 12:08:00","2",
"Z201847204","Z201847204_Z","Ministerstvo obrany Slovenskej republiky","30845572","Slovenská republika","Bratislava","83247","Kutuzovova 8","SPORT ELEMENT s.r.o.","36814644","Slovenská republika","Košice","040 01","Hlavná 67","Kúpna zmluva","Športové a rekreačné vybavenie","37410000-5 Výbava pre športy vo voľnej prírode alebo na ihrisku;37411110-6 Lyžiarske topánky;37411120-9 Lyže;37411130-2 Lyžiarske palice;37411140-5 Viazania;37411160-1 Lyžiarsky výstroj;60000000-8 Dopravné služby (bez prepravy odpadu)","Tovar;Služba","","Slovenská republika","Banskobystrický","Zvolen","Zvolen","Borovianska cesta 1","12.11.2018 11:39:00","15.11.2018 11:40:00","","súbor","1,0000","1490,000","20,000","1788,000","0,000","8.11.2018 12:16:00","2",
"Z201848212","Z201848212_Z","Ministerstvo obrany Slovenskej republiky","30845572","Slovenská republika","Bratislava","83247","Kutuzovova 8","Vladimír Janičina ELKO","14268035","Slovenská republika","Dúbrava","03212","284","Kúpna zmluva","Páska izolačná","31651000-4 Elektroizolačná páska;60000000-8 Dopravné služby (bez prepravy odpadu)","Tovar;Služba","","Slovenská republika","Nitriansky","Nitra","Nitra","Novozámocká 1","12.11.2018 7:00:00","16.11.2018 14:00:00","","položka 1.- 57ks, pol. 2.- 57ks, pol. 3.- 57ks","171,0000","70,830","20,000","85,000","38,000","8.11.2018 12:20:00","2",
"Z201848221","Z201848221_Z","Ministerstvo obrany Slovenskej republiky","30845572","Slovenská republika","Bratislava","83247","Kutuzovova 8","Filson Slovakia s.r.o.","48157716","Slovenská republika","Dechtice","91953","41","Kúpna zmluva","Zmes do ostrekovačov ","24951310-1 Pripravené tekutiny na odmrazovanie;39831240-0 Zlúčeniny na čistenie;60000000-8 Dopravné služby (bez prepravy odpadu)","Tovar;Služba","","Slovenská republika","Nitriansky","Nitra","Nitra","Novozámocká 1","12.11.2018 7:00:00","16.11.2018 14:00:00","","položka č.1 - 50ks, položka č.2 - 55ks","105,0000","191,580","20,000","229,900","6,500","8.11.2018 12:36:00","2",
"Z201848108","Z201848108_Z","Trnavská univerzita so sídlom v Trnave","31825249","Slovenská republika","Trnava","91843","Hornopotočná 23","X logistics, s.r.o.","47899948","Slovenská republika","Nitra","94905","Dvorčianska 815","Kúpna zmluva","Drony a iná technika pre archeologický výskum","30213000-5 Osobné počítače;31710000-6 Elektronické zariadenia;32270000-6 Digitálne prenosové prístroje;32333200-8 Videokamery;34711200-6 Bezpilotné lietadlá;38620000-7 Polarizačný materiál;38623000-8 Optické filtre;38624000-5 Optické pomôcky;38651600-9 Digitálne fotoaparáty;39133000-3 Zobrazovacie jednotky;60000000-8 Dopravné služby (bez prepravy odpadu)","Tovar;Služba","","Slovenská republika","Trnavský","Trnava","Trnava","Hornopotočná 23","14.11.2018 8:00:00","16.11.2018 9:00:00","","kompletná objednávka","1,0000","1870,000","20,000","2244,000","207,250","8.11.2018 12:36:00","2",
"Z201847893","Z201847893_Z","Obec Kokšov-Bakša","00324311","Slovenská republika","Kokšov-Bakša","04413","Kokšov-Bakša 178","KOSIT a.s.","36205214","Slovenská republika","Košice","04346","Rastislavova 98","Zmluva o poskytovaní služieb","zber, preprava a zneškodnenie odpadov","90500000-2 Služby súvisiace s likvidáciou odpadu a odpadom;90510000-5 Likvidácia a spracovanie odpadu;90511000-2 Služby na zber odpadu;90512000-9 Služby na prepravu odpadu","Služba","","Slovenská republika","Košický","Košice - okolie","Kokšov - Bakša","Kokšov-Bakša 178","1.1.2019 0:00:00","1.1.2023 0:00:00","","rok","4,0000","119174,800","20,000","143009,760","69786,240","8.11.2018 12:38:00","2",
"Z201848173","Z201848173_Z","Centrum biológie rastlín a biodiverzity Slovenskej akadémie vied","00679089","Slovenská republika","Bratislava","84523","Dúbravská cesta 9","CLEAN TONERY, s.r.o.","35891866","Slovenská republika","Pezinok","90201","Za Hradbami 27","Kúpna zmluva","Tonery: HP 30A čierny a HP CE285A čierny  ","30125110-5 Toner do laserových tlačiarní/faxových prístrojov;60000000-8 Dopravné služby (bez prepravy odpadu)","Tovar;Služba","","Slovenská republika","Bratislavský","Bratislava IV","Bratislava - mestská časť Karlova Ves","Dúbravská cesta 9","","","15.11.2018 10:02:00","ks","3,0000","137,500","20,000","165,000","64,990","8.11.2018 12:38:00","2",
"Z201848159","Z201848159_Z","Žilinská univerzita v Žiline","00397563","Slovenská republika","Žilina","01026","Univerzitná 8215/1","X logistics, s.r.o.","47899948","Slovenská republika","Nitra","94905","Dvorčianska 815","Kúpna zmluva","Vývojové dosky","31710000-6 Elektronické zariadenia;31711100-4 Elektronické komponenty;60000000-8 Dopravné služby (bez prepravy odpadu)","Tovar;Služba","","Slovenská republika","Žilinský","Žilina","Žilina","Univerzitná 1, 010 26  Žilina, Elektrotechnická fakulta, KTEBI","12.11.2018 8:00:00","16.11.2018 14:00:00","","celok","1,0000","109,990","20,000","131,990","0,010","8.11.2018 12:38:00","2",
"Z201848223","Z201848223_Z","Ministerstvo obrany Slovenskej republiky","30845572","Slovenská republika","Bratislava","83247","Kutuzovova 8","AG NÁRADIE - AGRODEAL, s.r.o.","18049401","Slovenská republika","Trnava","91700","Bulharská 37/2","Kúpna zmluva","štikacie kliešte","44512200-4 Kliešte;44512400-6 Štikacie kliešte;60000000-8 Dopravné služby (bez prepravy odpadu)","Tovar;Služba","","Slovenská republika","Nitriansky","Nitra","Nitra","Novozámocká 1","12.11.2018 7:00:00","16.11.2018 14:00:00","","ks","2,0000","13,330","20,000","16,000","0,000","8.11.2018 12:44:00","2",
"Z201847807","Z201847807_Z","Ústredná vojenská nemocnica SNP Ružomberok-fakultná nemocnica","31936415","Slovenská republika","Ružomberok","03426","Gen. Miloša Vesela 21","PhDr. Gabriela Spišáková - Majster Papier","33768897","Slovenská republika","Bratislava 5","85101","Wolkrova 5, P.O.BOX 212","Kúpna zmluva","Toaletný papier a papierové utierky","33760000-5 Toaletný papier, vreckovky, uteráky na ruky a servítky;60000000-8 Dopravné služby (bez prepravy odpadu)","Tovar;Služba","","Slovenská republika","Žilinský","Ružomberok","Ružomberok","Generála Miloša Vesela 21, 034 26  Ružomberok","16.11.2018 12:00:00","15.11.2019 12:00:00","","bal.","1,0000","18979,000","20,000","22774,800","7021,000","8.11.2018 12:46:00","2",
"Z201848177","Z201848177_Z","Centrum biológie rastlín a biodiverzity Slovenskej akadémie vied","00679089","Slovenská republika","Bratislava","84523","Dúbravská cesta 9","X logistics, s.r.o.","47899948","Slovenská republika","Nitra","94905","Dvorčianska 815","Kúpna zmluva","Tlačiareň CANON Pixma iP8750","30232150-0 Atramentové tlačiarne;60000000-8 Dopravné služby (bez prepravy odpadu)","Tovar;Služba","","Slovenská republika","Bratislavský","Bratislava IV","Bratislava - mestská časť Karlova Ves","Dúbravská cesta 9","","","15.11.2018 10:10:00","ks","1,0000","237,490","20,000","284,990","0,000","8.11.2018 12:46:00","2",
"Z201848165","Z201848165_Z","Žilinská univerzita v Žiline","00397563","Slovenská republika","Žilina","01026","Univerzitná 8215/1","CLEAN TONERY, s.r.o.","35891866","Slovenská republika","Pezinok","90201","Za Hradbami 27","Kúpna zmluva","Tonerové náplne - originál","30125100-2 Tonerové náplne;30125120-8 Toner do fotokopírovacích strojov;60000000-8 Dopravné služby (bez prepravy odpadu)","Tovar;Služba","","Slovenská republika","Žilinský","Žilina","Žilina","Univerzitná 1, 010 26  Žilina, Fakulta PEDaS","12.11.2018 8:00:00","16.11.2018 14:00:00","","celok","1,0000","6498,000","","6498,000","2902,000","8.11.2018 12:56:00","2",
"Z201848218","Z201848218_Z","Ústredie ľudovej umeleckej výroby","00164429","Slovenská republika","Bratislava","81611","Obchodná 64","MARSANN IT, s.r.o.","43821987","Slovenská republika","Bratislava","851 01","Digital Park II, Einsteinova 23","Kúpna zmluva","Nákup výpočtovej techniky ( 7 ks PC, 7 ks monitor)","30213300-8 Stolový počítač;30231000-7 Počítačové monitory a konzoly;30237200-1 Príslušenstvo počítačov;60000000-8 Dopravné služby (bez prepravy odpadu)","Tovar;Služba","","Slovenská republika","Bratislavský","Bratislava I","Bratislava - mestská časť Staré Mesto","Obchodná 64","13.11.2018 11:00:00","30.11.2018 15:00:00","","Rozsah v zmysle technických vlastností","1,0000","3242,600","20,000","3891,120","668,880","8.11.2018 13:00:00","2",
"Z201846435","Z201846435_Z","Žilinská univerzita v Žiline","00397563","Slovenská republika","Žilina","01026","Univerzitná 8215/1","AREKO, s.r.o.","31377530","Slovenská republika","Bratislava","83107","Tomanova 35","Kúpna zmluva","Meracie prístroje a snímače fyzikálnych veličín","38420000-5 Nástroje na meranie prietoku, hladiny a tlaku kvapalín a plynov;38540000-2 Testovacie a meracie stroje a prístroje;60000000-8 Dopravné služby (bez prepravy odpadu)","Tovar;Služba","","Slovenská republika","Žilinský","Žilina","Žilina","ŽU v Žiline, Univerzitná 8215/1, Strojnícka fakulta, Katedra energetickej techniky","12.11.2018 8:00:00","17.12.2018 14:00:00","","komplet (podľa technickej špecifikácie)","1,0000","16705,900","20,000","20047,080","0,000","8.11.2018 13:08:00","2",
"Z201848158","Z201848158_Z","Žilinská univerzita v Žiline","00397563","Slovenská republika","Žilina","01026","Univerzitná 8215/1","IMI TRADE s.r.o. ","31565531","Slovenská republika","Žilina","01001","Jánošíkova 21","Kúpna zmluva","Reklamné predmety","60000000-8 Dopravné služby (bez prepravy odpadu);79340000-9 Reklamné a marketingové služby;79820000-8 Služby súvisiace s tlačou;22460000-2 Obchodno-reklamný materiál, komerčné katalógy a príručky;22462000-6 Propagačný materiál","Tovar;Služba","","Slovenská republika","Žilinský","Žilina","Žilina","Univerzitná 8215/1, 010 26 Žilina, Elektrotechnická fakulta, Dekanát","12.11.2018 8:00:00","23.11.2018 12:00:00","","celok","1,0000","9139,000","20,000","10966,800","3461,000","8.11.2018 13:14:00","2",
"Z201847764","Z201847764_Z","Ministerstvo obrany Slovenskej republiky","30845572","Slovenská republika","Bratislava","83247","Kutuzovova 8","KODRETA Štefanov spoločnosť s ručením obmedzeným skrátene: KODRETA Štefanov s.r.o.","31418171","Slovenská republika","Štefanov ","90645","Štefanov 372","Zmluva o poskytovaní služieb","Kontrola a oprava hasiacich prístrojov","50514000-1 Opravy a údržba kovových nádob;60000000-8 Dopravné služby (bez prepravy odpadu);71356100-9 Technická kontrola","Služba","","Slovenská republika","Košický","Trebišov","Trebišov","kpt. Nálepku 1","12.11.2018 8:00:00","20.11.2018 15:00:00","","ks","94,0000","578,330","20,000","694,000","206,000","8.11.2018 13:26:00","2",
"Z201848240","Z201848240_Z","Centrum biológie rastlín a biodiverzity Slovenskej akadémie vied","00679089","Slovenská republika","Bratislava","84523","Dúbravská cesta 9","BIOTECH s.r.o.","35768444","Slovenská republika","Bratislava","84105","Kresánkova 12","Kúpna zmluva","DNA polymeráza","24965000-6 Enzýmy;60000000-8 Dopravné služby (bez prepravy odpadu)","Tovar;Služba","","Slovenská republika","Bratislavský","Bratislava IV","Bratislava - mestská časť Karlova Ves","Dúbravská cesta 9","12.11.2018 13:51:00","27.11.2018 12:51:00","","kus","1,0000","107,000","10,000","117,700","0,000","8.11.2018 13:34:00","2",
