"IdentifikatorZakazky","IdentifikatorZmluvy","ObjednavatelObchodneMeno","ObjednavatelICO","ObjednavatelStat","ObjednavatelObec","ObjednavatelPSC","ObjednavatelUlica","DodavatelObchodneMeno","DodavatelICO","DodavatelStat","DodavatelObec","DodavatelPSC","DodavatelUlica","ZmluvnyVztah","OpisnyFormularNazov","OpisnyFormularCpv","OpisnyFormularDruh","OpisnyFormularKategoriaSluzieb","MiestoPlneniaStat","MiestoPlneniaKraj","MiestoPlneniaOkres","MiestoPlneniaObec","MiestoPlneniaUlica","LehotaPlneniaOd","LehotaPlneniaDo","LehotaPlneniaPresne","MnozstvoJednotka","MnozstvoHodnota","CenaBezDPH","CenaSadzbaDPH","CenaVrataneDPH","Uspora","DatumZazmluvnenia","IdStavVCrz",
"Z20227011","Z20227011_Z","Stredná športová škola, Kukučínova 4239/1, Poprad","52439534","Slovenská republika","Poprad 1","05801","Kukučínova 4239/1","PESMENPOL, spol. s r.o. ","36507881","Slovenská republika","Prešov","08001","Železničiarska 16/3815 ","Kúpna zmluva","Vybavenie šatní do športovej haly a hokejovej haly","39113600-3 Lavičky;39143121-0 Šatníky","Tovar;Služba","","Slovenská republika","Prešovský","Poprad","Poprad","Francisciho 910/8","15.7.2022 8:47:00","4.8.2022 8:47:00","","komplet","1,0000","25410,000","20,000","30492,000","0,000","7.7.2022 9:38:00","",
"Z20227041","Z20227041_Z","Stredná športová škola, Kukučínova 4239/1, Poprad","52439534","Slovenská republika","Poprad 1","05801","Kukučínova 4239/1","KVANT spol. s r.o.","31398294","Slovenská republika","Bratislava","84248","Fakulta matematiky, fyziky a informatiky UK, Mlynská Dolina ","Kúpna zmluva","Vybavenie prírodovedeckého laboratória pre predmety fyzika a biológia","39113000-7 Rôzne sedadlá a stoličky;39120000-9 Stoly, skrine, písacie stoly a knižnice;39150000-8 Rôzny nábytok a vybavenie;39181000-4 Laboratórne stoly;39290000-1 Rôzne vybavenie a zariadenie interiérov;44320000-9 Káble a súvisiace výrobky;44322100-4 Elektroinštalačné káble;60000000-8 Dopravné služby (bez prepravy odpadu)","Tovar;Služba","","Slovenská republika","Prešovský","Poprad","Poprad","Francisciho 910/8","15.7.2022 12:11:00","25.7.2022 12:16:00","","komplet","1,0000","13249,170","20,000","15899,000","1069,000","7.7.2022 11:02:01","",
"Z20227043","Z20227043_Z","Stredná športová škola, Kukučínova 4239/1, Poprad","52439534","Slovenská republika","Poprad 1","05801","Kukučínova 4239/1","MY DVA Slovakia, s.r.o.","35937548","Slovenská republika","Bratislava","84103","Lamačská cesta 45","Kúpna zmluva","Vybavenie chemického laboratória","39113000-7 Rôzne sedadlá a stoličky;39120000-9 Stoly, skrine, písacie stoly a knižnice;39141500-7 Digestory;39150000-8 Rôzny nábytok a vybavenie;39181000-4 Laboratórne stoly;39290000-1 Rôzne vybavenie a zariadenie interiérov;44320000-9 Káble a súvisiace výrobky;44322100-4 Elektroinštalačné káble","Tovar;Služba","","Slovenská republika","Prešovský","Poprad","Poprad","Francisciho 910/8","15.7.2022 12:27:00","25.7.2022 12:27:00","","komplet","1,0000","29166,670","20,000","35000,000","4960,000","7.7.2022 11:40:00","",
"Z20226942","Z20226942_Z","Mestská časť Bratislava-Petržalka","00603201","Slovenská republika","Bratislava","85212","Kutlíkova 17","BUČINA EKO, s.r.o.","46156101","Slovenská republika","Bratislava","82108","Ružová dolina 6","Rámcová dohoda","Zhodnotenie / zneškodnenie odpadov kategórie ostatné odpady","90500000-2 Služby súvisiace s likvidáciou odpadu a odpadom","Služba","","Slovenská republika","Bratislavský","Bratislava V","Bratislava - mestská časť Petržalka","Ondreja Štefánka","","","","ton za 12 mesiacov","3025,0000","81935,000","20,000","98322,000","0,000","7.7.2022 15:38:00","",
"Z20227170","Z20227170_Z","Ministerstvo obrany Slovenskej republiky","30845572","Slovenská republika","Bratislava","83247","Kutuzovova 8","ARGUSS, s.r.o.","31365213","Slovenská republika","Bratislava","81103","Michalská 9","Zmluva o poskytovaní služieb","Zneškodnenie a likvidácia nebezpečných odpadov (NO)","90510000-5 Likvidácia a spracovanie odpadu;90512000-9 Služby na prepravu odpadu;90520000-8 Služby súvisiace s rádioaktívnym, toxickým, zdravotníckym a nebezpečným odpadom","Služba","","Slovenská republika","Nitriansky","Levice","Levice","Šafárikova 9","5.7.2022 16:54:00","19.7.2022 15:54:00","","ks","1,0000","486,000","20,000","583,200","82,800","4.7.2022 16:36:00","",
"Z20226401","Z20226401_Z","Mestská časť Bratislava-Petržalka","00603201","Slovenská republika","Bratislava","85212","Kutlíkova 17","ŠIMONTEX, s. r. o.","47492210","Slovenská republika","Jakubovany","08301","Jakubovany 94","Kúpna zmluva","Posteľné prádlo pre materské školy","39500000-7 Textilné výrobky;39520000-3 Textilné výrobky z umelých vlákien;60000000-8 Dopravné služby (bez prepravy odpadu)","Tovar;Služba","","Slovenská republika","Bratislavský","Bratislava V","Bratislava - mestská časť Petržalka","Kutlíkova 17","11.7.2022 8:00:00","11.8.2022 14:00:00","","ks","1000,0000","5408,330","20,000","6490,000","12999,200","7.7.2022 16:44:00","",
"Z20226410","Z20226410_Z","Mestská časť Bratislava-Petržalka","00603201","Slovenská republika","Bratislava","85212","Kutlíkova 17","RAMOTECH s. r. o.","52700763","Slovenská republika","Bardejov","08501","Richvald 123","Kúpna zmluva","Koberce do tried materských škôl","39500000-7 Textilné výrobky;39520000-3 Textilné výrobky z umelých vlákien;39530000-6 Koberce, rohože a predložky;39531000-3 Koberce;60000000-8 Dopravné služby (bez prepravy odpadu)","Tovar;Služba","","Slovenská republika","Bratislavský","Bratislava V","Bratislava - mestská časť Petržalka","Kutlíkova 17","11.7.2022 8:00:00","11.8.2022 14:00:00","","ks","11,0000","5250,000","20,000","6300,000","9530,400","8.7.2022 10:29:59","",
"Z20226943","Z20226943_Z","Ústredná vojenská nemocnica SNP Ružomberok-fakultná nemocnica","31936415","Slovenská republika","Ružomberok","03426","Gen. Miloša Vesela 21","FILTEKO, s.r.o. ","36462110","Slovenská republika","Veľká Lomnica","05952","Školská 655/36","Kúpna zmluva","Dodávka filtrov do VZT","42514310-8 Vzduchové filtre","Tovar;Služba","","Slovenská republika","Žilinský","Ružomberok","Ružomberok","Gen. M. Vesela 21, 034 26 Ružomberok","11.7.2022 13:35:00","11.10.2022 13:37:00","","balík","1,0000","13500,000","20,000","16200,000","0,000","4.7.2022 9:08:00","",
"Z20227027","Z20227027_Z","Univerzita sv. Cyrila a Metoda v Trnave","36078913","Slovenská republika","Trnava","91701","Nám. J. Herdu 2","DMC, s.r.o.","36777455","Slovenská republika","Nové Zámky","94064","J. Murgaša 100","Zmluva o poskytovaní služieb","Tlač časopisu","60000000-8 Dopravné služby (bez prepravy odpadu);79800000-2 Tlačiarenské a príbuzné služby;79810000-5 Tlačiarenské služby;79820000-8 Služby súvisiace s tlačou;79821000-5 Konečná úprava tlače;79823000-9 Tlačiarenské a doručovateľské služby;79824000-6 Tlačiarenské a distribučné služby","Služba","","Slovenská republika","Trnavský","Trnava","Trnava","Nám. J. Herdu 2, 917 01 Trnava","11.7.2022 8:00:00","5.8.2022 15:00:00","","ks. ","45,0000","228,330","20,000","274,000","160,500","6.7.2022 10:37:59","",
"Z20227040","Z20227040_Z","Ministerstvo obrany Slovenskej republiky","30845572","Slovenská republika","Bratislava","83247","Kutuzovova 8","PhDr. Gabriela Spišáková - Majster Papier","33768897","Slovenská republika","Bratislava 5","85101","Wolkrova 5, P.O.BOX 212","Kúpna zmluva","Potreby pre verejné stravovanie na jedno použitie.","33772000-2 Jednorazové papierové výrobky;60000000-8 Dopravné služby (bez prepravy odpadu)","Tovar","","Slovenská republika","Trenčiansky","Trenčín","Nemšová","Slovenskej armády 52","11.7.2022 7:00:00","30.11.2022 13:00:00","","kg","6000,0000","11939,980","20,000","14327,980","0,020","4.7.2022 9:38:00","",
"Z20227178","Z20227178_Z","Ministerstvo obrany Slovenskej republiky","30845572","Slovenská republika","Bratislava","83247","Kutuzovova 8","nanoTECH s.r.o.","43798608","Slovenská republika","Prešov","08001","Zemplínska 15","Kúpna zmluva","Alkalické batérie, akumulátory, galvanické články a batérie","31400000-0 Akumulátory, galvanické články a batérie;31410000-3 Galvanické články;31411000-0 Alkalické batérie;31422000-0 Sady batérií;60000000-8 Dopravné služby (bez prepravy odpadu)","Tovar;Služba","","Slovenská republika","Žilinský","Žilina","Žilina","Rajecká cesta 18, 01001 Žilina","","","8.7.2022 11:00:00","ks","1,0000","495,000","20,000","594,000","628,990","4.7.2022 10:34:00","",
"Z20227046","Z20227046_Z","Generálna prokuratúra Slovenskej republiky","166481","Slovenská republika","Bratislava ","81285","Štúrova 2","CLEAN TONERY, s.r.o.","35891866","Slovenská republika","Pezinok","90201","Za Hradbami 27","Kúpna zmluva","Nákup tonerov - originál tonery","30125100-2 Tonerové náplne;30125110-5 Toner do laserových tlačiarní/faxových prístrojov;30125120-8 Toner do fotokopírovacích strojov;60000000-8 Dopravné služby (bez prepravy odpadu)","Tovar;Služba","","Slovenská republika","Bratislavský","Bratislava I","Bratislava - mestská časť Staré Mesto","Štúrova 2","","","8.7.2022 9:00:00","ks","104,0000","17517,500","20,000","21021,000","0,000","4.7.2022 9:08:00","",
"Z20226765","Z20226765_Z","Mesto Lučenec","00316181","Slovenská republika","Lučenec","98401","Novohradská 1","DOXX - Stravné lístky, spol. s r.o.","36391000","Slovenská republika","Žilina","01001","Kálov 356","Rámcová dohoda","Stravné poukážky","30199770-8 Stravné poukážky;60000000-8 Dopravné služby (bez prepravy odpadu)","Tovar;Služba","","Slovenská republika","Banskobystrický","Lučenec","Lučenec","Ulica Novohradská 1","","","","ks","19000,0000","94791,000","","94791,000","209,000","4.7.2022 11:40:00","",
"Z20227185","Z20227185_Z","Ministerstvo obrany Slovenskej republiky","30845572","Slovenská republika","Bratislava","83247","Kutuzovova 8","Gastro Academy s. r. o.","53141814","Slovenská republika","Stupava","90031","Kúpeľná 1107/2","Zmluva o poskytovaní služieb","Rekvalifikačný kurz kuchárov a pekárov","79632000-3 Školenia a výcvik personálu","Služba","","Slovenská republika","","","","","11.7.2022 9:06:00","16.12.2022 9:06:00","","osoba","1,0000","5992,490","20,000","7190,990","0,000","6.7.2022 9:42:00","",
"Z20227129","Z20227129_Z","Ministerstvo obrany Slovenskej republiky","30845572","Slovenská republika","Bratislava","83247","Kutuzovova 8","KP shop s.r.o.","47816724","Slovenská republika","Parchovany","07662","Športová 460/1","Kúpna zmluva","Zariadenie na klimatizáciu, chladenie vzduchu a príslušenstvo ","39717200-3 Klimatizačné spotrebiče;42512000-8 Klimatizačné zariadenia;60000000-8 Dopravné služby (bez prepravy odpadu)","Tovar;Služba","","Slovenská republika","Trenčiansky","Trenčín","Nemšová","Slovenskej armády 52","4.7.2022 7:00:00","29.7.2022 11:20:00","","podľa technickej špecifikácie-ks","1,0000","6352,310","20,000","7622,770","0,000","1.7.2022 10:03:59","",
"Z20226951","Z20226951_Z","Správa ciest Žilinského samosprávneho kraja","42054575","Slovenská republika","Žilina","01001","M. Rázusa 104","MADAST s.r.o.","36610674","Slovenská republika","Bratislava","85104","Ovsištské námestie 1","Kúpna zmluva","Oleje a mazivá ","09211000-1 Mazacie oleje a mazivá;09211100-2 Motorové oleje;09211400-5 Prevodové oleje;09211610-0 Oleje na použitie na hydraulické účely;60000000-8 Dopravné služby (bez prepravy odpadu)","Tovar;Služba","","Slovenská republika","Žilinský","Liptovský Mikuláš","Liptovský Mikuláš","Pod stráňami 4","22.7.2022 6:30:00","22.7.2022 13:00:00","","predmet zákazky","1,0000","7279,000","20,000","8734,800","2353,270","6.7.2022 11:07:59","",
"Z20226630","Z20226630_Z","Stredná zdravotnícka škola","00607029","Slovenská republika","Lučenec","98417","Lúčna 2","DOXX - Stravné lístky, spol. s r.o.","36391000","Slovenská republika","Žilina","01001","Kálov 356","Zmluva o poskytovaní služieb","Zabezpečenie stravovania zamestnancov formou stravných poukážok.","30199770-8 Stravné poukážky","Tovar;Služba","","Slovenská republika","Banskobystrický","Lučenec","Lučenec","Lúčna  2","11.7.2022 13:39:00","30.6.2023 13:39:00","","ks","6000,0000","26997,300","","26997,300","2,690","8.7.2022 14:15:59","",
"Z20227033","Z20227033_Z","Ústav na výkon väzby a Ústav na výkon trestu odňatia slobody","00738280","Slovenská republika","Nitra","95050","Cintorínska 3","CARS SERVICE s.r.o.","44108672","Slovenská republika","Lužianky","95141","Rastislavova 2","Zmluva o poskytovaní služieb","Pravidelné a nepravidelné servisné úkony na služobných motorových vozidlách","34330000-9 Náhradné diely pre vozidlá na prepravu tovaru, pre dodávky a osobné automobily;50110000-9 Opravy a údržbárske služby pre motorové vozidlá a súvisiace vybavenie;50112000-3 Oprava a údržba osobných motorových vozidiel;60000000-8 Dopravné služby (bez prepravy odpadu)","Služba","","Slovenská republika","Nitriansky","Nitra","Nitra - Staré Mesto","Cintorínska 3","11.7.2022 7:00:00","10.7.2026 15:00:00","","na základe čiastkových objednávok","1,0000","12083,330","20,000","14500,000","4940,000","6.7.2022 9:51:59","",
"Z20226400","Z20226400_Z","Univerzitná nemocnica Bratislava","31813861","Slovenská republika","Bratislava","82101","Pažítková 4","K&M MEDIA s.r.o.","44879806","Slovenská republika","Čadca","02201","Podzávoz 2303","Kúpna zmluva","Chladiace zariadenia na skladovanie erytrocytových transfúznych liekov","42513200-7 Chladiace zariadenia;51100000-3 Inštalácia elektrických a mechanických zariadení;60000000-8 Dopravné služby (bez prepravy odpadu)","Tovar;Služba","","Slovenská republika","Bratislavský","Bratislava","Bratislava","Ružinovská 6","12.7.2022 11:07:00","30.8.2022 14:51:00","","ks","2,0000","10000,000","20,000","12000,000","6639,000","7.7.2022 11:40:00","",
"Z20227198","Z20227198_Z","Ministerstvo obrany Slovenskej republiky","30845572","Slovenská republika","Bratislava","83247","Kutuzovova 8","Pixel Print s.r.o.","50557050","Slovenská republika","Vyšný Orlík","09011","47","Kúpna zmluva","Značky a súvisiace prvky ","44423400-5 Značky a súvisiace prvky;60000000-8 Dopravné služby (bez prepravy odpadu)","Tovar;Služba","","Slovenská republika","Trenčiansky","Trenčín","Nemšová","Slovenskej Armády 52","4.7.2022 8:00:00","31.8.2022 12:00:00","","súbor (podľa technickej špecifikácie)","1,0000","657,140","0,000","657,140","0,000","1.7.2022 13:04:00","",
"Z20226953","Z20226953_Z","Katolícka univerzita v Ružomberku","37801279","Slovenská republika","Ružomberok","03401","Hrabovská cesta 1A","DMC, s.r.o.","36777455","Slovenská republika","Nové Zámky","94064","J. Murgaša 100","Zmluva o poskytovaní služieb","Tlač publikácii (5)","60000000-8 Dopravné služby (bez prepravy odpadu);79810000-5 Tlačiarenské služby;79820000-8 Služby súvisiace s tlačou","Služba","","Slovenská republika","Žilinský","Ružomberok","Ružomberok","Hrabovská cesta 1","6.7.2022 7:00:00","18.7.2022 8:04:00","","súbor definovaných služieb","1,0000","199,000","10,000","218,900","524,290","4.7.2022 13:24:00","",
"Z20227204","Z20227204_Z","Mesto Senica ","00309974","Slovenská republika","Senica ","90525","Štefánikova 1408/56","Z + M servis a. s.","44195591","Slovenská republika","Bratislava","82101","Martinčekova 17","Kúpna zmluva","Originál tonery, alternatívne tonery","30125100-2 Tonerové náplne;30125110-5 Toner do laserových tlačiarní/faxových prístrojov;60000000-8 Dopravné služby (bez prepravy odpadu)","Tovar;Služba","","Slovenská republika","","","","","7.7.2022 10:00:00","13.7.2022 15:00:00","","súbor","1,0000","1500,000","20,000","1800,000","708,000","4.7.2022 10:38:00","",
"Z20227037","Z20227037_Z","Slovenská zdravotnícka univerzita v Bratislave","00165361","Slovenská republika","Bratislava ","83303","Limbová 12","ITSK, s.r.o.","36556050","Slovenská republika","Nitra","94905","Zelená 29","Kúpna zmluva","IT technika","30213300-8 Stolový počítač;30237000-9 Časti a príslušenstvo počítačov a spotrebný materiál k nim;32341000-5 Mikrofóny;33195100-4 Monitory;42962000-7 Tlačiarske/kopírovacie a grafické zariadenia;60000000-8 Dopravné služby (bez prepravy odpadu)","Tovar;Služba","","Slovenská republika","Bratislavský","Bratislava","Bratislava","Limbová 14","7.7.2022 12:00:00","15.7.2022 11:15:00","","sada","1,0000","1885,000","20,000","2262,000","198,000","4.7.2022 15:56:00","",
"Z20227205","Z20227205_Z","Ministerstvo obrany Slovenskej republiky","30845572","Slovenská republika","Bratislava","83247","Kutuzovova 8","TURČAN DELTA, s.r.o.","31626742","Slovenská republika","Košťany nad Turcom","03841","338","Kúpna zmluva","Vojenské poznávacie značky - zelené","34992200-9 Dopravné značky;60000000-8 Dopravné služby (bez prepravy odpadu)","Tovar;Služba","","Slovenská republika","Trenčiansky","Trenčín","Trenčín","Železničná 3","11.7.2022 14:00:00","15.8.2022 14:00:00","","ks","1,0000","2663,250","20,000","3195,900","0,000","6.7.2022 10:38:00","",
"Z20226885","Z20226885_Z","Mestská časť Košice-Nad Jazerom ","00691038","Slovenská republika","Košice-Nad jazerom","04012","Poludníková 7","VITAMED.SK s.r.o.","45487090","Slovenská republika","Pezinok","90201","1. Mája 45","Kúpna zmluva","Solárna stanica a externé defibrilátory","09332000-5 Solárne zariadenia;33182100-0 Defribrilátory;60000000-8 Dopravné služby (bez prepravy odpadu)","Tovar;Služba","","Slovenská republika","Košický","Košice IV","Košice - mestská časť Nad jazerom","Poludniková 7","7.7.2022 8:00:00","26.8.2022 12:00:00","","celok","1,0000","16666,600","20,000","19999,920","0,000","6.7.2022 9:37:59","",
"Z20226998","Z20226998_Z","Mesto Hlohovec","00312509","Slovenská republika","Hlohovec","92001","M.R.Štefánika 1","ITSK, s.r.o.","36556050","Slovenská republika","Nitra","94905","Zelená 29","Kúpna zmluva","Notebook s možnosťou dokovania HP ProBook 450 G8 2R9D7EA#BCM alebo ekvivalent ","30200000-1 Počítačové zariadenia a spotrebný materiál;30210000-4 Stroje na spracovanie údajov (hardvér);30213000-5 Osobné počítače;30213100-6 Prenosné počítače;60000000-8 Dopravné služby (bez prepravy odpadu)","Tovar;Služba","","Slovenská republika","Trnavský","Hlohovec","Hlohovec","M. R. Štefánika 1","","","14.7.2022 15:00:00","ks","3,0000","2916,660","20,000","3499,990","0,000","6.7.2022 10:38:00","",
"Z20226996","Z20226996_Z","Mesto Hlohovec","00312509","Slovenská republika","Hlohovec","92001","M.R.Štefánika 1","ITSK, s.r.o.","36556050","Slovenská republika","Nitra","94905","Zelená 29","Kúpna zmluva","Monitory","30200000-1 Počítačové zariadenia a spotrebný materiál;30230000-0 Zariadenia súvisiace s počítačmi;30231000-7 Počítačové monitory a konzoly;30231300-0 Zobrazovacie jednotky (obrazovky);30231310-3 Ploché displeje;60000000-8 Dopravné služby (bez prepravy odpadu)","Tovar;Služba","","Slovenská republika","Trnavský","Hlohovec","Hlohovec","M. R. Štefánika 1","","","14.7.2022 14:00:00","ks","2,0000","493,330","20,000","592,000","8,000","6.7.2022 10:38:01","",
"Z20227211","Z20227211_Z","Ministerstvo obrany Slovenskej republiky","30845572","Slovenská republika","Bratislava","83247","Kutuzovova 8","CLEAN TONERY, s.r.o.","35891866","Slovenská republika","Pezinok","90201","Za Hradbami 27","Kúpna zmluva","Originálne tonery do tlačiarní","30125110-5 Toner do laserových tlačiarní/faxových prístrojov;60000000-8 Dopravné služby (bez prepravy odpadu)","Tovar;Služba","","Slovenská republika","Bratislavský","Bratislava III","Bratislava - mestská časť Nové Mesto","Za kasárňou 3, Bratislava, Agentúra správy majetku, MO SR","7.7.2022 8:00:00","8.7.2022 13:00:00","","jeden celok","1,0000","1657,500","20,000","1989,000","0,000","4.7.2022 11:38:00","",
"Z20227076","Z20227076_Z","Ministerstvo obrany Slovenskej republiky","30845572","Slovenská republika","Bratislava","83247","Kutuzovova 8","TURON GASTRO s.r.o.","43812481","Slovenská republika","Liptovský Hrádok","03301","Vyšné fabriky 743","Kúpna zmluva","Potreby pre verejné stravovanie na jedno použitie","39222100-5 Potreby pre verejné stravovanie na jedno použitie;60000000-8 Dopravné služby (bez prepravy odpadu)","Tovar;Služba","","Slovenská republika","Nitriansky","Nitra","Nitra - Staré Mesto","Jelenecká (11. brigáda Vzdušných síl Nitra)","8.7.2022 11:00:00","15.7.2022 12:00:00","","počet kusov je uvedený v položkách obj. formulára","1,0000","274,920","20,000","329,900","3,100","6.7.2022 10:38:00","",
"Z20227215","Z20227215_Z","Ľubovnianska nemocnica, n.o.","37886851","Slovenská republika","Stará Ľubovňa","06401","Obrancov mieru 3","i-Step communication, s.r.o.","35754281","Slovenská republika","Bratislava - mestská časť Nové Mesto","83103","Pluhová 10/A","Kúpna zmluva","Respirátor typ FFP2 bez výdychového ventilu","33140000-3 Zdravotnícky spotrebný materiál;60000000-8 Dopravné služby (bez prepravy odpadu)","Tovar;Služba","","Slovenská republika","Prešovský","Stará Ľubovňa","Stará Ľubovňa","Obrancov 3","11.7.2022 9:00:00","14.7.2022 9:00:00","","zákazka","1,0000","1399,000","20,000","1678,800","2200,000","6.7.2022 12:00:01","",
"Z20227216","Z20227216_Z","Ministerstvo obrany Slovenskej republiky","30845572","Slovenská republika","Bratislava","83247","Kutuzovova 8","KRUPA, spol. s r.o.","31591957","Slovenská republika","Košťany nad Turcom","03841","Košťany nad Turcom č. 69","Kúpna zmluva","Knihársky spotrebný materiál","19000000-6 Koža a textílie, plastové a gumené materiály;43830000-0 Mechanické náradie;60000000-8 Dopravné služby (bez prepravy odpadu)","Tovar;Služba","","Slovenská republika","Bratislavský","Bratislava III","Bratislava - mestská časť Nové Mesto","Za kasárňou 3","11.7.2022 8:00:00","12.8.2022 12:00:00","","súbor položiek","1,0000","1101,750","20,000","1322,100","0,000","6.7.2022 8:38:00","",
"Z20227217","Z20227217_Z","Ministerstvo obrany Slovenskej republiky","30845572","Slovenská republika","Bratislava","83247","Kutuzovova 8","KRUPA, spol. s r.o.","31591957","Slovenská republika","Košťany nad Turcom","03841","Košťany nad Turcom č. 69","Kúpna zmluva","Polygrafická chémia","22610000-9 Tlačiarenské farby, atramenty;24000000-4 Chemické výrobky;60000000-8 Dopravné služby (bez prepravy odpadu)","Tovar;Služba","","Slovenská republika","Bratislavský","Bratislava III","Bratislava - mestská časť Nové Mesto","Kutuzovova 8","11.7.2022 8:00:00","12.8.2022 12:00:00","","súbor položiek","1,0000","933,060","20,000","1119,670","0,000","6.7.2022 8:38:00","",
"Z20227105","Z20227105_Z","Ministerstvo obrany Slovenskej republiky","30845572","Slovenská republika","Bratislava","83247","Kutuzovova 8","Ing. Igor Zacher","54038430","Slovenská republika","Poprad","05801","Ústecko-Orlická 25","Zmluva o poskytovaní služieb","Kontrola hasiacich prístrojov","60000000-8 Dopravné služby (bez prepravy odpadu);71356100-9 Technická kontrola","Služba","","Slovenská republika","Žilinský","Martin","Martin","42.zásobovacia základňa  ul. Československej armády 3, 036 01 Martin","24.10.2022 10:04:00","16.11.2022 10:04:00","","kusy","1681,0000","1450,000","0,000","1450,000","","8.7.2022 12:16:00","",
"Z20227113","Z20227113_Z","Ministerstvo obrany Slovenskej republiky","30845572","Slovenská republika","Bratislava","83247","Kutuzovova 8","STOLAMED PLUS, s. r. o.","46892923","Slovenská republika","Bratislava","81103","Michalská 9","Zmluva o poskytovaní služieb","Oprava a tlakové skúšky hasiacich prístrojov","50514000-1 Opravy a údržba kovových nádob;60000000-8 Dopravné služby (bez prepravy odpadu)","Služba","","Slovenská republika","Žilinský","Martin","Martin","42.zásobovacia základňa  ul. Československej armády 3, 036 01 Martin","24.10.2022 10:17:00","16.11.2022 10:18:00","","kusy","81,0000","750,000","20,000","900,000","176,000","8.7.2022 11:50:00","",
"Z20227112","Z20227112_Z","Ministerstvo obrany Slovenskej republiky","30845572","Slovenská republika","Bratislava","83247","Kutuzovova 8","SHIMADZU SLOVAKIA, organizačná zložka","31363237","Slovenská republika","Bratislava","851 01","Röntgenova 28","Kúpna zmluva","Laboratórne diagnostické pomôcky a materiál","38000000-5 Laboratórne, optické a presné prístroje a vybavenie (s výnimkou skiel);60000000-8 Dopravné služby (bez prepravy odpadu)","Tovar;Služba","","Slovenská republika","Trenčiansky","Trenčín","Nemšová","Slovenskej armády 52","11.7.2022 7:00:00","30.9.2022 14:00:00","","ks","2,0000","1236,000","20,000","1483,200","0,000","7.7.2022 12:38:00","",
"Z20227230","Z20227230_Z","Ministerstvo obrany Slovenskej republiky","30845572","Slovenská republika","Bratislava","83247","Kutuzovova 8","Hermes LabSystems, s.r.o.","35693487","Slovenská republika","Bratislava","831 06","Púchovská 12","Kúpna zmluva","pomocný spotrebný laboratórny materiál","33000000-0 Zdravotnícke vybavenie, farmaceutický materiál a výrobky osobnej starostlivosti;33140000-3 Zdravotnícky spotrebný materiál;33790000-4 Laboratórny, zdravotnícky alebo farmaceutický sklenený tovar;33791000-1 Sklenené výrobky;33792000-8 Sklenené výrobky pre farmáciu;33793000-5 Sklenené výrobky pre laboratóriá;60000000-8 Dopravné služby (bez prepravy odpadu)","Tovar;Služba","","Slovenská republika","Bratislavský","Bratislava III","Bratislava - mestská časť Nové Mesto","Kutuzovova 8; Za kasárňou 3","11.7.2022 8:00:00","20.7.2022 12:00:00","","súbor položiek","1,0000","1494,900","20,000","1793,880","0,100","6.7.2022 8:38:01","",
