"IdentifikatorZakazky","IdentifikatorZmluvy","ObjednavatelObchodneMeno","ObjednavatelICO","ObjednavatelStat","ObjednavatelObec","ObjednavatelPSC","ObjednavatelUlica","DodavatelObchodneMeno","DodavatelICO","DodavatelStat","DodavatelObec","DodavatelPSC","DodavatelUlica","ZmluvnyVztah","OpisnyFormularNazov","OpisnyFormularCpv","OpisnyFormularDruh","OpisnyFormularKategoriaSluzieb","MiestoPlneniaStat","MiestoPlneniaKraj","MiestoPlneniaOkres","MiestoPlneniaObec","MiestoPlneniaUlica","LehotaPlneniaOd","LehotaPlneniaDo","LehotaPlneniaPresne","MnozstvoJednotka","MnozstvoHodnota","CenaBezDPH","CenaSadzbaDPH","CenaVrataneDPH","Uspora","DatumZazmluvnenia",
"Z201814323","Z201814323_Z","Správa ciest Žilinského samosprávneho kraja","42054575","Slovenská republika","Žilina","01001","M. Rázusa 104","ITSK, s.r.o.","36556050","Slovenská republika","Nitra","94905","Zelená 29","Kúpna zmluva","Tonery do laserovej tlačiarne","30125110-5 Toner do laserových tlačiarní/faxových prístrojov;60000000-8 Dopravné služby (bez prepravy odpadu)","Tovar;Služba","","Slovenská republika","Žilinský","Žilina","Žilina","M.Rázusa 104","6.4.2018 14:00:00","13.4.2018 14:00:00","","ks","4,0000","335,000","20,000","402,000","25,000","4.4.2018 8:28:00",
"Z201814124","Z201814124_Z","Fakultná nemocnica s poliklinikou Nové Zámky","17336112","Slovenská republika","Nové Zámky","94034","Slovenská 11/A","Ing. Peter Gerši - GC Tech.","36880574","Slovenská republika","Trenčín","91101","Jilemnického 6","Rámcová dohoda","Kancelárske potreby","30192000-1 Kancelárske potreby;60000000-8 Dopravné služby (bez prepravy odpadu)","Tovar;Služba","","Slovenská republika","Nitriansky","Nové Zámky","Nové Zámky","Slovenská ulica 11 A","","","","skupina produktov","1,0000","10514,990","20,000","12617,990","6443,510","5.4.2018 12:24:00",
"Z201814334","Z201814334_Z","Slovenská poľnohospodárska univerzita v Nitre","00397482","Slovenská republika","Nitra","94976","Trieda Andreja Hlinku 2","Letecká agentúra SKYTRAVEL s.r.o.","36667234","Slovenská republika","Košice","04001","Letná 45","Zmluva o poskytovaní služieb","Letenka spiatočná","60000000-8 Dopravné služby (bez prepravy odpadu);60400000-2 Letecké dopravné služby","Služba","","Slovenská republika","Nitriansky","Nitra","Nitra","Tr. Andreja Hlinku 2","23.4.2018 10:00:00","27.4.2018 14:00:00","","ks","9,0000","1897,000","0,000","1897,000","793,000","5.4.2018 10:20:02",
"Z201814336","Z201814336_Z","Obec Mýtna","00316253","Slovenská republika","Mýtna","98553","47","Kravec, s.r.o.","46490485","Slovenská republika","Stožok","96212","Stožok 121","Kúpna zmluva","Nákup techniky pre spracovanie odpadu v obci Mýtna – traktor s príslušenstvom","16700000-2 Traktory/ťahače","Tovar;Služba","","Slovenská republika","Banskobystrický","Lučenec","Mýtna","Mýtna 47","2.7.2018 8:00:00","3.12.2018 8:00:00","","ks","5,0000","161558,330","20,000","193870,000","2,000","5.4.2018 9:38:00",
"Z201814337","Z201814337_Z","Obec Mýtna","00316253","Slovenská republika","Mýtna","98553","47","UNIKOV NITRA, s.r.o. ","46920765","Slovenská republika","Nitra","94901","Lehotská 4","Kúpna zmluva","Nákup techniky pre spracovanie odpadu v obci Mýtna – kontajnery","44619000-2 Iné kontajnery;60000000-8 Dopravné služby (bez prepravy odpadu)","Tovar;Služba","","Slovenská republika","Banskobystrický","Lučenec","Mýtna","Mýtna 47","2.7.2018 8:00:00","3.12.2018 8:00:00","","ks","5,0000","8341,670","20,000","10010,000","89,200","5.4.2018 10:38:00",
"Z201814307","Z201814307_Z","Mesto Púchov","00317748","Slovenská republika","Púchov","02018","Štefánikova 821/21","KULLA SK, s.r.o.","31321003","Slovenská republika","Bratislava","82101","Trnavská cesta 110/B","Kúpna zmluva","Dodávka závesných kvetináčov  ","03121000-5 Záhradnícke produkty;60000000-8 Dopravné služby (bez prepravy odpadu)","Tovar;Služba","","Slovenská republika","Trenčiansky","Púchov","Púchov","územie mesta","17.4.2018 8:00:00","20.4.2018 13:00:00","","ks","30,0000","7500,000","20,000","9000,000","540,000","5.4.2018 13:08:00",
"Z201814341","Z201814341_Z","Štátny ústav pre kontrolu liečiv","00165221","Slovenská republika","Bratislava","82508","Kvetná 11","PC SEMA, s.r.o.","36426041","Slovenská republika","Žilina","01001","Bôrická cesta 103","Kúpna zmluva","Pamäťový modul IBM, sieťová karta ","30234000-8 Pamäťové médiá;32580000-2 Dátové zariadenia;60000000-8 Dopravné služby (bez prepravy odpadu)","Tovar;Služba","","Slovenská republika","Bratislavský","Bratislava II","Bratislava - mestská časť Ružinov","Kvetná 11","16.4.2018 7:00:00","18.4.2018 14:00:00","","ks","4,0000","403,320","20,000","483,990","263,010","5.4.2018 16:30:00",
"Z201814344","Z201814344_Z","Obec Raslavice","00322521","Slovenská republika","Raslavice","08641","Hlavná 154","EURO MEDIA Košice, s.r.o. ","31608426","Slovenská republika","Košice","04001","Rastislavova 104","Kúpna zmluva","Originálne a kompatibilné (alternatívne) tonery do tlačiarní","30125100-2 Tonerové náplne;30125110-5 Toner do laserových tlačiarní/faxových prístrojov;60000000-8 Dopravné služby (bez prepravy odpadu)","Tovar;Služba","","Slovenská republika","Prešovský","Bardejov","Raslavice","Hlavná 154","9.4.2018 16:05:00","12.4.2018 12:00:00","","súbor podľa špecifikácie","1,0000","90,000","20,000","108,000","1,200","5.4.2018 12:38:00",
"Z201814412","Z201814412_Z","Národný ústav srdcových a cievnych chorôb, a.s.","35971126","Slovenská republika","Bratislava","83348","Pod Krásnou hôrkou 1","UNIPHARMA - 1.slovenská lekárnická akciová spoločnosť","31625657","Slovenská republika","Bojnice","97201","Opatovská cesta 4","Rámcová dohoda","ciprofloxacín","33651100-9 Látky ničiace baktérie na systémové použitie;60000000-8 Dopravné služby (bez prepravy odpadu)","Tovar;Služba","","Slovenská republika","Bratislavský","Bratislava III","Bratislava - mestská časť Nové Mesto","Pod Krásnou hôrkou 1","","","","10ml ampulka","5500,0000","5500,000","10,000","6050,000","0,000","5.4.2018 9:08:00",
"Z201814419","Z201814419_Z","Liptovská nemocnica s poliklinikou MUDr. Ivana Stodolu Liptovský Mikuláš","17336163","Slovenská republika","Liptovský Mikuláš","03123","Palúčanská   25","K&M MEDIA s.r.o.","44879806","Slovenská republika","Čierne","02313","Čierne 94","Kúpna zmluva","Parný sterilizátor ","33191100-6 Sterilizátory;33191110-9 Autoklávy;60000000-8 Dopravné služby (bez prepravy odpadu)","Tovar;Služba","","Slovenská republika","Žilinský","Liptovský Mikuláš","Liptovský Mikuláš","Palučanská 25","6.4.2018 8:20:00","7.5.2018 8:20:00","","ks","1,0000","9990,000","20,000","11988,000","10089,000","5.4.2018 8:36:00",
"Z201814407","Z201814407_Z","Stredná odborná škola hotelových služieb a obchodu","00158496","Slovenská republika","Banská Bystrica","97590","Školská 5","WASCO - družstvo","48079707","Slovenská republika","Valaská","97646","Strojárenská 10","Rámcová dohoda","pranie bielizne, čistenie prádla","60000000-8 Dopravné služby (bez prepravy odpadu);98310000-9 Pranie a chemické čistenie","Služba","","Slovenská republika","Banskobystrický","Banská Bystrica","Banská Bystrica","BELVEDER, Ul. K. Jarunkovej 2, B. Bystrica","","","","súbor","1,0000","1613,000","20,000","1935,600","2,400","5.4.2018 8:24:00",
"Z201814421","Z201814421_Z","Liptovská nemocnica s poliklinikou MUDr. Ivana Stodolu Liptovský Mikuláš","17336163","Slovenská republika","Liptovský Mikuláš","03123","Palúčanská   25","FORMED SK, s.r.o.","44737050","Slovenská republika","Kysucké Nové Mesto","02401","Dubská cesta 2727","Kúpna zmluva","Vyšetrovacie kreslo","33193120-6 Kreslá na kolieskach;39113100-8 Kreslá;60000000-8 Dopravné služby (bez prepravy odpadu)","Služba;Tovar","","Slovenská republika","Žilinský","Liptovský Mikuláš","Liptovský Mikuláš","Palučanská 25","9.4.2018 8:30:00","18.5.2018 8:30:00","","ks","2,0000","4140,000","20,000","4968,000","178,000","5.4.2018 8:40:00",
"Z201814408","Z201814408_Z","Stredná odborná škola hotelových služieb a obchodu","00158496","Slovenská republika","Banská Bystrica","97590","Školská 5","GASTRO HYGIENE s.r.o.","36789402","Slovenská republika","Banská Bystrica","97411","Sásovská cesta 15/3201","Rámcová dohoda","Gastro/hygienický tovar","33770000-8 Papierové hygienické výrobky;33771000-5 Hygienické výrobky z papiera;39220000-0 Kuchynské zariadenie, domáce potreby a potreby pre domáce hospodárstvo a dodávky pre stravovacie zariadenia;39221000-7 Kuchynské vybavenie;39315000-3 Zariadenia reštaurácií;39514000-8 Hygienická a kuchynská bielizeň","Tovar;Služba","","Slovenská republika","","","","BELVEDER - Jarunkovej 2, B. Bystrica; SOŠ HSaO - Školská 5, B. Bystrica","","","","súbor","1,0000","4007,490","20,000","4808,990","1942,210","5.4.2018 10:44:00",
"Z201814423","Z201814423_Z","Liptovská nemocnica s poliklinikou MUDr. Ivana Stodolu Liptovský Mikuláš","17336163","Slovenská republika","Liptovský Mikuláš","03123","Palúčanská   25","SURVEYE, s. r. o.","47619651","Slovenská republika","Banská Bystrica","97401","Kapitulská 12","Kúpna zmluva","Oftalmologický operačný stôl, stoličky pre operatéra a pre asistenta. ","33192000-2 Zdravotnícky nábytok;33192230-3 Operačné stoly;39110000-6 Sedadlá, stoličky a podobné výrobky a súvisiace časti;60000000-8 Dopravné služby (bez prepravy odpadu)","Tovar;Služba","","Slovenská republika","Žilinský","Liptovský Mikuláš","Liptovský Mikuláš","Palučanská 25","9.4.2018 8:36:00","18.5.2018 8:36:00","","ks","1,0000","26670,000","20,000","32004,000","745,000","5.4.2018 8:26:00",
"Z201814425","Z201814425_Z","Univerzita Pavla Jozefa Šafárika v Košiciach","00397768","Slovenská republika","Košice","04180","Šrobárova 2","Ing. Soňa Štofová SOPAS","51270692","Slovenská republika","Košice-Sídlisko KVP","04023","Húskova 1289/47","Kúpna zmluva","Flipchart pohyblivý, papierové bloky pre flipchart","22816000-3 Bloky;30195000-2 Tabule;30195300-5 Listové tabule alebo príslušenstvo;30195900-1 Biele tabule a magnetické tabule;60000000-8 Dopravné služby (bez prepravy odpadu)","Tovar;Služba","","Slovenská republika","Košický","Košice","Košice","Šrobárova 2","17.4.2018 8:00:00","30.4.2018 14:00:00","","bal","1,0000","679,200","","679,200","0,000","5.4.2018 9:38:00",
"Z201814246","Z201814246_Z","Krajská prokuratúra Bratislava","00166448","Slovenská republika","Bratislava-Nové Mesto","81256","Vajnorská 47","PhDr. Gabriela Spišáková - Majster Papier","33768897","Slovenská republika","Bratislava 5","85101","Wolkrova 5, P.O.BOX 212","Kúpna zmluva","čistiace a leštiace výrobky","39800000-0 Čistiace a leštiace výrobky;39830000-9 Čistiace výrobky;39831300-9 Čistiace prostriedky na podlahu;39831600-2 Čistiace prostriedky na toalety;39832000-3 Čistiace prostriedky na riad;60000000-8 Dopravné služby (bez prepravy odpadu)","Tovar;Služba","","Slovenská republika","Bratislavský","Bratislava III","Bratislava - mestská časť Nové Mesto","","17.4.2018 8:10:00","17.4.2018 13:10:00","","kusy","889,0000","1045,830","20,000","1255,000","425,000","5.4.2018 11:34:00",
"Z201814430","Z201814430_Z","Detská fakultná nemocnica s poliklinikou Banská Bystrica","37957937","Slovenská republika","Banská Bystrica ","97409","Námestie L.Svobodu 4","VIDRA a spol. s.r.o.","31589561","Slovenská republika","Žilina","01196","Štrková 8","Rámcová dohoda","Jednorázový hygienický zdravotnícky materiál","33141115-9 Zdravotnícke tampóny;33141117-3 Vata;33198000-4 Výrobky z papiera na nemocničné účely;33711410-4 Vatové tyčinky;33751000-9 Jednorazové plienky;33770000-8 Papierové hygienické výrobky;33771100-6 Hygienické vložky alebo tampóny;33772000-2 Jednorazové papierové výrobky;60000000-8 Dopravné služby (bez prepravy odpadu)","Tovar;Služba","","Slovenská republika","Banskobystrický","Banská Bystrica","Banská Bystrica","Námestie L. Svobodu 4","","","","podľa rozpisu položiek","1,0000","","","8500,000","2500,000","5.4.2018 9:54:00",
"Z201814433","Z201814433_Z","Letecká vojenská nemocnica, a.s.","36601578","Slovenská republika","Košice","04086","Murgašova 1","MED - ART, spol. s r.o.","34113924","Slovenská republika","Nitra","94901","Hornočermánska 4","Kúpna zmluva","Atorvastatin Actavis 20 mg alebo ekvivalent účinnej látky s identickým zložením, liekovou formou a silou","33622000-6 Liečivá pre srdcovocievny systém;60000000-8 Dopravné služby (bez prepravy odpadu)","Tovar;Služba","","Slovenská republika","Košický","Košice I","Košice - mestská časť Staré Mesto","Murgašova 1","","","11.4.2018 10:00:00","balenie","20,0000","24,600","10,000","27,060","0,000","5.4.2018 10:08:00",
"Z201814434","Z201814434_Z","Letecká vojenská nemocnica, a.s.","36601578","Slovenská republika","Košice","04086","Murgašova 1","MED - ART, spol. s r.o.","34113924","Slovenská republika","Nitra","94901","Hornočermánska 4","Kúpna zmluva","Coronal 5 alebo ekvivalent účinnej látky s identickým zložením, liekovou formou a silou","33622000-6 Liečivá pre srdcovocievny systém;60000000-8 Dopravné služby (bez prepravy odpadu)","Tovar;Služba","","Slovenská republika","Košický","Košice I","Košice - mestská časť Staré Mesto","Murgašova 1","","","11.4.2018 10:00:00","balenie","15,0000","14,100","10,000","15,510","0,000","5.4.2018 10:24:00",
"Z201814436","Z201814436_Z","Prešovská univerzita v Prešove","17070775","Slovenská republika","Prešov","08001","Ul. 17. novembra 15","DD21 s.r.o.","43818030","Slovenská republika","Prešov","08005","Švábska 107","Kúpna zmluva","Originálne atramentové náplne do tlačiarne HP Photosmart D5460","30125120-8 Toner do fotokopírovacích strojov;60000000-8 Dopravné služby (bez prepravy odpadu)","Tovar;Služba","","Slovenská republika","Prešovský","Prešov","Prešov","ul. 17 novembra č. 1, PU v Prešove-FF, inštitút slovakistiky a mediálnych štúdií","","","20.4.2018 9:00:00","ks","8,0000","116,670","20,000","140,000","10,420","5.4.2018 10:26:00",
"Z201814440","Z201814440_Z","Nemocnica s poliklinikou Považská Bystrica","00610411","Slovenská republika","Považská Bystrica","01726","Nemocničná 986","Jaroslav Vasičko JV tlačiareň","35245590","Slovenská republika","Valkovce","09042","64","Kúpna zmluva","Zdravotnícke tlačivá","22000000-0 Tlačené výrobky a príbuzné produkty;60000000-8 Dopravné služby (bez prepravy odpadu)","Tovar;Služba","","Slovenská republika","Trenčiansky","Považská Bystrica","Považská Bystrica","Nemocničná 986","","","20.4.2018 14:00:00","ks/blok","17400,0000","380,000","20,000","456,000","120,000","5.4.2018 10:42:00",
"Z201814439","Z201814439_Z","Prešovská univerzita v Prešove","17070775","Slovenská republika","Prešov","08001","Ul. 17. novembra 15","DD21 s.r.o.","43818030","Slovenská republika","Prešov","08005","Švábska 107","Kúpna zmluva","Originálna laserová náplň do tlačiarne HP Laser Jet Pro MFP M130nw","30125110-5 Toner do laserových tlačiarní/faxových prístrojov;60000000-8 Dopravné služby (bez prepravy odpadu)","Tovar;Služba","","Slovenská republika","Prešovský","Prešov","Prešov","ul. 17 novembra č. 1, PU v Prešove-FF, inštitút slovakistiky a mediálnych štúdií","","","20.4.2018 9:00:00","ks","2,0000","78,330","20,000","94,000","7,160","5.4.2018 10:24:00",
"Z201814443","Z201814443_Z","Letecká vojenská nemocnica, a.s.","36601578","Slovenská republika","Košice","04086","Murgašova 1","MED - ART, spol. s r.o.","34113924","Slovenská republika","Nitra","94901","Hornočermánska 4","Kúpna zmluva","Carvedilol-Teva 6,25 mg alebo ekvivalent účinnej látky s identickým zložením, liekovou formou a silou","33622000-6 Liečivá pre srdcovocievny systém;60000000-8 Dopravné služby (bez prepravy odpadu)","Tovar;Služba","","Slovenská republika","Košický","Košice I","Košice - mestská časť Staré Mesto","Murgašova 1","","","11.4.2018 10:00:00","balenie","10,0000","8,200","10,000","9,020","0,000","5.4.2018 10:38:00",
"Z201814438","Z201814438_Z","Slovenská poľnohospodárska univerzita v Nitre","00397482","Slovenská republika","Nitra","94976","Trieda Andreja Hlinku 2","ITSK, s.r.o.","36556050","Slovenská republika","Nitra","94905","Zelená 29","Kúpna zmluva","Počítačová zostava kancelárska s monitorom a Monochromatické multifunkčné zriadenie - laser, A4, obojstranná tlač, kopírka, skener","30213000-5 Osobné počítače;30231000-7 Počítačové monitory a konzoly;30232110-8 Laserové tlačiarne","Tovar","","Slovenská republika","Nitriansky","Nitra","Nitra","Trieda Andreja Hlinku 2","","","9.4.2018 15:00:00","ks","3,0000","1070,830","20,000","1285,000","315,000","5.4.2018 8:40:00",
"Z201814446","Z201814446_Z","Letecká vojenská nemocnica, a.s.","36601578","Slovenská republika","Košice","04086","Murgašova 1","MED - ART, spol. s r.o.","34113924","Slovenská republika","Nitra","94901","Hornočermánska 4","Kúpna zmluva","Carvedilol-Teva 25 mg alebo ekvivalent účinnej látky s identickým zložením, liekovou formou a silou","33622000-6 Liečivá pre srdcovocievny systém;60000000-8 Dopravné služby (bez prepravy odpadu)","Tovar;Služba","","Slovenská republika","Košický","Košice I","Košice - mestská časť Staré Mesto","Murgašova 1","","","11.4.2018 10:00:00","balenie","10,0000","21,500","10,000","23,650","0,000","5.4.2018 10:54:00",
"Z201814450","Z201814450_Z","Letecká vojenská nemocnica, a.s.","36601578","Slovenská republika","Košice","04086","Murgašova 1","MED - ART, spol. s r.o.","34113924","Slovenská republika","Nitra","94901","Hornočermánska 4","Kúpna zmluva","Doloproct 1 mg + 40 mg čapíky alebo ekvivalent účinnej látky s identickým zložením, liekovou formou a silou","33622000-6 Liečivá pre srdcovocievny systém;60000000-8 Dopravné služby (bez prepravy odpadu)","Tovar;Služba","","Slovenská republika","Košický","Košice I","Košice - mestská časť Staré Mesto","Murgašova 1","","","11.4.2018 10:00:00","balenie","10,0000","41,000","10,000","45,100","0,000","5.4.2018 11:08:00",
"Z201814451","Z201814451_Z","Detská fakultná nemocnica s poliklinikou Banská Bystrica","37957937","Slovenská republika","Banská Bystrica ","97409","Námestie L.Svobodu 4","DAHLHAUSEN SK, s.r.o. ","36313564","Slovenská republika","Nové Mesto nad Váhom","91501","J. Kréna 361/13","Kúpna zmluva","Uzavretý odsávací systém pre 48 hod. odsávanie CH6, CH8, CH12","33141000-0 Jednorazový nechemický lekársky spotrebný materiál a hematologický spotrebný materiál;60000000-8 Dopravné služby (bez prepravy odpadu)","Tovar;Služba","","Slovenská republika","Banskobystrický","Banská Bystrica","Banská Bystrica","Námestie L. Svobodu 4","","","16.4.2018 10:10:00","podľa rozpisu položiek","1,0000","","","803,420","0,000","5.4.2018 10:48:00",
"Z201814449","Z201814449_Z","Univerzita sv. Cyrila a Metoda v Trnave","36078913","Slovenská republika","Trnava","91701","Nám. J. Herdu 2","OFFICE STAR, s.r.o.","46323546","Slovenská republika","Bratislava","83104","Šancová 63/3568","Kúpna zmluva","Mikrotiky","30200000-1 Počítačové zariadenia a spotrebný materiál;32422000-7 Sieťové komponenty;60000000-8 Dopravné služby (bez prepravy odpadu)","Tovar;Služba","","Slovenská republika","Trnavský","Trnava","Trnava","Nám. J. Herdu 2, 917 01 Trnava","9.4.2018 8:30:00","13.4.2018 14:30:00","","ks. ","11,0000","319,990","20,000","383,990","10,010","5.4.2018 10:56:00",
"Z201814437","Z201814437_Z","Geodetický a kartografický ústav Bratislava","17316219","Slovenská republika","Bratislava","82745","Chlumeckého 4","AUTO VALUŠEK služby, s. r. o.","35776650","Slovenská republika","Holíč","90851","Štúrova 41","Kúpna zmluva","Osobné motorové vozidlo nižšej strednej triedy, prevedenie kombi","34100000-8 Motorové vozidlá;60000000-8 Dopravné služby (bez prepravy odpadu)","Tovar;Služba","","Slovenská republika","Bratislavský","Bratislava II","Bratislava - mestská časť Ružinov","Chlumeckého 4","16.4.2018 10:00:00","7.5.2018 10:00:00","","ks","5,0000","55500,000","20,000","66600,000","6415,000","5.4.2018 9:04:00",
"Z201814454","Z201814454_Z","Detská fakultná nemocnica s poliklinikou Banská Bystrica","37957937","Slovenská republika","Banská Bystrica ","97409","Námestie L.Svobodu 4","TIMED, s.r.o. ","00602175","Slovenská republika","Bratislava","82101","Trnavská cesta 112","Kúpna zmluva","Pacientská, neutrálna elektróda pre otvorenú a miniinvazívnu chirurgiu, na jedno použitie","33100000-1 Zdravotnícke vybavenie;33140000-3 Zdravotnícky spotrebný materiál;60000000-8 Dopravné služby (bez prepravy odpadu)","Tovar;Služba","","Slovenská republika","Banskobystrický","Banská Bystrica","Banská Bystrica","Námestie L. Svobodu 4","","","16.4.2018 10:20:00","podľa rozpisu položiek","1,0000","232,300","20,000","278,760","0,000","5.4.2018 10:58:00",
"Z201814457","Z201814457_Z","Slovenská správa ciest","00003328","Slovenská republika","Bratislava","82619","Miletičova 19","GARBIAR Stavebniny s.r.o.","47400072","Slovenská republika","Tvrdošín","02744","Vojtaššákova 846","Kúpna zmluva","Kávovar","39711310-5 Elektrické kávovary;60000000-8 Dopravné služby (bez prepravy odpadu)","Tovar;Služba","","Slovenská republika","Bratislavský","Bratislava II","Bratislava - mestská časť Ružinov","Miletičova 19","10.4.2018 10:16:00","13.4.2018 10:17:00","","ks","1,0000","235,830","20,000","283,000","17,000","5.4.2018 11:04:00",
"Z201814458","Z201814458_Z","Detská fakultná nemocnica s poliklinikou Banská Bystrica","37957937","Slovenská republika","Banská Bystrica ","97409","Námestie L.Svobodu 4","LASER servis, spol. s.r.o. ","35755989","Slovenská republika","Šenkvice","90081","Lipová 3","Kúpna zmluva","Tonery","30125100-2 Tonerové náplne;30125110-5 Toner do laserových tlačiarní/faxových prístrojov;60000000-8 Dopravné služby (bez prepravy odpadu)","Tovar;Služba","","Slovenská republika","Banskobystrický","Banská Bystrica","Banská Bystrica","Námestie L. Svobodu 4","","","16.4.2018 10:30:00","podľa rozpisu položiek","1,0000","493,330","20,000","592,000","80,960","5.4.2018 12:18:00",
"Z201814461","Z201814461_Z","Nemocnica s poliklinikou Prievidza so sídlom v Bojniciach","17335795","Slovenská republika","Bojnice","97201","Nemocničná 2","NIBIA s.r.o.","45408581","Slovenská republika","Partizánske","95801","Nitrianska 99","Zmluva o poskytovaní služieb","Denné upratovacie, čistiace a dezinfekčné služby, denný dovoz, rozvoz a manipulácia so stravou pre pacientov","55521100-9 Rozvoz stravy;60000000-8 Dopravné služby (bez prepravy odpadu);90900000-6 Čistiace a sanitárne služby;90910000-9 Upratovacie služby;90919100-3 Čistenie kancelárskych zariadení","Služba","","Slovenská republika","Trenčiansky","Prievidza","Bojnice","Nemocničná 2","1.5.2018 0:00:00","31.7.2018 23:55:00","","celok","1,0000","159999,000","20,000","191998,800","48490,000","5.4.2018 10:10:00",
"Z201814453","Z201814453_Z","Univerzita Konštantína Filozofa v Nitre","00157716","Slovenská republika","Nitra","94974","Trieda Andreja Hlinku 1","TRACO Computers s.r.o.","31421652","Slovenská republika","Piešťany","92101","Kukučínova 3","Kúpna zmluva","Notebook","30213100-6 Prenosné počítače","Tovar","","Slovenská republika","Nitriansky","Nitra","Nitra","Nábrežie mládeže 91","23.4.2018 12:00:00","7.5.2018 14:00:00","","ks","1,0000","999,150","20,000","1198,980","150,010","5.4.2018 10:56:00",
"Z201814466","Z201814466_Z","Univerzita Komenského v Bratislave","00397865","Slovenská republika","Bratislava","81499","Šafárikovo nám. 6","ProScience Tech s. r. o.","45868212","Slovenská republika","Bratislava","81105","Dobšinského 20","Kúpna zmluva","Chemikálie a kity na DNA analýzu","33696500-0 Laboratórne činidlá;60000000-8 Dopravné služby (bez prepravy odpadu)","Tovar;Služba","","Slovenská republika","Bratislavský","Bratislava","Bratislava","Martinské centrum pre biomedicínu BioMed, Divízia Onkológia, Malá hora 11161/4C, 4.poschodie, Martin 036 01","9.4.2018 10:00:00","4.5.2018 14:00:00","","Kompletný predmet zákazky","1,0000","1681,100","","","118,000","5.4.2018 10:02:00",
"Z201814467","Z201814467_Z","Základná škola s materskou školou Hugolína Gavloviča","36124681","Slovenská republika","Pruské","01852","Školská 369","PhDr. Gabriela Spišáková - Majster Papier","33768897","Slovenská republika","Bratislava 5","85101","Wolkrova 5, P.O.BOX 212","Kúpna zmluva","Čistiace prostriedky, potreby k upratovaniu, toaletný papier a utierky","33761000-2 Toaletný papier;39800000-0 Čistiace a leštiace výrobky;39830000-9 Čistiace výrobky;39831600-2 Čistiace prostriedky na toalety;60112000-6 Služby verejnej cestnej dopravy","Tovar;Služba","","Slovenská republika","Trenčiansky","Ilava","Pruské","Školská 369","9.4.2018 11:14:00","13.4.2018 11:14:00","","ks","1,0000","348,320","20,000","417,990","82,000","5.4.2018 12:20:00",
"Z201814245","Z201814245_Z","Správa ciest Žilinského samosprávneho kraja","42054575","Slovenská republika","Žilina","01001","M. Rázusa 104","HAKOM, s.r.o., ","36000124","Slovenská republika","Martin","03601","Československej armády 18","Kúpna zmluva","Cestné oceľové zvodidlá s príslušenstvom","34920000-2 Cestné príslušenstvo;34996000-5 Regulačné, bezpečnostné alebo signalizačné zariadenia pre cestnú dopravu;35113300-2 Bezpečnostné zariadenia;60100000-9 Služby cestnej dopravy","Tovar;Služba","","Slovenská republika","Žilinský","Čadca","Makov","334","","","16.4.2018 0:00:00","komplet ","1,0000","6060,790","20,000","7272,950","3239,210","5.4.2018 12:44:00",
