"IdentifikatorZakazky","IdentifikatorZmluvy","ObjednavatelObchodneMeno","ObjednavatelICO","ObjednavatelStat","ObjednavatelObec","ObjednavatelPSC","ObjednavatelUlica","DodavatelObchodneMeno","DodavatelICO","DodavatelStat","DodavatelObec","DodavatelPSC","DodavatelUlica","ZmluvnyVztah","OpisnyFormularNazov","OpisnyFormularCpv","OpisnyFormularDruh","OpisnyFormularKategoriaSluzieb","MiestoPlneniaStat","MiestoPlneniaKraj","MiestoPlneniaOkres","MiestoPlneniaObec","MiestoPlneniaUlica","LehotaPlneniaOd","LehotaPlneniaDo","LehotaPlneniaPresne","MnozstvoJednotka","MnozstvoHodnota","CenaBezDPH","CenaSadzbaDPH","CenaVrataneDPH","Uspora","DatumZazmluvnenia","IdStavVCrz",
"Z201847216","Z201847216_Z","Zariadenie pre seniorov a domov sociálnych služieb Terchová","00623521","Slovenská republika","Terchová","01306","Andreja Hlinku 234/8","Stredoslovenská energetika, a.s.","36403008","Slovenská republika","Žilina","010 47","Pri Rajčianke 8591/4B","Zmluva o poskytovaní služieb","Dodávka elektrickej energie","09310000-5 Elektrická energia;65300000-6 Rozvod elektriny a súvisiace služby","Tovar;Služba","","Slovenská republika","Žilinský","Žilina","Terchová","Andreja Hlinku 234/8","1.1.2019 0:00:00","1.1.2020 0:00:00","","kWh","99600,0000","17826,720","20,000","21392,070","1181,500","6.11.2018 12:14:00","2",
"Z201846739","Z201846739_Z","Ekonomická univerzita v Bratislave","00399957","Slovenská republika","Bratislava - mestská časť Petržalka","85235","Dolnozemská cesta 1","Hauerland spol. s r.o.","35777885","Slovenská republika","Bratislava","81104","Matúšova 56","Kúpna zmluva","Upomienkové predmety s potlačou 5č","39294100-0 Informačné a propagačné výrobky;60000000-8 Dopravné služby (bez prepravy odpadu)","Tovar;Služba","","Slovenská republika","Bratislavský","Bratislava V","Bratislava - mestská časť Petržalka","Dolnozemská cesta č.1","","","7.12.2018 14:53:00","kpl","1,0000","14416,670","20,000","17300,000","5789,200","6.11.2018 12:14:00","2",
"Z201847270","Z201847270_Z","Dopravný podnik mesta Košice, akciová spoločnosť","31701914","Slovenská republika","Košice","04329","Bardejovská 6","BERK, spol. s r.o. Košice","17084342","Slovenská republika","Košice","04001","Južná trieda 66","Kúpna zmluva","Náhradné diely na autobusy Solaris U15","34913000-0 Rôzne náhradné diely;60000000-8 Dopravné služby (bez prepravy odpadu)","Tovar","","Slovenská republika","Košický","Košice","Košice","Hornádska 10","","","12.11.2018 8:00:00","ks","4,0000","445,000","20,000","534,000","255,000","6.11.2018 12:20:00","2",
"Z201847202","Z201847202_Z","Univerzita Mateja Bela v Banskej Bystrici","30232295","Slovenská republika","Banská Bystrica","97401","Národná 12","X logistics, s.r.o.","47899948","Slovenská republika","Nitra","94905","Dvorčianska 815","Kúpna zmluva","Notebook","30200000-1 Počítačové zariadenia a spotrebný materiál;30213100-6 Prenosné počítače;60000000-8 Dopravné služby (bez prepravy odpadu)","Tovar;Služba","","Slovenská republika","Banskobystrický","Banská Bystrica","Banská Bystrica","Tajovského 40, Filozofická fakulta UMB","","","19.11.2018 14:00:00","ks","1,0000","682,500","20,000","819,000","0,600","6.11.2018 12:38:00","2",
"Z201847420","Z201847420_Z","Obec Družstevná pri Hornáde","00324116","Slovenská republika","Družstevná pri Hornáde","04431","Hlavná 38","FÚRA s.r.o. ","36211451","Slovenská republika","Rozhanovce","04442","SNP 77","Zmluva o poskytovaní služieb","zber, preprava a zneškodnenie odpadov","90500000-2 Služby súvisiace s likvidáciou odpadu a odpadom;90510000-5 Likvidácia a spracovanie odpadu;90511000-2 Služby na zber odpadu;90512000-9 Služby na prepravu odpadu","Služba","","Slovenská republika","Košický","Košice - okolie","Družstevná pri Hornáde","Hlavná 38","1.1.2019 0:00:00","1.1.2023 0:00:00","","rok","4,0000","159256,000","20,000","191107,200","4972,800","6.11.2018 12:38:00","2",
"Z201847568","Z201847568_Z","Východoslovenský ústav srdcových a cievnych chorôb","36601284","Slovenská republika","Košice","04011","Ondavská 8","IMMOMEDICAL CZ s.r.o.","28480830","Česká republika","Praha","14221","Novodvorská 994/138","Rámcová dohoda","Stentgraft kombinovaný s cievnou protézou a postrannými vetvami","33184200-5 Vaskulárne protézy;60000000-8 Dopravné služby (bez prepravy odpadu)","Tovar;Služba","","Slovenská republika","Košický","Košice II","Košice - mestská časť Západ","Ondavská 8","","","","ks","7,0000","69363,000","10,000","76299,300","0,000","6.11.2018 12:38:00","2",
"Z201846678","Z201846678_Z","Domov sociálnych služieb v Giraltovciach","00691674","Slovenská republika","Giraltovce","08701","Kukorelliho 17","K&M MEDIA s.r.o.","44879806","Slovenská republika","Čierne","02313","Čierne 94","Kúpna zmluva","Rukavice vyšetřovací latexové nepudrované M evercare","18424000-7 Rukavice;18424300-0 Jednorazové rukavice;33141420-0 Chirurgické rukavice;60000000-8 Dopravné služby (bez prepravy odpadu)","Tovar;Služba","2. Služby pozemnej dopravy, vrátane služieb pancierových automobilov a kuriérskych služieb okrem prepravy poštových zásielok","Slovenská republika","Prešovský","Svidník","Giraltovce","Kukorelliho 17","19.11.2018 12:30:00","23.11.2018 12:30:00","","ks","12000,0000","283,330","20,000","340,000","20,000","6.11.2018 13:08:00","2",
"Z201847196","Z201847196_Z","Prešovská univerzita v Prešove","17070775","Slovenská republika","Prešov","08001","Ul. 17. novembra 15","UniKnihy.sk, s.r.o.","36683132","Slovenská republika","Bratislava-Staré Mesto","81106","Vysoká 12","Kúpna zmluva","Nákup publikácií","22110000-4 Tlačené knihy;22111000-1 Knihy pre školy;22160000-9 Brožované knihy;60000000-8 Dopravné služby (bez prepravy odpadu)","Tovar;Služba","","Slovenská republika","Prešovský","Prešov","Prešov","ul. Partizánska 1, PU v Prešove, FZO","","","11.12.2018 13:00:00","ks","19,0000","328,450","10,000","361,300","0,000","6.11.2018 13:08:00","2",
"Z201847199","Z201847199_Z","Univerzita sv. Cyrila a Metoda v Trnave","36078913","Slovenská republika","Trnava","91701","Nám. J. Herdu 2","FaxCopy Pro s. r. o.","47076178","Slovenská republika","Bratislava","82105","Domkárska 15","Kúpna zmluva","Snímač obrazu","38650000-6 Fotografické zariadenia;38651000-3 Fotografické prístroje;38651600-9 Digitálne fotoaparáty;60000000-8 Dopravné služby (bez prepravy odpadu)","Tovar;Služba","","Slovenská republika","Trnavský","Trnava","Trnava","Nám. J. Herdu 2, 917 01 Trnava","9.11.2018 8:30:00","16.11.2018 14:30:00","","ks. ","2,0000","788,000","20,000","945,600","162,000","6.11.2018 13:20:00","2",
"Z201846684","Z201846684_Z","Slovenské národné múzeum","00164721","Slovenská republika","Bratislava","81006","Vajanského nábrežie 2","Lucia Hucíková - ŠKOLÁĆIK MAJO","47880775","Slovenská republika","Brezovica","02801","Pekárenská 277","Kúpna zmluva","Kancelársky nábytok","39121100-7 Písacie stoly;39122000-3 Skrine a knižnice;39130000-2 Kancelársky nábytok;39132300-9 Závesné kartotéky;60000000-8 Dopravné služby (bez prepravy odpadu)","Tovar;Služba","","Slovenská republika","Prešovský","Levoča","Levoča","Námestie Majstra Pavla č. 40","28.11.2018 9:00:00","28.11.2018 14:00:00","","celok","1,0000","1169,000","20,000","1402,800","0,000","6.11.2018 13:32:00","2",
"Z201847383","Z201847383_Z","Spojená škola, SNP 16, Sabinov s organizačnými zložkami Stredná odborná škola, SNP 16, Sabinov a Obchodná akadémia, SNP 16, Sabinov","42383153","Slovenská republika","Sabinov","08301","SNP 16","CORA GASTRO s.r.o.","44857187","Slovenská republika","Poprad","058 01","Traktorová 1","Kúpna zmluva","Univerzálny kuchynský robot ","39221000-7 Kuchynské vybavenie;60000000-8 Dopravné služby (bez prepravy odpadu)","Tovar;Služba","","Slovenská republika","Prešovský","Sabinov","Sabinov","SNP 16","15.11.2018 12:50:00","23.11.2018 12:50:00","","ks","1,0000","541,670","20,000","650,000","100,000","6.11.2018 13:36:00","2",
"Z201846724","Z201846724_Z","Slovenská poľnohospodárska univerzita v Nitre","00397482","Slovenská republika","Nitra","94976","Trieda Andreja Hlinku 2","LABICOM s.r.o.","25876856","Česká republika","Olomouc","77900","Šlechtitelů 19","Kúpna zmluva","Špičky","19520000-7 Plastové výrobky;60000000-8 Dopravné služby (bez prepravy odpadu)","Tovar;Služba","","Slovenská republika","Nitriansky","Nitra","Nitra","Tr. A. Hlinku 2, 949 76  Nitra","26.11.2018 8:01:00","30.11.2018 13:00:00","","balenie","5,0000","57,500","21,000","69,580","0,000","6.11.2018 13:38:00","2",
"Z201847212","Z201847212_Z","Fakultná nemocnica Trenčín","00610470","Slovenská republika","Trenčín","91171","Legionárska 28","Medirecord SK s.r.o.","50683641","Slovenská republika","Prešov","08005","Jiráskova 52","Kúpna zmluva","Robotický držiak kamery pre endoskopické operácie","33162100-4 Prístroje operačnej sály","Tovar","","Slovenská republika","Trenčiansky","Trenčín","Trenčín","Legionárska 28","12.11.2018 15:00:00","20.12.2018 15:00:00","","zostava","1,0000","24580,000","20,000","29496,000","23,000","6.11.2018 13:38:00","2",
"Z201847293","Z201847293_Z","Prešovská univerzita v Prešove","17070775","Slovenská republika","Prešov","08001","Ul. 17. novembra 15","Martin Gall - MG COMP","41751477","Slovenská republika","Prešov","08001","Šmeralova 23","Kúpna zmluva","Príslušenstvo k IKT-podstavce, podložka","30100000-0 Kancelárske stroje, vybavenie a spotrebný materiál s výnimkou počítačov, tlačiarní a nábytku;30237000-9 Časti a príslušenstvo počítačov a spotrebný materiál k nim;60000000-8 Dopravné služby (bez prepravy odpadu)","Tovar;Služba","","Slovenská republika","Prešovský","Prešov","Prešov","Ul. 17.novembra č.1, PU v Prešove-CVT","","","26.11.2018 13:00:00","ks","6,0000","108,200","20,000","129,840","0,000","6.11.2018 13:38:00","2",
"Z201847161","Z201847161_Z","Mesto Nové Zámky ","00309150","Slovenská republika","Nové Zámky ","94035","Hlavné námestie 10","MIVASOFT, spol. s r.o.","36289906","Slovenská republika","Šaľa","927 01","M.R. Štefánika 67/14","Kúpna zmluva","Vnútorné vybavenie ZŠ -učebné pomôcky","39162200-7 Učebné pomôcky a zariadenia;60000000-8 Dopravné služby (bez prepravy odpadu)","Tovar;Služba","","Slovenská republika","Nitriansky","Nové Zámky","Nové Zámky","Hlavné námestie 10","7.1.2019 8:00:00","8.7.2019 15:00:00","","ks","367,0000","34999,990","20,000","41999,990","4505,820","6.11.2018 13:40:00","2",
"Z201847535","Z201847535_Z","Slovenská poľnohospodárska univerzita v Nitre","00397482","Slovenská republika","Nitra","94976","Trieda Andreja Hlinku 2","MERCI SLOVAKIA, s. r. o.","35765178","Slovenská republika","Bratislava","831 04","Rožňavská 17","Kúpna zmluva","Petriho misky","19520000-7 Plastové výrobky;60000000-8 Dopravné služby (bez prepravy odpadu)","Tovar;Služba","","Slovenská republika","Nitriansky","Nitra","Nitra - Staré Mesto","Tr. A. Hlinku 2","12.11.2018 10:00:00","14.11.2018 14:00:00","","bal","10,0000","287,500","20,000","345,000","450,000","6.11.2018 13:48:00","2",
"Z201847549","Z201847549_Z","Krajská prokuratúra Trenčín","35629045","Slovenská republika","Trenčín","91250","Legionárska 7158/5","Ing. Peter Gerši - GC Tech.","36880574","Slovenská republika","Trenčín","91101","Jilemnického 6","Kúpna zmluva","Kancelárske potreby ","30192000-1 Kancelárske potreby;30197642-8 Papier na fotokopírovanie a xerografický papier;60000000-8 Dopravné služby (bez prepravy odpadu)","Tovar;Služba","","Slovenská republika","Trenčiansky","Trenčín","Trenčín","Legionárska 7158/5","12.11.2018 13:37:00","14.11.2018 13:37:00","","sada","1,0000","3333,330","20,000","4000,000","0,000","6.11.2018 14:14:00","2",
"Z201847552","Z201847552_Z","Regionálny úrad verejného zdravotníctva so sídlom v Prešove","00610992","Slovenská republika","Prešov","08001","Hollého 5","DOXX - Stravné lístky, spol. s r.o.","36391000","Slovenská republika","Žilina","01001","Kálov 356","Kúpna zmluva","Zabezpečenie stravovania zamestnancov prostredníctvom stravných lístkov","30199770-8 Stravné poukážky;60000000-8 Dopravné služby (bez prepravy odpadu)","Tovar;Služba","","Slovenská republika","Prešovský","Prešov","Prešov","Hollého 5","9.11.2018 13:46:00","9.11.2019 13:46:00","","zákazka","1,0000","45798,480","","45798,480","1001,520","6.11.2018 14:24:00","2",
"Z201847248","Z201847248_Z","LESY Slovenskej republiky, štátny podnik","36038351","Slovenská republika","Banská Bystrica","97566","Námestie SNP 8","MIKONA s.r.o.","31570364","Slovenská republika","Púchov","02001","Trenčianska 452","Kúpna zmluva","Zimné pneumatiky na Octaviu a Ford Transit značky Matador alebo Barum.","34351100-3 Pneumatiky pre motorové vozidlá;60000000-8 Dopravné služby (bez prepravy odpadu)","Tovar;Služba","","Slovenská republika","Žilinský","Liptovský Mikuláš","Liptovský Hrádok","Pri železnici 52","8.11.2018 13:48:00","9.11.2018 13:48:00","","kus","8,0000","400,000","20,000","480,000","200,000","6.11.2018 14:34:00","2",
"Z201847278","Z201847278_Z","Slovenské národné divadlo","00164763","Slovenská republika","Bratislava","81901","Pribinova 17","ĽUBICA, s.r.o.","50982516","Slovenská republika","Bratislava","83104","Vajnorská 131/A","Kúpna zmluva","Osobné ochranné pracovné odevy a obuv","18110000-3 Pracovné odevy;18400000-3 Špeciálne odevy a doplnky;18830000-6 Ochranná obuv","Tovar;Služba","","Slovenská republika","Bratislavský","Bratislava II","Bratislava - mestská časť Ružinov","Umelecko-dekoračné dielne SND, Mliekárenská 6, Bratislava","28.11.2018 9:00:00","30.11.2018 14:00:00","","položky","28,0000","8250,000","20,000","9900,000","29,990","6.11.2018 14:38:00","2",
"Z201847296","Z201847296_Z","Prešovská univerzita v Prešove","17070775","Slovenská republika","Prešov","08001","Ul. 17. novembra 15","MEGABOOKS SK, spol. s r.o.","36699594","Slovenská republika","Bratislava","84101","Na vrátkach 3410/1C","Kúpna zmluva","Knihy - nákup odbornej zahraničnej literatúry","22110000-4 Tlačené knihy;22111000-1 Knihy pre školy;22160000-9 Brožované knihy;60000000-8 Dopravné služby (bez prepravy odpadu)","Tovar;Služba","","Slovenská republika","Prešovský","Prešov","Prešov","ul. 17.novembra č.1, PU v Prešove-Filozofická fakulta, Inštitút etiky a bioetiky, Inštitút psychológie","","","3.12.2018 13:00:00","ks","6,0000","104,420","10,000","114,860","0,000","6.11.2018 14:38:00","2",
"Z201847541","Z201847541_Z","Kancelária verejného ochrancu práv","36064041","Slovenská republika","Bratislava","81109","Grösslingová 2461/35","Wolters Kluwer SR s. r. o.","31348262","Slovenská republika","Bratislava","82109","Mlynské nivy 48","Zmluva o poskytovaní služieb","Elektronický systém právnych informácií","48000000-8 Softvérové balíky a informačné systémy;48611000-4 Databázový softvérový balík;48810000-9 Informačné systémy;79140000-7 Právne poradenstvo a informačné služby","Služba;Tovar","","Slovenská republika","Bratislavský","Bratislava I","Bratislava - mestská časť Staré Mesto","Grösslingová 35","15.11.2018 14:00:00","14.1.2021 14:00:00","","celok","1,0000","39600,000","20,000","47520,000","0,000","6.11.2018 14:38:00","2",
"Z201847109","Z201847109_Z","Inšpektorát práce Banská Bystrica","00166375","Slovenská republika","Banská Bystrica","97433","Partizánska cesta 98","Ticket Systems s. r. o.","47903902","Slovenská republika","Bratislava","81101","Zámocká 36","Rámcová dohoda","Zabezpečenie stravovania zamestnancov formou stravných poukážok","30199770-8 Stravné poukážky;60000000-8 Dopravné služby (bez prepravy odpadu)","Tovar;Služba","","Slovenská republika","Banskobystrický","Banská Bystrica","Banská Bystrica","Partizánska cesta 98","","","","ks","6500,0000","25040,000","","25040,000","960,000","6.11.2018 14:42:00","2",
"Z201847016","Z201847016_Z","Letisko Poprad - Tatry, a.s.","35912651","Slovenská republika","Poprad","05898","Na letisko 100","Energie2, a.s.","46113177","Slovenská republika","Bratislava","81108","Lazaretská 3a","Kúpna zmluva","Dodávka elektrickej energie na kalendárny rok 2019","09310000-5 Elektrická energia;65300000-6 Rozvod elektriny a súvisiace služby","Tovar;Služba","","Slovenská republika","Prešovský","Poprad","Poprad","Na letisko 100","1.1.2019 0:00:00","1.1.2020 0:00:00","","MWh","909,1100","125015,280","20,000","150018,340","10360,170","6.11.2018 14:50:00","2",
"Z201846296","Z201846296_Z","Úrad pre dohľad nad zdravotnou starostlivosťou","30796482","Slovenská republika","Bratislava","82924","Žellova 2","ITbubble, spol. s r.o.","45353425","Slovenská republika","Piešťany","92101","Kalinčiakova 6","Kúpna zmluva","Operačný systém pre serverovú infraštruktúru","48000000-8 Softvérové balíky a informačné systémy;60000000-8 Dopravné služby (bez prepravy odpadu)","Tovar;Služba","","Slovenská republika","Bratislavský","Bratislava II","Bratislava - mestská časť Ružinov","Žellova 2 ","9.11.2018 14:00:00","30.11.2018 12:00:00","","ks","2,0000","8533,330","20,000","10240,000","999,100","6.11.2018 15:08:00","2",
"Z201847542","Z201847542_Z","Fakultná nemocnica Trnava","00610381","Slovenská republika","Trnava","91775","A. Žarnova  11","Tibor Varga TSV PAPIER","32627211","Slovenská republika","Lučenec","98401","Vajanského 80","Kúpna zmluva","Kancelárske potreby","22816000-3 Bloky;22830000-7 Zošity;22851000-0 Rýchloviazače;30124510-2 Popisovače;30192000-1 Kancelárske potreby;30197300-9 Otvárače listov, zošívačky a dierovače;30199230-1 Obálky;30199760-5 Etikety;60000000-8 Dopravné služby (bez prepravy odpadu)","Tovar;Služba","","Slovenská republika","Trnavský","Trnava","Trnava","A. Žarnova č. 11","3.12.2018 12:57:00","3.12.2019 12:57:00","","ks, bal.,","111081,0000","8950,000","20,000","10740,000","5667,230","6.11.2018 15:16:00","2",
"Z201845867","Z201845867_Z","Slovenské národné múzeum","00164721","Slovenská republika","Bratislava","81006","Vajanského nábrežie 2","IBO s.r.o.","36340073","Slovenská republika","Trenčín","91105","Bratislavská 50","Kúpna zmluva","stromčeky - jedľa/ Nordmanská jedlička ","03400000-4 Produkty lesníctva a ťažby dreva;60000000-8 Dopravné služby (bez prepravy odpadu)","Tovar;Služba","","Slovenská republika","Bratislavský","Pezinok","Častá","Hrad Červený Kameň 1","15.11.2018 9:52:00","30.11.2018 15:00:00","","ks","9,0000","570,000","20,000","684,000","0,000","6.11.2018 15:38:00","2",
"Z201847145","Z201847145_Z","Fakultná nemocnica s poliklinikou Nové Zámky","17336112","Slovenská republika","Nové Zámky","94034","Slovenská 11/A","KORAKO plus, s. r. o.","43959954","Slovenská republika","Partizánske","95804","Bielická 369","Rámcová dohoda","Nemocničná bielizeň - prádlo operačné, prádlo pacientske","18000000-9 Odevy, obuv, brašnárske výrobky a príslušenstvo;18100000-0 Pracovné odevy, špeciálne pracovné odevy a doplnky;18318000-1 Nočná bielizeň;18318200-3 Župany;18318300-4 Pyžamy;19212000-5 Bavlnené tkaniny;39518000-6 Nemocničná bielizeň;60000000-8 Dopravné služby (bez prepravy odpadu);18332000-5 Košele","Tovar;Služba","","Slovenská republika","Nitriansky","Nové Zámky","Nové Zámky","Slovenská ulica 11 A","","","","skupina produktov","1,0000","8400,000","20,000","10080,000","2761,000","6.11.2018 15:40:00","2",
"Z201846738","Z201846738_Z","Univerzita sv. Cyrila a Metoda v Trnave","36078913","Slovenská republika","Trnava","91701","Nám. J. Herdu 2","24music Martin s.r.o.","47428163","Slovenská republika","Martin","03601","Jána Šimka 4708/9A","Kúpna zmluva","Zvukové zariadenia ","32200000-5 Vysielacie prístroje pre rádiotelefóniu, rádiotelegrafiu, rozhlasové a televízne vysielanie;32300000-6 Televízne a rozhlasové prijímače a prístroje na záznam alebo reprodukciu zvuku alebo obrazu;32330000-5 Prístroje na záznam a reprodukciu zvuku a obrazu;32331300-5 Prístroje na reprodukciu zvuku;32342410-9 Zvukové zariadenie;60000000-8 Dopravné služby (bez prepravy odpadu)","Tovar;Služba","","Slovenská republika","Trnavský","Trnava","Trnava","Nám. J. Herdu 2, 917 01 Trnava","9.11.2018 8:30:00","16.11.2018 14:30:00","","ks. ","3,0000","660,000","20,000","792,000","40,000","6.11.2018 15:50:00","2",
"Z201846080","Z201846080_Z","Obec Stráňavy","00321613","Slovenská republika","Stráňavy","01325","Májová 336","Energie2, a.s.","46113177","Slovenská republika","Bratislava","81108","Lazaretská 3a","Zmluva o poskytovaní služieb","Dodávka elektrickej energie","09000000-3 Ropné výrobky, palivo, elektrina a ostatné zdroje energie;09310000-5 Elektrická energia","Tovar;Služba","","Slovenská republika","Žilinský","Žilina","Stráňavy","","1.1.2019 0:00:00","31.12.2020 0:00:00","","celkom ","1,0000","46352,050","20,000","55622,460","10328,350","6.11.2018 15:52:00","2",
"Z201847157","Z201847157_Z","Mesto Nové Zámky ","00309150","Slovenská republika","Nové Zámky ","94035","Hlavné námestie 10","X logistics, s.r.o.","47899948","Slovenská republika","Nitra","94905","Dvorčianska 815","Kúpna zmluva","Vnútorné vybavenie ZŠ -PC set, dataprojektor, školská keramická tabuľa","39162200-7 Učebné pomôcky a zariadenia;60000000-8 Dopravné služby (bez prepravy odpadu)","Tovar;Služba","","Slovenská republika","Nitriansky","Nové Zámky","Nové Zámky","Hlavné námestie 10","7.1.2019 8:00:00","8.7.2019 15:00:00","","ks","3,0000","1785,830","20,000","2143,000","278,310","6.11.2018 16:18:00","2",
"Z201847154","Z201847154_Z","Mesto Nové Zámky ","00309150","Slovenská republika","Nové Zámky ","94035","Hlavné námestie 10","MONASTER, s.r.o.","47454547","Slovenská republika","Bratislava-Petržalka","85103","Osuského 2476/1A ","Kúpna zmluva","Vnútorné vybavenie ZŠ -nábytok","39162200-7 Učebné pomôcky a zariadenia;60000000-8 Dopravné služby (bez prepravy odpadu)","Tovar;Služba","","Slovenská republika","Nitriansky","Nové Zámky","Nové Zámky","Hlavné námestie 10","7.1.2019 8:00:00","8.7.2019 15:00:00","","ks","35,0000","11950,000","20,000","14340,000","1517,580","6.11.2018 17:37:59","2",
"Z201847771","Z201847771_Z","Plemenárske služby SR, š.p.","36856096","Slovenská republika","Bratislava","85227","Starohájska č.29","PhDr. Gabriela Spišáková - Majster Papier","33768897","Slovenská republika","Bratislava 5","85101","Wolkrova 5, P.O.BOX 212","Kúpna zmluva","Hygienické prostriedky","24000000-4 Chemické výrobky;33000000-0 Zdravotnícke vybavenie, farmaceutický materiál a výrobky osobnej starostlivosti;60000000-8 Dopravné služby (bez prepravy odpadu)","Tovar;Služba","","Slovenská republika","Žilinský","Žilina","Žilina","Rosinská cesta 12","9.11.2018 10:59:00","15.11.2018 10:59:00","","zákazka","1,0000","249,990","20,000","299,990","0,000","7.11.2018 8:24:00","2",
"Z201847769","Z201847769_Z","Plemenárske služby SR, š.p.","36856096","Slovenská republika","Bratislava","85227","Starohájska č.29","PhDr. Gabriela Spišáková - Majster Papier","33768897","Slovenská republika","Bratislava 5","85101","Wolkrova 5, P.O.BOX 212","Kúpna zmluva","Čistiace a hygienické prostriedky","24000000-4 Chemické výrobky;33000000-0 Zdravotnícke vybavenie, farmaceutický materiál a výrobky osobnej starostlivosti;60000000-8 Dopravné služby (bez prepravy odpadu)","Tovar;Služba","","Slovenská republika","Žilinský","Žilina","Žilina","Rosinská cesta 12","9.11.2018 10:26:00","15.11.2018 10:26:00","","zákazka","1,0000","789,980","20,000","947,980","0,020","7.11.2018 8:24:00","2",
"Z201847775","Z201847775_Z","Plemenárske služby SR, š.p.","36856096","Slovenská republika","Bratislava","85227","Starohájska č.29","ECOLAB s.r.o.","31342213","Slovenská republika","Bratislava","81105","Čajakova 18","Kúpna zmluva","Čistiace prostriedky","24000000-4 Chemické výrobky;33000000-0 Zdravotnícke vybavenie, farmaceutický materiál a výrobky osobnej starostlivosti;60000000-8 Dopravné služby (bez prepravy odpadu)","Tovar;Služba","","Slovenská republika","Žilinský","Žilina","Žilina","Rosinská cesta 12","9.11.2018 11:05:00","16.11.2018 11:05:00","","zákazka","1,0000","1450,000","20,000","1740,000","0,000","7.11.2018 8:24:00","2",
"Z201847794","Z201847794_Z","Teresa Benedicta","31313680","Slovenská republika","Michalovce","07101","Námestie Jána Pavla II. 6073/7","KRIDLA s.r.o","36466778","Slovenská republika","Humenne","06601","Mierova 94","Kúpna zmluva","Čistiace, dezinfekčné a hygienické prostriedky","24455000-8 Dezinfekčné prostriedky;33711900-6 Mydlo;33761000-2 Toaletný papier;33763000-6 Papierové uteráky na ruky;39800000-0 Čistiace a leštiace výrobky;39831000-6 Pracie prostriedky;39831210-1 Saponáty na umývanie riadu;39832000-3 Čistiace prostriedky na riad;60000000-8 Dopravné služby (bez prepravy odpadu)","Tovar;Služba","","Slovenská republika","Košický","Michalovce","Michalovce","A. Hrehovčíka 1","9.11.2018 13:10:00","19.11.2018 13:11:00","","bal","1,0000","399,170","20,000","479,000","16,000","7.11.2018 8:24:00","2",
